masechet,commentary,perek,halakha,page,comment,dh,base text ref,base text
Sheviit,פני משה,8,4,23a,"@11ופת לאו כתבשילי עכו""ם הוה. @33כל זה הוא מדברי ר' מנא והלא פת היה נראה שהוא כתבשילי עכו""ם וכי כך אנו אומרים ג""כ בתבשילי עכו""ם שבדין היה שבמקום שאין תבשילי ישראל מצוים שיהו מותרין אלא שעמעמו לאסור בתמיה והלא מדינא אסורין:","ופת לאו כתבשילי עכו""ם הוה",JTmock Sheviit 8:4:3,"פיתן רבי יעקב בר אחא בשם רבי יונתן מהילכות של עימעום אמר רבי יוסי קשייתה קומי רבי יעקב בר אחא מהו מהלכות של עימעום אני אומר במקום שאין פת ישראל מצויה בדין היה שתהא פת עכו""ם מותרת ועימעמו עליה ואסרוה אמר רבי מנא ויש עמעום לאיסור ופת לא כתבשילי עכו""ם היא כך אנו אומרים במקום שאין תבשילי ישראל מצויין שם בדין הוא שיהא תבשילי עכו""ם מותרין ועמעמו עליה ואסרום אלא כן היה במקום שאין פת ישראל מצויין בדין שתהא פת עכו""ם אסורה אלא שעמעמו עליה והתירוהו מפני חיי נפש רבנן דקיסרי בשם רבי יעקב בר אחא כדברי מי שהוא מתיר ובלבד מן הפלטר ולא עבדין כן"
Sheviit,פני משה,8,4,23a,"@11אלא כן היה @33אלא ע""כ כך הוא במקום וכו'. כלומר אפי' שאין פת ישראל מצויה היה בדין שתהא אסורה כתבשיל שלהם ועמעמו עליה והתירוה מפני חיי נפש:","אלא כן היה אלא ע""כ כך הוא",JTmock Sheviit 8:4:3,"פיתן רבי יעקב בר אחא בשם רבי יונתן מהילכות של עימעום אמר רבי יוסי קשייתה קומי רבי יעקב בר אחא מהו מהלכות של עימעום אני אומר במקום שאין פת ישראל מצויה בדין היה שתהא פת עכו""ם מותרת ועימעמו עליה ואסרוה אמר רבי מנא ויש עמעום לאיסור ופת לא כתבשילי עכו""ם היא כך אנו אומרים במקום שאין תבשילי ישראל מצויין שם בדין הוא שיהא תבשילי עכו""ם מותרין ועמעמו עליה ואסרום אלא כן היה במקום שאין פת ישראל מצויין בדין שתהא פת עכו""ם אסורה אלא שעמעמו עליה והתירוהו מפני חיי נפש רבנן דקיסרי בשם רבי יעקב בר אחא כדברי מי שהוא מתיר ובלבד מן הפלטר ולא עבדין כן"
Sheviit,פני משה,8,4,23a,"@11כדברי. @33כלומר אפילו לדברי מי שהוא מתיר ובלבד מן הפלטר ולא מבעה""ב:",כדברי,JTmock Sheviit 8:4:3,"פיתן רבי יעקב בר אחא בשם רבי יונתן מהילכות של עימעום אמר רבי יוסי קשייתה קומי רבי יעקב בר אחא מהו מהלכות של עימעום אני אומר במקום שאין פת ישראל מצויה בדין היה שתהא פת עכו""ם מותרת ועימעמו עליה ואסרוה אמר רבי מנא ויש עמעום לאיסור ופת לא כתבשילי עכו""ם היא כך אנו אומרים במקום שאין תבשילי ישראל מצויין שם בדין הוא שיהא תבשילי עכו""ם מותרין ועמעמו עליה ואסרום אלא כן היה במקום שאין פת ישראל מצויין בדין שתהא פת עכו""ם אסורה אלא שעמעמו עליה והתירוהו מפני חיי נפש רבנן דקיסרי בשם רבי יעקב בר אחא כדברי מי שהוא מתיר ובלבד מן הפלטר ולא עבדין כן"
Sheviit,פני משה,8,4,23a,@11ולא עבדין כן. @33לא נהגו כך אלא בוהגין היתר אף בפת בעל הבית:,ולא עבדין כן,JTmock Sheviit 8:4:3,"פיתן רבי יעקב בר אחא בשם רבי יונתן מהילכות של עימעום אמר רבי יוסי קשייתה קומי רבי יעקב בר אחא מהו מהלכות של עימעום אני אומר במקום שאין פת ישראל מצויה בדין היה שתהא פת עכו""ם מותרת ועימעמו עליה ואסרוה אמר רבי מנא ויש עמעום לאיסור ופת לא כתבשילי עכו""ם היא כך אנו אומרים במקום שאין תבשילי ישראל מצויין שם בדין הוא שיהא תבשילי עכו""ם מותרין ועמעמו עליה ואסרום אלא כן היה במקום שאין פת ישראל מצויין בדין שתהא פת עכו""ם אסורה אלא שעמעמו עליה והתירוהו מפני חיי נפש רבנן דקיסרי בשם רבי יעקב בר אחא כדברי מי שהוא מתיר ובלבד מן הפלטר ולא עבדין כן"
Sheviit,פני משה,8,4,23a,"@11רשב""ל אמר במראה לו את הקלח. @33מתני' דקתני לקוט לי ירק היום שכרו מותר מיירי במראה לפועל את הקלח של הירק וא""ל כן והלכך ברישא מותר שאינו אלא כנותן שכר רגלו שיביא לו הקלח הזה ואם אמר לקוט לי בו א""כ על האיסר קאמר בזה האיסר תלקט לי והוי כמכר:","רשב""ל אמר במראה לו את הקלח",JTmock Sheviit 8:4:4,"ר""ש בן לקיש אומר במראה לו את הלוקט שאינו אלא כנותן לו שכר רגלו רבי יוחנן אמר אפילו לא הראה לו כמי שהראה לו מתני' פליגא על ריש לקיש דתניא השוכר את הפועל להביא לו יין לחולה או תפוח לחולה אם הביא חייב ליתן לו אם לאו אינו חייב ליתן לו אבל אם אמר לו יין לחולה ממקום פלוני תפוח לחולה ממקום פלוני בין שהביא בין שלא הביא חייב ליתן לו שכר רגליו הוא נותן לו מה עביד לה ר""ש בן לקיש פתר לה במראה לו מתני' פליגא על רבי יוחנן דתני לא יאמר אדם לפלוני הא לך דינר זה והבא לי לקט היום הבא לי פאה היום אלא אומר לו בלקט שתביא לי היום בפיאה שתביא לי היום וכן אתה מוצא בבן לוי והרי לא הראה לו ואת אמרת כמי שהראה לו מה עבד לה רבי יוחנן קל הקילו בשביעית שהיא מדרבנן"
Sheviit,פני משה,8,4,23a,@11ר' יוחנן אמר @33דאין חילוק ואפי' לא הראה לו נעשה כמי שהראה לו ומותר ברישא דשכר רגלו נותן לו:,ר' יוחנן אמר דאין חילוק ואפי' לא,JTmock Sheviit 8:4:4,"ר""ש בן לקיש אומר במראה לו את הלוקט שאינו אלא כנותן לו שכר רגלו רבי יוחנן אמר אפילו לא הראה לו כמי שהראה לו מתני' פליגא על ריש לקיש דתניא השוכר את הפועל להביא לו יין לחולה או תפוח לחולה אם הביא חייב ליתן לו אם לאו אינו חייב ליתן לו אבל אם אמר לו יין לחולה ממקום פלוני תפוח לחולה ממקום פלוני בין שהביא בין שלא הביא חייב ליתן לו שכר רגליו הוא נותן לו מה עביד לה ר""ש בן לקיש פתר לה במראה לו מתני' פליגא על רבי יוחנן דתני לא יאמר אדם לפלוני הא לך דינר זה והבא לי לקט היום הבא לי פאה היום אלא אומר לו בלקט שתביא לי היום בפיאה שתביא לי היום וכן אתה מוצא בבן לוי והרי לא הראה לו ואת אמרת כמי שהראה לו מה עבד לה רבי יוחנן קל הקילו בשביעית שהיא מדרבנן"
Sheviit,פני משה,8,4,23a,"@11מתניתא. @33האי ברייתא פליגא על ר""ל דקתני כשאומר לו הביא לי ממקום פלוני אע""פ שלא הביא חייב ליתן לו שכרו מפני ששכר רגלו הוא נותן לו והשליח שליחותו קעביד קתני מיהת דשייכא שכר רגלו ואפי' בשלא הראה לו וקשיא לר""ל:",מתניתא,JTmock Sheviit 8:4:4,"ר""ש בן לקיש אומר במראה לו את הלוקט שאינו אלא כנותן לו שכר רגלו רבי יוחנן אמר אפילו לא הראה לו כמי שהראה לו מתני' פליגא על ריש לקיש דתניא השוכר את הפועל להביא לו יין לחולה או תפוח לחולה אם הביא חייב ליתן לו אם לאו אינו חייב ליתן לו אבל אם אמר לו יין לחולה ממקום פלוני תפוח לחולה ממקום פלוני בין שהביא בין שלא הביא חייב ליתן לו שכר רגליו הוא נותן לו מה עביד לה ר""ש בן לקיש פתר לה במראה לו מתני' פליגא על רבי יוחנן דתני לא יאמר אדם לפלוני הא לך דינר זה והבא לי לקט היום הבא לי פאה היום אלא אומר לו בלקט שתביא לי היום בפיאה שתביא לי היום וכן אתה מוצא בבן לוי והרי לא הראה לו ואת אמרת כמי שהראה לו מה עבד לה רבי יוחנן קל הקילו בשביעית שהיא מדרבנן"
Sheviit,פני משה,8,4,23a,@11פתר לה במראה לו. @33אותו מקום פלוני כגון שהיה סמוך ונראה:,פתר לה במראה לו,JTmock Sheviit 8:4:4,"ר""ש בן לקיש אומר במראה לו את הלוקט שאינו אלא כנותן לו שכר רגלו רבי יוחנן אמר אפילו לא הראה לו כמי שהראה לו מתני' פליגא על ריש לקיש דתניא השוכר את הפועל להביא לו יין לחולה או תפוח לחולה אם הביא חייב ליתן לו אם לאו אינו חייב ליתן לו אבל אם אמר לו יין לחולה ממקום פלוני תפוח לחולה ממקום פלוני בין שהביא בין שלא הביא חייב ליתן לו שכר רגליו הוא נותן לו מה עביד לה ר""ש בן לקיש פתר לה במראה לו מתני' פליגא על רבי יוחנן דתני לא יאמר אדם לפלוני הא לך דינר זה והבא לי לקט היום הבא לי פאה היום אלא אומר לו בלקט שתביא לי היום בפיאה שתביא לי היום וכן אתה מוצא בבן לוי והרי לא הראה לו ואת אמרת כמי שהראה לו מה עבד לה רבי יוחנן קל הקילו בשביעית שהיא מדרבנן"
Sheviit,פני משה,8,4,23a,"@11מתני' פליגא על ר' יוחנן דתני. @33בתוספתא דמכלתין (פ""ו):",מתני' פליגא על ר' יוחנן דתני,JTmock Sheviit 8:4:4,"ר""ש בן לקיש אומר במראה לו את הלוקט שאינו אלא כנותן לו שכר רגלו רבי יוחנן אמר אפילו לא הראה לו כמי שהראה לו מתני' פליגא על ריש לקיש דתניא השוכר את הפועל להביא לו יין לחולה או תפוח לחולה אם הביא חייב ליתן לו אם לאו אינו חייב ליתן לו אבל אם אמר לו יין לחולה ממקום פלוני תפוח לחולה ממקום פלוני בין שהביא בין שלא הביא חייב ליתן לו שכר רגליו הוא נותן לו מה עביד לה ר""ש בן לקיש פתר לה במראה לו מתני' פליגא על רבי יוחנן דתני לא יאמר אדם לפלוני הא לך דינר זה והבא לי לקט היום הבא לי פאה היום אלא אומר לו בלקט שתביא לי היום בפיאה שתביא לי היום וכן אתה מוצא בבן לוי והרי לא הראה לו ואת אמרת כמי שהראה לו מה עבד לה רבי יוחנן קל הקילו בשביעית שהיא מדרבנן"
Sheviit,פני משה,8,4,23a,"@11לא יאמר אדם לעני הילך סלע זו והבא לי לקט היום וכו' @33דכיון שהקדים לו הסלע או הדינר וא""ל הבא לי בזה מתנות עניים שלך הוי כמי שלוקט בשביל הבעה""ב הזה ואסור שמפקיע מן המעשרות ועוד דאין העני זוכה בהן עד שיגיעו לידו ואינו יכול למוכרן לזה מקודם אבל אומר לו בלקט שתביא לי היום דבזה לא הוי כמוכר לו מקודם אלא אחר שיזכה בו העני והרי הוא שלו יביא לו בעד הסלע והדינר שקיבל:",לא יאמר אדם לעני הילך סלע זו,JTmock Sheviit 8:4:4,"ר""ש בן לקיש אומר במראה לו את הלוקט שאינו אלא כנותן לו שכר רגלו רבי יוחנן אמר אפילו לא הראה לו כמי שהראה לו מתני' פליגא על ריש לקיש דתניא השוכר את הפועל להביא לו יין לחולה או תפוח לחולה אם הביא חייב ליתן לו אם לאו אינו חייב ליתן לו אבל אם אמר לו יין לחולה ממקום פלוני תפוח לחולה ממקום פלוני בין שהביא בין שלא הביא חייב ליתן לו שכר רגליו הוא נותן לו מה עביד לה ר""ש בן לקיש פתר לה במראה לו מתני' פליגא על רבי יוחנן דתני לא יאמר אדם לפלוני הא לך דינר זה והבא לי לקט היום הבא לי פאה היום אלא אומר לו בלקט שתביא לי היום בפיאה שתביא לי היום וכן אתה מוצא בבן לוי והרי לא הראה לו ואת אמרת כמי שהראה לו מה עבד לה רבי יוחנן קל הקילו בשביעית שהיא מדרבנן"
Sheviit,פני משה,8,4,23a,"@11וכן אתה מוצא בבן לוי. @33שאמר לו אחד כן בשביל המעשר שלו קתני מיהת בסיפא דכשאמר לו הילך דינר זה בלקט שתביא לי דלא הוי כמכר. והרי לא הראה לו כלומר דטעמא הוי משום דלא הראה לו המקום ללקוט ואת אמר כמו שהראה לו. כלומר ולדידך דאת אמר אפי' לא הראה לו נעשה כמו שהראה לו ואם כן התם גם בסיפא יהא אסור וקשיא לר' יוחנן דהא מיהת שמעינן מהכא דלא אמרינן נעשה כמי שהראה לו והשתא במתני' אמאי שכרו מותר בשלא הראה לו ומה עביד לה ר""י ומשני קל שהקילו בשביעית שהיא מדרבנן והלכך אמרינן בה נעשה כמי שהראה לו לקולא ואע""ג דלא אמרינן הכי בעלמא:",וכן אתה מוצא בבן לוי,JTmock Sheviit 8:4:4,"ר""ש בן לקיש אומר במראה לו את הלוקט שאינו אלא כנותן לו שכר רגלו רבי יוחנן אמר אפילו לא הראה לו כמי שהראה לו מתני' פליגא על ריש לקיש דתניא השוכר את הפועל להביא לו יין לחולה או תפוח לחולה אם הביא חייב ליתן לו אם לאו אינו חייב ליתן לו אבל אם אמר לו יין לחולה ממקום פלוני תפוח לחולה ממקום פלוני בין שהביא בין שלא הביא חייב ליתן לו שכר רגליו הוא נותן לו מה עביד לה ר""ש בן לקיש פתר לה במראה לו מתני' פליגא על רבי יוחנן דתני לא יאמר אדם לפלוני הא לך דינר זה והבא לי לקט היום הבא לי פאה היום אלא אומר לו בלקט שתביא לי היום בפיאה שתביא לי היום וכן אתה מוצא בבן לוי והרי לא הראה לו ואת אמרת כמי שהראה לו מה עבד לה רבי יוחנן קל הקילו בשביעית שהיא מדרבנן"
Sheviit,פני משה,8,4,23a,"@11תני. @33בתוספתא שם ר' יהודה ור' נחמיה אוסרין בלקח מן הנחתום ככר אע""פ שא""ל כשאלקוט ירקות שדה אביא לך ומפרש לה מה אנן קיימין לפלוגתייהו ובמאי הוא דפליגי:",תני,JTmock Sheviit 8:4:5,לקח מן הנחתום כבר בפונדיון כשאלקוט ירקות השדה אביא לך מותר תני רבי יודא ורבי נחמיה אוסרים מה אנן קיימין בההוא דאמר הב לי וברי לי אנא יהב לך ר' יהודא ור' נחמיה אוסרין שאין ירקות שדה מצויין וחכמים מתירין מפני שירקות שדה מצויין:
Sheviit,פני משה,8,4,23a,"@11בההוא דאמר הב לי. @33הככר הזה וברי לי דאנא יהיב לך מירקות השדה שאלקט ור' יודה ור""נ דאוסרין טעמייהו שאין ירקות שדה מצויין והלכך אף שזה אמר לו ברי לי שאני אביא לך לא סמך הנחתום על דבריו שאינן מצויין בשביעית ושמא לא ימצא ללקוט לפי שהכל רצין לזכות מן ההפקר ומה שנתן לו הככר כחוב בעלמא נתן לו ומש""ה אסור אם מביא לו אח""כ דהוי כפורע חובו משביעית וחכמים מתירין דס""ל ירקות שדה מצויין הן וסמך הנחתום על זה ולא נתן לו הככר שיהא כחיב עליו אלא זה מקבל הככר וזה יקבל הירקות שדה שבודאי ימצא ללקטן ולהביא לו:",בההוא דאמר הב לי,JTmock Sheviit 8:4:5,לקח מן הנחתום כבר בפונדיון כשאלקוט ירקות השדה אביא לך מותר תני רבי יודא ורבי נחמיה אוסרים מה אנן קיימין בההוא דאמר הב לי וברי לי אנא יהב לך ר' יהודא ור' נחמיה אוסרין שאין ירקות שדה מצויין וחכמים מתירין מפני שירקות שדה מצויין:
Sheviit,פני משה,8,5,23a,@22מתני' @11אין נותנין. @33דמי שביעית לא לבייר והוא החופר בורות לא יתן לו שיספיק לו מים לכל תשמישו אלא דוקא אם הוא נותן לו שיספיק לו מים כדי לשתות כדקתני סיפא אבל הוא נותן לבייר לשתות:,אין נותנין,JTmock Sheviit 8:5:1,אין נותנין לא לבייר ולא לבלן ולא לספר ולא לספן אבל נותן הוא לבייר לשתות ולכולן הוא נותן מתנה חנם:
Sheviit,פני משה,8,5,23a,@11ולא לבלן @33המחמם מרחצאות:,ולא לבלן המחמם מרחצאות,JTmock Sheviit 8:5:1,אין נותנין לא לבייר ולא לבלן ולא לספר ולא לספן אבל נותן הוא לבייר לשתות ולכולן הוא נותן מתנה חנם:
Sheviit,פני משה,8,5,23a,@11ולא לספר. @33שכר התספורת:,ולא לספר,JTmock Sheviit 8:5:1,אין נותנין לא לבייר ולא לבלן ולא לספר ולא לספן אבל נותן הוא לבייר לשתות ולכולן הוא נותן מתנה חנם:
Sheviit,פני משה,8,5,23a,@11ולא לספן. @33שכר הספינה:,ולא לספן,JTmock Sheviit 8:5:1,אין נותנין לא לבייר ולא לבלן ולא לספר ולא לספן אבל נותן הוא לבייר לשתות ולכולן הוא נותן מתנה חנם:
Sheviit,פני משה,8,5,23a,"@11ולכולן לכל האומנין הוא נותן. @33דמי שביעית או פירות שביעית מתנת חנם ולא בשביל שכרן ואע""פ שממילא לא יתבעו ממנו שכר כשנותן להם מתנה שרי:",ולכולן לכל האומנין הוא נותן,,
Sheviit,פני משה,8,5,23a,@22גמ' @11תני. @33בחדא ברייתא דר' יוסי אומר אף אין נותנין דמי שביעית לא למבייר וכהאי דשנינו במתני':,תני,JTmock Sheviit 8:5:2,תני ר' יוסי אף לא למבייר מחלפא שיטתיה דרבי יוסי תמן הוא אמר אין לוקחין הימנו מים ומלח והכא הוא אמר הכין
Sheviit,פני משה,8,5,23a,"@11ופריך מיחלפא שיטתיה דר' יוסי דתמן הוא אומר. @33בתוספתא (פ""ו) דגריס התם פירות שביעית אין לוקחין בהן מים ומלת ר' יוסי אומר לוקחין בהן מים ומלח והיינו דרמי דר' יוסי דהך ברייתא אדר' יוסי דהתוספתא והש""ס לא הביא כאן אלא דברי הת""ק דהתוספתא וכמו וכו' הוא והכא אמר הכן א""ר יוסי אף לא למבייר:",ופריך מיחלפא שיטתיה דר' יוסי דתמן הוא,JTmock Sheviit 8:5:2,תני ר' יוסי אף לא למבייר מחלפא שיטתיה דרבי יוסי תמן הוא אמר אין לוקחין הימנו מים ומלח והכא הוא אמר הכין
Sheviit,פני משה,8,5,23a,"@11מה פליגין. @33כלומר דהש""ס בעי לאסוקי דהאי רומיא דר' יוסי אדר' יוסי אי אפשר לשנויי בענין אחר אלא דנימא תרי תנאי ואליבא דר' יוסי ומפרש לה דבמה פליגי הני תנאי אליבא דר' יוסי:",מה פליגין,JTmock Sheviit 8:5:3,אמר ר' יוסי מה פליגי בשתשמשו אבל בשתייה אף ר' יוסי מודה הוי מאן תנא אבל נותן לבייר לשתות ר' יוסי אמר רבי יוסי דברי הכל היא כאן לאדם כאן לבהמה
Sheviit,פני משה,8,5,23a,"@11בשתשמשו. @33כלומר ר' יוסי דתוספתא מתיר אף במים של שאר תשמישיו אבל בשתיה אף ר' יוסי דהך ברייתא מודה דלוקחין בהן ות""ק דהתוספתא אוסר אפי' לשתות:",בשתשמשו,JTmock Sheviit 8:5:3,אמר ר' יוסי מה פליגי בשתשמשו אבל בשתייה אף ר' יוסי מודה הוי מאן תנא אבל נותן לבייר לשתות ר' יוסי אמר רבי יוסי דברי הכל היא כאן לאדם כאן לבהמה
Sheviit,פני משה,8,5,23a,@11הוי. @33דשמעינן דמאן תנא במתניתין דקתני אבל הוא נותן לבייר לשתות ר' יוסי דאידך ברייתא היא:,הוי,JTmock Sheviit 8:5:3,אמר ר' יוסי מה פליגי בשתשמשו אבל בשתייה אף ר' יוסי מודה הוי מאן תנא אבל נותן לבייר לשתות ר' יוסי אמר רבי יוסי דברי הכל היא כאן לאדם כאן לבהמה
Sheviit,פני משה,8,5,23a,"@11א""ר יוסי. @33הוא ר' יוסי אמורא דלא היא דדברי הכל הוא דלשתות שרי אליבא דכ""ע ואפי' לת""ק דהתוספתא דלא פליגי אלא בשאר תשמישיו:","א""ר יוסי",JTmock Sheviit 8:5:3,אמר ר' יוסי מה פליגי בשתשמשו אבל בשתייה אף ר' יוסי מודה הוי מאן תנא אבל נותן לבייר לשתות ר' יוסי אמר רבי יוסי דברי הכל היא כאן לאדם כאן לבהמה
Sheviit,פני משה,8,5,23b,"@11כאן לאדם כאן לבהמה. @33כלומר והאי רומיא דר' יוסי אדר' יוסי הכי הוא דמתרצינן דר' יוסי דהתוספתא דע""כ דמתיר אפי' בשאר תשמישיו היינו לצרכי אדם ור' יוסי דאידך ברייתא דאסור אף ליתן למבייר היינו שיספיק מים לצורכי בהמה והשתא מתני' אתיא כת""ק דהתוספתא דלשאר תשמישיו אסור ואפי' הוא לצורך האדם ולשתות שרי דבהא כ""ע מודים:",כאן לאדם כאן לבהמה,JTmock Sheviit 8:5:3,אמר ר' יוסי מה פליגי בשתשמשו אבל בשתייה אף ר' יוסי מודה הוי מאן תנא אבל נותן לבייר לשתות ר' יוסי אמר רבי יוסי דברי הכל היא כאן לאדם כאן לבהמה
Sheviit,פני משה,8,5,23b,"@11תני. @33בתוספתא דב""מ (בפ' יא בסופו) ומייתי להא בפ' יא דנדרים (בהלכה א'):",תני,JTmock Sheviit 8:5:4,תני מעיין של בני העיר הן ואחרים הן קודמים לאחרים אחרים ובהמתן אחרים קודמין לבהמתן כביסתן וחיי אחרים כביסתן קודמת לחיי אחרים אמר רבי יוחנן מאן תנא כביסה חיי נפש רבי יוסי דתני אין נותנין מהם לא למשרה ולא לכביסה ורבי יוסי מתיר בכביסה מחלפא שיטתיה דרבי יוסי תמן הוא אומר אין רחיצה חיי נפש וכא הוא אמר הכביסה חיי נפש אמר רבי מנא אדם מגלגל ברחיצה ואין אדם מגלגל בכביסה
