masechet,commentary,perek,halakha,page,comment,dh,base text ref,base text
Sheviit,פני משה,6,1,16a,"@11י""ב מיל כמחנה ישראל. @33דכתיב ויחנו וגו' וגמירי די""ב מיל הוו וכתיב ומשה יקח את האוהל וגו' והיה כל מבקש ה' יצא אל אוהל מועד אשר מחוץ למחנה ש""מ עד י""ב מיל אסור:","י""ב מיל כמחנה ישראל",JTmock Sheviit 6:1:7,"תני תלמיד שהורה הלכה לפני רבו חייב מיתה תני בשם ר""א לא מתו נדב ואביהו אלא שהורו בפני משה רבן מעשה בתלמיד א' שהורה לפני רבי אליעזר רבו אמר לאימא שלום אשתו אינו יוצא שבתו ולא יצא שבתו עד שמת אמרו לו תלמידיו רבי נביא אתה אמר להן לא נביא אנכי ולא בן נביא אנכי אלא כך אני מקובל שכל תלמיד המורה הלכה בפני רבו חייב מיתה תני אסור לתלמיד להורות הלכה בפני רבו עד שיהי' רחוק ממנו י""ב מיל כמחנה ישראל ומה טעם (במדבר לג) ויחנו על הירדן מבית הישימות עד אבל השיטים וכמה הן י""ב מיל כהדא רבי תנחום בר חייא הוה בחפ' והוון שאלין ליה והוא מורה שאלין ליה והוא מורה אמרין ליה ולא כן אולפן רבי שאסור לתלמיד להורות הלכה לפני רבו עד שיהא רחוק ממנו י""ב מיל כמחנה ישראל והא רבי מנא רבן יתיב בציפורין אמר לון ייתי דלא ידעית מן ההיא שעתה לא הורי"
Sheviit,פני משה,6,1,16a,@11ייתי. @33יבא עלי אם ידעתי שר' מנא יושב בצפורי:,ייתי,JTmock Sheviit 6:1:7,"תני תלמיד שהורה הלכה לפני רבו חייב מיתה תני בשם ר""א לא מתו נדב ואביהו אלא שהורו בפני משה רבן מעשה בתלמיד א' שהורה לפני רבי אליעזר רבו אמר לאימא שלום אשתו אינו יוצא שבתו ולא יצא שבתו עד שמת אמרו לו תלמידיו רבי נביא אתה אמר להן לא נביא אנכי ולא בן נביא אנכי אלא כך אני מקובל שכל תלמיד המורה הלכה בפני רבו חייב מיתה תני אסור לתלמיד להורות הלכה בפני רבו עד שיהי' רחוק ממנו י""ב מיל כמחנה ישראל ומה טעם (במדבר לג) ויחנו על הירדן מבית הישימות עד אבל השיטים וכמה הן י""ב מיל כהדא רבי תנחום בר חייא הוה בחפ' והוון שאלין ליה והוא מורה שאלין ליה והוא מורה אמרין ליה ולא כן אולפן רבי שאסור לתלמיד להורות הלכה לפני רבו עד שיהא רחוק ממנו י""ב מיל כמחנה ישראל והא רבי מנא רבן יתיב בציפורין אמר לון ייתי דלא ידעית מן ההיא שעתה לא הורי"
Sheviit,פני משה,6,1,16a,@11רבי הוה בעכו וכו'. @33וזו היא העובדא אחריתא:,רבי הוה בעכו וכו',JTmock Sheviit 6:1:8,"רבי הוה בעכו חמי חד בר נש סלוק מן כיפתא ולעיל א""ל ולית את בריה דפלן כהנא לא הוה אבוך כהן א""ל עיניו של אבא היו גבוהות ונשא אשה שאינה הוגנת לו וחילל את אותו האיש:"
Sheviit,פני משה,6,1,16a,@11מכיפתא ולעיל. @33מן הגשר שהיה עומד שם ולהלן:,מכיפתא ולעיל,JTmock Sheviit 6:1:8,"רבי הוה בעכו חמי חד בר נש סלוק מן כיפתא ולעיל א""ל ולית את בריה דפלן כהנא לא הוה אבוך כהן א""ל עיניו של אבא היו גבוהות ונשא אשה שאינה הוגנת לו וחילל את אותו האיש:"
Sheviit,פני משה,6,1,16a,"@11לית את. @33וכי אין אתה בנו של פלוני שהיה כהן ואתה עומד בארץ העמים וחכמים גזרו טומאה עליה שמעינן מהא דעכו יש בה מחו""ל:",לית את,JTmock Sheviit 6:1:8,"רבי הוה בעכו חמי חד בר נש סלוק מן כיפתא ולעיל א""ל ולית את בריה דפלן כהנא לא הוה אבוך כהן א""ל עיניו של אבא היו גבוהות ונשא אשה שאינה הוגנת לו וחילל את אותו האיש:"
Sheviit,פני משה,6,1,16a,@11היו גבוהות. @33שהלך אחר עיניו ונשא אשה גרושה שאינה הוגנת לו וממנה נולדתי וחילל אותי:,היו גבוהות,JTmock Sheviit 6:1:8,"רבי הוה בעכו חמי חד בר נש סלוק מן כיפתא ולעיל א""ל ולית את בריה דפלן כהנא לא הוה אבוך כהן א""ל עיניו של אבא היו גבוהות ונשא אשה שאינה הוגנת לו וחילל את אותו האיש:"
Sheviit,פני משה,6,1,16a,@11תחומי ארץ ישראל. @33תוספתא (פרק ד') והתם גריס פרשת אשקלון וחומת מגדל שור וכן נשתנה נוסחת שאר שמות המקומות במקצת:,תחומי ארץ ישראל,JTmock Sheviit 6:1:9,"תחומי א""י כל שהחזיקו עולי בבל פרשת חומת מגדול שיר ושינא דרור ושורא דעכו וקצירייא דגלילא וכברתה ובית זניתה וקובעיא ומילתא דכור ובירייא רבתא תפנית וספנתה מחרתה דייתיר וממציא דאבהתא וראש מי געתן וגעתן עצמה מי ספר ומרחשת ומגדול חרוב ואילים רבתא ונוקבתא דעיון ותיקרת ברכה רבא ובר סנגרא ותרנגולא עילאה דלמעלן מקיסרין וטרכונא דמתחם לבוצרה ומלח דזרכאי וגומרין ובית סבל וקנת ורפיח דחגרא ודרך הגדולה ההולכת למדבר חשבון ויבקא ונחלא דזרד ויגר שהדות' ורקם רגיעה וגניא דאשקלון"
Sheviit,פני משה,6,1,16a,@11אשקלון עצמה. @33מהו:,אשקלון עצמה,JTmock Sheviit 6:1:10,"אשקלון עצמה רבי יעקב בר אחא בשם רבי זעירא מן מה דתני גנייא דאשקלון הדא אמרה אשקלון כלחוץ רבי סימן בשם חולפייא רבי רבי ישמעאל ב""ר יוסי ובן הקפר נמנו על אויר אשקלון וטיהרוהו מפי רבי פינחס בן יאיר דאמר יורדין היינו לסירקייא של אשקלון ולוקחין חיטין ועולין לעירנו וטובלין ואוכלין בתרומתינו למחר נמנו עליה לפוטרה מן המעשרות משך רבי ישמעאל ב""ר יוסי את ידיו מסתמך על בן הקפר א""ל בני למה לא אמרת לי מפני מה משכת את ידך ממנו הייתי אומר לך אתמול אני הוא שטמאתי אני הוא שטהרתי ועכשיו אני אומר שמא נתכבשה מדבר תורה והיאך אני פוטר' מדבר תורה"
Sheviit,פני משה,6,1,16a,@11מן מה דתני גנייה דאשקלון. @33הגינית של אשקלון הן התחום שמע מיניה אשקלון עצמה כלחוץ הוא:,מן מה דתני גנייה דאשקלון,JTmock Sheviit 6:1:10,"אשקלון עצמה רבי יעקב בר אחא בשם רבי זעירא מן מה דתני גנייא דאשקלון הדא אמרה אשקלון כלחוץ רבי סימן בשם חולפייא רבי רבי ישמעאל ב""ר יוסי ובן הקפר נמנו על אויר אשקלון וטיהרוהו מפי רבי פינחס בן יאיר דאמר יורדין היינו לסירקייא של אשקלון ולוקחין חיטין ועולין לעירנו וטובלין ואוכלין בתרומתינו למחר נמנו עליה לפוטרה מן המעשרות משך רבי ישמעאל ב""ר יוסי את ידיו מסתמך על בן הקפר א""ל בני למה לא אמרת לי מפני מה משכת את ידך ממנו הייתי אומר לך אתמול אני הוא שטמאתי אני הוא שטהרתי ועכשיו אני אומר שמא נתכבשה מדבר תורה והיאך אני פוטר' מדבר תורה"
Sheviit,פני משה,6,1,16a,@11נמנו על אויר אשקלון וטיהרוהו. @33משום ארץ העמים:,נמנו על אויר אשקלון וטיהרוהו,JTmock Sheviit 6:1:10,"אשקלון עצמה רבי יעקב בר אחא בשם רבי זעירא מן מה דתני גנייא דאשקלון הדא אמרה אשקלון כלחוץ רבי סימן בשם חולפייא רבי רבי ישמעאל ב""ר יוסי ובן הקפר נמנו על אויר אשקלון וטיהרוהו מפי רבי פינחס בן יאיר דאמר יורדין היינו לסירקייא של אשקלון ולוקחין חיטין ועולין לעירנו וטובלין ואוכלין בתרומתינו למחר נמנו עליה לפוטרה מן המעשרות משך רבי ישמעאל ב""ר יוסי את ידיו מסתמך על בן הקפר א""ל בני למה לא אמרת לי מפני מה משכת את ידך ממנו הייתי אומר לך אתמול אני הוא שטמאתי אני הוא שטהרתי ועכשיו אני אומר שמא נתכבשה מדבר תורה והיאך אני פוטר' מדבר תורה"
Sheviit,פני משה,6,1,16a,@11מפי רבי פנחס בן יאיר. @33מכח עדותו שאמר שהיו יורדין לשם ליריד הסוחרים שבאשקלון וכהנים היו כדמסיק אלמא אינה בכלל ארץ העמים. וגרסינן להא בפרק שביעי דיבמות (בהלכה ג'):,מפי רבי פנחס בן יאיר,JTmock Sheviit 6:1:10,"אשקלון עצמה רבי יעקב בר אחא בשם רבי זעירא מן מה דתני גנייא דאשקלון הדא אמרה אשקלון כלחוץ רבי סימן בשם חולפייא רבי רבי ישמעאל ב""ר יוסי ובן הקפר נמנו על אויר אשקלון וטיהרוהו מפי רבי פינחס בן יאיר דאמר יורדין היינו לסירקייא של אשקלון ולוקחין חיטין ועולין לעירנו וטובלין ואוכלין בתרומתינו למחר נמנו עליה לפוטרה מן המעשרות משך רבי ישמעאל ב""ר יוסי את ידיו מסתמך על בן הקפר א""ל בני למה לא אמרת לי מפני מה משכת את ידך ממנו הייתי אומר לך אתמול אני הוא שטמאתי אני הוא שטהרתי ועכשיו אני אומר שמא נתכבשה מדבר תורה והיאך אני פוטר' מדבר תורה"
Sheviit,פני משה,6,1,16b,"@11וטובלין. @33מפני צינורות של עכו""ם שנתזו עליהן:",וטובלין,JTmock Sheviit 6:1:10,"אשקלון עצמה רבי יעקב בר אחא בשם רבי זעירא מן מה דתני גנייא דאשקלון הדא אמרה אשקלון כלחוץ רבי סימן בשם חולפייא רבי רבי ישמעאל ב""ר יוסי ובן הקפר נמנו על אויר אשקלון וטיהרוהו מפי רבי פינחס בן יאיר דאמר יורדין היינו לסירקייא של אשקלון ולוקחין חיטין ועולין לעירנו וטובלין ואוכלין בתרומתינו למחר נמנו עליה לפוטרה מן המעשרות משך רבי ישמעאל ב""ר יוסי את ידיו מסתמך על בן הקפר א""ל בני למה לא אמרת לי מפני מה משכת את ידך ממנו הייתי אומר לך אתמול אני הוא שטמאתי אני הוא שטהרתי ועכשיו אני אומר שמא נתכבשה מדבר תורה והיאך אני פוטר' מדבר תורה"
Sheviit,פני משה,6,1,16b,@11למחר. @33חזרו ונמנו עליה לפוטרה מן המעשרות משום דלא חששו לעדות זו וסבירא להו כדלעיל דאשקלון לחוץ ומשך ר' ישמעאל בר' יוסי את ידיו שהיה רגיל להיות מסתמך על בן הקפר כדי שיבין שאין דעתו מסכמת לזה:,למחר,JTmock Sheviit 6:1:10,"אשקלון עצמה רבי יעקב בר אחא בשם רבי זעירא מן מה דתני גנייא דאשקלון הדא אמרה אשקלון כלחוץ רבי סימן בשם חולפייא רבי רבי ישמעאל ב""ר יוסי ובן הקפר נמנו על אויר אשקלון וטיהרוהו מפי רבי פינחס בן יאיר דאמר יורדין היינו לסירקייא של אשקלון ולוקחין חיטין ועולין לעירנו וטובלין ואוכלין בתרומתינו למחר נמנו עליה לפוטרה מן המעשרות משך רבי ישמעאל ב""ר יוסי את ידיו מסתמך על בן הקפר א""ל בני למה לא אמרת לי מפני מה משכת את ידך ממנו הייתי אומר לך אתמול אני הוא שטמאתי אני הוא שטהרתי ועכשיו אני אומר שמא נתכבשה מדבר תורה והיאך אני פוטר' מדבר תורה"
Sheviit,פני משה,6,1,16b,"@11למה לא אמרת לי וכו'. @33למה לא שאלת אותי הטעם שמשכתי את ידי והייתי אומר לך אתמול הייתי מן המנויים לטהר משום ארץ העמים ועכשיו איך אהיה מן הנמנים לפוטרה ממעשרות ולהחשיבה כחו""ל:",למה לא אמרת לי וכו',JTmock Sheviit 6:1:10,"אשקלון עצמה רבי יעקב בר אחא בשם רבי זעירא מן מה דתני גנייא דאשקלון הדא אמרה אשקלון כלחוץ רבי סימן בשם חולפייא רבי רבי ישמעאל ב""ר יוסי ובן הקפר נמנו על אויר אשקלון וטיהרוהו מפי רבי פינחס בן יאיר דאמר יורדין היינו לסירקייא של אשקלון ולוקחין חיטין ועולין לעירנו וטובלין ואוכלין בתרומתינו למחר נמנו עליה לפוטרה מן המעשרות משך רבי ישמעאל ב""ר יוסי את ידיו מסתמך על בן הקפר א""ל בני למה לא אמרת לי מפני מה משכת את ידך ממנו הייתי אומר לך אתמול אני הוא שטמאתי אני הוא שטהרתי ועכשיו אני אומר שמא נתכבשה מדבר תורה והיאך אני פוטר' מדבר תורה"
Sheviit,פני משה,6,1,16b,"@11אני הוא שטמאתי. @33היום אני הוא שטהרתי אתמול בתמיה ויש לפרש דה""ק דבשלמא לענין טומאה גזירה דרבנן בעלמא היא שגזרו על ארץ העמים אני הוא שטמאתי אני הוא שטיהרתי:",אני הוא שטמאתי,JTmock Sheviit 6:1:10,"אשקלון עצמה רבי יעקב בר אחא בשם רבי זעירא מן מה דתני גנייא דאשקלון הדא אמרה אשקלון כלחוץ רבי סימן בשם חולפייא רבי רבי ישמעאל ב""ר יוסי ובן הקפר נמנו על אויר אשקלון וטיהרוהו מפי רבי פינחס בן יאיר דאמר יורדין היינו לסירקייא של אשקלון ולוקחין חיטין ועולין לעירנו וטובלין ואוכלין בתרומתינו למחר נמנו עליה לפוטרה מן המעשרות משך רבי ישמעאל ב""ר יוסי את ידיו מסתמך על בן הקפר א""ל בני למה לא אמרת לי מפני מה משכת את ידך ממנו הייתי אומר לך אתמול אני הוא שטמאתי אני הוא שטהרתי ועכשיו אני אומר שמא נתכבשה מדבר תורה והיאך אני פוטר' מדבר תורה"
Sheviit,פני משה,6,1,16b,"@11ועכשיו. @33אבל עכשיו לענין מעשרות אני אומר שמא נתכבשה מד""ת להתחייב במעשרות וכהאי מ""ד דאע""ג שלא כבשוה עולי בבל קדושה ראשונה קדשה לשעתה וקידשה לע""ל:",ועכשיו,JTmock Sheviit 6:1:10,"אשקלון עצמה רבי יעקב בר אחא בשם רבי זעירא מן מה דתני גנייא דאשקלון הדא אמרה אשקלון כלחוץ רבי סימן בשם חולפייא רבי רבי ישמעאל ב""ר יוסי ובן הקפר נמנו על אויר אשקלון וטיהרוהו מפי רבי פינחס בן יאיר דאמר יורדין היינו לסירקייא של אשקלון ולוקחין חיטין ועולין לעירנו וטובלין ואוכלין בתרומתינו למחר נמנו עליה לפוטרה מן המעשרות משך רבי ישמעאל ב""ר יוסי את ידיו מסתמך על בן הקפר א""ל בני למה לא אמרת לי מפני מה משכת את ידך ממנו הייתי אומר לך אתמול אני הוא שטמאתי אני הוא שטהרתי ועכשיו אני אומר שמא נתכבשה מדבר תורה והיאך אני פוטר' מדבר תורה"
Sheviit,פני משה,6,1,16b,"@11והיאך אני פוטרה מד""ת. @33דס""ל כמ""ד לעיל דמן התורה נתחייבו בבית שני:","והיאך אני פוטרה מד""ת",JTmock Sheviit 6:1:10,"אשקלון עצמה רבי יעקב בר אחא בשם רבי זעירא מן מה דתני גנייא דאשקלון הדא אמרה אשקלון כלחוץ רבי סימן בשם חולפייא רבי רבי ישמעאל ב""ר יוסי ובן הקפר נמנו על אויר אשקלון וטיהרוהו מפי רבי פינחס בן יאיר דאמר יורדין היינו לסירקייא של אשקלון ולוקחין חיטין ועולין לעירנו וטובלין ואוכלין בתרומתינו למחר נמנו עליה לפוטרה מן המעשרות משך רבי ישמעאל ב""ר יוסי את ידיו מסתמך על בן הקפר א""ל בני למה לא אמרת לי מפני מה משכת את ידך ממנו הייתי אומר לך אתמול אני הוא שטמאתי אני הוא שטהרתי ועכשיו אני אומר שמא נתכבשה מדבר תורה והיאך אני פוטר' מדבר תורה"
Sheviit,פני משה,6,1,16b,@11אימתי היא טמאה משום ארץ העמים. @33לאחר שנמנו עליה לפוטרה ממעשרות אם היא טמאה מיד משום ארץ העמים או עד שתתפשט תקנה זו:,אימתי היא טמאה משום ארץ העמים,JTmock Sheviit 6:1:11,"אימתי היא טמאה משום ארץ העמים אמר רבי סימון משתשהא הגזירה ארבעין יומין א""ר ירמיה ולא בטעות אנו מחזיקין אלא מיד היא טמאה משום ארץ העמים אמר רבי מנא לא כן אמר רבי יעקב בר אחא בשם רבי זעירא מן מה דתני גנייא דאשקלון הדא אמרה אשקלון כלחוץ וכי צור אינו אסור לילך שם והקונה שם אינו מתחייב דלא תסבור מימר אוף הכא כן לפיכך נמנו עליה לפוטרה מן המעשרות"
Sheviit,פני משה,6,1,16b,"@11משתשהא הגזירה ארבעים יום. @33כלומר משתתפשט תקנה זו מ' יום להיות פטורה ממעשרות שהגזירה להיות טמאה משום ארץ העמים היא מחמת תקנה זו אבל קודם לכן לא שעד שלא נתפשטה יהיה זה נוהג בה חיוב מעשרות וזה יחזיקנה כארץ העמים והן סותרין זא""ז:",משתשהא הגזירה ארבעים יום,JTmock Sheviit 6:1:11,"אימתי היא טמאה משום ארץ העמים אמר רבי סימון משתשהא הגזירה ארבעין יומין א""ר ירמיה ולא בטעות אנו מחזיקין אלא מיד היא טמאה משום ארץ העמים אמר רבי מנא לא כן אמר רבי יעקב בר אחא בשם רבי זעירא מן מה דתני גנייא דאשקלון הדא אמרה אשקלון כלחוץ וכי צור אינו אסור לילך שם והקונה שם אינו מתחייב דלא תסבור מימר אוף הכא כן לפיכך נמנו עליה לפוטרה מן המעשרות"
Sheviit,פני משה,6,1,16b,"@11א""ר ירמיה. @33דלא היא שהרי ולא בטעות אנו מחזיקים אותה עד עכשו לחייבה במעשרות בתמיה וא""כ משעה שנמנו עליה לפוטרה מיד היא טמאה משום ארץ העמים ולא איכפת לן אם אחד או שנים שלא ידעו מהמנין שנמנו עליה ויהיו נוהגים בה חיוב מעשרות לפי שבטעות הוא:","א""ר ירמיה",JTmock Sheviit 6:1:11,"אימתי היא טמאה משום ארץ העמים אמר רבי סימון משתשהא הגזירה ארבעין יומין א""ר ירמיה ולא בטעות אנו מחזיקין אלא מיד היא טמאה משום ארץ העמים אמר רבי מנא לא כן אמר רבי יעקב בר אחא בשם רבי זעירא מן מה דתני גנייא דאשקלון הדא אמרה אשקלון כלחוץ וכי צור אינו אסור לילך שם והקונה שם אינו מתחייב דלא תסבור מימר אוף הכא כן לפיכך נמנו עליה לפוטרה מן המעשרות"
Sheviit,פני משה,6,1,16b,"@11א""ר מנא לא כן וכו'. @33ר' מנא נמי כר' ירמיה ס""ל ועל ר' סימון הוא דמקשה דהא לא כן א""ר יעקב בר אחא לעיל דשמעינן מהתוספתא דאשקלון עצמה כלחוץ וא""כ לכל דבר היא כח""ל לפוטרה ממעשרות ולטמאה משום ארץ העמים:","א""ר מנא לא כן וכו'",JTmock Sheviit 6:1:11,"אימתי היא טמאה משום ארץ העמים אמר רבי סימון משתשהא הגזירה ארבעין יומין א""ר ירמיה ולא בטעות אנו מחזיקין אלא מיד היא טמאה משום ארץ העמים אמר רבי מנא לא כן אמר רבי יעקב בר אחא בשם רבי זעירא מן מה דתני גנייא דאשקלון הדא אמרה אשקלון כלחוץ וכי צור אינו אסור לילך שם והקונה שם אינו מתחייב דלא תסבור מימר אוף הכא כן לפיכך נמנו עליה לפוטרה מן המעשרות"
Sheviit,פני משה,6,1,16b,"@11וכי צור אינו אסור לילך לשם. @33מסקנת דברי ר' מנא הן כלומר וכי תימא דאי הכי דשמעינן מהאי ברייתא להדיא דכח""ל היא מפני מה הוצרכו להיות נמנין עליה לפוטרה ממעשרות הלכך קאמר דהיינו טעמא לפי שהיו רגילין להיות נוהגין בה חיוב מעשרות ובטעות וע""ז לא היו חוששין דמה בכך אם הן פטורין ומחמירין על עצמן אלא דמשום טומאה הוא דחששו שלא ילמדו ממה שנוהגין בצור דכי אינו אסור לילך לשם מפני טומאת ארץ העמים והקונה תבואה שם אינו מתחייב במעשרות דודאי ח""ל הוא:",וכי צור אינו אסור לילך לשם,JTmock Sheviit 6:1:11,"אימתי היא טמאה משום ארץ העמים אמר רבי סימון משתשהא הגזירה ארבעין יומין א""ר ירמיה ולא בטעות אנו מחזיקין אלא מיד היא טמאה משום ארץ העמים אמר רבי מנא לא כן אמר רבי יעקב בר אחא בשם רבי זעירא מן מה דתני גנייא דאשקלון הדא אמרה אשקלון כלחוץ וכי צור אינו אסור לילך שם והקונה שם אינו מתחייב דלא תסבור מימר אוף הכא כן לפיכך נמנו עליה לפוטרה מן המעשרות"
Sheviit,פני משה,6,1,16b,"@11דלא תסבור מימר אוף הכא כן. @33כלומר שיסברו דלפי זה הכא נמי כן דזה תלוי בזה וכמו דצור מחזיקין אותה לטמאה ולפוטרה ממעשרות ה""ה הכא איפכא דכשיראו שנוהגין בה חיוב מעשרות יחזיקו אותה כא""י ויטהרו אותה ג""כ לפיכך הוצרכו להיות נמנין עליה לפוטרה מן המעשרות שיחזיקו אותה כח""ל לגמרי ויטמאו אותה משום ארץ העמים:",דלא תסבור מימר אוף הכא כן,JTmock Sheviit 6:1:11,"אימתי היא טמאה משום ארץ העמים אמר רבי סימון משתשהא הגזירה ארבעין יומין א""ר ירמיה ולא בטעות אנו מחזיקין אלא מיד היא טמאה משום ארץ העמים אמר רבי מנא לא כן אמר רבי יעקב בר אחא בשם רבי זעירא מן מה דתני גנייא דאשקלון הדא אמרה אשקלון כלחוץ וכי צור אינו אסור לילך שם והקונה שם אינו מתחייב דלא תסבור מימר אוף הכא כן לפיכך נמנו עליה לפוטרה מן המעשרות"
