masechet,commentary,perek,halakha,page,comment,dh,base text ref,base text
Sheviit,פני משה,3,4,8a,"@11בד""א מתוך שלו. @33דאז צריך שלא יהא נראה כרוצה לתקן שדהו אבל מתוך של חבירו מה שהוא רוצה יטול וכן דוקא בזמן שלא התחיל לפנות מערב שביעית אבל אם התחיל בו מערב שביעית נוטל מה שהוא רוצה ועד סמוך לארץ דמכיון שהתחיל מקודם לא מיחזי כמתקן שדהו בשביעית:","בד""א מתוך שלו",JTmock Sheviit 3:4:1,"לא יפתח אדם מחצב בתחילה לתוך שדהו עד שיהא בו שלוש מורביות שהן שלוש על שלוש על רום שלוש שיעורן עשרים ושבע אבנים גדר שיש בו י' אבנים של משוי שנים שנים הרי אילו ינטלו שיעור גדר עשרה טפחים פחות מכאן מחצה וגוממו עד פחות מן הארץ טפח בד""א מתוך שלו אבל מתוך של חבירו מה שהוא רוצה יטול בד""א בזמן שלא התחיל בו ערב שביעית אבל אם התחיל בו מערב שביעית מה שהיה רוצה יטול:"
Sheviit,פני משה,3,4,8a,@22גמ' @11היך עבידא. @33הא דקתני שהם ג' על ג' מפרש:,היך עבידא,JTmock Sheviit 3:4:2,היאך עבידא תלתא זמנין מן תשע תשע זמנין מן תלת עשרין ושבע
Sheviit,פני משה,3,4,8a,"@11תלתא זימנין מן תשע תשע זימנין מן תלת. @33כלומר שבכל שורה ושורה עושה ג""פ של ג' אבנים זו על זו היינו דקאמר מן תשע תשע זימנין שבכל שורה יש תשעה אבנים אבל אין התשעה מסודרות זו אצל זו באורך תשעה דא""כ תלתא זימנין מן תשע תשע מיבעי ליה למימר אלא שהן מונחות ג' ג' ועל גבי ג' שבתחלה מסדר ג' שורות של ג' אבנים זו אצל זו והן פעם אחת תשעה וחוזר ומניח עליהן ג' על ג' אבנים והן שני פעמים תשעה וחוזר ומניח עוד ג' של ג' אבנים עליהן והרי הן ג""פ של תשע תשע פעמים:",תלתא זימנין מן תשע תשע זימנין מן,JTmock Sheviit 3:4:2,היאך עבידא תלתא זמנין מן תשע תשע זמנין מן תלת עשרין ושבע
Sheviit,פני משה,3,4,8a,"@11מן תלת. @33וזהו כדאמרן שבכל פעם של תשעה יש ג' של ג' שהן בין הכל עשרין ושבע והשתא מדויק ג""כ לישנא דמתני' ג' מורביות ובכל מורביה ג' של ג' ונמצא שכשהן מונחות כולן זו על זו יש בהן ג' אמות אורך וג' אמות רוחב וברום ג' אמות לפי שכל אבן ואבן אמה אורך ואמה רוחב וברום אמה אחת כדפרישית במתני':",מן תלת,JTmock Sheviit 3:4:2,היאך עבידא תלתא זמנין מן תשע תשע זמנין מן תלת עשרין ושבע
Sheviit,פני משה,3,4,8a,@11תני. @33בברייתא:,תני,JTmock Sheviit 3:4:3,תני מחצב שבינו לבין חבירו ופתח בו חבירו בהיתר מותר ואם היתה ריקה אסור
Sheviit,פני משה,3,4,8a,"@11מחצב של אבנים @33שבינו לבין גבול חבירו ופתח בו חבירו בהיתר קודם שביעית מותר לכאו""א מהם ליטול ממנו בשביעית:",מחצב של אבנים שבינו לבין גבול חבירו,JTmock Sheviit 3:4:3,תני מחצב שבינו לבין חבירו ופתח בו חבירו בהיתר מותר ואם היתה ריקה אסור
Sheviit,פני משה,3,4,8a,@11ואם היתה. @33אותה המחצב ריקה שאין בה אבנים שפתח לחצוב משם קודם שביעית אסור:,ואם היתה,JTmock Sheviit 3:4:3,תני מחצב שבינו לבין חבירו ופתח בו חבירו בהיתר מותר ואם היתה ריקה אסור
Sheviit,פני משה,3,4,8a,"@11תמן תנינן. @33(בריש פי""ד דאהלות) הזיז מביא את הטומאה בכל שהוא כדמפרש התם במתני' איזהו הזיז שפניו למטה כלומר שהזיז הזה היוצא מן פתח הבית כפוף למטה לארץ ואז שיעורו להביא את הטומאה להבית בכל שהוא ואם פניו למעלה זהו נקרא הגיזרה או הגיבלית ואינו מביא את הטומאה אלא בפותח טפח ומסיים שם במתני' ובמה אמרו הזיז מביא את הטומאה בכל שהוא בזיז שהוא גבוה מן הפתח שלשה נדבכין שהם שנים עשר טפח וכלומר שגם בזיז שהוא גבוה מן הפתח ג""כ הדין כן ובלבד שלא יהא גבוה מעל גבי הארץ אלא עד י""ב טפח ולא יותר אבל אם הוא גבוה מעל הארץ יותר מכאן אינו מביא את הטומאה אלא בפותח טפח:",תמן תנינן,JTmock Sheviit 3:4:4,"תמן תנינן הזיז מביא את הטומאה בכל שהוא הגזרה והגובלית בפותח טפח אמר ר""ח בר בא הדא אמרה זה שהוא מקבל נדבך מחבירו צריך לעשות לו ארבעה טפחים כדי מקום א""ר יוסי מתני' אמרה כן ובמה אמרו הזיז מביא את הטומאה בכל שהוא בזיז שהוא גבוה מן הפתח ג' נדבכין שהן שנים עשר טפח ולמה תנינן נדבכין למדת הדין"
Sheviit,פני משה,3,4,8a,"@11הדא אמרה זה שהוא מקבל נדבך מחבירו. @33שהוא מקבל עליו לעשות נדבך לחבירו והוא שורה של אבנים צריך לעשות לו שיהא הנדבך ארבעה י""ט שהוא כדי מקום חשוב דהא קחשיב במתני' ג' נדבכים שהן י""ב טפחים וזהו ד""ט לכל נדבך ולמד ר' חייא בר בא לענין מקח וממכר מהמתני' דקתני לענין שיעור גבי טומאה:",הדא אמרה זה שהוא מקבל נדבך מחבירו,JTmock Sheviit 3:4:4,"תמן תנינן הזיז מביא את הטומאה בכל שהוא הגזרה והגובלית בפותח טפח אמר ר""ח בר בא הדא אמרה זה שהוא מקבל נדבך מחבירו צריך לעשות לו ארבעה טפחים כדי מקום א""ר יוסי מתני' אמרה כן ובמה אמרו הזיז מביא את הטומאה בכל שהוא בזיז שהוא גבוה מן הפתח ג' נדבכין שהן שנים עשר טפח ולמה תנינן נדבכין למדת הדין"
Sheviit,פני משה,3,4,8a,"@11מתניתא אמרה כן @33כלומר דר' יוסי מחזק דברי ר' חייא בר בא שלא תקשה מנין לנו ללמוד דין ממון מדין טומאה וקאמר דמלישנא דהאי מתני' שמענו כן דקתני ובמה אמרו וכו'. כדפרישית ולמה תנינן נדבכין לא הוי ליה למיתני אלא בגבוה י""ב טפחים ומאי קמ""ל בשיעורא דנדבכין אלא למדת הדין כלומר להשמיענו אגב דגם לענין דין ממון הוא כן דסתם נדבך שיעורו בגובה ד""ט:",מתניתא אמרה כן כלומר דר' יוסי מחזק,,
Sheviit,פני משה,3,4,8a,"@11אלין שיעוריא באינון שיעורייא. @33כלומר אם שיעור האבנים המוזכר במתני' כאן שוה לשיעור הנשנה במתני' דאהלות וקא""ר חזקיה אין דהכי הויא דאילין שיעורייא כמו אלין שיעורייא:",אלין שיעוריא באינון שיעורייא,JTmock Sheviit 3:4:5,"ר""ח בר בא שאל אינון שיעורין כאינון שיעורייא הכא את אמר שיעור גדר עשרה טפחים פחות מכאן מחצב וכא את אמר הכין מה אנן קיימין אם כשהיו ב' נדבכין ניתני שמונה טפחים אם כשהיו ג' ניתני שנים עשר טפחים א""ר יוסי צא חצי טפח לסיתות מכאן וחצי טפח לסיתות מכאן וכן לחבריה נמצא ג' נדבכים של עשרה טפחים פחות מכאן אינו לא גדר ולא מחצב"
Sheviit,פני משה,3,4,8a,"@11הכא. @33ופריך והיכא מצית למימר כן דהא הכא במתני' את אמר שיעור גדר שאמרו שנוטל ממנו אבנים הגדולות י""ט והכא במתני' דאהלות את אמר הכין שהנדבך של אבנים גבהו ד""ט והשתא קשיא מה אנן קיימין בגדר דמתני' אם בשהיה בו גובה שני נדבכין א""כ אין כאן אלא ח' טפחים ואמאי תני עשרה ואם בשהיו בו ג' נדבכין י""ב טפחים מבעי ליה:",הכא,JTmock Sheviit 3:4:5,"ר""ח בר בא שאל אינון שיעורין כאינון שיעורייא הכא את אמר שיעור גדר עשרה טפחים פחות מכאן מחצב וכא את אמר הכין מה אנן קיימין אם כשהיו ב' נדבכין ניתני שמונה טפחים אם כשהיו ג' ניתני שנים עשר טפחים א""ר יוסי צא חצי טפח לסיתות מכאן וחצי טפח לסיתות מכאן וכן לחבריה נמצא ג' נדבכים של עשרה טפחים פחות מכאן אינו לא גדר ולא מחצב"
Sheviit,פני משה,3,4,8a,"@11א""ר יוסי. @33דלא קשיא דלעולם סתם נדבך של גובה ד""ט הוא והיינו כשניטל מהמחצב אבל כשבא לעשות גדר צריך הוא לסתת האבנים ולתקנם וצא חצי טפח לסיתות מכאן ומכאן לכל נדבך מהעליונים ונשתייר בו גובה ג""ט וכן לחבריה והוא הנדבך האמצעי שצריך ג""כ לסתתו חצי טפח מכאן ומכאן אבל הנדבך השלישי והוא התחתון הסמוך לארץ אין מדרך לתקנו ונמצא עושה הגדר מג' נדבכין שהוא גדר של י""ט א""נ דגם הנדבך התחתון מסתתו כמו שנים העליונים ונשאר מהשלשה גובה תשעה טפחים ועכשיו צריך טיח של סיד וטיט לחברן והוא טפח ונמצא הגדר של ג' נדבכין גבוה י""ט ובמתני' דאהלות דתנן בג' נדבכין שהן י""ב טפחים היינו לשיעורא דנדבכין מקודם שמסתתן הוא דקחשיב וכדי להשמיענו אגב הדין לענין המקבל עליו לחצוב נדבך לחבירו שצריך שיהא בתחלה ד""ט כדאמרינן לעיל:","א""ר יוסי",JTmock Sheviit 3:4:5,"ר""ח בר בא שאל אינון שיעורין כאינון שיעורייא הכא את אמר שיעור גדר עשרה טפחים פחות מכאן מחצב וכא את אמר הכין מה אנן קיימין אם כשהיו ב' נדבכין ניתני שמונה טפחים אם כשהיו ג' ניתני שנים עשר טפחים א""ר יוסי צא חצי טפח לסיתות מכאן וחצי טפח לסיתות מכאן וכן לחבריה נמצא ג' נדבכים של עשרה טפחים פחות מכאן אינו לא גדר ולא מחצב"
Sheviit,פני משה,3,4,8b,"@11פחות מכאן וכו'. @33כלומר אין לו דין גדר שאמרו ולא דין מחצב דרישא דמתני' אלא מחצב ונוטל ממנו עד סמוך לארץ ואף ע""פ שלא פתח מקודם שביעית כדין המחצב:",פחות מכאן וכו',JTmock Sheviit 3:4:5,"ר""ח בר בא שאל אינון שיעורין כאינון שיעורייא הכא את אמר שיעור גדר עשרה טפחים פחות מכאן מחצב וכא את אמר הכין מה אנן קיימין אם כשהיו ב' נדבכין ניתני שמונה טפחים אם כשהיו ג' ניתני שנים עשר טפחים א""ר יוסי צא חצי טפח לסיתות מכאן וחצי טפח לסיתות מכאן וכן לחבריה נמצא ג' נדבכים של עשרה טפחים פחות מכאן אינו לא גדר ולא מחצב"
Sheviit,פני משה,3,4,8b,"@11תני בתוספתא @33(בריש פ""ג) והועתקה כאן בספרי הדפוס בטעות בדברי ר' יודה ור""ש כמו דגריס שם אר""י בד""א בזמן שנתכוין לתיקון שדהו אבל אם לא נתכוין לתיקון שדהו אפילו דבר מרובה מותר כלומר בהמחצב דרישא או בגדר שאמרנו בהן השיעור הזה דוקא אם כוונתו בהסירו את האבנים כדי לעשות השדה ולתקנה ומשום דבשביעית אסור הוא לתקן שדהו לפיכך אמרו בהן שיעורין הללו כדי שלא יהא נראה שהוא עושה לתקן את שדהו בשביעית אלא מה שנוטל עכשיו צריך שיהא ניכר שלצורך בנין הוא נוטל ולא לתיקון שדהו אבל אם לא נתכוין לתיקון שדהו כלומר שאנו יודעין בו שמעולם אין כוונתו בהסירו את האבנים לתקן שדהו אלא לבנין בלבד כגון שאנו מכירין בו שדרכו בכך:","תני בתוספתא בריש פ""ג והועתקה כאן בספרי",,
Sheviit,פני משה,3,4,8b,@11אפילו יותר מכאן מותר. @33כלומר מה שהוא רוצה יכול הוא ליטול ואפילו אין באבנים שהוא נוטל השיעור שאמרו וכן אין במחצב כפי השיעור שאמרו נוטל הוא ואף את הכל מאחר שאנו יודעין בו שאין חפצו לתקן שדהו:,אפילו יותר מכאן מותר,JTmock Sheviit 3:4:6,"תני א""ר יודא בד""א בזמן שלא נתכוין לתיקון שדהו אבל אם נתכוין לתיקון שדהו אפי' יותר מכאן מותר אמר רשב""ג בד""א בזמן שלא נתכווין לתיקון שדהו אבל אם נתכווין לתקן שדהו אפילו פחות מכאן אסור א""ר ביבי הורי רבי יוסי כהדא תניא לקולא:"
Sheviit,פני משה,3,4,8b,"@11ארשב""ג וכו' @33כלומר דפליג ואיפכא אמרינן ולחומרא דדוקא בזמן שאין אנו חוששין בו שהוא מתכוין לתיקון שדהו בהא דאמרו דנוטל וכפי השיעור ששנינו דתולין בו שלצורך בנין הוא נוטל אבל אם נתכוין וכו'. כלומר שיש לחוש בו שהוא מתכוין לתקן שדהו:","ארשב""ג וכו' כלומר דפליג ואיפכא אמרינן ולחומרא",JTmock Sheviit 3:4:6,"תני א""ר יודא בד""א בזמן שלא נתכוין לתיקון שדהו אבל אם נתכוין לתיקון שדהו אפי' יותר מכאן מותר אמר רשב""ג בד""א בזמן שלא נתכווין לתיקון שדהו אבל אם נתכווין לתקן שדהו אפילו פחות מכאן אסור א""ר ביבי הורי רבי יוסי כהדא תניא לקולא:"
Sheviit,פני משה,3,4,8b,"@11אפי' פחות מכאן אסור. @33כלומר אף היה בהן כשיעור שאמרו והוא נוטל פחות ממה שהתירו בשיש בהן כשיעור אעפ""כ אסור הואיל דאיכא למיחש ביה דכל מה שהוא נוטל לתקן את שדהו הוא נוטל:",אפי' פחות מכאן אסור,JTmock Sheviit 3:4:6,"תני א""ר יודא בד""א בזמן שלא נתכוין לתיקון שדהו אבל אם נתכוין לתיקון שדהו אפי' יותר מכאן מותר אמר רשב""ג בד""א בזמן שלא נתכווין לתיקון שדהו אבל אם נתכווין לתקן שדהו אפילו פחות מכאן אסור א""ר ביבי הורי רבי יוסי כהדא תניא לקולא:"
Sheviit,פני משה,3,4,8b,@11כהדין תנייא לקולא. @33כר' יהודה:,כהדין תנייא לקולא,JTmock Sheviit 3:4:6,"תני א""ר יודא בד""א בזמן שלא נתכוין לתיקון שדהו אבל אם נתכוין לתיקון שדהו אפי' יותר מכאן מותר אמר רשב""ג בד""א בזמן שלא נתכווין לתיקון שדהו אבל אם נתכווין לתקן שדהו אפילו פחות מכאן אסור א""ר ביבי הורי רבי יוסי כהדא תניא לקולא:"
Sheviit,פני משה,3,5,8b,"@22מתני' @11אבנים שזעזעתן המחרישה. @33האבנים שבשדה והמחרישה זעזעתן מעט ממקומן ומפרש בגמ' לאו דוקא שכבר זעזעתן אלא אפי' ראויות הן לכך ועתידה המחרישה לזעזע אותן וזה נלמד ג""כ מהתוספתא דתנינן (בפ""ג) אבנים תושבות שהמחרישה מזעזעתן כלומר שהן מיושבות עדיין בקרקע אבל אינן קבועות בעומק בארץ ועתידה המחרישה לזעזען:",אבנים שזעזעתן המחרישה,JTmock Sheviit 3:5:1,אבנים שזיעזעתן המחרישה או שהיו מכוסות ונתגלו אם יש בהן שתים של משוי שנים שנים הרי אלו ינטלו והמסקל את שדהו נוטל את העליונות ומניח את הנוגעות בארץ וכן גרגיר של צרורות או גל של אבנים נוטל את העליונות ומניח את הנוגעות בארץ אם יש תחתיהן סלע או קש הרי אלו ינטלו:
Sheviit,פני משה,3,5,8b,@11או שהיו מכוסות. @33בעפר ונתגלו:,או שהיו מכוסות,JTmock Sheviit 3:5:1,אבנים שזיעזעתן המחרישה או שהיו מכוסות ונתגלו אם יש בהן שתים של משוי שנים שנים הרי אלו ינטלו והמסקל את שדהו נוטל את העליונות ומניח את הנוגעות בארץ וכן גרגיר של צרורות או גל של אבנים נוטל את העליונות ומניח את הנוגעות בארץ אם יש תחתיהן סלע או קש הרי אלו ינטלו:
Sheviit,פני משה,3,5,8b,"@11אם יש בהן שתים של משוי שנים שנים הרי אלו ינטלו. @33אותן וקמ""ל דאף שראויין הן שהמחרישה תזעזע אותן מ""מ בעינן דוקא שיהו של משוי שנים שנים ואם היו קטנות מזה לא ינטלו:",אם יש בהן שתים של משוי שנים,JTmock Sheviit 3:5:1,אבנים שזיעזעתן המחרישה או שהיו מכוסות ונתגלו אם יש בהן שתים של משוי שנים שנים הרי אלו ינטלו והמסקל את שדהו נוטל את העליונות ומניח את הנוגעות בארץ וכן גרגיר של צרורות או גל של אבנים נוטל את העליונות ומניח את הנוגעות בארץ אם יש תחתיהן סלע או קש הרי אלו ינטלו:
Sheviit,פני משה,3,5,8b,@11המסקל שדהו בשביעית. @33מפני שהוא צריך לאבנים ומסלקן מן השדה נוטל את העליונות ומניח את הנוגעות בארץ שלא יהא נראה כמתקן שדהו לזריעה:,המסקל שדהו בשביעית,JTmock Sheviit 3:5:1,אבנים שזיעזעתן המחרישה או שהיו מכוסות ונתגלו אם יש בהן שתים של משוי שנים שנים הרי אלו ינטלו והמסקל את שדהו נוטל את העליונות ומניח את הנוגעות בארץ וכן גרגיר של צרורות או גל של אבנים נוטל את העליונות ומניח את הנוגעות בארץ אם יש תחתיהן סלע או קש הרי אלו ינטלו:
Sheviit,פני משה,3,5,8b,@11וכן גרגיר של צרורות. @33אבנים קטנות האסופות במקום אחד:,וכן גרגיר של צרורות,JTmock Sheviit 3:5:1,אבנים שזיעזעתן המחרישה או שהיו מכוסות ונתגלו אם יש בהן שתים של משוי שנים שנים הרי אלו ינטלו והמסקל את שדהו נוטל את העליונות ומניח את הנוגעות בארץ וכן גרגיר של צרורות או גל של אבנים נוטל את העליונות ומניח את הנוגעות בארץ אם יש תחתיהן סלע או קש הרי אלו ינטלו:
Sheviit,פני משה,3,5,8b,@11ואם יש תחתיהן סלע או קש. @33דאין מקום הזה ראוי לזריעה הרי אלו ינטלו כולן:,ואם יש תחתיהן סלע או קש,JTmock Sheviit 3:5:1,אבנים שזיעזעתן המחרישה או שהיו מכוסות ונתגלו אם יש בהן שתים של משוי שנים שנים הרי אלו ינטלו והמסקל את שדהו נוטל את העליונות ומניח את הנוגעות בארץ וכן גרגיר של צרורות או גל של אבנים נוטל את העליונות ומניח את הנוגעות בארץ אם יש תחתיהן סלע או קש הרי אלו ינטלו:
Sheviit,פני משה,3,5,8b,@22גמ' @11לאסוף דבר וכו'. @33כדפרישית במתני':,לאסוף דבר וכו',,
Sheviit,פני משה,3,5,8b,"@11מתניתא אמרה כן וכו'. @33ממתני' גופה שמעינן להא דמדקתני של משאוי שנים שנים א""כ צריך עד שיהא בכל אחת ואחת משאוי של שנים ובאבנים גדולות כאילו אי אפשר שתזעזע אותן המחרישה אלא ודאי לא שזעזעתן ממש קאמר אלא שעתידה לזעזע אותן וכלומר שראוין הן לכך לפי המקום שמונחות בארץ שאינן קבועות בעומק הרבה והמחרישה יכולה לנגוע בהן וזהו עתידה לזעזען דקאמר:",מתניתא אמרה כן וכו',JTmock Sheviit 3:5:2,לא סוף דבר בשזיעזעתן המחרישה אלא אפילו מחרישה עתידה לזעזען אמר רבי יוסי מתניתא אמרה כן אם יש בכל א' וא' של משאוי שנים שנים הרי אלו ינטלו.
Sheviit,פני משה,3,5,8b,"@11ר' יעקב בר בון וכו'. @33זה מצויין בספרי הדפוס אחר הלכה דלקמן וטעות הוא ואין אנו סומכין על ציון הלז של ספרי דפוס שנעשה מספרי העתקות ולא שלטה יד המגיהים הבקיאים בהם לא כאן ולא בכל מקום אלא כל דבר ודבר לפי הענין השייך לו וזה שייך למתניתין דידן דמדייק מדקתני וכן גרגר של צרורות ש""מ דגם צרורות קטנות נצרכין הן לבעל השדה לאיזה דבר ואע""פ שאינן ראוין לבנין ועלה קאמר זאת אומרת שאסור לאדם ללקט צרורות מתוך שדה חבירו לפי שבעל השדה מקפיד עליהן ולפעמים נצרכין לו:",ר' יעקב בר בון וכו',JTmock Sheviit 3:5:3,"רבי יעקב בר בון בשם ר""ש בן לקיש זאת אומר' אסור ללקט צרורות מתוך שדה חבירו דו מנכש ויהב עיסביה עליהן הדא דתימא בבקעה אבל בהרים וטרשים וטיבו השב ליה:"
Sheviit,פני משה,3,5,8b,@11די מנכש ויהיב עסביה עליהון. @33כשהוא מנכש את השדה מהעשבים נותן אותן על הצרורות ובמתני' נמי אוסף אותן אל מקום אחד להיות מוכנים להניח עשבים שמנכש עליהן:,די מנכש ויהיב עסביה עליהון,JTmock Sheviit 3:5:3,"רבי יעקב בר בון בשם ר""ש בן לקיש זאת אומר' אסור ללקט צרורות מתוך שדה חבירו דו מנכש ויהב עיסביה עליהן הדא דתימא בבקעה אבל בהרים וטרשים וטיבו השב ליה:"
Sheviit,פני משה,3,5,8b,@11הדא דתימר בבקעה. @33בשדה מישור אבל בשדה שבהרים ובשרשים מקום שטרשים וסלעים מצוין ואינו צריך לכך ולפיכך מותר לאחר ליטלן:,הדא דתימר בבקעה,JTmock Sheviit 3:5:3,"רבי יעקב בר בון בשם ר""ש בן לקיש זאת אומר' אסור ללקט צרורות מתוך שדה חבירו דו מנכש ויהב עיסביה עליהן הדא דתימא בבקעה אבל בהרים וטרשים וטיבו השב ליה:"
Sheviit,פני משה,3,5,8b,@11וטיבו חשב ליה. @33כלומר ואדרבה לטובה נחשבת ליה שמנקה את השדה מן הצרורות ובשדה הרים וטרשים צריכה ביותר שתהא נקיה מן העפר וצרורות:,וטיבו חשב ליה,JTmock Sheviit 3:5:3,"רבי יעקב בר בון בשם ר""ש בן לקיש זאת אומר' אסור ללקט צרורות מתוך שדה חבירו דו מנכש ויהב עיסביה עליהן הדא דתימא בבקעה אבל בהרים וטרשים וטיבו השב ליה:"
