Id,Relevance,Ref,Version,Lang,Content,Field,Score
149,n,Chiddushei Ramban on Shabbat 47a:4,"Chiddushei HaRamban, Jerusalem 1928-29",he," מעשריא ממעטני זיתיא ואמרי' במס' נדרים בגלילא שאני דחמרי יקיר להון ממשחא אלמא שמן הרבה הי' להם, וכן פר""ת ז""ל. אבל רש""י ז""ל אמר שהיו עניים ולא הי' להם פשתן ואינו נכון דאמרי' בפרק הגוזל מקבלין מהן דבר",infreq,7.711979
150,n,Esther 2:5,Tanach with Ta'amei Hamikra,he,איש יהודי היה בשושן הבירה ושמו מרדכי בן יאיר בן־שמעי בן־קיש איש ימיני,hebmorph-exact,3.2194688
151,n,Pirkei Avot 5:21,"Mishnah, ed. Romm, Vilna 1913",he,הוא היה אומר בן חמש שנים למקרא. בן עשר למשנה. בן שלש עשרה למצות. בן חמש עשרה לתלמוד. בן שמונה עשרה לחופה. בן עשרים לרדוף. בן שלשים לכח. בן ארבעים לבינה. בן חמשים לעצה. בן ששים לזקנה. בן שבעים לשיבה. בן שמונים לגבורה. בן תשעים לשוח. בן מאה כאילו מת ועבר ובטל מן העולם.,hebmorph-exact,3.9468563
152,n,Rashi on Sanhedrin 92b:55:3,Wikisource Rashi,he,"הומק סורו - נשפל גאותו כמו סורו רע (קדושין דף פב.) ל""א הומק סודו כמו יסודו נשתלשל וכן לימדני רבי יעקב בן יקר אבל מורי גרס והומק סידו סיד הכבשן נמסה מרוב חמימות כך שמעתי והיתה מושכת למרחוק ומהבל של אותו הסיד נשרפו אותן שהשליכו חנניה מישאל ועזריה לתוך כבשן האש:",aggresive-ngram,23.755886
153,--,Rashi on Jeremiah 31:20:1,On Your Way,he,"הבן יקיר לי אפרים. הן דברי שכינה כלומר הוא מתנודד ואני לבי נהפך עלי לרחם שמא בני יקירי הוא כמו שאין לו אלא בן אחד שהוא עושה לו כל רצונו  שעשועים . אישבניימני""ץ בלעז : ",hebmorph-standard,33.53188
154,n,Yevamot 45b:13,William Davidson Edition - Aramaic,he,ההוא דהוו קרו ליה בר ארמייתא אמר רב אסי מי לא טבלה לנדותה ההוא דהוו קרו ליה בר ארמאה אמר רבי יהושע בן לוי מי לא טבל לקריו,aggresive-ngram,7.4109936
155,n,Rashi on Genesis 35:18:1,On Your Way,he,בן אוני. בן צערי:,hebmorph-exact,3.5463803
156,n,Bartenura on Mishnah Parah 3:2:3,On Your Way,he,"ומגדלות שם את בניהן. עד שיהיו בן שמונה [שנים], ולא יותר שלא יראו קרי:",aggresive-ngram,7.280833
157,n,Shita Mekubetzet on Bava Metzia 65a:3,Vilna Ed,he," ליה אלא אמר ליה תן לי כמו ששוין פירותי בעת שתפרעני דמיהן ולא קץ כמה אלא בין יוקר ובין זול גם כן כתב ר""י אלברגלוני ז""ל. וטרשא דרב פפא כולם ז""ל מפרשים דהכי הוא שנותן לו כשער של אייר בין יוקר בין זול",aggresive-ngram,4.454229
158,--,"Commentary on Sefer Hamitzvot of Rasag, Laws of the Courts 31:2","Sefer Hamitzvot L'Rasag, Warsaw, 1914 -- vol. 3",he," מקומות בקרא הם נרדפים זה עם זה. כמו ילד יולד לנו בן נתן לנו (ישעי' ט' ה'). הבן יקיר לי אפרים אם ילד שעשועים (ירמיה ל""א י""ט). ועי' ויקרא רבה (פ""ב). וביוסף בהיותו בן שבע עשרה שנה כתיב הילד איננו (בראשית ל""ז ל'). וא""כ זהו כמעט כלישנא דקרא. אלא ששינה משום אות יוד של האלפא ביתא שבראשי החרוזים. וזה פשוט: 
",infreq,10.51576
159,n,Kitzur Shulkhan Aruch Yalkut Yosef 1:140:53,Kitzur Shulkhan Aruch Yalkut Yosef - Torat Emet 357,he,"בברכת אתה חונן יש שכתבו לומר ''חננו מאתך'' בלי אות וא''ו. וחילקו בזה בין מוצאי שבת, לשאר ימי החול. אולם בנוסח הרמב''ם, ובמחזור ויטרי, ובסדר רב עמרם גאון, ובסידור רבי יהודה בן יקר, הנוסח הוא ''וחננו",aggresive-ngram,3.6659822
160,n,Ritva on Sukkah 22a:8,"Chiddushei HaRashba, Sheva Shitot, Warsaw, 1883.",he,דאמרינן הכא אינו כענין ביניהן האמור במשנה שפירוש ביניהן האמור למעלה הוא בין קורה העליונה לקורה התחתונה והאי ביניהן דהכא פירושו בין קורות התחתונות וה״פ בד״א דאמרינן חבוט רמי כשיש בעליונות בגגן טפח ויש בין,aggresive-ngram,1.0985023
161,n,Korban Netanel on Sukkah 71:6,Vilna Edition,he," בוכנתו ופיטמתו פסול כדכתיבנא ובוכנתו פסול מטעם חסר ופסול א' כולל בוכנא ופיטמא ש""מ דתרוייהו מטעם חסר אך לפי' ה""ר יעקב בן יקר א""ל דס""ל מטעם הדר דהא קאמר ור""י בן אלעזר היה שונה במשנה במקום פטמתו בוכנתו לפי",aggresive-ngram,11.682337
162,n,Onkelos Exodus 18:18,Onkelos Exodus,he,מלאה תלאה אף את אף עמא הדין דעמך ארי יקיר מנך פתגמא לא תכול למעבדה בלחודך:,infreq,12.370035