Id,Relevance,Ref,Version,Lang,Content,Field,Score
74,n,Bava Kamma 65b:18,Wikisource Talmud Bavli,he,"איל בן יומו קרוי איל דכתיב (בראשית לא, לח) ואילי צאנך לא אכלתי אילים הוא דלא אכל כבשים אכל אלא לאו ש""מ איל בן יומו קרוי איל",aggresive-ngram,7.2016034
75,--,Jeremiah 31:20,Tanach with Nikkud,he,הבן יקיר לי אפרים אם ילד שעשעים כי־מדי דברי בו זכר אזכרנו עוד על־כן המו מעי לו רחם א‍רחמנו נאם־יהוה,hebmorph-standard,36.00588
76,--,Kitzur Shulkhan Aruch Yalkut Yosef 1:575:1,Kitzur Shulkhan Aruch Yalkut Yosef - Torat Emet 357,he,"ביום השני מתפללים כמו ביום הראשון, וקורין מ''והאלהים נסה את אברהם'', עד סוף הסדרא. והמפטיר קורא כמו אתמול. וההפטרה בירמיה, כה אמר ה' מצא חן במדבר, עד הבן יקיר לי אפרים. [ילקוט יוסף מועדים עמוד סב].
",hebmorph-standard,4.149476
77,--,Vayikra Rabbah 2:1,Daat Vayikra Rabbah,he,"דבר אל בני ישראל ואמרת אליהם אדם כי יקריב מכם קרבן לה' - זה שאמר הכתוב (ירמיה לא): הבן יקיר לי אפרים. עשרה נקראו יקרים ואלו הן: התורה, והנבואה, והתבונה, והדעת, והסכלות, והעושר, והצדיקים, ומיתתן של",hebmorph-standard,14.338463
78,n,Rashi on Genesis 31:38:2,On Your Way,he,"ואילי צאנך. מכאן אמרו איל בן יומו קרוי איל, שאם לא כן מה שבחו, אילים לא אכל אבל כבשים אכל, אם כן גזלן הוא:
",aggresive-ngram,6.881658
79,n,Rashi on Judges 6:25:1,On Your Way,he,"פר השור . פר הבחור , שהשור בן יומו קרוי שור : ",aggresive-ngram,8.48717
80,n,Bartenura on Mishnah Oholot 6:5:1,On Your Way,he,"טומאה בין הקורות. בין קורות התקרה שהנסרים עליהן והמעזיבה על גבן. ומתניתין כר׳ יהודה דאמר כל מעזיבה לעלייה. והשתא קאמר שאם היתה טומאה בקורות שתחת המעזיבה ומחיצה שהיא דקה כקליפת השום חוצצת בין הטומאה לבית שאין הטומאה נראית בבית, אם יש במקום הטומאה פותח טפח. היינו שיש חלל טפח במקום הטומאה:",aggresive-ngram,17.748178
81,--,Pesikta Rabbati 37:1,OYW,he,כבודו מפני [אומות] העולם בפני הפרסיים הרשעים אומר לו אפרים משיח צדקנו הוי דיין על אילו ועשה בהם מה שנפשך חפיצה שאלמלא רחמים שגברו עליך ביותר כבר איבדוך מן העולם ברגע אחד שנאמר הבן יקיר לי אפרים אם ילד,hebmorph-standard,4.742124
82,n,Ketubot 56a:3,Wikisource Talmud Bavli,he,יתיב רב חנינא קמיה דרבי ינאי וקאמר הלכה כרבי אלעזר בן עזריה אמר ליה פוק קרי קראך לברא אין הלכה כרבי אלעזר בן עזריה,aggresive-ngram,6.8085465
83,n,Onkelos Genesis 41:40,Onkelos Genesis,he,את תהי ממנא על ביתי ועל מימרך יתזן כל עמי לחוד כרסי מלכותא הדין איהי יקיר מנך,infreq,10.82378
84,n,"Bach, Orach Chaim 591:18:1","Tur Orach Chaim, Vilna, 1923",he," שנינו ומשלים בתורה ולדבריהם לא השלימו בתורה פי' שהרי בכל הסדורים שבידינו היום מסיים בפסוק הבן יקיר לי בזכרונות ובפסוק וה' אלהים בשופר יתקע בשופרות ולפי דבריהם הנך הויין השלמה ואע""ג דדיעבד אם השלימו",hebmorph-standard,14.965805
85,--,Kitzur Shulkhan Aruch Yalkut Yosef 1:564:6,Kitzur Shulkhan Aruch Yalkut Yosef - Torat Emet 357,he,"ביום השני של ראש השנה קוראים בתורה בפרשת וירא, ענין עקדת יצחק. והמפטיר קורא בפרשת פינחס, ובחודש השביעי באחד לחודש. ומפטיר בירמיה (לא, א) מצא חן במדבר, עד הבן יקיר לי אפרים.
",hebmorph-standard,4.149476
86,--,Metzudat David on Jeremiah 31:20:1,On Your Way,he,הבן יקיר. זהו מאמר המקום שאמר וכי אפרים הוא לי לבן יקיר וכי הוא לי לילד נחמד שאביו משעשע עמו אשר מתי שאני מדבר בו לא אפסוק מיד כי אם אזכרנו עוד זמן רב כדרך האב המדבר בבנו החביב לו שלא יפסוק מלזכרו עד זמן רב כי יתענג בזכרון שמו:,hebmorph-standard,27.642172
87,n,Berakhot 10b:3,William Davidson Edition - Aramaic,he,מאי קיר אמר רבי שמעון בן לקיש מקירות לבו שנאמר מעי מעי אוחילה קירות לבי וגו׳,infreq,10.904978
88,n,Tosafot Yom Tov on Mishnah Moed Katan 2:2:1,"Mishnah, ed. Romm, Vilna 1913",he,"וכן מי שהיה יינו וכו'. וצריכי דאי אשמועינן קמייתא בההיא קאמר רבי יוסי משום דמשחא [יקיר] ואיכא פסידא יתירא אבל חמרא דלא נפיש פסידא אימא מודי לר' יהודה ואי אשמועינן בתרייתא בההיא קאמר רבי יהודה וכו'. גמרא: 
",infreq,7.73841
89,n,Rashi on Exodus 7:14:1,On Your Way,he,"כבד. תרגומו יקיר, ולא אתיקר, מפני שהוא שם דבר, כמו (שמות יח יח) כי כבד ממך הדבר:
",infreq,11.194915
90,--,Chiddushei Ramban on Taanit 15a:1,"Chiddushei HaRamban, Jerusalem 1928-29",he,לאמר זכרתי לך חסד נעוריך אהבת כלולותיך לכתך אחרי במדבר בארץ לא זרועה. ונאמר וזכרתי את בריתי אותך בימי נעוריך והקימותי לך ברית עולם. ונאמר הבן יקיר לי אפרים אם ילד שעשועים כו' רחם ארחמנו נאום ה',hebmorph-standard,3.0072763
91,n,"Tur, Yoreh Deah 361:1","Yoreh Deah, Vilna, 1923",he," בין בשאר מלאכות ובשעת הוצאתו מבטלין מכל שאר מלאכות ובאין ללותו אפילו אי לא קרי ותני דלא מפלגינן בין קרי ותני אלא בביטול ת""ת אבל בשאר מלאכות אפילו לא קרי ותני הכל בטלים ובאין ללוותו ואם אין חבורות בעיר",aggresive-ngram,8.976407
92,--,Yalkut Shimoni on Nach 315:1,Yalkut Shimoni on Nach,he,"רחל מבכה על בניה, א""ר יצחק לפי שהדברים אמורים ברחל דכתיב אעבדך שבע שנים ברחל לפיכך נקרראו ישראל על שמה שנאמר רחל מבכה על בניה, ולא לשמה אלא לשם בנה שנאמר אולי יחנן ה' צבאות שארית יוסף, ולא לשם בנה אלא לשם בן בנה שנאמר הבן יקיר לי אפרים אם ילד שעשועים (כתוב ברמז צ""ו):",hebmorph-standard,3.368245
93,n,Targum of I Chronicles 11:25,Wikisource Aramaic Targum to Chronicles,he,"מן גבריא תלתא אגב תרין הא הוא יקיר ולתלת (ס""א ולתלת גבריא) לא מטא ומני יתיה דוד ריש מתיבתא על תלמידוי:
",infreq,9.286092
94,n,Targum Jonathan on II Samuel 6:22,Mikraot Gedolot,he,וזעירנא עוד מדא ואהי מכיך בעיני נפשי מבכן ועם אמהתא די את אמרת בעיניהון אהי יקיר:,infreq,12.668426
95,n,Targum of I Chronicles 11:21,Wikisource Aramaic Targum to Chronicles,he,"מן תלתא אגב תרין הוה יקיר והוה להון לרבנא ולתלת גבורן לא מטא:
",infreq,12.370035
96,n,Kli Yakar on Leviticus 1:1:2,On Your Way,he,"ובזה מיושב מה שפירש""י, ויקר לשון ארעי ולשון טומאה והיה די באחד מהם ליתן הבדל בין ויקר לויקרא אלא לפי שרש""י סובר ג""כ שנבואת משה היתה במקרה ולא בעצם מצד הכנתו, ולפי זה קשה לו למה לא נכתב ויקר בלא אלף",aggresive-ngram,8.26066
97,n,"Mishneh Torah, Defilement by a Corpse 24:8",Wikisource Mishneh Torah,he,טומאה שהיתה בין קורות הבית אפילו אין תחתיה אלא כקליפת השום הבית טהור ורואין את הטומאה כאילו היא רצוצה בארץ ומטמאה כנגדה בלבד ואם יש במקומה טפח על טפח הכל טמא וכן אם היתה נראית בתוך הבית בין כך ובין,aggresive-ngram,19.238625
98,n,Rashi on Daniel 2:11:1,On Your Way,he,יקירה . כבדה ומשאה כבד :,ngram,10.292069
99,n,Onkelos Exodus 6:12,Onkelos Exodus,he,ומליל משה קדם יי למימר הא בני ישראל לא קבילו מני ואכדין יקבל מני פרעה ואנא יקיר ממלל:,ngram,17.966679
100,n,Targum Jonathan on II Samuel 23:23,Mikraot Gedolot,he,מן גבריא יקיר ולתלת גבורן לא מטא ומנייה דוד על משמעתיה:,infreq,12.7941885
101,n,Yevamot 17a:3,William Davidson Edition - Aramaic,he,והאיכא בנות ואמר רבינא שמע מינה בן בתך הבא מן הגוי קרוי בנך גמירי דבנתא דההוא דרא איצטרויי אצטרו,aggresive-ngram,7.6912494
102,n,Tosafot Yom Tov on Mishnah Oholot 6:5:1,"Mishnah, ed. Romm, Vilna 1913",he,"טומאה בין הקורות. פי' הר""ב בין קורות התקרה כו' ומתניתין כר""י כו'. שא""א ליישב משנה זו כרבנן דהשתא במעזיבה עצמה מחציה ולמטה הבית טמא. כ""ש בין הקורות. כ""כ הר""ש. והרמב""ם מפרשה לרבנן. והקשה עליו הראב""ד",aggresive-ngram,7.2503996
103,--,"Beit Yosef, Orach Chaim 591:21:1","Tur Orach Chaim, Vilna, 1923",he,"ומ""ש ונהגו להפסיק בין שני פסוקים שבירמיה וכו' הב' פסוקים שבירמיה הם זכרתי לך חסד נעוריך והבן יקיר לי אפרים ומפסיקין ביניהם בפסוק וזכרתי אני את בריתי אותך בימי נעוריך כדי לסמוך זכירת ברית ימי נעוריך לזכירת חסד נעוריך: ",hebmorph-standard,25.181477
104,n,Aramaic Targum to Proverbs 27:3,Mikraot Gedolot,he,יקרא כיפא ונטול חלא ורוגזיה דשטיא יקיר מן תרויהון:,infreq,15.992735
105,n,"Shulchan Arukh, Yoreh De'ah 105:4",Wikisource Shulchan Aruch,he,במה דברים אמורים כשנפל לתוך התבשיל מפני שהרוטב מוליך פליטת האיסור ומערבו בכל התבשיל אבל איסור בין חם בין קר שנפל על הצלי שאצל האש אינו אוסר אלא כדי נטילה שהוא כעובי רוחב אצבע לפיכך ירך שצלאו בגידו או,aggresive-ngram,14.2363205
106,--,Devarim Rabbah 2:24,Daat Devarim Rabbah,he,": בני! אם חוזרים אתם לא אצל אביכם אתם חוזרים?! מנין? (שם לא) כי הייתי לישראל לאב וגו'. אמר רבי עזריה: א""ל הקב""ה לירמיהו: לך אמור להם לישראל: חייכם! איני כופר בכם, אתם אמרתם לי בסיני: ומעי המו עליו. אף אני כך אומר לכם. מנין? שנאמר (שם): הבן יקיר לי אפרים וגו':",hebmorph-standard,7.429863
107,n,Tosafot on Bava Kamma 65b:17:1,Vilna edition,he,איל בן יומו קרוי איל - מיהו ודאי לענין קרבן אמרינן דאיל בן שתי שנים מדכתיב במקום אחר כבש בן שנתו (ויקרא יב):,aggresive-ngram,6.8694086
108,--,Nefesh HaChaim 5:20:1,Nefesh HaChaim,he,והוא הבן יקיר מבני פלטרין דמלכא. מבני היכלא דמלכא אשר לו לבדו הרשות נתונה בכל עת לחפש בגנזי דמלכא קדישא. וכל השערים העליונים פתוחים לפניו. כמאמרם ז''ל (סוטה מ''ט א') כל העוסק בתורה מתוך דוחק כו' ר',hebmorph-standard,7.094192
109,--,Daat Zkenim on Genesis 41:52:1,daat zekenim,he,"קרא אפרים. על שם אבות אברהם ויצחק שנא' בהם אפר. אברהם 
שנאמר ואנכי עפר ואפר. יצחק כאפר על גבי המזבח דאפרים משמע שתי אפרות. ולכך נקראו ישראל 
על שם אפרים שנא' הבן יקיר לי אפרים: ",hebmorph-standard,24.201084
110,--,"Kessef Mishneh on Mishneh Torah, Prayer and the Priestly Blessing 13:10:1",Torat Emet 363,he,"בראש השנה קורין וכו'. גם זה שם בראש השנה בחדש השביעי ומפטירין הבן יקיר לי אפרים וי''א וה' פקד את שרה ומפטירין בחנה והאידנא דאיכא תרי יומי יומא קמא כי''א למחר והאלהים נסה ומפטירין הבן יקיר לי: 

",hebmorph-standard,33.53188
111,n,Malbim Beur Hamilot on Isaiah 41:22:1,On Your Way,he,"תקרינה.  המקרה הוא דבר הבלתי נתלה בשום סבה מן הסבות, או אשר לא נדע סבתו, וזה ההבדל בין קורות ובין מוצאות כמ''ש במק''א :
",aggresive-ngram,25.392658
112,--,Rif Megillah 10b:5,Vilna Edition,he," בר""ה ביו""ט הראשון וה' פקד את שרה ומפטירין בחנה וביום שני ויהי אחר הדברים האלה והאלהי' נסה את אברהם ומפטיר הבן יקיר לי אפרים ביוה""כ שחרית קוראין אחרי מות ומפטירין כי כה אמר רם ונשא במנחה בעריות ומפטיר ביונה בן אמתי:",hebmorph-standard,3.3107169
113,n,Kiddushin 68b:3,Wikisource Talmud Bavli,he,"א""ר יוחנן משום ר""ש בן יוחי  דאמר קרא (דברים ז, ד) כי יסיר את בנך מאחרי  בנך הבא מישראלית קרוי בנך ואין בנך הבא מן העובדת כוכבים קרוי בנך אלא בנה ",aggresive-ngram,6.884868
114,n,Aramaic Targum to Psalms 116:15,Mikraot Gedolot,he,יקיר קדם יי מיתותא דמשתלחא לחסידוי:,infreq,18.572184
115,n,Rashi on Bava Metzia 49a:12:1,Vilna Edition,he,לבן לוי - כל לוי קרוי בן לוי:,aggresive-ngram,9.972163
116,n,Yevamot 23a:11,William Davidson Edition - Aramaic,he,אמר רבי יוחנן משום רבי שמעון בן יוחי אמר קרא כי יסיר את בנך מאחרי בנך מישראלית קרוי בנך ואין בנך הבא מן הגויה קרוי בנך אלא בנה,aggresive-ngram,8.17572
117,n,"Bach, Orach Chaim 258:1:1","Tur Orach Chaim, Vilna, 1923",he," כמו אילו היה קר דג""כ אינו אסור אלא כשיכול להתבשל וא""כ ליפלוג במיניה וביה כשהעליון הוא חם בין בשיל כ""צ ובין בשיל כמאכל בן דרוסאי יש ליישב דניחא ליה למיפלג במיניה וביה בתבשיל שבישל כל צרכו בין קר לחם וקושיא זו ופירוקה אע""פ שעיקר מקומה בסימן שי""ח כתבתיה כאן לפי שנזכרה בדברינו ועודנה בפינו: ",aggresive-ngram,6.1503158
118,--,"Otzar Midrashim, Midrash on Hallel 'Sefer HaMa'asim' 6:3","Otzar Midrashim, New York, 1915",he,"יקר בעיני ה׳ המותה לחסידיו, עשרה דברים נקראו יקרים, התורה שנאמר יקרה הוא מפנינים, ישראל שנאמר הבן יקיר לי אפרים, עושר שנאמר הון אדם יקר חרוץ, דעת שנאמר וכלי יקר שפתי דעת, נבואה שנאמר ודבר ה׳ היה יקר",hebmorph-standard,6.0439396
119,n,Targum Jonathan on Exodus 18:18,Targum Jonathan on Exodus,he,מיתר תינתר אוף אנת אוף אהרן ובנוי וסביא דעמך ארום יקיר מינך פתגמא לא תיכול למעבדיה בלחודך,infreq,10.82378
120,--,Tosafot Yom Tov on Mishnah Megillah 3:5:1,"Mishnah, ed. Romm, Vilna 1913",he," תורה. ומ""ש ומפטירין בחבקוק שהוא מדבר במתן תורה אלוה מתימן יבא במתן תורה. רש""י. ומה שכתב ביו""ט שני בעקידה כדי שיזכור לנו עקידת יצחק היום במשפט. רש""י. ומ""ש מפטירין הבן יקיר לי. משום זכר אזכרנו רחם",hebmorph-standard,5.911827
121,--,"Sefer HaIkkarim, Maamar 3 37:20",Sefer Ha-'ikkarim,he,", בני בכורי ישראל, וכן בעבור שלפעמים יאהב האדם את הבן מצד השרות שהוא משרת לפניו כנער, אמר הכתוב כי נער ישראל ואהבהו, וגם לפי שלפעמים שתהיה אהבת האב את הבן מפני חשיבותו שהוא בן יקיר לו או מפני שהוא ילד",hebmorph-standard,3.368245
122,--,"Beit Yosef, Orach Chaim 601:2:1","Tur Orach Chaim, Vilna, 1923",he,"ומ""ש וקורין בפ' וירא מן והאלהים נסה וכו' ומפטיר מצא חן עד הבן יקיר לי אפרים בפ' בני העיר (לא.) ופירש הר""ן שקורין בעקידת יצחק כדי להזכיר ענין עקידת יצחק ואילו שבשביל כן תוקעין בשופר של איל ומפטירין",hebmorph-standard,10.60559
123,n,Targum Jonathan on Ezekiel 23:25,Mikraot Gedolot,he,ואתן פורענותי ביך ויתפרעון מניך ברגז רברביך ויקיריך יגלון ועמיך בחרבא יתקטלון אינון בנך ובנתך ישבון ושפר ארעיך יתוקד בנורא:,hebmorph-standard,7.8115535
124,n,Keritot 15a:4,Wikisource Talmud Bavli,he,דלמא לא היא עד כאן לא קאמר ר' יוחנן בן נורי הכא אלא משום שמות מוחלקין דמיקריא חמותו ומיקריא אם חמותו ומיקריא אם חמיו אבל גבי אותו ואת בנו דכולהו אותו ואת בנו מיקריין דאין שמות מוחלקין לא,hebmorph-standard,4.1383963
125,--,Midrash Mishlei 1:9,מדרש משלי - שלמה באבער,he,". (משלי א יג): ""כל הון יקר נמצא, נמלא בתינו שלל"" - זו מכירתו של יוסף, שהיה בן יקיר לאביו, שנאמר (בראשית לז ג): ""כי בן זקונים הוא לו"", נמצא מחיה לפניהם, דכתיב (בראשית מה ה): ""כי למחיה שלחני אלהים לפניכם",hebmorph-standard,8.360585
126,n,Onkelos Numbers 11:14,Onkelos Numbers,he,לית אנא יכיל בלחודי לסוברא ית כל עמא הדין ארי יקיר מני,infreq,12.381455
127,n,"Yad Ramah on Bava Batra, Perek 4, Comment 12 1",Yad Ramah on Bava Batra,he,". ורב יוסף אמר בדקא חלילא. והוא חלל עשוי סביבות כותלי הבית מאחוריו בין קירות הבית ובין קירות חיצונות שמקיפין אותו מסביב, והחלל שבנתים נקרא יציע כעין היציעים שהיו במקדש. ופעמים שאין עושין הקף זה אלא",aggresive-ngram,5.236969
128,--,"Prisha, Orach Chaim 591:3:1","Tur Orach Chaim, Vilna, 1923",he,בין ב' פסוקים שבירמיה כו' בפסוקי ירמיה הם זכרתי לך חסד נעוריך והבן יקיר לי אפרים ומפסיקין ביניהם בפסוק וזכרתי אני את בריתי אותך בימי נעוריך כדי לסמוך זכירת ברית ימי נעוריך לזכירת חסד נעורים:,hebmorph-standard,24.432459
129,--,Rashi on Megillah 31a:9:1,Vilna Edition,he,הבן יקיר לי אפרים - משום זכור אזכרנו רחם ארחמנו:,hebmorph-standard,48.40217
130,n,Aramaic Targum to Psalms 36:8,Mikraot Gedolot,he,כמה יקיר טובך יי ובני נשא בטלל שכנתך ישרון לרוחצן:,ngram,24.602251
131,n,Aramaic Targum to Psalms 49:9,Mikraot Gedolot,he,ויהי יקיר פורקניה ויפסוק בישותיה ופורענותא לעלם:,infreq,19.386528
132,n,"Shulchan Arukh, Orach Chayim 688:3",Wikisource Shulchan Aruch,he,"כפרים ועיירות גדולות, וכרכים שאינם מוקפים חומה מימות יהושע בן נון, קורים בי""ד.",aggresive-ngram,7.85982
133,--,Zohar 1:85a:10,Torat Emet Zohar,he," הצדיק קיימי, דעביד תולדות כעין כלהו) (ד''א ל''ג שבטים), ובגין כך אקרון ישראל על שמא דאפרים דכתיב, (ירמיה לא) הבן יקיר לי אפרים וגו'. 
",hebmorph-standard,18.968496
134,--,Megillah 31a:9,William Davidson Edition - Aramaic,he,בראש השנה בחדש השביעי ומפטירין הבן יקיר לי אפרים ויש אומרים וה׳ פקד את שרה ומפטירין בחנה,hebmorph-standard,40.781414
135,n,Onkelos Genesis 34:19,Onkelos Genesis,he,ולא אוחר עולימא למעבד פתגמא ארי אתרעי בבת יעקב והוא יקיר מכל בית אבוהי,infreq,12.381455
136,--,"Sefat Emet, Genesis, Bereshit 15:3","Sefat emet, Piotrków, 1905-1908",he,"אחז""ל עלה במחשבה לבראותה במדה""ד וראה שאין העולם מתקיים ושיתף מדה""ר. נראה לבאר שהתורה היא מדת הרחמים כמ""ש חז""ל בפ' הבן יקיר כו' מדי דברי בו די דברי שנתתי בו ואמרו מי שיש לו בן יגע בתורה מתמלא עליו",hebmorph-standard,2.9930613
137,n,Aruch HaShulchan 1:648:19,Wikisource,he,"וזה לשון הטור:ניטלה פיטמתו, והוא הפרח שבראשו לפירוש הרב רבי יעקב בן יקר – פסול. אבל ניטל עוקצו – כשר בכל עניין. ולפירוש הר""י הלוי: ניטלה פיטמתו – כשר בכל עניין. וניטלה עוקצו: אם ניטל מה שחוץ לגומא",aggresive-ngram,3.0667005
138,n,Aramaic Targum to Psalms 72:14,Mikraot Gedolot,he,מאונסא ומחטופין יפרוק נפשיהון ויהי יקיר אדמהון קדמוי:,infreq,15.992735
139,n,Malbim on Ezekiel 40:31:1,On Your Way,he," לפני שער הפנימי חמשים אמה עי' מה שפירשתי שם, והיה בין האולמות הדרומים ובן קיר החצר המזרחי חמש מאות, והיו יכולים לעמוד האולמות המזרחיים שנדבקו אצלם, ונוגעות קיר בקיר כי היה רחבם חמש אמות, ובצד השני נשאר עד השאר ט''ו אמות : ע''כ] : ",aggresive-ngram,6.214628
140,n,Targum Jonathan on Isaiah 22:24,Mikraot Gedolot,he,ויסתמכון עלוהי כל יקירי בית אבוהי בניא ובני בניא מרברביא ועד דעדקיא מכהניא לבשי אפודא ועד בני לוי אחדי נבליא:,hebmorph-standard,8.183952
141,--,Netzach Yisrael 2:9,Netzach Yisrael,he,", אלא על שם בנה ""הבן יקיר לי אפרים"" (שם שם יט). וזה המדרש יש לו טעם מופלג, כי האשה תקרא 'בית', כמו שאמר רבי יוסי (שבת קיח ע""ב) מעולם לא קראתי לאשתי 'אשתי', רק לאשתי 'ביתי'. ומפני כי רחל היא היתה עקרת",hebmorph-standard,8.276557
142,--,Rosh on Megillah 4:9:4,Vilna Edition,he," הראשון בחדש השלישי ומפטירין במרכבה וביום טוב שני שבעה שבועות ומפטירין בחבקוק. בר""ה ביום הראשון וה' פקד את שרה ומפטירין בחנה. ובשני והאלהים נסה את אברהם ומפטירין הבן יקיר לי אפרים. ביה""כ שחרית קורין אחרי",hebmorph-standard,9.092226
143,--,"Otzar Midrashim, Selection of Various Tales, The Story of Rabbi Shimon of Mainz 31","Otzar Midrashim, New York, 1915",he,"ויען ר' שמעון: ""בני יקירי! הסר הדאגה הזאת מלבך כי אנוס היית, ובעודך נער גונבת מאבותיך ומאמונתך.""",hebmorph-standard,5.9861226
144,--,Midrash Tanchuma 2:8:1,Tsel Midrash Tanchuma,he," כל תהלתך (תהלי' עא יד). ולא עוד אלא אדם הולך ולוה וממשכן עצמו ומשמח אותו היום. אמר רבי יודן, אימתי הבן חביב על אביו, כשמתחיל להשיח. וכן הוא אומר, הבן יקיר לי אפרים אם ילד שעשועים (ירמ' לא יט). מהו",hebmorph-standard,8.470379
145,n,Rashi on Yoma 66b:20:1,Vilna Edition,he,מתני' מיקירי ירושלים - מחשובי ירושלים:,ngram,8.840517
146,n,Ktav Yad Rashi on Menachot 91b:36:2,Wikisource Ktav Yad Rashi,he,"פלגס - כבש בן י""ג חדשים יצא מכלל כבש ולכלל איל לא בא דכבש בן שנה ואיל בן שתי שנים כשהוא בן י""ג חדשים ויום אחד שנכנס חדש בשנה שניה קרי ליה איל אבל בתוך חדש י""ג קרי ליה פלגס:",aggresive-ngram,7.250843
147,n,Chullin 18b:28,Wikisource Talmud Bavli,he,רבי שמעון בן לקיש אכשר בחודא דכובעא קרי עליה רבי יוחנן,aggresive-ngram,7.392078
148,--,"Mishneh Torah, Prayer and the Priestly Blessing 13:10",Wikisource Mishneh Torah,he,בראש השנה קורין בחדש השביעי באחד לחדש ומנהג פשוט שקורין ביום ראשון ויי' פקד את שרה ומפטירין ויהי איש אחד מן הרמתים ובשני קורין והאלהים נסה את אברהם ומפטירין הבן יקיר לי אפרים.,hebmorph-standard,26.97633
