Id,Relevance,Ref,Version,Lang,Content,Field,Score
159,--,"Sefat Emet, Numbers, Chukat 23:4","Sefat emet, Piotrków, 1905-1908",he," במד' ורש""י. שבכח זה השלימות שהמשיכו בנ""י הי' בכחם לקרב ושלחו דברי שלום. והרשעים מיאנו בדבר. וכמו כן איתא וישמע הכנעני שמע שמת אהרן ונסתלקו ענני הכבוד וסבר ניתן רשות להלחם בישראל. והכל ללמד על רשעת",original,0.9881568
160,n,Metzudat David on Psalms 143:1:2,On Your Way,he,"ענני בצדקתך. אם אין בידי זכות ענני בצדקתך:
",ngram,15.492613
161,--,"Rabbeinu Bahya, Bamidbar 33:40:1","Midrash Rabbeinu Bachya [ben Asher]. Warsaw, 1878",he,"וישמע הכנעני מלך ערד. סמך פרשה וישמע הכנעני למיתת אהרן, והוא שדרשו מה שמועה שמע, שמע שמת אהרן ונסתלקו ענני כבוד, וכיון שנסתלקו חשב שנתנה רשות להלחם בהם.
",aggresive-ngram,48.561504
162,--,"Bach, Orach Chaim 625:2:1","Tur Orach Chaim, Vilna, 1923",he," בלמען ידעו על הידיעה של יציאת מצרים ואח""כ הוקשה לו לפי זה אם כן היאך ימשך מישיבת הסוכה התכלית המכוון מן המצוה דהיינו שיזכרו יציאת מצרים ואמר והסוכות שאומר הכתוב שהושבנו בהם הם ענני הכבוד וכו' כלומר ודאי",original,4.292265
163,--,Ikar Tosafot Yom Tov on Pirkei Avot 5:4:2,On Your Way,he,"וזה היה לנוי ולתפארת ישראל. ובלא אוהל נמי תסגי להם בהבקעו לבד, דאין ספק דהענני כבוד לא סרו מהם. וכן נמי הנס החמישי נעשה לנוי:",aggresive-ngram,34.377922
164,n,Metzudat David on Psalms 22:2:1,On Your Way,he,אלי אלי. כפל המלה כדרך הקוראים והצועקים כמו ענני ה׳‎ ענני (מ״‎א י״‎ח):,original,6.39959
165,--,"Sefat Emet, Deuteronomy, Sukkot 2:6","Sefat emet, Piotrków, 1905-1908",he,"ג' רגלים בכל לבבך נפשך מאודך. בפסח נגאלו מיצה""ר. ושבועות הרגשה בנפש נפשי יצאה בדברו. ובסוכות מאודך צא מדירת קבע כמ""ש ז""ל שלא לסמוך על ממונו ובנינו רק לבטוח בהשי""ת. וכן חיבת ענני הכבוד הוא חיבה יתירה",original,1.7292744
166,--,"Sefat Emet, Leviticus, Passover 11:6","Sefat emet, Piotrków, 1905-1908",he," שהוא על גילוי ענני הכבוד שהסיב אותם בתחלת הליכתם מרעמסס לסוכות רמ""ש ואשא אתכם על כנפי נשרים. וקורא זאת גאולה כי הי' גאולה בעצם נפשותם שנתרוממו מתוך חשיכה לאורה. אכן לכאורה הי' משמע בפסוק בפ' בשלח כי",original,1.467913
167,n,Sanhedrin 98a:40,Wikisource Talmud Bavli,he,זכו עם ענני שמיא לא זכו עני רוכב על חמור,original,6.3472486
168,n,Ibn Ezra on Exodus 24:17:1,Ibn Ezra on Exodus -- Torah Emet,he,ומראה. הנה ההר כולו מכוסה ענן. ובראשו הכבוד ששם השם הנכבד היה נראה כאש אוכלת:,infreq,16.813665
169,--,Ibn Ezra on Numbers 11:17:1,On Your Way,he,וירדתי. הכבוד ירד באש בתוך הענן,infreq,24.229752
170,--,"Sefat Emet, Numbers, Chukat 15:4","Sefat emet, Piotrków, 1905-1908",he,"בפסוק וישמע הכנעני דרשו חז""ל שמע שמת אהרן ונסתלקו ענני הכבוד וניתן רשות להלחם כו'. מה שיחסו מלחמות אלו בכחו של אהרן. דכתיב ואשים דברי בפיך כו'. והם ב' המתנות שני שדיך משה רבינו ע""ה ואהרן הכהן. דברי",original,0.97860867
171,n,Malbim on Psalms 29:3:5,On Your Way,he,אל הכבוד הוא,aggresive-ngram,11.056459
172,--,Haamek Davar on Genesis 22:2:3,"Sefer Torat Elohim, Vilna 1879",he,אשר אמר אליך. לא אמר בפי׳ אלא ממה שראה והבין שהוא ההר ע״י מראה ענן וכבוד ה׳ הוא מאמר ה׳ והכי מתבאר להלן כ״ד נ״א ובכ״מ:,hebmorph-standard,29.584007
173,--,"Sefat Emet, Numbers, Pinchas 3:2","Sefat emet, Piotrków, 1905-1908",he," וקטרוג יכול לבטל זה כמ""ש אם יתן איש כו' בוז יבוזו לו. וכ' על כל פשעים תכסה אהבה. וזה ניתן לאהרן הכהן במתנה שיהי' תמיד דבוק באהבה זו ויכול לעורר תמיד אהבה שבינו ית' לשראל. לכן ענני הכבוד בזכות אהרן שע""י",original,0.99241877
174,--,"Sefat Emet, Numbers, Sh'lach 14:2","Sefat emet, Piotrków, 1905-1908",he," כי נשאר הארה מאלה הג' מתנות. וחלה ונסכים הוא זכר ממן ובאר. וציצית בחי' החסד ענני הכבוד. וכ' בציצית לדורותם שזה נשאר גם לנו בגלות [וי""ל ע""י שהיא בחי' החסד נשאר לעולם. וי""ל דלכך התכלת שהיא התקשרות למתק",original,0.8619158
175,--,Mekhilta d'Rabbi Yishmael 13:19:3,Mekhilta -- Wikisource,he,"רבי נתן אומר בקיפוסולין של מצרים היה קבור יוסף. ללמדך שבמדה שהאדם מודד בה מודדים לו: מרים המתינה למשה שעה אחת, שנאמר (שמות ב) ""ותתצב אחותו מרחוק לדעה"", והמקום עכב לה במדבר הארון והשכינה, והכהנים והלויים, וכל ישראל - שבעת ימים עם ענני כבוד; שנאמר (במדבר יב) ""והעם לא נסע עד האסף מרים"".",aggresive-ngram,32.832127
176,--,"Shney Luchot HaBrit, Bamidbar, Torah Ohr 90",Shney Luchot Habrit by Rabbi Eliyahu Munk,en,". Whenever G'd wanted the camps to move, the columns of cloud containing the letters would rise from the ark, and the four ענני הכבוד, clouds depicting the Presence of G'd's glory on which the letters א-י-י, ב-צ-ע, ר-ח-ק, מ-ק-ב, were inscribed would start moving. So far the Tziyoni.",original,8.358161
177,n,Ibn Ezra on Habakkuk 3:5:1,Ibn Ezra on Habakkuk -- Daat,he,לפניו - לפני הכבוד או הארון ששם הכבוד.,ngram,14.497376
178,--,"Rabbeinu Bahya, Bamidbar 23:8:1","Midrash Rabbeinu Bachya [ben Asher]. Warsaw, 1878",he,"מה אקוב לא קבה אל. אף כשהיו ראויין לקללה במעשה העגל לא זז מלחבבן לא פסקו ענני כבוד והמן והבאר, וכן כתוב בעזרא (נחמיה ט) אף כי עשו להם עגל מסכה ויאמרו זה אלהיך אשר העלך מארץ מצרים ויעשו נאצות גדולות",aggresive-ngram,28.360338
179,n,Malbim on Psalms 4:2:2,On Your Way,he,ענני מפני שלשה דברים א. מצד שאתה,original,6.7927737
180,n,Psalms 118:5,Tanach with Text Only,he,מן־המצר קראתי יה ענני במרחב יה,ngram,18.296669
181,n,Psalms 86:1,Tanach with Text Only,he,תפלה לדוד הטה־יהוה אזנך ענני כי־עני ואביון אני,original,6.4751415
182,--,Kochvei Ohr 1:3,אור יאיר - דרוש לסוכות,he,"בדף י""א תניא כי בסוכות הושבתי את בני ישראל, ענני הכבוד היו דברי ר""א, ר""ע אומר סוכות ממש עשו להם. הנה לדון בשכל פשוט נראים דברי ר""ע צודקים שהוא מפרש את המלה כפשוטה סוכה ממש, ור""א מוציא את המלה מפשוטה",original,2.0994365
183,--,Ritva on Rosh Hashanah 3a:1,"Chiddushei HaRitva, Konigsberg, 1858.",he,וישמע הכנעני וכו'. פי׳ בתוס׳ דתרי קראי נינהו חד בפ׳ חקת דכתיב וישמע כו׳ ולא דרשינן ההוא קרא דהתם כתיב דשמע כי בא ישראל ואידך קרא דרשינן דכתיב בפ׳ מסעי וישמע וכו׳ דההוא קרא לא כתיב מה שמועה שמע ועל כרחיך הוא מיתת אהרן לעיל מיניה הוא דשמע שמת אהרן ונסתלקו ענני הכבוד:,aggresive-ngram,32.00162
184,n,Malbim on Psalms 69:18:3,On Your Way,he,"שצר לי מהר ענני מבלי עיכוב :
",original,6.9584928
185,--,"Sefat Emet, Numbers, Chukat 11:5","Sefat emet, Piotrków, 1905-1908",he,"בפסוק ויראו כל העדה כי גוע אהרן ודרשו חז""ל וייראו כדר""ל מה שמע הכנעני שמת אהרן ונסתלקו ענני הכבוד וסבר שניתן רשות להלחם בישראל. נראה כי העננים היו שמירה לבנ""י דהג' מתנות שנתן לנו הקב""ה מן בזכות משה",original,1.218933