Id,Relevance,Ref,Version,Lang,Content,Field,Score
76,--,Gur Aryeh on Shemot 16:7:1,OYW,he,"לא על הכבוד הנראה הוא. שלא היה הכבוד נראה בבוקר של מחרת רק באותו יום שנאמר (פסוק י) ""ויהי כדבר אהרן אל כל עדת וגומר [והנה כבוד ה' נראה בענן]"":",hebmorph-standard,10.529593
77,n,Ibn Ezra on Psalms 118:21:1,Ibn Ezra on Psalms -- Daat,he,אודך כי עניתני - כנגד ענני במרחב יה.,original,6.992016
78,n,Malbim on Psalms 72:11:1,On Your Way,he,"וישתחוו,  ג. רוב הכבוד ",aggresive-ngram,11.056459
79,--,Gur Aryeh on Bamidbar 21:1:1,OYW,he,"שמע שנסתלקו ענני הכבוד. דכפשוטו אין לפרש, דאם כן לא הוי למכתב לשון ""וישמע"", דזה הלשון משמע ששמע שמועה שהיה דבר חידוש, אבל מה שישראל באו דרך האתרים - אין זה דבר חידוש שיאמר, דבודאי ידע לפני זה כי",aggresive-ngram,32.374336
80,--,Ibn Ezra on Numbers 12:9:1,On Your Way,he,וילך. הכבוד והעד והענן סר,infreq,28.268044
81,--,"Shulchan Arukh, Orach Chayim 625:1",Torat Emet 363,he,"בסכות תשבו שבעת ימים וגו' כי בסכות הושבתי את בני ישראל הם ענני כבוד שהקיפם בהם לבל יכם שרב ושמש  ומצוה   לתקן הסכה מיד לאחר יום כפור, דמצוה הבאה לידו אל יחמיצנה  (מהרי''ל).  
",aggresive-ngram,51.9255
82,n,Psalms 13:4,Tanach with Ta'amei Hamikra,he,הביטה ענני יהוה אלהי האירה עיני פן־אישן המות,original,6.533422
83,--,Exodus 40:35,Tanach with Ta'amei Hamikra,he,ולא־יכל משה לבוא אל־אהל מועד כי־שכן עליו הענן וכבוד יהוה מלא את־המשכן,hebmorph-standard,47.919342
84,--,"Siddur, Sefard 3:7:24",Torat Emet 357,he," ענני כבוד אומרים אף ברי יטריח עב יפיץ ענן אורו: (איוב לז יא) 
",aggresive-ngram,64.254845
85,n,Shabbat 64b:14,William Davidson Edition - Aramaic,he,תנן בכבול ובפאה נכרית לחצר בשלמא לרב ניחא אלא לרבי ענני בר ששון קשיא רבי ענני בר ששון משמיה דמאן קאמר ליה משמיה דרבי ישמעאל בר יוסי רבי ישמעאל בר יוסי תנא הוא ופליג,ngram,15.9489355
86,--,Shir HaShirim Rabbah 4:5:2,Daat Shir Hashirim Rabbah,he,".   המן בזכות משה.  הבאר בזכות מרים.  בזכות אהרן ענני הכבוד.  מתה מרים ופסקה הבאר והיו אומרין: לא מקום זרע ותאנה וחזרה. בזכות משה ואהרן.  מת אהרן נסתלקו ענני הכבוד, הדא הוא דכתיב (במדבר כ') ויראו כל",aggresive-ngram,30.297863
87,--,"Rabbeinu Bahya, Vayikra 23:43:1","Midrash Rabbeinu Bachya [ben Asher]. Warsaw, 1878",he,"כי בסכות הושבתי את בני ישראל. יש מרז""ל שאמרו סכות ממש עשו להם, ויש שאמר ענני כבוד. דעת האומר סכות ממש עשו להם, מפני זה נצטוינו לעשות סכות דוגמתן כדי שיתגלה ויתפרסם מתוך מצות הסכות גודל מעלתן של ישראל",aggresive-ngram,34.07628
88,--,Zohar 1:47a:68,Torat Emet Zohar,he," חפיין על ישראל כסוכה ובגין כך כולהו ענני כבוד אזלין עם ישראל במדברא בזכותא דאהרן בגין כך י''ד אמרין בכל יומא. 
",aggresive-ngram,32.127422
89,--,"Tur HaAroch, Exodus 16:7:1","Tur on the Torah, trans. Eliyahu Munk",en," ובוקר וראיתם את כבוד ה', “and in the morning you will see the glory of Hashem.” This verse does not refer to the manifestation of G’d’s glory in the shape of the ענני הכבוד the clouds of glory",original,3.5442522
90,--,"Sefat Emet, Numbers, Korach 25:3","Sefat emet, Piotrków, 1905-1908",he," ולפנים בחי' התשובה והוא בחי' נשמה. וע""ז אמרו במקום שבע""ת [*עומדין] אין צדיקים גמורים יכולין לעמוד. וגדולה תשובה שמגעת עד כסא הכבוד. לכן ענני הכבוד בזכות אהרן. ובזה יובן מחלוקת קרח שעשה טלית שכולה",original,0.73135984
91,n,Psalms 24:9,Tanach with Nikkud,he,שאו שערים ראשיכם ושאו פתחי עולם ויבא מלך הכבוד,aggresive-ngram,9.062449
92,n,Psalms 24:7,Tanach with Text Only,he,שאו שערים ראשיכם והנשאו פתחי עולם ויבוא מלך הכבוד,aggresive-ngram,9.826922
93,--,"Derech Hashem, Part Four, On Seasonal Commandments 2",Handwritten Manuscript EH 47 C 32. 1896.,he,ענין הסוכה והלולב הוא כי הנה ענני הכבוד שהקיף הקב״ה את ישראל מלבד תועלתם בגשמיות שהיה לסכך עליהם ולהגן בעדם עוד היתה תולדה גדולה נולדת בהם בדרכי הרוחניות. והוא כמו שע״י העננים ההם היו נמצאים ישראל,original,5.6708035
94,--,Netzach Yisrael 55:6,Netzach Yisrael,he,"וענני כבוד היו על ידי אהרן. כבר אמרנו לך כי על ידי אהרן היה החבור של הקב""ה עם ישראל, כמו שתמצא בכל מקום כאשר היה נגלה השכינה בתחתונים - היה על ידי ענני כבוד; ""וירא ה' בעמוד ענן"" (ר' דברים לא, טו), וזה תמיד. ""ויהי ביום השלישי בהיות הבוקר ויהי קולות וברקים וענן כבד"" (שמות יט, יז). וגם כן בכל מקום שהיה גלוי שכינתו",aggresive-ngram,29.510921
95,--,Netzach Yisrael 55:4,Netzach Yisrael,he," בזכות משה. מתה מרים - נסתלק הבאר, דכתיב (במדבר כ, א) ""ותמת שם מרים"", וכתיב בתריה (שם שם ב) ""ולא היה מים לעדה"", וחזרה בזכות שניהם. מת אהרן - נסתלקו ענני כבוד, שנאמר (במדבר כא, א) ""וישמע הכנעני מלך ערד"", מה",aggresive-ngram,28.554022
96,--,Rashi on Numbers 33:40:1,On Your Way,he,"וישמע הכנעני. כאן למדך שמיתת אהרן היא השמועה, שנסתלקו ענני הכבוד וכסבור שנתנה רשות להלחם בישראל, לפיכך חזר וכתבה:
",aggresive-ngram,57.889713
97,--,Tanna Debei Eliyahu Rabbah 12:1,OYW (segmentation according to Warsaw 1880),he," ישראל את שבעה ענני הכבוד לישב תחתיהם במדבר ארבעים שנה. ובשכר הפת לחם שהאכיל אברהם אבינו למלאכי השרת נתן הקב""ה לישראל את המן במדבר ארבעים שנה. ברוך המקום ברוך הוא שאין לפניו משוא פנים כשם שעשה אברהם אבינו",original,3.2240121
98,n,Shabbat 64b:13,William Davidson Edition - Aramaic,he,רבי ענני בר ששון משמיה דרבי ישמעאל אמר הכל ככבול,ngram,23.174072
99,--,Perek Shirah 2:7,Torat Emet 357,he,"[ענני כבוד] אומרים . אף ברי יטריח עב יפיץ ענן אורו: (איוב לז יא)
",aggresive-ngram,64.74867
100,n,Ikar Tosafot Yom Tov on Mishnah Taanit 2:4:6,On Your Way,he,אליהו כו' מעין אשא עיני אל ההרים דכתיב באליהו ענני ה' ענני דהיינו תפלה. רש''י:,original,6.5605297
101,n,Psalms 4:2,Tanach with Nikkud,he,בקראי ענני אלהי צדקי בצר הרחבת לי חנני ושמע תפלתי,ngram,14.657476
102,n,Metzudat David on Psalms 66:2:1,On Your Way,he,כבוד שמו. כפי הכבוד הראוי לשמו:,aggresive-ngram,9.036861
103,--,"Mei HaShiloach, Volume I, Numbers, Chukat 5","Mei HaShiloach; Publication of Sifrei Izhbitza Radzin, Bnei Brak 2005.",he," שהיתה מפורשת להם והיו הולכים כמו שהבינו מענני הכבוד, אך בעת שנסתלקו ענני הכבוד, אז התחילו להתנהג עצמם עפ""י כללים מד""ת וכמו שעתה בזמן שבהמ""ק חרב אין לו להקב""ה אלא ד' אמות של הלכה בלבד (ברכות ח'.), ואז",original,4.253103
104,--,Kitzur Shulkhan Aruch Yalkut Yosef 1:617:1,Kitzur Shulkhan Aruch Yalkut Yosef - Torat Emet 357,he,"נאמר בתורה (ויקרא כג מב): בסוכות תשבו שבעת ימים כל האזרח בישראל ישבו בסוכות, למען ידעו דורותיכם כי בסוכות הושבתי את בני ישראל בהוציאי אותם מארץ מצרים. ופירשו חז''ל: שהם ענני כבוד שהקיפם הקב''ה לבל",aggresive-ngram,29.510921
105,--,Jerusalem Talmud Yoma 2a:1,Mechon Mamre Talmud Yerushalmi,he,מת אהרן והלא בהר ההר מת הדא הוא דכתיב (במדבר לג) ויעל אהרן הכהן אל הר ההר על פי ה' וימת שם אלא מכיון שמת אהרן נסתלקו ענני הכבוד ובקשו הכנענים להתגרות בם הדא הוא דכתיב (במדבר כא) וישמע הכנעני מלך ערד יושב הנגד כי בא ישראל דרך האתרים וילחם בישראל מהו דרך האתרים כי מת,original,4.940644
106,n,Metzudat David on Psalms 4:2:1,On Your Way,he,בקראי. בעת אקרא לך ענני:,ngram,15.3369055
107,n,Kitzur Baal Haturim on Genesis 32:25:1,On Your Way,he,ויאבק בגימטריא כסא הכבוד מלמד שהעלו האבק עד כסא הכבוד:,aggresive-ngram,9.847895
108,n,Rashi on Taanit 17a:3:1,Vilna Edition,he,גבי אליהו - במעשה דהר הכרמל כתיב תפלה דכתיב ענני ה' ענני דמשמע לשון בקשה ותפלה ולא לשון צעקה ומשני ענני ה' ענני לשון צעקה הוא כך שמעתי:,original,6.7927737
109,n,Chidushei Agadot on Berakhot 6b:18,Vilna Edition,he,ענני  ה' ענני כו' ענני שלא יאמרו מעשה כשפים כו'. כמו שמסיים ענני וידעו העם הזה כי אתה הוא ה' אלהים וגו':,original,6.9584928
110,--,"Chizkuni, Leviticus 23:42:1",Chizkuni,he,המצות ונאמר חמשה עשר בחג הסוכות מה להלן לילה הראשון חובה מכאן ואילך רשות אף כאן.בסכת תשבו שבעת ימים כנגד ענני הכבוד.,aggresive-ngram,32.127422
111,--,Rashi on Numbers 14:10:2,Pentateuch with Rashi's commentary by M. Rosenbaum and A.M. Silbermann,he,וכבוד ה'. הענן ירד שׁם:,infreq,15.015162
112,n,Malbim on II Samuel 23:23:1,On Your Way,he,והיה נכבד מצד הכבוד,aggresive-ngram,12.049148
113,--,Rashi on Yevamot 72a:2:2,Vilna Edition,he,ואיבעית אימא - משום הכי לא נשבה כי היכי דלא ניבדרו ענני כבוד שהיו מקיפין ולא היתה חמה יכולה ליכנס:,aggresive-ngram,56.655087
114,--,Ramban on Leviticus 23:43:1,On Your Way,he,"כי בסכות הושבתי את בני ישראל ענני כבוד לשון רש""י והוא הנכון בעיני על דרך הפשט כי צוה שידעו הדורות את כל מעשי ה' הגדול אשר עשה עמהם להפליא ששכן אותם בענני כבודו כסוכה כענין שנאמר (ישעיה ד ה ו) וברא ה'",aggresive-ngram,39.380623
115,--,"Siftei Hakhamim, Numbers 21:1:3",Siftei Hakhamim,he,"ד פירוש והוא הארון כלומר כיון שראו שנסתלקו ענני כבוד ולא היה להם כי אם ארון הקודש שנוסע לפניהם משום הכי בא להלחם מה שלא עשה קודם לכן הרא""ם. והוצרך לטעם של דבר אחר כי לטעם הראשון קשה למה כתוב דרך",aggresive-ngram,33.942844
116,--,Gur Aryeh on Bamidbar 21:4:1,OYW,he,"שבע מסעות. פירוש, (כו') מפני כי במוסרה עמדו עליהם בני לוי והרגום מפני שחזרו לאחוריהם (רש""י דברים י, ו), והוצרך לישראל לשוב לפנים ולא לאחור, ומאחר שהוצרכו לשוב, הספידו את אהרן כאילו שם מת, שהוא גרם להם החזרה ההיא, שבמיתתו נסתלקו ענני הכבוד (שם) :",aggresive-ngram,32.411816
117,n,Rashi on Taanit 23b:7:3,Vilna Edition,he,אי נמי - אהכי קדים ענני דידה:,original,6.7927737
118,--,Rashi on Sukkah 11b:14:1,Vilna Edition,he,ואד יעלה מן הארץ - שמע מינה עננים גידולי קרקע נינהו וסוכה מעננים ילפינן שהרי זכר לענני כבוד הוא כדכתיב כי בסוכות הושבתי ומתרגמינן ארי במטלות ענניי:,aggresive-ngram,34.33817
119,--,Malbim on Ezekiel 10:4:3,On Your Way,he,"וימלא הבית את הענן,  שהכבוד נסע אל הבית כנוסע מקה''ק לחוץ, ",hebmorph-standard,39.011116
120,n,Malbim on I Samuel 15:30:3,On Your Way,he,"ושוב עמי והשתחויתי מפני הכבוד :
",aggresive-ngram,9.674402
121,n,Metzudat David on I Kings 2:30:3,On Your Way,he,"וכה ענני. כפל הדבר במילות שונות:
",original,6.992016
122,--,"Sefat Emet, Numbers, Chukat 22:2","Sefat emet, Piotrków, 1905-1908",he," הארץ לפניהם בבחי' מנוחה ושלום. וזה ג""כ הענין שדרשו חז""ל וישמע הכנעני שמע שמת אהרן ונסתלקו ענני הכבוד וסבר שניתן רשות להלחם בישראל. והנה הפסוק מסיים כי בא ישראל דרך האתרים. רק הכל ענין אחד כשהי' אהרן",original,1.3974648
123,n,Rashi on Bava Kamma 49b:9:1,Vilna Edition,he,עני מורי - ענני אדוני:,ngram,17.527891
124,--,Aruch HaShulchan 1:625:2,Wikisource,he,"ותניא (סוכה יא ב): ""כי בסוכות הושבתי את בני ישראל"" – ענני כבוד היו, דברי רבי אליעזר. רבי עקיבא אומר: סוכות ממש עשו להם.והנה לדברי רבי אליעזר – וודאי דשייך לעשות זכרון לדבר הגדול הזה, שהקיפן בענני",aggresive-ngram,35.04625
125,--,Haamek Davar on Numbers 10:34:1,"Sefer Torat Elohim, Vilna 1879",he,"וענן ה׳ וגו׳. כי בהיותם יושבים במחנה היו באהלים להגין מן השרב. אבל בנסעם מן המחנה הי׳ הענן מגין. נמצא מש״כ כי בסוכות הושבתי את ב״י וגו׳ הי׳ גם סוכות ממש גם ענני כבוד. היינו בשעת חניה הי׳ סכות ממש. ובשעת המסע הי׳ ענני כבוד. וע״ע מש״כ בס׳ ויקרא כ״ג מ״ג בא״א:
",aggresive-ngram,45.43504
126,--,"Zohar Chadash, Bereshit 609",Zohar Chadash,he,"מתה מרים, פסקה הבאר. מת אהרן, ניטלו ענני כבוד. הדא הוא דכתיב. (שם כ) ויראו כל העדה. אל תקרי ויראו אלא וייראו. מתה מרים פסקה הבאר, מנא לן. דכתיב (שם) וישב העם בקדש ותמת שם מרים. וכתיב בתריה ולא היה",aggresive-ngram,28.360338
127,--,"Zohar Chadash, Bereshit 608",Zohar Chadash,he,"פתח ההוא ינוקא פומיה ואמר, (במדבר כא) באר חפרוה שרים כרוה נדיבי העם במחוקק במשענותם. תאנא, שלש מתנות טובות נתן הקדוש ברוך הוא לישראל, על ידי שלשה רועים אחים, משה, אהרן, ומרים. בזכות משה, היה המן יורד לישראל. בזכות אהרן, היו ענני כבוד הולכים עם ישראל. בזכות מרים, היתה הבאר הולכת עמהם. ",aggresive-ngram,32.305187
128,n,Malbim on Psalms 13:4:3,On Your Way,he,וענני,ngram,16.449263
129,n,Rashi on Menachot 17a:17:1,Wikisource Rashi,he,עני מרי - ענני אדוני:,ngram,17.419842
130,--,"Sefat Emet, Numbers, Balak 9:2","Sefat emet, Piotrków, 1905-1908",he," תרביץ בצהרים כו' כי משה רבינו אמרו ע""ש והרמז כנ""ל כי הנהגתם הי' במדבר להיות תחת צל ענני הכבוד אבל כשיהיו בין האומות איכה תרביץ כדפרש""י שם בשיה""ש. והשיבו צאי לך בעקבי הצאן. פי' שזו ההנהגה ירושה היא",original,0.8683664
131,n,Metzudat Zion on I Kings 2:30:1,On Your Way,he,"ענני. מלשון עניה ותשובה:
",ngram,17.783495
132,--,Shmonah Kvatzim 7:166:1,Rav Kook public files,he,"חסד של אברהם הוא כולל את כל באי עולם, וחסד של אהרן הוא מרוכז בישראל, ומי שמתדבק במדת החסד לאמתו, באור תורה, צריך שיחבר את שני ענני הכבוד הללו של אברהם ושל אהרן ביחד, ויאירו עליו שני האורות. ואז יאמר",original,1.2232609
133,--,Rashi on Numbers 20:29:3,Pentateuch with Rashi's commentary by M. Rosenbaum and A.M. Silbermann,he," כי גוע. אוֹמר אני שׁהמתרגּם דּהא מית טוֹעה הוּא, אלּא אם כּן מתרגּם ויּראוּ ואתחזיאוּ, שׁלּא אמרוּ רבּוֹתינוּ כּי זה משׁמּשׁ בּלשׁוֹן דּהא אלּא על מדרשׁ שׁנּסתּלּקוּ ענני הכבוֹד, וכדאמר רבּי אבהוּ (ראש השנה ג'), אל תּקרי ויּראוּ, אלּא ויּראוּ, ועל לשׁוֹן זה נוֹפל לשׁוֹן דּהא, לפי שׁהיא נתינת טעם למה שּׁלּמעלה הימנּוּ — למּה",original,8.530426
134,n,Metzudat David on Proverbs 3:35:1,On Your Way,he,ינחלו. נוחלים לעצמם הכבוד:,aggresive-ngram,11.0825405
135,n,Metzudat Zion on I Samuel 2:30:2,On Your Way,he,"יקלו. הוא הפך הכבוד:
",aggresive-ngram,11.141622
136,--,"Sefat Emet, Numbers, Balak 11:2","Sefat emet, Piotrków, 1905-1908",he," ומפסידין לכל. ואח""כ הודה בלעם האמת דכ' וירא כו' שוכן לשבטיו עי""ז ותהי עליו רוח אלקים הוא כנ""ל שראו שכשבנ""י מתאספין ומקבלין ההארות מאיר גם להם. לכן בחג הסוכות שהוא בחי' ענני הכבוד דג' מתנות נתן הקב""ה. מן",original,0.8562826
137,n,Rashi on Berakhot 59a:7:5,Vilna Edition,he,מנהמי ענני - הומות העננים:,ngram,20.826595
138,--,Mekhilta DeRabbi Shimon Bar Yochai 13:19,"Mechilta de-Rabbi Simon b. Jochai, Dr. D. Hoffman, Frankfurt 1905",he," ויסעו מסכות  ר' עקיבה אומר אין סכות אלא ענני כבוד שנאמר (ישעיה ד' ה') כי על כל כבוד חפה, וכן לעתיד לבוא וסוכה תהיה לצל יומם מחורב (שם ד' ו'):  ד""א ויסעו מסכות כו' שלש מסעות נסעו ישראל עד שלא הגיעו לים :",aggresive-ngram,37.559868
139,--,Rashi on Isaiah 3:8:3,On Your Way,he,"למרות עיני כבודו . להקניט לפני כבודו ד""א עניני כבודו :
",aggresive-ngram,57.29654
140,n,Ibn Ezra on Proverbs 4:8:2,Ibn Ezra on Proverbs -- Daat,he,תכבדך - תשימך במעלת הכבוד.,aggresive-ngram,11.980625
141,--,"Derech Hashem, Part Four, On Divine Service and the Calendar 6",Handwritten Manuscript EH 47 C 32. 1896.,he,הוקבע שבשוב תקופת הזמן ההוא יאיר עלינו אור מעין האור שהאיר אז ותחודש בנו תולדת אותו התיקון וע״כ נתחייב באותם הענינים כלם. ועד״ז חג השבועות למתן התורה וחג הסוכות לענין ענני הכבוד אעפ״י שאינו אותו הזמן,original,1.2371049
142,--,"Sefat Emet, Deuteronomy, Sukkot 26:4","Sefat emet, Piotrków, 1905-1908",he,סוכות עמוד השלום ענני הכבוד בזכות אהרן. ואיתא אוהב שלום ורודף שלום כו'. הם ב' מיני שלימות דכתיב שלום שלום לרחוק ולקרוב. והם בחי' הסוכה והלולב. בלולב כתיב ולקחתם לכם שנעשין אגודה אחת בכח עצמותם. וסוכה,original,1.218933
143,--,Zohar 3:255b:4,Torat Emet Zohar,he,"ובגין ז' ספיראן אמר קרא, (ויקרא כג) כי בסכות הושבתי את בני ישראל, במפקנותהון מארעא דמצרים, בז' ענני כבוד. סוכה (אית באת ו', בסוכות חסר ו', דאתמר בה בסכת תשבו שבעת ימים, איהי אימא אבל סוכה) באת ו'",aggresive-ngram,32.00162
144,--,Gur Aryeh on Vayikra 23:43:1,OYW,he,"ענני כבוד. בפרק קמא דסוכה (סוף יא ע""ב), כרבי עקיבא:",aggresive-ngram,80.76297
145,--,"Sefat Emet, Deuteronomy, Sukkot 14:10","Sefat emet, Piotrków, 1905-1908",he," הבריאה יש זה הקטרוג. וזה המשפט שצריכין לברר שכדאי התחתונים לזה. מה אנוש כי תזכרנו כו' הוא ביום הזכרון. ותחסרהו מעט מאלקים הוא ביוהכ""פ שנדמין למלאכים. וכבוד והדר תעטרהו הוא בסוכות ענני הכבוד ופרי עץ הדר",original,0.97860867
146,--,Ibn Ezra on Exodus 16:10:1,Ibn Ezra on Exodus -- Torah Emet,he,ויהי. התברר להם כי בעת שדבר להם קרבו. מיד בא הענן ונראה בו הכבוד:,infreq,16.153168
147,--,"Rabbeinu Bahya, Devarim 31:15:1","Midrash Rabbeinu Bachya [ben Asher]. Warsaw, 1878",he,"וירא ה' באהל בעמוד ענן. כי היה הכבוד בתוך הענן וכח הרחמים בקרבו.
",infreq,18.039461
148,n,Ibn Ezra on Exodus 15:11:2,Ibn Ezra on Exodus -- Torah Emet,he,נאדר בקדש. הוא כסא הכבוד.,aggresive-ngram,9.7489195
149,--,Ramban on Deuteronomy 10:6:1,On Your Way,he,ההר מת? צא וחשוב ותמצא שמונה מסעות ממוסרות להר ההר? אלא אף זו מן התוכחות: ועוד זאת עשיתם כשמת אהרן בהר ההר בסוף ארבעים שנה ונסתלקו ענני הכבוד יראתם לכם ממלחמת מלך ערד ונתתם ראש לחזור למצרים וחזרתם,original,3.5620773
150,--,Kitzur Baal Haturim on Leviticus 23:42:1,On Your Way,he,"בסכות תשבו שבעת ימים כנגד ז' ענני כבוד וכנגד שבעת הימים שישראל יושבין בסוכות זוכין לז' חופות ואלו הן. ענן. עשן. נוגה. אש. להבה. כבוד שכינה. וסכת לויתן. וצוה לעשות סוכות בתחלת החורף שאם היו עושים אותן בקיץ לא הי' ניכר אלא היה נראה שעושין אותו לצל:

",aggresive-ngram,32.411816
151,--,"Tur HaAroch, Exodus 15:22:1","Tur on the Torah, trans. Eliyahu Munk",en," one another by day and by night respectively. If the report is based on historical tradition that these clouds were identical with the ones commonly known as the ענני הכבוד, the clouds proving the",original,3.5290313
152,--,"Sefat Emet, Numbers, Chukat 9:5","Sefat emet, Piotrków, 1905-1908",he,". אבל ע""י החטא נפגם בחי' החיצוניות שלהם והיו צריכין מכסה. ואיתא הוא עמלק ולבש עצמו לבושי כנעני דכ' ולאום מלאום יאמץ. ולכן ע""י שנחסר מבנ""י אותו המלבוש ופריסות ענני הכבוד להסתר בהם מע""ר של האומות וסט""א",original,1.218933
153,--,Kitzur Shulchan Aruch 135:1,Torat Emet 357,he," ברוך הוא לישב בסכה זכר ליציאת מצרים. וסכות אלו שאמר הכתוב כי בסכות הושבתי, נחלקו בהם תנאים. רבי אליעזר אומר, המה ענני הכבוד, שהקיף בהם הקדוש ברוך הוא את אבותינו, לבל יכם שרב ושמש. ורבי עקיבא אומר, סכות",original,0.98968387
154,--,Kitzur Baal Haturim on Numbers 33:5:1,On Your Way,he,"בסכות ששם נסתככו בענני כבוד:

",aggresive-ngram,79.951256
155,--,"Rabbeinu Bahya, Shemot 35:27:2","Midrash Rabbeinu Bachya [ben Asher]. Warsaw, 1878",he,"ויש שפירש כי אבני השהם ושאר הדברים בדרך נס באו לישראל וכדי שתהיה מלאכת המשכן נשלמת הביאום ענני כבוד לתוך אהלו של משה וזהו לשון והנשיאים הביאו מלשון (תהלים קלה) מעלה נשיאים מקצה הארץ.
",aggresive-ngram,40.381485
156,n,Taanit 17a:3,William Davidson Edition - Aramaic,he,אלא גבי אליהו תפלה כתיב צעקה לא כתיב ענני ה׳ ענני לשון צעקה היא,original,7.356284
157,n,"Likutei Moharan, Part II 8:4",Likutei Moharan Tinyana - rabenubook.com,he," עמים, הבו לה' כבוד ועז. וזה בחינת רעמים, בבחינת (שם כט): אל הכבוד הרעים, ה' על מים רבים. מים רבים, זה בחינת מימי הדעת, בחינת (ישעיה יא): כי מלאה הארץ דעה את ה' כמים לים מכסים, הינו בחינת מימי הדעת",original,6.306117
158,--,Shemot Rabbah 26:3,Daat Shemot Rabbah,he," ירא אלהים. בחר לנו אנשים מהו אנשים? אנשים של חכמה וביראת חטא. וצא הלחם בעמלק, מיכן אתה למד, שהיו תחת ענני הכבוד, שאין אומרים צא, אלא למי שהוא שרוי בפנים. ומטה האלהים בידי אמר לו: מטה זה בידי, שאמר",original,7.1757765
