Ref,Text
Chullin 110a:10,"חַזְיֵיהּ דְּלָא הֲוָה מַנַּח תְּפִילִּין, אֲמַר לֵיהּ: מַאי טַעְמָא לָא מַנְּחַתְּ תְּפִילִּין? אֲמַר לֵיהּ: חוֹלֵי מֵעַיִין הוּא, וְאָמַר רַב יְהוּדָה חוֹלֵי מֵעַיִין פָּטוּר מִן הַתְּפִילִּין."
Chullin 110a:11,"חַזְיֵיהּ דְּלָא הֲוָה קָא רָמֵי חוּטֵי, אֲמַר לֵיהּ: מַאי טַעְמָא לֵית לָךְ חוּטֵי? אֲמַר לֵיהּ: טַלִּית שְׁאוּלָה הִיא, וְאָמַר רַב יְהוּדָה"
Chullin 110b:1,טַלִּית שְׁאוּלָה — כׇּל שְׁלֹשִׁים יוֹם פְּטוּרָה מִן הַצִּיצִית.
Chullin 110b:2,"אַדְּהָכִי, אַיְיתוּהּ לְהָהוּא גַּבְרָא דְּלָא הֲוָה מוֹקַר אֲבוּהּ וְאִמֵּיהּ, כַּפְתוּהּ,"
Chullin 110b:3,"אֲמַר לְהוּ: שִׁבְקוּהּ, דְּתַנְיָא כׇּל מִצְוַת עֲשֵׂה שֶׁמַּתַּן שְׂכָרָהּ בְּצִדָּהּ — אֵין בֵּית דִּין שֶׁלְּמַטָּה מוּזְהָרִין עָלֶיהָ. אֲמַר לֵיהּ: חֲזֵינָא לָךְ דְּחָרִיפַתְּ טוּבָא! אֲמַר לֵיהּ: אִי הֲוֵית בְּאַתְרֵיהּ דְּרַב יְהוּדָה, אַחְוִינָא לָךְ חוּרְפַּאי."
Chullin 110b:4,"אֲמַר לֵיהּ אַבָּיֵי לְרַב סָפְרָא: כִּי סָלְקַתְּ לְהָתָם, בְּעִי מִינַּיְיהוּ: כַּבְדָּא, מָה, אַתּוּן בֵּיהּ? כִּי סְלֵיק, אַשְׁכְּחֵיהּ לְרַב זְרִיקָא. אֲמַר לֵיהּ: אֲנָא שְׁלַקִי לֵיהּ לְרַבִּי אַמֵּי, וַאֲכַל."
Chullin 110b:5,"כִּי, אֲתָא לְגַבֵּיהּ. אֲמַר לֵיהּ: לְמֵיסַר נַפְשַׁהּ — לָא קָא מִיבַּעְיָא לִי. כִּי קָמִבַּעְיָא לִי, לְמֵיסַר חֲבִירְתַּהּ:"
Chullin 110b:6,"מַאי שְׁנָא לְמֵיסַר נַפְשַׁהּ, דְּלָא מִיבַּעְיָא לָךְ — דִּתְנַן אֵינָהּ נֶאֱסֶרֶת. לְמֵיסַר חֲבִירְתַּהּ נָמֵי לָא תִּבְּעֵי לָךְ — דִּתְנַן הַכָּבֵד אוֹסֶרֶת, וְאֵינָהּ נֶאֱסֶרֶת, מִפְּנֵי שֶׁהִיא פּוֹלֶטֶת וְאֵינָהּ בּוֹלַעַת! אֲמַר לֵיהּ: דִּילְמָא הָתָם בְּכַבְדָּא דְּאִיסּוּרָא,"
Chullin 111a:1,"וּמִשּׁוּם שַׁמְנוּנִיתָא. מִשּׁוּם דְּמָא, מַאי."
Chullin 111a:2,"כִּי הֲדַר סְלֵיק, אַשְׁכְּחֵיהּ לְרַבִּי זְרִיקָא. אֲמַר לֵיהּ: הַאי נָמֵי לָא תִּבְּעֵי לָךְ, דַּאֲנָא וְיַנַּאי בְּרֵיהּ דְּרַבִּי אַמֵּי אִיקַּלְעַן לְבֵי יְהוּדָה בְּרֵיהּ דְּרַבִּי שִׁמְעוֹן בֶּן פַּזִּי, וְקָרִיבוּ לַן קַנְיָא בְּקוֹפֵיהּ, וַאֲכַלְנָא."
Chullin 111a:3,"מַתְקֵיף לַהּ רַב אָשֵׁי, וְאִיתֵּימָא רַבִּי שְׁמוּאֵל מִזְּרוּקִינְיָא: וְדִלְמָא פִּי קָנֶה חוּץ לִקְדֵרָה הֲוָה. אִי נָמֵי, מִיחְלָט הֲוָה חָלֵיט לֵיהּ מֵעִיקָּרָא. כִּי הָא דְּרַב הוּנָא חָלְטִי לֵיהּ בְּחַלָּא, וְרַב נַחְמָן חָלְטִי לֵיהּ בְּרוֹתְחִין"
Chullin 111a:4,"וּסְבַר רַב פָּפָּא קַמֵּיהּ דְּרָבָא לְמֵימַר חַלָּא — אֲסִיר. אֲמַר לֵיהּ: אִי חַלָּא אֲסִיר — אִיהוּ נָמֵי אֲסִיר, כִּי הֵיכִי דְּפָלֵיט, הֲדַר בָּלַע."
Chullin 111a:5,"רַב בַּר שְׁבָא אִיקְּלַע לְבֵי רַב נַחְמָן, אַיְיתוֹ לֵיהּ כַּבְדָּא שְׁלִיקָא וְלָא אֲכַל. אֲמַרוּ לֵיהּ בַּר בֵּי רַב דִּלְגָיו לָא אָכֵיל! וּמַנּוּ? רַב בַּר שַׁבָּא. אֲמַר לְהוּ רַב נַחְמָן: גַּאמוּ לְשַׁבָּא."
Chullin 111a:6,"כְּתַנָּאֵי. רַבִּי אֱלִיעֶזֶר אוֹמֵר הַכָּבֵד אוֹסֶרֶת, וְאֵינָהּ נֶאֱסֶרֶת, מִפְּנֵי שֶׁפּוֹלֶטֶת וְאֵינָהּ בּוֹלַעַת. רַבִּי יִשְׁמָעֵאל בְּנוֹ שֶׁל רַבִּי יוֹחָנָן בֶּן בְּרוֹקָה אוֹמֵר מְתוּבֶּלֶת — אוֹסֶרֶת, וְנֶאֱסֶרֶת. שְׁלוּקָה — אוֹסֶרֶת, וְנֶאֱסֶרֶת."
Chullin 111a:7,"רַבָּה בַּר רַב הוּנָא אִקְּלַע לְבֵי רַבָּה בַּר רַב נַחְמָן. אַיְיתִי לְקַמֵּיהּ תְּלָת סָאוֵי טַחְאֵי, אֲמַר לְהוּ: מִי הֲוָה יָדְעִיתוּ דְּאָתֵינָא? אֲמַרוּ לֵיהּ: מִי עֲדִיפַתְּ לַן מִינַּהּ, דִּכְתִיב: ""וְקָרָאתָ לַשַּׁבָּת עֹנֶג""!"
Chullin 111a:8,"אַדְּהָכִי, אַשְׁכַּח הָהוּא כַּבְדָּא דַּהֲוָה בַּהּ סִמְפּוֹנָא דִּבְלִיעָא דְּמָא, אֲמַר לְהוּ: אַמַּאי עָבְדִיתוּ הָכִי! אֲמַרוּ לֵיהּ: אֶלָּא הֵיכִי נַעֲבֵיד? אֲמַר לְהוּ: קְרַעוּ שְׁתִי וָעֵרֶב, וְחִיתּוּכָא לְתַחַת."
Chullin 111a:9,"וְהָנֵי מִילֵּי כַּבְדָּא, אֲבָל טְחָלָא, — שׁוּמְנָא בְּעָלְמָא הוּא. כִּי הָא דִּשְׁמוּאֵל עָבְדִי לֵיהּ תַּבְשִׁילָא דִטְחָלֵי בְּיוֹמָא דְּעָבֵיד מִלְּתָא."
Chullin 111a:10,"אִתְּמַר, כַּבְדָּא עִילָּוֵי בִּשְׂרָא, — שְׁרֵי: דְּמָא מִשְׁרָק שָׁרֵיק. כַּחְלָא עִילָּוֵי בִּשְׂרָא — אָסוּר, מַאי טַעְמָא? חָלָב סָרוֹכֵי מְסָרֵיךְ."
Chullin 111a:11,"רַב דִּימִי מִנְּהַרְדְּעָא מַתְנֵי אִפְכָּא: כַּחְלָא עִילָּוֵי בִּשְׂרָא — שְׁרֵי, מַאי טַעְמָא? חֵלֶב שְׁחוּטָה דְּרַבָּנַן. כַּבְדָּא עִילָּוֵי בִּשְׂרָא — אֲסִיר, דָּם דְּאוֹרָיְיתָא."
Chullin 111a:12,"דָּרֵשׁ מָרִימָר, הִלְכְתָא: בֵּין כַּבְדָּא בֵּין כַּחְלָא, תּוּתֵי בִּשְׂרָא — שְׁרֵי, עִילָּוֵי בִּשְׂרָא, דִּיעֲבַד — אִין, לְכַתְּחִלָּה — לָא."
Chullin 111a:13,"רַב אָשֵׁי אִיקְּלַע לְבֵי רָמֵי בַּר אַבָּא חֲמוּהּ, חַזְיֵיהּ לִבְרֵיהּ דְּרָמֵי בַּר אַבָּא דְּקָא"
Chullin 111b:1,"שָׁפֵיד כַּבְדָּא עִילָּוֵי בִּשְׂרָא, אָמַר: כַּמָּה יְהִיר הַאי מֵרַבָּנַן, אֵימַר דַּאֲמוּר רַבָּנַן דִּיעֲבַד, לְכַתְּחִלָּה מִי אֲמוּר?!"
Chullin 111b:2,"וְאִי אִיכָּא בֵּי דוּגֵי — בִּשְׂרָא עִילָּוֵי כַּבְדָּא, נָמֵי אֲסִיר."
Chullin 111b:3,"וּמַאי שְׁנָא, מִדְּמָא דְּבִשְׂרָא? דְּמָא דְּבִשְׂרָא — שָׁכֵן. דְּמָא דְּכַבְדָּא — קָפֵי."
Chullin 111b:4,"אָמַר רַב נַחְמָן, אָמַר שְׁמוּאֵל: סַכִּין שֶׁשָּׁחַט בָּהּ, — אָסוּר לַחְתּוֹךְ בָּהּ רוֹתֵחַ. צוֹנֵן — אָמְרִי לַהּ בָּעֲיָא הַדָּחָה, וְאָמְרִי לַהּ לָא בָּעֲיָא הַדָּחָה."
Chullin 111b:5,"אָמַר רַב יְהוּדָה, אָמַר שְׁמוּאֵל: קְעָרָה שֶׁמָּלַח בָּהּ בָּשָׂר, — אָסוּר לֶאֱכוֹל בָּהּ רוֹתֵחַ. וּשְׁמוּאֵל לְטַעְמֵיהּ, דְּאָמַר שְׁמוּאֵל מָלִיחַ — הֲרֵי הוּא כְּרוֹתֵחַ, וְכָבוּשׁ הֲרֵי הוּא כִּמְבוּשָּׁל."
Chullin 111b:6,"כִּי אֲתָא רָבִין אָמַר רַבִּי יוֹחָנָן: מָלִיחַ — אֵינוֹ כְּרוֹתֵחַ, וְכָבוּשׁ — אֵינוֹ כִּמְבוּשָּׁל. אָמַר אַבָּיֵי: הָא דְּרָבִין, לֵיתַהּ, דְּהַהִיא פִּינְכָּא דַּהֲוָה בֵּי רַבִּי אַמֵּי, דְּמָלַח בֵּיהּ בִּשְׂרָא, וְתַבְרֵיהּ. מִכְּדֵי, רַבִּי אַמֵּי תַּלְמִיד דְּרַבִּי יוֹחָנָן הֲוָה, מַאי טַעְמָא תַּבְרֵיהּ? לָאו מִשּׁוּם דִּשְׁמִיעָא לֵיהּ מִינֵּיהּ דְּרַבִּי יוֹחָנָן דְּאָמַר: מָלִיחַ — הֲרֵי הוּא כְּרוֹתֵחַ!"
Chullin 111b:7,"יָתֵיב רַב כָּהֲנָא אֲחוּהּ דְּרַב יְהוּדָה קַמֵּיהּ דְּרַב הוּנָא, וְיָתֵיב וְקָאָמַר: קְעָרָה שֶׁמָּלַח בָּהּ בָּשָׂר — אָסוּר לֶאֱכוֹל בָּהּ רוֹתֵחַ. וּצְנוֹן: שֶׁחֲתָכוֹ בְּסַכִּין, — מוּתָּר לְאׇכְלוֹ בְּכוּתָּח."
Chullin 111b:8,"מַאי טַעְמָא? אָמַר אַבָּיֵי: הַאי — הֶיתֵּרָא בָּלַע, וְהַאי — אִיסּוּרָא בָּלַע."
Chullin 111b:9,"אֲמַר לֵיהּ רָבָא: כִּי בָּלַע הֶיתֵּרָא, מַאי הָוֵי?! סוֹף סוֹף, הַאי הֶיתֵּרָא דְּאָתֵי לִידֵי אִיסּוּרָא הוּא, דְּאִיסּוּרָא קָאָכֵיל! אֶלָּא אָמַר רָבָא: הַאי, אֶפְשָׁר לְמִטְעֲמֵיהּ, וְהַאי, לָא אֶפְשָׁר לְמִטְעֲמֵיהּ."
Chullin 111b:10,"אֲמַר לֵיהּ רַב פָּפָּא לְרָבָא, וְלִיטְעֲמֵיהּ קַפִּילָא אֲרַמָּאָה, מִי לָא תְּנַן קְדֵרָה שֶׁבִּישֵּׁל בָּהּ בָּשָׂר — לֹא יְבַשֵּׁל בָּהּ חָלָב, וְאִם בִּשֵּׁל — בְּנוֹתֵן טַעַם. בִּשֵּׁל בָּהּ תְּרוּמָה — לֹא יְבַשֵּׁל בָּהּ חוּלִּין. וְאִם בִּשֵּׁל, — בְּנוֹתֵן טַעַם."
Chullin 111b:11,"וְאָמְרִינַן: בִּשְׁלָמָא תְּרוּמָה — טָעֵים לַהּ כֹּהֵן. אֶלָּא בָּשָׂר בְּחָלָב, מַאן טָעֵים לַהּ?! וַאֲמַר לַן: לִיטְעֲמֵיהּ קַפִּילָא, הָכִי נָמֵי לִיטְעֲמֵיהּ קַפִּילָא! הָכִי נָמֵי, — כִּי קָאָמֵינָא דְּלֵיכָּא קַפִּילָא."
Chullin 111b:12,"אִיתְּמַר דָּגִים שֶׁעָלוּ, בַּקְּעָרָה, רַב אָמַר אָסוּר לְאָכְלָן בְּכוּתָּח. וּשְׁמוּאֵל אָמַר מוּתָּר לְאָכְלָן בְּכוּתָּח."
Chullin 111b:13,"רַב אָמַר אָסוּר, נוֹתֵן טַעַם הוּא. וּשְׁמוּאֵל אָמַר מוּתָּר, נוֹתֵן טַעַם בַּר נוֹתֵן טַעַם הוּא."
Chullin 111b:14,וְהָא דְּרַב לָאו בְּפֵירוּשׁ אִיתְּמַר אֶלָּא מִכְּלָלָא אִיתְּמַר דְּרַב אִיקְּלַע לְבֵי רַב שִׁימִי בַּר חִיָּיא בַּר בְּרֵיהּ חַשׁ (בְּעֵינָיו) [בְּעֵינֵיהּ] עֲבַדוּ לֵיהּ שְׁיָיפָא בְּצָעָא בָּתַר הָכִי רְמוֹ לֵיהּ בִּשּׁוּלָא בְּגַוַּוהּ טָעֵים לֵיהּ טַעְמָא דִּשְׁיָיפָא אֲמַר יָהֵיב טַעְמָא כּוּלֵּי הַאי וְלָא הִיא שָׁאנֵי הָתָם דִּנְפִישׁ מְרָרֵהּ טְפֵי
Chullin 111b:15,"רַבִּי אֶלְעָזָר הֲוָה קָאֵים קַמֵּיהּ דְּמָר שְׁמוּאֵל, אַיְיתוֹ לְקַמֵּיהּ דָּגִים שֶׁעָלוּ בַּקְּעָרָה, וְקָא אָכֵיל בְּכוּתָּח. יָהֵיב לֵיהּ, וְלָא אֲכַל. אֲמַר לֵיהּ: לְרַבָּךְ, יְהַבִי לֵיהּ, וַאֲכַל, וְאַתְּ לָא אָכְלַתְּ? אֲתָא לְקַמֵּיהּ דְּרַב, אֲמַר לֵיהּ: הֲדַר בֵּיהּ מָר מִשְּׁמַעְתֵּיהּ? אֲמַר לֵיהּ: חַס לֵיהּ לְזַרְעֵיהּ דְּאַבָּא בַּר אַבָּא דְּלִיסְפֵּי לִי מִידֵּי וְלָא סְבִירָא לִי."
Chullin 111b:16,"רַב הוּנָא וְרַב חִיָּיא בַּר אָשֵׁי הֲווֹ יָתְבִי. חַד בְּהַאי גִּיסָא דְּמַבָּרָא דְּסוּרָא, וְחַד בְּהַאי גִּיסָא דְּמַבָּרָא. לְמָר אַיְיתוֹ לֵיהּ דָּגִים שֶׁעָלוּ בַּקְּעָרָה וַאֲכַל בְּכוּתָּח, לְמָר אַיְיתוֹ לֵיהּ תְּאֵנִים וַעֲנָבִים בְּתוֹךְ הַסְּעוּדָה, וַאֲכַל, וְלָא בָּרֵיךְ."
Chullin 111b:17,"מָר אֲמַר לֵיהּ לְחַבְרֵיהּ: יַתְמָא! עֲבַד רַבָּךְ הָכִי? וּמָר אֲמַר לֵיהּ לְחַבְרֵיהּ: יַתְמָא! עֲבַד רַבָּךְ הָכִי? מָר אֲמַר לֵיהּ לְחַבְרֵיהּ: אֲנָא כִּשְׁמוּאֵל סְבִירָא לִי, וּמָר אֲמַר לֵיהּ לְחַבְרֵיהּ: אֲנָא כְּרַבִּי חִיָּיא סְבִירָא לִי, דְּתָנֵי רַבִּי חִיָּיא: פַּת — פּוֹטֶרֶת כׇּל מִינֵי מַאֲכָל. וְיַיִן — פּוֹטֵר כׇּל מִינֵי מַשְׁקִין."
Chullin 111b:18,אָמַר חִזְקִיָּה מִשּׁוּם אַבָּיֵי: הִלְכְתָא דָּגִים שֶׁעָלוּ בַּקְּעָרָה — מוּתָּר לְאוֹכְלָן בְּכוּתָּח. צְנוֹן שֶׁחֲתָכוֹ בְּסַכִּין שֶׁחָתַךְ בָּהּ בָּשָׂר — אָסוּר לְאוֹכְלוֹ בְּכוּתָּח.
Chullin 111b:19,"וְהָנֵי מִילֵּי צְנוֹן,"
Chullin 112a:1,"דְּאַגַּב חוּרְפֵּיהּ בָּלַע. אֲבָל קִישּׁוּת, — גָּרֵיר לְבֵי פְסָקֵיהּ וְאָכֵיל."
Chullin 112a:2,קִילְחֵי דְּלִיפְתָּא — שְׁרֵי. דְּסִילְקָא — אֲסִירי. וְאִי פְּתַךְ בְּהוּ דְּלִיפְתָּא — שַׁפִּיר דָּמֵי.
Chullin 112a:3,בְּעָא מִינֵּיהּ רַב דִּימִי מֵרַב נַחְמָן: מַהוּ לְאַנּוֹחֵי כַּדָּא דְמִלְחָא גַּבֵּי כַּדָּא דְכַמְכָּא? אֲמַר לֵיהּ: אָסוּר: דְּחַלָּא מַאי? אֲמַר לֵיהּ: שְׁרֵי.
Chullin 112a:4,וּמַאי שְׁנָא? לְכִי תֵּיכוּל עֲלַהּ כּוֹרָא דְמִלְחָא! מַאי טַעְמָא? הַאי — אִיתֵיהּ [לְ]אִיסּוּרָא בְּעֵינֵיהּ. וְהַאי — לֵיתֵיהּ [לְ]אִיסּוּרָא בְּעֵינֵיהּ.
Chullin 112a:5,"הָהוּא בַּר גּוֹזָלָא דִּנְפַל לְכַדָּא דְּכַמְכָּא, — שַׁרְיֵיהּ רַב חִינָּנָא בְּרֵיהּ דְּרָבָא מִפַּשְׁרוּנְיָא אָמַר רָבָא: מַאן חַכִּים לְמִישְׁרֵי כִּי הַאי גַוְונָא, אִי לָאו רַב חִינָּנָא בְּרֵיהּ דְּרָבָא מִפַּשְׁרוּנְיָא קָסָבַר: כִּי אָמַר שְׁמוּאֵל מָלִיחַ הֲרֵי הוּא כְּרוֹתֵחַ — הָנֵי מִילֵּי הֵיכָא, דְּאֵינוֹ נֶאֱכָל מֵחֲמַת מִלְחוֹ. אֲבָל הַאי כּוּתָּחָא הֲרֵי נֶאֱכָל מֵחֲמַת מִלְחוֹ."
Chullin 112a:6,"וְהָנֵי מִילֵּי, חַי, אֲבָל צָלִי — בָּעֵי קְלִיפָה. וְאִי אִית בֵּיהּ פִּילֵי — כּוּלֵּיהּ אָסוּר. וְאִי מְתַבַּל בְּתַבְלִין, — כּוּלֵּיהּ אָסוּר."
Chullin 112a:7,"אָמַר רַב נַחְמָן, אָמַר שְׁמוּאֵל: כִּכָּר שֶׁחָתַךְ עָלֶיהָ בָּשָׂר — אָסוּר לְאׇכְלָהּ: וְהָנֵי מִילֵּי דְּאַסְמֵיק. וְהָנֵי מִילֵּי דְּאַבְרְיֵהּ. וְהָנֵי מִילֵּי דְּאַסְמְכֵיהּ, אֲבָל קְלִישְׁתָּא — לֵית לַן בַּהּ."
Chullin 112a:8,"שְׁמוּאֵל שָׁדֵי לֵיהּ לְכַלְבֵּיהּ, רַב הוּנָא, יָהֵיב לֵיהּ לְשַׁמָּעֵיהּ: מָה נַפְשָׁךְ, אִי שְׁרֵי — לְכוּלֵּי עָלְמָא שְׁרֵי. אִי אֲסִיר — לְכוּלֵּי עָלְמָא אֲסִיר! שָׁאנֵי רַב הוּנָא, דַּאֲנִינָא דַּעְתֵּיהּ. רָבָא אָכֵיל לֵיהּ, ""וְקָרֵי לֵיהּ"" חֲמַר בָּשָׂר."
Chullin 112a:9,"אָמַר רַב נַחְמָן, אָמַר שְׁמוּאֵל: אֵין מַנִּיחִין כְּלִי תַּחַת בָּשָׂר, עַד שֶׁיִּכְלֶה כׇּל מַרְאֵה אַדְמוּמִית שֶׁבּוֹ: מְנָא יָדְעִינַן? מָר זוּטְרָא מִשְּׁמֵיהּ דְּרַב פָּפָּא אָמַר: מִשֶּׁתַּעֲלֶה תִּימְרָתוֹ."
Chullin 112a:10,"מַתְקֵיף לַהּ רַב אָשֵׁי: וְדִלְמָא תַּתָּאָה מְטָא, עִילָּאָה לָא מְטָא? אֶלָּא אָמַר רַב אָשֵׁי: לֵית לֵיהּ תַּקַּנְתָּא, אֶלָּא מִשְׁדֵּא בֵּיהּ תַּרְתֵּי גַּלְלֵי מִלְחָא,"
Chullin 112b:1,וּמִשְׁפְּיֵיהּ.
Chullin 112b:2,"אֲמַר לֵיהּ רַב אַחָא בְּרֵיהּ דְּרַב אִיקָא לְרַב אָשֵׁי: וּמִי אָמַר שְׁמוּאֵל הָכִי? וְהָאָמַר שְׁמוּאֵל כִּכָּר שֶׁחָתַךְ עָלֶיהָ בָּשָׂר אָסוּר לְאׇכְלָהּ! — שָׁאנֵי הָתָם, דְּאַגַּב דּוּחְקָא דְסַכִּינָא, פָּלֵיט."
Chullin 112b:3,"אָמַר רַב נַחְמָן: דָּגִים וְעוֹפוֹת שֶׁמְּלָחָן זֶה עִם זֶה — אֲסוּרִין: הֵיכִי דָמֵי? אִי בִּכְלִי שֶׁאֵינוֹ מְנוּקָּב, — אֲפִילּוּ עוֹפוֹת וְעוֹפוֹת נָמֵי אֲסִירִי! אִי בִּכְלִי מְנוּקָּב — אֲפִילּוּ דָּגִים וְעוֹפוֹת נָמֵי שְׁרֵי!"
Chullin 112b:4,"לְעוֹלָם בִּכְלִי מְנוּקָּב, וְדָגִים מִשּׁוּם דִּרְפוּ קְרָמַיְיהוּ, קָדְמִי וּפָלְטִי, וְעוֹפוֹת קְמִיטִי. בָּתַר דְּנָיְחִי דָּגִים, פָּלְיטִי עוֹפוֹת, וַהֲדַר בָּלְעִי מִינֵּיהּ."
Chullin 112b:5,"רַב מָרִי בַּר רָחֵל אִימְּלַח לֵיהּ, בְּשַׂר שְׁחוּטָה בַּהֲדֵי בְּשַׂר טְרֵפָה, אֲתָא לְקַמֵּיהּ דְּרָבָא."
Chullin 112b:6,"אֲמַר לֵיהּ: הַטְּמֵאִים, — לֶאֱסוֹר, צִירָן, וְרוֹטְבָן, וְקֵיפֶה שֶׁלָּהֶן."
Chullin 113a:1,"וְלֵימָא לֵיהּ, מִדִּשְׁמוּאֵל דְּאָמַר שְׁמוּאֵל, מָלִיחַ הֲרֵי הוּא כְּרוֹתֵחַ, וְכָבוּשׁ הֲרֵי הוּא כִּמְבוּשָּׁל."
Chullin 113a:2,"אִי מִדִּשְׁמוּאֵל, הֲוָה אָמֵינָא הָנֵי מִילֵּי דָּמָן. אֲבָל, צִירָן וְרוֹטְבָן, לָא, קָמַשְׁמַע לַן."
Chullin 113a:3,"מֵיתִיבִי דָּג טָהוֹר שֶׁמְּלָחוֹ עִם דָּג טָמֵא מוּתָּר. מַאי לָאו שֶׁהָיוּ שְׁנֵיהֶן מְלוּחִין! לָא, כְּגוֹן שֶׁהָיָה טָהוֹר מָלִיחַ וְטָמֵא תָּפֵל."
Chullin 113a:4,"וְהָא מִדְּקָתָנֵי סֵיפָא אֲבָל אִם הָיָה טָהוֹר מָלִיחַ וְטָמֵא תָּפֵל, מִכְּלָל דְּרֵישָׁא בְּשֶׁשְּׁנֵיהֶם מְלוּחִין עָסְקִינַן! פָּרוֹשֵׁי קָא מְפָרֵשׁ: טָהוֹר שֶׁמְּלָחוֹ עִם דָּג טָמֵא — מוּתָּר, כֵּיצַד? שֶׁהָיָה טָהוֹר מָלִיחַ וְטָמֵא תָּפֵל."
Chullin 113a:5,"הָכִי נָמֵי מִסְתַּבְּרָא, דְּאִי סָלְקָא דַעְתָּךְ רֵישָׁא שְׁנֵיהֶם מְלוּחִים, — הַשְׁתָּא שְׁנֵיהֶם מְלוּחִים — שְׁרֵי, טָהוֹר מָלִיחַ וְטָמֵא תָּפֵל מִיבַּעְיָא?!"
Chullin 113a:6,"אִי מִשּׁוּם הָא לָא אִירְיָא, — תְּנָא סֵיפָא לְגַלּוֹיֵי רֵישָׁא, דְּלָא תֵּימָא רֵישָׁא טָהוֹר מָלִיחַ וְטָמֵא תָּפֵל: אֲבָל שְׁנֵיהֶם מְלוּחִין — אָסוּר, תְּנָא סֵיפָא טָהוֹר מָלִיחַ וְטָמֵא תָּפֵל, מִכְּלָל דְּרֵישָׁא שְׁנֵיהֶן מְלוּחִין, וַאֲפִילּוּ הָכִי שְׁרֵי."
Chullin 113a:7,תָּא שְׁמַע מִסֵּיפָא דְּסֵיפָא: אֲבָל אִם הָיָה טָמֵא מָלִיחַ וְטָהוֹר תָּפֵל — אָסוּר: טָמֵא מָלִיחַ וְטָהוֹר תָּפֵל הוּא דְּאָסוּר הָא שְׁנֵיהֶן מְלוּחִין — שְׁרֵי!
Chullin 113a:8,"אַיְּידֵי דִּתְנָא רֵישָׁא טָהוֹר מָלִיחַ וְטָמֵא תָּפֵל, תְּנָא נָמֵי סֵיפָא טָמֵא מָלִיחַ וְטָהוֹר תָּפֵל."
Chullin 113a:9,"(סִימָן: בִּישְׂרָא, דְּמַנַּח, נַפְקוּתָא)."
Chullin 113a:10,"אָמַר שְׁמוּאֵל: אֵין הַבָּשָׂר יוֹצֵא מִידֵי דָּמוֹ, אֶלָּא אִם כֵּן מוֹלְחוֹ יָפֶה יָפֶה, וּמְדִיחוֹ יָפֶה יָפֶה. אִתְּמַר רַב הוּנָא אָמַר: מוֹלֵחַ וּמֵדִיחַ, בְּמַתְנִיתָא תְּנָא מֵדִיחַ וּמוֹלֵחַ וּמֵדִיחַ. וְלָא פְּלִיגִי: הָא — דְּחַלְלֵיהּ בֵּי טַבָּחָא. הָא — דְּלָא חַלְלֵיהּ בֵּי טַבָּחָא. רַב דִּימִי מִנְּהַרְדְּעָא מָלַח לֵיהּ בְּמִילְחָא גְּלָלְנִיתָא, וּמְנַפֵּיץ לֵיהּ."
Chullin 113a:11,אָמַר רַב מְשַׁרְשְׁיָא: אֵין מַחֲזִיקִין דָּם בִּבְנֵי מֵעַיִים: תַּרְגְּמַאּ אַכַּרְכְּשָׁא וּמְעַיָּיא וְהַדְרָא דְּכַנְתָּא.
Chullin 113a:12,אָמַר שְׁמוּאֵל: אֵין מַנִּיחִין בָּשָׂר מָלִיחַ אֶלָּא עַל גַּבֵּי כְּלִי מְנוּקָּב.
Chullin 113a:13,"רַב שֵׁשֶׁת מָלַח לֵיהּ גַּרְמָא גַּרְמָא: תְּרֵי מַאי טַעְמָא לָא? מִשּׁוּם דְּפָרֵישׁ מֵהַאי וּבָלַע הַאי, חַד נָמֵי, פָּרֵישׁ מֵהַאי גִּיסָא וּבָלַע הַאי גִּיסָא! אֶלָּא לָא שְׁנָא."
Chullin 113a:14,"אָמַר שְׁמוּאֵל, מִשּׁוּם רַבִּי חִיָּיא: הַשּׁוֹבֵר מַפְרַקְתָּהּ שֶׁל בְּהֵמָה קוֹדֶם שֶׁתֵּצֵא נַפְשָׁהּ — הֲרֵי זֶה מַכְבִּיד אֶת הַבָּשָׂר. וְגוֹזֵל אֶת הַבְּרִיּוֹת וּמַבְלִיעַ דָּם בָּאֵבָרִים."
Chullin 113a:15,"אִיבַּעְיָא לְהוּ: הֵיכִי קָאָמַר, מַכְבִּיד אֶת הַבָּשָׂר, וְגוֹזֵל אֶת הַבְּרִיּוֹת מִשּׁוּם דְּמַבְלִיעַ דָּם בָּאֵבָרִים. הָא לְדִידֵיהּ, שַׁפִּיר דָּמֵי. אוֹ דִלְמָא. לְדִידֵיהּ נָמֵי אֲסִיר. תֵּיקוּ."
Chullin 113a:16,מַתְנִי' הַמַּעֲלֶה אֶת הָעוֹף עִם הַגְּבִינָה עַל — הַשֻּׁלְחָן אֵינוֹ עוֹבֵר בְּלֹא תַעֲשֶׂה.
