Ref,Text
Chullin 74a:2,"יָתֵיב רַב יוֹסֵף קַמֵּיהּ דְּרַב הוּנָא, וְיָתֵיב וְקָאָמַר, אָמַר רַב יְהוּדָה אָמַר רַב: אֲכָלוֹ לָזֶה, — לוֹקֶה. אֲמַר לֵיהּ הָהוּא מֵרַבָּנַן: לָא תְּצִיתוּ לֵיהּ, הָכִי אָמַר רַב יִצְחָק בַּר שְׁמוּאֵל בַּר מָרְתָא מִשְּׁמֵיהּ דְרַב: אֲכָלוֹ לָזֶה — אֵינוֹ לוֹקֶה."
Chullin 74a:3,"אֲמַר לֵיהּ רַב הוּנָא: אֲנַן אַמַּאן נִסְמוֹךְ? אַהְדְּרִינְהוּ רַב יוֹסֵף לְאַפֵּיהּ, אֲמַר לֵיהּ: מַאי קוּשְׁיָא? כִּי אֲמַרִי אֲנָא — בְּמִיתָה, דְּעוֹשָׂה נִיפּוּל כִּי אֲמַר אִיהוּ בִּשְׁחִיטָה דְּאֵינָהּ עוֹשָׂה נִיפּוּל."
Chullin 74a:4,אָמַר רָבָא מְנָא הָא מִלְּתָא דַאֲמוּר רַבָּנַן מִיתָה עוֹשָׂה נִיפּוּל שְׁחִיטָה אֵינָהּ עוֹשָׂה נִיפּוּל דִּכְתִיב וְכֹל אֲשֶׁר יִפֹּל עָלָיו מֵהֶם בְּמֹתָם יִטְמָא לְמַעוֹטֵי מַאי אִילֵּימָא לְמַעוֹטֵי בְּחַיֵּיהֶם מִנִּבְלָתָם נָפְקָא אֶלָּא שְׁמַע מִינַּהּ מִיתָה עוֹשָׂה נִיפּוּל וְאֵין שְׁחִיטָה עוֹשָׂה נִיפּוּל
Chullin 74a:5,"אֲמַר לֵיהּ רַב אַדָּא בַּר אַהֲבָה לְרָבָא: וְהָא קְרָא בִּשְׁרָצִים כְּתִיב! אֲמַר לֵיהּ: אִם אֵינוֹ עִנְיָן, לִשְׁרָצִים, דְּלָאו בְּנֵי שְׁחִיטָה נִינְהוּ — תְּנֵהוּ עִנְיָן לִבְהֵמָה."
Chullin 74a:6,"וְאַכַּתִּי מִבְּעֵי לֵיהּ: כְּעֵין מִיתָה, לַחִין מְטַמְּאִים, יְבֵשִׁים — אֵין מְטַמְּאִים! ""תְּרֵי"" בְּמֹתָם כְּתִיבִי:"
Chullin 74a:7,"אָמַר רַב חִסְדָּא: מַחְלוֹקֶת בְּאֵבֶר דְּעוּבָּר חַי, אֲבָל בְּאֵבֶר דְּעוּבָּר מֵת — דִּבְרֵי הַכֹּל: שְׁחִיטָה עוֹשָׂה נִיפּוּל. וְרַבָּה אָמַר: כְּמַחְלוֹקֶת בָּזֶה כָּךְ מַחְלוֹקֶת בָּזֶה."
Chullin 74a:8,"בֶּן שְׁמֹנֶה חַי. וְהָתַנְיָא: בֶּן שְׁמֹנֶה חַי יוֹכִיחַ, שֶׁאַף עַל פִּי שֶׁיֵּשׁ בְּמִינוֹ שְׁחִיטָה — אֵין שְׁחִיטָתוֹ מְטַהַרְתּוֹ!"
Chullin 74a:9,"אָמַר רַב כָּהֲנָא: יֵשׁ בְּמִינוֹ שְׁחִיטָה, — אַגַּב אִמּוֹ. וְתַנָּא דִּידַן, מִינָא דְּאִמֵּיהּ לָא פָּרֵיךְ."
Chullin 74a:10,"וּלְהַאי תַּנָּא דְּפָרֵיךְ, טְרֵפָה דִּשְׁחִיטָתָהּ מְטַהַרְתָּהּ מְנָא לֵיהּ? נָפְקָא לֵיהּ מִדְּרַב יְהוּדָה אָמַר רַב, דְּאָמַר רַב יְהוּדָה אָמַר רַב, וְאָמְרִי לַהּ בְּמַתְנִיתָא תָּנָא: אָמַר קְרָא ""וְכִי יָמוּת מִן הַבְּהֵמָה: מִקְצָת בְּהֵמָה מְטַמְּאָה, וּמִקְצָת בְּהֵמָה אֵינָהּ מְטַמְּאָה, וְאֵיזוֹ זוֹ? זוֹ טְרֵפָה שֶׁשְּׁחָטָהּ."
Chullin 74a:11,"בָּעֵי רַב הוֹשַׁעְיָא: הוֹשִׁיט אֶת יָדוֹ לִמְעֵי בְּהֵמָה, וְשָׁחַט בֶּן תִּשְׁעָה חַי, מַהוּ? תִּבְּעֵי לְרַבִּי מֵאִיר, וְתִבְּעֵי לְרַבָּנַן."
Chullin 74a:12,"תִּבְּעֵי: לְרַבִּי מֵאִיר עַד כָּאן לָא קָאָמַר רַבִּי מֵאִיר בֶּן פְּקוּעָה, טָעוּן שְׁחִיטָה — הָנֵי מִילֵּי הֵיכָא דְּיָצָא לַאֲוִיר הָעוֹלָם, אֲבָל בִּמְעֵי אִמּוֹ — לָא שָׁרְיָא לֵיהּ שְׁחִיטָה."
Chullin 74a:13,"אוֹ דִילְמָא, אֲפִילּוּ לְרַבָּנַן, אַרְבָּעָה סִימָנִין אַכְשַׁר בֵּיהּ רַחֲמָנָא?"
Chullin 74a:14,"אָמַר רַב חֲנַנְיָא, תָּא שְׁמַע: הֲרֵי שֶׁנּוֹלְדָה טְרֵפָה מִן הַבֶּטֶן. — וְאִי אִיתָא, מַשְׁכַּחַתְּ לַהּ דְּהָיְתָה לָהּ שְׁעַת הַכּוֹשֶׁר, דְּאִי בָּעֵי עַיֵּיל יְדֵיהּ וְשַׁחֲטַהּ!"
Chullin 74a:15,"אֲמַר לֵיהּ רָבָא, תָּנֵי: שֶׁנּוֹצְרָה טְרֵפָה מִן הַבֶּטֶן. וּמַשְׁכַּחַתְּ לַהּ בְּבַעֲלַת חָמֵשׁ רַגְלַיִם."
Chullin 74a:16,"מַתְנִי' הַשּׁוֹחֵט אֶת הַבְּהֵמָה, וּמָצָא בָּהּ בֶּן שְׁמֹנֶה חַי אוֹ מֵת, אוֹ בֶּן תִּשְׁעָה, מֵת, — קוֹרְעוֹ, וּמוֹצִיא אֶת דָּמוֹ."
Chullin 74a:17,"מָצָא בֶּן תִּשְׁעָה חַי — טָעוּן שְׁחִיטָה, וְחַיָּיב בְּאוֹתוֹ וְאֶת בְּנוֹ, דִּבְרֵי רַבִּי מֵאִיר. וַחֲכָמִים אוֹמְרִים: — שְׁחִיטַת אִמּוֹ מְטַהַרְתּוֹ."
Chullin 74b:1,"רַבִּי שִׁמְעוֹן שֵׁזוּרִי אוֹמֵר: אֲפִילּוּ, בֶּן חָמֵשׁ שָׁנִים וְחוֹרֵשׁ בַּשָּׂדֶה — שְׁחִיטַת אִמּוֹ מְטַהַרְתּוֹ. קְרָעָהּ וּמָצָא בָּהּ בֶּן תִּשְׁעָה חַי — טָעוּן שְׁחִיטָה, לְפִי שֶׁלֹּא נִשְׁחֲטָה אִמּוֹ."
Chullin 74b:2,"גְּמָ' אָמַר רַבִּי אֶלְעָזָר אָמַר רַבִּי אוֹשַׁעְיָא: לֹא הִילְּכוּ בּוֹ, אֶלָּא עַל עִסְקֵי שְׁחִיטָה בִּלְבַד. לְמַעוֹטֵי מַאי? לְמַעוֹטֵי חֶלְבּוֹ וְגִידוֹ:"
Chullin 74b:3,"חֶלְבּוֹ דְּמַאי? אִילֵּימָא: חֶלְבּוֹ דִּשְׁלִיל, — מִפְלָג פְּלִיגִי! דְּתַנְיָא: גִּיד הַנָּשֶׁה נוֹהֵג בַּשְּׁלִיל, וְחֶלְבּוֹ אָסוּר, דִּבְרֵי רַבִּי מֵאִיר. רַבִּי יְהוּדָה אוֹמֵר: אֵינוֹ נוֹהֵג בַּשְּׁלִיל, וְחֶלְבּוֹ מוּתָּר. וְאָמַר רַבִּי אֶלְעָזָר אָמַר רַבִּי אוֹשַׁעְיָא: מַחְלוֹקֶת בְּבֶן תִּשְׁעָה חַי, וְהָלַךְ רַבִּי מֵאִיר לְשִׁיטָתוֹ, וְרַבִּי יְהוּדָה לְשִׁיטָתוֹ!"
Chullin 74b:4,"אֶלָּא חֶלְבּוֹ דְּגִיד, מִפְלָג פְּלִיגִי! דְּתַנְיָא: גִּיד הַנָּשֶׁה — מְחַטֵּט אַחֲרָיו בְּכׇל מָקוֹם שֶׁהוּא, וְחוֹתֵךְ שַׁמְנוֹ מֵעִיקָּרוֹ, דִּבְרֵי רַבִּי מֵאִיר. רַבִּי יְהוּדָה אוֹמֵר: גּוֹמְמוֹ עִם הַשּׁוֹפִי!"
Chullin 74b:5,"אֶלָּא אִי אִתְּמַר — הָכִי אִתְּמַר, — אָמַר רַבִּי אֶלְעָזָר אָמַר רַבִּי אוֹשַׁעְיָא: לֹא הִילְּכוּ בּוֹ אֶלָּא עַל עִסְקֵי אֲכִילָה בִּלְבַד, לְמַעוֹטֵי רוֹבְעוֹ, וְחוֹרֵשׁ בּוֹ."
Chullin 74b:6,"אָמַר רַבִּי שִׁמְעוֹן בֶּן לָקִישׁ: לְדִבְרֵי הַמַּתִּיר בְּחֶלְבּוֹ — מַתִּיר בְּדָמוֹ, לְדִבְרֵי הָאוֹסֵר בְּחֶלְבּוֹ — אוֹסֵר בְּדָמוֹ. וְרַבִּי יוֹחָנָן אָמַר: אַף לְדִבְרֵי הַמַּתִּיר בְּחֶלְבּוֹ — אוֹסֵר בְּדָמוֹ."
Chullin 74b:7,"אֵיתִיבֵיהּ רַבִּי יוֹחָנָן לְרַבִּי שִׁמְעוֹן בֶּן לָקִישׁ: — קוֹרְעוֹ, וּמוֹצִיא אֶת דָּמוֹ. — אָמַר רַבִּי זֵירָא: לוֹמַר שֶׁאֵין עָנוּשׁ כָּרֵת."
Chullin 74b:8,"לְמַאן קָאָמְרִי? לְרַבִּי יְהוּדָה, לֹא יְהֵא אֶלָּא דַּם הַתַּמְצִית. דְּתַנְיָא: דַּם הַתַּמְצִית בְּאַזְהָרָה, רַבִּי יְהוּדָה אוֹמֵר: בְּהִכָּרֵת!"
Chullin 74b:9,"תַּרְגְּמָא רַב יוֹסֵף בְּרֵיהּ דְּרַב סַלָּא חֲסִידָא קַמֵּיהּ דְּרַב פָּפָּא: אִית לֵיהּ לְרַבִּי יְהוּדָה ""דָּם"" וְכׇל דָּם"". — כֹּל הֵיכָא דְּמִיחַיַּיב אַדַּם הַנֶּפֶשׁ — מִיחַיַּיב אַדַּם הַתַּמְצִית, וְכֹל הֵיכָא דְּלָא מִחַיַּיב אַדַּם הַנֶּפֶשׁ — לָא מִחַיַּיב אַדַּם הַתַּמְצִית."
Chullin 74b:10,"אִיבַּעְיָא לְהוּ: מַהוּ לִפְדּוֹת בְּבֶן פְּקוּעָה? אַלִּיבָּא דְּרַבִּי מֵאִיר לָא תִּיבְּעֵי לָךְ, דְּכֵיוָן דְּאָמַר טָעוּן שְׁחִיטָה שֶׂה מְעַלְּיָא הוּא."
Chullin 74b:11,"כִּי תִּיבְּעֵי לָךְ אַלִּיבָּא דְּרַבָּנַן, דְּאָמְרִי: שְׁחִיטַת אִמּוֹ מְטַהַרְתּוֹ, מַאי? כֵּיוָן דְּאָמְרִי שְׁחִיטַת אִמּוֹ מְטַהַרְתּוֹ — כְּבִשְׂרָא בְּדִיקּוּלָא הוּא. אוֹ דִילְמָא כֵּיוָן דְּרָהֵיט וְאָזֵיל, וְרָהֵיט ""וְאָתֵי"", — שֶׂה קָרֵינָא בֵּיהּ?"
Chullin 74b:12,"מָר זוּטְרָא אָמַר: אֵין פּוֹדִין, וְרַב אָשֵׁי אָמַר: פּוֹדִין."
Chullin 74b:13,"אֲמַר לֵיהּ רַב אָשֵׁי לְמָר זוּטְרָא: מַאי דַּעְתָּךְ? — ""דְּגָמְרַתְּ"" ""שֶׂה"" שֶׂה מִפְּסָחִים. —"
Chullin 74b:14,"אִי: מָה לְהַלָּן — זָכָר, תָּמִים, וּבֶן שָׁנָה, אַף כָּאן — זָכָר, תָּמִים, ""וּבֶן"" ""שָׁנָה""! תִּפְדֶּה תִּפְדֶּה, רִיבָּה."
Chullin 74b:15,"אִי ""תִּפְדֶּה"" ""תִּפְדֶּה"" רִיבָּה, אֲפִילּוּ כֹּל מִילֵּי נָמֵי! אִם כֵּן, ""שֶׂה"" ""שֶׂה"", מַאי אַהֲנִי לָךְ?"
Chullin 74b:16,אִיבַּעְיָא לְהוּ: מַהוּ לִמְנוֹת בּוֹ רִאשׁוֹן וְשֵׁנִי?
Chullin 74b:17,"רַבִּי יוֹחָנָן אָמַר: מוֹנִין בּוֹ רִאשׁוֹן וְשֵׁנִי. רַבִּי שִׁמְעוֹן בֶּן לָקִישׁ אוֹמֵר: אֵין מוֹנִין בּוֹ רִאשׁוֹן וְשֵׁנִי, נַעֲשָׂה כֶּאֱגוֹז הַמִּתְקַשְׁקֵשׁ בִּקְלִיפָּתוֹ."
Chullin 74b:18,"אֵיתִיבֵיהּ רַבִּי שִׁמְעוֹן בֶּן לָקִישׁ לְרַבִּי יוֹחָנָן: — הַבָּשָׂר מַגַּע נְבֵלָה, דִּבְרֵי רַבִּי מֵאִיר,"
Chullin 74b:19,וַחֲכָמִים אוֹמְרִים: מַגַּע טְרֵפָה שְׁחוּטָה.
Chullin 74b:20,"בִּשְׁלָמָא לְדִידִי, דְּאָמֵינָא חַד גּוּפָא הוּא — הַיְינוּ דְּאִיתַּכְשַׁר בִּדְמָא דְּאִמֵּיהּ. — אֶלָּא לְדִידָךְ, בְּמַאי אִיתַּכְשַׁר?"
Chullin 74b:21,"אֲמַר לֵיהּ: בִּשְׁחִיטָה, וּכְרַבִּי שִׁמְעוֹן. —"
Chullin 74b:22,"אֵיתִיבֵיהּ רַבִּי יוֹחָנָן לְרַבִּי שִׁמְעוֹן בֶּן לָקִישׁ: עָבַר בְּנָהָר — הוּכְשַׁר, הָלַךְ לְבֵית הַקְּבָרוֹת — נִטְמָא."
Chullin 74b:23,"בִּשְׁלָמָא לְדִידִי דְּאָמֵינָא תְּרֵי גּוּפֵי נִינְהוּ, — מִשּׁוּם הָכִי, הוּכְשַׁר — אִין, לֹא הוּכְשַׁר — לָא. אֶלָּא לְדִידָךְ, דְּאָמְרַתְּ חַד גּוּפָא הוּא? הָא אִיתַּכְשַׁר בִּדְמָא דְּאִמֵּיהּ!"
Chullin 75a:1,בִּשְׁחִיטָה יַבִּישְׁתָּא. וּדְלָא כְּרַבִּי שִׁמְעוֹן.
Chullin 75a:2,"מַאן תַּנָּא: עָבַר בְּנָהָר — הוּכְשַׁר, הָלַךְ לְבֵית הַקְּבָרוֹת — נִטְמָא? אָמַר רַבִּי יוֹחָנָן: רַבִּי יוֹסֵי הַגְּלִילִי הִיא, דְּתַנְיָא, רַבִּי שִׁמְעוֹן בֶּן אֶלְעָזָר אוֹמֵר מִשּׁוּם רַבִּי יוֹסֵי הַגְּלִילִי: מְטַמֵּא טוּמְאַת אוֹכָלִים, וְצָרִיךְ הֶכְשֵׁר. וַחֲכָמִים אוֹמְרִים: אֵינוֹ מְטַמֵּא טוּמְאַת אוֹכָלִין, מִפְּנֵי שֶׁהוּא חַי, וְכׇל שֶׁהוּא חַי — אֵינוֹ מְטַמֵּא טוּמְאַת אוֹכָלִין."
Chullin 75a:3,"וְאַזְדָּא רַבִּי יוֹחָנָן לְטַעְמֵיהּ, דְּאָמַר רַבִּי יוֹחָנָן: רַבִּי יוֹסֵי הַגְּלִילִי וּבֵית שַׁמַּאי אָמְרוּ דָּבָר אֶחָד, —"
Chullin 75a:4,"רַבִּי יוֹסֵי הַגְּלִילִי — הָא דַּאֲמַרַן בֵּית שַׁמַּאי — דִּתְנַן: דָּגִים, מֵאֵימָתַי מְקַבְּלִין טוּמְאָה? בֵּית שַׁמַּאי אוֹמְרִים: מִשֶּׁיִּצּוֹדוּ. וּבֵית הִלֵּל אוֹמְרִים: מִשֶּׁיָּמוּתוּ. רַבִּי עֲקִיבָא אוֹמֵר: מִשָּׁעָה שֶׁאֵין יְכוֹלִין לִחְיוֹת."
Chullin 75a:5,מַאי בֵּינַיְיהוּ? אָמַר רַבִּי יוֹחָנָן: דָּג מְקַרְטֵעַ אִיכָּא בֵּינַיְיהוּ.
Chullin 75a:6,"בָּעֵי רַב חִסְדָּא: נוֹלְדוּ בְּדָגִים סִימָנֵי טְרֵפָה, מַהוּ? תִּיבְּעֵי לְמַאן דְּאָמַר טְרֵפָה — חַיָּה. וְתִיבְּעֵי לְמַאן דְּאָמַר טְרֵפָה אֵינָהּ חַיָּה."
Chullin 75a:7,"תִּיבְּעֵי לְמַאן דְּאָמַר טְרֵפָה חַיָּה בְּהֵמָה הוּא, דִּנְפִישָׁא חַיּוּתַהּ, אֲבָל דָּגִים דְּלָא נְפִישָׁא חַיּוּתַיְיהוּ — לָא. אוֹ דִילְמָא, אֲפִילּוּ לְמַאן דְּאָמַר טְרֵפָה אֵינָהּ חַיָּה, הָנֵי מִילֵּי בְּהֵמָה, דְּיֵשׁ בְּמִינָהּ שְׁחִיטָה, — אֲבָל דָּגִים דְּאֵין בְּמִינָן שְׁחִיטָה — אֵימָא לָא? — תֵּיקוּ."
Chullin 75a:8,הֵטִילָה נֵפֶל רַבִּי יוֹחָנָן אָמַר: חֶלְבּוֹ כְּחֵלֶב בְּהֵמָה. וְרַבִּי שִׁמְעוֹן בֶּן לָקִישׁ אָמַר: חֶלְבּוֹ כְּחֵלֶב חַיָּה.
Chullin 75a:9,"רַבִּי יוֹחָנָן אָמַר: חֶלְבּוֹ כְּחֵלֶב בְּהֵמָה, אַוֵּירָא גָּרֵים. רַבִּי שִׁמְעוֹן בֶּן לָקִישׁ אָמַר: חֶלְבּוֹ כְּחֵלֶב חַיָּה חֳדָשִׁים גָּרְמִי."
Chullin 75a:10,"אִיכָּא דְאָמְרִי: כֹּל הֵיכָא דְּלֹא כָּלוּ לוֹ חֳדָשָׁיו — לָא כְּלוּם הוּא. כִּי פְּלִיגִי הֵיכָא דְּהוֹשִׁיט יָדוֹ לִמְעֵי בְּהֵמָה, וְתָלַשׁ חֵלֶב שֶׁל בֶּן תִּשְׁעָה חַי וְאָכַל רַבִּי יוֹחָנָן אָמַר: חֶלְבּוֹ כְּחֵלֶב בְּהֵמָה, חֳדָשִׁים גָּרְמִי. רַבִּי שִׁמְעוֹן בֶּן לָקִישׁ אָמַר: חֶלְבּוֹ כְּחֵלֶב חַיָּה, חֳדָשִׁים וְאַוֵּירָא גָּרְמִי. —"
Chullin 75a:11,"אֵיתִיבֵיהּ רַבִּי יוֹחָנָן לְרַבִּי שִׁמְעוֹן בֶּן לָקִישׁ: מָה חֵלֶב וּשְׁתֵּי כְלָיוֹת הָאֲמוּרוֹת בְּאָשָׁם מוּצָא מִכְּלַל שְׁלִיל, אַף כֹּל, — מוּצָא מִכְּלַל שְׁלִיל."
Chullin 75a:12,"בִּשְׁלָמָא לְדִידִי, — הַיְינוּ דְּאִיצְטְרִיךְ קְרָא לְמַעוֹטֵי. אֶלָּא לְדִידָךְ, אַמַּאי אִיצְטְרִיךְ? אֲמַר לֵיהּ: טַעְמָא דִּידִי נָמֵי מֵהָכָא."
Chullin 75a:13,"וְאִיכָּא דְּאָמְרִי, אֵיתִיבֵיהּ רַבִּי שִׁמְעוֹן בֶּן לָקִישׁ לְרַבִּי יוֹחָנָן: מָה חֵלֶב וּשְׁתֵּי כְלָיוֹת הָאֲמוּרוֹת בְּאָשָׁם — מוּצָא מִכְּלַל שְׁלִיל, אַף כֹּל — מוּצָא מִכְּלַל שְׁלִיל."
Chullin 75a:14,"בִּשְׁלָמָא לְדִידִי, — מִשּׁוּם הָכִי מַיעֲטֵיהּ רַחֲמָנָא, אֶלָּא לְדִידָךְ, — לִיקְרַב! אֲמַר לֵיהּ: מִידֵּי דְּהָוֵה אַמְּחוּסַּר זְמַן."
Chullin 75a:15,"אָמַר רַבִּי אַמֵּי: הַשּׁוֹחֵט אֶת הַטְּרֵפָה וּמָצָא בָּהּ בֶּן תִּשְׁעָה חַי, לְדִבְרֵי הָאוֹסֵר, מַתִּיר. לְדִבְרֵי הַמַּתִּיר, — אוֹסֵר."
Chullin 75a:16,"רָבָא אָמַר: לְדִבְרֵי הַמַּתִּיר, נָמֵי מוּתָּר, אַרְבָּעָה סִימָנִין אַכְשַׁר בֵּיהּ רַחֲמָנָא. —"
Chullin 75a:17,"אָמַר רַב חִסְדָּא: הַשּׁוֹחֵט אֶת הַטְּרֵפָה, וּמָצָא בָּהּ בֶּן תִּשְׁעָה חַי —"
Chullin 75b:1,"טָעוּן שְׁחִיטָה, וְחַיָּיב בִּזְרוֹעַ וְהַלְּחָיַיִם וְהַקֵּבָה, וְאִם מֵת — טָהוֹר מִלְּטַמֵּא בְּמַשָּׂא."
Chullin 75b:2,"אֲמַר לֵיהּ רָבָא: טָעוּן שְׁחִיטָה, כְּמַאן? כְּרַבִּי מֵאִיר, וְאִם מֵת טָהוֹר מִלְּטַמֵּא בְּמַשָּׂא, כְּמַאן? כְּרַבָּנַן!"
Chullin 75b:3,"וְלִיטַעְמָיךְ, הָא דְתָנֵי רַבִּי חִיָּיא: הַשּׁוֹחֵט אֶת הַטְּרֵפָה וּמָצָא בָּהּ בֶּן תִּשְׁעָה חַי — טָעוּן שְׁחִיטָה, וְחַיָּיב בִּזְרוֹעַ וְהַלְּחָיַיִם וְהַקֵּבָה, וְאִם מֵת — טָהוֹר מִלְּטַמֵּא בְּמַשָּׂא: — טָעוּן שְׁחִיטָה, כְּמַאן? כְּרַבִּי מֵאִיר, וְאִם מֵת — טָהוֹר מִלְּטַמֵּא בְּמַשָּׂא, כְּרַבָּנַן!"
Chullin 75b:4,"הָא לָא קַשְׁיָא, רַבִּי חִיָּיא, אִם כְּבָר מְצָאוֹ מֵת קָאָמַר. אֶלָּא לְדִידָךְ, קַשְׁיָא!"
Chullin 75b:5,"אֲמַר לֵיהּ: לְדִידִי נָמֵי לָא קַשְׁיָא, אַרְבָּעָה סִימָנִים אַכְשַׁר בֵּיהּ רַחֲמָנָא."
Chullin 75b:6,"כִּי סָלֵיק רַבִּי זֵירָא, אַשְׁכְּחֵיהּ לְרַב אַסִּי דְּיָתֵיב, וְקָאָמַר לֵיהּ לְהָא שְׁמַעְתָּא. אֲמַר לֵיהּ: יִישַׁר, וְכֵן אָמַר רַבִּי יוֹחָנָן. מִכְּלָל דִּפְלִיג עֲלֵיהּ רַבִּי שִׁמְעוֹן בֶּן לָקִישׁ?"
Chullin 75b:7,מִשְׁהָא הֲוָה שָׁהֵי לֵיהּ וְשָׁתֵיק לֵיהּ. וְאִיכָּא דְּאָמְרִי: מִשְׁתָּא הֲוָה שָׁתֵי וְשָׁתֵיק לֵיהּ.
Chullin 75b:8,"רַבִּי שִׁמְעוֹן שֵׁזוּרִי אוֹמֵר: אֲפִילּוּ: — וְכוּ' הַיְינוּ תַּנָּא קַמָּא! אָמַר רַב כָּהֲנָא: הִפְרִיס, עַל גַּבֵּי קַרְקַע אִיכָּא בֵּינַיְיהוּ. —"
Chullin 75b:9,"אָמַר רַב מְשַׁרְשְׁיָא: לְדִבְרֵי הָאוֹמֵר חוֹשְׁשִׁין לְזֶרַע הָאָב, בֶּן פְּקוּעָה, הַבָּא עַל בְּהֵמָה מְעַלַּיְיתָא — הַוָּלָד אֵין לוֹ תַּקָּנָה."
Chullin 75b:10,"אָמַר אַבָּיֵי: הַכֹּל, מוֹדִים בְּקָלוּט בֶּן, פְּקוּעָה שֶׁמּוּתָּר מַאי טַעְמָא? כֹּל מִלְּתָא דִּתְמִיהָא מִידְכָּר דְּכִירִי לַהּ אִינָשֵׁי. אִיכָּא דְּאָמְרִי, אָמַר אַבָּיֵי: הַכֹּל מוֹדִים בְּקָלוּט בֶּן קְלוּטָה בֶּן פְּקוּעָה שֶׁמּוּתָּר, מַאי טַעְמָא? תְּרֵי תְּמִיהֵי מִידְכָּר דְּכִירִי אִינָשֵׁי."
Chullin 75b:11,אָמַר זְעֵירִי אָמַר רַבִּי חֲנִינָא הֲלָכָה כְּרַבִּי שִׁמְעוֹן שֵׁזוּרִי וְכֵן הָיָה רַבִּי שִׁמְעוֹן שֵׁזוּרִי מַתִּיר בִּבְנוֹ וּבֶן בְּנוֹ עַד סוֹף כׇּל הַדּוֹרוֹת רַבִּי יוֹחָנָן אָמַר הוּא מוּתָּר וּבְנוֹ אָסוּר
Chullin 75b:12,"אַדָּא בַּר חָבוּ הֲוָה לֵיהּ בֶּן פְּקוּעָה דִּנְפַל דֵּיבָא עֲלֵיהּ. אֲתָא לְקַמֵּיהּ דְּרַב אָשֵׁי, אֲמַר לֵיהּ: זִיל שַׁחְטֵיהּ. אֲמַר לֵיהּ, הָאָמַר זְעֵירִי אָמַר רַבִּי חֲנִינָא: הֲלָכָה כְּרַבִּי שִׁמְעוֹן שֵׁזוּרִי, וְכֵן הָיָה רַבִּי שִׁמְעוֹן שֵׁזוּרִי מַתִּיר בִּבְנוֹ וּבֶן בְּנוֹ עַד סוֹף כׇּל הַדּוֹרוֹת. וַאֲפִילּוּ רַבִּי יוֹחָנָן לָא קָאָמַר אֶלָּא בְּנוֹ, אֲבָל אִיהוּ — לָא!"
Chullin 75b:13,אֲמַר לֵיהּ: רַבִּי יוֹחָנָן לְדִבְרֵי רַבִּי שִׁמְעוֹן שֵׁזוּרִי קָאָמַר.
Chullin 75b:14,"וְהָאָמַר רָבִין בַּר חֲנִינָא אָמַר עוּלָּא אָמַר רַבִּי חֲנִינָא: הֲלָכָה כְּרַבִּי שִׁמְעוֹן שֵׁזוּרִי וְלֹא עוֹד, אֶלָּא כׇּל מָקוֹם שֶׁשָּׁנָה רַבִּי שִׁמְעוֹן שֵׁזוּרִי בְּמִשְׁנָתֵנוּ הֲלָכָה כְּמוֹתוֹ!"
Chullin 75b:15,"אֲמַר לֵיהּ: אֲנָא כִּי הָא סְבִירָא לִי, דְּאָמַר רַבִּי יוֹנָתָן: הֲלָכָה כְּרַבִּי שִׁמְעוֹן שֵׁזוּרִי בִּמְסוּכָּן וּבִתְרוּמַת מַעֲשֵׂר שֶׁל דְּמַאי."
Chullin 75b:16,"מְסוּכָּן? דִּתְנַן: בָּרִאשׁוֹנָה הָיוּ אוֹמְרִים, הַיּוֹצֵא בְּקוֹלָר וְאָמַר: ""כִּתְבוּ גֵּט לְאִשְׁתִּי"", הֲרֵי אֵלּוּ יִכְתְּבוּ ""וְיִתְּנוּ"". חָזְרוּ לוֹמַר — אַף הַמְפָרֵשׁ וְהַיּוֹצֵא בִּשְׁיָירָא, — רַבִּי שִׁמְעוֹן בֶּן שֵׁזוּרִי אוֹמֵר: אַף הַמְסוּכָּן."
Chullin 75b:17,"תְּרוּמַת מַעֲשֵׂר שֶׁל דְּמַאי? דִּתְנַן: תְּרוּמַת מַעֲשֵׂר שֶׁל דְּמַאי, שֶׁחָזְרָה לִמְקוֹמָהּ, רַבִּי שִׁמְעוֹן בֶּן שֵׁזוּרִי אוֹמֵר: אַף בַּחוֹל שׁוֹאֲלוֹ, וְאוֹכְלוֹ עַל פִּיו."
Chullin 76a:1,"מַתְנִי' בְּהֵמָה שֶׁנֶּחְתְּכוּ רַגְלֶיהָ, מִן הָאַרְכּוּבָּה וּלְמַטָּה — כְּשֵׁרָה, מִן הָאַרְכּוּבָּה וּלְמַעְלָה — פְּסוּלָה, וְכֵן שֶׁנִּיטַּל צוֹמֶת הַגִּידִין."
Chullin 76a:2,"נִשְׁבַּר הָעֶצֶם, אִם רוֹב הַבָּשָׂר קַיָּים — שְׁחִיטָתוֹ מְטַהַרְתּוֹ, וְאִם לָאו, — אֵין שְׁחִיטָתוֹ מְטַהַרְתּוֹ."
