Ref,Text
Chullin 38a:11,"אָמַר רַב נַחְמָן בַּר יִצְחָק: מְנָא אָמֵינָא לַהּ? דִּתְנַן, אָמַר רַבִּי שִׁמְעוֹן: הַשּׁוֹחֵט בַּלַּיְלָה, וּלְמָחָר מָצָא כְּתָלִים מְלֵאִים דָּם — כְּשֵׁרָה, שֶׁזִּינְּקָה, וּכְמִדַּת רַבִּי אֱלִיעֶזֶר. וְאָמַר שְׁמוּאֵל: כּוֹתְלֵי בֵּית שְׁחִיטָה שָׁנִינוּ. אִי אָמְרַתְּ בִּשְׁלָמָא בִּתְחִלַּת שְׁחִיטָה — שַׁפִּיר, אֶלָּא אִי אָמְרַתְּ בְּסוֹף שְׁחִיטָה? לֵיחוּשׁ דִּלְמָא בִּתְחִלַּת שְׁחִיטָה זִינְּקָה!"
Chullin 38a:12,וְדִלְמָא שָׁאנֵי זִינּוּק דַּעֲדִיף.
Chullin 38a:13,"וּמִי עֲדִיף? וְהָתְנַן רַבִּי אֱלִיעֶזֶר אוֹמֵר: דַּיָּיהּ אִם זִינְּקָה! קַל מִדְּרַבָּן גַּמְלִיאֵל, וַעֲדִיף מִדְּרַבָּנַן."
Chullin 38a:14,"אָמַר רָבִינָא: אָמַר לִי סַמָּא בַּר חִילְקַאי, אַקְשִׁי בַּהּ אֲבוּהּ דְּבַר אַבּוּבְרָם, וְאָמְרִי לַהּ אֲחוּהּ דְּבַר אַבּוּבְרָם: וּמִדְּרַבָּנַן מִי עֲדִיף? וְהָא תְּנַן, וַחֲכָמִים אוֹמְרִים: עַד שֶׁתְּפַרְכֵּס אוֹ בַיָּד אוֹ בָרֶגֶל."
Chullin 38a:15,רַבָּנַן אַהֵי קָיְימִי אִילֵּימָא אַדְּרַבָּן גַּמְלִיאֵל כֵּיוָן שֶׁפִּירְכְּסָה מִיבְּעֵי לֵיהּ
Chullin 38a:16,"אֶלָּא פְּשִׁיטָא אַדְּרַבִּי אֱלִיעֶזֶר: וְאִי עֲדִיף, מַאי ""עַד?"
Chullin 38a:17,"רָבָא אָמַר: פִּירְכּוּס שֶׁאָמְרוּ — בְּסוֹף שְׁחִיטָה. אָמַר רָבָא: מְנָא אָמֵינָא לַהּ? ""דְּתַנְיָא: שׁוֹר"
Chullin 38b:1,אוֹ כֶשֶׂב פְּרָט לְכִלְאַיִם אוֹ עֵז פְּרָט לְנִדְמֶה כִּי יִוָּלֵד פְּרָט לְיוֹצֵא דּוֹפֶן שִׁבְעַת יָמִים פְּרָט לִמְחוּסַּר זְמַן תַּחַת אִמּוֹ פְּרָט לַיָּתוֹם
Chullin 38b:2,"הַאי יָתוֹם הֵיכִי דָמֵי? אִילֵּימָא דִּילִידְתֵּיהּ אִמֵּיהּ וַהֲדַר מִתָה, לְעוֹלָם תֵּיחֵי וְתֵיזִיל? אֶלָּא דְּמִתָה וַהֲדַר יְלִידְתֵּיהּ, ""מִכִּי יִוָּלֵד"" נָפְקָא!"
Chullin 38b:3,"אֶלָּא פְּשִׁיטָא, זֶה פֵּירַשׁ לְמִיתָה וְזֶה פֵּירַשׁ לְחַיִּים. אִי אָמְרַתְּ בִּשְׁלָמָא בָּעֵינַן חִיּוּתָא בְּסוֹף לֵידָה — הַיְינוּ דְּאִיצְטְרִיךְ קְרָא לְמַעוֹטֵי. — אֶלָּא אִי אָמְרַתְּ לָא בָּעֵינַן חִיּוּתָא בְּסוֹף לֵידָה, לְמָה לֵיהּ""? מִכִּי יִוָּלֵד נָפְקָא! —"
Chullin 38b:4,אָמַר רָבָא: הִלְכְתָא כִּי הָא מַתְנִיתָא: בְּהֵמָה דַּקָּה שֶׁפָּשְׁטָה יָדָהּ וְלֹא הֶחְזִירָה — פְּסוּלָה.
Chullin 38b:5,"בַּמֶּה דְּבָרִים אֲמוּרִים? בַּיָּד, אֲבָל בָּרֶגֶל, בֵּין פָּשְׁטָה וְלֹא כָּפְפָה, בֵּין כָּפְפָה וְלֹא פָּשְׁטָה — כְּשֵׁרָה. בַּמֶּה דְּבָרִים אֲמוּרִים? בְּדַקָּה, אֲבָל בְּגַסָּה, בֵּין בַּיָּד בֵּין בָּרֶגֶל, בֵּין פָּשְׁטָה וְלֹא כָּפְפָה, בֵּין כָּפְפָה וְלֹא פָּשְׁטָה — כְּשֵׁרָה. וְעוֹף, אֲפִילּוּ לֹא רִפְרֵף אֶלָּא גַּפּוֹ, וְלֹא כִּשְׁכֵּשׁ אֶלָּא זְנָבוֹ — הֲרֵי זֶה פִּירְכּוּס."
Chullin 38b:6,"מַאי קָא מַשְׁמַע לַן? כּוּלְּהוּ תְּנַנְהִי: בְּהֵמָה דַּקָּה שֶׁפָּשְׁטָה יָדָהּ וְלֹא הֶחְזִירָה — פְּסוּלָה, שֶׁאֵינָהּ אֶלָּא הוֹצָאַת נֶפֶשׁ. יָד — אִין, רֶגֶל — לָא דַּקָּה — אִין, גַּסָּה — לָא! עוֹף אִיצְטְרִיכָא לֵיהּ, דְּלָא תְּנַן."
Chullin 38b:7,"מַתְנִי' הַשּׁוֹחֵט לְנׇכְרִי — שְׁחִיטָתוֹ כְּשֵׁרָה, וְרַבִּי אֱלִיעֶזֶר פּוֹסֵל. אָמַר רַבִּי אֱלִיעֶזֶר: אֲפִילּוּ שְׁחָטָהּ לֶאֱכוֹל לְנׇכְרִי מֵחֲצַר כָּבֵד שֶׁלָּהּ — פְּסוּלָה, שֶׁסְּתָם מַחְשֶׁבֶת נׇכְרִי לַעֲבוֹדָה זָרָה."
Chullin 38b:8,"אָמַר רַבִּי יוֹסֵי קַל וָחוֹמֶר הַדְּבָרִים, וּמָה בִּמְקוֹם שֶׁהַמַּחְשָׁבָה פּוֹסֶלֶת, בְּמוּקְדָּשִׁין, — אֵין הַכֹּל הוֹלֵךְ אֶלָּא אַחַר הָעוֹבֵד, מְקוֹם שֶׁאֵין מַחְשָׁבָה פּוֹסֶלֶת, בְּחוּלִּין — אֵינוֹ דִּין שֶׁלֹּא יְהֵא הַכֹּל הוֹלֵךְ אֶלָּא אַחַר הַשּׁוֹחֵט? —"
Chullin 38b:9,"גְּמָ' הָנֵי תַּנָּאֵי אִית לְהוּ דְּרַבִּי אֱלִיעֶזֶר בְּרַבִּי. יוֹסֵי, דְּתַנְיָא אָמַר רַבִּי אֱלִיעֶזֶר בְּרַבִּי: יוֹסֵי שָׁמַעְתִּי שֶׁהַבְּעָלִים מְפַגְּלִין."
Chullin 38b:10,"מִיהוּ תַּנָּא קַמָּא סָבַר: אִי שַׁמְעִינֵיהּ דְּחַשֵּׁיב — אִין, אִי לָא — לָא, סְתָם מַחְשֶׁבֶת נׇכְרִי לַעֲבוֹדָה זָרָה לָא אָמְרִינַן. רַבִּי אֱלִיעֶזֶר סָבַר: אַף עַל גַּב דְּלָא שַׁמְעִינֵיהּ דְּחַשֵּׁיב, — סְתָם מַחְשֶׁבֶת נׇכְרִי לַעֲבוֹדָה זָרָה אָמְרִינַן. וַאֲתָא רַבִּי יוֹסֵי לְמֵימַר: אַף עַל גַּב דְּשַׁמְעִינֵיהּ דְּחַשֵּׁיב, זֶה מְחַשֵּׁב וְזֶה עוֹבֵד לָא אָמְרִינַן."
Chullin 38b:11,"אִיכָּא דְּאָמְרִי: בִּדְשַׁמְעִינֵיהּ דְּחַשֵּׁיב פְּלִיגִי, תַּנָּא קַמָּא סָבַר: כִּי אָמְרִינַן זֶה מְחַשֵּׁב וְזֶה עוֹבֵד — הָנֵי מִילֵּי בִּפְנִים, אֲבָל בְּחוּץ, — לֹא, חוּץ מִפְּנִים"
Chullin 39a:1,"לָא יָלְפִינַן. וַאֲתָא רַבִּי אֱלִיעֶזֶר לְמֵימַר: יָלְפִינַן חוּץ מִפְּנִים, וַאֲתָא רַבִּי יוֹסֵי לְמֵימַר: אֲפִילּוּ בְּפָנִים נָמֵי זֶה מְחַשֵּׁב וְזֶה עוֹבֵד לָא אָמְרִינַן."
Chullin 39a:2,"אִתְּמַר: הַשּׁוֹחֵט אֶת הַבְּהֵמָה לִזְרוֹק דָּמָהּ לַעֲבוֹדָה זָרָה, וּלְהַקְטִיר חֶלְבָּהּ לַעֲבוֹדָה זָרָה — רַבִּי יוֹחָנָן אָמַר: פְּסוּלָה. רַבִּי שִׁמְעוֹן בֶּן לָקִישׁ אָמַר: מוּתֶּרֶת."
Chullin 39a:3,"רַבִּי יוֹחָנָן אָמַר פְּסוּלָה, מְחַשְּׁבִין מֵעֲבוֹדָה לַעֲבוֹדָה, וְיָלְפִינַן חוּץ מִפְּנִים. —"
Chullin 39a:4,"רֵישׁ לָקִישׁ אָמַר מוּתֶּרֶת, אֵין מְחַשְּׁבִין מֵעֲבוֹדָה לַעֲבוֹדָה, וְלָא גָּמְרִינַן חוּץ מִפְּנִים."
Chullin 39a:5,"וְאָזְדוּ לְטַעְמַיְיהוּ, דְּאִתְּמַר: שְׁחָטָהּ לִשְׁמָהּ לִזְרוֹק דָּמָהּ שֶׁלֹּא לִשְׁמָהּ — רַבִּי יוֹחָנָן אָמַר: פְּסוּלָה, רַבִּי שִׁמְעוֹן בֶּן לָקִישׁ אָמַר: כְּשֵׁרָה."
Chullin 39a:6,"רַבִּי יוֹחָנָן אָמַר פְּסוּלָה, מְחַשְּׁבִין מֵעֲבוֹדָה לַעֲבוֹדָה, — וְגָמְרִינַן מִמַּחְשֶׁבֶת פִּיגּוּל. רַבִּי שִׁמְעוֹן בֶּן לָקִישׁ אָמַר כְּשֵׁרָה, אֵין מְחַשְּׁבִין מֵעֲבוֹדָה לַעֲבוֹדָה, — וְלָא גָּמְרִינַן מִמַּחְשֶׁבֶת פִּיגּוּל."
Chullin 39a:7,"וּצְרִיכָא, דְּאִי אִיתְּמַר בְּהָא: בְּהָא קָאָמַר רַבִּי שִׁמְעוֹן בֶּן לָקִישׁ, מִשּׁוּם דְּחוּץ מִפְּנִים לָא יָלְפִינַן, אֲבָל פְּנִים מִפְּנִים אֵימָא מוֹדֵי לֵיהּ לְרַבִּי יוֹחָנָן. —"
Chullin 39a:8,"וְאִי אִתְּמַר בְּהָךְ: בְּהַהִיא קָאָמַר רַבִּי יוֹחָנָן, אֲבָל בְּהָא — אֵימָא מוֹדֵי לֵיהּ לְרַבִּי שִׁמְעוֹן בֶּן לָקִישׁ, צְרִיכָא."
Chullin 39a:9,"מֵתִיב רַב שֵׁשֶׁת, אָמַר רַבִּי יוֹסֵי: קַל וָחוֹמֶר הַדְּבָרִים, וּמָה בִּמְקוֹם שֶׁמַּחְשָׁבָה פּוֹסֶלֶת, בְּמוּקְדָּשִׁין — אֵין הַכֹּל הוֹלֵךְ אֶלָּא אַחַר הָעוֹבֵד, מְקוֹם שֶׁאֵין מַחְשָׁבָה פּוֹסֶלֶת, בְּחוּלִּין — אֵינוֹ דִּין שֶׁלֹּא יְהֵא הַכֹּל הוֹלֵךְ אֶלָּא אַחַר הַשּׁוֹחֵט?"
Chullin 39a:10,"מַאי אֵין מַחְשָׁבָה פּוֹסֶלֶת בְּחוּלִּין? אִילֵּימָא דְּלָא פָּסְלָה כְּלָל, אֶלָּא, זְבִיחָה דַּעֲבוֹדָה זָרָה דְּמִיתַּסְרָא, הֵיכִי מַשְׁכַּחַתְּ לַהּ?"
Chullin 39a:11,"אֶלָּא פְּשִׁיטָא מֵעֲבוֹדָה לַעֲבוֹדָה. וְהָכִי קָאָמַר: וּמָה בִּמְקוֹם שֶׁמַּחְשָׁבָה פּוֹסֶלֶת בְּמוּקְדָּשִׁין, מֵעֲבוֹדָה לַעֲבוֹדָה — אֵין הַכֹּל הוֹלֵךְ אֶלָּא אַחַר הָעוֹבֵד, מְקוֹם שֶׁאֵין מַחְשָׁבָה פּוֹסֶלֶת, בְּחוּלִּין, מֵעֲבוֹדָה לַעֲבוֹדָה, אֶלָּא בְּאוֹתָהּ עֲבוֹדָה — אֵינוֹ דִּין שֶׁלֹּא יְהֵא הַכֹּל הוֹלֵךְ אֶלָּא אַחַר הַשּׁוֹחֵט?"
Chullin 39a:12,"פְּנִים קַשְׁיָא לְרַבִּי שִׁמְעוֹן בֶּן לָקִישׁ, חוּץ קַשְׁיָא לְרַבִּי יוֹחָנָן!"
Chullin 39a:13,"בִּשְׁלָמָא פְּנִים, לְרַבִּי שִׁמְעוֹן בֶּן לָקִישׁ לָא קַשְׁיָא: הָא מִקַּמֵּי דְּשַׁמְעַהּ מֵרַבִּי יוֹחָנָן, הָא לְבָתַר דְּשַׁמְעַהּ מֵרַבִּי יוֹחָנָן. אֶלָּא חוּץ קַשְׁיָא לְרַבִּי יוֹחָנָן!"
Chullin 39a:14,"הוּא מוֹתֵיב לַהּ וְהוּא מְפָרֵק לַהּ: — בְּאַרְבַּע עֲבוֹדוֹת. וְהָכִי קָאָמַר: וּמָה בִּמְקוֹם שֶׁמַּחְשָׁבָה פּוֹסֶלֶת, בְּמוּקְדָּשִׁין בְּאַרְבַּע עֲבוֹדוֹת: — אֵין הַכֹּל הוֹלֵךְ אֶלָּא אַחַר הָעוֹבֵד,"
Chullin 39b:1,"מְקוֹם שֶׁאֵין מַחְשָׁבָה פּוֹסֶלֶת, בְּחוּלִּין, אֶלָּא בִּשְׁתֵּי עֲבוֹדוֹת, — אֵינוֹ דִּין שֶׁלֹּא יְהֵא הַכֹּל הוֹלֵךְ אֶלָּא אַחַר הַשּׁוֹחֵט?"
Chullin 39b:2,תַּנְיָא כְּווֹתֵיהּ דְּרַבִּי יוֹחָנָן: הַשּׁוֹחֵט אֶת הַבְּהֵמָה לִזְרוֹק דָּמָהּ לַעֲבוֹדָה זָרָה וּלְהַקְטִיר חֶלְבָּהּ לַעֲבוֹדָה זָרָה — הֲרֵי אֵלּוּ זִבְחֵי מֵתִים. שְׁחָטָהּ וְאַחַר כָּךְ חִישֵּׁב עָלֶיהָ — זֶה הָיָה מַעֲשֶׂה בְּקֵיסָרִי וְלֹא אָמְרוּ בָּהּ לֹא אִיסּוּר וְלֹא הֶיתֵּר.
Chullin 39b:3,אָמַר רַב חִסְדָּא: לֹא אָמְרוּ בָּהּ אִיסּוּר — מִשּׁוּם כְּבוֹדָן דְּרַבָּנַן. — לֹא הֶיתֵּר — מִשּׁוּם כְּבוֹדוֹ דְרַבִּי אֱלִיעֶזֶר.
Chullin 39b:4,"מִמַּאי דִּלְמָא עַד כָּאן לָא קָאָמְרִי רַבָּנַן הָתָם, אֶלָּא דְּלָא שְׁמַעְנֵאּ דְּחַשֵּׁיב, אֲבָל הָכָא דִּשְׁמַעְנֵאּ דְּחַשֵּׁיב — הוֹכִיחַ סוֹפוֹ עַל תְּחִלָּתוֹ!"
Chullin 39b:5,"אִי נָמֵי: עַד כָּאן לָא קָאָמַר רַבִּי אֱלִיעֶזֶר הָתָם אֶלָּא גַּבֵּי נׇכְרִי, דִּסְתָם מַחְשֶׁבֶת נׇכְרִי לַעֲבוֹדָה זָרָה, אֲבָל יִשְׂרָאֵל, הוֹכִיחַ סוֹפוֹ עַל תְּחִלָּתוֹ לָא אָמְרִינַן!"
Chullin 39b:6,אֶלָּא אָמַר רַב שֵׁיזְבִי: לֹא אָמְרוּ בָּהּ הֶיתֵּר — מִשּׁוּם כְּבוֹדוֹ דְּרַבָּן שִׁמְעוֹן בֶּן גַּמְלִיאֵל: הֵי רַבָּן שִׁמְעוֹן בֶּן גַּמְלִיאֵל?
Chullin 39b:7,"אִילֵּימָא רַבָּן שִׁמְעוֹן בֶּן גַּמְלִיאֵל דְּגִיטִּין, דִּתְנַן: — הַבָּרִיא ""שֶׁאָמַר כִּתְבוּ גֵּט"" לְאִשְׁתִּי, — רָצָה לְשַׂחֵק בָּהּ."
Chullin 39b:8,"וּמַעֲשֶׂה בְּבָרִיא שֶׁאָמַר ""כִּתְבוּ גֵּט לְאִשְׁתִּי"", וְעָלָה לַגָּג וְנָפַל וָמֵת, אָמַר רַבָּן שִׁמְעוֹן בֶּן גַּמְלִיאֵל: אִם מֵעַצְמוֹ נָפַל, — הֲרֵי זֶה גֵּט, וְאִם הָרוּחַ דָּחַתּוּ אֵינוֹ גֵּט"
Chullin 39b:9,וְהָוֵינַן בַּהּ: מַעֲשֶׂה לִסְתּוֹר?
Chullin 39b:10,"חַסּוֹרֵי מִיחַסְּרָא וְהָכִי קָתָנֵי: אִם הוֹכִיחַ סוֹפוֹ עַל תְּחִלָּתוֹ, — הֲרֵי זֶה גֵּט, וּמַעֲשֶׂה נָמֵי בְּבָרִיא ""שֶׁאָמַר כִּתְבוּ גֵּט"" לְאִשְׁתִּי, וְעָלָה לַגָּג וְנָפַל וָמֵת, אָמַר רַבָּן שִׁמְעוֹן בֶּן גַּמְלִיאֵל: אִם מֵעַצְמוֹ נָפַל — הֲרֵי זֶה גֵּט, וְאִם הָרוּחַ דָּחַתּוּ — אֵינוֹ גֵּט. —"
Chullin 39b:11,"וְדִלְמָא שָׁאנֵי הָתָם, דְּקָאָמַר ""כִּתְבוּ!"
Chullin 39b:12,"אֶלָּא אָמַר רָבִינָא: מִשּׁוּם כְּבוֹדוֹ דְּרַבָּן שִׁמְעוֹן בֶּן גַּמְלִיאֵל דְּהָכָא, דְּתַנְיָא: הַכּוֹתֵב נְכָסָיו לַאֲחֵרִים וְהָיוּ בָּהֶן עֲבָדִים, וְאָמַר הַלָּה: אִי אֶפְשִׁי בָּהֶן, אִם הָיָה רַבּוֹ שֵׁנִי, כֹּהֵן — הֲרֵי אֵלּוּ אוֹכְלִין בִּתְרוּמָה. רַבָּן שִׁמְעוֹן בֶּן גַּמְלִיאֵל אוֹמֵר: כֵּיוָן שֶׁאָמַר הַלָּה אִי אֶפְשִׁי בָּהֶן — כְּבָר זָכוּ בָּהֶן יוֹרְשִׁין."
Chullin 39b:13,וְהָוֵינַן בַּהּ: לְתַנָּא קַמָּא אֲפִילּוּ עוֹמֵד וְצוֹוֵחַ?
Chullin 39b:14,"אֲמַר רַבָּה, וְאִיתֵּימָא רַבִּי יוֹחָנָן: בְּצוֹוֵחַ מֵעִיקָּרָא, — דְּכוּלֵּי עָלְמָא לָא פְּלִיגִי דְּלָא קָנָה בְּשׁוֹתֵק, וּבַסּוֹף צוֹוֵחַ — דְּכוּלֵּי עָלְמָא לָא פְּלִיגִי דִּקְנָה"
Chullin 39b:15,"כִּי פְּלִיגִי שֶׁזִּיכָּה לוֹ עַל יְדֵי אַחֵר, וְשָׁתַק, וּלְבַסּוֹף צָוַוח תַּנָּא קַמָּא סָבַר: מִדִּשְׁתֵיק — קְנָנְהוּ, — וְהַאי דְּקָא צָוַוח — מִיהְדָּר קָא הָדַר בֵּיהּ. —"
Chullin 39b:16,"וְרַבָּן שִׁמְעוֹן בֶּן גַּמְלִיאֵל סָבַר: הוֹכִיחַ סוֹפוֹ עַל תְּחִילָּתוֹ, וְהָא דְּלָא צְוַוח מֵעִיקָּרָא, סָבַר: כִּי לָא אָתֵי לִידִי אַמַּאי אֶצְוַוח."
Chullin 39b:17,אָמַר רַב יְהוּדָה אָמַר שְׁמוּאֵל: הֲלָכָה כְּרַבִּי יוֹסֵי.
Chullin 39b:18,"הָנְהוּ טַיָּיעֵי דַּאֲתוֹ לְצִיקוֹנְיָא, יְהוּב דִּיכְרֵי לְטַבָּחֵי יִשְׂרָאֵל, אֲמַרוּ לְהוּ: דְּמָא וְתַרְבָּא לְדִידַן, מַשְׁכָּא וּבִישְׂרָא לְדִידְכוּ. שַׁלְחַהּ רַב טוֹבִי בַּר רַב מַתְנָה לְקַמֵּיהּ דְּרַב יוֹסֵף: כִּי הַאי גַּוְונָא מַאי? שְׁלַח לֵיהּ, הָכִי אָמַר רַב יְהוּדָה אָמַר שְׁמוּאֵל: הֲלָכָה כְּרַבִּי יוֹסֵי."
Chullin 39b:19,"אֲמַר לֵיהּ רַב אַחָא בְּרֵיהּ דְּרַב אַוְיָא לְרַב אָשֵׁי: לְרַבִּי אֱלִיעֶזֶר יְהֵיב לֵיהּ זוּזָא לְטַבָּח יִשְׂרָאֵל, מַאי? אֲמַר לֵיהּ: חָזֵינַן אִי אִינִישׁ אַלָּמָא הוּא, דְּלָא מָצֵי מְדַחֵי לֵיהּ: — אָסוּר, וְאִי לָא, — אָמַר לֵיהּ: רֵישָׁיךָ וְהַר."
Chullin 39b:20,"מַתְנִי' הַשּׁוֹחֵט לְשֵׁם הָרִים, לְשֵׁם גְּבָעוֹת, לְשֵׁם יַמִּים, לְשֵׁם נְהָרוֹת, לְשֵׁם מִדְבָּרוֹת, — שְׁחִיטָתוֹ פְּסוּלָה."
Chullin 40a:1,"שְׁנַיִם אוֹחֲזִין בְּסַכִּין וְשׁוֹחֲטִין, אֶחָד לְשֵׁם אֶחָד מִכׇּל אֵלּוּ, וְאֶחָד לְשֵׁם דָּבָר כָּשֵׁר — שְׁחִיטָתוֹ פְּסוּלָה."
Chullin 40a:2,"גְּמָ' פְּסוּלָה — אִין, זִבְחֵי מֵתִים, — לָא. וּרְמִינְהִי: הַשּׁוֹחֵט לְשׁוּם הָרִים, לְשׁוּם גְּבָעוֹת, לְשׁוּם נְהָרוֹת, לְשׁוּם מִדְבָּרוֹת, לְשׁוּם חַמָּה וּלְבָנָה, לְשׁוּם כּוֹכָבִים וּמַזָּלוֹת, לְשׁוּם מִיכָאֵל הַשַּׂר הַגָּדוֹל, לְשׁוּם שִׁילְשׁוּל קָטָן — הֲרֵי אֵלּוּ זִבְחֵי מֵתִים!"
Chullin 40a:3,"אָמַר אַבָּיֵי, לָא קַשְׁיָא: הָא, דְּאָמַר לְהַר. הָא, דְּאָמַר לְגַדָּא דְּהַר: דַּיְקָא נָמֵי, דְּקָתָנֵי דּוּמְיָא דְּמִיכָאֵל שַׂר הַגָּדוֹל, שְׁמַע מִינַּהּ."
Chullin 40a:4,"אָמַר רַב הוּנָא: הָיְתָה בֶּהֱמַת חֲבֵירוֹ רְבוּצָה לִפְנֵי עֲבוֹדָה זָרָה, כֵּיוָן שֶׁשָּׁחַט בָּהּ סִימָן אֶחָד — אֲסָרָהּ. סָבַר לַהּ כִּי הָא דְּאָמַר עוּלָּא אָמַר רַבִּי יוֹחָנָן: אַף עַל פִּי שֶׁאָמְרוּ הַמִּשְׁתַּחֲוֶה לְבֶהֱמַת חֲבֵירוֹ לֹא אֲסָרָהּ, עָשָׂה בָּהּ מַעֲשֶׂה — אֲסָרָהּ."
Chullin 40a:5,"אֵיתִיבֵיהּ רַב נַחְמָן לְרַב הוּנָא: הַשּׁוֹחֵט חַטָּאת, בְּשַׁבָּת, בַּחוּץ, לַעֲבוֹדָה זָרָה, — חַיָּיב שָׁלֹשׁ חַטָּאוֹת: וְאִי אָמְרַתְּ כֵּיוָן שֶׁשָּׁחַט בָּהּ סִימָן אֶחָד אֲסָרָהּ — אַשְּׁחוּטֵי חוּץ לָא לִיחַיַּיב,"
Chullin 40b:1,"מְחַתֵּךְ בְּעָפָר הוּא! אָמַר רַב פָּפָּא: הָכָא בְּחַטַּאת הָעוֹף עָסְקִינַן, דְּכוּלְּהוּ בַּהֲדֵי הֲדָדֵי קָאָתֵי."
Chullin 40b:2,מִכְּדֵי רַב הוּנָא כְּמַאן אַמְרַהּ לִשְׁמַעְתֵּיהּ? כְּעוּלָּא: — וְעוּלָּא מַעֲשֶׂה כֹּל דְּהוּ קָאָמַר! —
Chullin 40b:3,"אֶלָּא, בְּאוֹמֵר בִּגְמַר זְבִיחָה הוּא עוֹבְדָהּ."
Chullin 40b:4,"אִי הָכִי, מַאי אִירְיָא חַטָּאת? לַישְׁמְעִינַן זֶבַח!"
Chullin 40b:5,"אֶלָּא אָמַר מָר זוּטְרָא מִשְּׁמֵיהּ דְּרַב פָּפָּא: הָכָא בְּמַאי עָסְקִינַן? — כְּגוֹן שֶׁהָיָה חֲצִי קָנֶה פָּגוּם, וְהוֹסִיף עָלָיו כׇּל שֶׁהוּא, וּגְמָרוֹ, דְּכוּלְּהוּ בַּהֲדֵי הֲדָדֵי קָאָתְיָין."
Chullin 40b:6,"אָמַר רַב פָּפָּא: אִי לָאו דְּאָמַר רַב הוּנָא סִימָן אֶחָד, לָא הָוְיָא חַטָּאת תְּיוּבְתֵּיהּ: מַאי מַעֲשֶׂה — מַעֲשֶׂה רַבָּה."
Chullin 40b:7,"וְאָמַר רַב פָּפָּא: אִי לָאו דְּאָמַר רַב הוּנָא בֶּהֱמַת חֲבֵרוֹ, לָא הָוְיָא חַטָּאת תְּיוּבְתֵּיהּ: מַאי טַעְמָא — דִּידֵיהּ מָצֵי אָסַר, דְּחַבְרֵיהּ לָא מָצֵי אָסַר?"
Chullin 40b:8,"פְּשִׁיטָא! מַהוּ דְּתֵימָא: כֵּיוָן דְּקָנֵי לֵיהּ לְכַפָּרָה — כְּדִידֵיהּ דָּמְיָא, קָא מַשְׁמַע לַן."
Chullin 40b:9,(נָעַץ סִימָן): רַב נַחְמָן וְרַב עַמְרָם וְרַב יִצְחָק אָמְרִי: אֵין אָדָם אוֹסֵר דָּבָר שֶׁאֵין שֶׁלּוֹ.
Chullin 40b:10,"מֵיתִיבִי: הַשּׁוֹחֵט חַטָּאת בַּשַּׁבָּת בַּחוּץ לַעֲבוֹדָה זָרָה — חַיָּיב שָׁלֹשׁ חַטָּאוֹת, וְאוֹקִימְנָא בְּחַטַּאת הָעוֹף וּבַחֲצִי קָנֶה פָּגוּם: טַעְמָא דְּחַטַּאת הָעוֹף הוּא, דְּכוּלְּהוּ בַּהֲדֵי הֲדָדֵי קָאָתְיָין,"
Chullin 41a:1,"אֲבָל זֶבַח — לָא, וְאִי אֵין אָדָם אוֹסֵר דָּבָר שֶׁאֵינוֹ שֶׁלּוֹ, מַאי אִרְיָא חַטַּאת הָעוֹף? אֲפִילּוּ חַטַּאת בְּהֵמָה נָמֵי! כֵּיוָן דְּקַנְיָא לֵיהּ לְכַפָּרָה — כְּדִידֵיהּ דָּמְיָא."
Chullin 41a:2,"תָּא שְׁמַע: שְׁנַיִם אוֹחֲזִין בְּסַכִּין וְשׁוֹחֲטִין, אֶחָד לְשׁוּם אֶחָד מִכׇּל אֵלּוּ, וְאֶחָד לְשׁוּם דָּבָר כָּשֵׁר — שְׁחִיטָתוֹ פְּסוּלָה! הָכָא בְּמַאי עָסְקִינַן? דְּאִית לֵיהּ שׁוּתָּפוּת בְּגַוַּהּ."
Chullin 41a:3,"תָּא שְׁמַע: הַמְטַמֵּא, וְהַמְדַמֵּעַ, וְהַמְנַסֵּךְ, בְּשׁוֹגֵג — פָּטוּר, בְּמֵזִיד — חַיָּיב. הָכָא נָמֵי דְּאִית לֵיהּ שׁוּתָּפוּת בְּגַוַּהּ."
Chullin 41a:4,"כְּתַנָּאֵי: גּוֹי שֶׁנִּיסֵּךְ יֵינוֹ שֶׁל יִשְׂרָאֵל, שֶׁלֹּא בִּפְנֵי עֲבוֹדָה זָרָה — אֲסָרוֹ רַבִּי יְהוּדָה בֶּן בְּתֵירָא וְרַבִּי יְהוּדָה בֶּן בָּבָא מַתִּירִין אוֹתוֹ מִפְּנֵי שְׁנֵי דְבָרִים: אֶחָד — שֶׁאֵין מְנַסְּכִין יַיִן אֶלָּא בִּפְנֵי עֲבוֹדָה זָרָה, וְאֶחָד — שֶׁיָּכוֹל לוֹמַר לוֹ: לֹא כׇּל הֵימֶנָּךְ שֶׁתֶּאֱסֹר יֵינִי לְאוֹנְסִי."
