,,,,,,,
Ohev Yisra‘el,Jerusalem 1996,manually,"be-ha‘alotekha, p. 192.","עשה לך שתי חצוצרות כסף וגו'  [י, ב]. שמעתי בשם הרב הקדוש כו' מוהר""ר דוב בער זללה""ה שאמר אלו הדיבורים עשה לך שתי חצוצרו""ת נוטריקון שתי חצי צורות. אך פירושן של הדברים לא שמעתי. וי""ל ביאור הדברים כי דבר גדול דיבר וסוד עמוק. כי הנה ידוע מזוהר הקדוש (בראשית כא ב) ומספרים הקדושים כי משה נקרא בבחינת בעלה דמטרוניתא בעלה דשכינתא קדישא כי הוא המשפיע למלכותא קדישא כנסת ישראל כלה קרואה בנעימה בסוד כלת משה נמצא כי בבחינה זו נקרא משה רבינו ע""ה בבחינת דכ""ר כי הוא המשפיע. ועוד נודע מספרים הקדושים כי משה רבינו ע""ה הוא בחינת דעת העליון והוא בבחינת מקבל בחינת נוקבא. כי מקבל השפעה והארה ממוחין עילאין קדישין ג' ראשונות סוד כתר חכמה בינה. נמצא שהיו לו למשה רבינו ע""ה שני בחינות, בחינת משפיע ובחינת מקבל, דכר ונוקבא. ועם כל זה אין אנו יכולין להשיג הדברים על בוריין איזה בחינה נקרא בבחינת מקבל ואיזה בבחינת משפיע. כי יש לומר שהמשפיע בעצמו נקרא מקבל לגודל התענוג שמקבל מזה שמשפיע. על דרך שאמרו חכמינו ז""ל (פסחים קיב א) יותר ממה שהעגל רוצה לינק הפרה רוצה להניק. ועם כל זה ב' בחינות המה וכל אחד נקרא בבחינת חצי צורה כי צורה שלימה הוא דכר ונוקבא. כמו שכתוב (בראשית ה, ב) זכר ונקבה בראם ויקרא שמם אדם. ונמצא כי משה רבינו ע""ה היה בבחינת שני חצי צורות. והנה תיבת חצוצרת חסר כמו שכתוב בתורה הוא נוטריקון חצי צרת כי שתי פעמים מספר מש""ה עולה מנין צר""ת:
ועל פי זה נבוא לבאר הפסוקים. עשה לך שתי חצוצרת, היינו שמשה רבינו ע""ה יעשה מעצמו בחינת שתי חצי צר""ת שתי בחינות משה בחינת דכר ובחינת נוקבא וכמבואר. כסף, היינו שאלו הבחינות יהיו נכספים ונחשקים זה לזה מלשון (תהלים פד, ג) נכספה וגם כלתה נפשי...",,,
Igra de-Kalla,Lvov 1868,manually,"vol. 2, be-ha‘alotekha, fol. 7a.","עשה לך שתי חצוצרות כסף וכו' . הרב הקדוש מהרד""ב זצוק""ל פירש, חצוצרות מלשון חצא""י צורו""ת, עייש""ד כי מאוד עמקו מחשבותיו. ועפ""י דבריו הקדושים נ""ל לפרש דהנה הנפש היורדת לגוף האדם היא מהשכינה אם הבנים, וכבר ידעת כי הרוחניות לא יעתק ממקום למקום רק יתרבה, ואפילו שיורד ממקומו אעפי""כ ישאר במקום הראשון, והנה הנשמה גם כן הגם שיורדת לגוף האדם עכ""ז תשאר בצורתה במלכות שמים אם הבנים, על כן תקרא הנשמה שתי חצאי צורות, חציה למעלה וחציה למטה. והנה כבר ידעת שהנשמה כלולה מרמ""ח איברים רוחניים דמיון הגוף, והנה נתן הש""י לעמו רמ""ח מצות עשין להאיר על ידם רמ""ח איברי הנשמה, היינו שיאירו בה רמ""ח איברין דמלכא, היינו רמ""ח עליונים שבחלק הנשמה אשר היא ספונה למעלה בשכינה, ואז מתדבקין רמ""ח ברמ""ח בסוד הבן יקיר לי וכו' רח""ם ארחמנ""ו וכו' [ירמיה לא יט], וזה סוד אברה""ם אברה""ם [בראשית כב יא] ב' פעמים רמ""ח (כתוב אצלינו במקו""א), ובהיפך יובן הדבר בהיפך, בשומו מסך המבדיל ח""ו כשלא ישתוקק לדבק בחלק הנשמה העליונה על ידי המצות, אזי כמים הפנים לפנים, והבן. וזה סוד מלכות שמים שלימה [ברכות יד ב] כי ב' פעמים רמ""ח בגימטריא מלכו""ת, והבן. וזה עשה לך שתי חצוצרות (היינו השתי חצאי צורות) כסף שיהיו משתוקקים זה לזה זה לקבל וזה להשפיע ויהיה מלכות שמים שלימה, והכל על ידי קיום המצות, וגם שאר הפסוק יש לפרש על דרךזה, ולא הארכנו כעת.",,,
Benei Yiissakhar,Bnei Berak 2005,copied from bar ilan,"Ma'amarei Hodesh Adar, ma'amar 2, shekel ha-kodesh, derush 2","דברי המדרש [במ""ר פט""ו י""ד] עשה לך שתי חצוצרות כסף [במדבר י א] זהו שאמר הכתוב ירא את י""י בני ומלך [משלי כד כא], המליכהו עליך, והוא פלאי, ופירשנו בזה עפ""י דברי הרב הקדוש מהרד""ב זצוק""ל כתב, עשה לך שתי חצוצרו""ת, שתי חצאי צורות, כס""ף שיהיו נכספים זה לזה, ולפי דברינו הנ""ל יתפרשו דברי הרב, היינו חלק הנפש אשר הוא בעולם הזה מלובש בגוף תכסוף למקורה לחלק השמיימי, ואז חלק השמיימי יכסוף להאיר לחלק אשר בעולם הזה כנ""ל, והנה רמ""ח בגימטריא חצי (מספר) מלכו""ת, והנה גם חלק הנפש השמיימי במקורה הוא גם כן רמ""ח, זה הוא מלכו""ת שמים שלימה שהזכירו חז""ל [ברכות טו א] והוא סוד אברה""ם אברה""ם [בראשית כב יא] הנזכר אחר העקידה, אחר שכבר נתדבק אברהם כל כך בקונו שמסר להש""י דבר החביב עליו יותר מנפשו היינו בן יחיד הבן יקיר לו, הוא המסירת הנפש המופלג והדיבוק לגמרי בקונו ונתהוו לאחדים ממש חלקי הנפשות, רמ""ח רמ""ח אברה""ם אברה""ם, ונתהווה מספר מלכו""ת שמים שלימה, (ותוכל להשכיל להיטב אחר כך ויקרא מלאך י""י אל אברה""ם שנית מן השמים, ר""ל אל הנפש השנית שהוא מן השמים, ואין להאריך והמשכיל יבין), והוא לדעתי סוד הפסוק הבן יקיר לי אפרים וכו' רח""ם ארחמנ""ו נאום י""י [ירמיה לא יט], ובזה יתבארו דברי המדרש הנ""ל, עשה לך שתי חצוצרות כסף, היינו כסיפות השתי חצאי צורות זהו שאמר הכתוב ירא את ד' בני ומלך, מאי ומלך המליכהו עליך דכיון דבשתי חצאי צורות יתחברו רמ""ח רמ""ח יתהווה מלכו""ת שמים שלימה, ואתה תבין כי קצרתי וביארתי במקום אחר",,,
Va-Yahel Moshe,Lvov 1868,manually,"tehillim 98, fol. 20b.","א""י דהנה אאמ""ו זצללה""ה אמר בשם הה""ק דוב בער זצללה""ה מ""מ מראוונע תיבת חצוצרות הוא נוטריקון חצי צורות, שהאדם עצמו הוא רק כחצי צורה. ועם הבוב""ה החונן לאדם דעת איך לעבוד אותו הוא צורה שלימה ע""כ וזהו פיה""כ בחצוצרות כשהאדם הוא בבחי' חצי צורה שמעצמותו אין לו שום כח ושכל לעבוד אותו ית', אך עם הבוב""ה הוא צורה שלימה. וזהו ג""כ וקול שופר, דקול הוא פנימיות, והשופר מעצמותו הוא ג""כ אין ואפס. אך יש בו הכנה לקבל קול התקיעה כשנופח בו כמו כן האדם צ""ל שמעצמותו אין לו שום כח ושכל לעבדו רק מהשפעת הבוב""ה בו. והוא והנותן לו כח לעשות חיל וזהו וקול שופר מפנימיות החיות האלקי הנשפע בתוכו ממנו באים יופי הדבורים ואמרי שפר הנאמרים לפניו ית""ש ואז הריעו לפני המלך ד' יהיה לכם הריעות והתחברות עם מלך ה' צבאות וכנ""ל. גם י״ל עפ״י הקדמה הנ״ל חצוצרות הוא חצי צורה. שבשוב האדם ובצדקו מעשיו לא יאמר די להפקיע עצמו ומה לי להצטער על חבירי לא כן כי כל אדם צריך לראות שיזכה חבירי על ידי. לכ״א בחצוצרות. שאהי׳ תמיד בעיניך כחצי צורה. ועם חבירך כשיתקן מעשיו כמוך תהי׳ צורה שלימה וכשתהי׳ כך תזכו ובקול שופר הוא קול הפשוט המורה על הרחמים. שיופיע עלינו הרחמים והחסדים. הריעו לפני המלך ד׳ שתהי' ריעים לפני ד׳ אל הוי״ה והרחמים.",,,
Or Torah (Tsemah Tsedek),,manually,"vol. 2, be-ha‘alotekha, p. 369","ובאו""ת מהמגיד נ""ע פי' שתי חצוצרות חצי צורות, כי על דמות הכסא דמות כמראה אדם כו' שהאדם שלמטה הוא חצי צורה וכשמתדבק בהקב""ה נעשה צורה שלימה כו', ויש לבאר דבריו ע""ד זכר ונקבה יחד הם אדם משא""כ כל א' לבדו נק' פלג גופא, גם להעיר מענין מחצית השקל, ולפי""ז י""ל ג""כ שהם נו""ה דאיהו בנצח כו' כנ""ל ועמ""ש ע""פ ה' צלך בת""א בד""ה רני ושמחי, גם להעיר מענין ועשיתם אתם כאלו עשאוני בד""ה אני ישנה גבי רעייתי שממשיכים האור בהמדות להיות חו""ג כו', משא""כ האור מצד עצמו מסתלק למעלה, א""כ הם העושים הצורה וזהו שתי חצי צורות כו' וע""ד גדול כחן של נביאים שמדמים צורה ליוצרה, ולהעיר מענין וייצר, ומענין המה היוצרים, וכן נו""ה נקראים תרי פלגי גופא, ועיין מזה בספר שערי אורה שער ג""ד ושניהם נכללים לפעמים כאחד כו' ולפי שמשה אמר ונחנו מ""ה ותחסרהו מעט מאלקים כו' ע""כ זכה לבחי' שתי חצי צורות הנ""ל, אשר [משה] היינו יחוד זו""נ ולכן נתנבא באספה""מ משא""כ שאר הנביאים שלא נתנבאו כ""א באסשא""מ לא זכו לשתי חצוצרות המורים על יחוד וגילוי אסה""מ בשא""מ, ולפ""ז שתי חצוצרות באים ליום שיש בו יחוד ו""ה, ולכן בר""ח תוקעים בחצוצרות שאזי יחוד שמשא וסיהרא אבל בר""ה שאזי המל' מקבלת מבינה שלמעלה מבחי' שמשא אזי תוקעים בשופר כו' וזהו תקעו בחדש שופר.",,Chabad,
Hemshekh ‘ayin bet,,manually,"vol. 2, mi-qets, p. 790.","וביאור הענין בכללות ההפרש בין תפלה לתורה ילה""ק מ""ש באו""ת מהה""מ ז""ל ע""פ עשה לך שתי חצוצרות כסף חצוצרות חצי צורות (היינו הקב""ה וכנס""י הם כבי' חצי צורות שמשלימים זא""ז, ונראה הכוונה על בחי' האור והגילוי דא""ס ב""ה וכן בנש""י בחי' ההתגלות של הנשמה כו'. דהנה כתי' יונתי תמתי ואי' במד""ר תאומתי לא אני גדול ממנה ולא היא גדולה ממני והיינו בחי' ז""א ומל' כשהן שוין בקומתן וכתר א' לשניהם כו', ובנפש הוא בחי' יחידה שבנפש שדבוקה בבחי' יחיד כו', והו""ע ובו תדבקון דבקות עצם בעצם שהן כדבר א' ממש כו' וכמ""ש בסי' בד""ה אחרי ה' תלכו, ועל בחי' ומדרי' זו אינו שייך חצי צורות שמשלימות זא""ז שהרי זהו בחי' העצמות שזה בבחי' שלמות בעצם כו'. אמנם ענין צורה הוא בחי' ההתגלות לא העצמות ממש, ובזה הוא שמשלימות זא""ז כו'.",,Chabad,
Ginzei Yisra'el,Jerusalem 1987,manually,"rosh ha-shanah, p. 11.","הנה איתא בשם זקני המגיד הק׳ זצ״ל, עה״פ ״עשה לך שתי חצוצרות של כסף״ ואמר ע״ז ״חצוצרות״, שתי חצי צורות, ולהלן (שם, ג־ה) אומר ״ותקעו בהם ונועדו אליך כל העדה וגו׳ ותקעתם תרועה ונסעו המחנות החנים קדמה״. וידוע, כי העיקר הוא שתהיה אחדות ואהבה ורעות בין בני ישראל, כי אז כולם יחד נאמר עליהם (שה״ש ד, ז) ״כולך יפה רעיתי״.
והנה ישראל נמשלים לגוף אחד וצריכים להתאחד הגוף עם הראש, והראש הוא צדיק הדור, וכל אחד צריך לחשוב כי הוא אך כחצי גוף והכל תלוי רק בהתאחד יחד שבטי ישראל עם מלכם בראשם, ולזה ג״כ כוונת תקיעת שופר לעוררם על זה, ולכן תחילה תוקעים אך תקיעה פשוטה, להורות על האחדות, ואח״כ כאשר יתאחדו, תוקעים תרועה, להודיע כי כבר התאחדו ונעשו רעים אהובים, וזה מרומז בלשון תרועה, ואז לא ייבצר מהם מאומה.
ועל זה מרמזת כוונת המגיד הקדוש על שתי חצוצרות, שתי חצי צורות, דהיינו כי כונת התקיעה להודיע להם כי כל אחד הוא אך החצי, ע״כ ״ונועדו אליך כל העדה ונסעו המחנות״ הלאה, עם המסילה העולה בית אל. ובזה כוונת חז״ל כי בפעם הראשונה אין השטן נתבהל, כי ידע שתחסר להם התאחדות ואינו ירא מפניהם, אבל בפעם השניה, בשומעו ע״י התרועה כי כבר התרועעו ונעשה ביניהם אחדות ואהבה, אז מפחד מאד ואמר, כי ״ודאי זהו שיפורא דיתקע בשופר גדול״ וכוי, כי אז אין מעצור לרוחם ורצונם וימלא ה׳ כל משאלות לבם.",,Ruzhin,
Akh Peri Tevu’ah,Munkatch 1876,manually,"vol. 2, be-ha‘alotekha,","שמעתי שבם הצדיקים דחצוצרות הוא לשון חצי צורות. ויש לומר דבאמת כ""א מישראל הוא רק חצי צורה ואינו נשלם רק עם השי""ת ולכן אם ח""ו מגיע עליו איזה דבר לא טוב צריך לדעת שדבר זה נוגע למעלה ג""כ ח""ו ולא יתפלל עבור עצמו רק עבור חלק שלמעלה משום דבכל צרתם לו צר ח""ו ועי""ז יש לו הישועה ואפשר שזהו הפי' המתפלל בעד חבירו והוא צריך לאותו דבר הוע נענה תחילה. וכן בהשמחה שיגיע לו ג""כ אל ישמח רק עבור חלק הגבוה... וזהו ג""כ בחי' השופר שהוא כלי ריקן והכל נעשה ע""י התוקע.",,,
Ma'or va-Shemesh,Breslau 1842,manually,"vol. 2, rosh hashanah, fol. 244b.","... חצוצרות הוא נוטריקון חצי צורות רומז, שזעיר אנפין ומלכות שהם חצי צורות קודם שמקבלין המוחין עומדים לקבל השפע שיורד מאריך אנפין על ידי השופר. וזהו שופר מאריך רומז, שהשופר פועל שיורד השפע מאריך אנפין אל הזעיר ונוקביה ונשלם שיעור קומתם, וחצוצרות מקצרות רומז, שהגבורות המעכבים השפע ועושין אתה זעיר ונוקביה בבחינת חצי צורות - מקצרות ומסתלקות תיכף, והבן.",Non-Attributed,,
Kol Ya'akov,Jerusalem 1989,manually,"be-ha‘alotekha, p. 188.","עשה לך שתי חצוצרות כסף. עפימ״ש [ברכות נ״ל.] בכל לבבך בשני יצריך, שצריך לעבוד שגם היצר הרע יהי משתוקק לה׳. וז״ש עשה לך שתתקן עצמך שתי חצוצרות שהיצר טוב והיצר הרע הם כל אחד חצי צורה זה הוא בימין וזה הוא בשמאל ותתקן ששתי חצי צורות וזהו אותיות חצוצרו׳׳ת, כסף שישתוקקו שניהם לה׳.",Non-Attributed,,
Kehilat Moshe,Lublin 1904,manually,"ki tavo, fol. 106a-b.","וזהו בחצוצרות וקול שופר הריעו לפני המלך ה', דידוע חצוצרות אותיות חצי צורות. ולדרכנו נראה לבאר דרומז על תרין ההין דהם חצי צורות כי אות ה' הוא ד' דאיתמלי ביו""ד או בוי""ו. וקול שופר רומז על י""ו כי קול הוא פנימיות הוא המחשבה היא היו""ד חכמה הקדומה לכל הקדומה ומתייחד הכל ע""י שופר דמות ו' בחי' זעיר אנפין.",Non-Attributed,,
Va-Yikah Moshe,Munkatch 1907,manually,"be-ha‘alotekha, fol. 23a.","וזה סמיכת הפסוקים על הצר הצורר אתכם זה יצה""ר והרעותם בחצוצרות שתי חצי צורות של אביו ואמו ונושעתם וגם וביום שמחתכם במועדיכם אם יעלה חידושים והיו לכם לזכרון.",Non-Attributed,,
Imrei Elimelekh,Warsaw 1876,manually,"be-ha‘alotekha, fol. 132b-133a","יבואר עפ""י מבואר בשם הרב האלהי מו""ה דב זללה""ה, חצוצרות הוא חצי צורות, ויבואר כי הנה עיקר בריאת העולם היה ע""י שעלה ברצונו הפשוט התענוג והשעשועים ונח""ר שיקבל מנשמות בנ""י, כי הגם שאין מספר לגדודיו בצבא מעלה ורבוא רבוון ישמשוני' באימה ויראה וששים ושמחים לעשות רצון קונם, מ""מ עיקר תענוג ושעשועים הוא משוכני בתי חומר אשר בעפר יסודם, והיצה""ר שוכן בקרבם ואורב עליהם תמיד והם מתגברים על יצרם ומהפכים חשוכא לנהורא וטעמא מרירא למתקא, מזה מגיע לו ית""ש תענוג ונח""ר יותר מכל צבא מעלה.וא""כ עיקר מעלת האדם וצורתו היא ע""י בחי' יצה""ר ויצ""ט שמגביר כח היצה""ט על היצה""ר וכח כ""א מהיצרים הוא בחי' חצי צורה. והנה כתיב ואהבת את ה' אלהיך בכל לבבך בשני יצריך ביצה""ט וביצה""ר כי הנה בראשונה צריך האדם להרגיז היצה""ט על היצה""ר, כי ידע ויבין כי רע ומר עזבו את ה' אלהיו והחטא בעצמו אשר הוא המרחקו מאור פני מלך חיים הוא יותר רע מכל עונשין שבעולם. והגם כי כ""ז אשר האדם מלובש בחומר העכור אין מרגיש זאת, אבל באמת כשיתבונן האדם היטב במעוז שכלו ודעתו ידע ויבין כי כן הוא האמת, וזה הוא בחינת יראת חטא ועי""ז יסיר ויפריד הרע וכח היצה""ר ממדותיו. אמנם בזאת אינו מקיים עוד בכל לבבך בשני יצריך, כי אינו עובד ביצה""ר רק שמרחיקו ומפרידו מאתו. אמנם העבודה בשני יצריך הוא, שיקח האהבה והחמדה, כח היצה""ר, לעבודתו ית' שיתלהב לבו בכח האהבה הלזו לשמו ית' ומהפך בחי' חשוכא חשכת היצה""ר לנהורא וטעמא מרירא למתקא. וכן בכל המדות יהפוך את רעת היצה""ר לטוב. והנה אח""כ כשכבר תיקן כל מדותיו והפך הרע שבהם לטוב, יוכל לזכות ולבוא למדרגה גבוהה, בחי' ביטול ואפס ואין בחי' כלות נפש ודביקות נפלאה באלהים חיים בסוד מחשבה עילאה למעלה מן המדות. ועפ""י המבואר יפורש הכתוב עשה לך שתי חצצורות, ור""ל עשה ותקן בחי' השתי חצי צורות היצה""ר והיצה""ט, שיהיה לך לטובתך, כי גם היצה""ר יהיה לטובתך, כי עיקר ע""י היצה""ר.",,,
Divrei Elimelekh,Warsaw 1890,manually,"be-ha‘alotekha, fol. 162a-b.","[א] וזהו עשה לך שתי חצוצרות. עשה הוא בחי' אהבה כנ""ל, חצוצרות הוא חצי צורות כנודע ממרן אלקי מהד""ב זצ""ל, ור""ל שתבוא לאהבה כשתתבונן כי לך ניתן שתי חצי צורות והוא חסד וגבורה, כי כל אחד הוא חצי ואין שלימות זה בלא זה כנ""ל. ושניהם בידך לאנהגא עלמין. כסף מקשה תעשה אותם, כסף הוא לשון נכסף נכספתי והוא תשוקה ואהבה, מקשה לשון חיבור ואחדות כמו דא לדא נקשן, ור""ל ועוד תבוא לתשוקה ואהבת ה' ביותר כשתתבונן מקשה תעשה עותם, כי כח בידך שתעשה אותם היינו החו""ג להיות מקשה וחיבור אחד, כולו חסד, להפך הגבורה לחסד או מקשה תעשה אותם, אשר כח בידך לחבר ב' אהבות כאחד, שע""י אהבתך להשי""ת תמשוך אהבת ה' אליך וכשתתבונן בזה צריך שתבוא לאהבה את ה' אכי""ר.[ב] ... עשה ותתקן הבחי' לך שלא תכוין בעבודתם בשבליל לך להנאתך ולטובתך, כי תדע ותבין שתי חצוצרות שתי צורות, שנשמתך הוא א' משתי חצאי צורות, חלק וניצוץ מהכל הוא א""ס ב""ה, וא""כ איך תחשוב בשביל החלק ולא בשביל הכל. לכן כסף מקשה תעשה אותם כסף הוא תשוקה ואהבה ומקשה הוא חיבור והשוואה, ור""כ לכן צריך שתעבוד רק מאהבה בלתי מחשבת טובת עצמך, כמו אהבת הקב""ה לישראל.[ג] א""י כי תבואו למלחמה בארצכם. כי יש לך אדם אשר רצונו ורעותא דלבי' הוא טוב ושלם עם ה', ורצונו לעשות רצון ה'. אלא שהשאור שבעיסה מעכב מלהוציא רעותא דלבי' דילי' אל הפועל על כל האברים דיל' אמנם יש אדם אשר כח הרע גובר עליו מבית ומחוץ אשר אין לו גם בחי' רצון הטוב. כי גם נפשו הי' לו לבחי' יצה""ר. אמנם גם האדם הלזה אין לו לייאש עצמו, וצריך לערוך מלחמה וקרב, כי יתבונן כי כל א' מישראל יהי' מי שיהי' היא חלק אלקי ממעל בחי' חצי צורה. לכן ודאי הבא לטהר מסייעין אותו. וה' יהי' בעזרו לנצח המלחמה. וזהו כי תבואו למלחמה בארצכם היינו ברצונכם כנ""ל, ורצ""ל גם כאשר תבואו למלחמה גם על רצונכם כי גם הבחי' רצון הוא רע ח""ו. על הצר הצורר אתכם היינו כי אתם בעצמכם נעשו צר הצורר ח""ו. מ""מ והרעותם בחצוצרות תריעו ותתרוצצו הצר הצורר ע""י חצוצרות שתי חצי צורות שתתבוננו כי אתם וקב""ה כביכול המה ב' חצאי צורות כנ""ל. ועי""ז ונזכרתם לפני ה' אלהיכם להושיע אתכם והבא לטהר מסייעין לו והבן.",,,
