,,,,,,,
Siftei Tsaddiqim,Premishlan 1883,manually,be-ha‘alotekha,"בפסוק וידבר ד' אל משה לאמר. עשה לך שתי חצוצרות כסף מקשה תעשה אותם... ונראה ליישב על פי מה ששמעתי מרבותי הקדושים זללה""ה. ובתחילה אקדים מה ששמעתי מש""ב הרב הקדוש מאפטא ז""ל שאמר על פסוק אתם נצבים היום כו' וזה לשונו, עיקר גדול אצלנו שכל צדיק הגדול שבדור צריך לקשר את עצמו עם כלל ישראל להשפיע לכל אחד מישראל שפע קודש לפי ערך נשמתו של המקבל, והרמז על זה מה שאנו אומרים והאופנים וחיות הקודש מתנשאים לעומת השרפים, כי הצדיקים הגדולים שבדור הם מכונים בשם שרפים לפי שהם דבוקים תמיד בהשי""ת בהתלהבות גדול ולבם בוער בקרבם בהשתוקקות גדול מים רבים לא יוכלו לכבות את האהבה, ותלמידי חכמים העוסקים תמיד בתורה ובחקים ומשפטים הם נקראים חיות הקודש לפי שהם נותנים חיות וקדושה בעולם על ידי הבל הקודש היוצא מפיהם, וכל שאר בני ישראל הפשוטים הם נקראים אופנים, לפי שהם נגררים אחר תלמידי חכמים כאופן הנגרר אחר הסוס המנהיג ומושך אותו כך הם שומעים בקול הורים לשמור ולעשות ולקיים כל אשר יאמרו אליהם על פי דברי התורה הקדושה. וכל השני כתות האלה שהם האופנים וחיות הקודש צריכים לדבק ולקשר עצמם בקשר אמיץ וחזק אל השרפים שהם הצדיקים גמורים בני עליה המועטים כדי שישפיע עליהם חכמה בינה ודעת מהשי""ת. וזה שאמר משה רבינו ע""ה לישראל קודם מותו אתם נצבים היום כלכם לפני ד' אלקיכם ראשיכם כו' כל איש ישראל ר""ל כך הייתי דבוק וקשור עם כל אחד מישראל עד שהבאתי אתכם למעלה הזאת שתהיו נצבים כולכם לפניו יתברך להשפיע עליכם שפע קודש כל אחד לפי ערכו ע""ש באריכות. ועיין מה שכתבתי לעיל בשם אדמ""ו זללה""ה.
וגם קרוב לענין זה שמעתי מאדמ""ו הרב הקדוש מוהר""ם מקאסוב על פסוק ויוצא משה את העם (שמות יט, טז) וגם מאדמ""ו הרב הקדוש מוהר""ר נפתלי מראפשיץ זללה""ה בפרשת ויצא, שצריך כל צדיק הגדול שבדור להשפיל את עצמו אל בני דורו לעיין בצרכיהם ולדבר עמהם בנחת כדי שיקבלו את דבריו באהבה וידע את כל צרכיהם מה שנחסר לכל אחד הן בגוף או בנפש ואחר כך כשחוזר במחשבתו הקדושה אל העולמות הקדושים בתורה ובתפלה הוא משפיע להם על ידי זה כל הטובות ומשלים לכל אחד את חסרונו.ולכן אמר הרב החסיד מוהר""ר צבי הכהן נ""י שזה הוא ענין החצוצרות שצריך הצדיק לחלק את צורת נשמתו על שני חלקים, דהיינו חצי צורה ישפיל למטה אל החומר כדי לעיין בצרכי ישראל, וחצי צורה יהא דבוק למעלה להשלים להם כל חסרונם על ידי הבל פיו שזה דומה ממש לתקיעת החצוצרות כי התקיעה בא מן הבל פה היוצא משני החצי צורות.ועל פי זה נוכל לפרש את מקראי קודש הנאמרים כאן בתורתינו הקדושה שהקב""ה לימד את משה רבינו ע""ה שהוא היה צדיק הגדול שבדור איך יקרב ויקשר את עצמו עם כל ישראל הקטנים והגדולים ואמר לו עשה לך שתי חצי צורות, כסף הוא לשון אהבה כמו שכתוב נכסוף נכספת (בראשית לא, ל) ר""ל התקשרות שני החצי צורות יהא באהבה עזה, דהיינו חצי צורה למטה באהבת ישראל וחצי צורה למעלה באהבת השם. מקשה תעשה אותם ר""ל שני האהבות האלה יהא תמיד קשה בעיניך להשיג אותם היינו מחמת גודל אהבת ישראל יקשהבעיניך תמיד החסרון שלהם ותשתוקק מאד למלאות חסרונם בגוף ובנפש וגם אהבת השם יקשה בעיניך תמיד איך להשיג אותו בשלימות,שאם תשיג איזה שכל טוב לעבודת הבורא ית""ש יקשה בעיניך איך להשיג החכמה והשכל שלמעלה מזה כדי לדבק בו באהבה יתירה וכןבכל פעם תעלה מעלה מעלה עד אין סוף. והיו לך למקרא העדה ולמסע את המחנות ר""ל השתי חצי צורות האלה יהיו לך כדי לקשר עצמךתמיד עם כל העדה אפילו אנשים הפשוטים, וגם למסע את המחנות הם תלמידי חכמים ההולכים מחיל אל חיל ויכולים בקל לעלות למעלה על ידי עוסקם בתורה רק שהם צריכים סיוע מהצדיקים גמורים כנ""ל. ותקעו בהן ונועדו אליך כל העדה אל פתח אוהל מועד ר""ל אם תעשה כן ותתקשר עמהם באהבה עזה, אזי תיכף ומיד כשישמעו שום דיבור מהבל פיך לעבודתו יתברך הדומה לתקיעה בעלמא הבאמהבל הפה מיד יאספו אליך כולם כאחד לקבל עליהם השראת קדושה העליונה הדומה לאוהל מועד ויעשו רצון קונם באמת ובלב שלם.",,,
Toledot Yitshak,Warsaw 1868,manually,"vol. 2, pinhas, fol. 13b.","עוד יש לרמז כי כתיב גבי פנחס וחצוצרות התרועה בידו. ופי' הרה""מ זצוקלה""ה ממעזריטש. על שתי חצוצרות. פי' שתי חצי צורות וזהו תלוי בנו לתקן את זה. ופנחס היה תמיד לבו נשבר ע""ז לתקן זה. וז""פ וחצוצרות היינו חצי צורות. התרועה לשון התחברות. וגם לשון שבירה שהיה לבו נשבר ע""ז. שיתחברו השתי חצי צורות. ולזה רומז היו""ד זעירא. על הקטנת ושברון לבו. כדי לתקן תיקון הנ""ל.",,,
Peri ha-‘Ets,Munkatch 1887,manually,", vol. 2, be-ha‘alotekha","והנה הקדוש מהרד""ב כ' שתי חצוצרות שתי הצי תורות וכל הצדיקים בכל ספריהם איש לפי דרכו חסרו לפרש כוונתו וגם אני הצעיר אענה חלקי שיהי' דבריו מותאמים עם דברי מהרח""ו.",,,
Ma’amar David,Lvov 1890,manually,,"מצאתי רמז מן התורה ע""ז שאמר הקב""ה למשה עשה לך שתי חצוצרות ע""ז אמר רבינו הקדוש רבי ר' שמעלקא מניקעלשפורג זללה""ה חצוצרת הוא חצי צורות כי האדם בלא השי""ת אינו יכול לעשות שום דבר רק הכל בעזרת הש""י א""כ הוא חצי צורה זה שאמרנו שהנדיבי לב שבחו""ל הם חצי צורה והלומדי תורה שבאה""ק המה חצי צור השנית ושניהם ביחד המה משלימים הצורה לחבר את האוהל להיות אחד. ולפ""ז מתורץ הגמרא מ""ש הדר בחו""ל דומה כמי שאין לו אלו' והדר בא""י דומה כמי שיש לו אלו' וקשה מה לשון דומה דמשמע שאין לו אבל באמת יש לו וזה פשיטא מי שדר בחו""ל דומה שאין לו אבל באמת יש לו אם הוא בחבורה תמכי דאורייתא כי חבירו החצי צורה שלו הוא באה""ק והוא עוסק בתורה דומה כאלו הוא בעצמו עוסק בתורה אבל מי שדר בא""י ואינו עוסק בתורה דומה שיש לו א' אבל באמת אינו כן כי אינו מלומדי תורה.",,,
Peri Tsadik,Lublin 1901,manually,"vol. 5, rosh ha-shanah, fol. 90b.","וחצוצרות מורה על אהבה כמו דאיתא בספר רמזי תורה מרבינו הרבי ר' בער זצ""ל דלשון חצוצרות חצי צורות היינו שורש יחוד קודשא בריך הוא ושכינתיה.",,,
Benei Binyamin,Premyshlan 1893,manually,"liqqutim – shoftim, fol. 60b.","תמים תהי' עם ד""א. ת""א פירש שלים תהא בדחלתא ד""א עפרש""י על לשון תמים.ול נראה לפרש הלשון תמים כי איתא מהרב הקדוש המגיד רבינו דוב זלה""ה עה""פ עשה לך שתי חצוצרות כסף מרמז על שתי חצי צורות ופרשו תלמידיו הק' כי רימז בזה דהנה ידוע דהגוף הוא החומר והנשמה נקרא צורה והנה הנשמה היא חלק אלקי ממעל נמצא כי הנשמה שבגוף האדם שרשה בגבהי מרומים וכל עבודינו לדמות החצי הצור שבגוף להחצי צורה העליונה שבמקום שרשה. וזהו עשה לך שתי חצוצרות היינו להשתדל כל ימיך שיהי' השני חצי צורותשוות ע""כ.ולהסביר דבריו הק' כי הכתוב אומר כי חלק ד' עמו א""כ הצורה היא הנשמה היא חלק אלקי ממעל ואם אדם עושה עבירות אזי מזיק להנשמה שנתפגמה לכן כשתרצה הנשמה לשוב לבוראה למקום שנחצבה לא תוכל להשוות א""ע למקום שנחצבה כי הוא זה כמו מקל שנחלק ונעשה ביניהם רפש וטיט שאין יכולין אח""כ השני חלקים להתחבר בלתי אם ירחיצו מקודם הרפש והטיט המפסיק כ""כ אם אדם עושה עבירה אזי נעשה כביכול על הנשמה שהיא חלק אלקי ממעל כעין רפש וטיט א""ז אינה יכולה עוד להתחבר למקום שרשה באילן הקדוש. עפי""ז פירוש הכתוב כך הוא שהתורה מזהיר להאדם שלא יעשה עבירה או עכ""פ יעשה תיכף תשובה עלי' כדי שהיהי' תמים עם ד""א היינו שיהי' מתאים חלק שלו הנאצל לנשמתו עם עיקר שורשו למעלה בלי הפסק ביניהם ודו""ק.",,,
Birkat Avraham,Warsaw 1905,manually,fol. 12a.,"או יאמר בהקדם מ""ש (פ' בהעלותך) עשה לך שתי חצוצרות כסף כי ידוע שהתורה בכללותה תפרוש לד""ח פרד""ס, נגלה ונסתר רמז סוד ולזאת האדם שהוא מבחר הבריאה, יוכל להגיע במעלות להבין עמקה וסודותי' וז""ש הארץ היתה תהו ובהו וחושך ע""פ תהום רומז לנ""ת סד""ר שקשה להבין מאוד מעמקי תהומה וזש""א עשה לך שתי חצוצרות כסף, כי כידוע מכתבי האר""י ז""ל חצי צורות, שיעשה לו כסף וחשק לחבר הואהל להיות השחים אחד צמודים בנגלה ונסתר.",,,
Hayyei Yitshak,Warsaw 1912,manually,"noah, fol. 12a-b","ומה שהשי""ת כביכול תולה החסרון בו ואומר אשר הרעותי וכדומה, זה נותן קיום להארץ. וזהו כעין מ""ש בגמ' הביאו עלי כפרה על שמיעטתי את הירח וד""ל. וע""כ הקשת הוא חצי עיגול, כמ""ש האר""י ז""ל בס' עץ החיים, שעיגול שלם מורה על השלימות ע""כ רומז חצי עיגול של הקשת לומר שהאדם לא נברא בשלימות. א""כ אין להעניש לאדם החוטא.וזשה""כ בחצוצרות וקול שופר הריעו לפני ה' ואמר הרה""מ מהרד""ב זצ""ו ממעזריטש חצוצרות היינו חצי צורות. וזה נותן קיום לארץ שלא יענשו כ""כ משום שלא נברא בתכלית השלימות.וזהו דכתיב ואשא אתכם על כנפי נשרים, היינו שהשי""ת מקבל החסרון ע""ע כמו שהנשר אומר מוטב יכנס החץ בי ולא בבני.",,,
Arugat ha-Bosem,Huszt 1913,manually,"vol. 2, nitsavim, fol. 174b.","ע""ד נ""ל בס""ד עפ""י מ""ד כי תבואו למלחמה בארצכם וגו' והרעותם בחצוצרות ונזכרתם לפני ה""א ונושעתם מאויביכם ופירשתי בס""ד עפ""י דברי המגיד הק' בס' ליקוטי אמרים חצוצרות היינו שני חצי צורות דישתדל שיהא ענפים דומים לשרשם ולא יהי' בחי' עונותיכם מבדילים ביני לבינכם וזה והרעותם ענין רעות בחצוצרות ועי""ז ונזכרתם לפני ה""א והנה כ""ז שערלה מכסה את הלב נמצא מחיצה מבדלת והיינו דהבטיח השי""ת ומל ה""א את לבבך וגו' וממילא ונושעתם מאויביכם וה""ד למען חייך וא""ש בס""ד.",,,
Siftei Tsaddikim (Y. Leiner),Pietrekow 1914,manually,unpaginated,"בשם הרב הק' וכו' ר""ר זלה""ה נבנ""מ זי""ע פירש עשה לך שתי הצוצרות היינו שני חצי צורות היינו שהאדם בעצמו הוא חצי צורה שמקבל עליו מדת מלכותו ויראתו של השי״ת ולית ליה מגרמי' כלום ונם צריך להאמין באמונה שלימה כמו שכתב בתיקונים שהצורה עליונה לא גנמר אלא בבריאת האדם והוא ג״כ חצי צורה. וכשהאדם מקבל עליו מדת מלכות ויראתו אז נגמר הצורה עליונו. וזהו שני חצי צורות.",,,
Yismah Yisra‘el,Lodz 1915,manually,"vol. 5 re‘eh, fol. 39b.","וענין עירובי הצירות עפ״י דרכי העבודה היא ע""ד שכ׳ המגיד הגדול הק׳ מהרד״ב ממעזריטש זצללה""ה על פסוק ""עשה לך שתי חצוצרות"", צירוף חצוצרות היא חצי צורות. ולפי קט שכלינו כוונתו נ״ל כנס""י עם דודה, שהם כחצי צורה כאו""א לבדו, כביכול כבודו לפי רצונו ית״ש ע״י התדבקותו כתאומתו כנס״י, כי אין מלך בלא עם, והנפש החיוני משתוקקת ג״כ לבוא למקור מחצבתה, ומחצבתה היא מתחת כסא הכטד כמאחז״ל נשמותיהם של ישראל חצובה מתחת כסא כבודו, עד שהכל...",,,
Tiferet Shmu'el,New York 1926,manually,p. 128.,"היוצא לנו מדברי הזוה״ק הנ״ל דמלד צריד להיות שלם בדיִן ורהמים, ואם לאו לא הוי מלד כדברי הזוה״ק מלכא וראי שלים הוא מכולא. והנה שני חצאין יחד נעשה דבר שלם, וזהו כונת דברי המניר הק׳ ממעזיריטש בביאור הכתוב עשת לך שתי חצוצרות, שתי חצי צורות, שאמר הקב״ה למשה רבינו ע״ה שהיה מלך שיהיה שלים מכולא מדין ורחמים כראוי למלך כי כל אחד משני אלו דין או רחמים הוא הצי צורה ע״כ יעשה שיהיה לו אלו השתי חצי צורות ויהיה שלים מכולא.והנה המדרש הבין נ״כ כן דשתי חצוצרות הכונה כדברי המגיד שתי תצי צורות, היינו דין ורחמים, וזהו שאמר המדרש שביום פטירת משה רבינו ע״ה לא השתמש בהן, מחמת אין שלטון ביום המות, כיון דאלו שתי תצי צורות הנ״ל שייכים רק אצל מלד ואין שלטון ביום המות, וזהו מה שמסיים המדרש, הוי עשת לד שתי חצוצרות כפף, והבן וזהו ג״כ כונת המדרש  מה שאמר עשת לך אתה משתמש בהן שאתה מלך והבן ובזה נבוא ג׳׳כ לביאור המררש הנ״ל עשה לך שתי תצוצרות כסף, זש""ה ירא את ה׳ בני ומלך, מהו ומלך המליכהו עליך, דהיה קשה להמדרש האיך משוה מורא מלכית למורא שמים, וכשבא בעל המדרש לפסוק עשה לד שתי תצוצרות, והבין הכונה דקאי על השתי תצי צורות הנ״ל דין ורחמים שראוי למלך להיות שלים בכולא.",,,
Ishei Yisra’el,Miholevits 1929,manually,"be-ha‘alotekha, fol. 76a.",עשה לך שתי חצוצרות כסף וכו׳ והי׳ לך למקרא למקרא העדה וכו׳ ותקעו בהן ונועדו אליך כל העדה וכו׳ ואיתא בסה״ק אוהב ישראל בשם רבינו הק׳ מו״ה דוב ממעזריטש זצוק״ל שתי חצוצרות שתי חצי צורות וצ״ב ואפשר לומר עפ״י דאיתא באלשי״ך הק׳ טעם למחצית השקל בשם רבינו מהר״ש אלקב״ץ זל״ה להורות אחדות בין ישראל למען ידעו כי כל אהד רק פלג גופא ורק בהצטרף עם חבירו אז הוא גוף שלם ונוכל ללמוד מזה איך צריכים להיות באחדות יע״ש והנה צורך החצוצרות היו למען יעמדו יחדיו ויהי׳ באחדות במקום אחד כמ״ש ונועדו אליך ולזה צריך כ״א להחזיק א״ע רק לחצי צורה ועי״כ יוכל לבא לאחדות וע״כ באה המצו' בזה בחצוצרות לרמז ע״ז שלהיות באחדות צריך כ״א להחזיק א״ע בחצי צורות כנוטריקון של חצוצרות וא״ש,,,
Divrei Shalom,Satmar 1936,manually,"vol. 1, ki tissa, fol. 66a","ואפ""ל עפ״מ שכ׳ בסה""ק בני״ש ע״פ דברי הרב הקדוש מהרד״ב זצוק""ל שפי' עשה לך שתי חצוצרות כסף שתי חצי צורות כסף שיהיו נכספים זל""ז וכתב הוא ז""ל שהנפש נחלק שנים חלק א' באת לעוה""ז וחלק א' נשאר שם במקורה בשמים ממעל ואותו חלק אשר בשמים ממעל מאיר לאשר בארץ בגוף האדם והחלק אשר בארץ מחוייב להשתוקק למקור אשר בשמים (וזה ענין מסה""נ באהבה) ולפ""ז יתפרשו דברי הרב היינ חלק הנפש אשר הוא בעוה""ז מלובש בגוף תכסוף למקורה לחלק השמיימי ואז חלק השמיימי יכסוף להאיר לחלק אשר בעוה""ז כנ""ל ולזה צוה השי""ת ליתן מחצית השקל דייקא.",,,
Peh Eliyahu,Lublin 1938,manually,"derush, fol. 11b-12a","משחרב ביהמ""ק אישתני שם שופרת""א לשם חצוצרת""א ע""ש הכוונה עפי""ד רבינו קוה""ק המגיד ממעזריטש הרר""ב זי""ע מובא בסה""ק אוהב ישראל פ' בהעלותך חצוצרות נוטריקון חצי צורות ע""ש הכוונה לדעתי כי מי שאינו שוה בשוה עם חבירו מביט בו בחצי פנים והא פתגם העולם, ער קוקט איהם אן מיט א האלב פנים. ומלפנים בזמן שביהמ""ק קיים הי' שלום במחנה ישראל הי' נקרא שופ""ר כנ""ל רמז העדר השטן. לא כן אחר חורבן ביהמ""ק ואין שלום נקרא חצוצרות חצי צורות אי אחדות.",,,
Mishnah Sakhir,Jerusalem 200,manually,"be-ha‘alotekha, p. 365","בספרי הצדיקים תלמידי בעש""ט זלה""ה [עי' עבודת ישראל ד""ה עשה לך] הביאו בשם רבינו קדש הקדשים מו""ה דובער המגיד הגדול ממעזריטש: 'עשה לך שתי חצי צורות,"" עיי""ש בדבריהם כוונה אמיתית בזה. אבל לי נראה לומר ג""כ כוונה פשוטה בזה, דמבואר במדרש [במדב""ר טו, טו] וברש""י דהקב""ה רצה לעשות בזה כבוד למשה רבינו ע""ה כמו שעושין למלך, וידוע מה דכתיב אצל מלך [דברים יז, יח] וכתב לו משנה תורה, והכוונה נראה לומר דידוע דלכל איש מוטל עליו חיוב אחד היינו להשלים את עצמו וצורתו, משא""כ על מלך ישנם שני חיובים השלמת העם והשלמת צורתו, וזה שאמרה התורה וכתב לו משנה תורה שעליו מוטל חיוב משנה וכפול מעל שאר העם. וידוע דהאדם השלם בכל מדרגה שהשיג יחשוב בעיני עצמו כאילו עוד לא השלים עצמו ועוד לא הגיע למעלה עליונה ושהוא הוא רק חצי צורה ולא השלים עוד צורתו, וא""כ במלך שיש שני חיובים בהשלמת צורת העם וצורת עצמו א""כ תמיד יהיה כאילו לא השלים חיוביו לא לגביהעם ולא לגבי עצמו, וזה הכוונה עשה לך שתי חצי צורות, היינו שעוד אינו צורה שלמה וגם העם עוד ג""כ לא נשלמה בצורתו, ועי""ז ישתדל להשיג שלימות יותר בין אצלו ובין אצל העם, וא""ש והבן.",,,
Ginat ha-Bitan,London 1944,manually,pp. 65-66.,"וזהו שנותן כל אחד חצי שקל ואחר כן יתחברו השקלים לשקלים שלימים. ובהפסוק עשה לך שתי חצוצרות כסף רמז בזה ״חצוצרות״ נוטריקון שתי חצי־צורות. ועד""ז מפרשים את פעסוק וכי תבואו למלחמה בארצכם על הצר הצורר אתכם והרעותם בהצוצרות והרעותם מלשון אחדו׳ וריעות, בחצוצרות בחצי־צורות כי כל אחד בפני עצמו הוא רק חצי צורה, וכשהם באגודה אחת אין כל אומה ולשון יכולה לשלוט בהם.",,,
Tiferet Yisra'el,Brooklyn 1945,manually,p. 20,"א״י ויקרא משה להושע בן נון יהושע וברש״י התפלל עליו י""ה יושיעך מעצת המרגלים, להבין למה תפס בזה השם י""ה, וי״ל עפ״י הידוע בשם הרבי ר׳ בער זצוק״ל עה״פ (במדבר י׳) עשה לך שתי חצוצרות שתי חצי צורות עכלה״ק, ויש לומר הענין בזה, בהקדם להבין מהו כח החצוצרות, בעת המלחמה על הצר הצורר, להיות תשועה להתגברות ולנצחון כמ״ש ותקעתם בחצוצרות ונושעתם מאויביכם, אלא על זה הכוונה של שתי חצי צורות, כלומר הגוף והנפש הם שתי חצי צורות והם כח החומרי והרוחני, והעיקר לחבר אותן שתי חצי צורות כאחד יחד, כמו שע״י הגוף והנפש יחד נעשה אדם חי ושלם, ואם תחלש גופו או נשמתו אין כחו שוה כלום, כן ע״י התחברות כח החומרי והרוחני גם יחד יש יכולת להתגבר על האויב.ובזה יובן מה שנאמר לו למשה: עשה לך שתי חצוצרות, ובמדרש עשה לך משלך, ירצה, כי משה נקרא איש אלקים שהי׳ מחציו ולמעלה אלקים ומחציו ולמטה איש (דב״ר פי״א), על זה שפיר עשה לך שתי חצוצרות, היינו שתי חצי צורות מבחי׳ שתי המדרגות שלך, של חציו איש וחציו אלקים, מכח הרוחני והחומרי שניהם כאחד.",,,
Ohel Shem,Jerusalem 1946,manually,p. 154,"עשה לך שתי חצוצרות אפשר לומר שהמלה מחולקת לשנים חצי צורות לרמוז לישראל כמו ענין מחצית השקל שיזכור כל יהודי בימי חייו שהוא רק חצי צורה והסר [צ""ל חסר] לו שלימות שזה יוכל להשיג דק אצל חבירו כשיתחברו שניהם יחדיו וישתלמו בהשגת המושכלות הראשונות.",,,
Esh Dat,Tel Aviv 1951,manually,"vol. 4, p. 181.","ועוד בענין החציין, כדרך שכתב באור תורה להרר""ב ז""ל בענין חצוצרות כי חצוצרות - חצי צורות, כסף לשון תאוה, שתהא מתאוה לה' וה' יאהב אותך, וכל הבריאה בשביל ישראל, רצ""ל רק בשבילו ית', על דרך משל האב אוהב הבן והבן האב, ויש להם געגועים לזה על זה, וא""כ בכל אחד חצי אהבה, שהוא חצי צורה, ושניהם ביחד הוי צורה שלימה, ע""כ תו""ד.ובדרך זה הוי גילוי האהבה וחצוי הצורות בהחצאות הדם. ובזה יוסבר לך מה שהערנו לעיל שמקודם אמרו רק נעשה, ואח""כ אמרו גם נשמע. והוא מטעם שמצות חצאת הדם, חצי על העם וחצי על המזבח שזהו חלק ה', מראה על הכסופים המרובים מעל ישראל לה', ועל האהבה מה' אל ישראל.",,,
