masechet,commentary,perek,halakha,page,comment,dh,base text ref,base text,problem
Shevuot,קרבן העדה,4,1,19a,"ומפי אחרים. כגון משביע אני עליכם שתבואו ותעידוני ואמרו אין אנו יודעים לך עדות ולא ענו אמן אינן חייבין עד שיכפרו בב""ד דכתיב אם לא יגיד ונשא עונו במקום שאלו היה מגיד היה מועיל וקרא במושבע מפי אחרים כתיב שנא' ושמעה קול אלה היינו ששמע מאחרים:",ומפי אחרים,JTmock Shevuot 4:1:1,"שבועת העדות נוהגת באנשים ולא בנשים ברחוקים ולא בקרובים בכשרים ולא בפסולים ואינה נוהגת אלא בראויין להעיד בפני בית דין ושלא בפני בית דין מפי עצמו ומפי אחרים אינן חייבין עד שיכפרו בו בב""ד דברי רבי מאיר וחכ""א בין מפי עצמו בין מפי אחרים אינן חייבין עד שיכפרו בו ובב""ד וחייבין על זדון שבועה ועל שגגתה ועל זדון העדות ואין חייבין על שגגתה ומה הוא חייב על זדונה קרבן עולה ויורד:",
Shevuot,קרבן העדה,4,1,19a,"@22גמ' @11שעירים. @33אי כתיב שעירים ידעינן שהן שנים דמיעוט רבים שנים הן א""כ מה ת""ל יקח שני שעירים לכתוב שעירים ואנא ידענא שהן שנים אלא לכך כתיב שני ללמד שיהו שניהם שווין בכל מה דאפשר כלומר כשם שנכללין בדבור אחד כך יהיו שוין כאלו שניהם אחד הן: כבשים. גבי תמידין כתיב כבשים בני שנה שנים ליום ובמצורע כתיב יקח שני כבשים: צפרים. במצורע כתיב שתי צפרים חיות: חצוצרות. כתיב קח לך שתי חצוצרות כסף: והכתיב לא תטה משפט גר יתום. ואי ס""ד בעינן שיהו שני בעלי דינין שוים לא מצינו גר דן אלא עם חבירו גר א""כ ל""ל קרא שלא להטות דין גר מהיכא תיתי להטות מפני שהוא גר הא שכנגדו נמי גר הוא אלא גר דן עם שאינו גר ויתום דן עם אינו יתום ש""מ שא""צ בעלי דינין להיות שוין וקשיא שני ל""ל אלא שני מופנה לדרוש מיניה גזרה שוה: הרי למדנו שאין האשה דנה. מגז""ש שאם אינו ענין לנידונים תנהו ענין לדיינים: מעתה. דלא מסברא ילפינן שאין האשה דנה אלא מקרא ואיכא למימר דהיינו טעמא דדין היינו תורה ונשים לאו בני תורה נינהו קשיא מנלן שאין האשה מעידה: ה""ג נאמר כאן שני על פי שנים עדים ונאמר להלן וישארו שני אנשים במחנה מה שני שנא' להלן אנשים ולא נשים ולא קטנים אף שני שנאמר כאן אנשים ולא נשים ולא קטנים א""כ למה נאמר ועמדו שני האנשים שלא יהא כו'. כ""ה ביומא. וה""פ השתא דאית לך גז""ש שאין האשה מעידה אמרינן נמי שאינה דנה מסברא אמרינן שאינה דנה דהא דאינה מעידה משום דנשים דעתן קלות אף לענין הדין כן א""כ ועמדו שני האנשים למעט אשה שאינה דנה ל""ל דהא מק""ו שמעינן: שלא יהא אחד עומד ואחד יושב. שכשיראה שמכבדין חבירו יותר ממנו יסתתמו טענותיו: מאריך פנים. כובש כעסו וכנגד השני מעיז פנים ומדבר אתו קשות: האסור. שלא אסרה התורה אלא שלא יהא אחד עומד ואחד יושב אבל כששניהן שוין מותר שאין עמידת בעלי דינין חובה: לבוש כשם שהוא לבוש. שלא יסתתמו דברי חבירו באמרו הב""ד לא יאמינו לי בראותם שהוא אדם חשוב ואני שפל לכן ילבשו בשוה: בשעה שמעידין שנאמר ועמדו כו'. ובעדים משתעי קרא דסמיך ליה כי יקום עד חמס באיש: אף הנידונים. צריכין לעמוד בשעת קבלת העדות: מ""ט. מנ""ל: אשר להם הריב כו'. והא ודאי בבעלי הדינים משתעי וה""ק קרא ועמדו שני האנשים אלו העדים וגם אותן אשר להם הריב והם הנידונים יעמדו בשעת עידותן: כתיב לא יומתו אבות על בנים. אין לפרש שלא יומתו אבות בעון בנים ובנים בעון אבות שהרי כבר נאמר איש בחטאו ימות אלא מה ת""ל לא יומתו אבות וגו' בעדות בנים קאמר: מיכן. מכאן שמעינן שלא יהו העדים קרובים לבעלי דינין: ה""ג ומניין שלא יהו העדים קרובים זה לזה הגע עצמך שאם הוזם אחד מהן כלום נהרג עד שיוזם חבירו אם אומר את כן לא היה נהרג על פיו ומניין שלא יהו העדים קרובים לדיינין הגע עצמך שאם הוזמו לא מפיהן נהרגין ומניין שלא יהו הדיינין כו' וכ""ה בהרי""ף פ' זה בורר. וה""פ מניין שלא יהו העדים קרובין זה לזה קאמר הש""ס לזה לא צריך קרא אמור לנפשך הא אם הוזם אחד מן העדים אינו נהרג עד שיוזם גם חבירו נמצא אם העדים קרובים זה לזה שהקרוב נהרג בעדותו של קרובו ושלא יהיו קרובים לדיינים נמי סברא היא שהרי אם הוזמו ע""פ הדיינין נהרגין ואין הדיינין ראויין לקבל הזמתן שהרי קרוביהם הם: מה העדים אינן קרובין זה לזה. כדילפינן בסמוך: ובנים. לא יומתו על אבות ל""ל דמדבנים פסולין על האבות ממילא האבות פסולין [על] הבנים אלא ללמד על שאר קרובים שפסולין זה לזה: ופריך עד. כאן לר""ע דדריש כפילות הכתובים בתורה לרבויי אתיין ניחא אלא לר""י דאמר דברה תורה כלשון בני אדם שאר קרובים מנלן: ושפטו העדה בין המכה ובין גואל הדם. אי ס""ד שהדיינין מותרים להיות קרובים לנידונים פעמים שהדיינין הם גואלי הדם ואינן דנין אלא להמכה ולא לגואל הדם וקרא קאמר שיהיו שופטים בין המכה ובין גואל הדם אבל לא למכה לחוד ש""מ בעינן שלא יהיו השופטים קרובים לא למכה ולא למוכה: אר""י אם אומר כו'. ר' יוסי מפרש דברי ר' ישמעאל כדפרישית בסמוך: ע""פ מטים. הדיינין נקראו מטים שדנין אחרי הרוב וכתיב אחרי רבים להטות: מה הדיינין אינן קרובין לנידונים. כדדייקינן מקרא ושפטו העדה: @66ה""ג מניין שלא יהיו העדים קרובין זה לזה הגע עצמך שאם הוזם אחד מהן כלום נהרג עד שיוזם חבירו אם אומר את כן לא נמצא נהרג על פיו ומניין שלא יהו העדים קרובין לדיינין הגע עצמך אם הוזמו לא מפיהן הן נהרגין: בכשרין ולא בפסולין מניין. אמתני' קאי דתנן שבועת העדות נוהגת {א) עי' בקרבן העדה בסנהדרין פ""ג ה""ח מה שחסר כאן. בירושלמי שלנו הוא בהלכה ט':",שעירים,JTmock Shevuot 4:1:2,"שעירים מיעוט שעירים שנים מה ת""ל שני שיהו שוין.",
Shevuot,קרבן העדה,4,1,19a,} בכשרין ולא בפסולין מניין שאינה נוהגת בפסולין הא מיהת לשקרא אישתבע:, בכשרין ולא בפסולין מניין שאינה נוהגת,JTmock Shevuot 4:1:17,בכשירין לא בפסולין. מניין אם לא יגיד ונשא עונו את שמגיד וחבירו משלם ממון יצא פסול שמגיד ואין חבירו משלם ממון:,
Shevuot,קרבן העדה,4,1,19a,אין חבירו משלם ממון. נמצא דמיעטיה קרא מעון דשבועת העדות ואינו חייב אלא משום שבועת שוא:,אין חבירו משלם ממון,JTmock Shevuot 4:1:17,בכשירין לא בפסולין. מניין אם לא יגיד ונשא עונו את שמגיד וחבירו משלם ממון יצא פסול שמגיד ואין חבירו משלם ממון:,
Shevuot,קרבן העדה,4,1,19a,"להוציא עד אחד. כלומר מנ""ל עד אחד שאמרו הבעלי דינין אנו מקבלין אותו לשנים שאינו חייב קרבן שבועה:",להוציא עד אחד,JTmock Shevuot 4:1:18,"מפי ב""ד. להוציא עד אחד. בשאמרו לו הרי את מקובל עלינו כשני עדים יהא חייב ות""ל והוא עד או ראה או ידע אם לא יגיד ונשא עונו את שכשר להעיד עדות תורה יצא אחד שאינו כשר להעיד:",
Shevuot,קרבן העדה,4,1,19a,"ה""ג בפני ב""ד להוציא עד אחד יכול יהא חייב ת""ל כו'. וה""פ יכול יהא חייב דהא חבירו משלם ממון על פיו:","ה""ג בפני ב""ד להוציא עד אחד יכול",JTmock Shevuot 4:1:18,"מפי ב""ד. להוציא עד אחד. בשאמרו לו הרי את מקובל עלינו כשני עדים יהא חייב ות""ל והוא עד או ראה או ידע אם לא יגיד ונשא עונו את שכשר להעיד עדות תורה יצא אחד שאינו כשר להעיד:",
Shevuot,קרבן העדה,4,1,19a,"ת""ל והוא עד כו'. צריך שיהא עד ראוי להוציא ממון מן הנתבע בע""כ על פי התורה לאפוקי עד אחד שיקיבלו אותו בשנים שאינו נאמן אלא ע""פ הנתבע פטור מקרבן שבועה:","ת""ל והוא עד כו'",JTmock Shevuot 4:1:18,"מפי ב""ד. להוציא עד אחד. בשאמרו לו הרי את מקובל עלינו כשני עדים יהא חייב ות""ל והוא עד או ראה או ידע אם לא יגיד ונשא עונו את שכשר להעיד עדות תורה יצא אחד שאינו כשר להעיד:",
Shevuot,קרבן העדה,4,1,19a,"שלא בפני ב""ד. מנלן דפטור:","שלא בפני ב""ד",JTmock Shevuot 4:1:19,"שלא בפני ב""ד. אם לא יגיד ונשא עונו מקום שמגיד וחבירו משלם ממון יצא חוץ לב""ד אפילו מגיד אין חבירו משלם.",
Shevuot,קרבן העדה,4,1,19a,אפי' מגיד אין חבירו משלם. ממון שהרי יכול לחזור מעדותו:,אפי' מגיד אין חבירו משלם,JTmock Shevuot 4:1:19,"שלא בפני ב""ד. אם לא יגיד ונשא עונו מקום שמגיד וחבירו משלם ממון יצא חוץ לב""ד אפילו מגיד אין חבירו משלם.",
Shevuot,קרבן העדה,4,1,19b,"@11ומניין לשני עדים. @33הא דאמרת קרא והוא עד משמע שנים ויומעט עד אחד נהפוך הוא והוא עד משמע אחד ולא שנים ל""א קאי אהא דתנן בזה אחר זה הראשון חייב והשני פטור ש""מ דעד אחד פטור וקאמר מנין דבעינן שנים ומתרץ ת""ל והוא עד וכר""י כו':",ומניין לשני עדים,JTmock Shevuot 4:1:20,ומניין לשני עדים תלמוד לומר והוא עד הרי כאן שנים כר' ישמעאל דאמר כל מקום שנאמ' עד סתם הרי הוא בכלל שני' עד שיודיעך הכתוב אחד. אשכח תני ר' ישמעאל שני עדים. אחד מהו שיהו חייבין עליו משום שבועת ביטוי. איפשר לומר אחד ראוי לצורפו לחייבו משום שבועת עדות ואת מחייבו משום שבועת ביטוי.,
Shevuot,קרבן העדה,4,1,19b,"ומשני כר""י. אתיא דאמר כל מקום שנאמר עד משמע שנים:","ומשני כר""י",JTmock Shevuot 4:1:20,ומניין לשני עדים תלמוד לומר והוא עד הרי כאן שנים כר' ישמעאל דאמר כל מקום שנאמ' עד סתם הרי הוא בכלל שני' עד שיודיעך הכתוב אחד. אשכח תני ר' ישמעאל שני עדים. אחד מהו שיהו חייבין עליו משום שבועת ביטוי. איפשר לומר אחד ראוי לצורפו לחייבו משום שבועת עדות ואת מחייבו משום שבועת ביטוי.,
Shevuot,קרבן העדה,4,1,19b,"כל מקום. שכתוב בתורה עד סתם שנים משמע דכתיב לא יקום עד אחד באיש וקשיא ממשמע שנאמר לא יקום עד באיש איני יודע שהוא אחד מה ת""ל אחד זה בנה אב כל מקום שנאמר עד הרי כאן שנים עד שיפרוט לך הכתוב אחד:",כל מקום,JTmock Shevuot 4:1:20,ומניין לשני עדים תלמוד לומר והוא עד הרי כאן שנים כר' ישמעאל דאמר כל מקום שנאמ' עד סתם הרי הוא בכלל שני' עד שיודיעך הכתוב אחד. אשכח תני ר' ישמעאל שני עדים. אחד מהו שיהו חייבין עליו משום שבועת ביטוי. איפשר לומר אחד ראוי לצורפו לחייבו משום שבועת עדות ואת מחייבו משום שבועת ביטוי.,
Shevuot,קרבן העדה,4,1,19b,אשכח תני. מצא ברייתא מפורש בה שר' ישמעאל הוא דאמר שבועת העדות בשנים דוקא:,אשכח תני,JTmock Shevuot 4:1:20,ומניין לשני עדים תלמוד לומר והוא עד הרי כאן שנים כר' ישמעאל דאמר כל מקום שנאמ' עד סתם הרי הוא בכלל שני' עד שיודיעך הכתוב אחד. אשכח תני ר' ישמעאל שני עדים. אחד מהו שיהו חייבין עליו משום שבועת ביטוי. איפשר לומר אחד ראוי לצורפו לחייבו משום שבועת עדות ואת מחייבו משום שבועת ביטוי.,
Shevuot,קרבן העדה,4,1,19b,עד אחד. שנשבע שאינו יודע עדות ונמצא שיודע עדות מהו לחייבו משום שבועת ביטוי:,עד אחד,JTmock Shevuot 4:1:20,ומניין לשני עדים תלמוד לומר והוא עד הרי כאן שנים כר' ישמעאל דאמר כל מקום שנאמ' עד סתם הרי הוא בכלל שני' עד שיודיעך הכתוב אחד. אשכח תני ר' ישמעאל שני עדים. אחד מהו שיהו חייבין עליו משום שבועת ביטוי. איפשר לומר אחד ראוי לצורפו לחייבו משום שבועת עדות ואת מחייבו משום שבועת ביטוי.,
Shevuot,קרבן העדה,4,1,19b,ופשיט איפשר לומר כו' ואת מחייבו משום שבועת ביטוי. בתמיה כיון שאם יצרפו לו עוד עד אחד חייב חבירו נמצא בשבועתו מפסידו וכיון שאפשר שיתחייב משום שבועת העדות איך נחייבנו משום שבועת ביטוי:,ופשיט איפשר לומר כו' ואת מחייבו משום,JTmock Shevuot 4:1:20,ומניין לשני עדים תלמוד לומר והוא עד הרי כאן שנים כר' ישמעאל דאמר כל מקום שנאמ' עד סתם הרי הוא בכלל שני' עד שיודיעך הכתוב אחד. אשכח תני ר' ישמעאל שני עדים. אחד מהו שיהו חייבין עליו משום שבועת ביטוי. איפשר לומר אחד ראוי לצורפו לחייבו משום שבועת עדות ואת מחייבו משום שבועת ביטוי.,
Shevuot,קרבן העדה,4,1,19b,קרוב. שאי אפשר לבוא לידי שבועת העדות מהו שיהא חייב משום שבועת ביטוי:,קרוב,JTmock Shevuot 4:1:21,"קרוב מהו שיהו חייבין עליו משום שבועת ביטוי ייבא כהדא דמר ר' בא בשם שמואל שבועה שנתן פלוני לפלוני ונמצא שלא נתן מאחר שאין בידו לבא אין בידו לשעבר. וכהדא איכן שורי אמר לו איני יודע מה אתה שח ר' פוטר משום שבועת הפיקדון ומחייב משום שבועת ביטוי. א""ר יוחנן מאחר שמצוה להפיסו אינו חייב משום שבועת ביטוי על דעתיה דרבנן אין מצוה להפיסו מפסייו על האמת ואינו מפייסו על השקר.",
Shevuot,קרבן העדה,4,1,19b,ייבא כדהא. נאמר דאתיא כהא דאמר ר' בא בר שמואל:,ייבא כדהא,JTmock Shevuot 4:1:21,"קרוב מהו שיהו חייבין עליו משום שבועת ביטוי ייבא כהדא דמר ר' בא בשם שמואל שבועה שנתן פלוני לפלוני ונמצא שלא נתן מאחר שאין בידו לבא אין בידו לשעבר. וכהדא איכן שורי אמר לו איני יודע מה אתה שח ר' פוטר משום שבועת הפיקדון ומחייב משום שבועת ביטוי. א""ר יוחנן מאחר שמצוה להפיסו אינו חייב משום שבועת ביטוי על דעתיה דרבנן אין מצוה להפיסו מפסייו על האמת ואינו מפייסו על השקר.",
Shevuot,קרבן העדה,4,1,19b,"מאחר שאין בידו לבא. אם נשבע להבא יתן פלוני לפלוני מנה אין כאן שבועת ביטוי שהרי אין פלוני ברשותו ליתן ושלא ליתן אף לשעבר כגון שנתן פלוני או שלא נתן נמי אינה שבועת ביטוי דבקרא לא כתיב אלא להבא להרע או להטיב ומרבינן מלכל אשר יבטא דחייב נמי לשעבר וכיון דליתא בלהבא המפורש בקרא אף לשעבר נמי ליתא וה""נ קרוב אע""פ שכשר לעדות לכל אדם כיון שפסול לזה שנשבע עליו אינה שבועת ביטוי:",מאחר שאין בידו לבא,JTmock Shevuot 4:1:21,"קרוב מהו שיהו חייבין עליו משום שבועת ביטוי ייבא כהדא דמר ר' בא בשם שמואל שבועה שנתן פלוני לפלוני ונמצא שלא נתן מאחר שאין בידו לבא אין בידו לשעבר. וכהדא איכן שורי אמר לו איני יודע מה אתה שח ר' פוטר משום שבועת הפיקדון ומחייב משום שבועת ביטוי. א""ר יוחנן מאחר שמצוה להפיסו אינו חייב משום שבועת ביטוי על דעתיה דרבנן אין מצוה להפיסו מפסייו על האמת ואינו מפייסו על השקר.",
Shevuot,קרבן העדה,4,1,19b,"כהדא. או דמיא שבועת הקרוב להא דתנן פ' בתרא דמכילתין א""ל לש""ח היכן שורי א""ל איני יודע מה אתה סח ובאמת מת או נשבר או נשבה או נגנב או אבד והשביעו המפקיד שכדבריו כן הוא שלא בא שורו לידו ואמר אמן ובשקר נשבע אפ""ה פטור מקרבן אשם שאין [חייב] קרבן [על] שבועת הפקדון (בא) אלא א""כ נשבע על דבר שאלו הודה היה חייב ממון אבל כאן אלו הודה על האמת שקיבל השור אלא שמת היה פטור הלכך אינו מביא קרבן על שבועתו:",כהדא,JTmock Shevuot 4:1:21,"קרוב מהו שיהו חייבין עליו משום שבועת ביטוי ייבא כהדא דמר ר' בא בשם שמואל שבועה שנתן פלוני לפלוני ונמצא שלא נתן מאחר שאין בידו לבא אין בידו לשעבר. וכהדא איכן שורי אמר לו איני יודע מה אתה שח ר' פוטר משום שבועת הפיקדון ומחייב משום שבועת ביטוי. א""ר יוחנן מאחר שמצוה להפיסו אינו חייב משום שבועת ביטוי על דעתיה דרבנן אין מצוה להפיסו מפסייו על האמת ואינו מפייסו על השקר.",
Shevuot,קרבן העדה,4,1,19b,"ה""ג רב אמר פטור משבועת הפקדון וכ""ה בסנהדר' [פ""ג ה""ט]. וה""פ רב אמר הא דתנן ואמר אמן פטור היינו פטור מאשם דשבועת הפקדון וחייב משום שבועת ביטוי לשעבר ומביא קרבן עולה ויורד אם שגג בקרבן כדין שבועה לשעבר באומר יודע אני ששבועה זו אסורה אבל איני יודע שחייבין עליה קרבן אע""פ שאינו בלהבא ימות ולא ימות כיון שהוא בלאו והן חייבין עליו משום ביטוי ה""נ בשבועת העדות אע""ג דליתא בלהבא דה""ל נשבע לבטל את המצוה אפ""ה חייב משום שבועת ביטוי:","ה""ג רב אמר פטור משבועת הפקדון וכ""ה",JTmock Shevuot 4:1:21,"קרוב מהו שיהו חייבין עליו משום שבועת ביטוי ייבא כהדא דמר ר' בא בשם שמואל שבועה שנתן פלוני לפלוני ונמצא שלא נתן מאחר שאין בידו לבא אין בידו לשעבר. וכהדא איכן שורי אמר לו איני יודע מה אתה שח ר' פוטר משום שבועת הפיקדון ומחייב משום שבועת ביטוי. א""ר יוחנן מאחר שמצוה להפיסו אינו חייב משום שבועת ביטוי על דעתיה דרבנן אין מצוה להפיסו מפסייו על האמת ואינו מפייסו על השקר.",
Shevuot,קרבן העדה,4,1,19b,"מאחר שמצוה להפיסו. אחרי שהשומר מצווה לישבע כדי להפיס דעתו של המפקיד כמפורש בתורה וב""ד משביעין אותו על כך אין כאן שבועת ביטוי דכתיב נפש כי תשבע לבטא בשפתים ודרשינן להאי כי בלשון אי הוא וה""ק נפש אם תשבע דהיינו מדעת נפשו חייב עליה אבל שבועת הדיינין שהיא בע""כ לא:",מאחר שמצוה להפיסו,JTmock Shevuot 4:1:21,"קרוב מהו שיהו חייבין עליו משום שבועת ביטוי ייבא כהדא דמר ר' בא בשם שמואל שבועה שנתן פלוני לפלוני ונמצא שלא נתן מאחר שאין בידו לבא אין בידו לשעבר. וכהדא איכן שורי אמר לו איני יודע מה אתה שח ר' פוטר משום שבועת הפיקדון ומחייב משום שבועת ביטוי. א""ר יוחנן מאחר שמצוה להפיסו אינו חייב משום שבועת ביטוי על דעתיה דרבנן אין מצוה להפיסו מפסייו על האמת ואינו מפייסו על השקר.",
Shevuot,קרבן העדה,4,1,19b,"ה""ג ע""ד דרב אינו מצוה להפיסו כו'. וה""פ דמחייב משום שבועת ביטוי היינו טעמיה הא דחייב שבועה ע""פ הדיינים אינו מצוה להפיסו אלא לברר האמת וכשנשבע לשקר אינו אלא שבועת ביטוי ומפרש כי תשבע בלשון דהא שהרי הרבה נשבעין ע""פ ב""ד:","ה""ג ע""ד דרב אינו מצוה להפיסו כו'",,,
Shevuot,קרבן העדה,4,1,19b,ונשא עונו. משמע שחייב קרבן שזהו בכלל נשיאת העון:,ונשא עונו,JTmock Shevuot 4:1:22,"תני ר' ישמעאל ונשא עונו קרבן מנלן ב""ד הגדה הגדה מה הגדה שנאמר להלן ב""ד אף כאן ב""ד.",
Shevuot,קרבן העדה,4,1,19b,"מנלן. דבעינן שיכפור דוקא בב""ד כדתנן במתני' ומשני הגדה הגדה. ילפינן בגז""ש נאמר כאן אם לא יגיד כו' ונאמר להלן אשר יגידו לך מה להלן בב""ד משתעי קרא אף ה""נ בב""ד:",מנלן,JTmock Shevuot 4:1:22,"תני ר' ישמעאל ונשא עונו קרבן מנלן ב""ד הגדה הגדה מה הגדה שנאמר להלן ב""ד אף כאן ב""ד.",
