masechet,commentary,perek,halakha,page,comment,dh,base text ref,base text,problem
Shevuot,קרבן העדה,3,1,11b,במדבר ומביא קרבן. בשביל ביטול דיבורו וכיון דמשום ביטול דיבורו הוא אף זה ביטל דיבורו שהאומר לא אוכל דעתו לאסור עצמו בכל שהוא:,במדבר ומביא קרבן,JTmock Shevuot 3:1:1,שבועות שתים שהן ארבע שבועה שאוכל ולא אוכל שאכלתי ושלא אכלתי שבועה שלא אוכל ואכל כל שהוא חייב דברי רבי עקיבה אמר לו לרבי עקיבה איכן מצינו לאוכל כל שהוא שהוא חייב שזה חייב אמר להן איכן מצינו במדבר ומביא קרבן שזה מדבר ומביא קרבן:,
Shevuot,קרבן העדה,3,1,12a,"@22גמ' @11ניחא שאוכל ושלא אוכל. @33אית בהו שגגה שבשעת שבועה סבר לקיים אח""כ נעלם ממנו ועבר אשבועתו אלא שאכלתי ושלא אכלתי כיון דבעינן אדם בשבועה היכי משכחת לה שוגג כדמסיק:",ניחא שאוכל ושלא אוכל,JTmock Shevuot 3:1:2,"ניחא שאוכל ושלא אוכל. שאכלתי ושלא אכלתי מה נן קיימין אם בידוע שאכל ונשבע שלא אכל שבועות שקר הוא ואם סבור שאכל ונשבע שלא אכל. רבי בא בר רב יהודה בשם רב בשוגג בקרבנה ובמזיד בקרבנה אבל סבור הייתי שאין בן שבועה מותר אלא במזיד בה ובשוגג בקרבנה. ולא כן א""ר אבהו בשם רבי יוחנן מזיד בחלב ובשוגג בקרבן מתרין בו ולוקה ומביא קרבן. לית יכיל דמר ר' לא בשם רבי לעזר כך משיב ר' ישמעאל לר' עקיבה מצינו דבר שחייבין בזדונו משום שבועת שקר ובהעלומו משום ביטוי. ויתיביניה רבי עקיבה מצינו דבר שחייבין בזדונו משום שבועת שקר ומביא קרבן. אלא כי נן קיימין בבריא לו שאכל ונשבע ונמצא שלא אכל. לא באומר אין זו שבועה. תמן באומר אין זו שבועה ברם הכא ביודע בה ששבועה היא אלא שהוא בטועה מחמת דבר אחר.",
Shevuot,קרבן העדה,3,1,12a,מה נן קיימין. במאי עסקינן:,מה נן קיימין,JTmock Shevuot 3:1:2,"ניחא שאוכל ושלא אוכל. שאכלתי ושלא אכלתי מה נן קיימין אם בידוע שאכל ונשבע שלא אכל שבועות שקר הוא ואם סבור שאכל ונשבע שלא אכל. רבי בא בר רב יהודה בשם רב בשוגג בקרבנה ובמזיד בקרבנה אבל סבור הייתי שאין בן שבועה מותר אלא במזיד בה ובשוגג בקרבנה. ולא כן א""ר אבהו בשם רבי יוחנן מזיד בחלב ובשוגג בקרבן מתרין בו ולוקה ומביא קרבן. לית יכיל דמר ר' לא בשם רבי לעזר כך משיב ר' ישמעאל לר' עקיבה מצינו דבר שחייבין בזדונו משום שבועת שקר ובהעלומו משום ביטוי. ויתיביניה רבי עקיבה מצינו דבר שחייבין בזדונו משום שבועת שקר ומביא קרבן. אלא כי נן קיימין בבריא לו שאכל ונשבע ונמצא שלא אכל. לא באומר אין זו שבועה. תמן באומר אין זו שבועה ברם הכא ביודע בה ששבועה היא אלא שהוא בטועה מחמת דבר אחר.",
Shevuot,קרבן העדה,3,1,12a,אם בידוע. לו בשעת שבועה שאכל ונשבע שלא אכל:,אם בידוע,JTmock Shevuot 3:1:2,"ניחא שאוכל ושלא אוכל. שאכלתי ושלא אכלתי מה נן קיימין אם בידוע שאכל ונשבע שלא אכל שבועות שקר הוא ואם סבור שאכל ונשבע שלא אכל. רבי בא בר רב יהודה בשם רב בשוגג בקרבנה ובמזיד בקרבנה אבל סבור הייתי שאין בן שבועה מותר אלא במזיד בה ובשוגג בקרבנה. ולא כן א""ר אבהו בשם רבי יוחנן מזיד בחלב ובשוגג בקרבן מתרין בו ולוקה ומביא קרבן. לית יכיל דמר ר' לא בשם רבי לעזר כך משיב ר' ישמעאל לר' עקיבה מצינו דבר שחייבין בזדונו משום שבועת שקר ובהעלומו משום ביטוי. ויתיביניה רבי עקיבה מצינו דבר שחייבין בזדונו משום שבועת שקר ומביא קרבן. אלא כי נן קיימין בבריא לו שאכל ונשבע ונמצא שלא אכל. לא באומר אין זו שבועה. תמן באומר אין זו שבועה ברם הכא ביודע בה ששבועה היא אלא שהוא בטועה מחמת דבר אחר.",
Shevuot,קרבן העדה,3,1,12a,שבועת שקר הוא. כלומר מזיד הוא ואינו בר קרבן דהא ונעלם כתיב והכא אין כאן העלמה:,שבועת שקר הוא,JTmock Shevuot 3:1:2,"ניחא שאוכל ושלא אוכל. שאכלתי ושלא אכלתי מה נן קיימין אם בידוע שאכל ונשבע שלא אכל שבועות שקר הוא ואם סבור שאכל ונשבע שלא אכל. רבי בא בר רב יהודה בשם רב בשוגג בקרבנה ובמזיד בקרבנה אבל סבור הייתי שאין בן שבועה מותר אלא במזיד בה ובשוגג בקרבנה. ולא כן א""ר אבהו בשם רבי יוחנן מזיד בחלב ובשוגג בקרבן מתרין בו ולוקה ומביא קרבן. לית יכיל דמר ר' לא בשם רבי לעזר כך משיב ר' ישמעאל לר' עקיבה מצינו דבר שחייבין בזדונו משום שבועת שקר ובהעלומו משום ביטוי. ויתיביניה רבי עקיבה מצינו דבר שחייבין בזדונו משום שבועת שקר ומביא קרבן. אלא כי נן קיימין בבריא לו שאכל ונשבע ונמצא שלא אכל. לא באומר אין זו שבועה. תמן באומר אין זו שבועה ברם הכא ביודע בה ששבועה היא אלא שהוא בטועה מחמת דבר אחר.",
Shevuot,קרבן העדה,3,1,12a,"@66ה""ג ואם סבור שלא אכל ונשבע שלא אכל:","ה""ג ואם סבור שלא אכל ונשבע שלא",JTmock Shevuot 3:1:2,"ניחא שאוכל ושלא אוכל. שאכלתי ושלא אכלתי מה נן קיימין אם בידוע שאכל ונשבע שלא אכל שבועות שקר הוא ואם סבור שאכל ונשבע שלא אכל. רבי בא בר רב יהודה בשם רב בשוגג בקרבנה ובמזיד בקרבנה אבל סבור הייתי שאין בן שבועה מותר אלא במזיד בה ובשוגג בקרבנה. ולא כן א""ר אבהו בשם רבי יוחנן מזיד בחלב ובשוגג בקרבן מתרין בו ולוקה ומביא קרבן. לית יכיל דמר ר' לא בשם רבי לעזר כך משיב ר' ישמעאל לר' עקיבה מצינו דבר שחייבין בזדונו משום שבועת שקר ובהעלומו משום ביטוי. ויתיביניה רבי עקיבה מצינו דבר שחייבין בזדונו משום שבועת שקר ומביא קרבן. אלא כי נן קיימין בבריא לו שאכל ונשבע ונמצא שלא אכל. לא באומר אין זו שבועה. תמן באומר אין זו שבועה ברם הכא ביודע בה ששבועה היא אלא שהוא בטועה מחמת דבר אחר.",
Shevuot,קרבן העדה,3,1,12a,"רבי בא כו'. הא אמר ר' בא כו' אהא דתנן לקמן פ' שבועת העדות וחייבין על זדון השבועה ועל שגגתה עם זדון העדות דוקא בקרבנה אין חילוק אם שגג בה ואינו יודע שחייבין עליה קרבן או מזיד בה ויודע שחייבין עליה קרבן אבל בשבועה צריך שיהיה זדון יודע ששבועה זו אסורה ונשבע לשקר וקמ""ל רב הא דתנן התם ועל שגגתה דלאו דוקא שוגג בקרבנה אלא ה""ה מזיד בקרבנה:",רבי בא כו',JTmock Shevuot 3:1:2,"ניחא שאוכל ושלא אוכל. שאכלתי ושלא אכלתי מה נן קיימין אם בידוע שאכל ונשבע שלא אכל שבועות שקר הוא ואם סבור שאכל ונשבע שלא אכל. רבי בא בר רב יהודה בשם רב בשוגג בקרבנה ובמזיד בקרבנה אבל סבור הייתי שאין בן שבועה מותר אלא במזיד בה ובשוגג בקרבנה. ולא כן א""ר אבהו בשם רבי יוחנן מזיד בחלב ובשוגג בקרבן מתרין בו ולוקה ומביא קרבן. לית יכיל דמר ר' לא בשם רבי לעזר כך משיב ר' ישמעאל לר' עקיבה מצינו דבר שחייבין בזדונו משום שבועת שקר ובהעלומו משום ביטוי. ויתיביניה רבי עקיבה מצינו דבר שחייבין בזדונו משום שבועת שקר ומביא קרבן. אלא כי נן קיימין בבריא לו שאכל ונשבע ונמצא שלא אכל. לא באומר אין זו שבועה. תמן באומר אין זו שבועה ברם הכא ביודע בה ששבועה היא אלא שהוא בטועה מחמת דבר אחר.",
Shevuot,קרבן העדה,3,1,12a,"אבל. אם הוא שוגג בשבועה וסובר שאין בו איסור שבועה פטור דאנוס הוא ואין כאן אדם בשבועה ומה התם דלא כתיב פטור בכה""ג שבועת ביטוי דכתיב ונעלם כ""ש בסבור שלא אכל דפטור מקרבן דאנוס הוא:",אבל,JTmock Shevuot 3:1:2,"ניחא שאוכל ושלא אוכל. שאכלתי ושלא אכלתי מה נן קיימין אם בידוע שאכל ונשבע שלא אכל שבועות שקר הוא ואם סבור שאכל ונשבע שלא אכל. רבי בא בר רב יהודה בשם רב בשוגג בקרבנה ובמזיד בקרבנה אבל סבור הייתי שאין בן שבועה מותר אלא במזיד בה ובשוגג בקרבנה. ולא כן א""ר אבהו בשם רבי יוחנן מזיד בחלב ובשוגג בקרבן מתרין בו ולוקה ומביא קרבן. לית יכיל דמר ר' לא בשם רבי לעזר כך משיב ר' ישמעאל לר' עקיבה מצינו דבר שחייבין בזדונו משום שבועת שקר ובהעלומו משום ביטוי. ויתיביניה רבי עקיבה מצינו דבר שחייבין בזדונו משום שבועת שקר ומביא קרבן. אלא כי נן קיימין בבריא לו שאכל ונשבע ונמצא שלא אכל. לא באומר אין זו שבועה. תמן באומר אין זו שבועה ברם הכא ביודע בה ששבועה היא אלא שהוא בטועה מחמת דבר אחר.",
Shevuot,קרבן העדה,3,1,12a,"אלא במזיד בה. בשבועה שאומר יודע אני ששבועה זו אסורה אפ""ה קרינן ביה ונעלם לפי ששוגג בקרבנה שאינו יודע שחייבין עליה קרבן ושגגת קרבן שמה שגגה:",אלא במזיד בה,JTmock Shevuot 3:1:2,"ניחא שאוכל ושלא אוכל. שאכלתי ושלא אכלתי מה נן קיימין אם בידוע שאכל ונשבע שלא אכל שבועות שקר הוא ואם סבור שאכל ונשבע שלא אכל. רבי בא בר רב יהודה בשם רב בשוגג בקרבנה ובמזיד בקרבנה אבל סבור הייתי שאין בן שבועה מותר אלא במזיד בה ובשוגג בקרבנה. ולא כן א""ר אבהו בשם רבי יוחנן מזיד בחלב ובשוגג בקרבן מתרין בו ולוקה ומביא קרבן. לית יכיל דמר ר' לא בשם רבי לעזר כך משיב ר' ישמעאל לר' עקיבה מצינו דבר שחייבין בזדונו משום שבועת שקר ובהעלומו משום ביטוי. ויתיביניה רבי עקיבה מצינו דבר שחייבין בזדונו משום שבועת שקר ומביא קרבן. אלא כי נן קיימין בבריא לו שאכל ונשבע ונמצא שלא אכל. לא באומר אין זו שבועה. תמן באומר אין זו שבועה ברם הכא ביודע בה ששבועה היא אלא שהוא בטועה מחמת דבר אחר.",
Shevuot,קרבן העדה,3,1,12a,"לא כן. וכי לא כך אר""א כו':",לא כן,JTmock Shevuot 3:1:2,"ניחא שאוכל ושלא אוכל. שאכלתי ושלא אכלתי מה נן קיימין אם בידוע שאכל ונשבע שלא אכל שבועות שקר הוא ואם סבור שאכל ונשבע שלא אכל. רבי בא בר רב יהודה בשם רב בשוגג בקרבנה ובמזיד בקרבנה אבל סבור הייתי שאין בן שבועה מותר אלא במזיד בה ובשוגג בקרבנה. ולא כן א""ר אבהו בשם רבי יוחנן מזיד בחלב ובשוגג בקרבן מתרין בו ולוקה ומביא קרבן. לית יכיל דמר ר' לא בשם רבי לעזר כך משיב ר' ישמעאל לר' עקיבה מצינו דבר שחייבין בזדונו משום שבועת שקר ובהעלומו משום ביטוי. ויתיביניה רבי עקיבה מצינו דבר שחייבין בזדונו משום שבועת שקר ומביא קרבן. אלא כי נן קיימין בבריא לו שאכל ונשבע ונמצא שלא אכל. לא באומר אין זו שבועה. תמן באומר אין זו שבועה ברם הכא ביודע בה ששבועה היא אלא שהוא בטועה מחמת דבר אחר.",
Shevuot,קרבן העדה,3,1,12a,"מזיד בחלב. כלומר מזיד בכרת יודע שחייב כרת על עברה זו ושוגג בקרבן אינו יודע שחייב קרבן על שגגתה מתרין בו על מזיד דכרת ולוקה כדין כל חייבי כריתות שלוקין ומביא קרבן על השגגה א""כ ה""נ אע""ג שהזיד בה מביא קרבן על שגגת קרבן:",מזיד בחלב,JTmock Shevuot 3:1:2,"ניחא שאוכל ושלא אוכל. שאכלתי ושלא אכלתי מה נן קיימין אם בידוע שאכל ונשבע שלא אכל שבועות שקר הוא ואם סבור שאכל ונשבע שלא אכל. רבי בא בר רב יהודה בשם רב בשוגג בקרבנה ובמזיד בקרבנה אבל סבור הייתי שאין בן שבועה מותר אלא במזיד בה ובשוגג בקרבנה. ולא כן א""ר אבהו בשם רבי יוחנן מזיד בחלב ובשוגג בקרבן מתרין בו ולוקה ומביא קרבן. לית יכיל דמר ר' לא בשם רבי לעזר כך משיב ר' ישמעאל לר' עקיבה מצינו דבר שחייבין בזדונו משום שבועת שקר ובהעלומו משום ביטוי. ויתיביניה רבי עקיבה מצינו דבר שחייבין בזדונו משום שבועת שקר ומביא קרבן. אלא כי נן קיימין בבריא לו שאכל ונשבע ונמצא שלא אכל. לא באומר אין זו שבועה. תמן באומר אין זו שבועה ברם הכא ביודע בה ששבועה היא אלא שהוא בטועה מחמת דבר אחר.",
Shevuot,קרבן העדה,3,1,12a,לית יכיל. אי אפשר לומר כן:,לית יכיל,JTmock Shevuot 3:1:2,"ניחא שאוכל ושלא אוכל. שאכלתי ושלא אכלתי מה נן קיימין אם בידוע שאכל ונשבע שלא אכל שבועות שקר הוא ואם סבור שאכל ונשבע שלא אכל. רבי בא בר רב יהודה בשם רב בשוגג בקרבנה ובמזיד בקרבנה אבל סבור הייתי שאין בן שבועה מותר אלא במזיד בה ובשוגג בקרבנה. ולא כן א""ר אבהו בשם רבי יוחנן מזיד בחלב ובשוגג בקרבן מתרין בו ולוקה ומביא קרבן. לית יכיל דמר ר' לא בשם רבי לעזר כך משיב ר' ישמעאל לר' עקיבה מצינו דבר שחייבין בזדונו משום שבועת שקר ובהעלומו משום ביטוי. ויתיביניה רבי עקיבה מצינו דבר שחייבין בזדונו משום שבועת שקר ומביא קרבן. אלא כי נן קיימין בבריא לו שאכל ונשבע ונמצא שלא אכל. לא באומר אין זו שבועה. תמן באומר אין זו שבועה ברם הכא ביודע בה ששבועה היא אלא שהוא בטועה מחמת דבר אחר.",
Shevuot,קרבן העדה,3,1,12a,"דמר. דאמר ר' אילא בשם ר""ל כך השיב ר""י לר""ע על הא דמחייב קרבן אף לשעבר כדתנן לקמן בפירקין איך נחייב לשעבר היכן מצינו דבר שחייבין על זדונו משום ולא תשבעו בשמי לשקר דהא כשנשבע לשעבר שקר הוא דבשעת השבועה ניכר שקרו ובהעלמו דהיינו בשגגתו יביא קרבן משום שבועת ביטוי דכי כתיב קרבן בשבועת ביטוי הוא דכתיב נפש כי תשבע לבטא בשפתים א""נ ה""פ והיכן מצינו בעברה אחד שלוקה על המזיד ומביא קרבן על השוגג דלשעבר במזיד לוקה על שבועת שקר ומביא קרבן על ששגג בקרבן אבל אוכל ולא אכל אינו במלקות אע""ג שעובר על בל יחל מ""מ אינו לוקה דלאו שאין בו מעשה הוא ולא אוכל ואכל נמי לא לקי דשויין להדדי:",דמר,JTmock Shevuot 3:1:2,"ניחא שאוכל ושלא אוכל. שאכלתי ושלא אכלתי מה נן קיימין אם בידוע שאכל ונשבע שלא אכל שבועות שקר הוא ואם סבור שאכל ונשבע שלא אכל. רבי בא בר רב יהודה בשם רב בשוגג בקרבנה ובמזיד בקרבנה אבל סבור הייתי שאין בן שבועה מותר אלא במזיד בה ובשוגג בקרבנה. ולא כן א""ר אבהו בשם רבי יוחנן מזיד בחלב ובשוגג בקרבן מתרין בו ולוקה ומביא קרבן. לית יכיל דמר ר' לא בשם רבי לעזר כך משיב ר' ישמעאל לר' עקיבה מצינו דבר שחייבין בזדונו משום שבועת שקר ובהעלומו משום ביטוי. ויתיביניה רבי עקיבה מצינו דבר שחייבין בזדונו משום שבועת שקר ומביא קרבן. אלא כי נן קיימין בבריא לו שאכל ונשבע ונמצא שלא אכל. לא באומר אין זו שבועה. תמן באומר אין זו שבועה ברם הכא ביודע בה ששבועה היא אלא שהוא בטועה מחמת דבר אחר.",
Shevuot,קרבן העדה,3,1,12a,"ויתביניה כו'. ואי ס""ד כר' יוחנן ה""ל לר""ע להשיב לר""י הרי מצינו בחטאת חלב שחייבין על זדונו משום לאו שבו ומביא קרבן על שגגת קרבן שבו אלא ודאי ר""ע לא ס""ל לדר' יוחנן הדרא קושיא לדוכתא אכלתי ולא אכלתי דמתני' דאתיא כר""ע במאי איירי:",ויתביניה כו',JTmock Shevuot 3:1:2,"ניחא שאוכל ושלא אוכל. שאכלתי ושלא אכלתי מה נן קיימין אם בידוע שאכל ונשבע שלא אכל שבועות שקר הוא ואם סבור שאכל ונשבע שלא אכל. רבי בא בר רב יהודה בשם רב בשוגג בקרבנה ובמזיד בקרבנה אבל סבור הייתי שאין בן שבועה מותר אלא במזיד בה ובשוגג בקרבנה. ולא כן א""ר אבהו בשם רבי יוחנן מזיד בחלב ובשוגג בקרבן מתרין בו ולוקה ומביא קרבן. לית יכיל דמר ר' לא בשם רבי לעזר כך משיב ר' ישמעאל לר' עקיבה מצינו דבר שחייבין בזדונו משום שבועת שקר ובהעלומו משום ביטוי. ויתיביניה רבי עקיבה מצינו דבר שחייבין בזדונו משום שבועת שקר ומביא קרבן. אלא כי נן קיימין בבריא לו שאכל ונשבע ונמצא שלא אכל. לא באומר אין זו שבועה. תמן באומר אין זו שבועה ברם הכא ביודע בה ששבועה היא אלא שהוא בטועה מחמת דבר אחר.",
Shevuot,קרבן העדה,3,1,12a,"אלא. במאי עסקינן בשעת שבועה טעה וסבר שלא אכל אח""כ נודע לו שאכל:",אלא,JTmock Shevuot 3:1:2,"ניחא שאוכל ושלא אוכל. שאכלתי ושלא אכלתי מה נן קיימין אם בידוע שאכל ונשבע שלא אכל שבועות שקר הוא ואם סבור שאכל ונשבע שלא אכל. רבי בא בר רב יהודה בשם רב בשוגג בקרבנה ובמזיד בקרבנה אבל סבור הייתי שאין בן שבועה מותר אלא במזיד בה ובשוגג בקרבנה. ולא כן א""ר אבהו בשם רבי יוחנן מזיד בחלב ובשוגג בקרבן מתרין בו ולוקה ומביא קרבן. לית יכיל דמר ר' לא בשם רבי לעזר כך משיב ר' ישמעאל לר' עקיבה מצינו דבר שחייבין בזדונו משום שבועת שקר ובהעלומו משום ביטוי. ויתיביניה רבי עקיבה מצינו דבר שחייבין בזדונו משום שבועת שקר ומביא קרבן. אלא כי נן קיימין בבריא לו שאכל ונשבע ונמצא שלא אכל. לא באומר אין זו שבועה. תמן באומר אין זו שבועה ברם הכא ביודע בה ששבועה היא אלא שהוא בטועה מחמת דבר אחר.",
Shevuot,קרבן העדה,3,1,12a,לא כו'. ופריך וכי אין זה כאומר סבור הייתי שאין זו שבועה דאמר רב לעיל דפטור:,לא כו',JTmock Shevuot 3:1:2,"ניחא שאוכל ושלא אוכל. שאכלתי ושלא אכלתי מה נן קיימין אם בידוע שאכל ונשבע שלא אכל שבועות שקר הוא ואם סבור שאכל ונשבע שלא אכל. רבי בא בר רב יהודה בשם רב בשוגג בקרבנה ובמזיד בקרבנה אבל סבור הייתי שאין בן שבועה מותר אלא במזיד בה ובשוגג בקרבנה. ולא כן א""ר אבהו בשם רבי יוחנן מזיד בחלב ובשוגג בקרבן מתרין בו ולוקה ומביא קרבן. לית יכיל דמר ר' לא בשם רבי לעזר כך משיב ר' ישמעאל לר' עקיבה מצינו דבר שחייבין בזדונו משום שבועת שקר ובהעלומו משום ביטוי. ויתיביניה רבי עקיבה מצינו דבר שחייבין בזדונו משום שבועת שקר ומביא קרבן. אלא כי נן קיימין בבריא לו שאכל ונשבע ונמצא שלא אכל. לא באומר אין זו שבועה. תמן באומר אין זו שבועה ברם הכא ביודע בה ששבועה היא אלא שהוא בטועה מחמת דבר אחר.",
Shevuot,קרבן העדה,3,1,12a,ומשני תמן. שאני התם שסובר שאין זו שבועה זה ודאי אנוס מיקרי:,ומשני תמן,JTmock Shevuot 3:1:2,"ניחא שאוכל ושלא אוכל. שאכלתי ושלא אכלתי מה נן קיימין אם בידוע שאכל ונשבע שלא אכל שבועות שקר הוא ואם סבור שאכל ונשבע שלא אכל. רבי בא בר רב יהודה בשם רב בשוגג בקרבנה ובמזיד בקרבנה אבל סבור הייתי שאין בן שבועה מותר אלא במזיד בה ובשוגג בקרבנה. ולא כן א""ר אבהו בשם רבי יוחנן מזיד בחלב ובשוגג בקרבן מתרין בו ולוקה ומביא קרבן. לית יכיל דמר ר' לא בשם רבי לעזר כך משיב ר' ישמעאל לר' עקיבה מצינו דבר שחייבין בזדונו משום שבועת שקר ובהעלומו משום ביטוי. ויתיביניה רבי עקיבה מצינו דבר שחייבין בזדונו משום שבועת שקר ומביא קרבן. אלא כי נן קיימין בבריא לו שאכל ונשבע ונמצא שלא אכל. לא באומר אין זו שבועה. תמן באומר אין זו שבועה ברם הכא ביודע בה ששבועה היא אלא שהוא בטועה מחמת דבר אחר.",
