masechet,commentary,perek,halakha,page,comment,dh,base text ref,base text
Terumot,"הגהות יפ""מ",1,0,6a,"@11ובא @33הלוי נ""ב עיין לקמן דף י""ב ע""ב [פ""ב ה""ד] ודף כ""ב ע""ב [ופ""ח ה""ד] במקומות הנ""ל הביא מקראות אחרים:","ובא הלוי נ""ב עיין לקמן דף י""ב",,
Terumot,"הגהות יפ""מ",1,0,12b,"@11רבי @33יוחנן בשם רבי ינאי זה א' מן שלשה מדרשות וכו'. נכתב בצידו ע""ל ד""ו ע""א ולקמן דף כ""ב ע""ב ב' מדרשות אחרים:",רבי יוחנן בשם רבי ינאי זה א',Jerusalem Talmud Terumot 2:2:2,רבי יוחנן בשם ר' ינאי זה אחד מן ג' מדרשות שהן מחוורין בתורה כל חלב יצהר וכל חלב תירוש ודגן מה נן קיימין אם ללמד שהן תורמין מן התירוש על הדגן ומן הדגן על התירוש התיבון הרי תירוש ויצהר הרי שני מיני אילן ואין תורמין ומעשרין מזה על זה דו אמר מה תירוש ויצהר שהן מיוחדין שהן ב' מיני אילן אין תורמין ומעשרין מזה על זה ואף אני מרבה שני מינין שבדגן שני מינין שבתבואה שאין תורמין ולא מעשרין מזה על זה
Terumot,"הגהות יפ""מ",1,0,13b,"@11כזית @33נותר וכזית חלב הרי אלו טהורין. ואין חייבין עליהם משום פגול נותר וטמא כצ""ל [וכ""ה בטהרות פ""ג מ""ד]:",כזית נותר וכזית חלב הרי אלו טהורין,Jerusalem Talmud Terumot 2:2:5,"תמן תנינן כביצה אוכלין שהניחן בחמה ונתמעטו כן כזית מן הנבילה וכעדשה מן השרץ כזית פיגול כזית נותר כזית חלב הרי אילו טהורין דרומאי אמרי והוא שיהא כזית מעיקרו ר' יוחנן ור""ש בן לקיש תריהון אמרין ואע""פ שאין כזית מעיקרו תמן תנינן אמרו לו אף היא היתה חסירה או יתירה מני אמרו לו ר""מ פעמים שהשאור יפה והוא תפוח הא אילו סולת היתה צמוקה ועכשיו שהוא שאור יפה והוא תפוח את רואה את התפוח כילו צמק ונראית חסירה ופעמים שהשאור רע והוא צמק הא אלו סולת היתה תפוחה ועכשיו שהשאור רע והוא צמוק את רואה את הצמק כילו תפח ונראית יתירה על דעתיה דר' ירמיה דרומאי ור' יוחנן ור""ש בן לקיש שלשתן אמרו דבר אחד ביתירה על דעתייהו דר' יונה ור' יוסי שלשתן אמרו דבר אחד בחסירה אילין דבר פטי בשלון אורז אנשין מתקנתה יתיה חברייא סברין מימר ייסב חיי לו לקביל מבשל אמר לון ר' יוסי אף אנא אמר כן למה שדרכו לתפוח:"
Terumot,"הגהות יפ""מ",1,0,19a,"@11תלמידו @33דרבי חייא נ""ב עיין לעיל פ""ב דף ט' ע""ב. @11ואם @33לאיזו. נ""ב צ""ל או לאיזו:","תלמידו דרבי חייא נ""ב עיין לעיל פ""ב",,
Terumot,"הגהות יפ""מ",1,0,30b,"@11א""ר @33זעירא שכן דרך. נ""ב צ""ל א""ר זטירא דברי הכל היא שכן דרך. @11אכל @33אחר מן השנייה. נ""ב צ""ל אכל אחר את השנייה:","א""ר זעירא שכן דרך",Jerusalem Talmud Terumot 5:3:3,"תני אף טוחן הוא בתחילה ומתיר מתני' דרבי יוסי דר""י אומר אף מתכווין וילקוט ויעלה באחד ומאתים א""ר זעירא שכן דרך כהנים להיות טוחנין מדומע בבתיהן מה נפיק מביניהון כלאי הכרם על דעתיה דרבי יוסי טוחן ומתיר על דעתיהון דרבנן אינו טוחן ומתיר."
Terumot,"הגהות יפ""מ",1,0,37b,"אחד מן שניהן צריך להיות את שניהן. @11שתי @33קופות וכו' והחולין יאכלו. נ""ב יאנלו בטהרה ואם היה החולין ג""כ טמאין החולין יאכלו נקודים:",אחד מן שניהן צריך להיות את שניהן,,
Terumot,"הגהות יפ""מ",1,0,40b,"@11רבי @33יוחנן בשם רבי ינאי זה אחד מן ג' מקראות וכו'. נ""ב ע""ל פ""א ה""ג ב' מקראות אחרים:",רבי יוחנן בשם רבי ינאי זה אחד,Jerusalem Talmud Terumot 8:1:4,"ר' יוחנן בשם ר' ינאי זה אחד מן ג' מקראות שהן מחוורין בתורה ובאת אל הכהן אשר יהיה בימים ההם וכי יש כהן עכשיו ואין כהן לאחר זמן ואיזה זה שהיה עומד ומקריב ע""ג המזבח ונודע שהוא בן גרושה או בן חלוצה שעבודתו כשירה אמר רב ופועל ידיו תרצה כל שהוא מזרעו של לוי עבודתו כשירה"
Terumot,"הגהות יפ""מ",1,0,47a,"@11תני @33סיעות בני אדם וכו' עיין בתוספתא דמסכת הלז פ""ז ובמ""ר סדר ויגש פ' צ""ד נ""א וגירסא אחרת בקצת:",תני סיעות בני אדם וכו' עיין בתוספתא,Jerusalem Talmud Terumot 8:4:11,"תני סיעות בני אדם שהיו מהלכין בדרך פגעו להן גוים ואמרו תנו לנו אחד מכם ונהרוג אותו ואם לאו הרי אנו הורגים את כולכם אפי' כולן נהרגים לא ימסרו נפש אחת מישראל ייחדו להן אחד כגון שבע בן בכרי ימסרו אותו ואל ייהרגו א""ר שמעון בן לקיש והוא שיהא חייב מיתה כשבע בן בכרי ורבי יוחנן אמר אע""פ שאינו חייב מיתה כשבע בן בכרי עולא בר קושב תבעתיה מלכותא ערק ואזיל ליה ללוד גבי ריב""ל אתון ואקפון מדינתא אמרו להן אין לית אתון יהבון ליה לן אנן מחרבין מדינתא סלק גביה ריב""ל ופייסיה ויהביה לון והוה אליהו זכור לטוב יליף מתגלי עלוי ולא אתגלי וצם כמה צומין ואיתגלי עלוי אמר ליה ולמסורות אני נגלה א""ל ולא משנה עשיתי א""ל וזו משנת החסידים"
