masechet,commentary,perek,halakha,page,comment,dh,base text ref,base text
Pesachim,"מהר""ם די לונזאנו",1,0,2a,"@11חורי הבית העליונים והתחתונים היציע והדות והעליה וגג הבית וגג המגדל @33כצ""ל:",חורי הבית העליונים והתחתונים היציע והדות והעליה,Jerusalem Talmud Pesachim 1:1:10,"חורי הבית העליונים והתחתונים והיציע והחדות והעלייה וגג הכד וגג המגדל בית התבן ובית הבקר ובית העצים ובית האוצרות אוצרות היין ואוצרות השמן ואוצרות הפירות אינן צריכין בדיקה. ניחא העליונים והתחתונים. הדא אמרה לא חשו לנפילה. א""ר יוסה תיפתר שהיו שניהן סמוכין לכותל אחד למעלה מעשרה וא' למטה מי'. והא תנינן חדות הדא אמרה שלא חשו לנפילה. מתיירא הוא התינוק לילך לשם וחש לומר שמא נתגלגל חמץ שם תיפתר בחדות שיש לה ליזבוז. וגג הבד וגג המגדל. הדא דתימר בגבוהין ג' טפחים אבל אם אינן גבוהין ג' טפחים כארץ הם ובאותו שלא נשתמש בו חמץ. אבל באותו שנשתמש בו חמץ אפילו גבוה כמה צריך בדיקה. אמר רבי מנא ויאות כן אנן אמרין הדא פיפייארות אפי' גבוה כמה לא תהא צריכה בדיקה."
Pesachim,"מהר""ם די לונזאנו",1,0,2a,"@11אני אמר תינוק נכנס והכניס שם חמץ @33כצ""ל:",אני אמר תינוק נכנס והכניס שם חמץ,Jerusalem Talmud Pesachim 1:1:11,"תני רשב""ג אומר מיטה שהיא חוצצת בתוך הבית ועצים ואבנים מונחין תחתיה בודק צד החיצון ואינו בודק צד הפנימי מפני שעצים ואבנים מונחין תחתיה הא אם אין עצים ואבנים מונחין תחתיה צריך לבדוק צד הפנימי. הדא אמרה חשו לנפילה. אני אומר תינוק נגע והכניס שם חמץ."
Pesachim,"מהר""ם די לונזאנו",1,0,17a,"@11תני פגה שטמנה וכו'. @33נ""ב קשה מאי שיכותיה לכאן:",תני פגה שטמנה וכו',Jerusalem Talmud Pesachim 2:4:6,תני פגה שטמנה בתבן וחררה שטמנה בגחלים אם היו מקצתן מגולין ניטלין בשבת ואם לאו אין ניטלין.
Pesachim,"מהר""ם די לונזאנו",1,0,19a,"@11א""ל צריך את לבער. @33נ""ב נ""ל הטעם משום דחיישינן כמו ששמו בו סולת כך שמו בו מים והוא מחמיץ [א""ה חיד""א ולשיטת רש""י א""ש]:","א""ל צריך את לבער",Jerusalem Talmud Pesachim 2:7:6," ר' שמואל בר רב יצחק היה לו יין קוסם יהב בגויה שערין בגין דיחמע שאל לרבי אימי א""ל צריך את לבער. ר' חנינא בריה דר' בחיי הוה ליה דבש מזוייף בסול' שאל לר' מנא א""ל צריך את לבער. חד מן אילין דר' כיריי הוה ליה גרבין דמשח בגו איצרה דחיטים שאל לרבנין אמרין ליה איזיל גרוף מן תוחתיהן. הורי ר' אימי באילין גרביא דכותחא ממלא אותן מים ג' ימים מעת לעת:"
Pesachim,"מהר""ם די לונזאנו",1,0,20a,"@11ר' שמואל בר רב יצחק בשם רב קדירה שבישל בה מודה. @33נ""א מורת ונ""ל דגרסינן חמיר:",ר' שמואל בר רב יצחק בשם רב,Jerusalem Talmud Pesachim 3:1:12,"ר' ירמיה רבי שמואל בר רב יצחק בשם רב קדירה שבישל בה מודה לא יבשל בה מאותו המין אלא לאחר הפסח הא ממין אחר מותר ובלבד לאחר שלשה תבשילין. כשם שהוא בטל על שאינו מינו כך יבטל על מינו. מין מעורר על מינו ליאסר. א""ר יעקב בר זבדי ר' אבהו מפקד לטחונייא דלא מיתן קופייא אילין על אילין דלא ירתחן ויחמען. ר' חיננא בר פפא אזל ליה גבי טחונייא. ר' יוסי בי ר' בון טחן ליה צרף. רבי אבון הורי לטחונייא מיתן טרטין דמוי בגין מידייה ומתלנה ארבעה זימנין. ר' חנניה ור' מנא חד אמר בעשבין שרי מטננה אסור וחורנה מיחלף. א""ר חנניה בריה דרבי הלל ואפילו כמאן דאמר בעשבים שרי בלוקטן משש שעות ולמעלן מה דטלא פייגא מינהון:"
Pesachim,"מהר""ם די לונזאנו",1,0,20a,"@11לא יבשל בה מאותוהמין אלא לאחר הפסח. @33נ""ב בעל הדברות בהלכות בדיקת כלים ל""ג אלא וכן עיקר כי לגירסתנו קשה איך אפשר שיתיר רב קדירות חמץ לתוך הפסח ואפילו לאחר כמה הגעלות התורה העידה על כלי חרס שאינו יוצא מידי דופיו לעולם. ותו מאי קמ""ל במ""ש קדירה שבישל בה חמץ אל יבשל מאותו המין בפסח פשיטא אלא ודאי דלא גרס אלא:",לא יבשל בה מאותוהמין אלא לאחר הפסח,Jerusalem Talmud Pesachim 3:1:12,"ר' ירמיה רבי שמואל בר רב יצחק בשם רב קדירה שבישל בה מודה לא יבשל בה מאותו המין אלא לאחר הפסח הא ממין אחר מותר ובלבד לאחר שלשה תבשילין. כשם שהוא בטל על שאינו מינו כך יבטל על מינו. מין מעורר על מינו ליאסר. א""ר יעקב בר זבדי ר' אבהו מפקד לטחונייא דלא מיתן קופייא אילין על אילין דלא ירתחן ויחמען. ר' חיננא בר פפא אזל ליה גבי טחונייא. ר' יוסי בי ר' בון טחן ליה צרף. רבי אבון הורי לטחונייא מיתן טרטין דמוי בגין מידייה ומתלנה ארבעה זימנין. ר' חנניה ור' מנא חד אמר בעשבין שרי מטננה אסור וחורנה מיחלף. א""ר חנניה בריה דרבי הלל ואפילו כמאן דאמר בעשבים שרי בלוקטן משש שעות ולמעלן מה דטלא פייגא מינהון:"
Pesachim,"מהר""ם די לונזאנו",1,0,56a,"@11פסחא כזיתא והלילא מתבר אגרייא @33כצ""ל. נ""ב מכאן שצ""ל ההלל בקול גדול:","פסחא כזיתא והלילא מתבר אגרייא כצ""ל",Jerusalem Talmud Pesachim 7:12:3,"ר' בא בשם רב יהודה לא קידשו תחת האגוף שבירושלם. ר' ירמיה בשם רב שמואל בר רב יצחק כדי שיהו מצורעין מגינין תחתיהן בחמה מפני החמה ובגשמים מפני הגשמים ודכוותה לא קידשו תחת האגוף של הר הבית כדי שיהו זבין מגינין תחתיהן בחמה מפני החמה ובגשמים מפני הגשמים. מצורע אין לו איכן להגן זב יש לו איכן להגן זב יש לו איכן להגן בכל ירושלם. רבי יוחנן בר מדייא בשם רבי פינחס מן מה דאנן חמיי רבנן שלחין סנדליהון תחת האגוף של הר הבית הדא אמר שלא קידשו תחת האגוף של הרב הבית. רב שאול לרבי חיי רבה גגנות ירושלם מה הן א""ל מן מה דמתלין מתלא פיסחא כזיתא והלילה מתבר אגרייא הדא אמרה גגות ירושלם קודש. ר' ירמיה ר' מיישא רבי שמואל בר רב יצחק בשם רב גגות ירושלם חול. והא תנינן מן האגוף ולפנים כלפנים מן האגוף ולחוץ כלחוץ פתר לה בגג מבוצר לאויר חצר הא מתניתא. והא תנינן החלונות ועובי החומה כלפנים. עוד היא בגג מבוצר לאויר חצר היא מתניתא. ואתיא כההיא דאמר רבי אחא בשם רבי חיננ' (איכה ב) ויאבל חיל וחומה. שורא ובר שורא. אם עובי החומה קידשו כל שכן חלון א""ר אחא בחלון שעל גבי האגוף נצרכה אף ע""ג דתימר לא קידשו תחת האגוף של ירושלם חלון שע""ג האגוף קודש."
