masechet,commentary,perek,halakha,page,comment,dh,base text ref,base text
Bava Metzia,"רידב""ז",1,0,15a,"@11ריב""ז @33ר""א בשם ר""י אמר ליתן מתנה לחבירו כו' בשעה שאמר קיצר כאן כדרך הסדר הזה שמביא אך ר""פ ובשביעית מבואר:","ריב""ז ר""א בשם ר""י אמר ליתן מתנה",JTmock Bava Metzia 4:2:4,ר' יעקב בר אידי ר' אבהו בשם ר' יוחנן טבעת אין בה משום עירבון. כל הנושא ונותן בדברים אין מוסרין אותו למי שפרע. ר' יעקב בר זבדי בשם ר' יוחנן אמר ליתן מתנה לחבירו וביקש לחזור בו חוזר. אמר בשעה שאמר צריך לומר בדעת גמורה מבתר כן אין חזר ביה לא חזר ביה. הדא דתימר בעני אבל בעשיר נעשה נדר. רב מפקד לשמשיה אימת דנימר לך תתן מתנה לבר נש אין הוה מסכן הב ליה מיד ואין עתיד אימליך בי תניינות. רבן
Bava Metzia,"רידב""ז",1,0,15b,"@11ר""ש @33בר סוסרטאי בשם ר' אבוה אם אמר נשרפו חיטיך בעליי' נאמן וע""ז שאל ר' יצחק על תיבת נאמן למי נאמן דהא אם בשקנו לו מעותיו שלו נשרפו. ר""ל דלא קאי דברי ר""ש בר סוסרטאי בהאי דקאמר לשון נאמן אם לא דס""ל דמעות קונה בזה שייך למימר נשרפו חיטיך בעלי' דאי לא קני ליה מעותיו ש""ז נשרפו ר""ל היכי שייך למימר נאמן הא ההפסד שלו הוא ולא שייך בזה לשון נאמן. כן פי' מהרא""פ זצ""ל:","ר""ש בר סוסרטאי בשם ר' אבוה אם",JTmock Bava Metzia 4:2:5,"יוחנן יהב דינרין לקריבוי על משח. יקר משח. אתא שאל לרבי ינאי א""ל מדבר תורה מעות קונין ולמה אמרו אין קונין שלא יאמר לו נשרפו חיטיך בעלייה. רבי שמואל בר סוסרטאי בשם רבי אבהו אם אמר לו נשרפו חיטיך בעלייה נאמן. רבי יצחק מקשי מה נן קיימין אם בשקנו לו מעותיו שלו נשרפו ואי לא קנו לו מעותיו של זה נשרפו."
Bava Metzia,"רידב""ז",1,0,15b,"@11ר' סימון @33בשם ריב""ל בר נש דיהיב לחברי' עשרה דינרין א""ל אית לי' גבך מאה גרבון דחמרא מן הדין ביתא שרי. מן אהן כרמא אסור כן גי' הבע""ט ז""ל במאמר שני קנין מה בין כרם לבית בית אינו מצוי ליפול כרם מצוי ליפול. גי' הבע""ט ז""ל מצוי לשרוף ופי' הבע""ט ז""ל דכל עיקר דעקרו רבנן קנין כסף הוא משום כדי שלא יאמרו נשרפו חיטך בעלי' וע""כ במילתא דלא שכיחא לא גזרו רבנן. וע""כ בבית דלא שכיחא דליקה ואינו מצוי ליפול לא גזרו רבנן משא""כ בכרם דשכיח דליקה [ומכאן פסק הבעה""ט ז""ל דדווקא בעלי' דשכיחא דליקה שייך לומר נשרפו חיטיך בעלי' משא""כ בבית דלא שכיחא דליקה לא שייך למימר נשרפו חיטיך בעלי' והא דנקט לשון אסור ולשון שרי הוא ע""כ לענין ריבית באם דקנה לי' לא הוי ריבית אבל אי לא קני עד דמשך הוי אגר נטר לי'] א""ר יוסי את שמע מינה בר נש דיהיב לחברי' עשרה דינרין א""ל ע""מ דתיקום לי בהון מאה גרבון מכיון ששלח ידו בהן צריך להעמיד לו מקחו ומפרש הבעה""ט דבזה ג""כ לא גזרו דיאמר לו נשרפו חיטיך בעלי' דבכל כה""ג ששלח בו יד ליכא נשרפו חיטך בעלי' דמילתא דחיקא היא וכן הילכתא בכל מילתא דלא שכיח עכ""ל ז""ל. ונראה לפענ""ד דבמקום דחיקא צ""ל רחיקא הוא [וספר הבעה""ט שת""י אינו מוגה] וכיון דהוי דבר רחוק שישלח בו יד דהא נתן לו ע""מ דיקנה בהון חמרא לא גזרו רבנן דבמעות ששלח בהן יד לא גזרו רבנן:","ר' סימון בשם ריב""ל בר נש דיהיב",JTmock Bava Metzia 4:2:6,"ר' סימון בשם ר' יהושע בן לוי בר נש דיהב לחבריה עשרה דינרין א""ל אית לי גבך מאה דינרין מהדין ביתא שרי מהדין כרמא אסור. מה בין כרם לבית בית אינו מצוי ליפול כרם מצוי ליפול. א""ר יוסי את שמע מינה בר נש דיהב לחבריה עשרה דינרין א""ל במנת דתיקום לי בהון מאה גרבין מכיון ששלח ידו בהן צריך להעמיד לו מקחו."
Bava Metzia,"רידב""ז",1,0,16a,"@11רב @33אמר שיעור הוא. פי' דאין אונאה פחות מארבעה כסף כמו דתנינן במתניתן האונאה ד' כסף מעשרים וארבעה כסף לסלע. אבל מעה כסף לא הוי שיעור אונאה כמו אין אונאה לפרוטות. ובעינן מטבע יותר מפרוטה דהוא מעה זהו שיעור אונאה לפי מה דקי""ל כר""כ דאין אונאה לפרוטות ובעינן שיעור מעה כדפסק הב""י ז""ל סי' רכ""ח ובסמ""ע ז""ל שם עיי""ש. כמו כן ס""ל לרב דשיעור המטבע של אונאה היא ארבעה כסף כדאיתא במתניתן וזהו שיעורא דאונאה. ר""י אמר לית היא שיעורא אלא העיקר הוא השיעור שתות למקח וחשבון בעלמא נקט התנא ארבעה כסף משום שהוא עשרים וארבעה בסלע. רב אמר כל הנושא ונותן במנת שאין לו עליו אונאה כו' משום דהנך תרתי מילי קאמר רב בהלכו' אונאה תני להו בהדדי. תני ר' לוי האונאה פרוטה וקס""ד דלא בעינן שיעור אונאה אלא העיקר דכיון דאיכא שיעור פרוטה הוי אונאה. וע""ז פריך והאונאה פרוטה בתמי'. אלא אונאה עצמה מהו פי' בשהי' אונאה בעצם כדינו שתות מקח או מעות מהו שיעורו של המטבע. ע""ז תני לוי דשיעורו פרוטה. אבל אי בעצם לא הי' דין אונאה ונתאנה בפרוטה לאו כלום הוא:",רב אמר שיעור הוא,JTmock Bava Metzia 4:3:2,רב אמר שיעור הוא רבי יוחנן אמר לית הוא שיעורא. רב אמר כל הנושא ונותן במנת שאין לו אונאה יש לו אונאה. תני רבי לוי האונאה פרוטה והאונאה פרוטה. אלא הונאה עצמה מהו. תני נקנה המקח חוזר. לו הונייתו דברי ר' יהודה הנשיא ר' יוחנן אמר בטל מקחו.
Bava Metzia,"רידב""ז",1,0,16b,"@11תני @33וקנה המקח חוזר לו הנייתו דברי ר""י הנשיא ר""י אמר ביטול מקח. ובבבלי דף נ' ע""ב ודף נ""א ע""א גרסי' פלוגתא דר' נתן ור""י הנשיא ובאופן אחר:",תני וקנה המקח חוזר לו הנייתו דברי,JTmock Bava Metzia 4:3:2,רב אמר שיעור הוא רבי יוחנן אמר לית הוא שיעורא. רב אמר כל הנושא ונותן במנת שאין לו אונאה יש לו אונאה. תני רבי לוי האונאה פרוטה והאונאה פרוטה. אלא הונאה עצמה מהו. תני נקנה המקח חוזר. לו הונייתו דברי ר' יהודה הנשיא ר' יוחנן אמר בטל מקחו.
Bava Metzia,"רידב""ז",1,0,16b,"@11כהנא @33בעי קומי רב בשעה שהמוכר מתאונה הוא עד חומש הוא שוה שש בחמש וכשהלוקח מתאונה הוא שוה חמש בשש הוא שתות מעות ומקשה על הברייתא דהתוספתא דבמוכר חשוב שוה שש בחמש. וגבי לוקח חשוב שוה חמש בשש ע""ז משני ליה. הוא והונייתו מצטרפין עד שתות פי' דשוה חמש בשש מצטרפין הזוז להמקח של חמש ובב""א הוי שש וחשבינן שתות מלבר כפורש הפ""מ ז""ל:",כהנא בעי קומי רב בשעה שהמוכר מתאונה,JTmock Bava Metzia 4:3:3,"כהנא בעא קומי רב בשעה שהמוכר מתאונה מתאונה עד חומש בשעה שהלוקח מתאונה מתאונה עד שתות. א""ל היא הונייתו ומצטרפין עד שתות. מכר לו שוה חמשה בששה יכיל מימר ליה חד דינר איגרבת סך דינרך. א""ר זירא יכיל מימר ליה לית איקרי דיהון ברייתא אמרין פלוני איגחך. ואית דבעי מימר יכיל מימר ליה לית הוא יקרי מלבוש בחמשה דינרין. ר' יוחנן ר' אלעזר ור' הושעיה אמרי מה טעמא דאהן תנייא ידע אנא דלא הוות מיקמתי תבא אלא חמשה דינרין על דהוות דחיק ליה יהבי אשתה דינרין סב דידך והב דידי."
Bava Metzia,"רידב""ז",1,0,16b,"@11מכר @33לו שוה חמשה בששה יכול מימר לי' חד דינר איגרבת כו' כפי' הפ""מ ז""ל:",מכר לו שוה חמשה בששה יכול מימר,JTmock Bava Metzia 4:3:3,"כהנא בעא קומי רב בשעה שהמוכר מתאונה מתאונה עד חומש בשעה שהלוקח מתאונה מתאונה עד שתות. א""ל היא הונייתו ומצטרפין עד שתות. מכר לו שוה חמשה בששה יכיל מימר ליה חד דינר איגרבת סך דינרך. א""ר זירא יכיל מימר ליה לית איקרי דיהון ברייתא אמרין פלוני איגחך. ואית דבעי מימר יכיל מימר ליה לית הוא יקרי מלבוש בחמשה דינרין. ר' יוחנן ר' אלעזר ור' הושעיה אמרי מה טעמא דאהן תנייא ידע אנא דלא הוות מיקמתי תבא אלא חמשה דינרין על דהוות דחיק ליה יהבי אשתה דינרין סב דידך והב דידי."
Bava Metzia,"רידב""ז",1,0,16b,"@11מכר @33לו שוה חמשה בששה לא הספיק לישא וליתן עד שהוקיר משבע ר' יעקב בר אידי ר' אבוה בשם ר' יוחנן כשם שבטל מאצל זה כך בטל מזה. ופריך כמן תנינן ארבעה מדות במוכרין מכר לו חיטין יפות ונמצאו רעות לוקח יכול לחזור בו והיא כקושית הבבלי במס' ב""ב דף פ""ד על רב חסדא אמאי מוכר א""י לחזור בו. ע""ז משני אר""י בר""ב ותייא כהן תניא הנושא ונותן בדברים אין מוסרין אותו למש""פ ופי' הנ""י ז""ל בב""ב שם דה""פ דקס""ד דמקשן דמאי דקאמר לא הספיק לישא וליתן היינו שלא משך אבל כסף כבר נתן וקמ""ל דפטור ממש""פ ולהכי אקשי ליה ממתניתן דקתני היכי דמשך דמתאנה חוזר בו ואינו מקבל מש""פ אבל מאנה אינו חוזר בו בלא מש""פ. ומשני אתיא כמ""ד הנושא והנותן בדברים אין מוסרין אותו למש""פ כלומר ההיא דר""י שלא הספיק לישא המקח ולא ליתן המעות ואין כאן מש""פ. והא קמ""ל דיכולין לחזור בהם לגמרי ואפי' משום מחוסר אמנה אין בו כיון שנשתנה השער כדקפסק בחו""מ סי' ר""ד עיי""ש. והרמב""ן ז""ל מפרש דהא דר' יוחנן בירושלמי מיירי בשלא נתן דמים ויכול לחזור דבדברים אין מוסרין אותו למש""פ. וה""ה נמי היכי שלא הוקרו ולא נתאנה אחד מהן אלא אורחה דמילתא נקט שאין אדם עשוי לחזור אלא א""כ היתה שם אונאה מתחלה. ועזד שיש בו משום חסרון אמנה. אבל עכשיו אין בהן חסרון אמנה שלא כיוון מתחלה בדעת גמורה לכך:",מכר לו שוה חמשה בששה לא הספיק,JTmock Bava Metzia 4:3:4,"מכר לו שוה חמשה בששה לא הספיק לישא וליתן עד שהוקיר משבע. ר' יעקב בר אידי רבי אבהו בשם ר' יוחנן כשם שבטל מאצל זה כך בטל מזה. תמן תנינן ארבע מידות במוכרין מכר לו חטין יפות ונמצאו רעות לוקח יכול לחזור בו רעות ונמצאו יפות מוכר יכול לחזור בו. א""ר יוסי בי רבי בון ותייא כהן תנא הנושא והנותן בדברים אין מוסרין אותו למי שפרע:"
Bava Metzia,"רידב""ז",1,0,18b,"@11א""ר @33ינאי זהו ריבית שיוצאה בדיינין. בעון קומי ר' יוחנן ריבית מהו שיוצאה בדיינין. א""ל אם מזו אין אנו מניחין לגדולי ארץ ישראל כלום. וזהו דחוי' בעלמא. ומשום דס""ל אין יוצאה בדיינין. ע""ז מסיק ומודה ר' יוחנן שאין שטר זוקק לחבירו פי' דאע""ג דס""ל אין יוצאה בדיינין לאחר שגבה המלוה הריבית שוב אין מוציאין מידו אבל אם עדיין לא גבה אלא שיש ללוה כנגדו עליו שט""ח והדין הוא דכל אחד עומד בשלו וזוקק שטר אחד לחבירו לקרוע השטר לא אמרינן דהוי כגבוי כבר ולא יכול עוד הלוה לתבוע בשט""ח שלו משום שהשט""ח שביד המלוה נחשב לפירעון לגבי' ולפ""ז הוי הריבית כאלו נגבה דהא ע""י זה בטל השטר של חבירו הלוה ז""א אלא דהלוה גובה בשטרו מה שכנגד הריבית שבשטר השני. דדווקא בשכבר גבה מעות מזומנים וגם קרע השטר חוב אז אין מוציאין מידו אבל כשלא גבה עדיין. אלא הגבוי הוא שנפטר משט""ח שביד חבירו זה לא הוי כגבוי אע""ג דבעלמא חשוב כגבוי זה עומד בשלו וזה בשלו אבל בריבית אינו כן כיון דלא גבה ממש וקרע השט""ח. עדיין ריבית בידו ומוציאין מידו. וכדמסיק דעוד מודה ר""י באם עוד השטר קיים דלא קרע עדיין השט""ח אע""ג שגבה מוציאין מידו דבעינן ב' תנאים דווקא בשגבה מעות מזומנים ונקרע השטר אז אין מוציאין מידו. ולדברינו שפיר מובן הא דמסמיך הברייתא דשטר שיש בו ריבית פלוגתא דר""מ וחכמים. ועי' בבבלי דף ס""ז דנחלקו אמוראים בסלוקי בלא זוזי אי חשיב אפוקי' ממונא או לא כיון דלא מפקע מיני' ממון אלא מנכין לו ממון. וזה ענין אחר:","א""ר ינאי זהו ריבית שיוצאה בדיינין",JTmock Bava Metzia 5:1:2,"א""ר ינאי זהו רבית שיוצא בדיינין. בעו קומי ר' יוחנן רבית מהו שיצא בדיינין. אמר לו אם מזו אין אנו מניחין לגדולי ארץ ישראל כלום. מודי ר' יוחנן שאין שטר זוקק לחבירו. מודה רבי יוחנן שאם היה השטר קיים דמגבין ליה."
Bava Metzia,"רידב""ז",1,0,19a,"@11במה @33קנה ר""נ בר יעקב סבר מימר חייב להעמיד לחבירו פי' דמקשה למה דקאמר ויין אין לו משמע אבל חיטים אפילו אין לו נמי מותר דחל הקנין. ע""ז פריך במה קנאה ר""נ ב""י סבר מימר חייב להעמיד לחבירו. פי' המוכר לחבירו כשיצא השער אע""פ שאין לו מחויב לטרוח ולקנות עבורו. וכן פסק הרמב""ם ז""ל בפכ""ב מה' מכירה ה""ג הפוסק על שער שבשוק וקיבל דמים ולא הי' אותו המין שפסק עליו ברשות מוכר חייב לקנות וליתן ללוקח מה שפסק ואם חזר בו מקבל מש""פ. והמפרשים ז""ל עמלים להביא מקור להרמב""ם ז""ל לדין הזה עי' בפכ""ד שם בנושאי כליו. ובאמת מהירושלמי הזה מוכח כן מפורש דדווקא גבי יין תנא דיין אין לו אבל חיטין אפילו אין לו נמי מותר משום דכיון דאיסורו בא לידו דמה לי הן מה לי דמיהן כיון דיש לו דמים ומצוי לקנות הרי דמי כמי שיש לו ועי' בפירש""י ז""ל דף ס""ג ע""א ד""ה ומאי לקח. ולא עוד אלא שמחויב לכתחלה לטרוח ולקנות עבורו. וזהו לישנא דרנב""י הכא דחייב להעמיד לחבירו ועי' בהה""מ ז""ל דמביא מקור מההיא מימרא דרבא דף ס""ג ע""ב והכ""מ ז""ל תמה ע""ז ואילו הכא בירושלמי מפורש כן:","במה קנה ר""נ בר יעקב סבר מימר",JTmock Bava Metzia 5:1:5,אמר לו תן לי חיטיי שאני מוכרן. במה קנה. רב נחמן בר יעקב סבר מימר חייב להעמיד לחבירו.
Bava Metzia,"רידב""ז",1,0,19a,"@11חד @33בר נש אישאיל לחברי' דינרין אשרינהו גו ביתי' פי' דהכניסו לתוך ביתו בסתם. א""ל הב לי אגר ביתא א""ל הב לי דנריי אתא עובדא קומי ר' בא בר מינא א""ל נקום לי' ר""ל ינכה לו [והרא""ש ז""ל במס' ב""מ דף ס""ז גורס מפורש ינכה לו] מה דהוי חמי מישרי אע""ג דהכניס סתם בבית והוי אבק ריבית דאינה יוצאה בדיינין מ""מ כשמנכה לו לא חשיב מוציא בדיינין וע""ז מסיק הגמ' הטעם דלמה לא חשיב מוציא בדיינין הוא משום דיש מקום לתלות כיון שהכניס סתם ולא נקצב שכר הדירה ורוצה דמי דירה ביוקר. למשל אם ההלואה היתה ב' דינרין ותחשב דינר ריבית על דמי דירה אבל דמי הדירה הוא ביוקר והוא בב' דינרין וע""כ במקום דיש לתלות לא חשיב כמוציא הריבית. וע""ז מביא הגמ' התוספתא יש דברים שהן כו' הלוני מאה דינרין יש לי חיטים וחזר ולקחן ממנו בעשרים וארבעה סלעים [ומאה דינרין הוא כ""ה סלעים] אין זה ריבית הגם דלכאורה הוא ריבית דהא בתכ""ד מכר לו בכ""ד סלעים ולמה נותן לו מאה דינרין הא אגר נטר הוא משום דא""ל לית את צריך יהב אגר כלים או אגר הכתפין ע""כ אקול ר""ל אנכה וסב דינרך ר""ל סב הכ""ד סלעין לאחר הניכוי שכר כתף ואגר כלים או כדאמר ר' לא שמחשב לו שכר רגלו שהי' צריך לחפש אחר קונה אחר לפיכך כשנזדמן לו על יותר למוכרו בלא שכר כתף ובלא טילטול הרגלים הוזיל הסלע. ונמצא דכיון דיש מקום לתלות תלינן כיון דאינו רבית גמור. וה""נ אמר ר""ז על הדא דידן נעשה כמשכיר לו דירה ביוקר. ומקדים הגמ' ומביא המימרא דסתמא דגמ' דא""ל לית את צריך יהב אגר כלים וכו' ומימרא דר' לא ומימרא דר""ז על הדא דידן:",חד בר נש אישאיל לחברי' דינרין אשרינהו,JTmock Bava Metzia 5:1:6,"המלוה את חבירו. חד בר נש אשאל לחבריה דינרין אשרוניה גו ביתיה. א""ל הב לי אגר ביתי. א""ל הב לי דינריי. אתא עובד' קומי רבי בא בר מינא. א""ל וקים ליה מה דהוה חמי מישרי."
