masechet,commentary,perek,halakha,page,comment,dh,base text ref,base text
Bava Metzia,"רידב""ז",1,0,21a,"@11המוליך @33פירות ממקום הזול כו' אבל חמרין המקבלין מבע""ב מעמידין להם פירות במקום היוקר כשער הזול. פי' החמרין מקבלין מעות מבע""ב קודם שנוסעים למקום הזול ואח""כ כשמביאין למקום היוקר מקבלין מהן הבע""ב הפירות כמו שקנאו הם בשער הזול מותר אפילו דהאחריות הוא על החמרין מ""מ לא הוי אגר נטר. ומפרש ר""י בפ""ז הטעם דמיירי שדרכו לילך ולבוא בו ביום פי' שאינו נראה כשכר המלוה כדפי' בשטמ""ק ז""ל עיי""ש אבל ר""ה סבר דמיירי דרך רחוקה לשנים רבים אעפ""כ מותר משום דנעשה שלוחו פי' דמיירי שהחמרים אין מקבלין שום פעולה טובה מהמעות אלא דהמה שלוחים של הבע""ב. ופריך הגמ' מתיבין לר""ה שליח שנאנס חייב באונסין פי' בתמי' הא שליח שנאנס פטור על האונסין. וא""כ כיון דהאחריות דאונסין הוא על החמרין היכי נאמר דהוי שלוחו. ומשני ולא פעמים שמתנה ש""ח להיות כשואל בתמי' א""כ ה""נ מתנה ש""ח להיות כשואל וזהו דינו של בעה""ת בשער מ""ו ח""ג סי' כ""ח דאם המקבל מקבל עליו אחריות הבהמה בנכסי צ""ב. ונותן כל הריוח לבעל בהמה בהא ודאי שרי דהא לא מיקרי הלואה אלא שליחותי' קעביד עכ""ל ז""ל. ומובא בשו""ע יור""ד סי' קע""ז ס' א' בהגה עיי""ש. ומוקי הירושלמי דמיירי דאין שום הנאה לחמרין [וכן פי' הגר""א ז""ל בסי' קע""ז ובסי' קע""ג עיי""ש] ע""כ לא איכפית לן מה דהוי באחריותו. ופריך הגמ' והתני ר""ה כשם שחייב בכולה כך חייב במקצתה פי' דמקשה ל""ל הנך אוקימתות דריב""פ ודרב הונא הא בלא""ה ניחא ובפשיטות ניחא דהא קי""ל הפוסק על שער שבשוק [פירש""י ז""ל בדף ס""ג ע""ב שער שבשוק הוא כשהחמרין מביאין תבואה למכור ממקום הזול למקום היוקר] וקיבל דמים ולא הי' אותו המין שפסק עליו ברשות מוכר חייב לקנות וליתן ללוקח מה שפסק ואם חזר בו מקבל מש""פ כדאיתא בשו""ע חו""מ סי' ר""ט א""כ הרי החמרין מחויבין לטרוח ולקנות עבור בעה""ב להעמיד מקחם ועליו מוטל למיטרח ולמייתי לי' וכדאמר רנב""י לעיל בה""ב בדברינו. והחמרין שנוסעים להביא סחורה ממקום הזול הוי אצלם השער שבשוק וכיון שחייבין לטרוח ולקנות ולהעמיד מקחם ולמייתי לי' לבעה""ב הרי כל טרחתם הוא להעמיד מקחם כדי שלא לקבל מי שפרע ואי דהם לא נקטו אלא מקצת מעות ואינן מחויבין לקבל מש""פ או להעמיד מקחם אלא לנגד המקצת מעות. אבל הם נותנים במקח הזול הכל לבעלי בתים ז""א דהא תני ר""ה כשם שחייב בכולה ר""ל כשיקבל דמי כולה כך חייב במקצתה פי' שקיבל מקצת דמים ג""כ חייב למטרח ומייתי' לי' דכנגד כולו הוא קונה. א""כ למה לן הנך אוקימתות דריב""פ ורב הונא וכל עיקר דמביא הא דר' הושעיא הוא דתני ר""ה שמחויב למטרח ומייתי לי'. ור""ה תני הדין לענין מקצת או כולו אבל עכ""פ שמעינן דמחויב לטרח ולייתי' לי' וכמו כן ידעינן דה""ה אפילו נחן לו מקצת דמים. דהא דרך הבע""ב שניתנים רק דמי יד להחמרין דכן דרך התגרין כדגרסינן דף מ""ט ע""א. א""כ יהיב לי' זוזי אכיתנא כו' קמאי דנקיטת זוזי הב להו ואידך דברים הוא כו' וכן בדף מ""ח גבי רחב""י יהבי לי' זוזי אמילחא כו' ערבון הוא דיהיב לי' כו'. ומשני מייתי' תמן ר""ל תמן טרח ומייתי' משלם כשער היוקר ברם הכא משלם כשער הזול. ר""ל דנהי דחייב לשלם ולמטרח ומייתי מקחו אבל המקח היא כשער היוקר שכאן אבל הכא החמרין אפילו נאמר דמטריחין בהליכה ובחזירה בעד עצמם כדי לקיים ולהעמיד מקחם ובשביל זה טרח ומייתי. אבל למה נותנין בשער הזול הא אפילו אי גוף הטירחא היא כדי להעמיד מקחם אבל שכר של הטירחא צריך להיות שייך להם והם יתנו במקח היוקר לבע""ב. ולמה נותנין במקח הזול כמו שקנו במקום הזול וע""כ מוכח דטורחין להעלות שכר אגר נטר לבעלים. וע""כ צריך לההיא אוקימתא דריב""פ דדרכו לבוא ביום א' ודרב הונא דאין להם שום הנאה בהממון והוין אך ש""ח דהתנה להיות כשואל. והירושלמי לא ס""ל הטעם דמגלי תרעי' או דאוזל גבי' הנאמר בבבלי דף ע""ג. אלא דאין להם שום הנאת ריוח מהממון וכדינו דבה""ת ז""ל הנ""ל וכן ביאר הגר""א ז""ל הנ""ל ועיי""ש:",המוליך פירות ממקום הזול כו' אבל חמרין,JTmock Bava Metzia 5:3:8,המוליך פירות ממקום הזול למקום היוקר אמר לחבירו תנם לי ואני נותן לך כדרך שאתה נותנן למקום פלוני אם באחריות הנותן אסור והלוקח מותר. המוליך חבילה ממקום למקום אמר לו תנייה לי ואני נותן לך כדרך שאתה נותן במקום פלוני אם באחריות הנותן אסור והלוקח מותר. אבל חמרין המקבלין מבעלי בתים מעמידין להן פירות במקום היוקר כשער הזול. רבי יודה בר פזי עד מקום שדרכו לילך ולבוא בו ביום. רב הונא אמר נעשה שלוחו. ודא מתיבין הונה שליח שנאנס חייב על האונסין שנאנס פטור על האונסין. לא פעמים מתנה שומר חנם להיות כשואל. והתני ר' הושעיה כשם שחייב בכולה כך חייב במקצתה. מאי כדון מייתה תמן משלם כשער היוקר ברם הכא משלם כשער הזול:
Bava Metzia,"רידב""ז",1,0,22a,"@11ר' ירמי' @33בעי תמן את מר נושא שכר חייב על האונסין אסור. וכא את מר נושא שכר חייב על האונסין מותר. פי' דגבי חמרין לעיל בה""ג אמרינן דאפילו דחייב באונסין מ""מ מותר והכא גבי צ""ב אמרינן דכיון דהוי צ""ב דחייב באונסין אסור ומשני לא פעמים שמתנה ש""ח להיות כשואל ר""ל לכך שם גבי חמרין מותר כיון שאין להם כלל הנאה משא""כ כאן דנוטל שכר ולהנאתו עושה אסור במקבל עליו האחריות. וכן פי' בביאור הגר""א ז""ל בס' קע""ז ס""ק ה' עיי""ש:",ר' ירמי' בעי תמן את מר נושא,JTmock Bava Metzia 5:5:3,רבי ירמיה בעי תמן את מר צאן ברזל לראשון וכא את מר לשני אמר ר' יוסי תמן שעיקר לראשון וולדן לראשון ברם הכא עיקרן לשני וולדן לשני. רבי ירמיה בעי תמן את מר נושא שכר חייב על האונסין אסור וכא את מר נושא שכר חייב על האונסין מותר. לא פעמים שמתנה שומר חנם להיות כשואל:
Bava Metzia,"רידב""ז",1,0,25a,"@11הטעו @33זא""ז מהו איתי אתון עבדין עמי ר""ל דפועל אחד אמר לפועלין אחרים באו ותעבדון אצל הבע""ב שלי ותעשו גם אתם אצלינו אצל חבורתינו האיך אתון עבדין ר""ל דהפועלין שאלו מאתו האיך אתון עבדין. וענה להם רבן מן חמש ר""ל הרוב לוקחין חמש דינרין ואשכחן עבדין מן עשר זהו שהטעה הוא את הפועלין אתון עבדין עמי השתא מפרש כיצד הטעו הם אותו דאמר להו אתון עבדין עמי אצל בעה""ב שלי האיך אתם עבדין. ר""ל דשאל מהן האיך אתין עבדין וענו לו מן עשרה רובן [במקום יומין גי' הראשונים ז""ל רובן] ר""ל דרובן נוטלין עשרה ואשכחן עבדין מן חמשה רובן. דרובן נוטלין חמשה. ובזה הטעו הפועלין אותו. והשתא מפרש האיך בע""ב מטעה הפועלין והפועלין את בעה""ב וקמפרש ואזיל הטען את בעה""ב מהו וקמפרש ואזיל איתי אתון עבדין עם חביריכון ר""ל באו אתם עם חביריכם האיך אינון עבדין ר""ל דשאל להם האיך חביריכון עבדין וענהו מעשר רובן ואשכחן עבדין מחמש זהו שהפועלין הטעו אותו. והאיך הבע""ב הטעה אותן עמך אנן עבדין [כן גי' הריטב""א ז""ל] היך חברין עבדין ר""ל דהפועלין שאלוהו האיך חברין עבדין אצלך ענה להם רובן מן חמשה [ובמקום יומין גרס רובן] ואשכחין עבדין מעשרה:","הטעו זא""ז מהו איתי אתון עבדין עמי",JTmock Bava Metzia 6:1:2,הטעו זה את זה מהו. איתי אתון עבדין עמי. היך אתון עבדין מן חמש רבן. ואשכחון עבדין מן עשר רבן למלאכה אתון עבדין עמי היך אתון עבדין מן עשרה יומין ואשכחון עבדין מן חמשה יומין. הטען בעל הבי' מהו איתיי אתון עבדין עם חביריכון. היך הינון עבדין מעשר רבן ואשכחן עבדין מחמש רבן למלאכה. אתיי אתון עבדין עם חביריכון היך הינוך עבדין מחמשה יומין ואשכחון עבדון מעשרה יומין. במה דברים אמורים שלא הלכו החמרים אבל הלכו ולא מצאו תבואה. פועלין לנכש ומצאו שדהו זלחה נותן להן שכר הליכה וחזירה. ולא דומה הבא טעון לבא ריקן. עושה מלאכה ליושב ובטל. היושב בצל ליושב בחמה. ר' חייה רובה אגר חמרין למיתא ליה כיתן הלכו ומצאוה לחה. אמר לון רב פוק והב לון אגרן משלם ואמר להון לא דאנא חייב מיתן לכון אגריכן אלא אנא חייה מתרית לכון
Bava Metzia,"רידב""ז",1,0,25b,"@11סלע @33פסקתי לך שנים אני נותן לך. נוטל מזה ונותן לזה א""ר אילא ובלבד עד כדי שכרו ר""ל דלא יוכל לשכיר יותר מסלע כגון אם נתיקרו פועלים ורוצים ב' סלעים בעד הגמר מלאכה א""י להוציא מאתו אך סלע אחד כפסיקת שכרו אבל לא ב' סלעים ע""ז מיבעיא עד כדון ובלבד עד כדי שכר אותו היום. ובלבד עד כדי שכרו לשעה ר""ל דמיבעיא אם חשבינן כדי שכרו של פסיקת כל המלאכה הגם דהגמר מלאכה שצריך ליתן בעד זה ב' סלעים הוא רק ב' או ג' שעות מ""מ צריך לחשוב כל פסיקת השכר של כל המלאכה או דא""צ לחשוב אלא הפסיקת שכר של אותו היום שפסק או דיחשוב כמה שכר מגיע לפי הפסיקה לשעה ויטול ממנו השכר ההוא לשלם להפועלין אחרים והיא בעיא דלא איפשיטא:",סלע פסקתי לך שנים אני נותן לך,JTmock Bava Metzia 6:1:4,"במה דברים אמורים בדבר שאינו אבד אבל בדבר האבד שוכר עליו ממקום אחר ומטעו ואומר לו סלע פסקתי לך שניים אני נותן לך נוטל מזה ונותן לזה. א""ר אילא ובלבד עד כדי שכרו. עד כדון ובלבד עד כדי שכר אותו היום ובלבד עד כדי שכרו לשעה. במה דברים אמורים במקום שאינו מוצא לשכור פועלים. אבל אם ראה חמרין שממשמשין ובאין או שפרק ספינתו בלמן אמר לו צא ושכור לך אחת מכל אילו אין לו עליו אלא תרעומת:"
Bava Metzia,"רידב""ז",1,0,25b,"@11רב @33אמר כי לי ב""י עבדים אין ישראל קונין זה את זה פי' דהאזהרה הוא שלא ימכר ישראל לישראל וכשם שמוזהר ישראל שלא למכר לישראל חבירו בעבד כן מיזהר הישראל השני שלא יקנה ישראל לעבד ושניהם מוזהרים הקונה והמוכר דאזהרה הוא דאין ישראל קונין זה את זה. ואין האזהרה על המקנה יותר מן הקונה והברייתא דריב""ז במס' קידושין דף כ""ב ע""ב דדרש עבדי הם ולא עבדים לעבדים האזהרה הזאת על שניהן דאין ישראל קונין זה את זה וע""ז פליג ר""י ואמר דאינו כן אלא עבד עברי הוא מתניתא דהברייתא דדרשה עבדי הם ולא עבדים לעבדים הוא אזהרה על עבד עברי שאסור לו למכור א""ע בע""ע. אבל הישראל הקונה אינו עובר באזהרה זו דלי ב""י עבדים וע""ז מסיק ע""ד דרב בין פועל בין בעה""ב יכול לחזור בו. וע""ד דר""י פועל יכול לחזור בו ולא בעה""ב:","רב אמר כי לי ב""י עבדים אין",JTmock Bava Metzia 6:2:2,"רב אמר כי לי בני ישראל עבדי' אין ישראל קונין זה את זה: א""ר יוחנן עבד עברי היא מתני'. על דעתיה דרב בין פועל בין בעל הבית יכול לחזור בו על דעתיה דרבי יוחנן פועל יכול לחזור בו ולא בעל הבית:"
Bava Metzia,"רידב""ז",1,0,27a,"@11הדא @33אנטיכריסים. ריבית הוא. עי' פ""מ ז""ל והמרא""פ זצ""ל פי' דקאי אשמור לי ואשמור לך דהוי בריבית כההיא יום גריד ורביעה לעיל בפ' א""נ ה""ח אנכש ואתה תעדור וה""ה שמירה דיום זה ויום זה אינן שוין:",הדא אנטיכריסים,JTmock Bava Metzia 6:5:2,הדא אנטיכריסים רבית הוא.
Bava Metzia,"רידב""ז",1,0,27a,"@11אר""י @33רוצה אדם ליתן כמה ולמכור פירותיו ע""י משכן מלשון זה משמע דיתן במה להקונה שיקנה ממנו פירותיו ע""י משכן. וקשה להבין היכן מצינו שהמוכר ישלם להלוקח בעבור שקונה ממנו. ע""ז אתא ר""א בשם ריב""ח רוצה אדם ליתן כמה ולמכור פירותיו למי שיפייסנו ע""י משכן ר""ל שיתן לסרסור דמי סרסירותו שיפעול אצל הקונה פירותיו שיתן לו משכן על בטחון מעותיו:","אר""י רוצה אדם ליתן כמה ולמכור פירותיו",JTmock Bava Metzia 6:5:4,"א""ר יוחנן רוצה אדם ליתן כמה ולמכור פירותיו על ידי משכון רבי אבהו בשם ר' יוסי בן חנינה רוצה אדם ליתן כמה ולמכור פירותיו למי שיפייסנו על ידי משכון:"
Bava Metzia,"רידב""ז",1,0,27b,"@11אר""ה @33זאת אומרת מנהג מבעל את ההלכה אע""ג דטפי להו בע""ב על אגרייהו. והי' ע""פ הדין מקום למימר דע""ד דהכי טפי להו אגרייהו מ""מ המנהג מבטל ההלכה:","אר""ה זאת אומרת מנהג מבעל את ההלכה",JTmock Bava Metzia 7:1:2,"אמר רב הושעיה זאת אומרת המנהג מבטל את ההלכה א""ר אימי כל המוציא מחבירו עליו להביא ראייה חוץ מזו"
Bava Metzia,"רידב""ז",1,0,27b,"@11א""ר @33אימי כל הממ""ת ע""ה חוץ מזו. דבמקום מנהג אם המנהג מסייע להמוציא א""צ לה""ר:","א""ר אימי כל הממ""ת ע""ה חוץ מזו",,
Bava Metzia,"רידב""ז",1,0,27b,"@11ערבית @33בין השכמה בין ערבה. גי' הרשב""א ז""ל ערבי שבתות בין השכמה בין ערבה:",ערבית בין השכמה בין ערבה,JTmock Bava Metzia 7:1:3,בני טיבריא לא משכימין ולא מעריבין בני בית מעון משכימין ומעריבין בני טיבריא שעלו לשכר בית מעון נשכרין בבית מעון בני בית מעון שירדו לשכר בטיבריא נשכרין בטיבריא אבל שעולה מטיבריא לשכר פועלין מבית מעון יכילו מימר לון כן סלקת במחשבתכון דלא הוינא משכח מיגר פועלין מטיבריא אלא בגין דשמעי' עליכון דאתון משכימין ומעריבין בגין כן סלקית הכא מקום שאין מנהג יהודה בן בוני רבי אמי רב יהודה תניי בית דין הוא שתהא השכמה של פועלין והערבה של בעל הבית ומאי טעמא תשת חשך ויהי לילה הכפירים שואגים לטרף תתן להם ילקוטון תזרח השמש יאספון יצא אדם לפעלו ערבית בין השכמה בין הערבה משל בעל הבית עד איכן עד כדי למלאות לו חבית מים ולצלות לו דגה ולהדליק לו נר
Bava Metzia,"רידב""ז",1,0,28b,"@11כל @33שכיוצא בה בא לידי זיקת מעשרות. ואיסור אחר גרם לו. אולי צ""ל כל שאין כיוצא בה בא לידי זיקת מעשרות ואיסור אחר גרם לו שכרו סתם פודה ומאכיל מעשר ומאכיל כיון דאין כיוצא בה בא לידי עונת המעשרות לא הוי לי' לאסוקי אדעתי' שכבר בא לידי עונת המעשרות כמו נתפרסו עיגוליו לא הוי לי' לאסוקי אדעתי' שכבר נדרסו ונתחייב במעשר. או דהוי נ""ר ע""כ פודה להנט""ר ומאכיל ומעשר ומאכיל. וכל שכיוצא בי בא לידי זיקת המעשרות כצ""ל אע""פ שאצלו עדיין לא נטבלה אך איסור אחר גרמה לו שכרו סתם אינו אוכל מפני שהי' לו לאסוקי אדעתי' שמא כבר נטבל למעשרות. ובתוספתא גי' אחרת היא וגם שם צריך קצת תיקון:",כל שכיוצא בה בא לידי זיקת מעשרות,JTmock Bava Metzia 7:5:2,כל שיוצא בו בא לזיקת המעשרות ואיסור אחר גרם לו שכרו סתם פודה ומאכיל מעשר ומאכיל קצץ עמו הרי זה אוכל. וכל שאין כיוצא בו בא לזיקת המעשרות ואיסור אחר גרם לו שכרו סתם אינו אוכל. קצץ עמו הרי זה אוכל:
Bava Metzia,"רידב""ז",1,0,29b,"@11זה @33הכלל שהי' ריב""ח אומר כל דבר שאיפשר להתקיים כו' כו' מכאן עד סוף הפרק הוא שייך למס' גיטין ומובא בכאן אגב גררא כדרך הש""ס הזה:","זה הכלל שהי' ריב""ח אומר כל דבר",JTmock Bava Metzia 7:7:3,זה הכלל שהיה ר' יודה בן תימא אומר כל דבר שאיפשר להתקיים והתנה עמה לא נתכוון אלא להפליגה בין שאמר בכתב בין שאמר בפה כל המתקיים בפה מתקיים בכתב. וכפר עותני בגליל ואנטיפטרס ביהודה את שבנתיים מטילין אותו לחומרו:
Bava Metzia,"רידב""ז",1,0,30a,"@11לילה @33שבינתים מהו אית מרין דרך הפרות ללון על בעליהן כו'. הרשב""א ז""ל מהפך הגי' מובא במה""פ ז""ל והמרה""פ ז""ל כתב שהוא דוחק ובאמת אינו דוחק ומובן מאוד:",לילה שבינתים מהו אית מרין דרך הפרות,JTmock Bava Metzia 8:2:2,לילה שבנתיים מהו. אית מרין דרך הפרות ללון על בעליהון וזו על ידי ששוכרה אצלו לא לנה כשאולה היא אצלה והוא חייב. ואית מרין אין דרך הפרות ללון על בעליהן וזו כשכורה אצלו פטור:
Bava Metzia,"רידב""ז",1,0,30a,"@11תני @33השאלני פרתך י' ימים והשאיל לו בהם ה' ימים ראשונים. מתה בתוך האחרונים משיעבוד הראשונים מתה וכיון דהה' ימים ראשונים הי' בבעלים והי' עמו בשעת שאלה א""צ להיות עמו בשעת שו""מ ע""כ פטור. אבל אם אמר לו השאלני פרתך לאחר עשרה ימים א""ל סבה כו' פירש דהנה אם שאל הבעלים היום והפרה למלאכתה לאחר עשרה ימים ומשך הפרה לרשותו לקנות בה בעשות מלאכה על לאחר עשרה וקיבלה בתורת שואל אך התנה שיתחיל בה במלאכה לאחר עשרה ימים פשיטא דחיובא דשואל עליה ומשעת משיכה נתחייב כדאיתא בתוס' ז""ל דף ע""ט ע""א במס' ב""ק דמשעת משיכה נתחייב שואל בשמירתו. ובפרט להנך מרבוותא ז""ל דסבירא להו דמשעה שסילק הבעלים שמירתו מחויב כל שומר בשמירתו לפי דינו. עי' בהרא""ש ז""ל שם והכא נתחייב על עצמו שימור דשואל דקיבל הפרה לרשותו לשאילה. אך התנה בעשית מלאכה על לאחר עשרה ימים ומתחייב מהשתא בשמירה דשואל משום שיעבודא דלאחרי עשרה ימים. ומ""מ אם מתה בתוך עשרה פטור מן האונסין דהא כל חיובו היא משום השיעבוד דלאחר עשרה דהא יכול כל אדם להתחייב א""ע מעכשיו בשביל דבר דאחר כך כמו שמבואר בחושן משפט סי' ס""א והנ""מ כשבא הדבר אחר כך נשתעבד מעיקרא אבל כשלא בא הדבר אחר כך פטור וכן מפורש במסכת כתובות ר""פ אף על פי בירושלמי עיי""ש בדברינו דמשעבד מעכשיו בשביל הביאה דאחר כך משא""כ כשמת ולא בא לידי ביאה פטור וה""נ אם מת השואל בתוך עשרה ימים או הפרה מתה בתוך עשרה פשיטא דפטור דהא כל חיובו דנשתעבד מעכשיו הוא בשביל שיעבודו דאחר עשרה ימים וכיון דלא בא לכלל חיוב דשאלה אחר כך פשיטא דפטור ואם כן אם מתה בתוך עשרה פטור אלא א""כ היתה לאחר עשרה ברשותו אז חייב אם מתה. וא""כ לענין מיתת הפרה לא שייך שנתחייב בתוך עשרה ואי דמתה לאחר עשרה הרי אז הוי שלא בבעלים. אך השואל טוען להמשאיל שסיבת מיתתה היא שנעשה טריפה הוא בתוך עשרה וכאילו כבר מתה בתוך עשרה ואפילו מתה לאחר עשרה אבל כיון דהסיבה היתה בתוך עשרה וחשוב כאילו כבר מתה בתוך עשרה הגם שמחויב אנכי באונסין כיון שנכנסה לאחר עשרה בשאילתי ועשיתי בה מלאכה לאחר עשרה. אבל כיון דכל עיקר המיתה דעכשיו הוא מהסיבה דמכבר ומזה מתה עתה לאחר עשרה ואז הוי בבעלים ופטור אני. ע""ז אמרינן דז""א דמשיעבוד ימים האחרוני' מתה כיון דכל החיוב של תוך עשרה הוא משיעבודא דלאחר עשרה והוי החיוב של שלא בבעלים וכה""ג כתב בהגהת אשרי ז""ל בפ' השואל וז""ל ז""ל דוקא שנדר להיות עמו במלאכתו תוך ימי שאילת הפרה אבל אחר ימי שאילת הפרה אע""פ שנדר קודם אין זה שאילה בבעלים עכ""ל ז""ל. וה""ה גבי הפרה דאם שאלה למלאכתה אחר ימי שאילת הבעלים אין זה שאילה בבעלים:",תני השאלני פרתך י' ימים והשאיל לו,JTmock Bava Metzia 8:3:2,"תני השאיליני פרתך עשרה ימים והשאל לי בהן חמשה ימים ראשונים. מתה בתוך האחרונים משעבוד הראשונים מתה. השאיליני פרתך לאחד עשר ימים א""ל סבה מן כבר מתה משיעבוד האחרונים מתה."
