masechet,commentary,perek,halakha,page,comment,dh,base text ref,base text
Shevuot,"רידב""ז",1,0,11b,"מחלפה שיטת ר""א תמן הוא אמר אפילו לא ידע וכא אמר עד שיודע. ומשני תמן הוא אמר והיא טמא עד שידע במה נטמא. ר""ל דיליף מן תיבת והוא ר""ל דהוא לשון ודאי טמא. הכא אשר חטא בה מ""מ. מחלפה שיטתיה דר""י ומשני תמן אשר חטא בה עד שידע במה נתחייב יליף מן תיבת בה דידע במאי. ברם הכא והיא טמא מ""מ. ע""ז מקשה ר""ח ולית כתוב בה בכאן דגבי טומאה נמי כתוב בה וא""כ קשה על תירוצא אליבא דר' יהושע ושפיר ס""ל לר""א דבעינן גבי טומאה עד שידע ומה מקיים ר""א בה דכתיב גבי חטאת. ומשני פרט למתעסק כן גי' הפ""מ ז""ל ומוכח היא:","מחלפה שיטת ר""א תמן הוא אמר אפילו",JTmock Shevuot 2:5:2,"חזקיה אמר מחלוקת ביניהון ור' יוחנן אמר משמעות דורשין ביניהון. אית תניי תני על העלם טומאה חייב ולא על העלם מקדש אית תניי תני על העלם שרץ חייב ולא על העלם מקדש. מחלפה שיטת רבי ליעזר תמן הוא אמר אפילו לא ידע וכא אמר עד שידע. תמן אשר חטא בה עד שידע במה נתחייב הכא והוא טמא מכל מקום. א""ר חיננא וכא לית כתיב בה. מחלפה שיטת ר' יהושע תמן הוא אמר והוא טמא עד שידע במה ניטמא הכא אשר חטא בה מ""מ. ומה מקיים רבי ליעזר בה פרט למתעסק:"
Shevuot,"רידב""ז",1,0,11b,"@99סליק פירקא בס""ד",,JTmock Shevuot 2:5:2,"חזקיה אמר מחלוקת ביניהון ור' יוחנן אמר משמעות דורשין ביניהון. אית תניי תני על העלם טומאה חייב ולא על העלם מקדש אית תניי תני על העלם שרץ חייב ולא על העלם מקדש. מחלפה שיטת רבי ליעזר תמן הוא אמר אפילו לא ידע וכא אמר עד שידע. תמן אשר חטא בה עד שידע במה נתחייב הכא והוא טמא מכל מקום. א""ר חיננא וכא לית כתיב בה. מחלפה שיטת ר' יהושע תמן הוא אמר והוא טמא עד שידע במה ניטמא הכא אשר חטא בה מ""מ. ומה מקיים רבי ליעזר בה פרט למתעסק:"
Shevuot,"רידב""ז",1,0,12a,"@11ניחא שאוכל ושלא אוכל שאכלתי ושלא אכלתי מה אנן קיימין אם בידוע שאכל ונשבע שלא אכל שבועת שקר הוא. @33[והיא כשיטת ר' יותנן בבבלי דף כא ע""א עיי""ש] ואם סבור שאכל ונשבע שלא אכל. ר""ל דסובר אפילו אכל יכול לישבע שלא אכל דסובר דאין זה חשוב שבועה ומותר לישבע וא""י דון דשבועה דסובר למאי נפ""מ אם אכלתי ואם לא אכלתי ותיבת ואם סבור קאי על ונשבע שלא אכל ר""ל דבאכל סובר לישבע שלא אכל. והא ר' בא בר רב יהודא בשם רב בשוגג בקרבנה ומזיד בקרבנה דאינו יודע דין חיוב דשבועה בקרבן נקרא שוגג. אבל סבור הייתי שאין בו שבועה מותר. וס""ל להגמ' דה""ה בשאכל ויצא מלבו שאכל וסובר שלא אכל ונשבע שלא אכל ואח""כ נזכר שאכל ג""כ פטור מטעם זה דהא סובר דמותר לישבע שלא אכל כיון דלדעתו לא אכל באמת ולאו משום האדם בשבועה פרט לאונס הטעם דבבבלי. דהירושלמי לא מביא האי ברייתא דאדם בשבועה. אלא הפטור משום דסובר דמותר לישבע וכן מוכח בסמוך. אלא במזיד בה ובשוגג בקרבנה ולא כן אמר ר""א בשם ר""י בניחותא מזיד בחלב ושוגג בקרבן מתרין ביה ולוקה ומביא קרבן דס""ל כמונבז דשגגת קרבן שמיה שגגה. הגם דלא קי""ל כמונבז אלא כר""ע דפליג עליו הנ""מ בכל התורה כולה אבל בשבועת ביטוי דחידוש הוא דלא אשכחן לאו דמייתי עלה קרבן והכא מייתי לכו""ע שגגת קרבן שמה שגגה. כדאיתא במס' שבת דף ס""ט עיי""ש. וע""כ משכח""ל בשגגת קרבן. ע""ז קאמר לית יכול דמרי ר' לא בשם ר' לעזר כך משיב ר""י לר""ע מצינו דבר שחייבין בזדונו משום שבועת שקר ובהעלמו משום שבועת ביטוי. דר""י פריך לר""ע דהיכי ס""ל דחייב קרבן אלשעבר הא היכן מצינו כזאת שיהא נתחלף בין מזיד לשוגג בשם אחר דבמזיד קרא שבועת שקר ובשוגג נקרא שבועת בטוי. והיכן מצינו דבר חדש הזה. ואי ס""ד דס""ל האי חידוש אליבא דר""ע דפליג אמונבז וס""ל בעלמא שגגת קרבן לאו שמיה שגגה ומ""מ הכא כיון דחדוש הוא מביא במזיד קרבן משום שגגת קרבן. הגם דבעלמא לא מצינו אליבא דר""ע דמביא קרבן במזיד. והכא מביא. ויתיביניה ר""ע מצינו דבר שחייבין בזדונו משום שבועת שקר ומביא קרבן וכי היכא דמצינו דבר חדש הזה כמו כן אל תתמה גם בזה דמצינו דבר שחייבין בזדונו משום שבועת שקר ובהעלמו משום ביטוי. א""ו דר""ע דפליג על מונבז ס""ל גבי שבועות ביטוי ג""כ דאינו חייב בקרבן על שגגת קרבן. ומשני אלא כי אנן קיימין בבריא לו שאכל ונשבע ונמצא שלא אכל. לזה משני דמיירי בבריא לו שאכל ונשבע ונמצא אח""כ שלא אכל. והירושלמי לא ס""ל האדם בשבועה פרט לאנוס דמיירי בשגגת שבועה כגון שבריא לו שאכל ונשבע ע""ז דאמרינן לבו אונסו כהבבלי דהא בירישלמי מס' נדרים פ""ג גרסינן תני נדרי שגגות מותרין שבועות שגגות אסורין ולא כשיטת הבבלי דף כ""ה ע""ב במס' נדרים דגרסינן כשם שנדרי שגגות מותרין כך שבועות שגגות מותרין. ובתוס' ז""ל במס' שבועות דף כ""ו ד""ה את כתבי דזהו משום האדם בשבועה אבל הירושלמי לא ס""ל כן אלא שגגות שבועות אסור והא דר""כ ור""א טעמא אחרינא. וקמקשה לא באומר אין זה שבועה בתמי' דבברור לו שאכל ונשבע עליו לדעתו באמת לא הוי כאומר אין זה שבועה והוי כאומר מותר. ומשני דבזה לא הוי כאומר מותר תמן באומר אין זה שבועה ר""ל דסבור לומר שמותר לישבע שלא אכל אע""פ שאכל. ברם הכא ביודע בה ששבועה היא ר""ל דיודע דאסור לישבע שאכל בשלא אכל אך הוא טועה וסובר דמותר לישבע שאכל מחמת שסובר שבאמת אכל וכיון דנמצא שלא אכל הרי הוא חייב קרבן שבועה:",ניחא שאוכל ושלא אוכל שאכלתי ושלא אכלתי,JTmock Shevuot 3:1:2,"ניחא שאוכל ושלא אוכל. שאכלתי ושלא אכלתי מה נן קיימין אם בידוע שאכל ונשבע שלא אכל שבועות שקר הוא ואם סבור שאכל ונשבע שלא אכל. רבי בא בר רב יהודה בשם רב בשוגג בקרבנה ובמזיד בקרבנה אבל סבור הייתי שאין בן שבועה מותר אלא במזיד בה ובשוגג בקרבנה. ולא כן א""ר אבהו בשם רבי יוחנן מזיד בחלב ובשוגג בקרבן מתרין בו ולוקה ומביא קרבן. לית יכיל דמר ר' לא בשם רבי לעזר כך משיב ר' ישמעאל לר' עקיבה מצינו דבר שחייבין בזדונו משום שבועת שקר ובהעלומו משום ביטוי. ויתיביניה רבי עקיבה מצינו דבר שחייבין בזדונו משום שבועת שקר ומביא קרבן. אלא כי נן קיימין בבריא לו שאכל ונשבע ונמצא שלא אכל. לא באומר אין זו שבועה. תמן באומר אין זו שבועה ברם הכא ביודע בה ששבועה היא אלא שהוא בטועה מחמת דבר אחר."
Shevuot,"רידב""ז",1,0,12b,"כ""ש אכילה פתר לה כר""ע דאמר כ""ש אכילה. הנו""י ז""ל מגיה דצ""ל כר""ש דס""ל כ""ש אכילה ולכאורה נראה שהצדק עמו וכצ""ל:","כ""ש אכילה פתר לה כר""ע דאמר כ""ש",JTmock Shevuot 3:1:3,"מה נן קיימין אם באומר שבועה שאוכל אכילת תורה אף ר' עקיבה מודה ואם באומר שבועה שלא אטעום אף רבנן מודו אלא כי נן קיימין כל שהוא כל שהוא אכילה פתר לה כר' עקיבה דאמר כל שהוא אכילה. מה מפקה מביניהן שבועה שאוכל ככר זו ואכלה חסר כל שהוא על דעתיה דר' עקיבה חייב על דעתיה דרבנין פטור. שלא אוכל ככר זה ואכלה חסר כל שהוא על דעתיה דרבי עקיבה פטור על דעתין דרבנין חייב. אף בשבועת ביטוי כן שבועה אשתי נהנית לי אם אוכל ככר זו ואכלה חסר כל שהוא על דעתיה דרבי עקיבה אשתו אסורה על דעתיה דרבנין אשתו מותרת. שלא אוכל ככר זו ואכלה חסר כל שהוא על דעתיה דרבי עקיבה אשתו מותרת על דעתיה דרבנין אשתו אסורה. אוף בנכסין כן שבועת נכסיי עלי אם אוכל ככר זו ואכל חסר כל שהוא על דעתיה דרבי עקיבה אסורין על דעתיה דרבנין נכסים מותרין. שלא אוכל ככר זו ואכל חסר כל שהוא על דעתיה דר""ע נכסיו מותרין על דעתיה דרבנין אסורין."
Shevuot,"רידב""ז",1,0,12b,"שתי' בכלל אכילה וכו'. והא תני המחה את החלב וגמאו כו' הר""ז חייב מה עביד לה אינו לא אוכל לטמא טומאת אוכלין ולא משקה לטמא טומאת משקין. ר' יוסי שמע לה מן הכא שבועה שלא איכל ואכל ושתה חברייא אמרין אינו חייב אלא אחת אמר לון ר' יוסי אמור דבתרא שבועה שלא אוכל ואשתה ואכל ושתה חייב שתים אילו כו' כן גי' הגר""א ז""ל בכי""ק וה""פ דר' יוסי האמורא שמע לה מן הכא דשתיה בכלל אכילה דלא כר' יונה אלא מהכא מוכח דשתי' בכלל אכילה מברייתא הזאת דפליג ר' יוסי התנא עם חברייא דחברייא אמרין שבועה שלא אוכל ואכל ושתה אינו חייב אלא אחת. שבועה שלא אוכל ואשתה ואכל ושתה חייב שתים ע""ז פריך להם ר' יוסי התנא על הרישא דס""ל דשבועה שלא אוכל ואכל ושתה אינו חייב אלא אחת מאי שנא מהסיפא דשלא אוכל ואשתה דחייב שתים. דהא מהרישא משמע דשתי' בכלל אכילה ומשום הכי אינו חייב אלא אחת א""כ בסיפא דנשבע על אכילה והדר אשתי' נמי לא יהא חייב אלא אחת דהוי דומה לנשבע שלא אוכל ושלא אוכל דשבועה השני' לא חלה על הראשונה משום דמושבע ועומד היא ע""ז השיבו לו רבנן דה""ט דסיפא אלו מי שהי' לפניו ב' כיכרים ואמר שבועה שלא אוכל כיכר זה. וחזר ואמר שבועה שלא אוכל ככר זה שמא אינו חייב שתים בתמי' בודאי חייב שתים דהא השבועה הראשונה היתה על ככר זה דווקא ועל כן חל השבועה על הככר השני' דהא למה לא אמר על שתיהן בב""א שבועה שלא אוכל ע""כ דבשבועה הראשונה היציא ככר השני' משבועתו. וה""נ כשנשבע שלא יאכל וחזר ונשבע שלא ישתה הרי הוציא השתי' מן השבועה הראשונה וע""כ חייב שתים כל זה היא הברייתא דפליג ר' יוסי עם חכמים הרי מוכח מהברייתא דשתי' בכלל אכילה כל זה מביא ר' יוסי האמורא להוכיח מהברייתא הזאת דשתי' בכלל אכילה כן היא הפי' לגי' הגר""א ז""ל:",שתי' בכלל אכילה וכו',JTmock Shevuot 3:2:2,"שתייה בכלל אכילה ולא אכילה בכלל שתייה. רבי יונה שמע כולהון מיכא. על כן אמרתי לבני ישראל כל נפש מכם לא תאכל דם מה נן קיימין אם בדם שקרש התני דם שקרש אינו לא אוכל ולא משקה אלא כן נן קיימין כל שהוא. כל שהוא אכילה פתר לה כר' עקיבה דר""ע אמר כל שהוא אכילה. והתני המחה הדם וגמעו או שהקפה חלב ואכלו אם יש בו כזית חייב. מה עבד לה רבי יונה אינו אוכל ליטמא טומאת אוכלין ולא משקה ליטמא טומאת משקין. חזר ר' יונה ופתר מתניתא ונתת הכסף בכל אשר תאוה נפשך מה נן קיימין אם בטועם טעם יין לתבשיל והלא הטעם לפגם אלא כן נן קיימין כל שהוא ורחמנא קרייה אכילה. רבנן דקיסרין אמרין תיפתר באילין גמרייה ואורזדרייה שהכל טפילה לאכילה כאכילה."
Shevuot,"רידב""ז",1,0,13a,"ר""ח בשם ר""פ שמע כו' לא בשבועה שלא אוכל ניחא כרבנן דנן [ר""ל רבנן דהכא] מדין שבועה שלא אוכל ברם כרבנן דתמן דאינון מרין שבועה שלא אוכל ושלא אשתה כן גי' הגר""א ז""ל בכי""ק:","ר""ח בשם ר""פ שמע כו' לא בשבועה",JTmock Shevuot 3:2:4,רבי חנינה בשם רבי פינחס שמע כולהון מיכא שבועה שלא אוכל ואכל אוכלין שאינן ראויין ושתה משקין שאינן ראויין פטור הא אכל אוכלין ראויין ושתה משקין ראויין חייב.
Shevuot,"רידב""ז",1,0,13a,"שבועה שלא אוכל וכרכה בעלי קנים. גי' המל""מ ז""ל בפי""ד מה' מאכלות אסורות שלא אוכל פת ועלי גפנים ועלי קנים וכרכה בעלי גפנים ועלי קנים אינו חייב אלא אחת ומפרש דפטור על הפת משום דלא נגע בגרונ' אלא נימס בתוך מעיו ורבותא קמ""ל לא מיבעיא היכי דלא נשבע על עלי גפנים וקנים פשיטא דפטור על הפת כיון דלאו מידי דאכילה נינהו כדאיתא בפ' בתרא דיומא הו""ל מין בשא""מ וחוצץ. אלא אפילו שנשבע עליהם ואחשיבנהו אכילה סד""א דהוי מב""מ ואינו חוצץ קמ""ל דאפ""ה פטור דמ""מ לא חשוב אוכל לענין חציצה ושפיר חוצץ ואיני חייב על הפת כי אם על עלי קנים וגפנים הנוגעים בגרונו והדר קאמר שאם נשבע על פת וחרצנים וזג כיון דחרצנים וזג לא מתאכלי בעינייהו אלא ע""י תערובות כדאיתא בבבלי דף כ""ג ע""ב. וכיון דנשבע עליהם חשובי אוכל ואינן חוצצין וחייב על כל או""א כן תוכן פירושו של המל""מ ז""ל:",שבועה שלא אוכל וכרכה בעלי קנים,JTmock Shevuot 3:3:2,"או""א: שבועה שלא אוכל פת וכרכה בעלי קנים ועלי גפנים ואכל אינו חייב אלא אחת שבועה שלא אוכל פת וחרצנין וזגין וכרכה בחרצנין וזגין חייב על כל אחת ואחת ואם היה נזיר חייב שלש. ר' יוחנן אמר בכולל אבל בפורט אין שבועות חלות על איסורין ר""ל אמר אפילו בכולל אין שבועות חלות על האיסורין:"
Shevuot,"רידב""ז",1,0,13b,"בדא ר""ש פוטר. פי' דמקשה על המתניתן שבועה שלא אוכל ואכל נבילות כו' חייב ור""ש פוטר על זה פריך בדא ר""ש פוטר ואליבא דרשב""ל פריך והוא ממש כדאיתא בבבלי דף כ""ג ע""ב דר""י מוקי בכולל לפיכך חייב על נו""ט. ור""ש לטעמי' דל""ל איסור כולל. ורשב""ל ס""ל דלפיכך חייב בנו""ט במפרש חצי שיעור או אליבא דר""ע דס""ל דאדם אוסר עצמו בכ""ש. והיינו דמסיק אליבא דרשב""ל בדא ר""ש פוטר. ומשני ר""ש כדעתיה דתנינן תמן כמה יאכל מן הטבל כו' ר""ש אומר כ""ש כו' כו' ופריך ע""ד דר""י למה ר""ש פוטר וע""ז משני ר""ש כדעתיה דל""ל איסור כולל. תני בשם ר""ש תענו את נפשותיכם כו' כדאיתא בבבלי ר""ש אומר האוכל נבילה ביוה""כ פטור מלא תעונה. רבב""מ בעי ע""ד דר""י דאמר בכולל שבועות חלות על האיסורין נתני שבועה שלא אוכל ואכל. היא קושית הבבלי בדף כ""ד מתיב רבא ברי' דרבה יש אוכל אכילה אחת וחייב עליה ארבעה חטאות ואשם א' טמא שאכל חלב והיא נותר מן המוקדשין ביוה""כ רמ""א אם היתה שבת והוציאו בפיו חייב. ואם איתא משכח""ל חמש כגון שאמר שבועה שלא אוכל תמרים וחלב מיגו דחייל אתמרים חייל נמי אחלב. וזהו קושית דרבב""מ הכא נתני שבועה שלא אוכל ואכל ושיטת הירושלמי דדווקא בכולל סתמא ס""ל לר""י דחייל בכולל באומר סתם שלא אוכל ולא במפרש תמרים וחלב דכיון דהזכיר מפורש חלב ונבילה ולא מהני מה שכולל עמו דברים המותרים אלא בכולל סתם שנשבע שלא יוכל סתם אז הוי כולל וחייל על איסורין [ולא כשיטת הבבלי דמוקי רישא בסתם ולפיכך לא חל וסיפא במפרש ז""א אלא בסתם חל על איסורין בכולל. ובמפרש לשיטת הירושלמי אינו חל משום דהזכיר בפי' נבילה וטריפה] [ולשיטת רש""י ז""ל גם להמסקנא בבבלי ג""כ כן דבכולל בסתם הוי כולל וחייל וסיפא מיירי בסתם דחייל ורישא מיירי בעפר עי' בדף כ""ד ע""א ברש""י ז""ל ד""ה ה""ג אלא כדרבא. וכבר מובא השיטת רש""י ז""ל והחולקין עמו בהראשונים ז""ל עי' בעה""מ ומלחמות ור""נ זכר כולם לברכה וכולם הסכימו דשיטת הירושלמי דבכולל סתמא חייל עיי""ש] וע""ז משני ר""ז כל ימיו כו' מה אנן קיימין אם באומר שבועה שלא אוכל בשר כל ימות השנה והפסח בתוכן או שלא אוכל עשרת הימים הללו ויוה""כ בתוכן במיחל שבועות על איסורין. פי' דהתם במתניתן דכריתות דיש אוכל אכילה אחת מיירי ביום הכפורים. וא""כ היכי משכח""ל איסור כולל. בשלמא גבי נבילה וטריפה משכח""ל שם. בנשבע שלא יאכל סתם ביום זה. דאי בנשבע שלא יאכל לעולם מלקין אותו בנשבע שלא יאכל ג' ימים. כדאיתא בירושלמי מס' נדרים בפ""ב. וע""כ דצריך לישבע על שלא יאכל לימים מיוחדים. וע""כ ביוה""כ צריך לישבע שלא יאכל עשרת ימים הללו עשרה לאו דווקא אלא סכום ימים מן עשרת ימים הללו ויוה""כ בתוכן כיון דמיוחד בתוך הימים הללו יוה""כ לא הוי כנשבע סתם שלא יאכל ביום זה. דהא הכא כיון שמפרש ימים הללו הוי כמפרש ימי היתר וימי איסור ולא הוי ככולל סתמא ע""כ לא מצי למיתני במתניתן דכריתות דמיירי ביוה""כ בנשבע שלא יאכל. ע""ז אמר ר' יוסי ומזה את ש""מ דבהי' לפניו ט' זיתים של שחיטה ואחד של נבילה ואמר שבועה שלא אוכל זיתים הללו כיון דמזכיר הללו הרי הוא כמפרש מפורש נבילה ולא חל כלל השבועה. ופריך רבב""ח והא עדיין אינו מתורץ קושית דרבב""מ דהא משכח""ל שבועה שלא אוכל אפילו ביוה""כ ואי דלא משכח""ל כולל סתמא דהא מחויב להזכיר ימים הללו. הלא יש אופן אחר דיכול לישבע כולל סתמא דישבע שלא יאכל משחיטת פלוני","בדא ר""ש פוטר",JTmock Shevuot 3:4:2,"בדא רבי שמעון פוטר ר' שמעון כדעתיה דתנינן תמן כמה יאכל מן הטבל ויהא חייב ר""ש אומר כל שהוא וחכ""א כזית. אמר להן ר' שמעון אין אתם מודין באוכלין נמלה כל שהוא שחייב אמרו לו מפני שהיא כברייתה אמר להן אף חיטה אחת כברייתה. על דעתיה דר' יוחנן למה ר' שמעון פוטר א""ר זעירה רבי שמעון כדעתיה תני בשם רבי שמעון תענו את נפשותיכם ממותר לכם ולא מאיסור לכם."
