masechet,commentary,perek,halakha,page,comment,dh,base text ref,base text
Shevuot,"רידב""ז",1,0,38a,"ר' יוחנן בשם ר' ינאי אין נפרעין מנכסי יתומים אלא בשטר שהרבית אוכלת בו וי""א אף לכתובת אשה א""ר ינאי מפני מזונות א""ר מתני' מן חש למזונות ר""ש היא דר""ש אומר במגבה הדבר תלוי ע""כ. הק""ע ז""ל מגיה במזונות הדבר תלוי. והפ""מ ז""ל פי' ר""ש דפ' אלמנה ניזונת דמוכרת למזונות קאמר ר""ש דמשגבתה מקצת אין לה מזונות וכן הנו""י ז""ל מפלפל בזה. ונראה לפענ""ד דה""פ דלכאורה צ""ב דפריך מאן תנא דחש למזונות פשיטא מהכ""ת נימא דלא יחוש למזונות מ""ש מזונות מרבית אבל יש להבין זאת בהקדם מה דגרסינן במס' גיטין דף ל""ה ההיא דאתיא לקמי' דרבה בר רב הונא א""ל מאי איעבד לך דרב לא מגבי כתובה לארמלתא א""ל הב לי מזוני א""ל מזוני נמי ל""ל דאר""י א""ש התובעת כתובתה בב""ד אין לה מזונות א""ל הפכיה לכורסי' כבי תרי עבדית לי. אפכוה לכורסי' ותרצוה ואפ""ה לא איפריק מחולשי' ע""כ. וצ""ב מאי דקאמרה כבי תרי עבדית לי מאי נ""מ אם הדינים אלו אמרו רב ושמואל או רב או שמואל הוי אמר תרווייהו וגם צ""ב מאי הי' ירא מפני קללתה הא שפיר דינא קאמר. ולפי הנראה האשה הזאת הבינה הדין דהא אמר לה מימרא דרב ומימרא דשמואל. ע""כ נראה לפענ""ד דע""פ הירושלמי הזה מובן מאוד דהנה גרסינן במס' כתובות דף נ""ד ע""א. דאר""י אמר שמואל התובעת כתובתה בב""ד אין לה מזונות מיתיבי מכרה כתובתה או מקצתה משכנה כתובתה או מקצתה או שעשתה כתובתה אפותיקי לאחר אין לה מזונות הני אין תובעת לא. אמרי הני בין בב""ד בין שלא בב""ד תובעת בב""ד אין שלא בב""ד לא ע""כ. וצריך ביאור להבין מאי טעם היא זה דבעינן ב""ד גבי תובעת וגבי מכרה לא בעינן ב""ד וכי הלכה למ""מ היא אכן האמת היא כך דגרסינן לעיל בר""פ נערה שנתפתתה עמדה בדין עד שלא מת האב הרי הן של אב מת האב הרי הן של אחים לא הספיקה לעמוד בדין עד שמת האב הרי הן של עצמה. ר""ש אומר אם לא הספיקה לגבות עד שמת האב הרי הן של עצמה. וגרסינן בגמ' בטעמא דר""ש ונתן האיש השוכב וגו' לא זכתה תורה לאב אלא בשעת נתינה. וכתב הרמב""ן ז""ל דרבנן ס""ל נמי האי דר""ש דלא זכתה תורה לאב אלא בשעת נתינה ואך טעמיי' דהעמדה בדין חשוב כגבוי ור""ש ס""ל דבעינן גבי' ממש וע""כ לרבנן. שפיר ניחא דהני בין בבית דין בין שלא בבית דין כיון דגבתה כבר שמכרה אין לה מזונות אבל תובעת בבית דין אין שלא בבית דין לא דבעמדה בדין כמאן דגביא דמי והוי כמו מכרה כתובתה דגבי' אבל שלא בבית דין לא. ונמצא דלר""ש דס""ל דהעמדה בדין לאו כגבוי דמי לא מהני תובעת כתובתה בב""ד להפסידה מזונות כי אם לרבנן דווקא דלר""ש העמדה בדין לא חשיב כגבוי ותלי רק בגבי' ממש ולא בהעמדה בדין. ועכשיו מובן מאליו פירוש הירושלמי הזה ר""י בשם ר""י אין נפרעין מנכסי יתומין אלא בשטר שהריבית אוכלת בהן. והיא כמו דאיתא בש""ס דילן אין ב""ד נזקקין לנכסי יתומין אלא בשטר שהריבית אוכלת בהן וי""א אף לכתובת אשה אר""י משום מזונות פי' דאין ב""ד נזקקין אלא לכתובה משום מזוני. וקשה הא כיון דתובעת כתובתה בבית דין דהא ב""ד נזקקין לה א""כ ממילא אין לה מזונות והיינו דמקשה ר' מתני' מאן חש למזונות דהא אליבא דמאן ניחוש למזונות הא כיון דתובעת כתובתה בב""ד ממילא אין לה מזונות דהא כגבוי דמי כיון דהחיוב של כתובה יצא ע""פ ב""ד חשוב כגבוי כמו למ""ד שטר העומד לגבות כגבוי דמי חשוב כגבוי אפילו בתוך זמנו כיון דעומד לגבות כמו כן בב""ד דחשיב כגבוי אפילו גבי קטנים דצריך להמתין עד שיגדלו דהא אילו פסקו ב""ד בהעמדה בדין לפרוע לאחר שנה ושנתים לא כגבוי דמי בתמי'. אלא ר""ש היא אלא ר""ש היא דאמר במגבה הדבר תלוי והלכך התובעת כתובה בב""ד יש לה מזונות [וכן לעיל בר""פ ד' גבי ר""ש אומר אם לא הספיקה לגבות גרסינן בירושלמי ג""כ שם ר""ש אומר במגבה הדבר תלוי] דהעמדה בדין לא חשוב כגבוי רק דבעינן גבוי ממש וע""כ מכרה כתובתה אין לה מזונות. אבל תובעת אף בב""ד יש לה מזונות. וז""ב. ועפ""ז כיון דרב לא מגבי כתובה לארמלתא כיון דעביד כרב האיך עביד כשמואל דהתובעת בב""ד אין לה מזונות הא הכא אליבא דרב לכו""ע עמידת ב""ד לא מהני דלא הוי כגבוי כיון דרב לא מגבי כתובה לארמלתא. ע""כ אמרה לי' כבי תרי עבדית לי ממ""נ כיון דפסקת כשמואל א""כ האיך פסקת כרב ואי כרב דלא מגבי כתובה לארמלתא האיך פסקת בתובעת בב""ד אין לה מזונות הא כיון דלא הוי כגבוי מאי מהני תובעת בב""ד ודו""ק:",ר' יוחנן בשם ר' ינאי אין נפרעין,JTmock Shevuot 7:7:4,"ר' יוחנן בשם ר' ינאי אין נפרעין מניכסי יתומין קטנים אלא בשרבית אוכלת בו ר' נתן אומר אף לכתובת אשה. א""ר מנא מפני מזונות. אמר רבי מתנייא מאן חייש למזונות ר' שמעון דרבי שמעון אומר בנקיבה הדבר תלוי. מאי כדון משם חינה כדי שיהו קופצין עליה לישאנה. רבי נתן אומר אף לגזילה ולנזקין א""ר יוסי אף נן תנינן תרתיהון לגזילה מהכא אם היה דבר שיש בו אחריות חייב לשלם לנזקין מהכא אין נפרעין מניכסי יתומין קטנים אלא מזיבורית. כיני מתניתא אין נפרעין מנכסי יתומין קטנים לנזקין אלא מזיבורית. והתני יעמוד הבן תחת האב הנזקין שמין להן בעידית ובעל חוב בבינונית וכתובת אשה בזיבורית. אמר רבי יוסי בי רבי בון תיפתר דברי הכל בהדא דייתיקי."
Shevuot,"רידב""ז",1,0,39a,"עד כמה מגלגלין עליו אמר ר""י עד כדי שיאמר לו עבדי אתה ופריך הגע עצמך שהי' כהן ר""ל שיש לו יחוס כהונה ומשני ע""ע לא עב""כ אלא עבד עברי דגם כהן יכול להיות ע""ע ופריך ובזה""ז אין דין ע""ע:","עד כמה מגלגלין עליו אמר ר""י עד",JTmock Shevuot 7:8:2,"א""ר יוסי הדא אמרה בנושא ונותן שלא בחשבון אבל בחשבון לא בדא. ואהן בן בית עוד הוא בנושא ונותן שלא בחשבון. ר' זעירא כהדא דר' יוסי חד בר נש אזל למידן קמי ר' זעירא וחייבו שבועה על תרין דינרין א""ל לאו תרין דינרין אני חייב לך הא טריפין לך. א""ל ומילת פלן ופלן. א""ר זירא או הב ליה כל דתבע לך או אישתבע ליה כל דמגלגל עלך. עד כמה מגלגלין עליו א""ר יוחנן עד כדי שיאמר לו עבדי אתה. הגע עצמך שהיה כהן ועבד עברי. וכי יש עבד בזמן הזה"
Shevuot,"רידב""ז",1,0,39a,"אמר ר""ש בר""י שמירה דלא כן מה אנן אמרין שמירה לא בטלי. נראה לפענ""ד דתיבת שמירה הראשונה מיותר וצ""ל במקומה התיבות שמירה לא בטלי' וכצ""ל אמר ר""ש בר""י שמירה לא בטלי' ר""ל דהשביעית אינו מבטל חיוב דשמירה ושבועת דשמירה ופריך הגמ' מאי קמ""ל דלא כן מה אנן אמרין ר""ל דהאיך הי' ס""ד דהשביעית משמטת שבועה דחיוב שומרין הא אינה משמטת אלא מלוה דכתיב בעל משה ידו. ולפיכך הקפת חנות ושכר שכיר ואונס קנס ופתוי אינו משמט כדאיתא במס' שביעית פ""י בירושלמי מפורש דכל הנהו אינו משמט משום דבעינן כל בעל משה ידו. א""כ פשיטא דחיוב דשבועת שמירה אינה משמעת דהא החיוב אינו משמט. ופשיטא דאינו משמט שבועתו. ע""ז משני היא בעל בעל מה בעל שנאמר להלן משמט אף בעל שנאמר כאן משמט ר""ל דגבי שבועת שומרין כתוב ונקרב בעה""ב אל האלקי' לשבועה וכתוב כל בעל משה ידו א""כ הוי אמינא דילפינן בעל בעל כי היכי דבעל משה ידו משמט אף על השבועה דשומרים ונקרב בע""ב גם כן משמט ע""ז קמ""ל ר""ש בר""י דאינו כן אלא דברים שהן משה ידו שביעית משמטתו ומשמטת שבועתו ושאין משה ידו אין שביעית משמטתו לא אותו ולא שבועתו:","אמר ר""ש בר""י שמירה דלא כן מה",JTmock Shevuot 7:8:3,"א""ר שמואל בר רב יצחק שמרה. דלא כן מה נן אמרין שמרה לא בטליה היא בעל בעל. מה בעל שנאמר להלן משמיט אף כאן משמיט. דברים שהן משה ידו שביעית משמטתו ומשמטת שבועתו ושאין משה ידו אין שביעית משמטתו לא אותו ולא שבועתו. כל ששביעית משמטתו משמטת שבועתו וכל שאין שביעי' משמטתו אינה משמט' שבועתו:"
Shevuot,"רידב""ז",1,0,39b,"אר""י ד' שומרין הן ואין חייבין אלא דרך קנין כו' מתניתא אמרה כן המקבל שדה מחבירו כו'. פי' הפ""מ ז""ל דהוא התוספתא המקבל שדה מחבירו משזכה בה חבירו שמין אותה כמה היא ראוי' לעשות אם הובירה אלמא דבעינן שיזכה בה חבירו. והגם דאין שמירה בקרקע אך בדהתנה חייב כמבואר בס' מחנה אפרים ז""ל בה' שומרין סי' ח' ומביא הירושלמי הזה ומפרש ג""כ כ' הפ""מ ז""ל ובנו""י ז""ל מגי' כאן ובאמת מבואר היטב כפי' הזה כהפ""מ ז""ל ומחנה אפרים ז""ל:","אר""י ד' שומרין הן ואין חייבין אלא",JTmock Shevuot 8:1:2,"א""ר יוחנן ארבעה שומרין הן ואין חייבין אלא דרך קניין ר' יעקב בר אחא בשם רבי לעזר אף לענין גזילה אין חייבין אלא דרך קניין. א""ר יוסי בי רבי בון ומתניתא אמרה כן המקבל שדה מחבירו וכו'. רבי חנניה א""ר בון אף בגניבה אין חייבין אלא דרך קניין. רבי חנניה בשם רבי פינחס ומתניתא אמרה כן היה מושכו ויוצא ומת ברשות הבעלים פטור הגביהו או הוציאו מרשות הבעלים ומת חייב. הגביהו ברשות הבעלים כמי שיצא כל רשות הבעלים. היה מושכו ויוצא עד שיצא כל רשות הבעלים. רבי אבהו בשם רבי יוחנן בעומדת באבוסו. ר' בון בר חייה בעי אם בעומדת באבוסו אפילו לא משך אלא כי נן קיימין בעומדת ברשות הרבים. מה רבי בון בר חייה כבית שמאי דבית שמאי אומרים ילקה בחסר ויתר. מה נן קיימין אם בעומדת ברשות הרבים וחשב לגוזלה ומתה באותה המחשבה דברי הכל חייב אם עד שלא משך דברי הכל פטור אלא כי נן קיימין בעומדת באבוסו. כדאמר רבי בון בר חייה כבית שמאי. אמר רבי בון תמן בקונה שלא מדעת הבעלים ברם הכא בקונה מדעת הבעלים."
Shevuot,"רידב""ז",1,0,40a,"תני וגונב מבית האיש לא מראש גגו. בכ""י של ידידי הרב הגאון הג' כש""מ מרדכי נ""י הגאבד""ק נאווא אלכסנדראווסקי כתב לפרש ולא מראש גגו דר""ל שהי' החפץ בראש גגו וגנב מראש גגו דווקא בגונב מבית וכדומה חייב בכפל. אבל גנב מראש גגו ר""ל במקום גלוי וכמו שכתבו התוס' ז""ל במס' ב""ק דף ע""ט ע""ב ד""ה כיון דראה גזלן היא כלומר שעושה במקום גלוי ולא דמי לגונב בבית או בחצר עכ""ל ז""ל. ובאמת אם גונב מר""ה פטור מכפל מה""ט כיון שעושה במקום גלוי. ולפיכך נקט במס' ב""מ דף ל""ד אגם דיוקא וזה שאמר ר""א הדא דתימר בגג שאינו מבוצר אבל בגג מבוצר כבית דמי ור""ל כיון שהיא מבוצר אינו עושה בגלוי עכ""ל:",תני וגונב מבית האיש לא מראש גגו,JTmock Shevuot 8:1:4,תני וגונב מבית האיש לא מראש גגו. אמר ר' לעזר הדא דתימר בגג שאינו מבוצר אבל בגג מבוצר כבית היא.
Shevuot,"רידב""ז",1,0,40a,"תני וגונב מבית האיש ולא מבית השואל. פי' דהירושלמי אזיל לשיטתי' הא דשייך הכיפל להשומר כששילם היא משום גזה""כ כדאיתא בר""פ המפקיד וגונב מבית האיש היא השומר אם ימצא הגנב ישלם שנים הוא דישלם להאיש עי' שם ובדברינו ע""ז דרש מבית האיש ולא מבית השואל. ופריך ויאמר א""כ למעט אף ש""ש ושוכר דהא הקרא דבית האיש כתוב גבי ש""ח ומאי ראית למעט שואל יותר מש""ש ושוכר ומשני כיון ששמירתו עליו כמו שהיא עליו חסר כאן אות בית קודם עליו השני וצריך להיות בעליו. ור""ל כיון ששמירתו עליו כמי שהיא בעליו פי' דבשואל אין חיובו לשלם בעד זו הגניבה משום השמירה דלא שמרו ומשלם משום דלא נתקיים השמירה. ז""א גבי שואל דהא אין חיובו דשואל משום שלא שמר החפץ. ז""א דהא חייב על האונסין אפילו מתה כדרכה. והיא ע""כ משום השתעבדות על אחריות ולא משום דלא נתקיים השמירה וכיון דחיוב התשלומין שלו בעד הגניבה הזאת היא משום תורת אחריות ולא משום הטלת שמירה. ע""כ אינו משלם הגנב הכיפל להשואל משום דאינו כבעלים אלא אחריותו עליו משא""כ בש""ש דחיובו היא משום שמירה הוי כבעליו של החפץ והגנב גנב מאתו. וע""כ משלם לו הכיפל והקצוה""ח ז""ל סי' שמ""ט מביא האי ירושלמי ומפרשו אבל אין זה סגנון לשון הירושלמי בשום מקום. ע""כ נראה לפענ""ד שפירושי היא נכון:",תני וגונב מבית האיש ולא מבית השואל,JTmock Shevuot 8:1:5,תני וגונב מבית האיש לא מבית השואל. ומר וגונב מבית האיש לא מבית נושא שכר והשוכר. מכיון ששמירתו עליו כמי שהוא עליו. שתימצא אומר שלש פרשיות הן התחתונה בשואל והאמצעית בנושא שכר והשוכר והעליונה בשומר חנם. שואל לפי שנהנה את הכל משלם את הכל נושא שכר והשוכר לפי שנהנה מקצת ומהנה מקצת נשבע מקצת ומשלם מקצת שומר חנם שאין לו הנייה נשבע ויוצא. מהו נשבע לא פשעתי היו אחרים יודעין שלא פשע מאי. נישמעינה מהדא הרי שנמצא הגנב ואין לו לשלם מהו שיאמר לו בוא והשבע לי שלא נתת עיניך בה לגוזלה. נישמעינה מהדא ואם לא ימצא הגנב הא אם נמצא פטור.
Shevuot,"רידב""ז",1,0,40a,"היו אחרים יודעים שלא פשע מאי נשמעיני'. מן הדא קיצר כאן וסמך על ההיא דר""פ המפקיד ומביא כאן רק ראשי פרקים כדרך הש""ס בסדר הזה ובפ' המפקיד גבי הסוגיא דשילם ולא רצה לישבע דקני הכיפל גרסינן שם דהיו לו עדים שנגנבה ושלא פשע ואף על פי כן שילם מיבעיא לי' אם קנה הכיפל או לא דהא אינו רק כקונה כיפל מחבירו ע""ז מסיק שם הדא דמר ר""א המוכר קנסו לחבירו לא עשה כלום. וכאן מתחיל היו אחרים יודעים שלא פשע מאי והיינו ההיא דפ' המפקיד הנ""ל וקאמר נשמעיני' מן הדא בראשי פרקים ולא מסיק הפשיטות מההיא דאמר ר""א הנ""ל וסמך על ההיא דהמפקיד הנ""ל כדרך הש""ס הזה וביחוד בסדר הזה. ושאל עוד הרי שנמצא הגנב ואין לו נשלם מהו שיאמר לו בא השבע לי שלא נתת עיניך לגוזלה דילמא שלחת יד מקודם וקאי ג""כ על ההיא היו יודעין שלא פשע ונמצא הגנב ואין לו במה לשלם אם צריך לישבע שלא שלח יד. וע""ז קאמר נשמעיני' מן הדא ואם לא ימצא הגנב הא אם נמצא פטור אבל אם לא נמצא הגנב אע""ג שיש עדים שנגנבה בלא פשיעה מ""מ חייב דהא ש""ש בגניבה חייב ומזה למד הרא""ש ז""ל דבירושלמי איכא דבדאיכא עדים שלא פשע א""צ לישבע שלא שלח בה יד עי' בחו""מ סי' רצ""ד בהג""ה עיי""ש ושם קאי אש""ח והכא מיירי בש""ש דחייב אפילו על גניבה אך בנמצא הגנב פטור השומר כשלא פשע והאיבעיא היא על שליחות יד. ופשוט דכיון דפטור משבועה שלא פשעתי פטור נמי משבועת שליחות יד:",היו אחרים יודעים שלא פשע מאי נשמעיני',JTmock Shevuot 8:1:5,תני וגונב מבית האיש לא מבית השואל. ומר וגונב מבית האיש לא מבית נושא שכר והשוכר. מכיון ששמירתו עליו כמי שהוא עליו. שתימצא אומר שלש פרשיות הן התחתונה בשואל והאמצעית בנושא שכר והשוכר והעליונה בשומר חנם. שואל לפי שנהנה את הכל משלם את הכל נושא שכר והשוכר לפי שנהנה מקצת ומהנה מקצת נשבע מקצת ומשלם מקצת שומר חנם שאין לו הנייה נשבע ויוצא. מהו נשבע לא פשעתי היו אחרים יודעין שלא פשע מאי. נישמעינה מהדא הרי שנמצא הגנב ואין לו לשלם מהו שיאמר לו בוא והשבע לי שלא נתת עיניך בה לגוזלה. נישמעינה מהדא ואם לא ימצא הגנב הא אם נמצא פטור.
Shevuot,"רידב""ז",1,0,40b,"גניבה אם גנב יגנב מעמו אבידה ואם לרבות האבידה ע""כ כר""ע כר' ישמעאל. פי' הפ""מ ז""ל כר""ע דדרש וא""ו דואם:",גניבה אם גנב יגנב מעמו אבידה ואם,JTmock Shevuot 8:1:6,כתיב כי יתן איש אל רעהו חמור או שור או שה וגו' שבועת ה' תהיה בין שניהם. גניבה אם גנוב יגנב מעמו אבידה ואם לרבות האבידה. עד כדון כר' עקיבה. כרבי ישמעאל. תני רבי ישמעאל מה אם גניבה שקרובה לאונסין את אמר משלם אבידה שאינה קרובה לאונסין לא כל שכן.
Shevuot,"רידב""ז",1,0,40b,"שבויה מנין נאמר כאן ונשבר או מת ונאמר להלן מת או נשבר מה להלן שבויה עמהן דהוקשו והשוו שבויה לשבורה או מתה אף כאן שבויה עמהן דגמרינן נשבר או מת מנשבר ומת ומה להלן הוקש שבויה להם אף כאן הוקש שבויה להם. ע""ז פריך עד כדון כר""ע דס""ל ילפינן היקש אח""כ לג""ש וילפינן למד מלמד משא""כ לר' ישמעאל דלא יליף למד מלמד. והוא בפ""ק דמס' קידושין בירושלמי ה""ב עיי""ש ע""ז משני דר' ישמעאל ס""ל כר""נ דאו מרבה שבויה ומסיק וכר""מ דא""ל דון מינה ומינה וכיון דקילפית ג""ש שואל מש""ש א""כ דון ומינה מה להלן נשבעין על האונסין אף כאן בשואל נשבעין על האונסין בתמי' א""כ ע""כ ר""מ לא ס""ל הג""ש וא""כ מנלן שבויה ע""ז משני עוד היא דר""נ דלר""מ ס""ל ה""נ כר""נ. ולשון זה דלר""מ למד ג""ש ממקום שבאת היא בירושלמי בפ' שבועת העדות ושבועת הפיקדון:",שבויה מנין נאמר כאן ונשבר או מת,JTmock Shevuot 8:1:7,"אין כתיב בשואל אלא שבורה אבידה וגניבה מניין ודין הוא מה אם נושא שכר והשוכר שאין משלמין שבורה ומתה משלמין גניבה ואבידה שואל שמשלם שבורה ומתה אינו דין שישלם אבידה וגניבה ותני עלה הרי זה קל וחומר שאין עליו תשובה. שבוייה מניין נאמר כאן ונשבר או מת ונאמר להלן ומת או נשבר מה להלן שבויה עמהן אף כאן שבויה עמהן. עד כדון כרבי עקיבה. כרבי ישמעאל רבי ישמעאל כרבי נתן רבי נתן אומר או לרבות את השבויה. וכר""מ דאמר ג""ש במקום שבאת מה להלן נשבעין על האונסין אף כאן נשבעין אל האונסין. עוד דר' נתן דר' נתן אומר או מת לרבות את השבויה."
