masechet,commentary,perek,halakha,page,comment,dh,base text ref,base text
Shevuot,"רידב""ז",1,0,27a,"ר""ז ר' יוסי בשם ר' יוחנן דברי ר""ש עיקר תביעה קנס. ר""ל דתבעו באמת ג' דברים קנס ובופ""ג אך העיקר התביעה הוא קנס ושבועתו היא על הקנס דהיא עיקר תביעתו. ומזה קאמר ר' יוחנן לעיל בה""ד דברי ר""ש נמצא שאין בידו חטים פטור כיון דאומר לו יש לך בידי חיטין ושעורין וכוסמין וא""ל שבועה שאין לך בידי כלום פטור כשאין לו חיטין משום דעיקר תביעתו היא על חיטים ושבועתו קאי על חיטים וקושטא קמשתבע. ה""נ עיקר תביעתו היא על קנס והכל הולך אחר העיקר. וע""כ אע""פ שתובע גם בופ""ג אבל כיון דעיקר השביעה היא על קנס הכל הולך אחר העיקר. וכיון שפטור על הקנס פטור נמי על בופ""ג והוי ממש כההיא דר' יוחנן לעיל בפ""ד לדברי ר""ש עיי""ש ור' אילא מפרש דברי ר""ש בתובעו קנס וביפ""ג. דברי חכמים בופ""ג וקנס כדאיתא בבבלי דרבנן ס""ל דלא שביק אינש מידי דמודי וחייב עלי' עיי""ש. והנפ""מ בין ר""י לר' אילא הוא דלר""י תובעו הכל קנס ובופ""ג ואך הקנס היא עיקר תביעתו אבל תובע לו הכל. ולר' אילא הוא דלר""ש תובע אותו אך הקנס לחוד אך הבופ""ג נכלל ממילא בתביעתו ורבנן ס""ל דבופ""ג היא תביעה בפני עצמה והקנס נכלל ממילא רבנן אמרי דברי ר""ש בתבעו דבר אחד. דברי חכמים בתבעו ג' דברים כדאיתא בבבלי וכן הוא גם הגי' הכא כמו בבבלי וכן היא הגי' בסמוך מפורש. וכן כתב הפו""מ ז""ל פי' דהיא כעין דאיתא בבבלי דלר""ש אינו תובע אלא קנס לחוד ובופ""ג אינו תובע כלל כדכתב הריטב""א ז""ל דלא בעי למיתבע תביעה גדולה בחד זימנא שלא יכבד על הנתבע ויקפוץ לכפור. וחכמים ס""ל דתיבע אף בופ""ג. וכן אתא רבין אמר ר""י בבבלי עיי""ש. ע""ז שאל ר""ז מר' יוסי בפירוש שמעת מר' יוחנן או ממילתיה ר""ל אם שמעת בפירוש דר' יוחנן ס""ל דתובע אליבא דר""ש הכל אך קנס הוא הראשון והוא העיקר ע""כ פוטר ר""ש. או לא שמעת ממנו בפירוש המימרא הזאת אך שמעת מכללא מן המימרא דה""ד דאמר ר' יוחנן דברי ר""ש נמצא שאין בידו חטים פטור ומזאת למדת כמו דהתם עיקר החטים כן נמי הכא דהעיקר הוא קנס אע""פ שתובע כולם הרי כולם נגררין אחר הקנס אחר עיקר התביעה. ור""ז שאל מר' יוסי השאלה הזאת אם מכללא אם בפירוש ע""ז אמר ר' יוסי מדשאל ר""ז האי שאלה משום דהא סבר כרבנן דס""ל דטעמא דר""ש משום דאיני תובע אלא קנס לחוד ואינו תובע בופ""ג כלל ואיהו פליג שם בה""ד מפורש על ההיא מימרא דר' יוחנן בתובע חטים ושעורין וכוסמין ומפרש דברי ר""ש דהכא כרבנן וס""ל דר' יוחנן לא קאמר אלא בתולה מפורש כוסמין בשעורין ושעורין בחטים עיי""ש אבל בתבעו חטים ושעורין וכוסמין ואע""פ שאין בידו חטים חייב דאף דהעיקר התביעה היא חיטים מ""מ לא אמרינן שנשבע על עיקר התביעה לחוד. ע""ז אמר ר""מ ואפילו דו סבר כר""א בפירוש מתניתן דידן נמי שאל שפיר מר' יוסי אם בפירוש שמיע ליה או מכללא דמשום דאפילו לר' אילא נמי אין ראי' לההיא דינא דחטים ושעורין משום דאפילו לר' אילא נמי במתניתן דידן אינו תובע אלא קנס אך דנכלל ממילא בופ""ג בכלל הזה. ורבנן ס""ל דגם בופ""ג נמי הוי תביעה בפ""ע ולא משום שנכלל בקנס ונמצא דאפילו לר' אילא נמי אין ראי' לההיא דחיטים ושעורים וכוסמין דהא הכא במתניתן לר""ש בתובעו דבר אחד אך דבופ""ג נכלל ממילא ברם הכא בחיטין ושעורין בתובעו ג' דברים:","ר""ז ר' יוסי בשם ר' יוחנן דברי",JTmock Shevuot 5:5:2,"רבי זירא רבי יסא בשם רבי יוחנן דברי ר""ש עיקר תביעה קנס לדברי חכמים לאו. א""ר אילא דברי ר""ש בתובעו קנס בושת ופגם דברי חכמים בתובעו בושת ופגם וקנס רבנין אמרין דברי ר""ש בתבעו שלשה דברים דברי חכמים בתבעו דבר אחד. רבי זירא בעא קומי רבי יסא בפירוש שמעת מרבי יוחנן או ממילתיה. א""ר יוסי דסבר כרבנן. א""ר מנא ואפילו דו סבר כרבי אילא דברי ר""ש בתבעו דבר אחד ברם הכא בתובעו שלשה דברים. אין לי אלא דברים שאינו משלם עליהן את הקרן מניין תשלומי כפל ותשלומי ארבעה וחמשה האונס והמפתה והמוציא שם רע ת""ל מכל אשר ישבע עליו לשקר. למוציא שם רע לאו קנס הוא א""ר ירמיה ר""ש היא דאמר במגבה הדבר תלוי:"
Shevuot,"רידב""ז",1,0,27a,"א""ר ירמי' דר""ש היא. דר""ש אמר במגבה הדבר תלוי עי' בפ""מ ז""ל ועי' במס' כתובות דף מ""ב ע""ב ומבואר כן:","א""ר ירמי' דר""ש היא",JTmock Shevuot 5:5:2,"רבי זירא רבי יסא בשם רבי יוחנן דברי ר""ש עיקר תביעה קנס לדברי חכמים לאו. א""ר אילא דברי ר""ש בתובעו קנס בושת ופגם דברי חכמים בתובעו בושת ופגם וקנס רבנין אמרין דברי ר""ש בתבעו שלשה דברים דברי חכמים בתבעו דבר אחד. רבי זירא בעא קומי רבי יסא בפירוש שמעת מרבי יוחנן או ממילתיה. א""ר יוסי דסבר כרבנן. א""ר מנא ואפילו דו סבר כרבי אילא דברי ר""ש בתבעו דבר אחד ברם הכא בתובעו שלשה דברים. אין לי אלא דברים שאינו משלם עליהן את הקרן מניין תשלומי כפל ותשלומי ארבעה וחמשה האונס והמפתה והמוציא שם רע ת""ל מכל אשר ישבע עליו לשקר. למוציא שם רע לאו קנס הוא א""ר ירמיה ר""ש היא דאמר במגבה הדבר תלוי:"
Shevuot,"רידב""ז",1,0,29a,"אסי אמר המלוה לחבירו לא יפרענו אלא בעדים. ולא מסיים המלוה לחבירו בעדים אלא המלוה לחבירו סתם. ע""ז אמר ר' אבון מילתי' דאסי המלוה לחבירו בעדים לא יחזור לו אלא בעדים:",אסי אמר המלוה לחבירו לא יפרענו אלא,JTmock Shevuot 6:1:8,"מנה לי בידך אין לך בידי אסי אמר המלוה לחבירו לא יפרענו אלא בעדים. א""ר אבין מילתיה דאסי המלוה לחבירו בעדים לא יחזיר לו אלא בעדים. מתניתא פליגא עלוי מנה לי בידך אמר לו הין למחר אמר לו תניהו לי נתתיו לך פטור אין לך בידי חייב:"
Shevuot,"רידב""ז",1,0,30a,"ר""א בשם ר""י. כל הסוגיא מבואר יפה במס' כתובות פ' שד""ג עיי""ש:","ר""א בשם ר""י",JTmock Shevuot 6:4:2,"ר' אמי בשם ר' יוחנן מתני' בטענו חיטים והודה לו בשעורי' אבל טענו שני מינין והודה לו באחד מהן דברי הכל פטור. א""ר אבהו בהדא דרבי אמי מאי דא דתנינן רבן גמליאל מחייב. בא להודיעך כח רבן גמליאל עד היכן מחייב. רבי חייה בשם רבי יוחנן לא סוף דבר בטענו חטים והודה לו בשעורים אבל אם טענו שני מינין והודה לו באחד מהן דברי חכמים פטור. ריש לקיש אמר לא יהא דבר בשטענו שני מינין והודה לו באחד מהן אבל אם טענו חטים והודה לו בשעורים דברי הכל חייב. כהדא דריש לקיש. חד בר נש אזל בעי מידון קמי רב דהוה מטען לחבריה חטין שעורין וכוסמין אמר ליה רב המתן עד דיגלגל עלך כל דבעי ובסופא תישתבע על כולן. אמר רבי אבהו כך משיב ריש לקיש לרבי יוחנן על דעתך דאת מר טענו שני מינין והודה לו באחד מהן דברי חכמים פטור והתנינן טענו חטים וקרקעות והודה לו בכלים וכפר בקרקעות בקרקעות וכפר בכלים כלים וכלים חייב כלים וקרקעות לא כ""ש. אמר ליה לזוקקו לשבועה דו מתניתא שהנכסים שיש להן אחריות זוקקין הנכסים שאין להן אחריות לישבע עליהן. ואפילו על דריש לקיש לית היא פליגא דתנינן הטוען לחבירו כדי שמן והודה לו בקנקנים. מה נן קיימין אם בשטענו קנקנים ושמן כל עמא מודיי שיש הודייה מהטענה אם בשטענו קנקנים ולא הודה בשמן כל עמא מודו שאין הודייה מהטענה. רבי זירא ור' אבהו בשם שמואל בשטוענו קנקנים ושמן אהן אמר קנקנים ולא שמן ואהן אמר שמן ולא קנקנים. קנקנים ולא שמן שמן ולא קנקנים. רבי לעזר בשם ר' אבין מפיק לישנא מחצין דמשח. וישאלוניה בהוא דאישתתק."
Shevuot,"רידב""ז",1,0,30a,"א""ר אבוה כך משיב רשב""ל לר""י ע""ד דתימר טענו שני מינין והודה באחד מכן דברי חכמים פטור והתנינן טענו חטים וקרקעות והודה לו בכלים וכפר בקרקעות בקרקעות וכפר בכלים כלים וכלים פטור כלים וקרקעות לא כ""ש. כצ""ל וזה פשוט. ולא ידעתי למה יגע הפ""מ ז""ל לפרש כפי שנדפס. דט""ס היא וצ""ל פטור:","א""ר אבוה כך משיב רשב""ל לר""י ע""ד",JTmock Shevuot 6:4:2,"ר' אמי בשם ר' יוחנן מתני' בטענו חיטים והודה לו בשעורי' אבל טענו שני מינין והודה לו באחד מהן דברי הכל פטור. א""ר אבהו בהדא דרבי אמי מאי דא דתנינן רבן גמליאל מחייב. בא להודיעך כח רבן גמליאל עד היכן מחייב. רבי חייה בשם רבי יוחנן לא סוף דבר בטענו חטים והודה לו בשעורים אבל אם טענו שני מינין והודה לו באחד מהן דברי חכמים פטור. ריש לקיש אמר לא יהא דבר בשטענו שני מינין והודה לו באחד מהן אבל אם טענו חטים והודה לו בשעורים דברי הכל חייב. כהדא דריש לקיש. חד בר נש אזל בעי מידון קמי רב דהוה מטען לחבריה חטין שעורין וכוסמין אמר ליה רב המתן עד דיגלגל עלך כל דבעי ובסופא תישתבע על כולן. אמר רבי אבהו כך משיב ריש לקיש לרבי יוחנן על דעתך דאת מר טענו שני מינין והודה לו באחד מהן דברי חכמים פטור והתנינן טענו חטים וקרקעות והודה לו בכלים וכפר בקרקעות בקרקעות וכפר בכלים כלים וכלים חייב כלים וקרקעות לא כ""ש. אמר ליה לזוקקו לשבועה דו מתניתא שהנכסים שיש להן אחריות זוקקין הנכסים שאין להן אחריות לישבע עליהן. ואפילו על דריש לקיש לית היא פליגא דתנינן הטוען לחבירו כדי שמן והודה לו בקנקנים. מה נן קיימין אם בשטענו קנקנים ושמן כל עמא מודיי שיש הודייה מהטענה אם בשטענו קנקנים ולא הודה בשמן כל עמא מודו שאין הודייה מהטענה. רבי זירא ור' אבהו בשם שמואל בשטוענו קנקנים ושמן אהן אמר קנקנים ולא שמן ואהן אמר שמן ולא קנקנים. קנקנים ולא שמן שמן ולא קנקנים. רבי לעזר בשם ר' אבין מפיק לישנא מחצין דמשח. וישאלוניה בהוא דאישתתק."
Shevuot,"רידב""ז",1,0,30b,"כיני מתניתא כפר במקצת קרקעות פטור במקצת כלים חייב כצ""ל וטעות הדפוס דמוכח הוא כפי' הפ""מ ז""ל. וה""פ דאילו לפי דגרסינן בהמשנה הודה מקצת כלים חייב דמשמע מזה דהודיי' דכלים מחייב שבועה אכפירה דקרקעות. ובאמת ההודיי' דכלים אינו מחייב שבועה על הקרקעות משום דהוי טענו חטים ושעורין והודה באחד מהן אלא העיקר משום דשבועתו על הכפירה דכלים זוקק שבועה על הכפירה דקרקעות ושבועה גוררת שבועה דמיגו דנשבע על הכפירה דכלים זוקק שבועה על הכפירה דקרקעות ושבועה גוררת שבועה דמיגו דנשבע על הכפירה דכלים נשבע נמי על כפירה דקרקעות דהא השבועה גוררת שבועה אבל לא הכלים גוררים להקרקע. וא""כ צריך להיות כך לשון המשנה כפר במקצת כלים חייב והיא דשבועתו על הכפירה דכלים זוקקו שבועה על הקרקע אבל לא ההודיי' דכלים מגררו לשבועה על כפירה דקרקעות. משום דהוי חטים ושעורים ע""כ קאמר כיני מתניתא כפר במקצת קרקע פטור במקצת כלים חייב:",כיני מתניתא כפר במקצת קרקעות פטור במקצת,JTmock Shevuot 6:4:3,כיני מתניתא כפר במקצת קרקעות חייב במקצת כלים פטור:
Shevuot,"רידב""ז",1,0,31a,"לית הדא פשיטא על דר' יוחנן דאמר הטוען לחבירו טענת גנב באבידה חייב. וכה""ג פריך במס' ב""ק דף ק""ו. הא אבידה הוא דבר בלא נתינה אך ממילא נמצא שלי בידך א""כ כמו כן הקטן כשיגדול יתבע שנמצא ממילא שלי בידך ומשני א""ר בא תיפתר שאמר לו עד שאת קטן תבעתני ונפטרתי אז משבועתך פי' דלא דמי דבאבידה נתחייב ברגע הראשונה לישבע מיד להבע""ד משא""כ הקטן כשהגיע החפץ לידו מן הקטן אז הי' פטור ואם הי' תובע אותו אז הי' פטור משבועה ונמצא דבשעה שהגיע החפץ לידו הי' פטור משבועה והאיך יתחייב אח""כ דהא כל עיקר הטענה דהשתא הוא על חיוב של השעה הראשונה ובשעה הראשונה הי' פטור משבועה. ובבבלי משני תירוצים אחרים:",לית הדא פשיטא על דר' יוחנן דאמר,JTmock Shevuot 6:5:2,"כתיב כי יתן איש אל רעהו פרט לקטן. עד כדון כשנתן לו קטן ותבעו קטן נתן לו קטן ותבעו גדול תלמוד לומר רעהו עד שיהא נתינתו ותביעתו שוין. א""ר בא בר ממל לית הדא פשיטא על דרבי יוחנן דאמר הטעון לחבירו טענת גנב באבידה חייב איכן אבידתי אמר לו נגנבה. א""ר בא תיפתר שאמר לו עד שאת קטן תבעתני ונפטרתי משבועתך. שבועת ה' תהיה בין שניהם להוציא היורש. רבי אילא בשם רבי יסא ביורשיו היא מתני'"
Shevuot,"רידב""ז",1,0,31a,"שבועת ד' תהיו בין שניהם להוציא היורש. ר""א בשם ר' יוסי ביורשין היא מתניתא ר""ל הא מתניתן דלקמן. וכן היתומים לא יפרעו אלא בשבועה ומוקמינן דביורשין מיירי מתניתן דהיא יתומים מן היתומים. וכן מוקמינן בבבלי דף מ""ז עיי""ש א""כ הרי מצינו שבועה בין יורשין אלא דלאו בין שניהם ממעט יורשין אלא האי בין שניהם להכי היא דאתא בין שניהם אינה זזה מבין שניהם לעולם כו' ועי' בבבלי דף מ""ז ע""ב ורב ושמואל האי שבועת וגו' מאי קדרשי בי' כו' מלמד שהשבועה חלה על שניהם כו' עיי""ש:",שבועת ד' תהיו בין שניהם להוציא היורש,JTmock Shevuot 6:5:2,"כתיב כי יתן איש אל רעהו פרט לקטן. עד כדון כשנתן לו קטן ותבעו קטן נתן לו קטן ותבעו גדול תלמוד לומר רעהו עד שיהא נתינתו ותביעתו שוין. א""ר בא בר ממל לית הדא פשיטא על דרבי יוחנן דאמר הטעון לחבירו טענת גנב באבידה חייב איכן אבידתי אמר לו נגנבה. א""ר בא תיפתר שאמר לו עד שאת קטן תבעתני ונפטרתי משבועתך. שבועת ה' תהיה בין שניהם להוציא היורש. רבי אילא בשם רבי יסא ביורשיו היא מתני'"
Shevuot,"רידב""ז",1,0,31b,"עבר ונשבע ר' יוחנן אמר מביא קרבן על השבועה והתוס' ז""ל במס' ב""ק דף ק""ג ע""א ד""ה הגוזל. כתבו בפשיטות דאפילו בנשבע מעצמו והב""ד פטרו כגון בפחות משו""פ נמי חייב חומש משום דאפילו על שבועת עצמו נמי חייב חומש וכן מפורש שם דף ק""ו ע""א עיי""ש. נראה פשוט דזה חוץ מן ההקדש משום דבעינן וכיחש בעמיתו. וכן משמע במס' תרומות פ""ו עיי""ש ברידב""ז ה""א ד""ה מחל. ועי' בתוס' הרי""ד במס' דמאי פ""ג ה""ד ד""ה בעין עיי""ש:",עבר ונשבע ר' יוחנן אמר מביא קרבן,JTmock Shevuot 6:6:2,"עבר ונשבע רבי יוחנן אמר מביא קרבן על השבועה ר' לעזר אומר אינו מביא. א""ר אבין בר חייה כן משיב רבי יוחנן לרבי לעזר לא אם אמרת בשבועת העדות שנוהגת בעבדים ובשטרות ובקרקעות תאמר בשבועת הפקדון שאינה נוהגת בעבדים ובשטרות ובקרקעות. ושבועת העדות לאו בב""ד ובית דין מוסרין שבועה לחשוד. אלא בשעבר ונשבע ותימר מביא קרבן על השבועה וכא עבר ונשבע מביא קרבן על השבועה."
Shevuot,"רידב""ז",1,0,31b,"ואית דבעי משמעינה מן הדא חמור או שור או שה דכתיב גבי ש""ש בפרשה שני' דכתיב שם ונשבר או נשבה אין רואה שבועת ד' וגו' מה אלו מיוחדין שיש בהם שבר ושבוי' ומתה יצאו קרקעות שאין בהם שבר ושבוי' ומתה נתמעטו משבועה אוציא קרקע ולא אוציא עבדים. מה אלו מיוחדין שיש להם קנס ר""ל דילפינן מפרשה ראשונה דגבי כפל כתוב ג""כ חמור שור ושה. והתם לא כתיב נשבר או נשבה או מתה. לרבות עבדים דבר מיתה ושבורה ושבוי'. וממעטינן שם עבדים מכפל משום דמה הפרט מפורש שם דמי' קצובים כדאיתא בסמוך. וע""כ ממעט גם הכא משבועה וקאמר מה אלו שור וחמור ושה מיוחדין שיש בהם קנס ר""ל דמשלם עליהם כפל דהירושלמי קרא לכפל קנס בסמוך. אף כל שמשלם קנס יצאו עבדים שאין בהם קנס הגם דבקרא הזה יש לרבות עבדים משום דאיתנייהו בשבורה ושבוי' ומתה. אבל ממעטינן משום דשור ושה מיוחד שיש בהם תשלומי כפל יצאו עבדים שאין בהם תשלומי כפל:",ואית דבעי משמעינה מן הדא חמור או,JTmock Shevuot 6:6:3,ואית דבעי נישמעינה מהדא חמור או שור או שה מה אילו מיוחדין שיש בהן שבר ושבויה ומתה יצאו קרקעות שאין בה שבר ושבויה ומתה אוציא קרקע ולא אוציא עבדים. מה אילו מיוחדין שיש להן קנס יצאו עבדים שאין להן קנס. אוציא עבדים ולא אוציא שטרות שיש להן קנס. מה אילו מיוחדין שיש להן אונאה יצאו שטרות שאין להן אונאה מיכן אמרו המוכר שטרות לבסם יש לו אונאה. ר' ישמעאל דרש או נפש כי תשבע כלל להרע או להיטיב פרט לכל אשר יבטא חזר וכלל כלל ופרט וכלל אין אתה דן אלא כעין הפרט. מה הפרט בתביעת ממון ולעצמו ומוציא בדין ויש לו דמי' ודמיו קצובין ובמטלטלין ופטור על העונש ועל הקנס. בתביעת ממון פרט לאומר לחבירו תן לי מאתים זוזים שאמרת ליתן לי ולא נתתה. לעצמו פרט לאומר לחבירו קיללתני וביישתני שפטור. ומוציא בדין פרט לאומר לחבירו אנסת ופיתיתה בת פלוני. ויש לו דמים פרט לשטרות. ודמיו קצובין פרט לעבדים. ובמטלטלין פרט לקרקעות. ופטור על העונש פרט לאומר לחבירו הדלקת גדישי בשבת שפטור. ופטור על הקנס פרט לתשלומי כפל ותשלומי ארבעה וחמשה שהן קנס.
