Index Title,Keritot
Keritot 21b:1,"nicht erforderlich]. Ausgenommen ist ein Toter, der auch zur Ergänzung$fn39 verwendet, nicht als Speise verunreinigungsfähig ist, denn sein Wille ist nichtig gegenüber dem aller anderen Menschen$fn40. R. Ḥananja erwiderte: Du kannst auch sagen: [Aas] im Quantum einer Olive, denn hier handelt es sich um den Fall, wenn man es mit Teig überzogen$fn41hat. – Demnach sollte es auch der Befähigung benötigen!? – Dies gilt nur von anderen Speisen, die nicht durch Berühren und nicht durch Tragen verunreinigend sind, dieses aber, wenn auch durch Berühren nicht verunreinigend, da es mit Teig überzogen ist, ist durch Tragen verunreinigend, denn man kann es tragen. Ausgenommen ist ein Toter, denn auch wenn man ihn mit Teig überzogen hat, haftet ihm eine schwere Unreinheit an, und die Unreinheit dringt durch nach oben und dringt durch nach unten$fn42."
Keritot 21b:2,"Der Meïster sagte: Ich schließe [das Blut der] Kriechtiere aus, bei denen es keine [schwere] Unreinheit gibt. Etwa nicht, das Kriechtier verunreinigt ja durch Berühren!? – Durch Tragen verunreinigt es aber nicht."
Keritot 21b:3,"Der Meister sagte: Ich schließe das Blut der Fische und das Blut der Heuschrecken aus, die vollständig erlaubt sind. Was heißt vollständig erlaubt: wollte man sagen, auch ihr Talg ist erlaubt, so ist ja auch beim Wilde der Talg erlaubt, das Blut aber verboten!? – Vielmehr, bei ihnen hat das Verbot der Spannader keine Geltung. – Auch beim Geflügel hat ja das Verbot der Spannader keine Geltung, das Blut aber ist verboten!? – Vielmehr, vollständig erlaubt, indem sie des Schlachtens nicht benötigen."
Keritot 21b:4,"Der Meister sagte: Wie es beim Geflügel keine Mischung gibt, ebenso ein Vieh &amp;c., so heißt es: <i>vom Vieh</i>. Welche Mischung: wollte man sagen, die Mischung durch Kreuzung$fn43und die Mischung beim Pflügen$fn44, so haben wir ja gelernt: desgleichen Wild und Geflügel$fn45!? Vielmehr, erwiderte Abajje, bei dessen Wolle man nicht wegen Mischgewebes$fn46schuldig ist."
Keritot 21b:5,"R. Jehuda sagte im Namen Rabhs: Wegen des Blutes von Ekeltieren ist beim Quantum einer Olive zu geißeln. Man wandte ein: Das Blut der Milz, das Blut des Herzens, das Blut der Nieren und das Blut einzelner Glieder ist mit einem Verbote belegt; das Blut von Zweifüßlern und das Blut von Ekel- und Kriechtieren ist verboten, jedoch ist man wegen dessen nicht schuldig!? – Man macht sich nicht der Ausrottung schuldig, wohl aber ist man schuldig wegen des Verbotes. – Erstens ist dies ja dasselbe, was der Anfangsatz$fn47, und ferner schließt sie ja dieser Autor auch vom Verbote aus, denn er lehrt: ich schließe das Blut der Kriechtiere aus, bei denen es keine schwere Unreinheit gibt!? R. Zera erwiderte: Hat man ihn wegen eines Kriechtieres gewarnt$fn48, so ist er zu geißeln, wenn wegen Blutes, so ist er nicht zu geißeln."
Keritot 21b:6,"Rabh sagte: Das gesammelte Blut von Fischen$fn43ist verboten. Man wandte ein: Blut der Fische und Blut der Heuschrecken ist erlaubt, auch von vornherein!? – Dies, wenn es nicht gesammelt ist, Rabh aber spricht von dem Falle, wenn es gesammelt ist. – Dem entsprechend bei Zweifüßlern, wenn es nicht gesammelt ist; aber ist solches denn verboten, es wird ja gelehrt, daß man von einem Laibe das Blut$fn50abkratze und ihn esse, das [Blut] zwischen den Zähnen aber ohne Bedenken aussauge und herabschlucke!? – Vielmehr, jene Lehre gilt von dem Falle, wenn Schuppen darin$fn51sind, das aber, was Rabh sagt, es sei verboten, gilt von dem Falle, wenn keine Schuppen darin sind$fn52."
Keritot 21b:7,"R. Šešeth sagte: Beim Blute der Zweifüßler liegt nicht einmal ein Gebot der Enthaltung$fn53vor. Man wandte ein: Das Blut der Milz, das Blut des Herzens, das Blut der Nieren und das Blut einzelner Glieder ist mit einem Verbote belegt, das Blut von Zweifüßlern und das Blut von Ekel- und von Kriechtieren ist verboten, jedoch ist man wegen dessen nicht schuldig!? – Die Lehre, daß es verboten sei, gilt von dem Falle, wenn es"
Keritot 22a:1,"gesondert ist, R. [Šešeth] aber spricht von dem Falle, wenn es nicht gesondert ist. Wie gelehrt wird: Das an einem Laibe haftende Blut kratze man ab und esse ihn, das [Blut] zwischen den Zähnen aber darf man ohne Bedenken aussaugen und herunterschlucken. Manche beziehen das, was R. Šešeth gesagt hat, auf folgende Lehre: Man könnte glauben, wer Milch von Zweifüßlern genießt, übertrete ein Verbot, und zwar wäre dies durch einen Schluß zu folgern: wenn du bei einem Vieh$fn54, bei dem du hinsichtlich der Berührung$fn55erleichtert hast, hinsichtlich der Milch erschwert$fn56 hast, um wieviel mehr solltest du bei Zweifüßlern, bei denen du hinsichtlich der Berührung erschwert$fn57hast, hinsichtlich der Milch erschweren; daher heißt es:$fn58<i>dies sei euch unrein</i>, dies ist unrein, nicht aber ist das Blut von Zweifüßlern unrein, sondern rein. Wollte man nur die Milch ausschließen, die nicht bei allen gleich$fn59ist, nicht aber das Blut, das bei allen gleich ist, so heißt es: <i>dies sei euch unrein</i>, dies ist unrein, nicht aber ist das Blut von Zweifüßlern unrein, sondern rein. Hierzu sagte R. Šešeth, hierbei liege nicht einmal ein Gebot der Enthaltung vor."
Keritot 22a:2,"Dort haben wir gelernt: Das Herz reiße man auf und lasse das Blut heraus; hat man es nicht aufgerissen, so hat man das Verbot$fn60nicht übertreten. R. Zera sagte im Namen Rabhs: Dies gilt nur vom Herzen eines Geflügels, weil es kein olivengroßes Quantum hat, beim Herzen eines Viehs aber ist [das Blut] verboten, weil es ein olivengroßes Quantum hat, und man ist dieserhalb der Ausrottung schuldig. Man wandte ein: Das Blut der Milz, das Blut des Herzens, das Blut der Nieren und das Blut einzelner Glieder ist mit einem Verbote belegt; das Blut von Zweifüßlern und das Blut von Ekel- und Kriechtieren ist verboten, jedoch ist man wegen dessen nicht schuldig!? – Die Lehre, man sei wegen dessen nicht schuldig, bezieht sich auf das darin$fn61enthaltene [Blut], was aber Rabh gesagt hat, bezieht sich auf das hereinkommende$fn62. – Das darin enthaltene Blut ist ja dasselbe, was das Blut einzelner Glieder!? – Lehrt er etwa nicht, auch nach deiner Auffassung, vom Blute der Nieren und vom Blute einzelner Glieder!? Vielmehr lehrt er [allgemein] und wiederholt es [einzeln], ebenso lehrt er es hierbei [allgemein] und wiederholt es [einzeln]. – Woher kommt das hereinkommende [Blut]? R. Zera erwiderte: Wenn die Seele austritt, wird es eingesogen."
Keritot 22a:3,"W<small>EGEN DES</small> B<small>LUTES</small>, <small>MIT DEM DIE</small> S<small>EELE AUSGEHT</small>, <small>IST MAN SCHULDIG</small>. Es wurde gelehrt: Welches ist Aderlaßblut, mit dem die Seele ausgeht? R. Joḥanan sagt, wenn es strömt; Reš Laqiš sagt, vom schwärzlichen Tropfen$fn63ab. Man wandte ein: Welches ist Aderlaßblut, mit dem die Seele ausgeht? Wenn es strömt; ausgenommen ist das nachfließende Blut, das nur rinnt. Deshalb gleicht [das Blut] vorher und nachher$fn64dem nachfließenden Blute. Dies ist eine Widerlegung des Reš Laqiš!? – Nein, dies schließt das schwärzliche Blut aus, das Blut vorher und nachher aber ist, obgleich es fließt. Blut der Seele. Man wandte ein: Welches heißt Blut der Seele$fn65? Das, was strömt; ausgenommen das Blut vorher und nachher, das fließt. Dies ist eine Widerlegung des Reš Laqiš!? – Er kann dir erwidern: hierüber streiten Tannaím, denn es wird gelehrt: Welches ist Blut der Seele? Das, was strömt – so R. Elie͑zer; R. Šimo͑n sagt, vom schwärzlichen Tropfen ab. In der Schule R. Jišma͑éls wurde gelehrt:$fn66<i>Und das Blut Erschlagener wird er trinken</i>, ausgenommen das ausströmende Blut, das Saaten nicht verunreinigungsfähig macht$fn67."
Keritot 22a:4,"R. Jirmeja fragte R. Zera: Wie ist es, wenn man einem Vieh zur Ader gelassen und das Blut in zwei Gefäße aufgenommen hat: wegen des ersten ist man nach aller Ansicht schuldig$fn68, ist man aber auch wegen des anderen schuldig oder nicht? Dieser erwiderte: Darüber besteht ein Streit zwischen R. Joḥanan und Reš Laqiš, denn es wurde gelehrt: Wer einem Vieh zur Ader gelassen und das Blut in zwei Gefäße aufgenommen$fn69hat, ist, wie Reš Laqiš sagt, zwei Sündopfer$fn70schuldig, und wie R. Joḥanan sagt, nur ein Sündopfer schuldig."
Keritot 22a:5,"N<small>ACH</small> R. J<small>EHUDA IST MAN WEGEN DES NACHFLIESSENDEN</small> B<small>LUTES SCHULDIG</small>. R. Elea͑zar sagte: R. Jehuda pflichtet bei$fn71hinsichtlich der Sühne, denn es heißt:$fn72<i>denn das Blut mit der Seele sühnt es</i>; das Blut, mit dem die Seele ausgeht, sühnt, mit dem aber die Seele nicht ausgeht, sühnt nicht. R. Naḥman b. Jiçḥaq sagte: Auch wir haben demgemäß gelernt:$fn73<i>Blut</i>, wozu heißt es: <i>keinerlei Blut</i>? Da es heißt: <i>denn das Blut mit der Seele sühnt es</i>, so weiß ich dies$fn74nur vom Opferblute, mit dem die Seele ausgeht, das Sühne schafft, woher dies von profanem Blute und vom nachfließenden Blute? – Darum heißt es: <i>keinerlei Blut</i>. Und eine anonyme Lehre im Siphra ist von R. Jehuda."
Keritot 22a:6,"<sup>ii</sup><b>R.</b> A͑<small>QIBA VERPFLICHTET WEGEN EINER ZWEIFELHAFTEN</small> V<small>ERUNTREUUNG</small>$fn75 <small>ZU EINEM</small> S<small>CHWEBE</small>-S<small>CHULDOPFER</small>, <small>DIE</small> W<small>EISEN BEFREIEN DAVON</small>. J<small>EDOCH PFLICHTET</small> R. A͑<small>QIBA BEI</small>, <small>DASS ER DAS</small> V<small>ERUNTREUTE NUR DANN ZU ERSETZEN BRAUCHE</small>, <small>WENN ER SICH DESSEN BEWUSST WIRD UND DAZU EIN ZWEIFELLOSES</small> S<small>CHULDOPFER BRINGT</small>. R. T<small>RYPHON SPRACH</small>: <small>WESHALB SOLL DIESER ZWEI</small> S<small>CHULDOPFER</small>$fn76<small>BRINGEN</small>!? V<small>IELMEHR ERSTATTE ER</small> [<small>DAFÜR</small>] <small>DAS</small> V<small>ERUNTREUTE MIT DEM</small> F<small>ÜNFTEL</small>$fn77, <small>SODANN BRINGE ER EIN</small> S<small>CHULDOPFER FÜR ZWEI</small> S<small>ELA͑ UND SAGE</small>: <small>HABE ICH SICHER EINE</small> V<small>ERUNTREUUNG BEGANGEN</small>, <small>SO SEI DIES MEINE</small> E<small>RSTATTUNG FÜR DIE</small> V<small>ERUNTREUUNG UND JENES MEIN</small> S<small>CHULDOPFER</small>, <small>IST ABER MEINE</small> V<small>ERUNTREUUNG ZWEIFELHAFT</small>, <small>SO SEI DER</small> G<small>ELDBETRAG NUR FREIWILLIGE</small> S<small>PENDE UND DAS</small> S<small>CHULDOPEFR EIN SCHWEBENDES</small>. V<small>ON DERSELBEN</small> A<small>RT NÄMLICH</small>, <small>VON DER ER</small> [<small>DAS</small> O<small>PFER</small>] <small>BRINGT</small>, <small>WENN ER SICH</small> [<small>DER</small> S<small>ÜNDE</small>] <small>BEWUSST WIRD</small>, <small>BRINGT ER ES AUCH</small>, <small>WENN ER SICH NICHT BEWUSST WIRD</small>. <sup>iii,1</sup>R. A͑<small>QIBA SPRACH</small>: S<small>EINE</small> W<small>ORTE SIND EINLEUCHTEND BEI EINER GERINGFÜGIGEN</small> V<small>ERUNTREUUNG</small>, <small>IST ES ABER EINE ZWEIFELHAFTE</small> V<small>ERUNTREUUNG VON HUNDERT MINEN</small>, <small>SO IST ES FÜR IHN VORTEILHAFTER</small>, <small>EIN</small> S<small>CHULDOPFER FÜR ZWEI</small> S<small>ELA͑ ZU BRINGEN</small>, <small>ALS EINEN ZWEIFELHAFTEN</small> V<small>ERUNTREUUNGSERSATZ FÜR HUNDERT</small> M<small>INEN</small>. R. A͑<small>QIBA PFLICHTET ALSO</small> R. T<small>RYPHON BEI EINER GERINGFÜGIGEN</small> V<small>ERUNTREUUNG BEI</small>."
Keritot 22a:7,
Keritot 22b:1,"GEMARA. Die Rabbanan lehrten:$fn78<i>Wenn eine Person</i>, daß man wegen der zweifelhaften Veruntreuung zu einem Schwebe-Schuldopfer verpflichtet ist – so R. A͑qiba; die Weisen befreien davon. Es wäre anzunehmen, daß ihr Streit in folgendem besteht: R. A͑qiba ist der Ansicht, man folgere hinsichtlich des vorangehenden vom folgenden$fn79, und die Rabbanan sind der Ansicht, man folgere nicht hinsichtlich des vorangehenden vom folgenden. R. Papa entgegnete: Alle sind der Ansicht, man folgere hinsichtlich des vorangebenden vom folgenden, denn sonst hätte man [keinen Beleg] dafür, daß ein Rind auf der Nordseite [zu schlachten$fn80sei]. hierbei aber befreien ihn die Rabbanan aus dem Grunde, weil sie es durch [das Wort] <i>Gebote</i>$fn81vom Sündopfer folgern: wie es da eine Handlung ist, wegen der man sich bei Vorsatz der Ausrottung, bei Versehen eines Sündopfers und bei einem Zweifel eines Schwebe-Schuldopfers schuldig macht, ebenso jede andere Handlung, wegen der man sich bei Vorsatz der Ausrottung, bei einem Zweifel eines Sündopfers und bei Versehen eines Schwebe-Schuldopfers schuldig macht, ausgenommen die Veruntreuung, wegen der man sich bei Vorsatz nicht der Ausrottung schuldig macht. Es wird nämlich gelehrt: Hat man die Veruntreuung vorsätzlich begangen, so ist dies, wie Rabbi sagt, mit dem Tode, und wie die Weisen sagen, mit einem Verbote belegt. – Und R. A͑qiba!? – Er ist der Ansicht, die Folgerung durch [das Wort] <i>Gebote</i> vom Sündopfer wegen Talg[genusses]$fn82 ist hierfür zu verwenden: wie es da ein festgesetztes [Opfer] ist, ebenso hierbei ein festgesetztes, ausgenommen das auf- und absteigende$fn83[Opfer], bei dem dies$fn84nicht gilt. – Und die Rabbanan!? – Es gibt keine Wortanalogie zur Hälfte$fn85. – Demnach ist R. A͑qiba der Ansicht, es gebe eine Wortanalogie zur Hälfte!? – Vielmehr, alle sind der Ansicht, es gebe keine Wortanalogie zur Hälfte, und folgendes ist der Grund R. A͑qibas; die Schrift sagt: <i>und wenn eine Person</i>, das <i>und</i> ist eine Hinzufügung zum vorangehenden, und man folgere hinsichtlich des vorangehenden vom folgenden$fn79. – Und die Rabbanan!? – Sie sind der Ansicht, dadurch folgere man hinsichtlich des folgenden vom vorangehenden, daß das Schuldopfer für einen Betrag von Šeqalim$fn86darzubringen ist. – Und R. A͑qiba!? – Er ist der Ansicht, es gebe keine Vergleichung zur Hälfte$fn87. – Demnach sind die Rabbanan der Ansicht, es gebe auch eine Vergleichung zur Hälfte, während uns doch bekannt ist, daß es keine Vergleichung zur Hälfte gibt!? – Alle sind der Ansicht, es gebe keine Vergleichung zur Hälfte, und hierbei ist folgendes der Grund der Rabbanan: die Schlußfolgerung durch [das Wort] <i>Gebote</i> hebt die Vergleichung$fn88auf. – Woher entnimmt R. A͑qiba, daß das Schuldopfer für einen Betrag vom Šeqalim darzubringen ist? – Er entnimmt dies aus [den Worten]:$fn89<i>dies ist das Gesetz vom Schuldopfer</i>, ein Gesetz für alle Schuldopfer; das Schuldopfer ist für einen Betrag von Šeqalim darzubringen. – Und die Rabbanan!? – Obgleich geschrieben steht: <i>dies ist das Gesetz vom Schuldopfer</i>, muß es auch heißen: <i>und wenn eine Person</i>, das <i>und</i> zum vorangehenden hinzufügend, um hinsichtlich des folgenden vom vorangehenden zu folgern. Hieße es nur: <i>dies ist das Gesetz vom Schuldopfer</i>, so könnte man glauben, die Bestimmung, ein Gesetz für alle Schuldopfer, gelte nur für zweifellose Schuldopfer, beim Schwebe-Schuldopfer aber, das wegen des zweifelhaften Talgessens darzubringen ist, sei es bei einem, Zweifel nicht strenger als bei einem zweifellosen [Vergehen], und wie bei einem zweifellosen ein Sündopfer für ein Danqa ausreicht, ebenso auch bei einem Zweifel ein Schuldopfer für ein Danqa, daher schrieb der Allbarmherzige: <i>und wenn eine Person</i>, das <i>und</i> zum vorangehenden hinzufügend. – Allerdings nach demjenigen, der [die Worte:] <i>dies ist das Gesetz vom Schuldopfer</i>, auslegt, wie ist es aber nach demjenigen zu erklären, der [die Worte:] <i>dies ist das Gesetz vom Schuldopfer</i>, nicht ausgelt!? – Er folgert dies durch [das Wort] <i>Schätzungswert</i>$fn90vom Schuldopfer wegen Veruntreuung. – Beim Schuldopfer wegen der vergebenen Sklavin$fn91heißt es ja nicht <i>Schätzungswert</i>!? – Man folgere es durch das [Wort] <i>Widder</i>$fn92."
Keritot 22b:2,"(R. A͑<small>QIBA PFLICHTET ALSO BEI</small> &amp;<small>C</small>.) I<small>ST ABER</small> &amp;<small>C</small>. <small>ZWEIFELHAFT</small>. Wie ist dies zu verstehen$fn93!? Raba erwiderte: Lies: und bleibt der Zweifel für immer bestehen, so sei es ein Schwebe-Schuldopfer."
Keritot 22b:3,"V<small>ON DERSELBEN</small> A<small>RT NÄMLICH</small>, <small>VON DER ER</small> [<small>DAS</small> O<small>PFER</small>] <small>BRINGT</small>, <small>WENN ER SICH</small> [<small>DER</small> S<small>ÜNDE</small>] <small>BEWUSST WIRD</small>, <small>BRINGT ER ES AUCH</small>, <small>WENN ER SICH NICHT BEWUSST WIRD</small>. Endlich muß er ja, wenn er sich bewußt wird, ein zweifelloses Schuldopfer$fn94bringen!? Raba erwiderte: Aus den Worten beider lernen wir, daß beim zweifellosen Schuldopfer vorher kein Bewußtwerden erforderlich ist$fn95."
Keritot 22b:4,"<sup>iii,2</sup><b>W</b><small>ENN EINE</small> F<small>RAU</small>$fn96<small>DAS</small> V<small>OGEL</small>-S<small>ÜNDOPFER GEBRACHT</small>$fn97<small>HAT</small>, <small>SO RICHTE SIE ES</small>, <small>WENN SIE VOR DEM</small> K<small>OPFABKNEIFEN</small>$fn98<small>SICH BEWUSST WIRD</small>, <small>DASS SIE SICHER GEBOREN HAT</small>, <small>ALS ZWEIFELLOSES</small> O<small>PFER HER</small>, <small>DENN VON DERSELBEN</small> A<small>RT</small>, <small>VON DER SIE ES BRINGT</small>, <small>WENN SIE SICH BEWUSST WIRD</small>, <small>BRINGT SIE ES AUCH</small>, <small>WENN SIE SICH NICHT BEWUSST WIRD</small>. <sup>iv</sup>W<small>ER VON EINEM</small> S<small>TÜCKE</small> P<small>ROFANES UND EINEM</small> S<small>TÜCKE</small> H<small>EILIGES EINES VON IHNEN GEGESSEN HAT UND NICHT WEISS</small>, <small>WELCHES VON IHNEN ER GEGESSEN HAT</small>, <small>IST FREI</small>, <small>UND NACH</small> R. A͑<small>QIBA ZU EINEM</small> S<small>CHWEBE</small>-S<small>CHULDOPFER VERPFLICHTET</small>; <small>HAT ER AUCH DAS ANDERE GEGESSEN</small>, <small>SO BRINGE ER EIN ZWEIFELLOSES</small> S<small>CHULDOPFER</small>. W<small>ENN EINER DAS EINE GEGESSEN HAT UND DARAUF EIN ANDERER GEKOMMEN IST UND DAS ANDERE GEGESSEN HAT</small>, <small>SO BRINGE DIESER</small>$fn99<small>EIN</small> S<small>CHWEBE</small>-S<small>CHULDOPFER UND JENER EIN</small> S<small>CHWEBE</small>-S<small>CHULDOPFER</small> – <small>SO</small> R. A͑<small>QIBA</small>. R. Š<small>IMO͑N SAGT</small>, <small>BEIDE</small> [<small>ZUSAMMEN</small>] <small>BRINGEN EIN</small> S<small>CHULDOPFER</small>. R. J<small>OSE SAGT</small>, <small>ZWEI KÖNNEN NICHT</small> [<small>ZUSAMMEN</small>] <small>EIN</small> S<small>CHULDOPFER BRINGEN</small>. W<small>ER VON</small>"
Keritot 23a:1,"<small>EINEM</small> S<small>TÜCKE</small> T<small>ALG UND EINEM</small> S<small>TÜCKE</small> P<small>ROFANES EINES VON IHNEN GEGESSEN HAT UND NICHT WEISS</small>, <small>WELCHES VON IHNEN ER GEGESSEN HAT</small>, <sup>v</sup><small>BRINGE EIN</small> S<small>CHWEBE</small>-S<small>CHULDOPFER</small>; <small>HAT ER AUCH DAS ANDERE GEGESSEN</small>, <small>SO BRINGE ER EIN</small> S<small>ÜNDOPFER</small>. W<small>ENN EINER DAS EINE GEGESSEN HAT UND DARAUF EIN ANDERER GEKOMMEN IST UND DAS ANDERE GEGESSEN HAT</small>, <small>SO BRINGE DIESER EIN</small> S<small>CHWEBE</small>-S<small>CHULDOPFER UND JENER EIN</small> S<small>CHWEBE</small>-S<small>CHULDOPFER</small> – <small>SO</small> R. A<small>QIBA</small>. R. Š<small>IMO͑N SAGT</small>, <small>BEIDE</small> [<small>ZUSAMMEN</small>] <small>BRINGEN EIN</small> S<small>ÜNDOPFER</small>. R. J<small>OSE SAGT</small>, <small>ZWEI KÖNNEN NICHT</small> [<small>ZUSAMMEN</small>] <small>EIN</small> S<small>ÜNDOPFER BRINGEN</small>. <sup>vi</sup>W<small>ER VON EINEM</small> S<small>TÜCKE</small> T<small>ALG UND EINEM</small> S<small>TÜCKE HEILIGES EINES VON IHNEN GEGESSEN HAT UND NICHT WEISS</small>, <small>WELCHES VON IHNEN ER GEGESSEN HAT</small>, <small>BRINGE EIN</small> S<small>CHWEBE</small>-S<small>CHULDOPFER</small>; <small>HAT ER AUCH DAS ANDERE GEGESSEN</small>, <small>SO BRINGE ER EIN</small> S<small>ÜNDOPFER UND EIN ZWEIFELLOSES</small> S<small>CHULDOPFER</small>. W<small>ENN EINER DAS EINE GEGESSEN UND DARAUF EIN ANDERER GEKOMMEN IST UND DAS ANDERE GEGESSEN HAT</small>, <small>SO BRINGE DIESER EIN</small> S<small>CHWEBE</small>-S<small>CHULDOPFER UND JENER EIN</small> S<small>CHWEBE</small>-S<small>CHULDOPFER</small>. R. Š<small>IMO͑N SAGT</small>, <small>BEIDE</small> [<small>ZUSAMMEN</small>] <small>BRINGEN EIN</small> S<small>ÜNDOPFER UND EIN</small> S<small>CHULDOPFER</small>. R. J<small>OSE SAGT</small>, <small>ZWEI KÖNNEN NICHT</small> [<small>ZUSAMMEN</small>] <small>EIN</small> S<small>ÜNDOPFER UND EIN</small> S<small>CHULDOPFER BRINGEN</small>. <sup>vii</sup>W<small>ER VON EINEM</small> [<small>PROFANEN</small>] S<small>TÜCKE</small> T<small>ALG UND EINEM HEILIGEN</small> S<small>TÜCKE</small> T<small>ALG EINES VON IHNEN GEGESSEN HAT UND NICHT WEISS</small>, <small>WELCHES VON IHNEN ER GEGESSEN HAT</small>, <small>BRINGE EIN</small> S<small>ÜNDOPFER</small>; R. A<small>QIBA SAGT</small>, <small>AUCH EIN</small> S<small>CHWEBE</small>-S<small>CHULDOPFER</small>; <small>HAT ER AUCH DAS ANDERE GEGESSEN</small>, <small>SO BRINGE ER ZWEI</small> S<small>ÜNDOPFER UND EIN ZWEIFELLOSES SCHULDOPFER</small>. W<small>ENN EINER DAS EINE GEGESSEN HAT UND DARAUF EIN ANDERER GEKOMMEN IST UND DAS ANDERE GEGESSEN HAT</small>, <small>SO BRINGE DIESER EIN</small> S<small>ÜNDOPFER UND JENER EIN</small> S<small>ÜNDOPFER</small>. R. A͑<small>QIBA SAGT</small>, <small>DIESER</small> [<small>BRINGE EIN</small> S<small>CHWEBE</small>-S<small>CHULDOPFER</small>] <small>UND JENER BRINGE EIN</small> S<small>CHWEBE</small>-S<small>CHULDOPFER</small>. R. Š<small>IMO͑N SAGT</small>, <small>DIESER BRINGE EIN</small> S<small>ÜNDOPFER UND JENER BRINGE EIN</small> S<small>ÜNDOPFER</small>, <small>UND BEIDE</small> [<small>ZUSAMMEN</small>] <small>BRINGEN EIN</small> S<small>CHULDOPFER</small>. R. J<small>OSE SAGT</small>, <small>ZWEI KÖNNEN NICHT</small> [<small>ZUSAMMEN</small>] <small>EIN</small> S<small>CHULDOPFER BRINGEN</small>. <sup>viii</sup>W<small>ER VON EINEM</small> [<small>PROFANEN</small>] S<small>TÜCKE</small> T<small>ALG UND EINEM</small> S<small>TÜCKE</small> T<small>ALG VON</small> Ü<small>BRIGGEBLIEBENEM EINES VON IHNEN GEGESSEN HAT UND NICHT WEISS</small>, <small>WELCHES VON IHNEN ER GEGESSEN HAT</small>, <small>BRINGE EIN</small> S<small>ÜNDOPFER UND EIN</small> S<small>CHWEBE</small>-S<small>CHULDOPFER</small>; <small>HAT ER AUCH DAS ANDERE GEGESSEN</small>, <small>SO BRINGE ER DREI</small> S<small>ÜNDOPFER</small>. W<small>ENN EINER DAS EINE GEGESSEN HAT UND DARAUF EIN ANDERER GEKOMMEN IST UND DAS ANDERE GEGESSEN HAT</small>, <small>SO BRINGE DIESER EIN</small> S<small>ÜNDOPFER UND EIN</small> S<small>CHWEBE</small>-S<small>CHULDOPFER UND JENER EIN</small> S<small>ÜNDOPFER UND EIN</small> S<small>CHWEBE</small>-S<small>CHULDOPFER</small>. R. Š<small>IMO͑N SAGT</small>, <small>DIESER BRINGE EIN</small> S<small>ÜNDOPFER UND JENER BRINGE EIN</small> S<small>ÜNDOPFER</small>, <small>UND BEIDE BRINGEN</small> [<small>ZUSAMMEN</small>] <small>EIN</small> S<small>ÜNDOPFER</small>. R. J<small>OSE SAGT</small>, <small>ZWEI KÖNNEN NICHT</small> [<small>ZUSAMMEN</small>] <small>EIN</small> S<small>ÜNDOPFER BRINGEN</small>, <small>DAS WEGEN EINER</small> S<small>ÜNDE</small>$fn100<small>DARZUBRINGEN IST</small>."
Keritot 23a:2,"GEMARA. Raba sprach zu R. Naḥman: Nach R. Jose können somit zwei [zusammen] nur ein Sündopfer nicht bringen, wohl aber können zwei [zusammen] ein Schwebe-Schuldopfer bringen, und dies lehrt ja auch der erste Autor!? – Wolltest du sagen, ein Unterschied bestehe zwischen ihnen bei einem Stücke von zwei$fn101Stücken, so wird ja gelehrt: R. Jose sagt, dieser bringe ein Schwebe-Schuldopfer und jener bringe ein Schwebe-Schuldopfer!? Dieser erwiderte: Er lehrt uns folgendes: der erste Autor ist R. Jose."
Keritot 23a:3,"V<small>ON EINEM</small> S<small>TÜCKE</small> T<small>ALG UND EINEM</small> S<small>TÜCKE HEILIGES</small> &amp;<small>C</small>., <small>EINEM</small> [<small>PROFANEN</small>] S<small>TÜCKE</small> T<small>ALG UND EINEM HEILIGEN</small> S<small>TÜCKE</small> T<small>ALG</small> &amp;<small>C</small>., <small>EINEM</small> S<small>TÜCKE</small> T<small>ALG UND EINEM</small> S<small>TÜCKE</small> T<small>ALG VON</small> Ü<small>BRIGGEBLIEBENEM</small> &amp;<small>C</small>. Raba sprach zu R. Naḥman: Er sollte doch auch ein zweifelloses Schuidopfer bringen, denn es ist ja Übriggebliebenes von Heiligem!? Dieser erwiderte: Es war keine Peruṭa wert$fn102. – Aber vorher spricht er ja von dem Falle, wenn es eine Peruṭa wert war, denn er lehrt von einem zweifellosen Schuldopfer!? Dieser erwiderte: Das Stück, das nicht Übriggebliebenes war, war eine Peruṭa wert. – Er lehrt ja aber$fn103den Fall, daß jemand wegen eines Essens vier Sündopfer und ein Schuldopfer schuldig ist, wobei auch Übriggebliebenes mit aufgezählt wird!? Dieser erwiderte: Jenes gilt von einem großen [Stücke], dieses aber von einem kleinen. Oder auch, (dies ist kein Einwand:) jenes in der Regenzeit, dieses aber im Sommer$fn104."
