Index Title,Keritot
Version Title,"""Talmud Bavli. German. Lazarus Goldschmidt. 1929 -- footnotes"""
Language,he
Version Source,https://www.nli.org.il/he/books/NNL_ALEPH001042448/NLI
Version Notes,
Keritot 2a:1,"<sup>i</sup> <b>S</b>ECHSUNDDREISSIG <small>MIT DER</small> A<small>USROTTUNG</small>$fn1 [<small>BELEGTE</small> V<small>ERGEHEN</small>] <small>GIBT ES IN DER</small> T<small>ORA</small>$fn2. W<small>ER SEINER</small> M<small>UTTER, DER</small> F<small>RAU SEINES</small> V<small>ATERS ODER SEINER</small> S<small>CHWIEGERTOCHTER BEIWOHNT, WER EINEN</small> M<small>ANN ODER EIN</small> V<small>IEH BESCHLÄFT, ODER WENN EIN</small> W<small>EIB SICH VON EINEM</small> V<small>IEH BESCHLAFEN LÄSST, WER EINER</small> F<small>RAU UND IHRER</small> T<small>OCHTER</small>$fn3, <small>EINER</small> E<small>HEFRAU, SEINER</small> S<small>CHWESTER, DER</small> S<small>CHWESTER SEINES</small> V<small>ATERS, DER</small> S<small>CHWESTER SEINER</small> M<small>UTTER, DER</small> S<small>CHWESTER SEINER</small> F<small>RAU, DER</small> F<small>RAU SEINES</small> B<small>RUDERS, DER</small> F<small>RAU DES</small> B<small>RUDERS SEINES</small> V<small>ATERS, DER</small> F<small>RAU DES</small> B<small>RUDERS SEINER</small> M<small>UTTER ODER EINER</small> M<small>ENSTRUIERENDEN BEIWOHNT, WER</small> G<small>OTT LÄSTERT</small>, G<small>ÖTZEN DIENT, VON SEINEM</small> S<small>AMEN DEM</small> M<small>OLEKH</small>$fn4 <small>HINGIBT</small>, T<small>OTE BESCHWÖRT, DEN</small> Š<small>ABBATH ENTWEIHT, UNREIN</small> G<small>EHEILIGTES ISST ODER UNREIN DAS</small> H<small>EILIGTUM BETRITT, WER</small> T<small>ALG</small>, B<small>LUT</small>, Ü<small>BRIGGEBLIEBENES ODER</small> V<small>ERWERFLICHES ISST, WER AUSSERHALB</small>$fn5 <small>SCHLACHTET UND DARBRINGT, WER</small> G<small>ESÄUERTES AM</small> P<small>ESAḤFESTE ISST, WER AM</small> V<small>ERSÖHNUNGSTAGE ISST ODER EINE</small> A<small>RBEIT VERRICHTET, WER DAS</small> S<small>ALBÖL</small>$fn6 <small>MENGT</small>$fn7, <small>DAS</small> R<small>ÄUCHERWERK</small>$fn6 <small>MENGT, ODER SICH MIT DEM</small> S<small>ALBÖL SCHMIERT, WER DAS</small> G<small>EBOT DES</small> P<small>ESAḤOPFERS UND DER</small> B<small>ESCHNEIDUNG</small> [<small>ÜBERTRITT</small>]. W<small>EGEN DIESER MACHT MAN SICH BEI</small> V<small>ORSÄTZLICHKEIT DER</small> A<small>USROTTUNG SCHULDIG, BEI</small> U<small>NVORSÄTZLICHKEIT IST EIN</small> S<small>ÜNDOPFER DARZUBRINGEN, UND IST MAN SICH DESSEN NICHT SICHER BEWUSST, EIN</small> S<small>CHWEBE-</small>S<small>CHULDOPFER, AUSGENOMMEN IST DIE</small> V<small>ERUNREINIGUNG DES</small> H<small>EILIGTUMES UND DES</small> G<small>EHEILIGTEN, WEGEN WELCHER EIN AUFUND ABSTEIGENDES</small>$fn8 O<small>PFER DARZUBRINGEN IST</small> – <small>SO</small> R. M<small>EÍR; DIE</small> W<small>EISEN SAGEN, AUCH DER</small> G<small>OTTESLÄSTERER, DENN ES HEISST</small> $fn9<i>ein Gesetz Sei euch für den, der aus Versehen etwas tut</i>, <small>AUSGENOMMEN DER</small> G<small>OTTESLÄSTERER, DER KEINE</small> T<small>ÄTIGKEIT AUSÜBT</small>."
Keritot 2a:2,"GEMARA. Wozu ist die Zahl$fn10nötig? R. Joḥanan erwiderte: Daß man,"
Keritot 2b:1,"wenn man sie alle bei einem Entfallen begangen hat, wegen jedes besonders schuldig ist. – Ferner haben wir gelernt: Die Hauptarbeiten$fn11 sind vierzig weniger eine. Wozu ist die Zahl nötig? – Daß man, wenn man sie alle bei einem Entfallen verrichtet hat, wegen jeder besonders schuldig ist. – Ferner haben wir gelernt: Vier sind es, denen die Sühne$fn12 noch fehlt. Wozu ist die Zahl nötig? – Dies schließt die Ansicht des R. Elie͑zer b. Ja͑qob aus, welcher sagt, es seien fünf. Es wird nämlich gelehrt: R. Elie͑zer b. Ja͑qob sagt, ein Proselyt, dem die Sühne noch fehlt, erst$fn13 wenn für ihn das Blut$fn14gesprengl worden ist. Deshalb lehrt er vier. – Ferner haben wir gelernt: Vier bringen [ein Opfer] dar bei Vorsätzlichkeit wie bei Unvorsätzlichkeit. Wozu ist die Zahl nötig? – Dies schließt die Ansicht R. Šimo͑ns aus, denn es wird gelehrt: R. Šimo͑n sagt, beim Schwure wegen eines Depositums gebe es bei Vorsatz keine Sühne. Daher lehrt er vier. – Ferner haben wir gelernt: Fünf bringen ein Opfer wegen mehrerer Sünden dar. Wozu ist die Zahl nötig? – Weil er weiter lehren will: wenn ein Naziräer sich wiederholt verunreinigt hat. Dies kommt in dem Falle vor, wenn er sich am siebenten [Tage] verunreinigt und sich abermals am siebenten verunreinigt hat, und zwar nach R. Jose b. R. Jehuda, welcher sagt, das Nazirat der Reinheit beginne schon am siebenten$fn15, denn in welchem Falle kann dies vorkommen nach Rabbi, nach dem das Nazirat der Reinheit erst am achten beginnt: hat er sich am siebenten verunreinigt und sich abermals am siebenten verunreinigt, so ist es ja zusammen nur eine lange Verunreinigung, und hat er sich am achten verunreinigt und sich abermals am achten verunreinigt, so müßte er ja, da die Zeit, in der das Opfer darzubringen$fn16war, vorüber ist, wegen jeder [Verunreinigung] besonders schuldig sein. Vielmehr ist hieraus zu entnehmen, daß hier die Ansicht des R. Jose b. R. Jehuda vertreten ist.– Was ist dies für ein Streit zwischen Rabbi und R. Jose b. R. Jehuda? – Es wird gelehrt:$fn17<i>Und er heilige sein Haupt an diesem Tage</i>, am Tage der Darbringung seines Opfers – so Rabbi. R. Jose b. R. Jehuda sagt, am Tage seiner Haarschur. – Ferner haben wir gelernt: Fünf haben ein aufund absteigendes Opfer darzubringen. Wozu ist die Zahl nötig!? – Da er im Schlußsatze lehren will: gleich ihnen auch der Fürst, daher lehrt er fünf. Dies schließt die Ansicht R. Elie͑zers aus, welcher sagt, der Fürst bringe einen Ziegenbock dar. – Ferner haben wir gelernt: Es gibt vier Hauplarten$fn18von Schädigungen. Wozu ist die Zahl nötig? – Dies schließt [die Lehre] R. Oša͑jas aus, welcher sagt, es gebe dreizehn Hauptarten von Schädigungen. – Wozu ist die Zahl nötig [in der Lehre] R. Oša͑jas? – Dies schließt [die Lehre] R. Ḥijas aus, welcher sagt, es gebe vierundzwanzig Hauptarten von Schädigungen. – Wozu ist die Zahl nötig [in die Lehre] R. Ḥijas? – Dies schließt die Denuntiation$fn19und die Verwerflichmachung$fn20aus."
Keritot 2b:2,"Der Meister sagte: Daß man, wenn man sie alle bei einem Entfallen begangen hat, wegen jeder besonders schuldig ist. Allerdings kannst du nicht sagen, man sei gänzlich frei, denn es heißt:$fn21<i>denn wer etwas von diesen Gräueln tut, soll ausgerottet werden</i>, aber vielleicht ist man, wenn man eines begangen hat, einmal schuldig, und wenn man bei einem Entfallen alle begangen hat, ebenfalls nur einmal schuldig!? R. Joḥanan erwiderte: Deshalb ist die Ausrottung wegen [der Beiwohnung] seiner Schwesler$fn22zur Teilung hervorgehoben worden. R. Bebaj b. Abaj je wandte ein: Vielleicht ist man wegen seiner Schwester, die die Schrift besonders hervorgehoben hat, besonders schuldig, und wegen aller anderen zusammen, da es bei einem Entfallen erfolgt ist, nur einmal schuldig!? – Hält denn R. Bebaj b. Abajje nichts von der folgenden Lehre!? Wenn etwas in der Gesamtheit einbegriffen war, und um etwas zu lehren aus der Gesamtheit herausgegriffen wurde, so bezieht sich die Lehre nicht nur auf dieses allein, sondern auf die ganze Gesamtheit. Zum Beispiel:$fn23<i>Die Person, die Fleisch &amp;c. ißt</i>; das Heilsopfer war ja in der Gesamtheit der Opfer$fn24einbegriffen, weshalb ist es herausgegriffen worden? Um [alles] mit diesem zu vergleichen: wie das Heilsopfer Heiliges für den Altar ist, und man ist dessentwegen schuldig, ebenso ist man wegen jedes anderen für den Altar Geheiligten schuldig, ausgenommen ist das für den Tempelreparaturfonds Geheiligte. – R. Bebaj kann dir erwidern: Eben hieraus. Du sagst ja da, ausgenommen sei das für den Tempelreparaturfonds Geheiligte, ebenso auch hierbei: wie eine Schwester sich dadurch auszeichnet, daß sie inzestuös ist und es für sie bei Lebzeiten des sie verboten machenden kein Erlaubtwerden$fn25gibt, ebenso alles andere, wofür es bei Lebzeiten des verboten machenden kein Erlaubtwerden gibt, ausgenommen die Ehefrau, bei der es bei Lebzeiten des sie verboten machenden ein Erlaubtwerderr$fn26gibt. R. Jona, manche sagen, R. Ḥona, Sohn des R. Jehošua͑, erwiderte: Die Schrift sagt: <i>denn jeder, der etwas von diesen Gräueln tut &amp;c</i>.; alle Inzestuösen werden mit der Schwester verglichen: wie man wegen einer Schwester besonders schuldig ist, ebenso ist man wegen aller anderen besonders schuldig. – R. Jiçḥaq sagte ja aber, alle Fälle der Ausrottung$fn27waren in der Allgemeinheit einbegriffen, und die Ausrottung wegen einer Schwester wurde deshalb herausgegriffen, daß dies mit der Ausrottung und nicht mit der Geißelung bestraft werde; woher entnimmt er nun die Teilung!? – Er entnimmt dies aus [den Worten]:$fn28<i>du sollst einem Weibe während ihrer Sonderungsunreinheit nicht nahen</i>; dies$fn29ist teilend, wegen jedes Weibes besonders. – Sollten es auch die Rabbanan entnehmen aus [den Worten]: <i>einem Weibe während ihrer Sonderungsunreinheit</i>!<i>?</i> Dem ist auch so. – Worauf deutet nun die Herausgreifung der Ausrottung wegen seiner Schwester!? – Dies ist zur Teilung erforderlich; wegen seiner Schwester, wegen der Schwester seines Vaters und wegen der Schwester seiner Mutter$fn30. – Wozu sind diese zur Teilung erforderlich, es sind ja verschiedene Namen$fn31und verschiedene Körper$fn32!? – Sage vielmehr: zur Teilung, wegen seiner Schwester, die die Schwester seines Vaters und die Schwester seiner Mutter$fn33ist. – Woher entnimmt dies R. Jiçḥaq!? – Er entnimmt dies aus [dem Worte] <i>Schwester</i> im Schlusse der Schriftstelle, denn es heißt: $fn34<i>die Scham seiner Schwester hat er entblößt</i>. – Wofür verwenden die Rabbanan [das Wort] <i>Schwester</i> im Schlusse der Schriftstelle!? – Dieses"
Keritot 3a:1,"ist nötig wegen einer Schwester, die die Tochter seines Vaters und die Tochter seiner Mutter ist, und dies besagt, daß man nicht eine Bestrafung durch einen Schluß$fn35folgere. – Und R. Jiçḥaq!? – Er ist der Ansicht, man folgere eine Bestrafung durch einen Schluß. Wenn du aber willst, sage ich: er folgert die Bestrafung vom Verbote$fn36."
Keritot 3a:2,"R. Elea͑zar sagte im Namen R. Hoša͑jas: Wenn du irgendwo zwei Verbote und eine Ausrottung findest, so sind sie hinsichtlich des Sündopfers zu teilen$fn37. – Was ist dies? – Wenn jemand das Salböl mengt und sich damit salbt. Es heißt:$fn38<i>auf keines Menschen Leib darf es gegossen werden und in seinem Verhältnisse</i>$fn39<i>&amp;c</i>. Die Ausrottung einmal, denn es heißt:$fn40<i>wer dergleichen mischt, wer davon auf einen Gemeinen tut, werde ausgerottet aus seinen Stammesgenossen</i>. – Wozu braucht, wenn die Verbote zu teilen sind, der Allbarmherzige die Ausrottung wegen seiner Schwester$fn41zu schreiben!? – Nach den Rabbanan ist dies nötig, um zu lehren, daß man nicht eine Bestrafung durch einen Schluß folgere, und nach R. Jiçḥaq ist daraus zu entnehmen, daß man schuldig sei wegen einer Schwester, die die Schwester seines Vaters und die Schwester seiner Mutter ist$fn35. – Und die Rabbanan!? – Sie entnehmen es aus [dem Worte] <i>Schwester</i> im ersteren [Schriftverse]. – Und R. Jiçḥaq!? – Er ist der Ansicht, im vorangehenden gehört [das Wort] <i>Schwester</i> zur Konstruktion des Schriftverses, und die Teilung entnimmt er aus [dem Worte] <i>Schwester</i> im letzteren Schriftverse, daß [die Verbote] zu teilen sind in dem Falle, wenn es eine Schwester ist, die die Schwester seines Vaters und die Schwester seiner Mutter ist. R. Naḥman b. Jiçḥaq sagte: Auch wir haben demgemäß gelernt: Wer das Öl mengt, wer das Räucherwerk mengt, und wer sich mit dem Salböl salbt. Wozu lehrt er in der Mitte vom Mengen des Räucherwerkes? Wahrscheinlich lehrt er uns folgendes: wie [das Mengen] des Räucherwerkes ein gesondertes Verbot ist und man dieserhalb der Ausrottung besonders schuldig ist, ebenso ist man wegen des Mengens des Öls und des Salbens, da sie gesonderte Verbote sind, auch besonders schuldig. Wolltest du sagen, weil er von den Mengungen nebeneinander lehren will, so sollte er doch umgekehrt lehren: wer das Räucherwerk mengt, wer das Salböl mengt und wer sich mit dem Salböl schmiert. Wenn er aber [die Fälle] vom Öl teilt, so lehrt er uns damit, daß sie hinsichtlich der Sündopfer zu teilen sind. Schließe hieraus."
Keritot 3a:3,"W<small>EU EINEN</small> M<small>ANN BESCHLÄFT</small>. Von wem$fn42spricht der Autor: wenn von Männern, so ist ja die bestiale Beschlafung eines Weibes abzuziehen, und es ist eines weniger, und spricht er von Weibern, so sind ja die Beschlafung eines Mannes und eines Tieres abzuziehen, und es sind zwei weniger!? R. Joḥanan erwiderte: Tatsächlich spricht der Autor von Männern, nur lese man wie folgt: wer einen Mann beschläft und sich von einem Manne beschlafcn läßt. Dies nach R. Jišma͑él, welcher sagt, man sei dieserhalb zweimal schuldig. – Wenn er aber im Schlußsätze vom Gotteslästerer lehrt, und wir es$fn43R. A͑qiba addizieren, so ist ja auch der Anfangsatz nach R. A͑qiba!? Wolltest du erwidern, nach R. A͑qiba, nur sei er im [Falle des] Anfangsatzes der Ansicht R. Jišma͑éls, so sagte ja R. Abahu: Wer einen Mann beschläft und sich von einem Manne beschlafen läßt, ist nach R. Jišma͑él zweimal schuldig, denn er entnimmt dies aus zwei Schriftversen:$fn44<i>mit einem Manne sollst du nicht liegen</i>, und: $fn45<i>es soll kein Lustbube von den Söhnen Jisraéls sein</i>, und nach R. A͑qiba nur einmal schuldig, denn er entnimmt dies aus einem Schriftverse: <i>mit einem Manne sollst du nicht liegen</i>, und man lese: nicht belegen$fn46 lassen!? – Vielmehr, der Anfangsatz nach R. Jišma͑él, nur ist er hinsichtlich des Gotteslästerers der Ansicht R. A͑qibas. Demnach sollte er auch lehren: wer ein Vieh beschläft und sich von einem Vieh beschlafen läßt!? – Abajje sagte ja: Wer ein Vieh beschläft und sich von einem Vieh beschlafen läßt, ist auch nach R. Jišma͑él nur einmal schuldig, denn die Schrift spricht nur von Männern. R. Elie͑zer erklärte im Namen Rabhs: Der Autor$fn47lehrt von dreiunddreißig Sündopfern$fn48, und zur Ergänzung der Ausrottungssünden nennt er noch drei$fn49Ausrottungsfälle. Im Schlußsatze lehrt er nämlich: wer das Gebot des Pesaḥopfers und der Beschneidung übertritt. Wozu lehrt er es vom Pesaḥopfer und von der Beschneidung: wenn etwa, daß dieserhalb ein Opfer darzubringen sei, so ist ja keines darzubringen, denn es wird gelehrt, die ganze Tora werde mit dem Gesetze vom Götzendienste verglichen, denn es heißt:$fn50<i>ein Gesetz gelte euch für den, der versehentlich tut, die Person aber die mit erhobener Hand tut</i>, wie der Götzendienst eine zu unterlassende Handlung ist, ebenso$fn51 wegen aller anderen zu unterlassenden Handlungen. Hieraus ist also zu entnehmen, daß er von dreiunddreißig Sündopfern$fn48spricht, (wenn versehentlich begangen,) und zur Ergänzung der Ausrottungssünden noch drei Ausrottungsfälle nennt. Schließe hieraus."
Keritot 3a:4,"W<small>EH DEN</small> Š<small>ABBATH ENTWEIHT</small>. Ich will dir sagen, beim Šabbath sind es ja vierzig [Arbeiten]$fn52weniger eine!? R. Joḥanan erwiderte: Er lehrt vom Falle der Unvorsätzlichkeit hinsichtlich des Šabbaths und der Vorsätzlichkeit hinsichtlich der Arbeiten, dessentwegen man nur einmal schuldig$fn53 ist. Es wird nämlich gelehrt:$fn54<i>[Von] diesen</i>, eines$fn55, nämlich bei Unvorsätzlichkeit hinsichtlich des Šabbaths und Vorsätzlichkeit hinsichtlich der Arbeiten. – Sollte er doch vom Falle der Vorsätzlichkeit hinsichtlich des Šabbaths und der Unvorsätzlichkeit hinsichtlich der Arbeiter$fn56lehren, dessentwegen man vierzig weniger eines$fn57schuldig ist!? Es wird nämlich gelehrt:$fn54<i>Und er eines</i>$fn55<i>von diesen tut</i>; zuweilen ist man ein [Opfer] wegen aller [Arbeiten] schuldig, und zuweilen ist man wegen jeder besonders schuldig. Und es wird gelehrt: <i>Eines, von diesen</i>$fn58, nämlich bei Vorsätzlichkeit hinsichtlich des Šabbaths und Unvorsätzlichkeit hinsichtlich der Arbeiten. – Der Autor bevorzugt den Fall der Unvorsätzlichkeit hinsichtlich des Šabbaths und der Vorsätzlichkeit hinsichtlich der Arbeiten, denn er ist trotzdem$fn59vom Sündopfer nicht befreit. Dasselbe findest du auch beim Götzendienste, wobei er von einem Falle der Unvorsätzlichkeit hinsichtlich des Götzen und der Vorsätzlichkeit hinsichtlich des Dienstes lehrt. – In welchem Falle kann es bei Unvorsätzlichkeit hinsichtlich des Götzen Vorkommen: wollte man sagen, wenn jemand in einem Götzentempel steht und im Glauben, es sei ein Bethaus, da anbetet, so hat er ja sein Herz zum Himmel$fn60gerichtet; wenn jemand eine Fürstenbüste sieht und davor niederkniet, so ist ja, wenn er sie als Gott anerkennt, er zu steinigen, und wenn er sie nicht als Gott anerkennt, dies überhaupt nichts; wenn aus Liebe oder Furcht$fn61, so ist dies allerdings zutreffend nach Abajje, welcher sagt, er sei schuldig, wie ist es aber nach Raba zu erklären, welcher sagt, er sei frei!? – Vielmehr, wenn jemand geglaubt"
Keritot 3b:1,"hat, es sei erlaubt$fn62. Auch Raba fragte nämlich R. Naḥman$fn63nur, ob er ein oder zwei [Sündopfer] schuldig sei, ob er gänzlich frei sei, fragte er ihn nicht. R. Papa erklärte: Dies kann bei dem vorkommen, der als Kind unter Nichtjuden in Gefangenschaft geraten ist; der zwar wußte, daß der Götzendienst verboten sei, aber nicht wußte, daß diese Dienstleistungen verboten seien. Wenn du aber willst, sage ich: dies kann auch bei einem Erwachsenen$fn64vorkommen, wenn er sich nämlich geirrt hat in folgendem Schriftverse:$fn65<i>ihr sollt nichts neben mir machen, silberne Götter oder goldene Götter &amp;c</i>.; wenn er nämlich glaubte, man dürfe sich nur vor Götzen aus Silber und Gold nicht niederwerfen, vor anderen Arten aber sei es erlaubt. Dies heißt Versehentlichkeit hinsichtlich des Götzen und Vorsätzlichkeit hinsichtlich des Dienstes. R. Aḥa, Sohn des R. Iqa, erklärte im Namen R. Bebajs: Er lehrt nur das Rubrum Šabbath$fn66und das Rubrum Götzendienst. – Woher dies? – Da er lehrt: wer einer Frau und ihrer Tochter beiwohnt oder einer Ehefrau; er lehrt aber nicht von der Tochter seiner Genotzüchtigten, die noch hinzukommen sollte$fn67. – Ich will dir sagen, von denen, die in der Schrift genannt sind, lehrt er es, von denen aber, die in der Schrift nicht genannt sind, lehrt er es nicht. – Es gibt ja noch die Fälle von der Tochter seiner Frau, der Tochter seiner Tochter und der Tochter ihres Sohnes, die in der Schrift geschrieben sind, von denen er es nicht lehrt!? Vielmehr lehrt er nur das Rubrum Mutter und Tochter, ebenso lehrt er nur das Rubrum Šabbath und das Rubrum Götzendienst. R. Aḥa, Sohn des R. Iqa, wies auf einen Widerspruch hin, in dem dieser sich mit sich selbst befindet. Kann R. Bebaj b. Abajje denn gesagt haben, er lehre nur das Rubrum Šabbath und das Rubrum Götzendienst, es wurde ja gelehrt, wer Opferglieder von innerhalb$fn68[Geschlachtetem] außerhalb opfert, sei schuldig, und wer Opferglieder von außerhalb [Geschlachtetem] außerhalb opfert, sei schuldig, und R. Bebaj b. Abajje wandte ein, wieso demnach gelehrt wird, es gebe sechsunddreißig mit der Ausrottung [belegte Vergehen] in der Tora, es sind ja siebenunddreißig, denn es gibt zweierlei Opferungen; was ist dies für ein Einwand, es ist ja zu erwidern, er lehre nur das Rubrum Opfern!? – Es ist nicht gleich; vom Šabbath und vom Götzendienste lehrt er [die Einzelheiten] an der passenden Stelle$fn69, und bei den Ausrottungsvergehen lehrt er allgemein das Rubrum Šabbath und das Rubrum Götzendienst, aber lehrt er denn [die Einzelheiten] der Opferung an einer passenden Stelle, um dies erwidern zu können!?"
Keritot 3b:2,"R. Jirmeja fragte R. Zera: Wie verhält es sich bei zwei Ausrottungen und einem Verbote$fn70? Dieser erwiderte: Du meinst wohl das Schlachten$fn71und das Darbringen, aber bei diesen sind es zwei Verbote. Nach demjenigen, der es [aus einem Schlusse] durch Wortanalogie folgert$fn72, heißt es ja da <i>bringen</i> und dort$fn73<i>bringen</i>, wie dort eine Bestrafung nur bei Warnung$fn74erfolgt, ebenso erfolgt da eine Bestrafung nur bei Warnung; und nach demjenigen, der es durch Vergleichung$fn75folgert, sagt die Schrift: $fn76<i>dort sollst du es hinaufbringen und dort sollst du es darbringen</i>, womit er das Schlachten mit dem Darbringen vergleicht, wie beim Darbringen eine Bestrafung nur bei Warnung erfolgt, ebenso erfolgt beim Schlachten eine Bestrafung nur bei Warnung. Du meinst vielleicht zwei Todesstrafen und ein Verbot. Das sind nämlich Totenbeschwörer und Wahrsager$fn77. Dieser erwiderte: Darüber besteht ein Streit zwischen R. Joḥanan und Reš Laqiš. Unter denen, die zu steinigen$fn78sind, werden Tolenbeschwörer und Wahrsager genannt, und auf unsere Frage, weshalb bei den mit der Steinigung belegten der Wahrsager genannt wird und bei den mit der Ausrottung belegten der Wahrsager nicht genannt$fn79wird, erwiderte R. Joḥanan, weil für beide ein Verbot besteht. (Sollte er doch den Wahrsager und nicht den Totenbeschwörer nennen!? – Weil die Schrift mit dem Totenbeschwörer beginnt.) Und Reš Laqiš erwiderte, weil [der Wahrsager] keine Tätigkeit ausübt$fn80. – Weshalb erklärt Reš Laqiš nicht wie R. Joḥanan? R. Papa erwiderte: Weil sie bei der Todesstrafe geteilt$fn81sind. – Und R. Joḥanan!? – Er kann dir erwidern: die Teilung beim Verbote ist eine Teilung, die Teilung bei der Todesstrafe ist keine Teilung. – Weshalb erklärt R. Joḥanan nicht wie Reš Laqiš? – Er ist der Ansicht, der Autor der Lehre von den Ausrottungssünden sei R. A͑qiba$fn82, und dieser sagt, es sei keine Tätigkeit erforderlich. – Und Reš Laqiš!? – Zugegeben, daß nach R. A͑qiba keine bedeutende Tätigkeit erforderlich ist, eine unbedeutende Tätigkeit aber ist erforderlich. – Welche Tätigkeit übt der Totenbeschwörer aus? – Das Zusammenschlagen der Arme ist eine Tätigkeit. – Welche Tätigkeit übt der Gotteslästerer aus? – Die Bewegung der Lippen ist eine Tätigkeit. Er$fn83glaubte, das Zusammenschlagen der Arme sei eine unbedeutende Tätigkeit auch nach den Rabbanan$fn84, somit ist einzuwenden: Beim Götzendienste ist man schuldig nur wegen einer Handlung, bei der eine Tätigkeit ausgeübt wird, wie Schlachten, Räuchern, Libieren oder Sichniederwerfen. Und auf unseren Einwurf, beim Sichniederwerfen übe man ja keine Tätigkeit aus, erwiderte Reš Laqiš, dies nach R. A͑qiba, welcher sagt, es sei keine Tätigkeit erforderlich, und R. Joḥanan erwiderte, auch nach den Rabbanan, denn das Beugen der Statur gelte als Tätigkeit. Demnach ist Reš Laqiš der Ansicht, nach den Rabbanan gelte das Beugen der Statur nicht als Tätigkeit und das Zusammenschlagen der Arme gelte als Tätigkeit!? –Wenn nun das, was Reš Laqiš gesagt hat, das Zusammenschlagen der Arme sei eine unbedeutende Tätigkeit. nach R. A͑qiba gilt, nach den Rabbanan aber sei dies keine Tätigkeit, wieso lehrt er demnach, ausgenommen der Gotteslästerer, weil er keine Tätigkeit ausübt, er sollte doch lehren, ausgenommen der Gotteslästerer und der Totenbeschwörer!? – Er lehrt eines von beiden. – Sollte er es doch vom Totenbeschwörer und nicht vom Gotteslästerer lehren!? – Vom Gotteslästerer ist dies zu lehren nötig. Da die Ausrottung desselben sich im Abschnitte von den Opfern$fn85befindet, so könnte man glauben, er pflichte R. A͑qiba bei, daher lehrt er uns, daß dem nicht so ist."
Keritot 3b:3,"U͑la erklärte: Vom Totenbeschwörer, von dem er lehrt, gilt dies in dem Falle, wenn er einem Dämon opfert. Raba wandte ein: Dies ist ja demnach Götzendienst!? Vielmehr, erklärte Raba, wenn er einem Dämon opfert, um ihn zu bannen. Abajje sprach zu ihm: Dies heißt ja Bannungen vornehmen$fn86!? Dieser erwiderte: Die Tora sagt, daß eine solche Bannung mit der Steinigung [bestraft werde], – Welche Bannung ist demnach nur mit einem Verbote belegt? Dieser erwiderte: Wie gelehrt wird.$fn87<i>Wer Bannungen vornimmt</i>, ob Bannungen von großen oder Bannungen von kleinen [Tieren]; selbst wer Schlangen und Skorpione bannt, ist schuldig. Abajje sagte: Wenn jemand eine Biene mit einem Skorpion bannen will, so ist dies verboten; wenn sie aber hinter ihm her sind, ist es erlaubt. – Sollte doch nach R. Joḥanan, welcher sagt, das Beugen der Statur sei eine"
Keritot 4a:1,"Tätigkeit, auch beim Gotteslästerer das Bewegen der Lippen als Tätigkeit gelten!? Raba erwiderte: Anders verhält es sich beim Gotteslästerer, weil es [hauptsächlich] im Herzen erfolgt. Sonst aber gilt die Bewegung der Lippen als Tätigkeit. R. Zera wandte ein: Ausgenommen das überführte Falschzeugnis, da dabei keine Tätigkeit ausgeübt wird. Weshalb denn, dabei heißt es ja:$fn88<i>durch den Mund</i>!? Raba erwiderte: Anders ist es beim überführten Falschzeugnis, weil es hauptsächlich auf das Sehen ankommt."
