Index Title,Keritot
Keritot 12b:7,"H<small>AT ER</small> T<small>ALG</small>, B<small>LUT</small>, V<small>ERWERFLICHES UND</small> Ü<small>BRIGGEBLIEBENES GEGESSEN, SO IST ER SCHULDIG</small> &amp;<small>C</small>. Selbstverständlich$fn27!? Reš Laqiš erwiderte im Namen des Bar Taíṭani: Wenn er sie aus zwei Schüsseln gegessen hat, und zwar nach R. Jehošua͑, welcher sagt, die Schüsseln teilen. Man könnte glauben, R. Jehošua͑ sage es erleichternd$fn28und erschwerend$fn29, so lehrt er uns, daß er schuldig sei, wonach er dies nur erschwerend sagt und nicht erleichternd. Manche beziehen dies auf den Schlußsatz: wenn von zwei Arten, frei. Selbstverständlich!? Reš Laqiš erwiderte im Namen des Bar Taíṭani: Wenn er sie aus zwei Schüsseln gegessen hat, und zwar nach R. Jehošua͑, welcher sagt, die Schüsseln teilen. Man könnte glauben, R. Jehošua͑ sage es nur erschwerend und nicht erleichternd, so lehrt er uns, daß er bei zwei Arten frei sei. Unter zwei Arten ist nämlich zu verstehen, auch von einer Art, und er nennt es deshalb zwei Arten, weil er sie aus zwei Schüsseln gegessen hat. Er lehrt, daß er frei sei, somit sagt es R. Jehošua͑ sowohl erleichternd als auch erschwerend. – Wenn der Schlußsatz von einer Art aus zwei Schüsseln spricht, so spricht ja der Anfangsatz von einer Art aus einer Schüssel, und dies ist ja selbstverständlich!? Rabina erwiderte: Wenn er sich zwischen beiden bewußt geworden war, und zwar nach R. Gamliél, welcher sagt, es gebe kein Bewußtwerden für ein halbes$fn30Quantum. Es wird nämlich gelehrt: Wer zwei Buchstaben bei zweimaligem Entfallen geschrieben$fn31hat, einmal morgens und einmal abends, ist nach R. Gamliél schuldig und nach den Weisen frei. R. Gamliél ist der Ansicht, es gebe kein Bewußtwerden für ein halbes Quantum, und die Rabbanan sind der Ansicht, es gebe ein Bewußtwerden für ein halbes Quantum."
Keritot 12b:8,"<sup>iii</sup> <b>W</b><small>IE LANGE KANN, DER SIE GEGESSEN HAT, DABEI VERBRACHT</small>$fn32<small>HABEN</small>? A<small>LS WENN MAN GERÖSTETE</small> Ä<small>HREN</small>$fn33<small>ISST</small> – <small>SO</small> R. M<small>EÍR</small>. D<small>IE</small> W<small>EISEN SAGEN, NUR WENN ER VOM</small> A<small>NFANG BIS ZUM</small> E<small>NDE DABEI SOLANGE VERBRACHT HAT, ALS MAN EIN</small> P<small>ERAS ISST, SEI ER SCHULDIG</small>. W<small>ER UNREINE</small> S<small>PEISEN GEGESSEN ODER UNREINE</small> G<small>ETRANKE GETRUNKEN HAT, ODER WER</small>$fn34<small>EIN</small> V<small>IERTELLOG</small> W<small>EIN GETRUNKEN HAT, UND IN DAS</small> H<small>EILIGTUM GETRETEN IST</small>$fn35<small>UND DA SOLANGE VERWEILT HAT, ALS MAN EIN</small> P<small>ERAS ISST, IST SCHULDIG</small>. R. E<small>LEA͑ZAU SAGT, HAT ER</small>$fn36<small>DABEI UNTERBROCHEN ODER ETWAS</small> W<small>ASSER HINEINGETAN, SEI ER FREI</small>."
Keritot 12b:9,"GEMARA. Sie fragten: Sagt es R. Meír erschwerend oder sagt er es erleichternd? Sagt er es erschwerend, und er meint es wie folgt: als wenn man geröstete Ähren ißt, auch den ganzen Tag, obgleich es vom Anfang bis zum Ende länger dauert als man ein Peras ißt, denn da sein Essen sich hingezogen hat, ist er schuldig, und hierzu sagten die Rabbanan zu ihm, er sei schuldig, nur wenn er dabei solange verbracht hat, als man ein Peras ißt, wenn aber länger als man ein Peras ißt, sei er frei. Oder sagt er es erleichternd, und meint er es wie folgt: als wenn man geröstete Ähren ißt und dabei nicht unterbricht, hat er aber dabei unterbrochen, so ist er frei, auch wenn vom Anfang bis zum Ende innerhalb der Zeit, in der man ein Peras ißt, und hierzu sagten die Rabbanan zu ihm, da vom Anfang bis zum Ende innerhalb der Zeit, in der man ein Peras ißt, sei er schuldig. – Komm und höre: Die Weisen sagen, nur wenn er vom Anfang"
Keritot 13a:1,"bis zum Ende dabei solange verbracht hat, als man ein Peras ißt. Erklärlich ist es, wenn du sagst, R. Meír sage es erschwerend, daß er lehrt: nur wenn er verbracht hat, nur wenn er dabei solange verbracht hat, als man ein Peras ißt; wenn du aber sagst, R. Meír sage es erleichternd, so müßte es ja heißen: die Weisen sagen, schon wenn er dabei verbracht hat!? Hieraus ist also zu entnehmen, daß R. Meír es erschwerend sagt. Schließe hieraus."
Keritot 13a:2,"Rabanaj sagte im Namen Šemuéls: Bei Talg und Aas$fn37, wenn er vom Anfang bis zum Ende solange verbracht hat, als man ein Peras ißt; bei unreinen Speisen, Ekel- und Kriechtieren und Getränken$fn38, auch den ganzen Tag, als man ein Peras ißt. – Wie meint er es? R. Papa erwiderte: Er meint es wie folgt: auch den ganzen Tag, nur muß er jedes Olivenquantum$fn39gegessen haben innerhalb der Zeit, in der man ein Peras ißt. Man wandte ein: Alle [unreinen] Speisen werden vereinigt, um im Quantum eines halben Peras den Körper untauglich$fn40zu machen. Doch wohl, wenn man ein halbes Peras gegessen hat innerhalb der Zeit, in der man ein Peras ißt!? – Nein, wenn man jedes Olivenquantum gegessen hat innerhalb der Zeit, in der man ein Peras ißt. Man wandte ein: Alle Speisen werden [beim Essen] innerhalb der Zeit, in der man ein Peras ißt, vereinigt, um im Quantum eines halben Peras den Körper untauglich zu machen. Zum Beispiel: hat er gegessen und wiederum gegessen, so werden sie, wenn es vom Anfang des ersten Essens bis zum Ende des letzten Essens solange gedauert hat, als man ein Peras ißt, vereinigt, wenn aber mehr, so werden sie nicht vereinigt. Man hat dem, der weniger als das Quantum gegessen hat, nicht hinabzusteigen und ein Tauchbad zu nehmen erlaubt; wenn er hinabgestiegen ist, ein Tauchbad genommen hat, heraufgestiegen ist und [das Quantum] ergänzt hat, so werden sie vereinigt. Einer Schwangeren hat man weniger als das Quantum zu essen erlaubt, wegen der Gefahr. Alle Getränke werden [beim Trinken] innerhalb der Zeit, in der man ein Peras ißt, vereinigt, um im Quantum eines Viertellog den Körper untauglich zu machen. Zum Beispiel: hat er getrunken und wiederum getrunken, so werden sie, wenn es vom Anfang des ersten Trinkens bis zum Ende des letzten Trinkens solange gedauert hat, als man ein Peras ißt, vereinigt, wenn aber mehr, so werden sie nicht vereinigt. Man hat [einer Frau], die mit einem Leichenunreinen in Berührung gekommen ist, ihr Kind zu säugen erlaubt, und ihr Kind ist rein. Hier wird also gelehrt, wenn es vom Anfang des ersten Essens bis zum Ende des letzten Essens solange gedauert hat, als man ein Peras ißt, werden sie vereinigt. Dies ist eine Widerlegung Babanajs. Eine Widerlegung."
Keritot 13a:3,"Der Meister sagte: Man hat dem, der weniger als das Quantum gegessen hat, nicht hinabzusteigen und ein Tauchbad zu nehmen erlaubt. Wie ist dies zu verstehen? R. Jehuda erwiderte: Er meint es wie folgt: hat er weniger als das Quantum gegessen, so hat man ihm hinabzusteigen und ein Tauchbad zu nehmen nicht erlaubt, weil, wenn er hinabsteigt, ein Tauchbad nimmt, heraufkommt und [das Quantum] ergänzt, sie vereinigt werden, er aber könnte glauben, das vorangehende Untertauchen sei wirksam, ohne zu wissen, daß das Untertauchen nur nachher wirksam ist. – Er lehrt, man habe einer Schwangeren weniger als das Quantum zu essen erlaubt, wegen der Gefahr. Wegen der Gefahr sollte sie doch auch mehr essen dürfen!? R. Papa erwiderte: Er meint es wie folgt: man hat einer Schwangeren in kleineren Quantitäten auch mehr erlaubt, wegen der Gefahr. – Er lehrt, man habe [einer Frau], die mit einem Leichemmreinen in Berührung gekommen ist, ihr Kind zu säugen erlaubt, und ihr Kind ist rein. Wieso rein, sobald es von der Milch saugt, wird es ja durch die Milch unrein!? Wolltest du sagen, [die Milch] sei nicht verunreinigungsfähig$fn41geworden, so ist sie ja durch den Schmutztropfen an der Brustwarze verunreinigungsfähig geworden. R. Naḥman erwiderte im Namen des Rabba b. Abuha: Wenn es mit einem Zuge gesogen und an der Brustwarze keinen Schmutztropfen zurückgelassen hat. Raba sprach: Dagegen ist zweierlei einzuwenden: erstens sehen wir, daß der Mund des Kindes voll Milch$fn42ist, und ferner gilt ja die Milchstelle als Quelle$fn43, denn es wird gelehrt, die Milch von einem Weibe verunreinige$fn44, ob gewollt oder ungewollt$fn45, und die von einem Vieh verunreinige nur gewollt. Ungewollt heißt es wohl, wenn es ihm nicht erwünscht$fn46ist, und er lehrt, sie sei verunreinigend!? Vielmehr, erklärte Raba, ist ihr Kind aus folgendem Grunde rein: es ist zweifelhaft, ob es das erforderliche Quantum gesogen hat oder nicht gesogen hat, und auch wenn du sagst, es habe gesogen, ist es noch zweifelhaft, ob es gesogen hat innerhalb der Zeit, in der man ein Peras ißt, oder es gesogen hat länger als man ein Peras ißt. – Raba ist also der Ansicht, die Stelle der Milch gelte als Quelle und eine Befähigung$fn47sei nicht erforderlich; wir haben ja aber gelernt, wenn ein Tropfen Milch aus der Brust einer [unreinen] Frau tropft und in den Hohlraum eines Ofens$fn48fällt, sei der Ofen unrein, und auf unsere Frage, wodurch denn [der Tropfen] verunreinigungsfähig wurde, erwiderte R. Joḥanan, durch den Schmutztropfen an der Brustwarze$fn49!? Wolltest du erwidern, Raba sei nicht der Ansicht R. Joḥanans, so wird ja gelehrt: Es ergibt sich also, daß es beim Flußbehafteten neun Flüssigkeiten gibt: Schweiß, übelriechende Aussonderung$fn50und Kot sind reiner als alle$fn51; die"
Keritot 13b:1,"Tränen seines Auges, das Blut seiner Verletzung und die Milch einer Frau sind als Flüssigkeiten im Quantum eines Viertellogs verunreinigend; sein Speichel, sein Fluß und sein Urin sind schwer verunreinigend, in jedem Quantum. Wenn du nun sagst, die Stelle der Milch gelte als Quelle, so sollte doch auch die Milch gleich seinem Flusse und seinem Speichel schwer verunreinigend sein in jedem Quantum!? Hieraus ist also zu entnehmen, daß die Milchstelle eines Weibes nicht als Quelle gilt. – Dagegen ist ja aber einzuwenden aus der von Raba angezogenen Lehre, [die Milch] verunreinige, ob gewollt oder ungewollt$fn52!? – Du glaubst, ungewollt heiße es, wenn es ihm unerwünscht ist; nein, ungewollt heißt es, [wenn$fn53er sich nicht äußert,] denn der Sinn des Kindes ist auf die Milch gerichtet, wenn es ihm aber unerwünscht ist, ist sie rein."
Keritot 13b:2,"W<small>ER UNREINE</small> S<small>PEISEN GEGESSEN</small> &amp;<small>C</small>. Wozu ist das Verweilen nötig, daß er lehrt: und verweilt$fn54hat!? R. Jehuda erwiderte: Er meint es wie folgt: wer unreine Speisen gegessen, unreine Getränke getrunken, ein Viertellog Wein getrunken, und beim Essen und Trinken solange verweilt hat, als man ein Peras ißt, und in das Heiligtum eingetreten ist, ist schuldig."
Keritot 13b:3,"R. E<small>LEA͑ZAR SAGT</small> &amp;<small>C</small>. Die Rabbanan lehrten:$fn55<i>Wein und Rauschtrank sollst du nicht trinken</i>, man könnte glauben, auch irgend etwas, auch aus der Kelter$fn56, so heißt es: <i>und Rauschtrank</i>, es ist nur soviel verboten, als zum Berauschen ausreichend. Wieviel heißt zum Berauschen ausreichend? Ein Viertellog vierzig Tage alter Wein. Wieso heißt es demnach <i>Wein</i>? Um dir zu sagen, daß sie verwarnt sind auch wegen jedes Quantums, und sogar von der Kelter. R. Jehuda sagte: <i>Wein</i>, ich weiß dies nur vom Weine, woher dies von anderen berauschenden Getränken? Es heißt: <i>und Rauschtrank</i>. Wozu heißt es demnach <i>Wein</i>? Auf Wein ist die Todesstrafe gesetzt, auf andere [berauschende] Getränke eine Verwarnung. R. Elea͑zar sagte: <i>Wein sollst du nicht trinken</i>; <i>Rauschtrank [sollst du nicht trinken]</i>; trinke ihn nicht so, daß er berauscht, wenn man aber dabei abgesetzt, oder man etwas Wasser hineingetan hat, ist man frei. Worin besteht ihr Streit? – Der erste Autor ist der Ansicht, man folgere durch [das Wort] <i>Rauschtrank</i>, das auch beim Naziräer$fn57gebraucht wird, R. Jehuda folgert nicht durch [das Wort] <i>Rauschtrank</i>, das auch beim Naziräer gebraucht wird, und R. Elea͑zar ist der Ansicht, unter <i>Rauschtrank</i> sei das Berauschende$fn58zu verstehen. – Die Lehre, daß, wer eine qei͑lische Feige gegessen oder Honig oder Milch getrunken hat und in das Heiligtum eingetreten ist und Dienst getan hat, zu geißeln sei, vertritt also die Ansicht R. Jehudas. R. Jehuda$fn59b. Aḥothaj sagte: Die Halakha ist wie R. Elea͑zar. Ferner sagte Rabh über R. Elea͑zar: Der bedeutendste unter den Weisen."
Keritot 13b:4,"R. Aḥa aus Huçal halte ein Gelübde getan inbetreff seiner Frau$fn60, und als er diesbezüglich$fn61zu R. Aši kam, sprach dieser zu ihm: Jetzt gehe$fn62und komm morgen. Rabh bestellte nämlich keinen Dolmetsch an einem Festtage zum nächsten, wegen Trunkenheit$fn63. Jener sprach: Rabh sagte ja, die Halakha sei wie R. Elea͑zar, und der Mieister hat ja Wasser [in den Wein] getan!? Dieser erwiderte: Das ist kein Einwand; eines gilt von einem Viertellog und eines von mehr als einem Viertellog."
Keritot 13b:5,"Die Rabbanan lehrten:$fn64<i>Und zwischen dem Heiligen und dem Gemeinen zu trennen</i>, das sind Wertgelübde$fn65, Schätzgelübde, Gebanntes und Geheiligtes;$fn64<i>zwischen dem Unreinen und dem Reinen</i>, das sind [Entscheidungen über] Unreines und Reines;$fn66<i>und zu lehren</i>, das ist die Entscheidung;$fn66<i>all die Gesetze</i>, das sind die Auslegungen;$fn66<i>das Wort des Herrn</i>, das ist die Halakha$fn67; <i>durch Moše</i>, das ist der Talmud. Man könnte glauben, auch die Mišna, so heißt es <i>und zu lehren</i>$fn68. R. Jose b. R. Jehuda sagte: Man könnte glauben, auch der Talmud, so heißt es: <i>und zu lehren</i>$fn69. Die Lehre, ausgenommen sei die Entscheidung, das Kriechtier sei unrein und der Frosch sei rein$fn70, die auch Weintrunkene treffen dürfen, vertritt also die Ansicht des R. Jose b. R. Jehuda und nicht die der Rabbanan. – Du kannst auch sagen, die der Rabbanan, nur ist es hierbei anders, denn dies ist in der Kinderschule$fn71zu lernen. Rabh sagte: Die Halakha ist wie R. Jose b. R. Jehuda. – Rabh bestellte ja aber keinen Dolmetsch an einem Festtage zum nächsten, wegen Trunkenheit$fn72!? – Anders war es bei Rabh, der Entscheidungen zu treffen hatte. – Sollte er ihn doch bestellen, aber keine Entscheidungen treffen!? – Wo Rabh war, ging es nicht ohne Entscheidungen."
Keritot 13b:6,"<sup>iv</sup> <b>M</b><small>ANCHER ISST EINE</small> S<small>PEISE UND IST DIESERHALB VIER</small> S<small>ÜNDOPFER UND EIN</small> S<small>CHULDOPFER SCHULDIG: WENN EIN</small> U<small>NREINER VON</small> O<small>PFERN ÜBRIGGEBLIEBENEN</small> T<small>ALG AM</small> V<small>ERSÖHNUNGSTAGE GEGESSEN HAT</small>. R. M<small>EÍR SAGTE:</small> W<small>ENN ES AN EINEM</small> Š<small>ABBATH WAR UND ER IHN</small> [<small>IM</small> M<small>UNDE</small>] <small>HINAUSGEBRACHT HAT, IST ER</small> [<small>AUCH DIESERHALB</small>] <small>SCHULDIG</small>. S<small>IE ERWIDERTEN IHM:</small> D<small>IES GEHÖRT NICHT ZU DIESEM</small> R<small>UBRUM</small>$fn73."
Keritot 13b:7,"GEMARA. Demnach wäre R. Meír der Ansicht, éin Verbot erstrecke"
Keritot 14a:1,"sich auf Verbotenes$fn74? – Ist er auch nicht der Ansicht, daß ein Verbot sich auf Verbotenes erstrecke$fn75, so ist er immerhin der Ansicht, daß ein umfassendes Verbot$fn76und ein erweiterndes Verbot sich wohl erstrecke. Dem Reinen war vorher nur Talg verboten, nachdem er aber unrein geworden ist, ist ihm auch ein Stück [Fleisch]$fn77verboten; somit ist zum Talge noch ein weiteres Verbot hinzugekommen. Der Talg war vorher nur zum Essen verboten, nachdem man ihn aber geheiligt hat, ist er auch zur Nutznießung verboten; somit ist zum Talge noch ein weiteres Verbot hinzugekommen. Aber immerhin war er nur einem Gemeinen verboten, für Gott aber erlaubt; nachdem er aber Übriggebliebenes geworden ist, ist zum Verbote für einen Gemeinen noch das Verbot für Gott hinzugekommen. Kommt noch [das Verbot] wegen des Versöhnungstages hinzu, so ist zum Verbote des Heiligen$fn78noch ein Verbot für Profanes$fn78hinzugekommen. – Sollte er doch lehren: fünf Sündopfer, und zwar in dem Falle, wenn jemand Verwerfliches in Olivengröße gegessen hat!? – Er spricht von einem Vieh und nicht von zweien, während bei einem Vieh Übriggebliebenes und Verwerfliches nicht Vorkommen können$fn79. – Wieso nicht, es kann ja in dem Falle vorkommen, wenn man ein Glied von Verwerflichem auf den Altar gebracht hat, sodaß ihm die Verwerflichkeit entzogen$fn80wird; es ist dann Übriggebliebenes!? Dies nach U͑la, welcher sagte, wenn man einen verwerflichen Haufen$fn81auf den Altar gebracht hat, sei ihm die Verwerflichkeit genommen; er ist somit Übriggebliebenes. – Er spricht von einem Opfergliede und nicht von zwei Opfergliedern, während bei einem Opfergliede Übriggebliebenes und Verwerfliches nicht Vorkommen können. – Wieso nicht, es kann ja in dem Falle Vorkommen, wenn man ein Glied von Verwerflichem auf den Altar gebracht hat, und zwar die Hälfte auf den Altar gelegt und die Hälfte abseits vom Altar, sodaß nur dem Teile, der sich auf dem Altar befindet, die Verwerflichkeit entzogen ist und er Übriggebliebenes wird!? Dies nach U͑la, welcher sagte, wenn man einen verwerflichen Haufen auf den Altar gebracht hat, sei ihm die Verwerflichkeit genommen; er ist somit Übriggebliebenes. [Dieser erwiderte:] Nein, befindet sich der größere Teil auf dem Altar, so gilt es als auf dem Altar befindlich, und befindet sich der größere Teil abseits des Altars, so gilt es als abseits befindlich. – Demnach wäre ja hieraus die Frage des Rami b. Ḥama zu entscheiden, ob man sich bei den Opfergliedern nach der größeren Hälfte richte oder nicht!? – Vielmehr, er spricht vom Quantum einer Olive, von zwei Oliven spricht er nicht. – Etwa nicht, er lehrt es ja vom Versöhnungstage, wegen dessen man bei Dattelgröße schuldig ist, und die Dattel hat ja zwei Oliven!? R. Zera erwiderte: Wenn er eine Niere mit ihrem Talge$fn82gegessen hat. R. Papa erwiderte: Wenn er [das Quantum] mit einer Dattel$fn83ergänzt hat. R. Ada b. Aḥa lehrte tatsächlich: fünf Sündopfer, und erklärte es durch den Fall, wenn jemand eine Olive Verwerfliches gegessen hat, und man erwiderte dagegen nicht alt die Erwiderungen, die wir erwidert haben. – Sollte er doch$fn84lehren: sechs Sündopfer, und auf den Fall beziehen, wenn jemand dazu eine Olive Blut gegessen hat!? – Er spricht von einem Essen, von zwei Essen aber spricht er nicht; die Weisen haben nämlich festgestellt, daß der Schlund nicht mehr als zwei Oliven fasse."
Keritot 14a:2,"R. M<small>EÍR SAGTE</small> &amp;<small>C</small>. Sollte er doch lehren: hat er es hinausgebracht$fn85, so ist er schuldig, weshalb lehrt er: wenn es an einem Šabbath war!? Raphram erwiderte: Dies besagt, daß [das Gesetz] vom E͑rub und vom Hinausbringen nur für den Šabbath gilt, nicht aber gilt [das Gesetz] vom E͑rub und vom Hinausbringen für den Versöhnungstag$fn86. – Woher dies, vielleicht gilt [das Gesetz] vom E͑rub und vom Hinausbringen auch für den Versöhnungstag, und er meint es wie folgt: wenn es an einem Šabbath war und er es hinausgebracht hat, so ist er auch wegen des Šabbaths und des Versöhnungstages schuldig!? – Vielmehr, ist die Lehre Raphrams gelehrt worden, so wird sie sich auf folgende Lehre beziehen:$fn87<i>Und sende ihn</i>$fn88<i>durch einen bereitstehenden Mann. Mann</i>, auch ein Gemeiner ist zulässig; <i>bereitstehenden</i>, auch in Unreinheit, auch am Šabbath; <i>bereitstehenden</i>, der bestellt ist. Er lehrt: <i>bereitstehenden</i>, auch am Šabbath; hierzu sagte Raphram: Dies besagt, daß [das Gesetz] vom E͑rub und vom Hinausbringen nur für den Šabbath gilt, nicht aber gilt [das Gesetz] vom E͑rub und vom Hinausbringen für den Versöhnungstag. – Woher dies, vielleicht ist es beim [fortzuschickenden Sühne]bocke anders, weil am Versöhnungstage seine Tauglichmachung erfolgt$fn89. – Vielmehr ist das, was Raphram gesagt hat, sinnlos."
Keritot 14a:3,"<sup>v,1</sup><b>M</b><small>ANCHER VOLLZIEHT EINEN</small> B<small>EISCHLAF UND IST DIESERHALB SECHS</small> S<small>ÜNDOPFER SCHULDIG</small>, <small>UND ZWAR</small>: <small>WENN JEMAND SEINER</small> T<small>OCHTER</small>$fn90<small>BEIWOHNT</small>, <small>SO KANN ER SICH SCHULDIG MACHEN</small> [<small>WEGEN</small> I<small>NZESTES MIT</small>] <small>SEINER</small> T<small>OCHTER</small>, <small>SEINER</small> S<small>CHWESTER</small>, <small>DER</small> F<small>RAU SEINES</small> B<small>RUDERS</small>, <small>DER</small> F<small>RAU DES</small> B<small>RUDERS SEINES</small> V<small>ATERS</small>, <small>EINES</small> E<small>HEWEIBES UND EINER</small> M<small>ENSTRUIERENDEN</small>."
Keritot 14a:4,"GEMARA. R. Meír ist ja aber nicht der Ansicht, daß ein Verbot sich"
Keritot 14b:1,"auf Verbotenes erstrecke!? – Ist er auch nicht der Ansicht, daß ein Verbot sich auf Verbotenes erstrecke, so ist er immerhin der Ansicht, daß ein erweiterndes Verbot und ein umfassendes Verbot sich wohl erstrecke. Wenn jemand beispielsweise seiner Mutter beigewohnt und eine Tochter gezeugt hat, so liegen das Verbot einer Tochter und das Verbot einer Schwester vor; verheiratet sie sich mit seinem Bruder, so ist das Verbot, da es für seine Brüder erweitert worden$fn91ist, auch für ihn erweitert worden. Verheiratet sie sich darauf mit dem Bruder seines Vaters, so ist das Verbot, da es für die übrigen Brüder seines Vaters erweitert worden$fn91ist, auch für ihn erweitert worden. Ist sie dazu Ehefrau, so ist das Verbot, da es für alle Welt erweitert worden$fn92ist, auch für ihn erweitert worden. Ist sie dazu Menstruierende, so ist das Verbot, da es für ihren Ehemann erweitert worden$fn93ist, auch für ihn erweitert worden."
Keritot 14b:2,"<sup>v,2</sup><b>W</b><small>ENN JEMAND DER</small> T<small>OCHTER SEINER</small> T<small>OCHTER BEIWOHNT</small>, <small>SO KANN ER SICH SCHULDIG MACHEN</small> [<small>WEGEN</small> I<small>NZESTES MIT</small>] <small>DER</small> T<small>OCHTER SEINER</small> T<small>OCHTER</small>, <small>SEINER</small> S<small>CHWIEGERTOCHTER</small>$fn94, <small>DER</small> F<small>RAU SEINES</small> B<small>RUDERS</small>, <small>DER</small> F<small>RAU DES</small> B<small>RUDERS SEINES</small> V<small>ATERS</small>, <small>DER</small> S<small>CHWESTER SEINER</small> F<small>RAU</small>, <small>EINES</small> E<small>HEWEIBES UND EINER</small> M<small>ENSTRUIERENDEN</small>. R. J<small>OSE SAGT</small>, <small>HAT DER</small> A<small>LTE</small>$fn95 <small>DAS</small> V<small>ERBOT ÜBERTRETEN UND SIE GEHEIRATET</small>, <small>SEI ER SCHULDIG AUCH WEGEN EINER</small> F<small>RAU SEINES</small> V<small>ATERS</small>. D<small>ESGLEICHEN AUCH</small>, <small>WENN JEMAND DER</small> T<small>OCHTER SEINER</small> F<small>RAU ODER DER</small> T<small>OCHTER IHRER</small> T<small>OCHTER BEIWOHNT</small>."
Keritot 14b:3,"GEMARA. Er lehrt, daß er schuldig sei wegen der Frau seines Vaters; ist sie ihm denn erlaubt$fn96!? R. Joḥanan erwiderte: Wenn sie ihm zur Schwagerehe$fn101zugefallen ist. – Wieso heißt es demnach übertreten$fn102!? R. Ja͑qob erwiderte: Er hat das zweitgradige Inzestverbot$fn103der Schwiegertochter seines Sohnes übertreten. Wie gelehrt wird: Seine Schwiegertochter ist inzestuös, die Schwiegertochter seines Sohnes ist zweitgradig inzestuös; dies gilt auch von der Tochter seines Sohnes und von der Tochter seines Sohnessohnes, bis ans Ende aller Generationen. – Ist denn R. Jose der Ansicht, ein Verbot erstrecke sich auf Verbotenes, wir haben ja gelernt, wer eine Sünde begangen hat, die mit zwei Todesstrafen belegt ist, werde mit der schwereren$fn104gerichtet, und R. Jose sagt, er werde mit der zuerst platzgreifenden$fn105gerichtet!? Ferner wird gelehrt: Wie wird er nach R. Jose mit der zuerst platzgreifenden gerichtet? War sie zuerst seine Schwiegermutter$fn106und nachher Ehefrau, so wird er wegen einer Schwiegermutter gerichtet; war sie zuerst Ehefrau und nachher seine Schwiegermutter, so wird er wegen einer Ehefrau gerichtet. R. Abahu erwiderte: R. Jose pflichtet bei einem erweiternden Verbote bei. Ebenso sagte Rabin, als er kam, im Namen R. Joḥanans, R. Jose pflichte bei einem erweiternden Verbote bei. – Wieso ist es hierbei ein erweiterndes Verbot!? – Wenn der Alte noch einen Sohn hat; da das Verbot für seinen Sohn erweitert worden$fn107ist, so ist es auch für ihn erweitert worden."
Keritot 14b:4,"<sup>vi</sup><b>W</b><small>ENN JEMAND SEINER</small> S<small>CHWIEGERMUTTER BEIWOHNT</small>, <small>SO KANN ER SICH SCHULDIG MACHEN</small> [<small>WEGEN</small> I<small>NZESTES MIT</small>] <small>SEINER</small> S<small>CHWIEGERMUTTER</small>, <small>SEINER</small> S<small>CHWIEGERTOCHTER</small>, <small>DER</small> F<small>RAU SEINES</small> B<small>RUDERS</small>, <small>DER</small> F<small>RAU DES</small> B<small>RUDERS SEINES</small> V<small>ATERS</small>, <small>DER</small> S<small>CHWESTER SEINER</small> F<small>RAU</small>, <small>EINES</small> E<small>HEWEIBES UND EINER</small> M<small>ENSTRUIERENDEN</small>. D<small>ESGLEICHEN AUCH</small>, <small>WENN JEMAND DER</small> M<small>UTTER SEINES</small> S<small>CHWIEGERVATERS ODER DER</small> M<small>UTTER SEINER</small> S<small>CHWIEGERMUTTER BEIWOHNT</small>. R. J<small>OḤANAN B</small>. N<small>URI SAGT</small>, <small>WER SEINER</small> S<small>CHWIEGERMUTTER BEIWOHNT</small>, <small>SEI SCHULDIG WEGEN SEINER</small> S<small>CHWIEGERMUTTER</small>, <small>DER</small> M<small>UTTER SEINER</small> S<small>CHWIEGERMUTTER</small>$fn108<small>UND DER</small> M<small>UTTER SEINES</small> S<small>CHWIEGERVATERS</small>. S<small>IE SPRACHEN ZU IHM</small>: B<small>EI ALLEN DREIEN IST ES DAS GLEICHE</small> V<small>ERBOT</small>$fn109."
Keritot 14b:5,"GEMARA. R. Elea͑zar sagte im Namen des R. Hoša͑ja: R. Joḥanan b. Nuri und Symmachos lehren ein und dasselbe. R. Joḥanan b. Nuri lehrt das, was wir eben gesagt haben, was lehrt Symmachos? – Wir haben gelernt:"
