Index Title,Makkot
Makkot 11b:3,"<b>S</b><small>TIRBT DER</small> H<small>OCHPRIESTER NACH SEINER</small> V<small>ERURTEILUNG, SO MUSS ER NICHT IN DIE</small> V<small>ERBANNUNG; WENN ABER DER</small> H<small>OCHPRIESTER VOR SEINER</small> V<small>ERURTEILUNG STIRBT UND EIN ANDERER AN SEINER</small> S<small>TELLE EINGESETZT UND ER DARAUF VERURTEILT WIRD, SO KEHRE ER BEIM</small> T<small>ODE DES ZWEITEN HEIM</small>. <sup>vi,3</sup> W<small>ENN BEI SEINER</small> V<small>ERURTEILUNG KEIN</small> H<small>OCHPRIESTER DA WAR, ODER WENN EIN</small> H<small>OCHPRIESTER JEMAND GETÖTET HAT, SO KANN ER</small> [<small>SEINE</small> Z<small>UFLUCHTSSTADT</small>] <small>NIEMALS VERLASSEN</small>. <sup>vii,1</sup> E<small>R DARF SIE NICHT VERLASSEN, UM</small> Z<small>EUGNIS ABZULEGEN IN EINER GOTTGEFÄLLIGEN</small> H<small>ANDLUNG, AUCH NICHT, UM</small> Z<small>EUGNIS ABZULEGEN IN</small> G<small>ELDSACHEN, AUCH NICHT, UM</small> Z<small>EUGNIS ABZULEGEN IN</small> T<small>ODESSTRAFSACHEN; UND SOGAR WENN GANZ</small> J<small>ISRAÉL SEINER BEDARF, UND SELBST WENN ER EIN</small> F<small>ELDHERR IST WIE</small> J<small>OÁB, DER</small> S<small>OHN DER ÇERUJA, DARF ER SIE NIEMALS VERLASSEN, DENN ES HEISST</small>$fn171<i>dort</i>, <small>DORT WOHNE ER, DORT STERBE ER UND DORT WERDE ER BEGRABEN</small>. W<small>IE DIE</small> S<small>TADT SELBER</small> Z<small>UFLUCHT GEWÄHRT, EBENSO GEWÄHRT AUCH IHR GANZES</small> G<small>RENZGEBIET</small> Z<small>UFLUCHT</small>. W<small>ENN DER</small> T<small>OTSCHLÄGER DAS</small> G<small>RENZGEBIET VERLÄSST UND DER</small> B<small>LUTRÄCHER IHN TRIFFT, SO IST ES, WIE</small> R. J<small>OSE DER</small> G<small>ALILÄER SAGT, DIESEM GEBOTEN, IHN ZU TÖTEN, JEDEM ANDEREN STEHT DIES FREI</small>. R. A͑<small>QIBA SAGT, DIES STEHE DEM</small> B<small>LUTRÄCHER FREI, UND JEDER ANDERE SEI DIESERHALB NICHT STRAFBAR</small>."
Makkot 11b:4,"GEMARA. Aus welchem Grunde? Abajje erklärte: Es ist [durch einen Schluß] vom Schwereren auf das Leichtere zu folgern: wenn sogar derjenige, der bereits in der Verbannung ist, dann$fn172heimkehrt, um wieviel weniger braucht derjenige, der noch nicht in der Verbannung ist, in die Verbannung zu gehen. – Vielleicht aber hat derjenige, der in der Verbannung ist, Versöhnung erlangt, nicht aber derjenige, der nicht in die Verbannung gekommen ist!? – Erlangt er denn Versöhnung durch die Verbannung, er erlangt sie ja durch den Ted des Hochpriesters."
Makkot 11b:5,"W<small>ENN ABER VOR SEINER</small> V<small>ERURTEILUNG</small> &amp;<small>C</small>. Woher dies? R. Kahana erwiderte. Die Schrift sagt:$fn173<i>er soll da bleiben bis zum Tode des Hochpriesters, den er mit dem heiligen Öl gesalbt hat</i>; salbte ihn denn dieser? Vielmehr, der während dieses Ereignisses gesalbt worden ist. – Was sollte er denn tun$fn174!? – Er sollte um Erbarmen flehen, daß das Urteil zu seinen Gunsten ausfallen möge, hat dies aber unterlassen."
Makkot 11b:6,"Abäjje sagte: Es ist uns überliefert, daß, wenn er nach seiner Verurteilung stirbt, seine Gebeine [in die Zufluchtsstadt] hingehracht werden, denn es heißt :$fn175<i>wiederzukommen und im Lande zu wohnen, bevor der Hochpriester gestorben ist</i>; welche Wohnung befindet sich im Lande$fn176? Sage: das Grab."
Makkot 11b:7,"Es wird gelehrt: Stirbt er früher als der Hochpriester, so bringe man seine Gebeine in die Grabstätte seiner Vorfahren, denn es heißt:$fn177<i>soll der Totschläger in das Land seines Besitzes zurückkehren;</i> welcher Besitz befindet sich im Lande? Sage: das Grab."
Makkot 11b:8,"[Über den Fall,] wenn nach seiner Verurteilung der Hochpriester als Sohn einer Geschiedenen oder einer Ḥaluça befunden wird, [streiten] R. Ami und R. Jiçḥaq der Schmied; einer sagt, die Priesterschaft gelte als gestorben, und einer sagt, die Priesterschaft sei [rückwirkend] aufgehoben. Es ist anzunehmen, daß sie denselben Streit führen wie R. Elie͑zer und R. Jehošua͑, denn wir haben gelernt: Wenn ein Priester am Altar steht und den Tempeldienst verrichtet, und es bekannt wird, daß er der Sohn einer Geschiedenen oder einer Ḥaluça ist, so sind alle Opfer, die er dargebracht hat, wie R. Elie͑zer sagt, untauglich, und wie R. Jehošua͑ sagt, tauglich. Derjenige, welcher sagt, [die Priesterschaft] gelte als gestorben, ist der Ansicht R. Jehošua͑s, und derjenige, welcher sagt, sie sei"
Makkot 12a:1,"[rückwirkend] aufgehoben, ist der Ansicht R. Elie͑zers. – Nach R. Elie͑zer streiten sie überhaupt nicht$fn178, sie streiten nur nach R. Jehošua͑; derjenige, welcher sagt, sie gelte als gestorben, ist entschieden der Ansicht R. Jehošua͑s, und derjenige, welcher sagt, sie sei [rückwirkend] aufgehoben, [kann einwenden:] R. Jehošua͑ ist dieser Ansicht nur dort, weil es heißt: $fn179<i>segne, Herr, seinen Wohlstand und laß dir gefallen das Tun seiner Hände</i>, selbst das der Entweihten$fn180, hierbei aber pflichtet auch R. Jehošua͑$fn181bei."
Makkot 12a:2,"W<small>ENN BEI SEINER</small> V<small>ERURTEILUNG</small> &amp;<small>C</small>. R. Jehuda sagte im Namen Rabhs: Joáb irrte sich doppelt in jener Stunde, von der es heißt :$fn182<i>da floh Joáb zum Zelte des Herrn und erfaßte die Hörner des Altars;</i> erstens irrte er sich, indem er die Hörner erfaßte, während nur das Dach eine Zuflucht gewährt, zweitens irrte er sich, indem er den Altar zu Šilo$fn183erfaßte, während nur der Altar des ewigen Hauses$fn184eine Zuflucht gewährt. Abajje sagte: Er irrte sich auch darin: er gewährt Zuflucht nur einem diensttuenden Priester, er aber war Gemeiner."
Makkot 12a:3,"Reš Laqiš sagte: Dereinst wird sich der Schutzengel Roms$fn185dreifach irren. Es heißt :$fn186<i>wer ist der, der von Edom herkommt, in hochroten Kleidern</i>$fn187<i>von Boçra</i>. Er wird sich irren, indem er sich nach Boçra flüchten wird, während die Zufluchtsstadt Beçer$fn188ist, er wird sich irren, indem eine solche nur unvorsätzlichen [Totschlägern] Zuflucht gewährt, während er vorsätzlicher ist, er wird sich irren, indem eine solche nur Menschen Zuflucht gewährt, während er ein Engel ist."
Makkot 12a:4,"R. Abahu sagte: Die Zufluchtsstädte sind nicht als Begräbnisplätze freigegeben worden, denn es heißt :$fn189<i>die dazu gehörenden Triften sollen sie für ihre Lasttiere, ihren Viehstand und für all ihre lebenden Tiere haben;</i> sie sind nur für das Leben bestimmt, nicht aber zum Begräbnisse. Man wandte ein: <i>Dort</i>, dort wohne er, dort sterbe er und dort werde er begraben!? – Anders ist es beim Totschläger, bei dem der Allbarmherzige dies ausdrücklich gesagt hat$fn190."
Makkot 12a:5,"W<small>IE DIE</small> S<small>TADT SELBER</small> Z<small>UFLUCHT GEWÄHRT</small> &amp;<small>C</small>. Ich will auf einen Widerspruch hin weisen :$fn191Er <i>soll da bleiben</i>, da, und nicht im Grenzgebiete!? Abajje erwiderte: Dies ist kein Widerspruch; eines gilt von der Gewährung einer Zuflucht und eines gilt vom Wohnen. – Wohnen ist ja schon aus dem Grunde [verboten], weil man weder ein Feld in einen Vorplatz noch einen Vorplatz in ein Feld noch einen Vorplatz in Stadtgebiet noch Stadtgebiet in einen Vorplatz umwandeln darf!? R. Šešeth erwiderte: Dies ist wegen der Höhlen nötig$fn192."
Makkot 12a:6,"W<small>ENN DER</small> T<small>OTSCHLÄGER DAS</small> G<small>RENZGEBIET VERLÄSST</small> &amp;<small>C</small>. DieRabbanan lehrten :$fn193<i>Und der Bluträcher ermorde(t)</i>$fn194<i>den Totschläger;</i> es ist Gebot, daß der Bluträcher dies tue; ist kein Bluträcher vorhanden, so steht dies jedem anderen frei – so R. Jose der Galiläer, R. A͑qiba sagt, dies stehe dem Bluträcher frei; jeder andere sei dieserhalb nicht strafbar. – Was ist der Grund R. Jose des Galiläers? – Heißt es denn: wenn ermordet hat? – Und R. A͑qiba!? – Heißt es denn: er soll ermorden?"
Makkot 12a:7,"Mar Zuṭra b. Ṭobija sagte im Namen Rabhs: Wenn der Totschläger das Stadtgebiet verläßt und der Bluträcher ihn trifft und erschlägt, so wird er dieserhalb hingerichtet$fn195. – Also weder nach R. Jose dem Galiläer noch nach R. A͑qiba!? – Er ist der Ansicht des Autors der folgenden Lehre: R. Elie͑zer sagte :$fn196<i>Bis er zum Behufe seiner Aburteilung vor der Gemeinde gestanden hat;</i> was besagt dies? Da es heißt:$fn197<i>und der Bluträcher ermorde(t) den Totschläger</i>, so könnte man glauben, sofort, so heißt es: <i>bis er zum Behufe seiner Aburteilung vor der Gemeinde gestanden hat</i>. – Wofür verwenden R. Jose und R. A͑qiba den [Schriftvers:] <i>bis er zum Behufe seiner Aburteilung vor der Gemeinde gestanden hat</i>!? – Diesen verwenden sie für folgende Lehre: R. A͑qiba sagte: Woher, daß wenn das Synedrium jemand einen Menschen erschlagen gesehen hat, es ihn nicht eher töten dürfe, als bis er vor einem anderen$fn198 Gerichte gestanden hat? Es heißt: <i>bis er zum Behufe seiner Aburteilung vor der Gemeinde gestanden hat</i>, bis er vor einem anderen Gerichte gestanden hat."
Makkot 12a:8,"Die Rabbanan lehrten:$fn199<i>Wenn aber der Mörder verläßt;</i> ich weiß dies nur von dem Falle, wenn vorsätzlich, woher dies, wenn versehentlich? Es heißt: <i>verlassen</i>$fn200, <i>verläßt</i>, in jedem Falle. – Es wird ja aber gelehrt, wenn vorsätzlich, werde er getötet, wenn versehentlich, werde er verbannt$fn201!? – Das ist kein Einwand; einer nach demjenigen, welcher sagt, die Tora gebrauche die übliche Redewendung$fn202der Menschen, und einer nach demjenigen, welcher sagt, die Tora gebrauche nicht die übliche Redewendung der Menschen. Abajje sagte: Es ist einleuchtend, daß die Tora hierbei die übliche Redewendung der Menschen gebrauche, denn sein Ende darf nicht strenger sein als sein Anfang: wie er anfangs$fn203 bei Vorsatz hingerichtet wird, und bei Versehen in die Verbannung muß, ebenso wird er auch bei seinem Ende$fn204bei Vorsatz hingerichtet und muß hei Versehen in die Verbannung."
Makkot 12a:9,"Eines lehrt, wenn ein Vater [seinen Sohn] tötet, sei der [andere] Sohn Bluträcher, und ein anderes lehrt, er sei nicht Bluträcher; es wäre also anzunehmen, eines nach R. Jose dem Galiläer$fn205und eines nach R. A͑qiba. – Glaubst du: ist dies denn erlaubt, ob nach demjenigen, welcher sagt, dies sei Gebot, oder nach demjenigen, welcher sagt, dies sei freigestellt!? Rabba b. R. Hona sagte ja, und ebenso wurde auch in der Schule R. Jišma͑éls gelehrt: In keinem Falle darf ein Sohn Gerichtsdiener werden, seinen Vater zu geißeln oder über ihn den [Bann]fluch auszusprechen, außer wenn er [zum Götzendienste] verleitet hat, denn die Tora sagt :$fn206<i>du sollst seiner nicht schonen noch seine Schuld verheimlichen</i>. Dennoch besteht hier kein Widerspruch; eines gilt von seinem Sohne und eines gilt vom Sohne seines Sohnes$fn207."
Makkot 12a:10,"<b>W</b><small>ENN EIN</small> B<small>AUM INNERHALB DES</small> G<small>RENZGEBIETES STEHT UND DIE</small> K<small>RONE SICH NACH AUSSERHALB NEIGT, ODER WENN ER AUSSERHALB DES</small> G<small>RENZGEBIETES STEHT UND DIE</small> K<small>RONE SICH NACH INNERHALB NEIGT, SO RICHTE MAN SICH STETS NACH DER</small> K<small>RONE</small>. <sup>vii,2</sup>"
Makkot 12a:11,"GEMARA. Ich will auf einen Widerspruch hin weisen: Wenn ein Baum innerhalb$fn208steht und sich nach außen neigt, oder außerhalb steht und sich nach innerhalb neigt, so gilt [der Teil] von der Mauer einwärts als innerhalb, und von der Mauer auswärts als außerhalb!? – Du weisest auf einen Widerspruch hin zwischen [einer Lehre vom] Zehnten und [einer Lehre von den] Zufluchtsstädten!? Beim Zehnten hat es der Allbarmherzige von der Mauer$fn209abhängig gemacht, bei den Zufluchtsstädten aber hat es der Allbarmherzige vom Wohnen abhängig gemacht, und zum Wohnen eignet sich die Krone und nicht der Stamm. – Ich will aber auf einen Widerspruch beim Zehnten hinweisen. Es wird gelehrt: Hinsichtlich der Stadt Jerušalem$fn210richte man sich nach der Krone, und auch hinsichtlich der Zufluchtsstädte richte man sich nach der Krone!? R. Kahana erwiderte: Das ist kein Widerspruch; eines nach R. Jehuda und eines nach den Rabbanan. Es wird nämlich gelehrt: R. Jehuda sagt,"
Makkot 12b:1,"bei einer Höhle richte man sich nach dem Eingang$fn211und bei einem Baume richte man sich nach der Krone. – R. Jehuda ist zwar dieser Ansicht beim Zehnten, bei dem dies erschwerend ist; wenn der Stamm außerhalb und die Krone innerhalb sich befindet: wie auf dem Gebiete, auf dem die Krone sich befindet, die Auslösung nicht zulässig$fn212ist, ebenso ist die Auslösung nicht zulässig auf dem Gebiete, auf dem der Stamm sich befindet; wenn der Stamm innerhalb und die Krone außerhalb sich befindet: wie auf dem Gebiete, auf dem die Krone sich befindet, das Essen$fn213unausgelöst nicht zulässig ist, ebenso ist das Essen unausgelöst nicht zulässig auf dem Gebiete, auf dem der Stamm sich befindet; wieso ist dies$fn214aber bei den Zufluchtsstädten der Fall? Allerdings in dem Falle, wenn der Stamm außerhalb und die Krone innerhalb sich befindet: wie man ihn nicht töten darf auf dem Gebiete, auf dem die Krone sich befindet, ebenso darf man ihn nicht töten auf dem Gebiete, auf welchem der Stamm sich befindet; wenn aber der Stamm innerhalb und die Krone außerhalb sich befindet, sollte man ihn, wie man ihn töten darf auf dem Gebiete, auf dem die Krone sich befindet, auch töten dürfen auf dem Gebiete, auf dem der Stamm sich befindet; er befindet sich ja innerhalb$fn215!? Raba erwiderte: Hinsichtlich des Stammes stimmen alle überein, daß man ihn auf dem Gebiete, auf dem dieser sich befindet, nicht töten dürfe; wenn er sich unter der Krone befindet und man ihn mit Pfeilen oder Geröll töten kann, so stimmen alle überein, daß man ihn töte, sie streiten nur, ob der Stamm als Treppe für die Krone dienen könne; einer ist der Ansicht, der Stamm diene als Treppe$fn216für die Krone, und einer ist der Ansicht, der Stamm diene nicht als Treppe für die Krone. R. Aši erklärte: Nach der Krone, dies heißt: auch nach der Krone$fn217."
Makkot 12b:2,"<sup>vii,3</sup> <b>H</b><small>AT ER IN DIESER</small> S<small>TADT</small>$fn218<small>GETÖTET, SO GEHE ER IN DIE</small> V<small>ERBANNUNG AUS EINEM</small> R<small>EVIER</small>$fn219<small>NACH EINEM ANDEREN</small>. E<small>IN</small> L<small>EVITE</small>$fn220<small>GEHE IN DIE</small> V<small>ERBANNUNG AUS EINER</small> S<small>TADT NACH EINER ANDEREN</small>."
Makkot 12b:3,"GEMARA. Die Rabbanan lehrten :$fn221<i>So will ich dir eine Stätte bestimmen &amp;c</i>. Will ich dir bestimmen, bei deinen$fn222Lebzeiten; <i>eine Stätte</i>, aus deiner$fn223Stätte; <i>wohin er flüchten kann</i>, dies lehrt, daß die Jisraéliten auch in der Wüste die [Institution der] Verbannung hatten. Wohin verbannten sie? In das levitische Lager. Hieraus folgerten sie, daß ein Le vite, wenn er [unvorsätzlich] getötet hat, aus einem Bezirke$fn224nach einem anderen in die Verbannung muß. Geht er in die Verbannung nach seinem eigenen Bezirke, so gewährt ihm auch dieser Zuflucht. R. Aḥa, Sohn des R. Iqa, sagte: Welcher Schriftvers deutet hierauf?$fn225<i>In seiner Zufluchtsstadt soll er bleiben</i>, in der Stadt, die ihm von früher her Zuflucht gewährt."
Makkot 12b:4,"<sup>viii</sup> <b>D</b><small>ESGLEICHEN AUCH</small>$fn226, <small>WENN EIN</small> T<small>OTSCHLÄGER IN EINE</small> Z<small>UFLUCHTSSTADT IN DIE</small> V<small>ERBANNUNG GEHT, UND DIE</small> L<small>EUTE DER</small> S<small>TADT IHM</small> E<small>HRUNG ERWEISEN WOLLEN, SO SAGE ER ZU IHNEN</small>: I<small>CH BIN EIN</small> T<small>OTSCHLÄGER</small>. W<small>ENN SIE IHM ABER ERWIDERN</small> : D<small>ENNOCH, SO NEHME ER SIE VON IHNEN AN, DENN ES HEISST</small>:$fn227<i>dies ist das Wort des Totschlägers</i>. S<small>IE</small>$fn228<small>MUSSTEN</small>"
Makkot 13a:1,"<small>DEN</small> L<small>EVITEN</small>$fn229M<small>IETE ZAHLEN</small> – so R. J<small>EHUDA</small> ; R. M<small>EÍR SAGT, SIE BRAUCHTEN IHNEN KEINE</small> M<small>IETE ZU ZAHLEN</small>. N<small>ACHHER</small>$fn230<small>KOMMT ER IN SEIN FRUHERES</small> A<small>MT ZURÜCK</small> – so R. M<small>EÍR;</small> R. J<small>EHUDA SAGT, ER KOMMT NICHT IN SEIN FRÜHERES</small> A<small>MT ZURÜCK</small>."
Makkot 13a:2,"GEMARA. R. Kahana sagte: Der Streit besteht nur über die sechs [Zufluchtsstädte]; einer erklärt:$fn231<i>für euch</i>, als Zuflucht, und der andere erklärt: <i>für euch</i>, zu jedem Behufe, hinsichtlich der übrigen zweiundvierzig [Städte]$fn232aber sind alle der Ansicht, daß sie da Miete zahlen mußten. Raba sprach zu ihm: <i>Für euch</i> heißt ja selbstverständlich zu jedem Behufe!? Vielmehr, sagte R. Kahana, der Streit besteht nur über die zweiundvierzig Städte, einer erklärt :$fn233<i>zu diesen sollt ihr hinzufügen</i>, zu diesen als Zuflucht, und der andere erklärt: <i>zu diesen sollt ihr hinzufügen</i>, gleich diesen: wie diese zu jedem Behufe, ebenso auch die übrigen zu jedem Behufe; bezüglich der sechs [Zufluchtsstädte] aber sind alle der Ansicht, daß sie da keine Miete zu zahlen brauchten."
Makkot 13a:3,"N<small>ACHHER KOMMT ER IN SEIN FRÜHERES</small> A<small>MT ZURÜCK</small> &amp;<small>C</small>. Die Rabbanan lehrten:$fn234<i>Und er kehre zu seinem Geschlechte zurück und zum Erbbesitze seiner Vorfahren;</i> er kehre zu seinem Geschlechte zurück, nicht aber in [das Amt], das seine Vorfahren inne hatten – so R. Jehuda; R. Meír sagt, er kehre auch in [das Amt], das seine Vorfahren inne hatten, zurück. <i>Zum Erbbesitze seiner Vorfahren</i>, gleich$fn235seinen Vorfahren. Dasselbe$fn236gilt auch von der Verbannung, denn es heißt: <i>kehre er zurück</i>, und dies schließt den Totschläger ein$fn237. – Was heißt: dasselbe gilt auch von der Verbannung? – Wie gelehrt wird:$fn238<i>Soll der Totschläger in das Land seines Erbbesitzes zurückkehren</i>, in das Land seines Erbbesitzes kehre er zurück, nicht aber in [das Amt], das seine Vorfahren inne hatten – so R. Jehuda; R. Meír sagt, er kehre auch in [das Amt] zurück, das seine Vorfahren inne hatten, denn er folgert dies aus dem Ausdruck ‘zurückkehren’, der auch dort$fn239gebraucht wird."
Makkot 13a:4,"<sup>i</sup> <b>F</b>OLGENDE$fn1 <small>SIND ZU GEISSELN</small>: W<small>ER SEINE</small> S<small>CHWESTER, DIE</small> S<small>CHWESTER SEINES</small> V<small>ATERS, DIE</small> S<small>CHWESTER SEINER</small> M<small>UTTER, DIE</small> S<small>CHWESTER SEINER</small> F<small>RAU, DIE</small> F<small>RAU SEINES</small> B<small>RUDERS, DIE</small> F<small>RAU DES</small> B<small>RUDERS SEINES</small> V<small>ATERS, ODER EINE</small> M<small>ENSTRUIERENDE BESCHLAFEN HAT, EIN</small> H<small>OCHPRIESTER, DER EINE</small> W<small>ITWE</small>$fn2, <small>EIN GEMEINER</small> P<small>RIESTER, DER EINE</small> G<small>ESCHIEDENE</small>$fn3 <small>ODER EINE</small> Ḥ<small>ALUÇA, EIN</small> J<small>ISRAÉLIT, DER EIN</small> H<small>URENKIND ODER EINE</small> N<small>ETHINA, EINE</small> J<small>ISRAÉLITIN, DIE EINEN</small> N<small>ATHIN ODER EIN</small> H<small>URENKIND GEHEIRATET</small>$fn4 <small>HAT</small>. W<small>ENN EINE</small> [F<small>RAU</small>] W<small>ITWE UND</small> G<small>ESCHIEDENE</small>$fn5 <small>IST, SO IST MAN IHRETWEGEN WEGEN ZWEIER</small> V<small>ERBOTE STRAFBAR; WENN EINE</small> G<small>ESCHIEDENE UND</small> Ḥ<small>ALUÇA IST, SO IST MAN IHRETWEGEN NUR WEGEN EINES</small> V<small>ERBOTS</small>$fn6 <small>STRAFBAR</small>. <sup>ii</sup> F<small>ERNER: EIN</small> U<small>NREINER, DER</small> H<small>EILIGES GEGESSEN HAT, WER UNREIN IN DAS</small> H<small>EILIGTUM EINGETRETEN IST, WER</small> T<small>ALG</small>, B<small>LUT</small>, Ü<small>BRIGGEBLIEBENES</small>, V<small>ERWERFLICHES ODER</small> U<small>NREINES GEGESSEN HAT, WER AUSSERHALB</small> [<small>DES</small> H<small>EILIGTUMS</small> O<small>PFER</small>] <small>GESCHLACHTET ODER DARGEBRACHT HAT, WER</small> G<small>ESÄUERTES AM</small> P<small>ESAḤFESTE GEGESSEN HAT, WER AM</small> V<small>ERSÖHNUNGSTAGE GEGESSEN ODER EINE</small> A<small>RBEIT VERRICHTET HAT, WER DAS</small> S<small>ALBÖL ODER DIE</small> S<small>PEZEREIEN</small>$fn7 <small>NACHGEMACHT HAT, WER SICH MIT DEM</small> S<small>ALBÖL GESCHMIERT HAT, WER</small> A<small>AS</small>, T<small>OTVERLETZTES</small>, E<small>KEL- ODER</small> K<small>RIECHTIERE GEGESSEN HAT, WER</small> U<small>NVERZEHNTETES, ERSTEN</small> Z<small>EHNTEN, VON DEM DIE</small> H<small>EBE NICHT ENTRICHTET WORDEN IST, ODER ZWEITEN</small> Z<small>EHNTEN UND</small> H<small>EILIGES, DIE NICHT AUSGELÖST WORDEN SIND, GEGESSEN HAT</small>. W<small>IEVIEL MUSS MAN VOM</small> U<small>NVERZEHNTETEN GEGESSEN HABEN, UM STRAFBAR ZU SEIN</small>? R. Š<small>IMO͑N SAGT</small>: <small>ETWAS; DIE</small> W<small>EISEN SAGEN: EIN OLIVENGROSSES</small> [Q<small>UANTUM</small>], R. <small>ŠIMO͑N SPRACH ZU IHNEN</small>: W<small>OLLT IHR MIR ETWA NICHT BEIPFLICHTEN, DASS, WER EINE NOCH SO KLEINE</small> A<small>MEISE GEGESSEN HAT, STRAFBAR</small>$fn8 <small>SEI</small>? S<small>IE ERWIDERTEN IHM</small>: W<small>EIL DIESE SO ERSCHAFFEN</small>$fn9 <small>IST</small>. E<small>R ENTGEGNETE IHNEN</small>: A<small>UCH EIN</small> W<small>EIZENKORN IST SO ERSCHAFFEN</small>."
Makkot 13a:5,"GEMARA. Er lehrt hier nur von den der Ausrottung Schuldigen, nicht aber von den der Todesstrafe durch das Gericht$fn10Schuldigen, somit vertritt unsere Mišna die Ansicht R. A͑qibas, denn es wird gelehrt: Sowohl die der Ausrottung Schuldigen, als auch die der Todesstrafe durch das Gericht Schuldigen sind im Gesetze von den vierzig Streichen einbegriffen$fn11"
