Index Title,Makkot
Makkot 16b:1,"verpflichtet, nur verliert sich der Anspruch des Proselyten. – Dies ist ja aber beim Eckenlasse der Fall; der Allbarmherzige sagt:$fn101<i>du sollst nicht ahernten die Ecke</i>, [und:] <i>für den Armen, den Fremden sollst du es zurücklassen &amp;c</i>. Hierbei kann sowohl die Ausübung und Nichtausübung [des Gebotes] als auch die Unmöglichmachung und Nichtunmöglichmachung vorkommen!? Wir haben nämlich gelernt: Es ist Gebot, den Eckenlaß von den Halmen abzusondem; hat man ihn nicht von den Halmen abgesondert, so sondere man ihn von den Garben ab; hat man ihn nicht von den Garben abgesondert, so sondere man ihn vom Getreidehaufen ab, bevor man ihn geworfelt hat; hat man ihn bereits geworfelt, so sondere man auch den Zehnten ab und gebe ihm$fn102!? – Nach R. Jišma͑él, welcher sagt, man sondere ihn auch vom Teige ab$fn103. – Aber auch nach R. Jišma͑él kann dies ja vorkommen, wenn er nämlich den Teig aufgegessen hat!? – Vielmehr, [die Worte] ‘dieses und noch eines’ beziehen sich eben auf diese Lehre, nicht aber auf den Fall vom Notzüchter, denn nur bei einer freigestellten Handlung kann ein im Namen der Öffentlichkeit abgelegtes Gelübde nicht aufgelöst werden, zur Ausübung eines Gebotes aber kann es wohl aufgelöst$fn104werden. So ließ einst R. Aḥa einen Kinderlehrer [den Unterricht] abgeloben; später aber setzte ihn Rabina wieder ein, weil er keinen gefunden hatte, der so gründlich war wie dieser."
Makkot 16b:2,"W<small>ER</small> A<small>AS</small>, T<small>OTVERLETZTES</small>, E<small>KEL- ODER</small> K<small>RIECHTIERE GEGESSEN HAT</small> &amp;<small>C</small>. R. Jehuda sagte: Wer einen Kohlwurm$fn105gegessen hat, ist zu geißeln wegen [Essens von] Bodengewürm. Einst aß jemand einen Kohlwurm, und R. Jehuda ließ ihn geißeln."
Makkot 16b:3,"Abajje sagte: Wer eine Putitha$fn106gegessen hat, ist vierfach$fn107zu geißeln, wenn eine Ameise, fünffach, auch wegen [des Essens von] Bodenreptilien, und wenn eine Hornis, sechsfach, auch wegen [des Essens von] Geflügelreptilien."
Makkot 16b:4,"R. Aḥaj sagte: Wer seinen Stuhlgang zurückhält, begeht das Verbot: $fn108<i>macht euch nicht abscheulich</i>."
Makkot 16b:5,"R. Bebaj b. Abajje sagte: Wer aus einem Baderhorn$fn109trinkt, begeht das Verbot: <i>macht euch nicht abscheulich</i>."
Makkot 16b:6,"Raba b. R. Hona sagte: Wer neun Ameisen zerdrückt und dazu noch [lebendige] hinzufügt und damit das ganze zu einem olivengroßen Quantum ergänzt hat, erhält sechs Geißelhiebe, fünffach wegen der lebendigen und einmal wegen eines olivengroßen Stückes Aas. Raba sagte im Namen R. Joḥanans: Selbst wenn zwei$fn110und eine [lebendige]. R. Joseph sagte im Namen R. Joḥanans: Selbst eine und eine [lebendige]. Sie streiten aber nicht; eines gilt von großen und eines gilt von kleinen."
Makkot 16b:7,"W<small>EH</small> U<small>NVERZEHNTETES, ERSTEN</small> Z<small>EHNTEN</small> &amp;<small>C. GEGESSEN HAT</small>. Rabh sagte: Wer [Früchte] gegessen hat, von denen der Armenzehnt$fn111nicht entrichtet worden ist, ist zu geißeln. Also nach der Ansicht des Autors der folgenden Lehre: R. Jose sagte: Man könnte glauben, man sei nur wegen des Unverzehnteten strafbar, von dem keine [der Abgaben] abgehoben worden ist, woher dies von dem Falle, wenn davon die große Hebe$fn112 und nicht der erste Zehnt abgehoben worden ist, oder auch der erste Zehnt und nicht der zweite Zehnt, oder sogar nur der Armenzehnt? Hierbei heißt es:$fn113<i>nicht darfst du essen in deinen Ortschaften &amp;c</i>., und dort$fn114heißt es: <i>sie sollen ihn in deinen Ortschaften essen und sich sättigen</i>; wie nun dort vom Armenzehnten gesprochen wird, ebenso ist auch hierbei der Armenzehnt zu verstehen, und der Allbarmherzige sagt, daß man [unverzehntet] nicht [essen] dürfe. R. Joseph sagte: [Hierüber streiten] Tannaím: R. Elie͑zer sagt, man brauche den Armenzehnt von Demaj nicht mit dem Namen$fn115zu bezeichnen; die Weisen sagen, man müsse"
Makkot 17a:1,"ihn bezeichnen, jedoch braucht man ihn nicht$fn116abzusondern. Ihr Streit besteht ja wahrscheinlich in folgendem: nach der einen Ansicht macht er Zweifelloses$fn117unverzehntet, und nach einer Ansicht macht er Zweifelloses nicht unverzehntet. Abajje sprach zu ihm: Weshalb streiten sie demnach über Zweifelhaftes$fn118, sie sollten ja über Zweifelloses streiten!? Vielmehr sind alle der Ansicht, er mache Zweifelloses verzehntet, und ihr Streit besteht in folgendem: einer ist der Ansicht, Leute aus dem gemeinen Volke$fn119seien hinsichtlich des Armenzehnten nicht verdächtig$fn120, und die Rabbanan sind der Ansicht, da dies ihnen lästig ist, entrichten sie ihn nicht."
Makkot 17a:2,"W<small>IEVIEL MUSS MAN VOM</small> U<small>NVERZEHNTETEN GEGESSEN HABEN</small> &amp;<small>C</small>. R. Bebaj sagte im Namen des R. Šimo͑n b. Laqiš, ihr Streit bestehe nur über ein Weizenkorn, beim Mehl aber stimmen alle überein, daß nur ein olivengroßes Quantum [strafbar sei]. R. Jirmeja aber sagte im Namen des R. Šimo͑n b. Laqiš, wie sie über das eine streiten, so streiten sie auch über das andere. – Wir haben gelernt: R. Šimo͑n sprach zu ihnen: Wollt ihr mir etwa nicht beipflichten, daß, wer eine noch so kleine Ameise gegessen hat, strafbar sei? Sie erwiderten ihm: Weil diese so erschaffen ist. Er entgegnete ihnen: Auch ein Weizankorn ist so erschaffen. Also nur ein Weizenkorn, Mehl aber nicht!? – Dies erwiderte er ihnen nach ihrer Ansicht: nach meiner Ansicht gilt dies auch vom Mehl, aber ihr müßt mir ja beipflichten, daß auch nach eurer Ansicht ein Weizenkorn ebenfalls so erschaffen ist. – Und die Rabbanan!? – Ein lebendes Geschöpf hat eine wesentliche Bedeutung, ein Weizenkom aber nicht. Übereinstimmend mit R. Jirmeja wird auch gelehrt: R. Šimo͑n sagte: Hinsichtlich der Geißelung ist jedes Quantum [strafbar]; die Olivengröße$fn121gilt nur hinsichtlich des Opfers."
Makkot 17a:3,"<sup>iii</sup> <b>W</b><small>ER</small> E<small>RSTLINGE GEGESSEN HAT, BEVOR ER DARÜBER</small> [<small>DIE</small> E<small>ULOGIE</small>]$fn122 <small>GELESEN HAT</small>, H<small>OCHHEILIGES AUSSERHALB DER</small> V<small>ORHÄNGE</small>, M<small>INDERHEILIGES ODER ZWEITEN</small> Z<small>EHNTEN AUSSERHALB DER</small> S<small>TADTMAUER, ODER WER EINEN</small> K<small>NOCHEN VOM</small> [<small>LEVITISCH</small>] <small>REINEN</small> P<small>ESAḤLAMME ZERBROCHEN</small>$fn123<small>HAT, ERHÄLT DIE VIERZIG</small> S<small>TREICHE; WER ABER VON EINEM REINEN</small> [P<small>ESAḤLAMME</small>] <small>ETWAS ZURÜCKGELASSEN</small>$fn124<small>HAT, ODER VON EINEM UNREINEN</small> [<small>EINEN</small> K<small>NOCHEN</small>] <small>ZERBROCHEN HAT, ERHÄLT NICHT</small>$fn125<small>DIE VIERZIG</small> S<small>TREICHE</small>. <sup>iv</sup> W<small>ER DIE</small> M<small>UTTER</small>$fn126<small>SAMT DEN</small> J<small>UNGEN GENOMMEN HAT, IST, WIE</small> R. J<small>EHUDA SAGT, ZU GEISSELN, UND ER LASSE</small> [<small>DIE</small> M<small>UTTER</small>] <small>NICHT MEHR FLIEGEN; DIE</small> W<small>EISEN SAGEN, ER LASSE SIE FLIEGEN UND ER IST NICHT ZU GEISSELN</small>. D<small>IE</small> R<small>EGEL HIERBEI IST: WEGEN EINES</small> V<small>ERBOTES, DEM SICH EIN</small> G<small>EBOT ANSCHLIESST, IST MAN NICHT STRAFBAR</small>."
Makkot 17a:4,"GEMARA. Rabba b. Bar Ḥana sagte im Namen R. Joḥanans: Dies ist die Ansicht des Anonymus R. A͑qiba, die Weisen aber sagen, bei den Erstlingen hänge es nur vom Niederlegen$fn127ab und nicht vom Lesen$fn128. – Er könnte ja sagen, dies sei die Ansicht des Anonymus R. Šimo͑n!? – Folgendes lehrt er uns: R. A͑qiba ist derselben Ansicht wie R. Šimo͑n. – Was ist dies für eine Lehre R. Šimo͑ns? –Es wird gelehrt:$fn129<i>Deiner Hände Hebe</i>, das sind die Erstlinge. R. Šimo͑n sprach: Was will er uns damit lehren: wenn etwa [das Verbot] des Essens außerhalb der Stadtmauer, so ist dies ja [durch einen Schluß] vom Leichteren auf das Schwerere, von leichteren Zehnten zu folgern: wenn wegen des Essens des leichteren Zehnten außerhalb der Stadtmauer zu geißeln ist, um wieviel mehr wegen der Erstlinge? Vielmehr lehrt die Schrift damit, daß wegen des Essens der Erstlinge, bevor man darüber [die Eulogie] gelesen hat, zu geißeln ist.$fn129<i>Deine freiwilligen Spenden</i>, das sind das Dank- und das Heilsopfer. R. Šimo͑n sprach: Was will er uns damit lehren: wenn etwa [das Verbot] des Essens außerhalb der Stadtmauer, so ist dies ja [durch einen Schluß] vom Leichteren auf das Schwerere vom Zehnten$fn130zu folgern. Vielmehr lehrt die Schrift damit, daß wegen des Essens vom Dank- und vom Heilsopfer vor dem Blutsprengen zu geißeln ist.$fn129<i>Und die Erstgeborenen</i>, das ist das Erstgeborene$fn131. R. Šimo͑n sprach: Was will er uns damit lehren: wenn etwa [das Verbot] des Essens außerhalb der Stadtmauer, so ist dies ja [durch einen Schluß] vom Leichteren auf das Schwerere$fn132vom Zehnten$fn130zu folgern, und wenn etwa [des Eissens] vor dem Blutsprengen, so ist dies ja [durch einen Schluß] vom Leichteren auf das Schwerere vom Dank- und vom Heilsopfer zu folgern. Vielmehr lehrt die Schrift damit, daß wegen des Essens vom Erstgeborenen, selbst nach dem Blutsprengen, zu geißeln ist.$fn129<i>Deiner Rinder und Schafe</i>, das sind Sünd- und Schuldopfer. R. Šimo͑n sprach: Was will er uns damit lehren: wenn etwa [das Verbot] des Essens außerhalb der Stadtmauer, so ist dies ja [durch einen Schluß] vom Leichteren auf das Schwerere vom Zehnten$fn130zu folgern, wenn etwa [des Essens] vor dem Blutsprengen, so ist dies ja [durch einen Schluß] vom Leichteren auf das Schwerere vom Dank- und vom Heilsopfer zu folgern, und wenn etwa [des Essens] nach dem Blutsprengen, so ist dies ja [durch einen Schluß] vom Leichteren auf das Schwerere vom Erstgeborenen zu folgern? Vielmehr lehrt die Schrift damit, daß wegen des Essens vom Sünd- und vom Schuldopfer außerhalb der Tempelmauer, selbst nach dem Sprengen, zu geißeln ist.$fn129<i>Deiner Gelübde[opfer]</i>, das ist das Brandopfer. R. Šimo͑n sprach: Was will er uns damit lehren: wenn etwa [das Verbot] des Essens außerhalb der Stadtmauer, so ist dies ja [durch einen Schluß] vom Leichteren auf das Schwerere vom Zehnten zu folgern, wenn etwa [des Essens] vor dem Blutsprengen, so ist dies ja [durch einen Schluß] vom Leichteren auf das Schwerere vom Dank- und vom Heilsopfer zu folgern, wenn etwa [des Essens] nach dem Blutsprengen, so ist dies ja [durch einen Schluß] vom Leichteren auf das Schwerere von der Erstgeburt zu folgern, und wenn etwa [des Essens] außerhalb der Tempelmauer, so ist dies ja [durch einen Schluß] vom Leichteren auf das Schwerere vom Sünd- und vom Schuldopfer zu folgern? Vielmehr lehrt die Schrift damit, daß wegen"
Makkot 17b:1,"des Essens vom Brandopfer nach dem Blutsprengen, selbst innerhalb [des Tempelhofes] zu geißeln ist. Raba sprach: Bekommt seine Mutter einen Sohn wie$fn133R. Šimo͑n, so mag sie gebären, sonst aber mag sie überhaupt nicht gebären. Trotzdem [jene Schlüsse] widerlegbar sind. Bei den Erstlingen ist es insofern schwerer als beim Zehnten, indem sie Gemeinen verboten sind, aber beim Zehnten ist es im Gegenteil schwerer, indem er Trauernden verboten ist. Beim Dank- und beim Heilsopfer ist es insofern schwerer als beim Zehnten, indem bei ihnen Blutsprengen und Darbringung der Opferteile auf dem Altar erforderlich sind, aber beim Zehnten ist es im Gegenteil schwerer, indem bei diesem [zur Auslösung] gemünztes Geld$fn134erforderlich ist. Beim Erstgeborenen ist es insofern schwerer als beim Dank- und beim Heilsopfer, indem es vom Mutterleibe aus heilig ist, aber beim Dank- und beim Heilsopfer ist es im Gegenteil schwerer, denn bei diesen ist das Stützen$fn135und das Schwingen von Brust und Schenkel$fn136erforderlich. Beim Sünd- und beim Schuldopfer ist es insofern schwerer als beim Erstgeborenen, indem sie hochheilig sind, aber beim Erstgeborenen ist es schwerer, indem es vom Mutterleibe aus heilig ist. Beim Brandopfer ist es insofern schwerer als beim Sünd- und beim Schuldopfer, indem es vollständig [verbrannt] wird, aber beim Sündund beim Schuldopfer ist es schwerer, indem sie Sühne verschaffen. Bei allen ist es ferner schwerer als beim Brandopfer, indem es bei ihnen zweierlei Verzehrungen$fn137gibt. – Wieso sagt er demnach: Bekommt seine Mutter einen Sohn wie R. Šimo͑n$fn138!? – Er setzte den Schriftvers um$fn139 und legte ihn nach seiner Ansicht aus. – Kann denn eine Verwarnung$fn140 durch einen Schluß gefolgert werden; selbst nach demjenigen, welcher sagt, eine Bestrafung könne durch einen Schluß gefolgert werden, kann ja keine Verwarnung durch einen Schluß gefolgert werden!? – Nur als verbotene Handlung$fn141. – Raba sagte ja aber, wenn ein Gemeiner etwas vom Brandopfer vor dem Blutsprengen außerhalb der Stadtmauer gegessen hat, sei er nach R. Šimo͑n fünffach$fn142zu geißeln!? – Es ist nur eine fünffach verbotene Handlung. – Wir haben ja aber gelernt: folgende$fn143sind"
Makkot 18a:1,"zu geißeln!? – Vielmehr, der ganze Schriftvers ist überflüssig; es heißt ja:$fn144<i>du sollst essen vor dem Herrn, deinem Gott, in der Stätte &amp;c</i>., somit sollte der Allbarmherzige darauf schreiben: du darfst diese nicht$fn145essen, wozu wiederholt$fn146er sie? Um für jedes besonders ein Verbot hervorzuheben."
Makkot 18a:2,"Der Text. Raba sagte: Wenn ein Gemeiner etwas vom Brandopfer vor dem Blutsprengen außerhalb der Stadtmauer gegessen hat, so ist er nach R. Šimo͑n fünffach zu geißeln. – Sollte er gegeißelt werden auch wegen [des Verbotes]$fn147<i>ein Gemeiner soll nichts Heiliges essen</i>!? – Dies gilt nur von dem, was für Priester geeignet ist, dieses aber ist auch für Priester ungeeignet. – Sollte er doch gegeißelt werden auch wegen [des V erbotes :]$fn148<i>Zerrissenes Fleisch auf dem Felde sollt ihr nicht essen</i>, [und hieraus wird gefolgert:] sobald das Fleisch aus seinem Gebiete$fn149gekommen ist, sei es verboten!? – Dies gilt nur von dem, das innerhalb [zu essen] geeignet ist, dieses aber ist auch innerhalb ungeeignet. – Sollte er doch gegeißelt werden auch wegen einer Lehre R. Elie͑zers!? R. Elie͑zer sagte nämlich :$fn150<i>Er darf nicht davon essen, denn es ist heilig</i>, alles,"
Makkot 18b:1,"was vom Heiligen untauglich ist; die Schrift belegt das Essen mit einem Verbote. – Dies gilt nur von dem, was vor dem Untauglichwerden geeignet war, dieses aber war auch vor dem Untauglichwerden ungeeignet. – Sollte er doch gegeißelt werden auch wegen einer anderen Lehre R. Elie͑zers!? Es wird nämlich gelehrt: R. Elie͑zer sagte: Es heißt:$fn151<i>sie sollen vollständige [Opfer] sein</i>, damit wird das Essen mit einem Verbote belegt. – Dem ist auch so, und auch Raba entnimmt das Verbot aus diesem Schriftverse."
Makkot 18b:2,"R. Gidel sagte im Namen Rabhs: Wenn ein Priester von einem Sündoder Schuldopfer vor dem Blutsprengen gegessen hat, so ist er zu geißeln. – Aus welchem Grunde? – Die Schrift sagt:$fn152<i>sie sollen das verzehren, womit Sühne vollzogen wurde</i>, nicht aber vor [Vollziehung] der Sühne$fn153, und ein Verbot, das aus einem Gebote kommt, gilt als Verbot. Raba wandte ein:$fn154<i>Und jedes Tier, das behuft ist und in zwei Teile gespaltene Klauen hat und wiederkauend ist unter den Tieren, dürft ihr essen</i>; nur diese dürft ihr essen, nicht aber dürft ihr andere Tiere essen. Wozu heißt es nach deiner Auffassung:$fn155<i>folgende dürft ihr nicht essen</i>!? – Vielmehr, ist dies gesagt worden, so wird es wie folgt lauten: R.Gidel sagte im Namen Rabhs: Wenn ein Gemeiner von einem Sünd- oder Schuldopfer vor dem Blutsprengen gegessen hat, so ist er straffrei, denn die Schrift sagt: <i>sie sollen das verzehren, womit Sühne vollzogen wurde</i>; wo der Schriftvers: <i>sie sollen das verzehren, womit Sühne vollzogen wurde</i>, Geltung hat, gilt auch der Schriftvers: ein <i>Gemeiner soll davon nicht essen, denn es ist heilig</i>, wo aber der Schriftvers: <i>sie sollen das verzehren, womit Sühne vollzogen wurde</i>, keine Geltung hat, hat auch der Schriftvers: <i>ein Gemeiner soll davon nicht essen</i>, keine Geltung."
Makkot 18b:3,"R. Elea͑zar sagte im Namen R. Hoša͑jas: Bei den Erstlingen ist nur das Niederlegen unerläßlich, nicht aber ist das Lesen [der Eulogie] unerläßlich. – Kann R. Elea͑zar dies denn gesagt haben, R. Elea͑zar sagte ja im Namen R. Hoša͑jas, wenn jemand vor dem Feste$fn156Erstlinge abgesondert hat und das Fest verstrichen ist, müsse man sie verfaulen lassen, doch wohl, weil man über sie [die Eulogie] nicht mehr lesen kann. Weshalb muß man sie nun verfaulen lassen, wenn man sagen wollte, das Lesen sei nicht unerläßlich!? – Dies nach R. Zera, denn R. Zera sagte: Bei dem, was zum Umrühren$fn157geeignet ist, ist das Umrühren nicht unerläßlich, und bei dem, was zum Umrühren nicht geeignet ist, ist das Umrühren unerläßlich. R. Aḥa b. Ja͑qob lehrte dies im Namen R. Asis im Namen R. Joḥanans, und wies auf einen Widerspruch hin, in dem R. Joḥanan sich befindet: Kann R. Joḥanan denn gesagthaben, bei den Erstlingen sei das Niederlegen unerläßlich und das Lesen [der Eulogie] nicht unerläßlich. R. Asi fragte ja R. Joḥanan, von wann ab die Erstlinge den Priestern erlaubt sind, und er erwiderte ihm: über die [die Eulogie] zu lesen$fn158ist, sobald man sie gelesen hat, und über die man sie nicht mehr lesen kann, sobald sie die Front des Tempels gesehen$fn159haben. Er befindet sich somit in einem Widerspruche sowohl hinsichtlich des Lesens, als auch hinsichtlich des Niederlegens$fn160!? – Hinsichtlich des Lesens besteht kein Widerspruch, denn eines gilt nach R. Šimo͑n$fn161und eines gilt nach den Rabbanan; hinsichtlich des Niederlegens besteht ebenfalls kein Widerspruch, denn eines gilt nach R. Jehuda$fn162und eines gilt nach den Rabbanan. – Welche Lehre R. Jehudas ist es? – Es wird gelehrt: R. Jehuda sagte :$fn163<i>Du sollst niederlegen</i>, darunter ist das Schwingen$fn164zu verstehen. Du sagst das Schwingen, vielleicht ist dem nicht so, sondern das Niederlegen, in der wörtlichen Bedeutung? Wenn es heißt :$fn165<i>er lege nieder</i>, so ist ja schon vom Niederlegen die Rede, somit ist unter <i>du sollst niederlegen</i> das Schwingen zu verstehen. – Wer ist der Autor, der gegen R. Jehuda streitet? – Es ist R. Elie͑zer b. Ja͑qob; denn es wird gelehrt :$fn165<i>Der Priester nehme den Korb aus deiner Hand</i>, dies lehrt, daß die Erstlinge des Schwingens benötigen – so R. Elie͑zer b. Ja͑qob$fn166. – Was ist der Grund des R. Elie͑zer b. Ja͑qob? – Er folgert dies aus [dem Worte] <i>Hand</i>, das auch beim Heilsopfer gebraucht wird; hier heißt es: <i>der Priester nehme den Korb aus deiner Hand</i>, und dort$fn167heißt es: <i>seine Hände sollen die Feueropfer des Herrn bringen;</i> wie hier der Priester, ebenso auch dort der Priester, und wie dort der Eigentümer, ebenso auch hier der Eigentümer. Auf welche Weise? Der Priester lege seine Hände unter die Hände des Eigentümers und schwinge."
Makkot 18b:4,Raba b. Ada sagte im Namen R. Jiçḥaqs: Von wann ab ist man wegen
Makkot 19a:1,"der Erstlinge$fn168strafbar? Sobald sie die Front des Tempels gesehen haben. Also nach dem Autor der folgenden Lehre: R. Elie͑zer sagte: Wenn von den Erstlingen ein Teil außerhalb und ein Teil innerhalb [des Tempelhofes] sich befindet, so gelten diejenigen, die sich außerhalb befinden, in jeder Hinsicht als Profanes, und die sich innerhalb befinden, in jeder Hinsicht als Heiliges."
Makkot 19a:2,"R. Šešeth sagte: Bei den Erstlingen ist das Niederlegen unerläßlich, nicht aber ist das Lesen [der Eulogie] unerläßlich. Also nach dem Autor der folgenden Lehre: R. Jose bekundete drei Dinge im Namen von drei Ältesten. R. Jišma͑él sagte: Man könnte glauben, man dürfe in der Jetztzeit den zweiten Zehnten nach Jerušalem bringen und ihn da [unausgelöst] essen. Dies wäre durch einen Schluß zu folgern: das Erstgeborene benötigt des Hinbringens nach der Stätte$fn169, und ebenso benötigt auch der zweite Zehnt des Hinbringens nach der Stätte, wie nun das Gesetz vom Erstgeborenen nur zur Zeit des Tempels Geltung hat, ebenso auch [die Auslösung] des Zehnten nur zur Zeit des Tempels. [Wenn man einwendet:] wohl das Erstgeborene, weil bei diesem Blutsprengen und Darbringung der Opferteile auf dem Altar erforderlich$fn170ist, so beweisen die Erstlinge [das Entgegengesetzte$fn171. Doch ist zu erwidern:] wohl die Erstlinge, die des Niederlegens$fn172nicht benötigen. Daher heißt es:$fn173<i>du sollst essen vor dem Herrn, deinem Gott &amp;c.;</i> er vergleicht also den Zehnten mit den Erstgeborenen, wie [das Gesetz vom] Erstgeborenen nur zur Zeit des Tempels Geltung hat, ebenso auch [die Auslösung des] Zehnten nur zur Zeit des Tempels. Wenn dem nun so$fn174wäre, so sollte er doch eingewandt haben: wohl die Erstlinge, weil sie des Lesens [der Eulogie] und des Niederlegens benötigen. R. Aši erwiderte: Wenn man auch zugibt, daß es nicht unerläßlich ist, so ist es ja aber immerhin Gebot, somit könnte er dies ja auch auf Grund des Gebotes eingewandt haben!? Vielmehr, sagte R. Aši, da auch der Proselyt die Erstlinge darbringen muß, der sagen müßte :$fn175<i>das der Herr unseren Vorfahren durch einen Schwur verheißen hat</i>, was er doch nicht kann, so wäre [dieser Einwand] nicht stichhaltig. – Sollte er doch das Resultat$fn176 zusammengefaßt und [einen Schluß] durch das Gemeinsame$fn176an ihnen gefolgert haben!? – Dagegen wäre zu erwidern: das Gemeinsame bei ihnen ist, daß beide zum Altar gelangen$fn177. – Welcher Ansicht ist er: ist er der Ansicht, die erste Heiligung$fn178galt sowohl für die damalige Zeit als auch für die Zukunft$fn179, so sollte dies auch hinsichtlich des Erstgeborenen gelten, und ist er der Ansicht, die erste Heiligung galt nur für die damalige Zeit und nicht für die Zukunft, so sollte es ihm auch hinsichtlich des Erstgeborenen fraglich$fn180sein!? Rabina erwiderte: Tatsächlich ist er der Ansicht, [die erste Heiligung] galt für die damalige Zeit und für die Zukunft, nur handelt es sich hier um ein Erstgeborenes, dessen Blut vor der Zerstörung des Tempels gesprengt wurde, und der Tempel darauf zerstört worden und das Fleisch noch vorhanden ist. Man vergleiche das Fleisch mit dem Blute: wie zum [Sprengen des] Blutes der Altar erforderlich ist, ebenso ist zum [Genüsse des] Fleisches der Altar erforderlich, und ferner vergleiche man den Zehnten mit dem Erstgeborenen. – Kann man denn von dem, was durch Vergleichung gefolgert wird, anderes durch Vergleichung folgern!? – Der Getreidezehnt"
Makkot 19b:1,"ist Profanes$fn181. – Allerdings nach demjenigen, welcher sagt, man richte sich hierbei nach dem, was gefolgert wird, wie ist es aber zu erklären nach demjenigen, welcher sagt, man richte sich hierbei nach dem, wovon gefolgert wird!? – Das Blut und das Fleisch gehören zusammen$fn182."
Makkot 19b:2,"H<small>OCHHEILIGES</small> &amp;<small>C</small>. Dies$fn183haben wir ja bereits gelernt: zweiten Zehnten und Heiliges, die nicht ausgelöst worden sind!? R. Jose b. Hanina erwiderte: Die zweite Lehre handelt von dem Falle, wenn ein Reiner reinen zweiten Zehnten außerhalb der Stadtmauer gegessen hat, und die erste Lehre handelt von dem Falle, wenn ein Unreiner [reinen, oder ein Reiner] unreinen zweiten Zehnten in Jerušalem [unausgelöst] gegessen hat. – Woher, daß man dabei wegen [Essens in] Unreinheit strafbar ist? – Es wird gelehrt: R. Šimo͑n sagte :$fn184<i>Ich habe nichts davon in Unreinheit fortgeschafft</i>, einerlei ob ich unrein und dieser rein, oder ich rein und dieser unrein war. Wo das Verbot des Essens [in Unreinheit] sich befindet, weiß ich nicht$fn185. – Von der Unreinheit des Körpers heißt es ja ausdrücklich :$fn186<i>wer solches berührt, ist unrein bis zum Abend und darf nichts Heiliges essen</i>!? – Vielmehr, woher dies von der Unreinheit [des Zehnten] selber. Hierbei$fn187heißt es: <i>du darfst in deinen Ortschaften nicht essen</i>, und dort$fn188heißt es: <i>in deinen Ortschaften sollst du es essen, rein oder unrein</i>. Ferner wurde in der Schule R. Jišma͑éls gelehrt: Ein Unreiner und ein Reiner dürfen davon ohne Rückhalt aus einer Schüssel$fn189essen. Und der Allbarmherzige sagt, das Essen in Unreinheit, das ich dir hierbei$fn190erlaubt habe, ist dort$fn191 verboten. – Woher, daß solcher ausgelöst werden kann? – R. Elea͑zar sagte: Woher, daß man den zweiten Zehnten, wenn er unrein wird, auch in Jerušalem auslösen kann? Es heißt :$fn192<i>wenn du es nicht tragen kannst</i>, und unter ‘tragen’ ist ‘essen’ zu verstehen, denn es heißt :$fn193<i>er ließ ihnen von ihm her Tischgaben auftragen</i>."
Makkot 19b:3,"R. Bebaj sagte im Namen R. Asis: Woher, daß man den zweiten Zehnten auslösen kann, selbst wenn er sich nur einen Schritt außerhalb der Stadtmauer$fn194befindet? Es heißt: <i>wenn du es nicht tragen kannst</i>$fn195. – Dieser [Schriftvers] ist ja für die Lehre R. Elea͑zars nötig!? – Es könnte ja heißen: nicht essen kannst, und es heißt: tragen. – Vielleicht deutet er n ur auf diese Lehre!? – Es könnte ja heißen: nicht anfassen kannst, wenn es aber tragen heißt, so ist hieraus beides zu entnehmen."
Makkot 19b:4,"R. Ḥananja und R. Hoša͑ja saßen vor dem Tore von Jerušalem und warfen folgende Frage auf: Selbstverständlich hat, wenn er außerhalb und sein Gepäck$fn196innerhalb sich befindet, die Mauer es aufgenommen$fn197; wie ist es aber, wenn er innerhalb und sein Gepäck außerhalb$fn198sich befindet!? – Da rezitierte ihnen ein Greis [eine Lehre] aus der Schule des R. Šimo͑n b. Joḥaj :$fn199<i>Wenn die Stätte zu weit von dir entfernt ist</i>, von deiner ganzen Ausdehnung$fn200. R. Papa fragte: Wie ist es, wenn man es an einem Stabe$fn201trägt? – Dies bleibt unentschieden."
