Jerusalem Talmud Berakhot,1,1,2a,"@תיפתר באילין כופרניא.# — ע' במ""ה ז""ח פי בראשית.",Jerusalem Talmud Berakhot 1:1:2,"<strong><big>הלכה:</big></strong> <i data-overlay=""Venice Columns"" data-value=""2a""></i>מֶאֵימָתַי קוֹרִין אֶת שְׁמַע בָּעֲרָבִין. אֲנָן תַּנִּינָן מִשָּׁעָה שֶׁהַכֹּהֲנִים נִכְנָסִין לוֹכֵל בִּתְּרוּמָתָן. תַּנִּי רִבִּי חִיָּיא מִשָּׁעָה שֶּׁדֶּרֶךְ בְּנֵי אָדָם נִכְנָסִין לֶאֱכוֹל פִּיתָּן בְּלֵילֵי שַׁבָּת. וְתַנִּי עֲלָהּ קְרוֹבִין דִּבְרֵיהֶן לִהְיוֹת שָׁוִין. <i data-overlay=""Vilna Pages"" data-value=""1b""></i>אִיתָא חָמֵי מִשָּׁעָה שֶׁהַכֹּהֲנִים נִכְנָסִין לוֹכֵל בִּתְּרוּמָתָן יְמָמָא הוּא וְעִם כּוֹכְבַיָּא הוּא. מִשָּׁעָה שֶּׁדֶּרֶךְ בְּנֵי אָדָם נִכְנָסִין לֶאֱכוֹל פִּיתָּן בְּלֵילֵי שַׁבָּת שָׁעָה וְתַרְתֵּי לֵיְלִיָּא הוּא. וְאַתְּ אָמַר קְרוֹבִין דִּבְרֵיהֶן לִהְיוֹת שָׁוִין. אָמַר רִבִּי יוֹסֵי תִּפְתָּר בְּאִלֵּין כּוּפְרָנַיָּא דְקִיקַיָּא דְּאוֹרְחֵיהוֹן מִסְתַּלְּקָא עַד דְּהוּא יְמָמָא דְצָדִי לוֹן מִקַּמֵּי חַיּוּתָא."
Jerusalem Talmud Peah,7,1,20c,"@עד שיהא בציר בצד הבציר.# — גי' הגר""א: בשעת הבציר, ולדעתי צ""ל כדרך הבציר"
Jerusalem Talmud Peah,7,1,20c,"@שהן עושין רביע.# — צ""ל: שהן עושין @רביעית#."
Jerusalem Talmud Peah,7,1,20c,"@צריכה לרבנין.# — פי' מ""מ מספקא לרבנן אם מותרין בפירות והדר מיבעיא במקדיש שדה אילן אם שייר בגידולין הנמצאין עתה באילנות דהא דגידולי הקדש אסורין אינו אלא בגידולין הבאין לאחר מכאן שגדלו בשדה הקדש. והא דתנן במעילה י""ג א' בהקדיש אילן מלא פירות מועלין במה שבתוכו י""ל דהיינו בהקדיש הפירות בפירוש ומשום סיפא תני לה ע""ש."
Jerusalem Talmud Peah,8,1,20d,"@שאין אדם עושה בדבר ערוה.# — גירסת הגר""א: שאין אדם עושה @מצוה בדבר עבירה#, ופירושו דאף כרבנן דסברי דאפשר שהפריש מע""ש ולא הפריש מעשר ראשון מ""מ כשנתן מעשר עני מודים דודאי הפריש מעשר ראשון דנותן לעני מצוה קעביד ואין עושה מצוה בדבר עבירה אבל מע""ש שהוא לעצמו אין זה אצלו מצוה כל כך.",Jerusalem Talmud Peah 8:2:3,רִבִי לָֽעְזָר דְּרוֹמָיָה בְּעֵי קוֹמֵי רִבִּי יוֹסֵי. מַתְנִיתִין דְּרִבִּי אֱלִיעֶזֶר דְּרִבִּי אֱלִיעֶזֶר אוֹמֵר נֶאֱמָן עַל הַשֵּׁנִי נֶאֱמָן עַל הָרִאשׁוֹן. אָמַר רִבִּי יוֹסֵי דִּבְרֵי הַכֹּל הִיא שַׁנְייָא הִיא שֶׁאֵין אָדָם עוֹשֶׂה בִּדְבַר עֶרְוָה. רִבִּי לָֽעְזָר בְּשֵׁם רִבִּי הוֹשַׁעְיָא כְּשֵׁם שֶׁלֹּא נֶחְשְׁדוּ יִשְׂרָאֵל עַל תְּרוּמָה גְדוֹלָה כָּךְ לֹא נֶחְשַׁד בֶּן לֵוִי עַל תְּרוּמַת מַעֲשֵׂר. אָמַר רִבִּי הוֹשַׁעְיָה מַתְנִיתִין אָמַר כֵּן וּבֶן לֵוִי נֶאֱמָן לְעוֹלָם.
Jerusalem Talmud Peah,8,1,20d,"@להיות מוסקין.# — צ""ל: להיות @עוצרין# (דמסיקה היינו תלישה ע' שבת פ""ז יו""ד ע""א).",Jerusalem Talmud Peah 8:3:2,"<strong><big>הלכה:</big></strong> מַהוּ שֶׁיְּהֵא נֶאֱמָן לוֹמַר חִיטִּים נִיתַּן לִי וְעָשִׂיתִי אוֹתָן קֶמַח. חִטִּים נִיתַּן לִי וְעָשִׂיתִי אוֹתָן פַּת. פְּשִיטָא לֵיהּ שֶׁהוּא נֶאֱמָן. הָיוּ הַכֹּל יוֹדְעִין שֶׁרוֹב בְּנֵי אָדָם מַכְנִיסוֹ לֶקֶט אֲפִילוּ כֵן אֵינוֹ נֶאֱמָן. <i data-overlay=""Vilna Pages"" data-value=""36a""></i>תַּנִּי רִבִּי יוּדָן אוֹמֵר מָקוֹם שֶׁנָּהֲגוּ לִהְיוֹת דּוֹרְכִין אֶת הָעוֹלֵלוֹת יְהֵא עָנִי נֶאֱמָן לוֹמַר יַיִן זֶה שֶׁל עוֹלֵלוֹת הוּא. וְדִכְווָתֵיהּ מָקוֹם שֶׁנָּהֲגוּ לִהְיוֹת מוֹסְקִין זֵיתֵי נִיקּוּף יְהֵא הֶעָנִי נֶאֱמָן לוֹמַר שֶׁמֶן זֶה שֶׁל זֵיתֵי נִיקּוּף הוּא."
Jerusalem Talmud Peah,8,1,21a,"@צא מהן ג' ליציאה.# — צ""ל: צא מהן @שליש# ליציאה."
Jerusalem Talmud Peah,8,1,21a,"@אין מדקדקין פתר ליה לפי כבודו כו'.# — צ""ל: אין מדקדקין בריא בזמן שאין מכירין כו' והכל לפי כבודו פתר ליה לפי כבודו והתני למזונות. שם ה""ח וחסרוניה חד קרט.# — הוא מין מטבע קטנה ע' ב""מ רפ""ד (וע' מ""ש שם, עמ' 487).",Jerusalem Talmud Peah 8:6:8,"רִבִּי בָּא בַּר זַבְדָּא אָמַר אִיתְפַּלְּגוּן רַב וְרִבִּי יוֹחָנָן חַד אָמַר מְדַקְדְּקִין בִּכְסוּת וְאֵין מְדַקְדְּקִין בְּחַיֵּי נְפָשׁוֹת. וְחָרָנָה אָמַר אַף בִּכְסוּת אֵין מְדַקְדְּקִין מִפְּנֵי בְרִיתוֹ שֶׁל אַבְרָהָם אָבִינוּ. מַתְנִיתָא פְלִיגָא עַל מָאן דְּאָמַר אַף בִּכְסוּת אֵין מְדַקְדְּקִין פָּתַר לֵיהּ לְפִי כְבוֹדוֹ. וְתַנִּי כֵן בְּמַה דְבָרִים אֲמוּרִים בִּזְמָן שֶׁאֵין מַכִּירִין אוֹתוֹ. אֶבָל בִּזְמָן שֶׁמַּכִּירִין אוֹתוֹ אַף מְכַסִּין אוֹתוֹ וְהַכֹּל לְפִי כְבוֹדוֹ. וְהָתַנִּי לִמְזוֹנוֹת שְׁלֹשִׁים יוֹם. לִכְסוּת שִׁשָּׁה חֳדָשִׁים. פָּתַר לָהּ לִיתֵּן <i data-commentator=""Notes by Heinrich Guggenheimer"" data-label=""100""></i> . וְהָתַנִּי לִמְזוֹנוֹת שְׁלֹשִׁים יוֹם לְפִיסִּין וְלִצְדָּקוֹת שְׁנֵים עָשָׂר חֹדֶשׁ הָא קַדְמִייָתָא לִיטּוֹל. עוֹד הִיא לִיתֵּן. מַהוּ לְפִיסִּין וְלִצְדָּקוֹת שְׁנֵים עָשָׂר חֹדֶשׁ בִּשְׂכַר סוֹפְרִים וּמַשְׁנִים."
Jerusalem Talmud Peah,8,1,21b,"@שמלותיך עליך וירדת הגורן כו' עמך וערטילא הוות כו' דשובתא.# יש להחליף וכצ""ל: שמלותיך עליך וערטילא הוות כו' דשובתא וירדת הגורן כו' עמך (כ""ה במדרש רות רבה לפסוק זה ונגרר משם).",Jerusalem Talmud Peah 8:7:8,"אָמַר רִבִּי חֲנִינָא צָרִיךְ אָדָם שֶׁיְּהוּ לוֹ <i data-overlay=""Venice Columns"" data-value=""21b""></i>שְׁנֵי עֲטִיפִין אֶחָד לְחוֹל וְאֶחָד לְשַׁבָּת. מַה טַעְמָא וְרָחַצְתְּ וָסַכְתְּ וְשַׂמְתְּ שִׂמְלוֹתַיִךְ וְכִי עֲרוּמָּה הָֽיְתָה אֶלָּא אֵלּוּ בִגְדֵּי שַׁבָּתָהּ. כַּד דְּרָשָׁהּ רִבִּי שִׂמְלַאי בְּצִיבּוּרָא בָּכוּן חֲבֵרָייָא לְקוֹבְלֵיהּ אָֽמְרוּ לֵיהּ רִבִּי כַּעֲטִיפוֹתֵינוּ בְּחוֹל כֵּן עֲטִיפוֹתֵינוּ בְּשַׁבָּת. אָמַר לוֹן אַף עַל פִּי כֵן צְרִיכִין אַתֶּם לְשַׁנּוֹת מִן הָדָא וְרָחַצְתְּ וְסַכְתְּ וְשַׂמְתְּ שִׂמְלוֹתַיִךְ עָלַיִךְ וְיוֹרַדְתְּ הַגּוֹרֶן. ויורדתּי כְּתִיב אָמַר לָהּ זְכוּתִי תֵּרֵד עִמָּךְ. וְעַרְטִילָא הֲווָת אֶלָּא אָֽמְרָה לָהּ לְבוֹשׁ מָאנֵךְ דְּשׁוּבְתָּא."
Jerusalem Talmud Demai,1,1,21c,"@ואני משמרה לבעל מלאכתי.# פי' לבה""ב שלי שנתן לי מלאכה להרויח וכעין זה באבות סופ""ב ונאמן הוא בעל מלאכתך (וזה דלא כפירוש רא""פ).",Jerusalem Talmud Demai 1:1:10,"עוּלָּא בַּר יִשְׁמָעֵאל בְּשֵׁם רִבִּי יוֹחָנָן רִבִּי וְרִבִּי יוֹסֵי בֵּי רִבִּי יְהוּדָה נִכְנְסוּ לוֹכַל בִּמְסוּייָפוֹת וְצָווַח בָּהֶן הַשּׁוֹמֵר וּמָשַׁךְ רִבִּי יוֹסֵי בֵּי רִבִּי יוּדָה אֶת יָדָיו. אָמַר לוֹ רִבִּי אֲכוֹל שֶׁכְּבָר נִתְייָאֲשׁוּ הַבְּעָלִים מֵהֶן. רִבִּי יוֹחָנָן בְּעֵי צָווַח וְאַתְּ אָמַר הָכֵן. אָמַר רִבִּי יוֹנָה יְאוּת הוּא מַקְשֵּׁי. וְהָא מַתְנִיתָא <i data-overlay=""Vilna Pages"" data-value=""2a""></i>פְלִיגָא הַסִּיאָה וְהָאֵזוֹב וְהַקּוּרְנִית שֶׁבְּחָצֵר אִם הָיוּ נִשְׁמָרִין חַייָבִין. הָא בְּגִינָּה אֲפִילוּ נִישְׁמָרִין פְּטוּרִין. תַּמָּן יָכוֹל הוּא לוֹמַר לוֹ הֲרֵי כָל־הָעוֹלָם כּוּלּוֹ לְפָנֶיךָ בְּרַם הָכָא כַּלְכָּלָה אַחַת הִיא וַאֲנִי מְשַׁמְּרָהּ לְבַעַל מְלַאכְתִּי."
Jerusalem Talmud Demai,1,1,21d,"@שמא אינו אסור לאונן.# — אינו מובן דספק טבל אסור לכל אדם, ונראה שענין זה שאם הפריש מספק טבל זה מעשר שני הוא אסור לאונן.",Jerusalem Talmud Demai 1:2:3,"תַּנִּי נֶאֱכַל בָּאֳנִינָה וְאֵינוֹ נֵאֱכַל בְּטוּמְאָה. מַה בֵּין אֳנִינָה וּמַה בֵּין טוּמְאָה. אָמַר רַב נַחְמָן טוּמְאָה מְצוּיָה אֳנִינָה אֵינָהּ מְצוּיָה. גָּֽזְרוּ עַל דָּבָר שֶׁהוּא מָצוּי וְלֹא גָֽזְרוּ עַל דָּבָר שֶׁאֵינוֹ מָצוּי. אָמַר רִבִּי יוֹסֵי אֲפִילוּ כְּסָפֵק טֵבֵל לֹא עָשׂוּ אוֹתוֹ. אִילּוּ בְּסָפֵק טֵבֵל<i data-commentator=""Notes by Heinrich Guggenheimer"" data-label=""79""></i> נִיתְקַן מַחְמַת שֵׁנִי סָפֵק לֹא נִיתְקַן שֶׁמָּא אֵינוֹ אָסוּר לְאוֹנָן. בְּרַם הָכָא מוּתָּר לְאוֹנָן."
Jerusalem Talmud Demai,1,1,21d,"@ר' אבא בר זבינא.# — ע' ב' שבת י""ב ב' תוד""ה ר""ני שהעתיקו בשם ביו ר' אבא בר זימנא בשם ר' אלעזר זעירא.",Jerusalem Talmud Demai 1:3:5,"רִבִּי יִרְמְיָה שְׁלַח לְרִבִּי זְעִירָא חָדָא מְסָאנָא דִתְאֵנִים דְּלָא מְתַקְּנָא. וַהֲוָה רִבִּי יִרְמְיָה סְבַר מֵימָר מַה רִבִּי זְעִירָא מֵיכוּל דְּלָא מְתַקְּנָא. וַהֲוָה רִבִּי זְעִירָא סְבַר מֵימָר מַה אֵיפְשַׁר דְּרִבִּי יִרְמְיָה מְשַׁלְּחָה לִי מִילָּא דְּלָא מְתַקְּנָא. מַה בֵּין דֵּין לְדֵין אִיתַכְלָת טֵבֵל. לְמָחָר קָם עִימֵּיהּ אֲמַר לֵיהּ הַהִיא מְסָנָתָא דִּשְׁלַחְתְּ לִי אֶתְמֹל מְתַקְּנָא הֲוָת. אֲמַר לֵיהּ אָֽמְרִית מַה רִבִּי זְעִירָא מֵיכוּל מִילָּה דְּלָא מְיתַקְּנָה. אֲמַר לֵיהּ אוּף אֲנָא אָֽמְרִית כֵּן הֲוָה רִבִּי יִרְמְיָה מְשַׁלְּחָה לִי מִילָּה דְּלָא מְתַקְּנֵיהּ. רִבִּי אַבַּא בַּר זְמִינָא<i data-commentator=""Notes by Heinrich Guggenheimer"" data-label=""129""></i> בְּשֵׁם רִבִּי זְעִירָא אָמַר אִין הֲווֹן קַדְמָּאֵי בְּנֵי מַלְאָכִים אֲנָן בְּנֵי נַשׁ. וְאִין הֲווֹן בְּנֵי נַשׁ אֲנָן חֲמֹרִין. אָמַר רִבִּי מָנָא בְּהַהִיא שַׁעֲתָא אָֽמְרִין אֲפִילוּ לַחֲמָרָתֵיהּ דְּרִבִּי פִינְחָס בֶּן יָאִיר לָא אִידְמִינָן."
Jerusalem Talmud Demai,1,1,22a,"@אפשר דלא חמי סבר אפוי כו'.# הגר""א מוחק מלת ""דלא"", ולדעתנו יש להגיה ""איפשר @דהוא# חמי"" כו'.",Jerusalem Talmud Demai 1:3:12,רִבִּי בָּעֵא מִישְׁרֵי שְׁמִיטְתָא סְלַק רִבִּי פִינְחָס בֶּן יָאִיר לְגַבֵּיהּ. אֲמַר לֵיהּ מַה עִיבּוּרָיָא עֲבִידִין. אֲמַר לֵיהּ עוּלְשִׁין יָפוֹת. מַה עִיבּוּרָיָא עֲבִידִין. אֲמַר לֵיהּ עוּלְשִׁין יָפוֹת. וִידַע רִבִּי דְּלֵית הוּא מַסְכְּמָא עִימֵּיהּ. אֲמַר לֵיהּ מִישְׁגָּח רִבִּי מֵיכוּל עִימִּין צִיבְחַד פְּטָל יוֹמָא דֵין. אֲמַר לוֹן אִין. מִי נְחֵית חֲמָא מוּלְווָתָא דְּרִבִּי קַייָמִין. אֲמַר כָּל־אִילֵּין יְהוּדָאֵי זְנִין אֵיפְשַׁר דְּלָא חֲמֵי סְבַר אַפּוֹי מִן כְּדוֹן. אָֽזְלוּן וְאָֽמְרוּן לְרִבִּי שְׁלַח רִבִּי בְּעֵי מְפַייְסָתֵיהּ. מָטוּן בֵּיהּ גַּבֵּי קַרְתֵּיהּ אֲמַר בְּנֵי קַרְתֵּיהּ קוֹרְבִין לִי וְנָחִתוּ בְּנֵי קַרְתָּא וְאַקְפוּן עֲלוֹי. אֲמַר לוֹן רִבִּי בְּעֵי מְפַייְסָתֵיהּ. שַׁבְקוּנֵיהּ וַאֲזוּל לוֹן. אֲמַר בְּנֵי דִידִי קוּרְבִין לִי. נָחִתָת אֵישְׁתָא מִן שְׁמַיָּא וְאַקְפַּת עֲלוֹי. אָֽזְלוּן אָֽמְרוּן לְרִבִּי אָמַר הוֹאִיל וְלֹא זְכִנינָן נִישְׂבַּע מִינֵיהּ בְּעָֽלְמָא הָדֵין נִיזְכֵּי נִישְׂבַּע מִינֵיהּ בְּעָֽלְמָא דְּאָתֵי.
Jerusalem Talmud Demai,2,1,22c,"@אישתרי לחברך.# — צ""ל: אישתוי לחברך (פי' ואסור אף דסיסרא וע' שבת פ""א ה""ו [ג' סוע""ב] ושביעית סופ""ט דאית ג'ן כן ופירושו שתעשה כשאר, וע' כ""מ פ""ד הכ""ט משמיטה מ""ש בזה; והגר""א גורס אישתוי לחברוהי שישוה דשל סיסרא לגינת נכרים אחרים).",Jerusalem Talmud Demai 2:1:12,"<i data-overlay=""Vilna Pages"" data-value=""8b""></i>רִבִּי יְהוֹשֻׁעַ בֶּן לֵוִי הֲוָה מְפַקֵּד לְטַלָּייָא לֹא תִיזְבּוּן לִי יֶרֶק אֶלָּא מִן גִּינְתָא דְּסִיסְרָא. קָם עִימֵּיהּ זָכוּר לַטּוֹב אָמַר לֵיהּ זִיל אֱמוֹר לְרַבָּךְ לֵית הָדָא גִּינְתָא דְּסִיסְרָא דִיהוּדָיי הֲוָת וּקְטָלֵיהּ וּנְסָבָת מִינֵיהּ וְאִין בְּעִית מַחְמְרָא עַל נַפְשָׁךְ אִישְׁתְּרֵי לְחַבְרָךְ."
Jerusalem Talmud Demai,3,1,22c,"@ר""ש אומר דמאי.# פי' ר""ש לטעמיה בתרומות פ""ג מ""ט דמיקל בתרומת הנכרי.",Jerusalem Talmud Demai 2:1:13,"רִבִּי יוֹסֵי דִכְפַר דָּן בְּשֵׁם רִבִּי בֶּן מְעָ‍ֽדְיָה הַמִּינִין הָאֲסוּרִין בְּבֵית שְׁאַן. הַקֶּצַח וְהַשּׁוּמְשּׁוּם וְהַחַרְדַּל וְהַשּׁוּם וְהַבּוּלְכָּסִין הָאֲפוּנִין הַשְּׁחוֹרִין וּבְצָלִים הַנִּמְכָּרִים וּבְנֵי הַמְּדִינָה הַנִּמְכָּרִים בְּמִידָּה וּפוּל הַמִּצְרִי הַנֶּאֱגָד בְּשִׁיפָה וּמֵינְתָה הַנֶּאֱגָד בִּפְנֵי עַצְמָהּ וְהָאִסְטָפֻנִינֵי לְעוֹלָם וְקֶפַלּוֹטוֹת מִן הָעֲצֶרֶת וְעַד חֲנוּכָּה. אָמַר רִבִּי זְעִירָא מִן הָעֲצֶרֶת וְעַד חֲנוּכָּה אִיסּוּר רָבָה עַל הַהֵיתֵר. מִן הַחֲנוּכָּה וְעַד הָעֲצֶרֶת הֵתֵּר רָבָה עַל הָאִיסּוּר. וּלְעִנְיַין סְפִחִים מֵרֹאשׁ הַשָּׁנָה וְעַד חֲנוּכָּה אִסּוּר סְפִחִין. מִן הַחֲנוּכָּה וְעַד הָעֲצֶרֶת הֵתֵּר סְפִחִין. מִן הָעֲצֶרֶת וְעַד רֹאשׁ הַשָּׁנָה צְרִיכָה. הַקִּישּׁוּאִין וְהַדִּילּוּעִין וְהָאֲבַטִּיחִין וְהַמְּלַפֶּפּוֹנוֹת וְהַיַיִן וְהַשֶּׁמֶן וּתְמָרִין אֶפֶּסִּיוֹת וְיֵשׁ אוֹמֵר אַף הַתּוּרְמוֹסִין וּפַת חַלָּה לְעוֹלָם הֲרֵי אֵילּוּ בַשְּׁבִיעִית שְׁבִיעִית. בִּשְׁאָר שְׁנֵי שָׁבוּעַ מַה. רִבִּי יוֹנָה אָמַר דְּמַאי רִבִּי יוֹסֵי אוֹמֵר וַדַּאי. וְלֹא פְּלִיגִין. מָה דְּרִבִּי יוֹנָה אָמַר דְּמַאי בְּלוֹקֵחַ מִן הַבַּלּוֹנְקֵי<i data-commentator=""Notes by Heinrich Guggenheimer"" data-label=""59""></i>. וּמַה דְּרִבִּי<i data-overlay=""Venice Pages"" data-value=""22d""></i> יוֹסֵי אוֹמֵר וַדַּאי בְּלוֹקֵחַ מִן הַגִּינָּה."
Jerusalem Talmud Demai,3,1,23b,"@דתני הגרים עמך (ויק' כ""ה ו') לרבות את האכסנייא.# כצ""ל, וברייתא היא בספרא שם ולענין פירות שמיטה (וברא""פ סתם)."
Jerusalem Talmud Demai,3,1,23c,"@חכמים שהן בשיטת ר""מ.# —פי' חכמים דמסכת מכשירין [פ""ב מ""י].",Jerusalem Talmud Demai 3:4:8,"וַחֲכָמִים אוֹמְרִים אֲפִילוּ כּוּלּוֹ גּוֹי וְיִשְׂרָאֵל אֶחָד מַטִּיל לְתוֹכוֹ דְּמַאי. הָדָא אָֽמְרָה שֶׁטָּהוֹר אֶחָד מַזֶּה עַל כַּמָּה טְמֵאִין דְּתַנֵּינָן אֶצֶל הַנָּכְרִי כְּפֵירוֹתָיו. אָמַר רִבִּי לָֽעְזָר חֲכָמִים שֶׁהֵן בְּשִׁיטַּת רִבִּי מֵאִיר. רִבִּי יוֹחָנָן אָמַר חֲכָמִים מַמָּשׁ. בְּעוֹן קוֹמֵי מַה טַעַם. אָמַר לוֹן כַּד תְּסָאבוּן אֲנָא אֲמַר לְכוֹן. מַה הֲוָה מֵימַר לְכוֹן כְּמַה דְאָמַר מֵאֵילֵיהֶן קִיבְּלוּ עֲלֵיהֶן אֶת הַמַּעְשְׂרוֹת. שְׁמוּאֵל בַּר בָּא בְּעֵי נִיחָא לְטָהֳרוֹת לֹא אָמַר לוֹן מִפְּנֵי גֶדֶר טָהֳרוֹת. לְמַעְשְׂרוֹת לֹא אָמַר לוֹן מִפְּנֵי גֶדֶר מַעְשְׂרוֹת. לְקֳדָשִׁים לֹא אָמַר לוֹן וְאִילּוּ אָמַר לוֹן מַה הֲוָה מֵימַר לוֹן. גַּבֵּי מַעְשְׂרוֹת כְּמָאן דְּאָמַר מֵאֵילֵיהֶן קִיבְּלוּ עֲלֵיהֶן אֶת הַמַּעְשְׂרוֹת.<i data-commentator=""Notes by Heinrich Guggenheimer"" data-label=""113""></i>"
Jerusalem Talmud Demai,4,1,24a,"@ידע דהוא רחיץ.# — פי' בטוח (וישבתם לבטח ת""א לרוחצן) שכבר זימנו אותו לסעודה אצל אחר.",Jerusalem Talmud Demai 4:3:6,תַּנִּי לֹא יְסָרֵב אָדָם בַּחֲבֵירוֹ לְאָֽרְחוֹ בְּשָׁעָה שֶׁהוּא יוֹדֵעַ שֶׁאֵינוֹ רוֹצֶה. וְלֹא יַרְבֶּה לוֹ בְתַקְרוֹבֶת בְּשָׁעָה שֶׁהוּא יוֹדֵעַ שֶׁאֵינוֹ מְקַבֵּל. מַהוּ בְתַקְרוֹבֶת יְדַע דְּהוּא רָחֵיץ וְהָא מַטְרַח עֲלוֹי. וּבִירוּשָׁלֵם הֲוָה מַפִּיךְ פִּילְכֵּיהּ דִּשְׂמָלָא לִימִינָא.
Jerusalem Talmud Demai,4,1,24a,"@ובירושלם הוה מפיך פלכיה כו'.# — במדרש איכה רבתי פ""ד (עה""כ בני ציון היקרים): מה היתה יקרותן שלא היה אי מהן הולך לסעודה אא""כ הופך יד אונקלי שלו (ובאיכה מכ""י הוצאת רש""ב ז""ל ""בשעה שהיה אחד מהן נזמן לסעודה היה הופך אונקלי שלו השמאלית"") וכ""כ למה כדי שלא יטעננו אחר טענת חנם (ובאיכה כ""י שאם יבא אחר לזמנו היה יודע שהוא מזומן לסעודה ולא יטעיננו טענת חנם""), וע' מתנות כהונה שם שראה בירושלמי כ""י ""פיבליה"" (במקום פילכיה) והוא כמו ""פיוולא"" בב""ר פל""ז שהוא לבוש עליון יפה. וע' מסכת דרך ארץ רבה רפ""ח הנוסח ""אפסחתיה למפלא"" והוא שיבוש, וע' נחלת שבעה ח""א סמ""ב שהתפאר בפירושו המעוות שחידש.",Jerusalem Talmud Demai 4:3:6,תַּנִּי לֹא יְסָרֵב אָדָם בַּחֲבֵירוֹ לְאָֽרְחוֹ בְּשָׁעָה שֶׁהוּא יוֹדֵעַ שֶׁאֵינוֹ רוֹצֶה. וְלֹא יַרְבֶּה לוֹ בְתַקְרוֹבֶת בְּשָׁעָה שֶׁהוּא יוֹדֵעַ שֶׁאֵינוֹ מְקַבֵּל. מַהוּ בְתַקְרוֹבֶת יְדַע דְּהוּא רָחֵיץ וְהָא מַטְרַח עֲלוֹי. וּבִירוּשָׁלֵם הֲוָה מַפִּיךְ פִּילְכֵּיהּ דִּשְׂמָלָא לִימִינָא.
