Index_Title,Jerusalem_Talmud_Mechon_Mamre,Schwab_fr,id_paragraphe,missing_footnotes
Jerusalem Talmud Gittin 3:2:2,"ר' יוחנן אמר כתב תרפו בטופס כשר. ר""ל אמר כתב תרפו בטופס פסול. מתניתא פליגא על רבי יוחנן הכותב טופסי גיטין צריך שיניח מקום האיש ומקום האשה והזמן. פתר לה ותורפו עמו. וקשיא על דר' יוחנן אם בשכתב תרפו בטופס בדא חכמים מכשירין. רבי ירמיה בשם ר' זעירה מפסולו את למד הכשירו אילו כתב כולו לשמה ושם האיש ושם האשה שלא לשמה שמא אינו פסול. ודכוותה כתב כולו שלא לשמה ושם האיש ושם האשה לשמה כשר. ר' יוסי שאל לרבי ירמיה הגע עצמך שזיווג. אמר ליה כן. אמר ליה רבי זעירא רבו מכיון שאינו מצוי לזיוג אפי' זיווג כמי שלא זיווג. וקשיא על ריש לקיש אם בשלא כתב בטופס תורפו בדא רבי יודה פוסל. ר' יוסי ברבי זעירא לעניין אחר עבד לה ר' יודה. ותייא כיי דמר שמעון בר בא בשם רבי יוחנן חלק מקום שני שיטין לעניין אחר אפילו כל שהוא פסול.","R. Yohanan a dit <sup>69</sup><i class=""footnote"">Ci-dessus, (2, 4), et ci-après, (7, 2)</i>: l’inscription du corps du divorce (de déclarer la femme libre à tous), faite avec le formulaire, ne nuit pas à la validité de l’acte; tandis que, selon R. Simon b. Lakish, l’acte ainsi conçu devient impropre (il faut ainsi que ladite partie ait été écrite spécialement pour la femme divorcée, sous peine de nullité). Notre présente Mishna n’est-elle pas opposée à cet avis de R. Yohanan, lorsqu’elle dit: “Celui qui écrit des modèles de divorce (d’avance) devra laisser en blanc la place pour le nom du mari, pour celui de la femme et pour la date”? (N’est-ce pas à l’exclusion de ce qui forme le corps de l’acte du divorce)? -Non, R. Yohanan explique que le formulaire englobe le texte en question. Mais alors, il y a lieu d’objecter contre l’avis de R. Yohanan, si le texte constituant le corps du divorce peut avoir été écrit avec le formulaire, comment il se fait que les sages exigent de laisser en blanc les noms en question pour la validité de l’acte? (N’est-ce pas aussi du corps de l’acte)? C’est que, répond R. Jérémie au nom de R. Zeira, d’après ce qui rend l’acte impropre, on sait en quel cas il est valable: lorsque le corps entier de l’acte de divorce a été écrit en vue spéciale de la femme divorcée, mais le nom de la femme et du mari ont été apposés sans destination spéciale, il va sans dire que l’acte est impropre; de même (à l’inverse), l’acte qui est entièrement écrit sans destination spéciale, sera valable. R. Yossé demanda à R. Jérémie: songe à ce qu’il arriverait s’il y avait là un autre homme du même nom? (Ne peut-il arriver une confusion <sup>70</sup><i class=""footnote"">La même crainte se retrouve énoncée en (Sheqalim 5, 5)</i> lors de la remise de l’acte du divorce, qui, ayant été écrit par un couple, sera remis à un autre, auquel il n’était pas destiné)? -Voici, lui répondit R. Jérémie, ce que R. Zeira son maître lui avait enseigné : comme c’est un cas peu fréquent même lorsqu’il se présente, on n’en tient pas compte. – D’autre part, il y a une objection à faire contre l’avis de R. Simon b. Lakish: lorsqu’on n’a rien écrit du corps de l’acte dans le formulaire, pourquoi R. Juda le déclare-t-il impropre? -C’est que, répond R. Yossé b. R. Zeira, R. Juda compare l’acte en question à un autre cas. C’est conforme à ce qu’a dit Simon b. Aba au nom de R. Yohanan <sup>71</sup><i class=""footnote"">Ci-après, (9, 9) ( 50c)</i>: si l’on a laissé en blanc sur un acte l’espace de deux lignes pour pouvoir y ajouter un sujet étranger, sur quelle place que ce soit, l’acte devient impropre (pour la même cause de blanc à laisser, R. Juda déclare impropre le formulaire préparé d’avance).",1504,
Jerusalem Talmud Gittin 3:2:3,מהו מפני התקנה. רבי שבתי בשם חזקיה מפני תקנת בנות ישראל שלא יהו מצויות להתגרש. רבי שמואל בר רב יצחק שאל לרבי חייא בר בא כשר ואת אמר אכין. אין תימר פסול ויאות. מאי כדון. אמר ר' אבון מפני תקנת הליבלר כדי שיהו חייו מצויין לו.,"Qu’entend-on par “la commodité des transactions”? Selon R. Shabtaï au nom de Hiskia, il s’agit de facilités accordées, pour que les filles d’Israël ne soient pas exposées à une trop prompte répudiation (s’il n’y avait qu’à divorcer en remplissant un formulaire prêt d’avance). A ce sujet R. Samuel b. R. Isaac fit cette objection devant R. Hiya b. Aba: il semble que l’on a parlé du cas où l’acte est valable et non de sa défectuosité; si donc on avait dit qu’à défaut du blanc laissé l’acte devient impropre, on comprendrait l’explication de R. Shabtaï; que signifie donc l’expression “pour la commodité”? En effet, dit R. Abin, il s’agit de la commodité pour le greffier, qu’il trouve dans cette rédaction des ressources pour vivre.",,
Jerusalem Talmud Gittin 3:2:4,רבי זעירא רב הונא בשם רב הלכה כרבי יודה בגיטין וכרבי אליעזר בשטרות. נאמר הלכה כרבי אליעזר. רבי בא בשם רב הלכה כרבי ליעזר בגיטין וכרבי יהודה בשטרות. נאמר הלכה כרבי יהודה. אלא בגין דרב ושמואל תרוויהו אמרין הלכה כר' לעזר ולא תיסבר מימר אף הכא כן צריך מימר הלכה כרבי יהודה בגיטין וכרבי אלעזר בשטרות:,"R. Zeira ou R. Houna dit au nom de Rab: l’avis de R. Juda sert de règle pour les actes de divorce (ainsi la moindre inscription faite d’avance annule l’acte), comme l’avis de R. Eliézer relatif aux autres actes (les déclarant valables en ce cas). -Pourquoi ne pas dire simplement que l’avis de R. Eliézer (déclarant “tous les autres actes admissibles, sauf ceux du divorce”) prédomine? -En effet, dit R. Aba au nom de Rav, l’avis de R. Eliézer pour les divorces (les déclarant impropres), comme celui de R. Juda pour tous autres actes (aussi sévère), prédomine. Pourquoi ne pas adopter l’avis seul de R. Juda (qui invalide le tout)? Comme Rav et Samuel disent tous deux <sup>72</sup><i class=""footnote"">""Ibid, 8 ; (Baba Batra 10, 10)""</i> que l’avis de R. Eliézer prédomine (en l’absence d’attestation), on aurait pu croire qu’ici ils attribuent aussi la prédominance de ce rabbin (savoir que même l’apposition des noms n’a pas besoin d’être faite dans une vue spéciale); c’est pourquoi il a fallu préciser les deux points, que l’avis de R. Juda prédomine pour les divorces, et celui de R. Eliézer pour tous autres actes.",,
Jerusalem Talmud Gittin 3:3:1,המביא גט ואבד ממנו אם מצאו על אתר כשר ואם לאו פסול מצאו בחפיסה או בדלוסקמה אם מכירו כשר המביא גט והניחו זקן או חולה נותנו לה בחזקת שהוא קיים בת ישראל שנישאת לכהן והלך בעלה למדינת הים אוכלת בתרומה בחזקת שהוא קיים השולח חטאתו ממדינת הים מקריבין אותה בחזקת שהוא קיים:,"Si le porteur d’un acte de divorce le perd et le retrouve aussitôt après, l’acte reste valable; l’acte non retrouvé de suite devient impropre. Si l’acte est retrouvé dans une poche (petit sac), ou dans une boîte, ou caisse, arceion, et reconnu par le porteur, il reste valable. Si quelqu’un apporte un acte de divorce de la part d’un homme qu’il laisse vieux ou malade, il remet l’acte à la femme dans la présomption que le mari vit encore. De même, une fille d’Israélite mariée à un cohen, dont la mari fait un voyage d’outre-mer, peut continuer à manger de l’oblation sacerdotale dans la présomption que le mari vit toujours (jusqu’à l’avis contraire). De même aussi, on devra sacrifier la victime expiatoire envoyée par quelqu’un d’outre-mer, dans la présomption que l’expéditeur est en vie.<sup>75</sup><i class=""footnote"">En tête du 3 est une page déjà traduite en (Yebamot 16, 6)</i> ",1505,
Jerusalem Talmud Gittin 3:3:2,"איזהו על אתר. רבי יוחנן אמר כל שלא עבר שם ברייה. ר' יעקב בר אידי רבי שמעון בר אבא בשם רבי יהושע בן לוי כל שלא עברו שם שלשה בני אדם. עבד גוי נישמעינה מן הדא אבא בר בר חנה אייתי גיטא ובד מיניה ואשכחיה חד בירקיי. אתא עובדא קומי רבי יוחנן ואכשרון. הדא אמרה עבר גוי כשר. נימר סי' הוה ליה ביה. ולא כן תני אין סימן בגיטין. והוא דמר תרין תלת שורין. ברם הכא ח""א שבו היה נקוד. רבי עזרא בעא קומי רבי מנא הכא למה הוא פסול אני אומר אחר היה שם והיו שמו כשמו. הגע שבדקו כל אותו המקום ולא מצאו אדם ששמו כשמו אלא משום חומר הוא בעריות. והא תנינן הלכו ולא מצאו שם אדם והשיאו את אשתו הלכו ולא הכירוהו והשיאו את אשתו. אמר ליה רבי מנא כן אמר רבי שמואל בר אחא האיש הזה שני גיטין היו בידו אחד כשר ואחד פסול איבד את הכשר והשליך את הפסול בשעה שמצא אני אומר הפסול מצא.",,1505,
Jerusalem Talmud Gittin 3:3:3,תני בר קפרא אפילו הניחו בן מאה שנה ועשה בדרך עוד מאה שנה נותנו לה בחזקת שהוא קיים.,"– Bar-Kappara a enseigné: si même le porteur a laissé le mari âgé de cent ans, et fut-il encore resté en route cent ans, il remettra le divorce à la femme dont la présomption que le mari existe encore. Pourquoi la Mishna ajoute-t-elle ensuite: “la femme peut continuer à manger de l’oblation sacerdotale, dans la présomption que le mari vit encore” ?",,
Jerusalem Talmud Gittin 3:3:4,ולא כן תני &lt;מניין&gt; האומר לאשתו הרי זה גיטיך לפני מיתתי שעה אחת וכן האומר לשפחתו הרי שטר שחרוריך לפני מיתתי שעה אחת שהיא אסורה לוכל בתרומה מיד. תמן משעה ראשונה נתקלקלה. ברם הכא לכשימות היא מתקלקלה:,"-N’a-t-on pas enseigné que si quelqu’un dit à sa femme: “je te remets le divorce à valoir un heure avant ma mort”, ou s’il dit à sa servante: “je te remets ton acte d’affranchissement à valoir une heure avant ma mort”, il leur sera interdit de suite de manger de l’oblation? -C’est qu’en ce dernier cas dès le premier instant (dès la réception de l’avis), la femme devient impropre à manger la consécration; tandis qu’ici (pour le divorce envoyé) l’inaptitude commence seulement lorsque le décès du mari survient.",,
Jerusalem Talmud Gittin 3:4:1,שלשה דברים אמר רבי אלעזר בן פרטא לפני חכמים וקיימו את דבריו על עיר שהקיפוה כרקום ועל ספינה המוטרפת בים ועל היוצא לידון שהן בחזקת קיימין אבל עיר שכבשה כרקום וספינה שאבדה בים והיוצא ליהרג נותנין עליו חומרי חיים וחומרי מתים בת כהן לישראל ובת ישראל לכהן לא תאכל בתרומה:,"R. Eléazar b. Parta a énoncé devant les sages trois règles qu’ils ont confirmées: les gens d’une ville assiégée à qui il ne reste plus d’issue, les passagers d’un navire battu par la tempête, et le coupable sur le point d’être condamné par la justice à la peine capitale, restent pourtant dans la présomption d’être vivants. Mais une fois que la ville est prise par les assiégeants, ou si le navire a fait naufrage en mer, ou si le condamné se rend déjà au dernier supplice, à tous ces gens on applique les lois les plus sévères des vivants et des morts <sup>73</sup><i class=""footnote"">Pour eux, on observera les lois les plus sévères, en les supposants vivants et en les supposant morts</i>. Ainsi, lorsqu’une fille d’Israélite est mariée à un cohen (qui se trouve dans l’un de ces derniers cas), ou si une fille de cohen est mariée à un simple israélite, elle ne pourra pas manger de l’oblation sacerdotale <sup>74</sup><i class=""footnote"">""Pour la 1re, on suppose le mari mort ; pour la 2e, on le suppose vivant, et aux 2 cas l'oblation est interdite""</i>.",1506,
Jerusalem Talmud Gittin 3:4:2,"איזהו כרקום ר' בא בשם ר' חייא בר אשי כגון זוגין ושלשליות וכלבים ואווזין ותרנגולים ואיסטרטיות המקיפין את העיר. וא""ר בא בשם ר' חייה בר אשי מעשה היה וברח משם סומא אחת. היתה שם פירצה אחת מצלת את הכל. היה שם מחבוייה צריכה. ר""ז רבא בר זבדי ר""י בר חקולאי בשם ר' יודן נשייא. ובלבד כרקום של אותה מלכות. אבל כרקום של מלכות אחרת כליסטים הן.",,1506,
Jerusalem Talmud Gittin 3:4:3,ועוד ג' הוסיפו עליהן את שגררתו חיה ואת ששטפו נהר ואת שנפלה עליו מפולת ונותנין עליהם חומרי חיים וחומרי מתים בת ישראל לכהן ובת כהן לישראל לא תאכל בתרומה:,"<sup>76</sup><i class=""footnote"">Le commencement du 4 est traduit ci-dessus, (Ketubot 2, 9)</i> Parmi “les gens à qui l’on applique les lois les plus sévères des vivants et des morts”, soit pour l’interdit de manger de l’oblation, soit pour la non-libération de la femme mariée, on a encore compris les trois personnes suivantes <sup>77</sup><i class=""footnote"">Tossefta à ce traité, ch 2</i>: celui qui a été déchiré par une bête féroce, ou emporté par un torrent, ou enseveli sous les décombres.",,
Jerusalem Talmud Gittin 3:5:1,המביא גט בארץ ישראל וחלה הרי זה משלחו ביד אחר אם אמר לו טול לי ממנה חפץ פלוני לא ישלחנו ביד אחר שאין רצונו שיהא פקדונו ביד אחר:,"Si un porteur d’acte de divorce en Palestine même (d’une localité à l’autre) devient malade en route, le mari peut en charger autrui. Mais si le mari lui a dit de reprendre par contre de la femme un objet spécial (de valeur), le porteur ne peut pas se décharger de l’acte sur autrui: car le mari n’a pas entendu accorder à un tiers sa confiance pour avoir le dépôt en question.",1507,
Jerusalem Talmud Gittin 3:5:2,מפני שחלה. הא לא חלה לא.,"“Si un porteur devient malade (§ 5), le mari peut en charger un autre”. Si donc, le porteur n’est pas tombé malade, le mari ne peut pas charger un autre de porter le divorce.",1507,
Jerusalem Talmud Gittin 3:5:3,לית הדא פליגא על רבי יוחנן דרבי יוחנן אמר שומר שמסר לשומר הראשון חייב. רבי בא בריה דרבי חייה משום תנאי גיטין מה נפק מביניהון קידם הבעל ונטלה. אין תימר משום תנאי גיטין יאות. אין תימר שאין רצוני שיהא פקדוני ביד אחר הרי אין פקדוני ביד אחר. אף בקידושין כן. מה בין גיטין מה בין קידושין. ביד כל אדם מצוי לגרש. לא ביד כל אדם מצוי לקדש:,"Ce n’est pas contraire à ce qu’a dit R. Yohanan (lorsque la Mishna dit que “le mari ne peut pas accorder sa confiance à un tiers”), car R. Yohanan dit <sup>78</sup><i class=""footnote"">J, (Qidushin 1, 4) ( 60b)</i> :lorsqu’un gardien (nouveau) livre le dépôt (qui lui a été confié) au premier gardien, il est responsable envers le maître (qui peut arguer n’avoir pas confiance en ce tiers). Selon R. Aba, fils de R. Hiya, c’est inhérent aux conditions de la validité du divorce (que le porteur prenne d’abord ce qui lui a été désigné, pour que l’acte de divorce ait sa valeur). Entre ces deux raisons données il y a une différence pratique: d’après la seconde explication donnée, si le mari commence par prendre l’objet en question, il est juste de faire dépendre de cette prise la validité de l’acte; si au contraire le motif allégué, que le mari peut ne pas vouloir accorder sa confiance à un autre, l’emporte, dès lors que le mari a l’objet, il n’a plus besoin de se fier à autrui; et il peut envoyer l’acte par n’importe qui. -En est-il de même pour la consécration d’une femme à effectuer par autrui? (Le messager peut-il transmettre sa mission à un autre)? -Il n’y a rien à déduire de là, en raison de la distinction entre le divorce et la consécration <sup>79</sup><i class=""footnote"">Cf plus loin, (4, 1), fin ( 45c)</i>: n’importe qui est apte à remettre un acte de divorce, tandis que l’on peut ne pas confier à chacun la mission de consacrer une femme pour épouse (et il se peut que le futur n’autorise pas un tiers à cet effet).",,
Jerusalem Talmud Gittin 3:6:1,המביא גט ממדינת הים וחלה עושה בית דין ומשלחו ואומר לפניהם בפני נכתב ובפני נחתם אין השליח האחרון צריך שיאמר בפני נכתב ובפני נחתם אלא אומר שליח בית דין אני:,"Si le porteur d’un acte de divorce venant d’outre-mer tombe malade, le tribunal désignera un messager chargé de l’expédition, et le porteur devra déclarer devant les juges avoir assisté à la rédaction et à la signature de l’acte. Le dernier porteur n’a pas besoin de faire cette même déclaration, mais il devra seulement avoir été chargé de cet envoi par le tribunal.",1508,
Jerusalem Talmud Gittin 3:6:2,אמר רבי מנא לכן צריכה והוא שבא לארץ ישראל. שלא תאמר הואיל ובא לארץ ישראל יעשה כגיטי ארץ ישראל. וגיטי ארץ ישראל אין צריך לומר בפניי נכתב ובפניי נחתם,"R. Mena dit: la Mishna a dû rappeler l’obligation pour le second porteur de “déclarer devant les juges avoir assisté à la rédaction et à la signature de l’acte”, pour le cas où le premier porteur est arrivé jusqu’en Palestine; or, on aurait pu croire qu’en raison de l’arrivée de l’acte en Palestine, on le traite à l’égal de ceux qui ont été rédigés et seront remis à l’intérieur du pays, sans ajouter l’attestation l’avoir vu écrire et signer; il a donc fallu dire qu’ici c’est différent (en raison de la provenance de l’acte).",1508,
Jerusalem Talmud Gittin 3:6:3,חלה השליח. אמר ר' חנינה בריה דרבי אבא הוה ליה עובדא ושאל ושלח לרבי חייה ולרבי יסא ולרבי אימי והורון ליה אין השליח האחרון צריך שיאמר בפניי נכתב ובפניי נחתם אלא אומר שליח בית דין אני.,"-Si le second messager désigné d’office tombe aussi malade, quelle sera la règle? R. Hanina, fils de R. Aba, répond: un fait de ce genre lui survint, et il fit demander à R. Hiya, à R. Yassa et R. Imi quelle est la règle à suivre? Ils lui répondirent par les termes de notre Mishna: “Le dernier porteur n’a pas besoin de déclarer avoir assisté à la rédaction et à la signature de l’acte, mais il dira seulement avoir été chargé de cet envoi par le tribunal”. “(C’est donc que la transmission du message peut toujours se poursuivre, même au-delà d’un second).",,
Jerusalem Talmud Gittin 3:6:4,"וצריך למסור לו כל שליחותו. רבי ירמיה אמר צריך למסור לו כל שליחותו. רבי אבין בר כהנא אמר אין צריך למסור לו כל שליחתו. מייתי לה דרבי אבין בר כהנא מן הדא אין השליח האחרון צריך שיאמר בפניי נכתב ובפניי נחתם אלא אומר שליח בית דין אני. אמר רבי ירמיה חזר ביה ר' אבון בר כהנא מן הדא אין השליח האחרון צריך שיאמר בפניי נכתב ובפניי נחתם. אלא אומר שליח ב""ד אני:","Le premier porteur doit-il transmettre au suivant toutes les commissions dont le maître l’avait chargé? (ou se restreindre à la remise du divorce)? -Oui, répond R. Jérémie; il faudra lui transmettre le message au complet. -Non, dit R. Abin b. Cahana, ce n’est pas nécessaire; et celui-ci invoque à l’appui de son opinion les derniers termes de la Mishna: “Il dira seulement avoir été chargé de cet envoi par le tribunal “ (rien au-delà, sans se charger du reste du message). Plus tard, dit R. Jérémie, R. Abin b. Cahana renonça à sa première explication; et, au lieu d’appliquer au cas douteux les derniers termes de la Mishna, il lui applique les mots précédents: le dernier porteur n’a pas besoin de faire la déclaration d’avoir assisté à la rédaction du contrat” (c’est la seule restriction prescrite, mais sans diminuer le reste du message).",,
Jerusalem Talmud Gittin 3:7:1,המלוה מעות את הכהן ואת הלוי ואת העני להיות מפריש עליהן מחלקן מפריש עליהן בחזקת שהן קיימין ואינו חושש שמא מת כהן או לוי או שמא העשיר העני מתו צריך ליטול רשות מן היורשין ואם הלוום בפני בית דין אינו צריך ליטול רשות:,"Si quelqu’un prête de l’argent à un Cohen, ou à un lévite, ou à un pauvre, avec l’intention de se rembourser plus tard en prélevant le montant sur celui qui leur revient <sup>80</sup><i class=""footnote"">Au premier, le créancier devra l'oblation sur ses fruits, et aux autres il doit les diverses dîmes</i>, il pourra faire le prélèvement de ce qui lui revient dans la présomption que ces gens vivent toujours, sans craindre que le Cohen ou le lévite soient morts, ou que le pauvre se soit enrichi. S’ils sont morts avant que le créancier soit remboursé, celui-ci devra demander aux héritiers du défunt l’autorisation de se rembourser S’il a prêté par devant justice, il n’a pas besoin de cette autorisation pour se payer.",1509,
