Index_Title,Jerusalem_Talmud_Mechon_Mamre,Schwab_fr,id_paragraphe,missing_footnotes
Jerusalem Talmud Sanhedrin 7:6:1,הבא על האם חייב עליה משום אם ומשום אשת אב ר' יהודה אומר אינו חייב אלא משום האם בלבד הבא על אשת אב חייב עליה משום אשת האב ומשום אשת איש בין בחיי אביו בין לאחר מיתת אביו בין מן האירוסין בין מן הנישואין הבא על כלתו חייב עליה משום כלתו ומשום אשת איש בין בחיי בנו בין לאחר מיתת בנו בין מן האירוסין בין מן הנישואין:,"Celui qui a cohabité (par erreur) avec sa mère est soumis à 2 sacrifices, parce que c’est: 1° sa mère; 2° la femme de son père; selon R. Juda, il n’est coupable que du premier fait. Celui qui cohabite avec la femme de son père est coupable, parce qu’elle est 1° la femme de son père; 2° Une femme mariée (adultère), soit du vivant du père, soit après sa mort, fiancée ou mariée. Le crime de l’adultère avec la femme du fils est également double, quand même elle n’aurait été que fiancée au fils, et même après la mort du fils.",2060,
Jerusalem Talmud Sanhedrin 7:6:2,אזהרה לבא על האם מניין ערות אמך לא תגלה. כרת מניין כי כל אשר יעשה מכל התועבות האלה ונכרתו הנפשות העושות מקרב עמם. אזהרה לבא על אשת אב מניין ערות אשת אביך לא תגלה כרת מניין כי כל אשר יעשה וגו'. עונש מניין ואיש אשר ישכב את אשת אביו ערות אביו גלה מות יומתו וגו'.,"Quelle est la défense biblique qui interdise explicitement l’inceste avec la mère? Le verset suivant (Lv 18, 17): Tu ne découvriras pas la nudité de ta mère. On sait que ce crime est puni de retranchement de ce qu’il est dit (ibid. 29): Si quelqu’un commet une de ces iniquités, une telle personne sera retranchée du milieu de son peuple. On connaît la défense de cohabiter avec la femme de son père, de ce qu’il est dit (ibid. 8): Tu ne découvriras pas la nudité de la femme de ton père, et la pénalité du retranchement pour ce crime est visée (au verset précité): Une telle personne sera retranchée, etc.; de plus, la peine de mort imposée en ce cas par le Tribunal est indiquée par les mots (ibid. 20, 11): Si quelqu’un cohabite avec la femme de son père, découvrant la honte de son père, ils seront condamnés à mort tous deux.",2060,
Jerusalem Talmud Sanhedrin 7:6:3,אזהרה לבא על כלתו מניין ערות כלתך לא תגלה כרת מניין כי כל איש אשר יעשה מכל התועבות האלה ונכרתו עונש מניין ואיש אשר ישכב את כלתו וגו'.,"La défense biblique d’avoir une relation illicite avec sa bru est contenue dans ces mots (ibid. 15): Tu ne découvriras pas la nudité de ta belle-fille, et la pénalité du retranchement pour ce crime est prévue (au v. précité): Une telle personne sera retranchée, etc.; de plus, la peine de mort imposée en ce cas par le tribunal est indiquée par ces mots (ibid. 20, 12): Celui qui cohabite avec sa belle-fille sera mis à mort.",,
Jerusalem Talmud Sanhedrin 7:6:4,"תניתה הכא תניתה בכריתות. ניחא בכריתות שהוא מביא קרבן וחוזר ומביא קרבן אית לך מימר בסנהדרין שהוא נסקל וחוזר ונסקל. א""ר יודן אבוי דר' מתנייה להתרייה איתאמרת שאם התרו בו משום אשת אב לוקה משום אם לוקה. ויתרו בו משום אשת איש א""ר אבין תיפתר בפנויה.","Comment se fait-il que l’on énumère ici, aussi bien qu’au traité Keritot (des retranchements), les divers cas où il y a double culpabilité? On comprend cette distinction audit traité, en raison des cas d’inadvertance, parce qu’alors il s’agit d’offrir un second sacrifice d’expiation; mais ici au point de vue criminel, peut-on supposer que le coupable sera lapidé deux fois? Il faut ici la double indication, dit R. Judan, père de R. Mathnia, au point de vue des avertissements, car si le criminel a été avisé de la gravité de sa faute spéciale, soit en lui disant qu’il s’agit “de la femme de son père”, soit “de sa mère”, il subira la peine des coups pour chaque avis, outre la peine capitale. Pourquoi ne pas l’aviser du crime d’adultère? Il peut s’agir du cas, répond R. Abin, où la femme est veuve. ",,
Jerusalem Talmud Sanhedrin 7:6:5,"תמן תנינן רבי יהודה אומר אם לא היתה אמו ראויה לאביו אינו חייב אלא אחת הא אם היתה אמו ראויה לאביו חייב שתים. רבי אבהו בשם ר' יוחנן לא נשייא בין שהיתה אמו ראויה לאביו בין שאין אמו ראויה לאביו אינו חייב אלא אחת. טעמא דר' יוחנן אמך היא משום אמו אתה מחייבו ערה את כל הפרשה לאם. ר' בון בר חייה בעא קומי ר' זעירא מה ראה ר' יוחנן לתפוש את האם ולהניח אשת האב א""ל דהוא סבר כר' ישמעאל דר' ישמעאל דרש ערות &lt;אשת&gt; אביך בזכר הכתוב מדבר ואין אביו בכלל הזכר אלא לחייבו שתים דתני הבא על אביו חייב עליו שתים. וניתני שלשים ושבע כריתות בתור'. ר' מנא אמר כל שם זכר אחד ערות אשת אביך באשת אב הכתוב מדבר ערות אמך זו אמו שהיא אשת אביו אמו שאינה אשת אביו מניין אמך היא לא תגלה ערותה. מה עבד לה ר' &lt;ישמעאל&gt; עקיבה פתר לה לאחר מיתה. ולית לרבי &lt;עקיבה&gt; ישמעאל בן ערות אביך היא. לא שנייא בין בחייה בין לאחר מיתה. רבי עקיבה דרש ערות &lt;אשת&gt; אביך באשת אב הכתוב מדבר ערות אמך זו אמו שהיא אשת אביו אמו שאינה אשת אביו מניין אמך היא לא תגלה ערותה. מה עבד לה ר' ישמעאל פתר לה לאחר מיתה. ולית לי' לר' עקיבה כן ערות אביך ערות אמך מה אביך כל שהוא אביך בין לעונש בין לאזהר' אף אמך כל שהוא אמך בין לעונש בין לאזהר'. לא מסתברא דדריש אהן קרייא. אלא ר' יודה דלית ליה אמו שהיא אשת אביו צריך מידרוש ערות אביך וערות אמך מה אביך כל שהוא אביך בין לעונש בין לאזהרה אף אמך כל שהיא אמך בין לעונש בין לאזהרה. א""ר זעירה הדא אמרה למידין מגזרה שוה אפילו מופנה מצד אחד. אמר ליה רבי יודן לית דא פשיטא על דר' עקיבה דרבי עקיבה אמר גזירה שוה אף על פי שאינו מופנה.","On a enseigné là-bas (à Babylone) que R. Juda dit: si sa mère n’a pas été propre à épouser son père (de sorte que le mariage n’était pas légal), le criminel n’est qu’une fois coupable; donc, si le mariage de sa mère avec son père avait été légal, selon R. Juda aussi ce criminel serait deux fois coupable (pour ses relations illicites avec la femme de son père et avec sa mère). -Non, dit R. Abahou au nom de R. Yohanan, peu importe que sa mère ait été propre à épouser son père, ou non; en tous cas, selon R. Juda, un tel criminel n’est qu’une fois coupable. Cette opinion se fonde, selon R. Yohanan, sur ce qu’il est dit (ibid. 18, 7): c’est ta mère, expression qui semble exclusive et indique que celui qui a commis le crime est seulement coupable d’inceste avec la mère, référant à ce crime tout le chapitre <sup>197</sup><i class=""footnote"">""Même formule au (Yebamot 2, 1)  ; Cf. (Qidushin 1, 1).""</i>. R. Aboun b. Hiya objecta devant R. Zeira: pourquoi invoquer seulement le texte relatif à l’inceste avec la mère, et omettre celui qui traite séparément de la relation illicite avec la femme du père? (Ne peut-on pas objecter que, pour cette dernière défense, l’expression spéciale c’est la nudité de ton père exclut la culpabilité d’inceste avec la mère, à l’opposé de la précédente déduction)? Une autre déduction est impossible, fut-il répondu, car R. Yohanan adopte l’avis de R. Ismael, qui dit: l’interprétation exégétique des mots “tu ne découvriras pas la nudité de ton père” (ibid.) vise, non le crime de la relation incestueuse, mais celui d’un commerce contre nature avec un mâle. Mais le père de quelqu’un n’est-il pas à légal de tout mâle? Une telle relation (en vertu des termes précités) entraîne une double culpabilité. En effet on a enseigné: celui qui a un commerce contre nature avec son père est 2 fois coupable (1° pour relation avec un mâle; 2° avec son père). Mais alors, dans l’énumération des 36 crimes entraînant la peine du retranchement, on devrait établir le compte de 37 (en comptant double ce dernier crime, de commerce contre nature avec son père)? R. Mena répond: le crime de commerce avec un mâle se trouve déjà énoncé pour un. L’expression tu ne découvriras pas la nudité de la femme de ton père (ib. 8) se rapporte bien à la femme mariée au père (qui n’est pas la mère); car la mère mariée au père forme l’interdit du verset précédent (ib. 7). Enfin, la défense s’applique aussi à la mère, qui n’est pas la femme légale du père <sup>198</sup><i class=""footnote"">P. ex. celle qui a été violée par le père.</i>, en raison de la suite (du même verset): c’est ta mère, tu ne découvriras pas sa nudité. Comment R. aqiba, qui ne tire pas la même déduction de ce verset, l’explique-t-il? -Selon lui, ces mots indiquent que la relation est interdite même après la mort du père. Mais d’après R. Ismaël, qui applique l’expression en question à la défense même de la relation avec la femme du père, d’où sait-on qu’il y a interdit même après la mort du père? De l’expression superflue c’est la nudité de ton père, il déduit qu’il n’y a pas de différence entre l’époque où le père vit et sa mort. R. aqiba, au contraire, interprète la première partie de ce verset, la nudité de la femme de ton père, en ce sens qu’il s’agit là de la femme du père (non de sa mère), que la suite, la nudité de ta mère, se rapporte à la vraie mère, qui est en même temps femme du père, et qu’enfin l’extension de l’interdit à la mère non mariée légalement au père est indiquée par la fin: c’est ta mère, ne découvre pas sa nudité. Selon R. Ismaël, qui n’admet pas autant d’interprétations, à quoi sert la fin du verset précitée? Elle sert à indiquer que l’interdit de relation persiste après la mort du père. R. aqiba n’a-t-il pas besoin d’appliquer ces mots à ce dernier interdit? C’est vrai, et il déduit l’extension de l’interdit à la femme non mariée légalement avec le père, de l’analogie entre les expression similaires “c’est la nudité de ton père”, “c’est la nudité de ta mère”: comme de ton père, tout ce qui est de lui (constituant sa nudité) est d’une relation défendue, soit à titre de pénalité, soit sous le rapport de l’avertissement; de même, de ta mère, tout ce qui est d’elle (même sans mariage légal) constitue une relation interdite. En somme, il en résulte que l’on semble expliquer seulement ce verset d’après l’opinion de R. Juda (d’attribuer à ce crime d’inceste une seule culpabilité); car il n’est pas d’avis de baser l’interdit pour la mère, qui est aussi la femme du père, sur l’interprétation de l’analogie entre les expression “c’est la nudité de ton père”, “c’est la nudité de ta mère”, avec les déductions de cette analogie. Ceci prouve, dit R. Zeira, qu’une analogie entre deux termes, dont un seul a son application immédiate <sup>199</sup><i class=""footnote"">""Ainsi, p. ex. l'expression """" il a découvert la nudité de son père """" est nécessaire pour établir la nécessité de cet avis.""</i>, peut aussi servir de base à une déduction d’extension de l’interdit. -Non, dit R. Judan, ceci ne se rapporte en rien à R. aqiba, car d’après lui on peut tirer une déduction de l’analogie des termes, même lorsqu’aucun d’eux n’a d’application directe.",,
Jerusalem Talmud Sanhedrin 7:6:6,רבי ירמיה בעי הבא על אמו מהו שהוא חייב עליה משום אשת איש. תא חמי אילו בא אחר עליה חייב משום אשת איש בנה לא כל שכן. התיב רבי יוסי הרי חורגה הרי הוא חייב עליה משום אשת איש ובנה אינו חייב עליה משום אשת איש. דתני אף בשאר כל העריות כן חמותו ואשת איש את תופשו משום חמותו כלתו ואשת איש את תופסו משום כלתו אחותו ואשת איש את תופסו משום אחותו. מבריחו מן החמורה ומקנתרו בקלה לית יכיל דתני הבא על אחותו חייב עליה משום אחותו ומשום בת אשת אביו. ר' יוסי בי ר' יודה אומר הבא על אחותו אינו חייב עליה אלא משום שם אחד בלבד וכן הבא על כלתו. ר' ירמיה ר' אבהו בשם ר' יוחנן אתייא דר' יוסי בי ר' יודה כשיטת ר' יודה אביו כמה דר' יודה תופש שם ראשון כן ר' יוסי בי ר' יודה תופש שם ראשון. חזר ר' ירמיה ר' אבהו בשם ר' יוחנן לית לר' יוסי בי ר' יודה כשיטת ר' יודה אביו תמן אמו בלא אשת אביו חייב אשת אביו בלא אמו חייב ברם הכא מצינו בת אשת אביו בלא אחותו הוא מותר בה:,"R. Jérémie demanda: est-ce que celui qui commet un inceste avec sa mère est aussi coupable du crime d’adultère? Cette question est inutile, car si un autre avait cohabité avec cette femme, il serait certes coupable du crime d’adultère; donc, son fils l’est à plus forte raison. Toutefois, observa R. Yossé, selon les termes de la Mishna, pour le commerce avec sa bru l’adultère est spécifié comme ayant lieu, tandis que pour le fils il est question du crime de relation avec la femme du père et avec la mère, non d’adultère (la question avait donc lieu d’être posée). On a en effet enseigné: il en est de même pour toutes les autres règles de relations illicites, et l’interdit le plus grave domine; ainsi, celui qui a eu commerce avec sa belle-mère, qui est mariée, est coupable du crime de relation avec la belle-mère, non d’adultère; si la femme est sa bru et mariée, le complice est coupable du seul crime de relation avec la bru; si la femme est sa sœur et qu’elle est mariée, le complice est coupable du seul crime d’inceste avec la sœur. On ne saurait disculper un tel homme du crime grave, et le charger seulement de celui qui est moins grave (celui d’adultère, dont la pénalité est d’un degré moindre). Or, on a enseigné <sup>200</sup><i class=""footnote"">Tossefta à ce traité, ch. 10.</i>: celui qui cohabite avec sa sœur est coupable de relation avec sa sœur et avec la fille de la femme de son père (deux fois). Selon R. Yossé b. Juda, celui qui commet un tel inceste est seulement coupable pour un crime d’une dénomination (de sœur), et il en est de même pour la relation avec la belle-fille (quoique mariée). R. Jérémie ou R. Abahou dit au nom de R. Yohanan: l’avis que vient d’exprimer R. Yossé b. R. Juda est conforme à celui de R. Juda son père; comme dans notre Mishna, il n’impose qu’une culpabilité pour la dénomination essentielle de l’interdit, de même R. Yossé b. Juda n’attache d’importance qu’à la première désignation du crime. Puis, R. Jérémie revint sur son assertion et dit que, selon R. Abahou au nom de R. Yohanan, R. Yossé b. Juda n’a pas adopté l’avis de son père, R. Juda, car il y a une distinction notable à établir entre notre Mishna et l’avis précité: ailleurs, le crime d’inceste avec la mère peut exister sans qu’il s’agisse de la femme de son père (une veuve), et il y a culpabilité, de même que l’on peut se rendre coupable de relation illicite avec la femme de son père sans qu’elle soit la mère <sup>201</sup><i class=""footnote"">Si donc les 2 faits sont réunis, il y a double culpabilité.</i>; tandis qu’ici il s’agit de la fille de la femme de son père qui n’est pas sa sœur, auquel cas elle lui est permise.",,
Jerusalem Talmud Sanhedrin 7:7:1,הבא על הזכר ועל הבהמה והאשה המביאה את הבהמה אם אדם חטא בהמה מה חטאת אלא לפי שבאת לאדם תקלה על ידיה לפיכך אמר הכתוב תיסקל דבר אחר שלא תהא הבהמה עוברת בשוק ויאמרו זו היא שנסקל איש פלוני על ידיה:,"Si un homme a des relations contre nature avec son semblable, ou avec un animal, ou si une femme fait approcher un animal pour se prostituer à lui, l’animal sera soumis à la lapidation. Puisque l’être humain a péché, pourquoi l’animal est-il frappé? L’animal est innocent, mais il était la cause d’un crime; ou encore, on ne peut pas le laisser vivre, car en le voyant passer dans la rue, on dira: Voilà l’animal qui a été la cause de la condamnation de tel individu <sup>202</sup><i class=""footnote"">Or, la Loi tient compte du respect dû aux individus.</i>.",2061,
Jerusalem Talmud Sanhedrin 7:7:2,"אזהרה לבא על הזכר מניין ואת זכר לא תשכב משכבי אשה. כרת מניין כי כל אשר יעשה מכל התועבות האלה ונכרתו וגו'. עונש מניין ואיש אשר ישכב את זכר משכבי אשה תועבה עשו שניהם מות יומתו דמיהם בם. את יליף דמיהם בם מדמיהם בם עד כדון לשוכב לנשכב מניין ואת זכר לא תשכבר משכבי אשה קרי ביה לא תישכב. עד כדון כר' עקיבה כר' ישמעאל לא יהי' קדש מבני ישראל. כרת לנשכב כר' ישמעאל מניין ר' ירמיה בשם ר' אבהו נאמר כאן קדש ונאמר להלן וגם קדש היה בארץ את למד קדש מקדש וקדש מתועבה. ר' חייה בר אדא בשם רבי חנינה תועבה מתועבה. א""ר יוסי בי ר' בון מתניתא אמרה כן תועבה עשו שניהם שניהם בסקילה שניהם באזהרה שניהן בהכרת.","La défense négative formelle d’avoir des relations contre nature avec un mâle est exprimée par ces mots (Lv 18, 22): Ne cohabite pas avec un mâle d’une cohabitation sexuelle. On sait que ce crime est puni de la peine du retranchement, de ce qu’il est dit (ib. 29): Si quelqu’un accomplit une de ces abominations, cette âme sera retranchée, etc.; de plus, en ce cas, le tribunal prononcera la peine capitale, comme il est dit (ibid. 20, 13): Si un individu cohabite avec un mâle d’une cohabitation sexuelle, c’est une abomination qu’ils ont commise tous deux ; qu’ils soient punis de mort, leur supplice est mérité. Or, l’on sait qu’en ce cas la pénalité est celle de la lapidation, par analogie des derniers mots dudit verset et de ceux usités pour le nécromancien (ib. 27). On sait ainsi quelle est la culpabilité du complice actif; d’où le sait-on pour le complice passif? Le verset précité peut aussi s’entendre dans le sens passif. Ce qui précède est émis d’après l’avis de R. aqiba (qui admet les déductions tirées d’un verset); mais, selon R. Ismaël, on le sait de ce qu’il est dit (Dt 23, 18): Il n’y aura pas de fornicateur (sodomite) parmi les enfants d’Israël, ce qui englobe le complice passif. D’où sait-on, selon R. Ismaël <sup>203</sup><i class=""footnote"">Il n'a pas recours aux déductions, admises par R. Akiba, du verset relatif aux relations illicites.</i>, que ce dernier est passible du retranchement? R. Jérémie répond au nom de R. Abahou: comme ici on emploie le terme fornicateur, que l’on retrouve ailleurs dans ce texte (1R 14, 24): il avait été aussi fornicateur dans le pays ; ils ont imité toutes les abominations des païens etc. -Or, de même que l’on établit un parallèle entre les termes répétés de fornicateur, on suppose que le mot abomination (exprimé au second verset) se retrouve au précédent texte, et qu’il entraîne la pénalité afférente au crime contre nature ainsi qualifié (passible du retranchement, comme toutes les relations illicites). Aussi, R. Hiya b. Ada dit au nom de R. Hanina que l’on établit un parallèle entre les termes abomination de ces divers textes. En effet, ajoute R. Yossé b. Aboun, on trouve un enseignement qui s’exprime ainsi: par l’expression ils ont commis tous deux une abomination (Lv 20, 13), on sait que tous deux sont passibles de la lapidation, qu’à tous deux s’adresse la même défense, et que tous deux sont aussi passibles de la peine du retranchement (à défaut de la sentence du tribunal).",2061,
