Index_Title,Jerusalem_Talmud_Mechon_Mamre,Schwab_fr,id_paragraphe,missing_footnotes
Jerusalem Talmud Sanhedrin 3:6:2,מכיון דתנינן אחיו מה צורכה למיתני אחי אביו לומר בנו וחתנו של חתן,"Dès que l’on considère comme parent le frère (avec ses fils), à quoi bon parler “du frère du père”? (Si le fils du frère est un parent pour son oncle, celui-ci l’est pour son neveu)? C’est pour dire qu’au même titre que le fils du frère, le gendre de ce dernier est tenu pour parent, ainsi que le gendre du gendre.",2024,
Jerusalem Talmud Sanhedrin 3:6:3,אחי אביו. מכיון דתנינן אחי אביו מה צורכה למיתני אחי אמו לומר בנו וחתנו של חתן,"De même, puisque le frère du père est noté comme parent, à quoi bon mentionner le frère de la mère? Pour dire que le fils et le gendre du gendre du frère de sa mère sont considérés comme parents.",,
Jerusalem Talmud Sanhedrin 3:6:4,אחי אמו. מכיון דתנינן בעל אחותו מה צורכה למיתני בעל אחות אביו לומר בנו וחתנו של חתן,"De même, dès que le mari de la sœur est un parent, ne va-t-il pas de soi de défendre aussi le mari de la sœur du père, l’oncle par alliance? C’est pour dire que le fils et même le gendre du gendre du mari de la sœur du père est considéré comme parent.",,
Jerusalem Talmud Sanhedrin 3:6:5,בעל אחות אביו. מכיון דתנינן בעל אחות אביו מה צורכה למיתני בעל אחות אמו לומר בנו וחתנו של חתן,,,
Jerusalem Talmud Sanhedrin 3:6:6,בעל אחות אמו. והתנינן חורגו לבדו. רב אמר אם חתן חמותו אסור בעל וחרגתו לא כל שכן. תיפתר שיש לה בנים וחתנים ממנו.,"On indique aussi à part comme inapte le mari de la sœur de la mère, pour viser comme inaptes le fils et le gendre du gendre du mari de la sœur de sa mère. Mais n’a-t-on pas enseigné que le “beau-fils seul” est tenu pour inapte comme parent? (N’est-ce pas à l’exclusion de la femme)? Or, dit Rav, si le gendre de la belle-mère est interdit comme parent, ne va-t-il pas sans dire d’envisager de même le mari de la belle-fille (du 1er mari)? Non, il s’agit seulement d’interdire les beaux-fils ou gendres d’une femme par son mari actuel.",,
Jerusalem Talmud Sanhedrin 3:6:7,אגיסו אית תניי תני יש לו בנים וחתנים אית תניי תני אין לו בנים וחתנים. מאן דמר יש לו בנים וחתנים ממנה ומאן דמר אין לו בנים וחתנים ממקום אחר.,"Par le terme “beau-frère (ou belle-sœur)”, on comprend aussi les fils ou gendres de celui-ci; selon une autre version, les fils et gendres ne sont pas compris. -Toutefois, ces 2 avis ne se contredisent pas: le 1er se réfère aux fils ou gendres de la sœur de la femme; le second se rapporte aux fils ou gendre par une autre femme.",,
Jerusalem Talmud Sanhedrin 3:6:8,רב נפק למיתרי משכון לרבי חייה רבה עבר בחד אתר ואשכח רבי יוחנן יתיב ומקשי תנינן חורגו לבדו אשת חורגו מהו בעל חורגתו מהו. אשה כבעלה ובעל כאשתו. וקמת אשר חורגו כחורגו והבעל כאשה.,"Comme Rav cherchait un domicile pour R. Hiya le grand, il passa par un endroit où il trouva R. Yohanan en train de se demander si l’expression de la Mishna “son beau-frère seul” exclut la femme, de sorte que la femme du beau-fils, et le mari de la belle-fille restent aptes à attester? Ou dit-on qu’il y a similitude entre le mari et la femme, de sorte que cette parenté constitue l’interdit? Cette dernière considération de similitude l’emporte (la restriction du mot seul ne s’étend qu’aux fils et gendres",,
Jerusalem Talmud Sanhedrin 3:6:9,רב חסדא בעי דור שלישי מהו שיהא מותר באשת ראשון משה מהו שיהא מותר באשת פינחס. ריש לקיש אמר מקבלין דור שני ודור שלישי מדוחק רבי יוחנן אמר אפילו מריוח.,"R. Hisda demanda: est-ce que quelqu’un de la 3e génération peut attester dans une question concernant la femme de la 1re génération? (Ou à l’inverse)? Ainsi, Moïse aurait-il pu attester en ce qui concerne la femme de Pinhas? Resh Lakish répond: c’est admissible au grand besoin pour la 2e ou la 3e génération; selon R. Yohanan, c’est admissible même librement (lorsqu’on peut aussi recourir à d’autres témoins).",,
Jerusalem Talmud Sanhedrin 3:6:10,כחדא אגיסיה דרב הונא הוה ליה דין עם חד בר נש אמר כל מה דרב הונא אמר אנא מקבל עלי. שמע רב הונא ואמר כהדין. יודעני כשם שאמרו מלמעלן כך אמרו מלמטן. רב ירמיה בשם רב הלכה כרבי יודה:,"Un témoin qui n’était plus parent du plaideur au moment de l’action qu’il certifie peut la juger”. Ainsi, le beau-frère de R. Houna eut un procès avec quelqu’un (lequel beau-frère, un moment sont parent ou allié, ne l’était plus alors); il dit: tout ce que R. Houna prononcera dans ce procès, je l’accueillerai. R. Houna l’ayant entendu, le confirma, et ajouta: il est clair, comme la Mishna admet l’aptitude la génération qui est au-dessus (de celui qui avait été le gendre d’un plaideur, mais qui ayant perdu sa femme n’est plus son allié), qu’elle l’admet aussi pour la génération d’au-dessous (pour le beau-frère qui est dans le même cas). R. Jérémie dit au nom de Rav: on adopte en règle l’avis de R. Juda (de ne pas laisser témoigner le gendre).",,
Jerusalem Talmud Sanhedrin 3:7:1,האוהב והשונא אי זהו האוהב זה שושבינו והשונ' כל שלא דיבר עמו שלשת ימים באיבה אמרו לו לא נחשדו ישראל על כך:,"L’ami et l’ennemi sont inaptes aussi à attester. L’ami est p. ex. le garçon d’honneur (l’ami de noces, qui est incapable de témoigner dans l’affaire du marié pendant les jours de la noce <sup>104</sup><i class=""footnote"">Comme le Talmud l'explique ci-après.</i>; l’ennemi est celui qui ne lui a pas parlé depuis 3 jours par haine contre lui. Les autres docteurs lui dirent: on ne soupçonne pas un israélite de faux témoignage pour cause d’amitié ou de haine <sup>105</sup><i class=""footnote"">Rashi ajoute : tout le monde cependant est d'accord qu'un ennemi ne peut pas être juge.</i>.",2025,
Jerusalem Talmud Sanhedrin 3:7:2,רבי טבליי רבי אבינא בשם רב בשבעת ימי המשתה שנו:,R. Tablia ou R. Abina dit au nom de Rav: pendant les 7 jours de la noce le garçon d’honneur est un ami (inapte à témoigner).,2025,
Jerusalem Talmud Sanhedrin 3:8:1,כיצד בודקין את העדים היו מכניסין אותן ומאיימין עליהן ומוציאין אותן לחוץ ומשיירין את הגדול שבהן ואומר לו אמור האיך אתה יודע שזה חייב לזה אם אמר הוא אמר לי שאני חייב לו איש פלוני אמר לי שהוא חייב לא אמר כלום עד שיאמר בפנינו הודה לו שהוא חייב לו מאתים זוז:,"Pour s’assurer de l’exactitude des témoignages, on fait entrer les témoins dans une chambre à part; on leur fait comprendre la gravité d’un faux témoignage; on fait sortir tout le monde, on laisse seul le témoin le plus important, et on lui demande: “Comment sais-tu que cet homme doit de l’argent au demandeur”? S’il répond qu’il l’a entendu dire à quelqu’un, ou bien que le défendeur le lui a raconté, son témoignage est nul <sup>106</sup><i class=""footnote"">Il arrive souvent, dit Rashi, qu'on dit avoir des dettes pour ne pas être supposé riche.</i>, sauf si le témoin dit: le défendeur a avoué devant nous devoir p. ex. 200 zouz.",2026,
Jerusalem Talmud Sanhedrin 3:8:2,רבי יוסי בשם רבי יוחנן אם היה מתכוין למסור לו עדות עדותן קיימת.,"Selon R. Yossé au nom de R. Yohanan, si le témoin interrogé dit: “que le défendeur le lui a raconté”, non comme simple récit, mais dans le but que sa présence serve à attester le fait, le témoignage sera valable.",2026,
Jerusalem Talmud Sanhedrin 3:8:3,כיצד דינין הדיינין יושבין והנידונין עומדין והתובע פותח בדבריו ראשון שנאמר מי בעל דברים יגש אליכם.,"Voici comment on procède en justice: les juges sont assis, les plaideurs debout, et le demandeur a le premier la parole, comme il est dit (Ex 24, 14): Celui qui a un procès s’approchera de vous. ",,
Jerusalem Talmud Sanhedrin 3:8:4,ומניין שהמוציא מחבירו עליו הראיה רבי קריספא בשם רבי חנניה בן גמליאל יגש אליכם יגש ראיותיו.,"On sait <sup>107</sup><i class=""footnote"">""Tossefta, ch. 6 ; Rabba sur (Nb 5) ; Cf. B., Baba Qama 46.""</i> que le demandeur est tenu de prouver le bien-fondé de sa réclamation, dit R. Qrispa au nom de R. Hanania b. Gamliel, par l’expression “s’approchera de vous”. ",,
Jerusalem Talmud Sanhedrin 3:8:5,רבי יוחנן בעי ביבמה מי מרדף אחר מי. התיב רבי לעזר והכתיב ועלתה יבמתו השערה אמר רבי יוחנן יפה לימדני רבי לעזר.,"R. Yohanan demanda <sup>108</sup><i class=""footnote"">J., (Yebamot 12, 6) .</i>: pour le lévirat, lequel des 2 conjoints (au cas où chacun habite une localité différente) devra suivre l’autre? Il semble que la femme doit suivre le mari, dit R. Eléazar, puisqu’il est écrit (Dt 25, 7): la belle-sœur se rendra à la porte. Lorsque R. Yohanan entendit cette interprétation, il déclara que l’enseignement de R. Eléazar est parfait. ",,
Jerusalem Talmud Sanhedrin 3:8:6,רבי ברכיה ורבי חלבו רבי בא בשם רבי ינאי התובע תובע והנתבע משיב והדיין מכריע. אמר רבי סימון צריך הדיין לשנות טענותיהן שנאמר ויאמר המלך זאת אומרת זה בני החי ובנך המת וגו'.,"R. Berakhia, R. Helbo et R. Aba disent au nom de R. Yanaï: le demandeur expose sa réclamation, le défendeur fait valoir les motifs de refus, puis le juge énonce la sentence arbitrale. R. Simon dit <sup>109</sup><i class=""footnote"">""Rabba à Deutér., ch. 5; Midrash sur (Ps 72).""</i>: le juge doit d’abord répéter les arguments de chaque plaideur, comme il est dit (1R 3, 23): le roi dit: comme l’une prétend que le fils vivant est à elle et le mort à toi, etc. ",,
Jerusalem Talmud Sanhedrin 3:8:7,רב הונא כד הוה חמי סהדי בכוונא הוה חקר וכד הוה חמי הכן הוה מכוון. רב הונא מיקל לדיינא דאמר מקבלין עליכון חד סהיד אלא יימרון אינון. רב הונא כד הוה ידע זכו לבר נש בדינא ולא הוה ידע ליה הוה פתח ליה על שם פתח פיך לאלם.,"Lorsque R. Houna remarquait l’identité de termes de 2 témoignages, il poussait d’autant plus loin l’enquête dans l’interrogatoire, et il reconnaissait alors que les témoins étaient entendus pour témoigner à faux <sup>110</sup><i class=""footnote"">Cf. ci-après, (4, 1).</i>. Il méprisait le juge qui demandait au plaideur s’il accepte le témoin unique opposé par l’adversaire; il faut laisser le plaideur arguer seul. Lorsque R. Houna reconnaissait l’innocence de quelqu’un, qui ne savait pas la faire valoir, il l’exposait pour lui, selon ces mots: (Pr 31, 8): Ouvre ta bouche pour le muet (aide-le). ",,
Jerusalem Talmud Sanhedrin 3:8:8,"רבי אבהו בשם רבי יוחנן המכמין עידיו אחורי גדר לא עשה כלום. כהדא חד בר נש אשגח למיגוס גו אריסטון א""ל הב לי מה דאת חייב לי אמר ליה אין. בתר דקמון אמר ליה לי נא חייב לך כלום אמר ליה אית לי סהדין. אמר ליה לא אמרית אלא בגין דלא מיערבב מגוסתך. אתא קומי רבי אמי ומר הדא דמר ר' יוחנן המכמין עידיו אחורי גדר לא עשה כלום:","R. Abahou dit au nom de R. Yohanan: aposter des témoins derrière la clôture (pour qu’ils confirment un aveu obtenu) ne sert à rien. Ainsi, quelqu’un accepta à dîner, ariston , chez son prochain; celui-ci à table réclama à l’invité une dette: je paierai, répondit le dernier. Une fois levé, il déclara ne rien devoir à son hôte. J’ai des témoins, dit celui-ci, de ton aveu de dette. Je n’ai dit vouloir payer, répondit l’invité, que pour ne pas troubler ton repas. La cause fut portée devant R. Amé, qui dit: selon l’avis de R. Yohanan: aposter des témoins derrière une clôture, en vue d’une confirmation d’aveu, ne sert à rien.",,
Jerusalem Talmud Sanhedrin 3:9:1,היו מכניסין את השני ובודקין אותו נמצאו דבריהן מכוונין נושאין ונותנין בדבר שנים אומרים זכאי ואחד אומר חייב זכאי שנים אומרים חייב ואחד אומר זכאי חייב אחד אומר זכאי ואחד אומר חייב ואחד אומר איני יודע יוסיפו הדיינין ואפילו שנים מזכין או מחייבין ואחד אומר איני יודע יוסיפו הדיינין:,"On fait venir ensuite l’autre témoin, et on l’examine de la même façon. Si les deux témoignages s’accordent entre eux, les juges commencent à délibérer. Si 2 des 3 juges veulent l’acquitter et le 3e veut le condamner, il est acquitté; si 2 veulent le condamner et le 3e veut l’acquitter, il est condamné. Si un juge veut le condamner, le deuxième veut l’acquitter, mais le troisième dit qu’il ne sait pas comment se prononcer, il faut adjoindre d’autres juges; quand même il y aurait eu 5 juges d’abord, dont 2 seraient pour l’acquittement, 2 pour la condamnation, et le 5e ne saurait pas se prononcer, il y aurait lieu d’adjoindre d’autres juges.",2027,
Jerusalem Talmud Sanhedrin 3:9:2,מיעוט שעירים שנים מה תלמוד לומר שני שיהו שניהן שוין.,,2027,
Jerusalem Talmud Sanhedrin 3:9:3,"כבשים מיעוט כבשים שנים מה ת""ל שני שיהו שניהן שוין.",,,
Jerusalem Talmud Sanhedrin 3:9:4,מיעוט צפרים שנים מה תלמוד לומר שתי שיהו שוות. מיעוט חצוצרות שתים מה תלמוד לומר שתי שיהו שוות.,,,
Jerusalem Talmud Sanhedrin 3:9:5,התיב רבי חגי לרבי יסא והכתיב ועמדו שני האנשים מעתה מיעוט אנשים שנים מה תלמוד לומר שני שיהו שוין והכתיב לא תטה משפט גר יתום הרי גר דן עם מי שאינו גר יתום דן עם מי שאינו יתום. אם כן למה נאמר שני. מופנה להקיש ולדון ממנו גזירה שוה. נאמר כן שני ונאמר להלן וישארו שני אנשים מה להלן אנשים ולא נשים אף כאן אנשים ולא נשים ולא קטנים. הרי למדנו שאין האשה דנה ולא מעידה.,,,
Jerusalem Talmud Sanhedrin 3:9:6,"ר' יוסי בי ר' בון בשם רבי יוסף נאמר כאן שני ונאמר להלן שני מה להלן על פי שנים עדים אף כאן על פי שנים עדים אם כן מה ת""ל שני שלא יהא אחד עומד ואחד יושב אחד אומר כל צורכו ולאחד אומר לו קצר דבריך.",,,
Jerusalem Talmud Sanhedrin 3:9:7,"א""ר יהודה שמעתי שאם רצה הדיין להושיב את שניהן מושיב. רבי ישמעאל אומר אומרין לו לבוש כשם שהוא לבוש או הלבישהו כשם שאת לבוש.",,,
Jerusalem Talmud Sanhedrin 3:9:8,אמר רבי בא בשם רב הונא צריכין העדים לעמוד בשעה שמעידין שנאמר ועמדו שני האנשים. רבי ירמיה בשם רבי אבהו אף הנידונין צריכין לעמוד בשעה שמקבלין דינן שנאמר אשר להם הריב לפני ה'.,,,
Jerusalem Talmud Sanhedrin 3:9:9,"כתיב לא יומתו אבות על בנים והלא כבר נאמר איש בחטאו יומת מה ת""ל לא יומתו אבות על בנים. לא יומתו אבות בעדות בנים ובנים לא יומתו בעדות אבות. מניין שלא יהו העדים קרובין של נידונין","<sup>111</sup><i class=""footnote"">En tête est une page traduite (Yoma 6, 1) . Cf. (Shevuot 4, 1).</i>. Il est écrit (Dt 24, 6): les pères ne doivent pas mourir à cause des fils, etc. A quoi bon, après ces mots, est-il dit (ibid.): Chacun sera mis à mort pour son propre méfait? Ces mots veulent dire que les pères ne pourront être condamnés à mort sur le témoignage des fils, ni les fils d’après le témoignage du père d'où il résulte que les témoins ne doivent pas être proches parents des accusés. ",,
Jerusalem Talmud Sanhedrin 3:9:10,ומניין שלא יהו העדים קרובין זה לזה. הגע עצמך שאם הוזמו לא מפיהן נהרגין. ומניין שלא יהו העדים קרובין של דיינין הגע עצמך שאם הוזם אחד מהן כלום נהרג עד שיוזם חבירו. אם את אומר כן לא היה נהרג על פיו.,"D’autre part, les témoins ne doivent pas non plus être parents entre eux; car s’ils étaient admis quoique parents, il arriverait qu’en cas de conviction de faux de l’un d’eux, ce dernier ne serait pas de ce fait condamné à mort, sur le dire du 2e témoin son proche, à moins que celui-ci soit aussi convaincu de faux (il faut le double faux pour les condamner).",,
Jerusalem Talmud Sanhedrin 3:9:11,ומניין שלא יהו הדיינין קרובין זה לזה. אמרה תורה הרוג על פי עדים הרוג על פי דיינין מה עדים אין קרובין זה לזה אף דיינין אין קרובין זה לזה.,"De même, les témoins ne doivent pas non plus être proches parents des juges; sans quoi, en cas de conviction de faux par les juges, ceux-ci seraient tenus de condamner à mort leurs parents (cruauté inadmissible). Enfin les juges ne doivent pas être parents entre eux, règle à déduire par comparaison: la Loi ordonne de condamner à mort le coupable, selon la déclaration des témoins et sur l’ordre prononcé par les juges; comme les témoins ne doivent pas être proches parents entre eux, les juges ne devront pas l’être non plus.",,
Jerusalem Talmud Sanhedrin 3:9:12,"אין לי אלא אבות ובנים שאר קרובין מניין א""ר זעירא ובנים לרבות שאר קרובין.","Par le verset précité on sait seulement que la parenté entre le père et le fils constitue un obstacle: d’où le sait-on aussi pour d’autres degrés de parenté? On le déduit, répond R. Zeira, de ce qu’il est dit: ET les fils etc. ",,
Jerusalem Talmud Sanhedrin 3:9:13,עד כדון כרבי עקיבה,"Cette explication est juste, d’après R. aqiba (qui déduit les dites inaptitudes du verset précité);",,
Jerusalem Talmud Sanhedrin 3:9:14,"כרבי ישמעאל מניין תני רבי שמעאל ושפטו העדה והצילו העדה שלא יהא העדה לא קרובי מכה ולא קרובי מוכה. א""ר יוסי אם אתה אומר כן נמצאת אומר בית דין גואלי הדם מיכן שלא יהו הדיינין קרובי הנידונין ומניין שלא יהו העדים קרובי הנידונין אמרה תורה הרוג ע""פ עדים הרוג על פי דיינין מה הדיינין אינן קרובי הנידונין אף העדים לא יהו קרובי הנידונין. ומניין שלא יהו העדים קרובין זה לזה. הגע עצמך שהוזמו לא מפיהן הן נהרגין","mais d’où le sait-on d’après Ismaël? De ce qu’il est dit (Nb 35, 24-25) la communauté le jugera la communauté le sauvera; le second terme (explétif) indique que nul de la communauté ne devra être un parent, soit de ceux qui frappent (jugent) soit de ceux qui sont frappés; car, ajoute R. Yossé, si un tel parent était admis à agir ainsi il pourrait arriver qu’il y ait dans le tribunal des “vengeurs du sang” (parents du condamné), hypothèse inconciliable avec la prescription biblique “de juger entre celui qui a frappé et les vengeurs du sang <sup>112</sup><i class=""footnote"">V. Siffri section Massé, n° 160.</i>”. Donc, la parenté entre les juges et les accusés est interdite. Enfin, les témoins ne doivent pas être proches parents des accusés, en raison du parallélisme établi par la loi entre les témoins et les juges pour l’arrêt de mort: comme ces derniers ne doivent pas être parents des accusés, les autres ne devront non plus l’être.",,
Jerusalem Talmud Sanhedrin 3:9:15,בכשירים ולא בפסולים. שנאמר אם לא יגיד ונשא עונו את שמגיד וחבירו משלם ממון צא פסול שאפילו מגיד אין חבירו משלם ממון.,"Par des gens aptes, non par les inaptes <sup>113</sup><i class=""footnote"">Selon les termes de Shevuot ibid.</i>”, car il est dit (Lv 5, 1) S’il ne le dit pas il en supportera la faute; celui dont le dire peut condamner le prochain à payer sera fautif, mais le témoin inapte dont le dire n’a pas de conséquence n’est pas fautif s’il s’abstient.",,
Jerusalem Talmud Sanhedrin 3:9:16,בפני בית דין להוציא עד אחד בשאמרו לו הרי את מקובל עלינו כשנים. יכול יהא חייב תלמוד לומר ראה או ידע את שהוא כשר להעיד עדות תורה יצא עד אחד שאין כשר להעיד עדות תורה.,"Par ceux aptes à attester devant le tribunal” aura lieu la prestation de serment, à l’exclusion d’un seul témoin, dont l’assertion n’a pas de conséquence légale. Est-ce à dire que le témoin à qui l’on a dit vouloir l’accepter à l’égal de deux <sup>114</sup><i class=""footnote"">Pouvant entraîner la condamnation.</i> sera passible de sacrifice “s’il n’a pas dit” ce qu’il savait? -Non, parce qu’il est dit (ibid.): s’il a vu ou s’il sait; celui qui est apte légalement sera fautif “s’il ne dit pas”, non le témoin isolé inapte également.",,
Jerusalem Talmud Sanhedrin 3:9:17,"שלא בפני ב""ד אם לא יגיד ונשא עונו את שמגיד ומשלם ממון יצא חוץ לב""ד שאפילו מגיד אין חבירו משלם ממון.","“Ou sans que ce soit par devant le tribunal” s’il ne le dit pas il en supportera la faute, au cas où l’attestation eût motivé la condamnation à payer, non en dehors du tribunal où l’attestation n’a pas cette conséquence.",,
Jerusalem Talmud Sanhedrin 3:9:18,ומניין לשני עדים הוא ועד אחד הרי כאן שנים וכר' ישמעאל דר' ישמעאל אמר כל מקום שכתוב בתורה עד סתם הרי הוא בכלל שני עדים עד שיודיעך הכתוב שהוא עד אחד. אשכח תני רבי ישמעאל עד אחד מהו לחייב עליו משום שבועת ביטוי. איפשר לומר אחר ראוי לצרפו ולחייבו משום שבועת עדות ואת מחייבו משום שבועת ביטוי.,"Pourquoi la double attestation entraîne-t-elle seule la faute, lorsque ce verset dit: et s’il est témoin (unique)? La conjonction et implique la double présence des témoins; c’est conforme à R. Ismaël qui dit: chaque fois que la Loi parle de témoin vaguement, elle comprend 2 témoins, à moins de spécifier quand un seul suffit. On trouve ainsi l’explication pourquoi R. Ismaël enseigne qu’en présence seulement de 2 témoins le serment sera imposé; mais un seul témoin peut-il être passible de sacrifice pour faux serment de parole? Certes non; car on ne saurait dire qu’il y a lieu de lui adjoindre un autre afin d’entraîner l’obligation du sacrifice pour un tel serment (usité seulement en dehors de la justice).",,
