Index_Title,Jerusalem_Talmud_Mechon_Mamre,Schwab_fr,id_paragraphe,missing_footnotes
Jerusalem Talmud Sanhedrin 9:6:3,אמרין כמה דאישתאלת על דר' יוסי כך אישתאלת על דר' ישמעאל דתני בשם ר' ישמעאל נתאלמנה ונתגרש' נתחללה זינת ואחר כך בא עליה אינו חייב אלא אחת. זינת ונתחללה ואחר כך בא עליה חייב על כל אחת ואחת. נתאלמנה נתגרשה כאחת מה אמר בה ר' ישמעאל חומר בקל מה אמר בה ר' ישמעאל שני איסורין כאחת מה אמר בה ר' ישמעאל.,"De même, que dit R. Yossé si les deux causes d’interdit (d’être sa bru et mariée) sont simultanées? Il fut répondu que des questions semblables à celle-ci ont été posées à R. Ismaël, au nom de qui l’on a enseigné: Si une femme est devenue veuve, puis remariée a été répudiée, et a été profanée, et elle s’est prostituée, enfin le grand prêtre a cohabité avec elle, il est 4 fois coupable (pour les 4 faits survenus successivement à cette femme); mais si l’ordre diffère, et que la femme se soit d’abord prostituée, avant la survenance des autres faits qui la rendent interdite à cet homme, il n’est qu’une fois coupable pour son commerce avec elle <sup>264</sup><i class=""footnote"">""Lorsqu'il n'y a pas d'augmentation d'interdits gradués, ils ne s'ajoutent pas l'un à l'autre ; or la question est de savoir si en cas d'augmentation seulement il y a distinction dans la série d'interdits, ou non.""</i>. Si elle est devenue en même temps veuve et femme répudiée (si les deux causes d’interdit <sup>265</sup><i class=""footnote"">Si elle a conclu p. ex. un mariage douteux avec A et un mariage valable avec B, elle devra être répudiée par suite du premier, ce qui valide l'union avec le second mari, et il arrive que ce dernier meure aussitôt. V. B., Qidushin 77.</i> sont simultanées), qu’en dit R. Ismaël, et est-il d’avis que si le second crime est plus grave que le premier, ils comptent tous deux en cas de jonction, ou non, ainsi qu’en cas de deux interdits réunis? (Questions diverses non résolues).",,
Jerusalem Talmud Sanhedrin 9:6:4,רב אמר במפנים עדיו היא מתניתא ר' יוסי בן חנינה אמר שאינו יכול לקבל התריה:,"– Un “assassin sans témoins”, dont parle la Mishna est celui, dit Rav, qui a été vue par des témoins placés chacun dans un coin (attestations isolées, n’entraînant pas de peine capitale); selon R. Yossé b. R. Hanina, il s’agit du cas où le meurtrier n’a pu être averti de la gravité du crime (faute de temps ou de proximité).",,
Jerusalem Talmud Sanhedrin 9:7:1,"הגונב את הקסווא והמקלל בקסם והבועל ארמית קנאין פוגעין בהן כהן ששימש בטומאה אין אחיו הכהנים מביאין אותו לב""ד אלא פירחי כהונה מוציאין אותו חוץ לעזרה ומפצעין את מוחו בגיזירין זר ששימש במקדש ר' עקיבה אומר בחנק וחכמים אומרים בידי שמים:","Quiconque <sup>11</sup><i class=""footnote"">Lorsqu'avec celle-ci Dieu s'est entendu.</i> enlève la couverture (qui sert à couvrir les vases sacrés), ou blasphème Dieu par des sacrilèges, ou cohabite avec une femme araméenne, est frappé par les zélateurs <sup>266</sup><i class=""footnote"">Le dernier péché est celui de Zimri, vengé par Phinéas, dit M. Derenbourg, ibid., p. 238, n. 3 : il n'est entré dans la loi de Moïse que par une fausse interprétation M. (Megila 3, 9). M. J. Lévy, s. V., a pour Qswh Schale (enveloppe).</i>. Le cohen qui opère au Temple à l’état impur ne sera pas traduit devant le tribunal par ses frères (égaux); mais les adolescents du sacerdoce (apprentis) le feront sortir de l’enceinte sacrée et lui briseront le crâne à coup de bûche. Un étranger à la race sacerdotale qui aura servi au Temple sera passible de la strangulation, selon R. aqiba ; d’après les autres docteurs, il sera puni de la mort par voie céleste (non par les hommes).",2082,
Jerusalem Talmud Sanhedrin 9:7:2,קסווה קיסטא. רב יהודה אמר כלי משל בית המקדש היה כמה דתימר ואת קשות הנשך:,"Le mot kasso signifie caisse xesth"". Selon R. Juda, c’est le nom d’un vase sacré usité au Temple, comme il est dit (Nb 4, 7): les montants qui garnissent la table.",2082,
Jerusalem Talmud Sanhedrin 9:7:3,המקלל בקסם. כגון אילין נפתאי דמקללין לקניין קיינך קנווך:,"“Celui qui blasphème Dieu par des sacrilèges”, comme font les Nabatéens <sup>267</sup><i class=""footnote"">V. J., (Baba Batra 8, 7) (8).</i> qui maudissent le Créateur et ils estropient ce nom de ˚nwq ton possesseur ou formateur en celui de ˚nyyq ou ˚wnq (qui n’a pas de sens).",,
Jerusalem Talmud Sanhedrin 9:7:4,"הבועל ארמית. תני רבי ישמעאל זה שהוא נושא נכרית ומוליד בנים מעמיד אויבים ממנה למקום. כתיב וירא פינחס בן אלעזר בן אהרן הכהן מה ראה ראה את המעשה ונזכר להלכה הבועל ארמית הקנאים פוגעין בהן. תני שלא ברצון חכמים. ופינחס שלא ברצון חכמים א""ר יודה בר פזי ביקשו לנדותו אילולי שקפצה עליו רוח הקודש ואמרה והיתה לו ולזרעו אחריו ברית כהונת עולם וגומר.","“ Celui qui épouse une Araméenne”. R. Ismaël a enseigné <sup>268</sup><i class=""footnote"">J., (Megila 4, 11) fin .</i>: l’interdit du Molokh s’applique à celui qui épouse une païenne; et s’il a des fils d’elle, il élève autant d’ennemis de Dieu (opposés au judaïsme). Il est écrit (ibid. 25, 7): Pinhas fils d’Eléazar fils d’Aaron le Pontife vit, etc.; or, il a vu <sup>269</sup><i class=""footnote"">V. Midrash Rabba sur (Nb 20)</i> l’acte (copulationem), et il s’est souvenu de la doctrine mishinique, disant: “celui qui cohabite avec une Araméenne sera frappé par les zélateurs”, ce qu’il exécuta. Toutefois, fut-il dit, l’acte de frapper est la conduite des zélateurs, car les sages consultés ne l’enseignent pas. Mais peut-on dire de Pinhas qu’il ait agi contrairement à l’ordre des docteurs? (N’a-t-il pas au contraire consulté Moïse)? - En effet, dit R. Juda b. Pazi, on voulut placer Pinhas à l’écart (pour avoir agi comme il l’a fait); seulement, il fut constaté que Pinhas avait agi par inspiration de l’Esprit-Saint, comme il est dit (ibid. 13): le pacte d’un sacerdoce éternel lui sera assuré, à lui et à sa postérité après lui, en récompense de sa belle action qui a valu le pardon à Israël.",,
Jerusalem Talmud Sanhedrin 9:7:5,מה טעמא דרבי עקיבה נאמר כאן מות יומת ונאמר להלן כל הקרב הקרב אל משכן ה' ימות וגו' מה טעמון דרבנין נאמר כאן מות יומת ונאמר להלן והזר הקרב יומת מוטב שילמד יומת מיומת ואל ילמד יומת מימות:,"Pourquoi R. aqiba punit-il de la strangulation l’étranger qui a fonctionné au Temple? Comme il est dit d’une part (pour le faux prophète (Dt 13, 6): il mourra, terme usité aussi pour l’étranger qui s’approche (Nb 18, 7); d’après lui, il est logique de conclure de cette analogie des termes à l’analogie de pénalité (sans la comparer à une autre peine). Les autres sages au contraire disent que la peine de mort suivra par voie céleste, car il est dit d’une part (ibid.) – Il devra mourir, et d’autre part (ibid. 18, 28): tout homme qui approchera de la résidence de l’Eternel mourra; mieux vaut, selon eux, établir une corrélation entre deux textes traitant des simples israélites, qu’entre un texte relatif au prophète et un autre concernant le simple israélite.",,
Jerusalem Talmud Sanhedrin 10:1:1,כל ישראל יש להן חלק לעולם הבא ואילו שאין להם חלק לעולם הבא האומר אין תחיית המים מן התורה ואין תורה מן השמים ואפיקורוס רבי עקיבה אומר אף הקורא בספרים החיצונים והלוחש על המכה ואומר כל המחלה אשר שמתי במצרים לא אשים עליך כי אני ה' רופאך אבא שאול אומר אף ההוגה את השם באותיותיו:,"Tous les Israélites ont part à la vie future, selon ces mots (Is 60, 21): ceux de ton peuple sont tous justes, ils posséderont la terre pour l’éternité, un rejeton de ma plantation, une œuvre de mes mains, pour être glorifié. Voici ceux qui n’ont pas de part à la vie future; celui qui prétend que la résurrection des morts n’est pas énoncée dans la Bible <sup>270</sup><i class=""footnote"">V. Tanhouma, section Wayera.</i>, ou que la loi n’émane pas du ciel, ou l’épicurien (Epicureus). R. aqiba y comprend aussi celui qui s’adonne à la lecture des livres extérieurs (ou hérétiques), ou celui qui, à la vue d’une plaie, dit à voix basse (pour exorciser) les mots (Ex 15, 26): je ne t’imposerai aucune des maladies suggérées à l’Egypte, car je suis l’Eternel qui te guérit. Abba Saül y englobe celui qui énonce le nom divin par ses quatre lettres (le tétragramme dit comme il est écrit).",2083,
Jerusalem Talmud Sanhedrin 10:1:2,הוסיפו עליהן הפורק עול והמפיר ברית והמגלה פנים בתורה אין להן חלק לעולם הבא. הפורק עול זה שהוא אומר יש תורה ואינו סופנה המיפר ברית זה שהוא מושך לו ערלה המגלה פנים בתורה זה שהוא אומר לא ניתנה תורה מן השמים. ולא כבר תניתה האומר אין תורה מן השמים. תני רבי חנינה ענותוני' קומי רבי מנא זה שהוא עובר על דברי תורה בפרהסיא כגון יהויקים בן יאשיה מלך יהודה וחביריו.,,2083,
Jerusalem Talmud Sanhedrin 10:1:3,"עכו""ם וגילוי עריות ר' יונה ורבי יוסה חד אמר בקלות וחד אמר בחמורות מה נן קיימין אם באותו שעשה תשובה אין כל דבר עומד בפני כל בעלי תשובה אלא כן אנן קיימין באותו שלא עשה תשובה ומת בהיכרת",,,
Jerusalem Talmud Sanhedrin 10:1:4,רובו זכיות ומיעוטו עבירות נפרעין ממנו מיעוט עבירות קלות שיש בידו בעולם הזה כדי ליתן לו שכרו משלם לעתיד לבוא רובו עבירות ומיעוטו זכיות נותנין לו שכר מצות קלות שיש בידו בעולם הזה כדי ליפרע ממנו משלם לעתיד לבוא.,,,
Jerusalem Talmud Sanhedrin 10:1:5,"רובו זכיות יורש גן עדן רובו עבירות יורש גיהנם. היה מעויין אמר ר' יוסי בן חנינה נושא עוונות אין כתיב כאן אלא נושא עון הקב""ה חוטף שטר אחד מן העבירות והזכיות מכריעות. א""ר לעזר ולך ה' חסד כי אתה תשלם לאיש כמעשהו מעשה אין כתוב כאן אלא כמעשהו ואין לית ליה את יהיב ליה מן דידך. היא דעתיה דרבי לעזר רבי לעזר אמר ורב חסד מטה כלפי חסד.",,,
Jerusalem Talmud Sanhedrin 10:1:6,"רבי ירמיה א""ר שמואל בר רב יצחק בעה צדקה תצר תם דרך ורשעים תסלף חטאת חטאים תרדף רעה ואת צדיק ישלם טוב אם ללצים הוא יליץ ולענוים יתן חן רגלי חסידיו ישמור ורשעים בחושך ידמו כבוד חכמים ינחלו וכסילים מרים קלון. וסיגין סייגה ותרעין תריעה וכיני סייגין סייגה ותרעין תריעה אלא כיני. רבי ירמיה בשם רבי שמואל בר רב יצחק שומר אדם את עצמו מן העבירה פעם ראשונה שנייה ושלישית מיכן והילך הקב""ה משמרו מה טעמא הן כל אלה יפעל אל פעמים שלש עם גבר א""ר זעירה ובלחוד דלא יתיב ליה ומה טעמא והחוט המשולש לא לעולם ינתק אין כתיב אלא לא במהרה ינתק אין אטרחת עליו הוא מפסק.",,,
Jerusalem Talmud Sanhedrin 10:1:7,"רבי הונא בשם רבי אבהו הקב""ה אין לפניו שכחה כביכול הא בשביל ישראל נעשה שכחן מה טעמא נושא עון נשא כתיב וכן דוד אמר נשאת עון עמך כסית כל חטאתם סלה.",,,
Jerusalem Talmud Sanhedrin 10:1:8,"שאל רב מתיא בן חרש את רבי אלעזר בן עזריה בישיבה אמר לו שמעתה ארבעה חלוקי כפרה שהיה רבי ישמעאל דורש אמר לו שלשה הן חוץ מן התשובה. כתוב אחד אומר שובו בנים שובבים ארפא משובותיכם וכתוב אחד אומר כי ביום הזה יכפר עליכם לטהר אתכם וגו' וכתוב אחד אומר ופקדתי בשבט פשעם ובנגעים עונם וכתוב אחד אומר אם יכופר העון הזה לכם עד תמותון וגו'. כיצד העובר על מצות עשה ושב מיד אינו זז ממקומו עד שימחול לו הקב""ה ועליו הוא אומר שובו בנים שובבים ארפא משובותיכם. העובר על מצות בלא תעשה התשובה תולה ויום הכיפורים מכפר ועליו הוא אומר כי ביום הזה יכפר עליכם וגו'. העובר על הכריתות ומיתות בית דין במזיד התשובה ויום הכיפורים מכפרין מחצה והייסורין מכפרין מחצה ועליו הוא אומר ופקדתי בשבט פשעם וגו' אבל מי שנתחלל בו שם שמים אין כח בתשובה לתלות ולא יום הכיפורים לכפר ולא הייסורים למרק אלא התשובה ויום הכיפורים מכפרין שליש וייסורין שליש ומיתה ממרקת שליש ועליו הוא אומר אם יכופר העון הזה לכם עד תמותון הא למדנו שהמיתה ממרקת.",,,
Jerusalem Talmud Sanhedrin 10:1:9,אמר רבי יוחנן זו דברי רבי אלעזר בן עזריה ורבי ישמעאל ורבי עקיבה אבל דברי חכמי' שעיר המשתלח מכפר. כיצד הוא מכפר רבי זעירא אמר כל שהוא כל שהוא רבי חנינה אמר בסוף מה מפקה מביניהון מת מיד על דעתיה דרבי זעירא כבר כפר על דעתיה דרבי חנינה לא כיפר. אמר רבי חנינא מתניתא מסייעה לרבי זעירה חומר בשעיר מה שאין כן ביום הכיפורים וביום הכיפורים מה שאין כן בשעיר שיום הכיפורים מכפר בלא שעיר ושעיר אינו מכפר בלא יום הכיפורים חומר בשעיר שהשעיר מכפר מיד ויום הכיפורים משתחשך. אמר רבי הונא איתתבת קומי רבי ירמיה ואמר תיפתר שהיה בדעתן להביא שעיר אחר ולא הביאו. אמר רבי יוסה בן יוסה ואין הקדוש ברוך הוא רואה את הנולד ויכפר מיד.,,,
Jerusalem Talmud Sanhedrin 10:1:10,כתיב כי דבר ה' בזה אין לי אלא בזמן שביזה דברי תורה מנין אפילו כפר במקרא אחד בתרגום אחד בקל וחומר אחד תלמוד לומר ואת מצוותו הפר. במקרא אחד ואחות לוטן תמנע בתרגום אחד ויקרא לו לבן יגר שהדותא בקל וחומר אחד כי שבעתים יקם קין וגו'.,"<sup>271</sup><i class=""footnote"">En tête se trouvent 2 longs passages déjà traduits, le 1er (Pea 1, 1) fin , le 2e (Yoma 8, 8) .</i>. Il est écrit (Nb 15, 31): Car il a méprisé la parole de l’Eternel. Par ce texte, on sait quelle est la pénalité en cas de mépris (de négligence) des paroles de la loi; d’où sait-on quelle est cette peine si l’on a seulement nié la valeur d’un verset du texte, ou de la traduction, ou d’une déduction a fortiori? C’est pourquoi il est écrit (ibid.): il a détruit ses préceptes. Comme exemple d’un verset (même insignifiant), voici celui-ci (Gn 36, 22): la sœur de Lotan fut Timnà. Comme texte Chaldéen, voici par exemple les mots (ibid. 31, 47): Laban le nomma le monceau du témoignage; enfin, comme exemple pour lequel la bible emploie le raisonnement a fortiori, on peut citer ce passage (ibid. 4, 24): Car Caïn sera vengé sept fois.",,
Jerusalem Talmud Sanhedrin 10:1:11,דבר אחר כי דבר ה' בזה זה שהוא מזכיר דברי תורה במקום טינוף כהדא רבי אילא וחברייא הוון יתיבין קומי פונדקיה ברמשא אמרין מהו מימר מילא דאורייא אמרין מכיון דאילו הוה איממא הוונן חמיי מה קומינון ברם כדון אסור.,"On peut entendre aussi d’une autre façon le verset précité, “il a méprisé la parole de l’Eternel” et dire qu’il s’agit de celui qui rappelle les paroles de la Loi dans un endroit malpropre. Ainsi, R. Ila et ses compagnons étaient assis le soir devant l’auberge (où les ordures sont déposées), et l’un d’eux proposa un sujet d’étude biblique. D’autres s’y opposèrent, en disant: si c’était le jour nous verrions que nous avons des immondices sous les yeux; donc, maintenant aussi (sans les voir), une telle étude est interdite.",,
Jerusalem Talmud Sanhedrin 10:1:12,בר קפרא אמר אחז וכל מלכי ישראל הרשעים אין להן חלק לעולם הבא מה טעמא כל מלכיהם נפלו אין קורא בהם אלי. מתיבין ליה הרי הוא נמנה בפטייה של מלכים בימי עזיהו יותם אחז יחזקיהו מלכי יהודה אמר לון מפני שהיה בו בושת פנים. מה בושת היה בו רבי אחא בשם רבי לעזר רבי יוסי בשם רבי יהושע בן לוי את מוצא בשעה שהיה הנביא בא לקטרגו היה בורח למקום טומאה וכובש את פניו במקום טומאה לומר שאין שכינה שורה במקום טומאה הדא הוא דכתיב ויאמר ה' אל ישעיהו צא נא לקראת אחז אתה ושאר ישוב בנך אל קצה תעלת הבריכה העליונה אל מסילת שדה כובס אל תהי קורא כובס אלא כובש שהיה כובש פניו ובורח ממנו. הא כיצד בשעה שהיה הנביא בא לקטרגו היה בורח למקום טומאה וכובש את פניו במקום טומאה. רבי יהוד' אומר מפני שנתייסר בבנו הבכור מה טעמא ויהרוג זכרי גבור אפרים וגו'. רב הושעיה רבה אמר מפני שהיה אביו צדיק. ומנשה לא היה אביו צדיק מנשה אביו צדיק ובנו רשע יחזקיהו אביו רשע ובנו רשע הוא שחזקיהו אומר הנה לשלום מר לי מר. מר לי מלפני מאחז מר לי מאחרי ממנשה. אחז אביו צדיק ובנו צדיק הדא הוא דכתיב יד ליד לא ינקה רע וזרע צדיקים נמלט וזרע צדיק נמלט אין כתיב כאן אלא וזרע צדיקים נמלט זרע שהוא מוטל בין שני צדיקים נמלט.,"Bar-Qappara dit <sup>272</sup><i class=""footnote"">V. Rabba sur (Lv ch. 36.</i>: Ahaz et tous les rois impies d’Israël n’ont pas de part au monde futur, comme il est dit (Os 7, 7): tous leurs rois sont tombés ; nul d’entre eux ne m’invoque (même au delà du tombeau). Mais, fut-il objecté Ahaz ne compte-t-il pas dans la série, upateia , des rois (justes)? N’est-il pas dit (Is 1,1): Au temps d’Ozias, de Jotham, d’Ahaz, d’Ezéchias, rois de Juda? On lui sait gré, répondit-il d’avoir montré de la honte de son impiété. On en a la preuve, dit R. Aha au nom de R. Eléazar, ou R. Yossé au nom de R. Josué b. Lévi, en voyant qu’à l’arrivée du prophète Isaïe pour le morigéner, ce roi s’enfuit dans un endroit impur pour se soustraire en une telle place aux reproches qu’il sentait être méritoires, supposant avec raison que la Providence ne réside pas dans une place impure. C’est pourquoi il est écrit (Ibid. 7, 3): l’Eternel dit à Isaïe: va donc vers Ahaz, et Schear Yaschoub ton fils ira vers l’extrémité du conduit de la haute piscine, au chemin du champ du foulon, or, ce dernier mot, au lieu d’avoir le sens de foulon peut aussi avoir le sens de “se couvrir le visage”, comme fait celui qui s‘enfuit (par honte). Ceci signifie qu’à l’arrivée du prophète le roi s’enfuit dans un endroit impur pour se cacher là. Selon R. Juda, Ahaz compte parmi les rois justes, parce qu’il a souffert de la perte de son fils aîné, comme il est dit (2Ch 28, 7): Zikhri héros d’Ephraim, tua Maasiahou fils du roi. Selon R. Oshia le grand, ce roi est compté comme juste, à cause de son père Jotham qui fut juste. Mais Manassé n’avait-il pas un père juste? -Oui, son père (Jotham) fut juste; mais le fils de Manassé fut également impie, tandis que l’on compte comme juste Ezéchias, dont le père et le fils <sup>273</sup><i class=""footnote"">Jotham et Ezéchias.</i> furent des impies. Ainsi, d’Ezéchias il est dit (Is 38, 17): Voici, une grande amertume m’était survenue dans ma prospérité; c’est-à-dire, je suis chagriné de celui qui me précède, savoir Ahaz, et de celui qui me suit, ou Manassé. Pour Ahaz au contraire, le père était un juste, et son fils aussi, ainsi qu’il est écrit (Pr 11, 21): De main en main, le méchant ne demeurera pas impuni ; mais la race des justes sera délivrée;or, il n’est pas dit là “du juste”, mais “des justes”, pour indiquer que la race (un fils) qui se trouve entre deux justes (le père et le fils) sera délivré du châtiment.",,
Jerusalem Talmud Sanhedrin 10:1:13,דבר אחר יד ליד לא ינקה רע אמר רבי פינחס זה שהוא עושה צדקה ומבקש ליטול שכרה מיד אמר רבי סימן כאינש דאמר הא שקא והא סלעא והא סאתא קום כול. ותדע לך שהוא כן שהרי אבות העולם אילו בקשו ליטול שכר מצות שעשו בעולם הזה מאיכן היתה הזכות קיימת לבניהם אחריהם הוא שמשה אמר לישראל וזכרתי את בריתי יעקב וגו'.,"Voici une autre explication du même verset “de main en main, le méchant ne demeurera pas impuni, mais la race des justes sera délivrée”: selon R. Pinhas, il s’agit là de celui qui ayant fait du bien voudrait aussitôt être récompensé. Il semble, dit R. Simon, qu’un tel homme veuille dire: voici le sac, le selà de paiement, et la mesure saa, pour me mesurer sur le champ. Ce qui prouve qu’il en est ainsi, c’est que si les patriarches avaient voulu le salaire pour leurs bonnes actions accomplies en ce monde, ils n’auraient plus laissé de mérite à leurs descendants après eux; or, Moïse dit à Israël (Lv 26, 42): Je me suis souvenu de mon alliance avec Jacob, etc. (l’alliance rappelée consiste dans l’abnégation des patriarches",,
