Index_Title,Jerusalem_Talmud_Mechon_Mamre,Schwab_fr,id_paragraphe,missing_footnotes
Jerusalem Talmud Gittin 7:4:5,שלא עמד מאותו החולי ועבד ושפחה נאמנין יודעין הן העדים שבשעה שנתייחדה עמו שהיה שם עבד ושפחה. כהדא נתייחדה עמו בפני שנים צריכה הימינו גט שני באחד אינה צריכה ממנו גט שני באחד בשחרית ובאחד בין הערבים זה היה מעשה ושאל רבי אליעזר בן תרדיון לחכמים ואמרו אין זה יחוד. נתייחדה עמו כדי בעילה חוששין לה משום בעילה ואין חוששין לה משום קידושין. רבי יוסי בי רבי יהודה אומר אף חוששין לה משום קידושין. רבי ירמיה פתר מתניתא נתייחדה עמו כדי בעילה חוששין לה משום בעילת זנות ואין חוששין לה משום קידושין בבעילה. לא נתייחדה עמו כדי בעילה אין חוששין לה משום כלום. רבי יוסי בי רבי יהודה אומר אף חוששין משום קידושין בבעילה. רבי יוסי פתר לה מתניתא נתייחדה עמו כדי בעילה חוששין לה משום בעילת זנות ואין חוששין לה משום קידושין בבעילה. לא נתייחדה עמו כדי בעילה אין חוששין לה משום קידושין בכסף. רבי יוסי בי רבי יהודה אומר אף חוששין לה משום קידושין בכסף. אמר רבי אבין אתיא דבית שמאי כרבנין. ובית הלל כרבי יוסי בי,"Pourquoi la Mishna dit-elle qu’il suffit de la présence d’un esclave ou d’une servante, pendant que le mari est auprès de la femme répudiée? Sont-ils donc dignes de foi? -Non; il suffit aux témoins de savoir qu’au moment de la présence du mari auprès de cette femme, il y avait là un esclave ou une servante (ce qui suffit à écarter l’hypothèse d’une cohabitation). C’est conforme à cet enseignement <sup>275</sup><i class=""footnote"">""J, (Sota 1, 1) (t 7, p 225) ; Tossefta à notre traité, ch 5""</i>: Si une femme répudiée par son mari s’est isolée (enfermée) avec lui, et que ce fait est attesté par deux témoins, il lui faut un second acte de répudiation pour être libre; s’il n’y a eu qu’un témoin, il n’est pas besoin d’un nouvel acte; si enfin un témoin l’a vue enfermée avec son mari le matin, et un autre témoin l’a vue l’après-midi avec lui, c’est un fait sur lequel R. Eléazar b. Tadaï a consulté les sages, et ils ont répondu que ce n’est pas là un isolement confirmé. Si la femme s’est isolée avec le mari pendant le temps suffisant à une cohabitation il est à craindre que cette dernière ait eu lieu; mais cela ne va pas jusqu’à craindre une consécration en mariage (et il ne sera pas nécessaire de renouveler l’acte de divorce). R. Jérémie explique l’enseignement qui précède comme suit: Si la femme s’est isolée avec son mari pendant le temps suffisant à une cohabitation, on a lieu de craindre une cohabitation licencieuse (illégale), mais cela ne va pas jusqu’à craindre une consécration par le fait de cette union (de sorte qu’il ne faut pas un second acte de divorce); s’il n’y a pas eu d’isolement pendant un temps suffisant à cette union, il n’y a aucune crainte à éprouver (ni union illicite, ni nécessité de renouveler le divorce). Selon R. Yossé b. R. Juda au contraire, en cas d’isolement pour un temps suffisant on craint que l’union ait un effet de consécration (et il faudra un nouvel acte de divorce; mais si les époux n’ont pas été suffisamment seuls ensemble, on ne craint d’aucune façon qu’il s’en soit suivi une nouvelle consécration). R. Yossé explique l’enseignement en question comme suit (d’accord en partie avec R. Jérémie): si la femme s’est isolée avec son mari pendant le temps suffisant à une cohabitation, on a lieu de craindre une cohabitation licencieuse (illégale), mais cela ne va pas jusqu’à craindre une consécration par le fait de cette union (de sorte qu’il ne faut pas un second acte de divorce <sup>276</sup><i class=""footnote"">Selon lui, il y a divergence d'avis s'il n'y a pas eu isolement des époux pendant un temps suffisant à l'union, et le premier interlocuteur est alors d'avis que nulle consécration n'est à supposer</i>; s’il n’y a pas eu d’isolement pendant un temps suffisant, il n’y a pas à craindre le fait d’une consécration moyennant de l’argent; tandis que, selon R. Yossé b. R. Juda, en ce dernier cas (d’isolement insuffisant), il faut craindre du moins une nouvelle consécration par de l’argent. Rabin dit: conformément à l’avis exprimé ici par les autres sages, l’école de Shammaï s’exprime aussi plus loin <sup>277</sup><i class=""footnote"">Il est dit ci-après, (8, 11), que la femme répudiée qui a passé la nuit avec son mari dans une auberge n'a pas besoin d'un nouvel acte de divorce pour être libérée, selon Schammaï, mais Hillel l'exige</i> dans le sens du maintien de la valeur de cet acte, et leurs adversaires de l’école de Hillel adoptent l’avis contraire qui est conforme à celui de R. Yossé b. R. Juda ici (de craindre une nouvelle consécration ce qui implique la nécessité d'un nouvel acte de divorce).",,
Jerusalem Talmud Gittin 7:4:6,רבי יהודה. ליידא מילה רבי לעזר אומר ליורשה. דתנינן תמן וזכאי במציאתה ובמעשה ידיה ובהפר נדריה. אמר ר' זעירא זאת אומרת שהיא כאשת איש לכל דבר.,"A quel point de vue (aux termes de notre Mishna), “cette femme sera-t-elle considérée, selon R. Juda, comme une femme marié en tout”? Au point de vue de l’héritage, répondit R. Eléazar. De même (d’autre part) il a été enseigné <sup>278</sup><i class=""footnote"">J, (Ketubot 4, 4)</i>: “Ce que la fille trouve, ou gagne par le travail de ses mains, appartient au père, lequel possède aussi la faculté d’annuler les vœux de sa fille”. C’est ainsi, ajoute R. Zeira, qu’il faut entendre ici la qualification de “femme mariée en tout” (sous ces trois rapports, elle reste en la dépendance du mari).",,
Jerusalem Talmud Gittin 7:4:7,מחלפה שיטתיה דרבי יודה. תמן הוא אמר מיתה מצויה. והכא הוא אמר אין מיתה מצויה. תמן בציבור כאן ביחיד. דתניא ר' יהודה אומר לא היה שופר קינים בירושלים מפני התערובת שמא תמות אחת מהן ונמצאו דמי חטאות מתות מעורבת בהן.,"Est-ce que R. Juda n’est pas en contradiction avec lui-même? Il dit d’une part (ci-après) que la mort est une chose fréquente et dont il faut se préoccuper, tandis qu’ici il paraît ne pas craindre cette éventualité, et il suppose la femme “mariée en tout” (sans prévision du décès marital)? -C’est qu’ici il est question d’un particulier (on craint peu le décès); mais ailleurs il s’agit du public. Or, on a enseigné que R. Juda dit <sup>279</sup><i class=""footnote"">J, (Sheqalim 6, 7)</i>: il n’y avait pas de caisse spéciale pour les achats des nids d’oiseaux à Jérusalem, afin d’éviter tout mélange fâcheux; car il pourrait arriver qu’une femme dont l’argent déposé là (pour un tel achat) meure avant l’offrande, et cette somme, désormais sans destination, serait mêlée avec le reste (ce qui est interdit).",,
Jerusalem Talmud Gittin 7:4:8,"בעילתה מהו. אית תניי תני בעילתה ברורה. ואית תניי תני בעילתה ספק. מאן דאמר בעילתה ברורה מביא אשם תלוי ומד""א בעילתה ספק מת פטור. לא מת מביא חטאת:","Si la femme ainsi répudiée provisoirement cohabite avec un homme, quel sera le degré de criminalité? Selon un enseignement, le fait de la cohabitation est certain (en raison du décès survenu plus tard, la répudiation compte rétroactivement et doit entraîner la liberté de la femme). Selon un autre enseignement, c’est un fait sujet au doute. D’après la première opinion, l’homme qui a accompli cette union devra offrir avec certitude le sacrifice du péché de suspension (en raison du doute sur l’adultère); d’après l’autre avis, la femme est en état continuel de doute (pour la mort future du mari), et si le mari meurt de la même maladie, l’homme qui a cohabité est dispensé de tout sacrifice; si le mari n’en meurt pas, l’homme devra le sacrifice d’expiation (pour le crime d’union illicite).",,
Jerusalem Talmud Gittin 7:5:1,הרי זה גיטיך על מנת שתתני לי מאתים זוז הרי זו מגורשת ותתן על מנת שתתני לי מיכן ועד שלשים יום נתנה לו בתוך שלשים יום מגורשת ואם לאו אינה מגורשת אמר רבן שמעון בן גמליאל מעשה בציידן שאמר אחד לאשתו הרי זה גיטיך על מנת שתתני לי איצטליתי ואבדה איצטליתו אמרו חכמים תתן לו את דמיה:,"Si le mari dit à la femme: “Voici ton acte de divorce, à la condition de me donner 200 zouz”, elle sera tenue pour répudiée dès l’acceptation <sup>280</sup><i class=""footnote"">Cf J, (Qidushin 3, 2) ( 43d)</i>, et dès lors elle doit ladite somme à son mari. Si le mari établit la condition qu’elle lui remette cette somme à partir d’à présent jusqu’à 30 jours de là, au cas où elle lui remet ladite somme dans les 30 jours, la femme sera déclarée répudiée; au cas contraire, elle ne le sera pas. R. Simon b. Gamliel raconte qu’à Sidon il arriva à quelqu’un de dire à sa femme: “voici ton acte de divorce, à condition de me remettre ton vêtement (stola) de luxe” ; comme elle l’avait perdu, la condition était irréalisable, et l’acte nul. Selon les autres sages, il suffit à la femme de remettre le montant du vêtement au mari, pour valider l’acte.",1541,
Jerusalem Talmud Gittin 7:5:2,"תני לא הספיקה ליתן עד שמת. רבן שמעון ב""ג אומר תינתן לאביו ולאחיו והיא פטורה מן החליצה ומן הייבום. אף בקידושין כן. הרי את מקודשת לי על מנת שאתן ליך מאתים זוז ולא הספיק ליתן לה עד שמת רבן שמעון בן גמליאל אומר אביו ואחיו נותנין לה והיא זקוקה לחליצה ולייבום.","On a enseigné <sup>281</sup><i class=""footnote"">Ibid</i>: Lorsqu’en cas de divorce remis à condition de paiement, et avant que la femme ait eu le temps d’effectuer le paiement, le mari meurt, selon R. Simon b. Gamliel, la somme convenue devra être remise au père du mari, ou à son frère, et dès lors la femme sera dispensée de procéder à la cérémonie du déchaussement, ou d’épouser le beau-frère. Il en est de même pour la consécration d’une femme en mariage. Si le futur a déclaré consacrer la fiancée à condition de lui remettre 200 zouz, et qu’avant d’avoir eu le temps de lui verser cette somme il meurt, selon R. Simon b. Gamliel, le père ou le frère du défunt peuvent lui verser cette somme, afin d’avoir la faculté de la contraindre à procéder au déchaussement, ou à se soumettre au lévirat.",1541,
Jerusalem Talmud Gittin 7:5:3,"אמר רבי יודן בשאבדה באונס אנן קיימין עשו אותה כמתנה שומר חנם להיות פטור מן השבועה א""ר יוסה וכא אתינן מיתני שומר חנם להיות פטור מן השבועה. אלא כשאבדה בפשיעה אנן קיימין דמי' עשו אותה כאיצטלית. רבנין אמרין אחת זו ואחת זו משום תנאי גיטין:","Quant à l’obligation pour la femme “de remettre au mari le montant du vêtement”, c’est , dit R. Judan, si elle l’a perdu sans être fautive; pourtant elle est dispensée de jurer l’avoir perdu par sa négligence, dans l’hypothèse de la condition faite qu’elle sera un gardien gratuit (non responsable). -Mais, objecta R. Yossé, comment peut-il être question ici de la condition de garder gratuitement, avec dispense de prêter le serment, puisque la Mishna condamne au contraire la femme à payer le montant de l’objet perdu? -C’est qu’en effet il s’agit du cas où elle a perdu le vêtement par sa faute, et il est seulement dit ici qu’il suffit pour elle de payer le montant, redevable (selon R. Simon) au même titre que si elle fournissait le vêtement lui-même (sans qu’elle soit astreinte à restituer un tel objet en nature). Selon les autres sages, au contraire, elle doit restituer le montant en tout cas (qu’il s’agisse du cas où elle est fautive ou non), puisque ce sont des conditions inhérentes au divorce.",,
Jerusalem Talmud Gittin 7:6:1,"הרי זה גיטיך ע""מ שתשמשי את אבא ע""מ שתניקי את בני כמה היא מניקתו שתי שנים רבי יהודה אומר שמנה עשר חדש מת הבן או שמת האב הרי זה גט על מנת שתשמשי את אבא שתי שנים ועל מנת שתניקי את בני שתי שנים מת הבן או שאמר האב אי איפשי שתשמשיני שלא בהקפדה אינו גט רבן שמעון בן גמליאל אומר כזה גט כלל אמר רבן שמעון בן גמליאל כל עכבה שאינה ממנה הרי זה גט:","Si le mari a dit: “voici ton divorce, à la condition de servir mon père, ou d’allaiter mon fils” (sans durée déterminée), quelle sera la durée de l’allaitement (ou du service, sous peine d’annulation de la condition)? Deux ans. Selon R. Juda, 18 mois. Si le fils ou le père meurt (avant l’exécution de la condition), l’acte reste valable. Si le mari dit: “voici ton acte de divorce, à la condition de servir mon père 2 ans, ou d’allaiter mon fils 2 ans”, et qu’ensuite le fils meurt <sup>282</sup><i class=""footnote"">""Dans l'édition de la Mishna selon le Talmud Babli, le texte ajoute comme hypothèse : """" si le père meurt """"""</i>, ou le père déclare ne pas vouloir être servi par elle, lors même qu’elle n’a pas provoqué ce refus en irritant le père, l’acte devient nul; selon R. Simon b. Gamliel, il reste valable. R. Simon b. Gamliel établit cette règle: pour tout obstacle qui n’émane pas de la femme, l’acte reste valable.",1542,
Jerusalem Talmud Gittin 7:6:2,"א""ר חייה בר' בא בחייו והוא שתשמשינו כל צורכו. והוא שתניקי כל צורכו. לאחר מיתה אפילו לא הניקתו כל צורכו. אפילו לא שימשתו כל צורכו. אלא אפילו שימשתו שעה אחת. אפילו הניקתו שעה אחת. רבי שמעון בן לקיש אמר בחייו אפילו לא שימשתו כל צורכו. אפילו לא הניקתו כל צורכו. אלא אפילו שימשתו שעה אחת. אפילו הניקתו שעה אחת. לאחר מיתה אפילו לא שימשתו ולא הניקתו כלום. מתניתא פליגא על ריש לקיש. כמה היא מניקתו שתי שנים. רבי יהודה אומר שמונה עשר חדש. אמר רבי אבין בשכר מניקה שנו.","R. Hiya b. Aba dit: lorsqu’il est question de faire valoir l’acte durant la vie, la femme devra avoir servi le père durant toute sa vie, ou allaité l’enfant durant toute la période nécessaire (2 ans); s’il s’agit de la validité de l’acte après décès, on suppose que la femme a commencé le service, ou l’allaitement, ne fut-ce qu’une heure, puis le père ou l’enfant est mort (la condition imposée par faire valoir l’acte est suffisamment remplie). R. Simon b. Lakish dit: s’il s’agit de l’état de vie, même si la période en question n’a pas été complètement occupée par le service ou l’allaitement (si le décès est survenu dans l’intervalle de temps), le divorce conserve sa valeur, et il suffit que le service auprès du père, ou l’allaitement, ait eu lieu seulement une heure durant la vie du père, ou de l’enfant; lorsqu’il s’agit de l’hypothèse “après décès”, on suppose (selon lui) qu’il n’y a eu aucun service, ni allaitement commencé (le décès étant survenu aussitôt). Est-ce que notre Mishna n’est pas opposée à cet avis de R. Simon b. Lakish (qui se contente au besoin d’une heure), puisqu’elle dit: “La durée de l’allaitement sera de 2 ans; selon R. Juda, elle sera de 18 mois”? R. Abin répond: la Mishna ne veut pas dire que le mari ait voulu imposer à la femme la condition d’allaiter l’enfant aussi longtemps, mais elle devra payer 2 ans le salaire d’une nourrice.",1542,
Jerusalem Talmud Gittin 7:6:3,"אמר רבי אבהו בשם רבי יוחנן סדר סימפון כך הוא אנא פלן בר פלן מקדש ליך אנא פלנית בת פלן ע""מ ליתן ליך מיקמת פלן ומנכסייך ליום פלן דאין אתא יום פלן ולא כנסתיך לא יהוי לי עליך כלום. אירע לו אונס ר' יוחנן אמר אונסא כמאן דלא עבד. ריש לקיש אמר אונסא כמאן דעבד. על דעתיה דריש לקיש אין הוה צריך למיעבד ואין אתא יום פלוני ולא כנסתה לי לא יהוי לי עליך כלום. רבי יוחנן מי דמיך פקיד לבנתיה די יהווין עבדן כריש לקיש אמר שמא יעמד בית דין אחר ויסבר דכוותיה ונמצאו בניו באין לידי ממזירות.","R. Abahou a dit au nom de R. Yohanan <sup>283</sup><i class=""footnote"">J, (Eruvin 3, 5)</i> quelle est la formule de rédaction des contrats: “Moi tel, fils d’un tel, déclare t’épouser, une telle, fille d’un tel, à la condition de te remettre le douaire déterminé et de te faire entrer au domicile conjugal tel jour”; et (2e hypothèse), “si à tel jour ne te t’ai pas fait entrer, je n’aurai aucun droit sur toi”. Si par suite d’un accident survenu, le mariage n’a pas pu être effectué au jour convenu, selon R. Yohanan, quoique ce soit un cas de force majeure, c’est comme si la convention n’avait pas été conclue (et le mari n’aura aucun droit sur la femme): selon l’avis de R. Simon b. Lakish, l’accident représente bien la conclusion du contrat (et en raison de la validité de la consécration, le mari doit à la femme ce qu’il a promis). Selon ce dernier avis, l’homme doit agir en conséquence (sans autre issue que de faire valoir l’événement imprévu), à moins que la femme soit revenue sur les conditions faites, et qu’elle ait dit: “Si à tel jour tu ne m’as pas épousée, tu n’auras aucun droit sur moi” <sup>284</sup><i class=""footnote"">Alors seulement, on ne peut pas faire valoir l'imprévu, puisque la condition a été faite par la femme</i>. R. Yohanan, à son lit de mort, recommanda à ses fille d’agir (le cas échéant) selon l’avis de R. Simon b. Lakish (d’établir elles-mêmes leurs conditions au contrat), car, dit-il, il peut survenir plus tard un autre tribunal qui adopte l’avis de R. Simon b. Lakish (à savoir de tenir compte d’un cas de force majeure), et lorsqu’ensuite la femme ainsi divorcée à condition se remarie, cette seconde union est illégale (par suite du maintien de la première), de sorte que les enfants issus de la seconde union seraient illégitimes (ce qui n’arrive pas avec la précaution préalable de la condition écrite).",,
Jerusalem Talmud Gittin 7:6:4,"חד בר נש אקדם פריטין לאילפא ונגב נהרא. אתא עובדא קומי רב נחמן בר יעקב הא אילפא אייתי נהרא. אבא בר הונא בשם רבי אבא הוה מצלי דייגב נהרא בגין דניסב פריטוי. אשכחת אמר רבי יוחנן ורבי בא לא סברין כרבן שמעון בן גמליאל. ר""ל ורב נחמן בר יעקב סברין כרשב""ג. חתכה דדה כמי שעכבה. נחתך דדה כמי שלא עיכבה:","Ainsi, il arriva à un homme de payer d’avance à un batelier le salaire (pour transporter ses marchandises), après quoi, le lit du fleuve se trouva tout à coup desséché <sup>285</sup><i class=""footnote"">Non navigable</i>. On soumit ce fait en litige à R. Nahman b. Jacob, qui répondit (en faveur du batelier): “le bateau est là; à toi (demandeur) de fournir le fleuve” (ce n’est pas la faute du défendeur). Aba b. Houna, au contraire, dit au nom de R. Aba: le locataire du bateau (qui, après l’avoir payé, demande à recouvrer le montant de la location) peut avoir prié (désiré) que le lit se dessèche, pour reprendre son argent. On trouve qu’il est dit: R. Yohanan et R. Aba adoptent l’avis de R. Simon b. Gamliel (que si l’obstacle ne provient pas de la femme, l’acte sera valable); Resh Lakish et R. Nahman b. Jacob l’admettent en ce sens que l’on tient compte de l’accident. Ainsi, si la femme s’est coupé le sein, elle a mis obstacle à l’allaitement; si elle a eu le sein coupé, elle n’est pas la cause de l’obstacle (et l’acte reste valable).",,
Jerusalem Talmud Gittin 7:7:1,הרי זה גיטיך אם לא באתי מיכן ועד שלשים יום היה הולך מיהודה לגליל הגיע לאנטיפטרס וחזר בטל התנאי הרי זה גיטיך אם לא באתי מיכן ועד שלשים יום היה הולך מגליל ליהודה והגיע לכפר עותני וחזר בטל התנאי הרי זה גיטיך אם לא באתי מיכן ועד שלשים יום היה הולך למדינת הים הגיע לעכו וחזר בטל התנאי הרי זה גיטיך כל זמן שאעבור מכנגד פניך שלשים יום היה הולך ובא והיה הולך ובא הואיל ולא נתייחד עמה הרי זה גט:,"S’il dit: “Voici ton divorce si je ne suis pas revenu”, et qu’allant de Judée en Galilée il s’arrête à Antipatris (limite de Judée) et revient, les conditions ne sont pas remplies, et l‘acte est nul. Il en est de même s’il remet l’acte, en le subordonnant à la condition d’être revenu de voyage d’ici à 30 jours, et qu’allant de Judée en Galilée il s’arrête à Othnaï (limite de la Galilée); ou encore s’il le remet à condition du retour d’ici à 30 jours d’un voyage d’outre-mer, et arrivé à Acco (le port palestinien) il retourne chez lui: les conditions énoncées n’ont pas été remplies. S’il dit: “Voici ton divorce après que j’aurai passé devant ta face pendant 30 jours”, et qu’en ce temps il sera toujours allé et venu, à condition de ne pas s’être isolé avec elle, l’acte sera valable.",1543,
Jerusalem Talmud Gittin 7:7:2,ליידא מיל'. רבי לעזר אמר לביתו. רבי יוחנן אמר למקומות. מתניתין מסייעא למאן דאמר לביתו. הגיע לעכו וחזר בטל התנאי. אמר רבי חגיי קומי רבי יוסי תיפתר כמאן דאמר עכו כארץ ישראל לגיטין. ואפילו תימר עכו כארץ ישראל לגיטין שמא לתנאי גיטין.,"A quoi bon la Mishna parle-t-elle de condition, si, lors d’un voyage de Judée en Galilée, il suffit de s’être arrêté à Antipatris (qui fait encore partie de la Judée)? On veut dire par là, répond R. Eléazar, que la condition essentielle consiste à n’être pas rentrée dans sa maison <sup>286</sup><i class=""footnote"">Il suffit, pour annuler la condition d'avoir touché la limite de Galilée, avant de rentrer chez soi</i>. R. Yohanan dit: aux localités citées dans la Mishna, s’applique ladite condition (valable si le mari arrive là). Notre Mishna confirme le premier avis, disant que le point essentiel porte sur l’arrivée “à sa maison”, puisqu’il est dit à la fin: “S’il va en voyage d’outre-mer et s’arrête à Acco, puis retourne chez lui, la condition faite n’est pas remplie”(or, s’il suffisait d’être arrivé à Acco, la localité désignée, l’acte ne devrait pas être nul; c’est donc qu’il importe avant tout d’être rentré chez soi). -Non, dit R. Hagaï en présence de R. Yossé, on peut justifier même d’après notre Mishna le second avis (disant que l’on envisage essentiellement l’arrivée aux dites localités), d’après l’opinion qui déclare <sup>287</sup><i class=""footnote"">(Gitin 1, 2)</i> qu’Acco fait partie de la Palestine sous le rapport des divorces (non d’outre-mer). Toutefois, fut-il observé, même en classant Acco comme ville palestinienne pour les divorces, est-ce à dire qu’elle est tout à fait telle pour les conditions relatives au divorce? (Donc, elle est considérée comme externe sous ce dernier rapport).",1543,
Jerusalem Talmud Gittin 7:7:3,ואסור להתייחד עמה מכבר שמא יעבר מכנגד פניה ל' יום ונמצא גיטה גדול מבנה:,"– Il est défendu au mari de s’isoler avec sa femme répudiée depuis l’instant où l’acte de divorce est rédigé, de crainte qu’en “passant devant elle 30 jours” (et ayant cohabité avec elle dans l’intervalle) l’acte se trouve daté avant la conception d’un enfant qu’elle aurait plus tard (lequel serait supposé né à l’état illégitime).",,
