Index_Title,Jerusalem_Talmud_Mechon_Mamre,Schwab_fr,id_paragraphe,missing_footnotes
Jerusalem Talmud Sanhedrin 1:1:1,"דיני ממונות בשלשה גזילות וחובות בשלשה נזק וחצי נזק תשלומי כפל תשלומי ארבעה וחמשה האונס והמפתה ומוציא שם רע בשלשה דברי ר""מ וחכמים אומרים המוציא שם רע בעשרים ושלשה שיש בו דיני נפשות:","Un tribunal de trois juges statue sur les procès civils (financiers), ou sur les réclamations relatives à l’enlèvement d’un objet par violence, ou sur les blessures <sup>1</sup><i class=""footnote"">Ou : sur les dettes (selon une autre version).</i>. De même un tribunal de trois juges connaît des demandes en dommages-intérêts, soit dans le cas où la loi accorde une entière indemnité, soit dans ceux où elle n’accorde que le remboursement de la moitié du dommage, comme aussi dans ceux où elle oblige de payer le double, ou le quadruple, ou le quintuple (Ex 21, 37). Les réclamations pour viol, ou pour séduction, et l’accusation d’adultère, sont portées devant un tribunal de trois juges <sup>2</sup><i class=""footnote"">(Ketubot 4, 5).</i>; tel est l’avis de R. Meir. Les autres docteurs disent: pour l’accusation d’adultère, il faut un tribunal de 23 juges, car ces procès peuvent aboutir à une peine capitale.",2009,
Jerusalem Talmud Sanhedrin 1:1:2,מנן תיתי ליה והיו אלה לכם לחקת משפט הייתי אומר אחד דיני ממונות ואחד דיני נפשות בדרישה ובחקירה.,,2009,
Jerusalem Talmud Sanhedrin 1:1:3,ומניין לדיני ממונות שהן בשלשה ונקרב בעל הבית אל האלהים ריבה בה דיין אחד עד האלהים הרי שנים אשר ירשיעון אלהים הרי כאן שלשה דברי ר' יאשיה רבי יונתן אמר הראשון תחילה נאמר. ואין דורשין תחילות. אלא עד האלהים הרי אחד אשר ירשיעון אלהים הרי שנים אין בית דין שקול מוסיפין עליהן עוד אחד הרי שלשה.,"D’où sait-on (qu’à l’instar de ce qui est prescrit pour les dépôts, les vols et les blessures) il faut 3 juges pour connaître des questions d’argent, tels que prêts, ou aveux? C’est qu’il est dit (Nb 35, 29): ces préceptes vous serviront de loi en justice; de ce dernier terme, on conclut à l’uniformité de toutes les questions d’argent, et pour celles-ci comme pour les questions capitales, la loi exige l’examen et l’enquête judiciaires. Quant au fait même de l’exigence de 3 juges pour connaître des questions d’argent, on le sait de ce qu’il est dit (Ex 22, 8): le maître de maison s’approchera des juges; ce qui implique la présence d’un juge; l’expression suivante, devant le juge, se réfère au second, et les termes que les juges condamnent <sup>3</sup><i class=""footnote"">Tossefta, ch. 1.</i> se réfèrent au 3e. Tel est l’avis de R. Yoshia. R. Jonathan dit: la première expression invoquée se rapporte au fait même que la présence de juges compétents est exigible, et d’un principe on ne déduit rien autre; mais de chacune des 2 expressions suivantes, on déduit autant de fois qu’il faut un juge (soit 2), et pour départager les voix, on ajoute un 3e juge.",,
Jerusalem Talmud Sanhedrin 1:1:4,ר' אומר בשנים הכתוב מדבר אתה אומר בשנים או אינו אלא באחד כשהוא אומר אשר ירשיען אלהים אין כתיב כאן אלא אשר ירשיעון אלהים אין בית דין שקול מוסיפין עליהן עוד אחד הרי שלשה.,"Rabbi dit: la 3e expression, “que les juges condamnent”, implique déjà un minimum de 2 juges, et il ne saurait y avoir doute sur l’allusion aux 2 juges, en raison de l’emploi du verbe condamner au pluriel; puis pour départager les voix, on ajoute un 3e juge.",,
Jerusalem Talmud Sanhedrin 1:1:5,"ר' אבהו בעי וכרבי דיני ממונות בחמשה ושיגמר בכ""ג. אשכח תני רבי חזקיה הואיל ואמרה תורה הרוג על פי מטים הרוג על פי עדים מה עדים שנים אף מטים שנים אין בית דין שקול מוסיפין עליהן אחד הרי חמשה.","R. Abahou objecta ceci: d’après l’interprétation de Rabbi (voyant une allusion à 2 juges dans la dernière expression, soit, avec les deux précédentes, un total de 4 juges), un tribunal de 5 juges devrait être exigible, avec faculté de se prononcer à la majorité de 3 voix? -En effet, on trouve enseigné par R. Hiskia <sup>4</sup><i class=""footnote"">Tossefta, ch. 1.</i> qu’il en faut 5; car la condamnation devra être prononcée à une majorité d’au moins 2 voix, comme les attestations doivent être au moins au nombre de deux; puis, pour départager les voix, on ajoute encore un juge, soit en total 5. -",,
Jerusalem Talmud Sanhedrin 1:1:6,"לא הן גזילות הן חבלות. אשכח תני ר""ש בן יוחי ואלה המשפטים אשר תשים לפניהם. אתא מימר לך בפשוטה דקרייא ותייא כרבי יוסי בר חלפתא.","Est-ce que les vols ne sont pas, comme les blessures, des questions d’intérêt pécuniaire? (Pourquoi ces 2 sujets sont-ils distincts)? -En effet, on trouve que R. Simon b. Yohaï a enseigné: du verset (ibid. 21, 1) Voici les préceptes que tu leur exposeras, on déduit qu’il y a lieu de suivre l’ordre biblique (et, à l’instar de ce texte, d’énoncer chaque sujet à part). De même on tire de ce verset la déduction faite par R. Yossé b. Halafta (qu’il faut voir ce que l’on juge); ",,
Jerusalem Talmud Sanhedrin 1:1:7,"ר' יוסי בר חלפתא אתון תרין בר נש מידון קומוי א""ל על מנת שתדיננו דין תורה. אמר לון אני איני יודע דין תורה אלא היודע מחשבות יפרע מאותן האנשים. מקבלין עליכון מה דנא אמר לכון.","or, devant ce R. Yossé, 2 hommes se présentèrent en justice, lui disant de les juger selon le droit de la Loi. -Je ne connais pas ces règles, leur répondit-il (et je vous jugerai d’après vos arguments); Celui qui sait la pensée intime de chacun punira les gens qui arguent à faux; vous accepterez donc ce que je vous dirai.",,
Jerusalem Talmud Sanhedrin 1:1:8,"רבי עקיבה כד הוה בר נש אזל בעי מידון קומיה הוה א""ל הוו יודעין לפני מי אתם עומדין לפני מי שאמר והיה העולם שנאמר ועמדו שני האנשים אשר להם הריב לפני ה' ולא לפני עקיבה בן יוסף.","Lorsque devant R. aqiba des gens se présentaient pour un procès, ce rabbin leur disait: Sachez devant qui vous vous tenez; non devant moi, mais devant celui qui a créé le monde comme il est dit (Dt 19, 17): Les 2 hommes qui ont une contestations se tiendront devant l’Eternel, et non devant moi aqiba b. Joseph. ",,
Jerusalem Talmud Sanhedrin 1:1:9,"תני קודם לארבעים שנה עד שלא חרב הבית ניטלו דיני נפשות ובימי שמעון בן שטח ניטלו דיני ממונות. אמר ר""ש בן יוחי בריך רחמנא דלינא חכים מידון.","On a enseigné <sup>5</sup><i class=""footnote"">Ci-après, (7, 2). V. Derenbourg, Essai, etc., p. 69 et 90.</i>: 40 ans avant la destruction du Temple de Jérusalem, le droit de prononcer les sentences capitales a été enlevé aux Israélites, et au temps de Simon b. Shetah on leur enleva le droit de connaître des questions pécuniaires. R. Simon b. Yohaï s’écria un jour: Béni soit Dieu de ce que je suis incapable de juger ! (de cette façon, je ne suis pas responsable de la sentence).",,
Jerusalem Talmud Sanhedrin 1:1:10,"שמואל אמר שנים שדנו דיניהם דין אלא שנקראו ב""ד חצוף ר' יוחנן וריש לקיש תריהון מרין אפילו שנים שדנו אין דיניהן דין. תמן תנינן היה דן את הדין זיכה את החייב חייב לזכאי טימא לטהור טיהר לטמא מה שעשה עשוי וישלם מביתו. ר' בא בשם ר' אבהו בשאמרו לו הרי את מקובל עלינו כשנים. מה אנן קיימין אם בשטעה ודנן משיקול הדעת בדא מה שעשה עשוי. אם בשטעה ודנן דין תורה בדא ישלם מביתו. רבי בא בשם רבי אבהו בשאמרו לו הרי את מקובל עלינו כשלשה על מנת שתדיננו דין תורה וטעה ודנן בשיקול הדעת ישלם מביתו שהגיס דעתו לדון יחידי דין תורה דתנינן אל תהי דן יחידי שאין דן יחיד אלא אחד.","Samuel dit <sup>6</sup><i class=""footnote"">J., (Berakhot 7, 1) .</i> que le jugement de 2 personnes est valable; mais c’est un acte imprudent de juger à deux (au lieux d’être 3). R. Yohanan et Resh Lakish disent tous deux, de plus, qu’un tel jugement par 2 est non avenu. On a enseigné ailleurs <sup>7</sup><i class=""footnote"">(Bekhorot 4, 4).</i>: Si un homme incompétent prononce un jugement donnant raison au coupable et condamnant l’innocent, ou s’il déclare impur ce qui est pur, appelant pur ce qui est impur, le fait accompli sera maintenu; mais le préjudice ainsi causé devra être remboursé par cet homme. - C’est admis, dit R. Aba au nom de R. Abahou, au cas où les intéressés ont déclaré vouloir accepter sa décision à l’égal de celle d’un tribunal de 3 membres. Sans quoi, comment expliquer la règle de la Mishna? -Si cet homme s’est trompé pour avoir jugé avec trop de légèreté <sup>8</sup><i class=""footnote"">Cf. (Ketubot 9, 2) fin.</i>, comment est-il dit que “le fait accompli sera maintenu”? Si son erreur consiste en ce qu’il a jugé à l’opposé de la Loi formelle, pourquoi doit-il payer de sa poche le préjudice qu’il a causé à l’ayant-droit (et ne pas le réclamer à celui qui a été déclaré innocent indûment)? -Il s’agit donc ici, comme l’a dit R. Aba au nom de R. Abahou, du cas où les plaideurs ont déclaré accepter sa décision comme celle d’un tribunal de 3 juges, à condition de juger selon la Loi: alors, l’erreur survenue dans son jugement par légèreté laissera en l’état les choses faites; mais l’homme devra payer de sa poche l’erreur causée, en punition de son orgueil d’avoir jugé seul une question légale. Or, il est dit <sup>9</sup><i class=""footnote"">(Avot 4, 10).</i>: Ne sois pas seul juge, car il n’est qu’un (Dieu) qui juge seul.",,
Jerusalem Talmud Sanhedrin 1:1:11,"א""ר יהודה בן פזי אף הקב""ה אינו דן יחידי שנאמר וכל צבא השמי' עומדי' עליו מימינו ומשמאלו אילו מטין לכף זכות ואילו מטין לכף חובה. אע""פ שאין דן יחידי חותם יחידי שנאמר אבל אגיד לך את הרשום בכתב אמת. אמר רבי יוחנן לעולם אין הקב""ה עושה בעולמו דבר עד שנמלך בבית דין שלמעלן מה טעם ואמת הדבר וצבא גדול. אימתי חותמו של הקב""ה אמת בשעה שנמלך בבית דין שלמעלן. א""ר לעזר כל מקום שנאמר וה' הוא ובית דינו. ובניין אב שבכולם וה' דבר עליו רעה.","Et encore, dit R. Juda b. Pazi, même le Très-Saint ne juge pas seul, comme il est dit (1R 22, 19): toute l’armée céleste était placée auprès de lui, à sa droite et à sa gauche; les uns font pencher la balance de la justice en faveur de la grâce; les autres la font pencher dans le sens de la culpabilité (de la condamnation). Cependant, bien que Dieu ne juge pas seul, il scelle seul l’arrêt, comme il est dit (Dn 10, 21): Mais je te dirai ce qui est marqué en écriture de vérité <sup>10</sup><i class=""footnote"">Cf. (Yebamot 12, 6) .</i>; ce qui est le cachet divin. R. Yohanan dit: Dieu ne fait jamais rien dans ce bas monde sans se concerter avec le tribunal d’en haut, selon ces mots (ibid.): la parole est vraie, et l’armée est grande <sup>11</sup><i class=""footnote"">Lorsqu'avec celle-ci Dieu s'est entendu.</i>. Or, quand le cachet divin est-il la Vérité? -Lorsqu’il y a eu entente avec le tribunal d’en haut. R. Eléazar dit <sup>12</sup><i class=""footnote"">J., (Berakhot 9, 7) Midrash Rabba, (Lv sect. Qedoschim, ch. 24.</i>: partout où il est écrit Et l’Eternel, cela indique que Dieu a été assisté du tribunal céleste, et on peut chaque fois le prouver. Ainsi il est dit (1R 22, 23): Et l’Eternel a prononcé du mal contre lui (c’est l’Eternel, assisté de l’esprit sévère de la justice).",,
Jerusalem Talmud Sanhedrin 1:1:12,"מהו חותמו של הקדוש ברוך הוא רבי ביבי בשם ר' ראובן אמת מהו אמת א""ר בון שהוא אלהים חיים ומלך עולם. אמר ריש לקיש אל""ף רישיה דאלפא ביתא מ""ם באמצעיתה תי""ו בסופה לומר אני ה' ראשון שלא קיבלתי מאחר ומבלעדי אין אלהים שאין לי שותף ואת אחרונים אני הוא שאיני עתיד למוסרה לאחר.","-Quel est le cachet <sup>13</sup><i class=""footnote"">Rabba à (Gn ch. 81.</i> de la Divinité? -Le mot Vérité, dit R. Bivi au nom de R. Ruben. -Pourquoi ce mot? -Parce que, dit R. Aboun, il affirme qu’il est le Dieu vivant et le roi du monde. Selon Resh Lakish, le mot EMET (vérité) se compose de alef (A) 1re lettre de l’alphabet, mem (M) la lettre médiane, et tav (T) la dernière lettre <sup>14</sup><i class=""footnote"">""Rabba sur (Dt 1). ; Cf. B. Yoma 69b.""</i>, pour dire -selon l’expression d’Isaïe, (Is 44, 6): moi l’Eternel suis le premier, n’ayant pas reçu le pouvoir d’autrui, en dehors de moi il n’est pas de Dieu, n’ayant pas d’associé, et je serai le dernier, ne transmettant pas le pouvoir à un autre.",,
Jerusalem Talmud Sanhedrin 1:1:13,רבי בא ורבי בנימין בר יפת הוו דיינין קומי ר' יצחק ונפק דינא עם רבי בנימן. אתא רבי בא בעי מיטרוף על רבי אמי ואלף מומחה שכפף ודן דינו דין.,"R. Aba et R. Benjamin b. Japhet étaient en procès devant R. Isaac, qui donna gain de cause à R. Benjamin. R. Aba (le perdant) vint tourmenter R. Amé (au sujet de ce que R. Isaac seul l’avait condamné); mais R. Amé lui apprit que si des plaideurs ont contraint un homme compétent (comme R. Isaac) à prononcer un jugement, celui-ci est valable. ",,
Jerusalem Talmud Sanhedrin 1:1:14,רבי אבהו הוה יתיב דיין בכנישתא מדרתא דקיסרין לגרמיה אמרין ליה תלמידיו ולא כן אלפן ר' אל תהא דן יחידי. אמר לון כיון דאנן חמי לי יתיב דיין לגרמי ואתון לגביי כמי שקיבלו עליהן. ותני כן במה דברים אמורים שלא קיבלו עליהן אבל אם קיבלו עליהן דן אפילו יחידי.,"De même, R. Abahou était assis seul comme juge dans la synagogue de la Révolte à Césarée <sup>15</sup><i class=""footnote"">V. t. 1, pp. 58 et 555.</i>; ses disciples lui objectèrent son propre enseignement, disant de ne pas être seul pour juger. - Puisque, répondit-il, on me voit assis seul à juger, les parents semblent déclarer d’avance m’accepter pour tel. En effet, on a enseigné que l’on ne doit pas juger seul à défaut d’acceptation; mais dès que les plaideurs ont accepté quelqu’un pour arbitre, celui-ci peut juger, fut-il seul.",,
Jerusalem Talmud Sanhedrin 1:1:15,רבי יוחנן אזל מידון קומי רבי חייה רבה אייתוב גבי חד תלמיד. ולא כן תני אב ובנו הרב ותלמידו שניהן נימנין אחד. נימר חבר ותלמיד היה כרבי לעזר לר' יוחנן.,"R. Yohanan étant allé soutenir une cause devant R. Hiya le grand, ce dernier fit asseoir un de ses élèves à côté de lui (pour ne pas juger seul). -Mais n’a-t-on pas enseigné <sup>16</sup><i class=""footnote"">Tossefta, ch. 7.</i> qu’un père et son fils, ou un maître et son élève, ne comptent tous deux que pour une voix? -C’est vrai; mais on peut admettre que le disciple appelé par R. Hiya était à la fois un compagnon et un élève, comme R. Eléazar l’était pour R. Yohanan.",,
Jerusalem Talmud Sanhedrin 1:1:16,גזר דין נפקו מן דרב לגרמיה מן דרבי אחא לגרמיה מן דרבי יונה ור' יוסי לגרמיהון.,"Une sentence a été prononcée par Rav étant seul juge, ainsi que par R. Aba seul, et R. Yona et Yossé chacun seul. ",,
Jerusalem Talmud Sanhedrin 1:1:17,תמן תנינן הנוטל שכרו לדון דיניו בטילין כיני מתניתא החשוד ליטול שכרו ודן.,"Il est dit ailleurs <sup>17</sup><i class=""footnote"">(Bekhorot 4, 6).</i>: Les jugements de celui qui accepte un salaire pour juger sont annulés (or, est-il juste de ne pas dédommager le juge pour son dérangement)? -Voici comment il faut rectifier ce texte: celui qui est soupçonné d’accepter un don prévaricateur dans l’exercice de la justice ne sera pas agréé comme juge.",,
Jerusalem Talmud Sanhedrin 1:1:18,"חד בר נש אזל מידון קומי רב הונא א""ל אייתי לי בר נש דיסוק תחותי לדיקלא.","Ainsi un homme alla soutenir un procès devant R. Houna, lequel dit de lui faire venir un homme qui monte à sa place sur le palmier cueillir les fruits mûrs (un tel dédommagement de salaire est dû par le plaideur).",,
Jerusalem Talmud Sanhedrin 1:1:19,"רב הונא הוה רעי תורין והוה ידע שהדו לבר נש א""ל איתא שהד עלי א""ל הב לי אגרי ותני כן נותנין לדיין שכר בטילו ולעד שכר עדותו.","R. Houna était aussi pâtre; et comme quelqu’un le sollicita un jour d’aller témoigner en justice pour lui, R. Houna y consentit à la condition d’être dédommagé de son salaire comme pâtre. En effet, on a enseigné: il faut payer le salaire du juge pour son dérangement, ainsi qu’au témoin pour son attestation. ",,
Jerusalem Talmud Sanhedrin 1:1:20,חד בר נש סאב לחד כהן אתא עובדא קומי ר' יצחק ואוכליה חולין. סברין מימר שיוצאין לו דמי תרומה מתוכם.,"Quelqu’un ayant rendu impur un cohen (qui, à partir de ce moment, ne pouvait plus manger de l’oblation), le procès que lui intenta le cohen fut soumis à R. Isaac, qui décida que cet homme qui a causé l’impureté sera tenu de fournir au cohen des aliments profanes (à manger en tout état). Les compagnons d’étude ont supposé que le cohen devra du moins restituer au défendeur le montant du même aliment en oblation <sup>18</sup><i class=""footnote"">Celle-ci, étant consommée par les Cohanim seuls, a moins de preneurs que les aliments profanes et coûte moins : cette différence incombe à l'auteur de l'impureté, cause du dégât.</i>.",,
Jerusalem Talmud Sanhedrin 1:1:21,תני ר' אליעזר בן רבי יוסי הגלילי אומר המבצע חוטא והמברך את המבצע הרי זה כמנאץ לפני המקום שנאמר ובוצע ברך נאץ ה'. אלא יקוב הדין את ההר כשעשה משה אבל אהרן משים שלום שנאמר בשלום ובמישור הלך אתי.,"Or, on a enseigné que R. Eliézer b. R. Yossé le galiléen dit: celui qui accomplit la conciliation commet un péché, et celui qui bénit un tel individu blasphème pour ainsi dire la Divinité, puisqu’il est dit (Ps 10, 3): l’intermédiaire béni <sup>19</sup><i class=""footnote"">Le sens habituel, dont l'exégète se détourne ici, est : l'homme cupide se félicite de blasphémer l'Eternel. Cf. (Halla 1, 9).</i> blasphème l’Eternel; il vaut mieux en ce cas percer la montagne (plutôt que de la contourner, en signe d’accommodement), comme l’a fait Moïse. Aaron au contraire propagea la paix, car il est dit de lui (Ml 2, 6): dans la paix et la droiture il a marché avec moi.",,
Jerusalem Talmud Sanhedrin 1:1:22,תני רבי ליעזר בן יעקב אומר מה תלמוד לומר ובוצע ברך נאץ ה' משלו משל למה הדבר דומה לאחד שגנב סאה חיטין והוליכה לנחתום והפריש חלתה והאכילה לבניו הרי זה מברך ואינו אלא מנאץ.,"D’autre part, R. Eliézer b. Jacob a enseigné d’expliquer le verset précité (des psaumes) par l’apologue suivant: un homme vole un sac de froment, l’amène au boulanger, prélève sur la pâte l’oblation sacerdotale, puis donne ce pain à manger à ses enfants, et prononce sur le pain la bénédiction légale; c’est blasphémer l’Eternel de le bénir pour un vol.",,
Jerusalem Talmud Sanhedrin 1:1:23,"ר""מ אומר מה תלמוד לומר ובוצע ברך נאץ ה' אילו אחי יוסף שנאמר מה בצע כי נהרוג את אחינו וגו'.","A son tour R. Meir explique ce verset, et l’applique à la conduite des frères de Joseph, dont l’un a dit (Gn 37, 26): Quel avantage <sup>20</sup><i class=""footnote"">""Jeu de mots sur batsa"""" de ce verset et de celui des Psaumes.""</i>, si nous tuons notre frère !",,
Jerusalem Talmud Sanhedrin 1:1:24,רבי יהושע בן קרחה אומר מצוה לבצע שנאמר אמת ומשפט שלום כל מקום שיש אמת אין משפט שלום יש שלום אין משפט אמת ואי זה אמת שיש בו משפט שלום הוי אומר זה ביצוע.,"@ R. Josué b. Qorha au contraire dit que la conciliation est recommandée, par l’application de ces mots (Za 8, 16): Soyez dans la vérité, et jugez dans le sens de la paix. En voici le sens: partout où l’on veut appliquer la stricte vérité, on ne juge pas dans le sens favorable à la paix (à l’entente); si au contraire on veut avoir la paix, ce n’est pas toujours un jugement sévère de la vérité. -Quand donc le jugement vrai contient-il en même temps une tendance à la paix? -C’est en cas d’une conciliation, satisfaisant les 2 parties <sup>21</sup><i class=""footnote"">Cf. J., (Taanit 4, 2).</i>.",,
Jerusalem Talmud Sanhedrin 1:1:25,דן את הדין זיכה לזכאי חייב לחייב מעלה עליו הכתוב כילו עשה צדקה עם הזכוי וכילו עשה צדקה עם החייב. צדקה עם הזכוי שהחזיר לו ממונו ועם החייב שהוציא גזילו מתחת ידו. אמר ר' אבהו משפט משפט אמורין בפרשה אמת ומשפט שלום שפטו בשעריכם.,"Celui qui applique sévèrement la justice, déclarant innocent celui qui est tel et condamnant le coupable, est considéré par la loi comme ayant fait œuvre pie, aussi bien à l’égard de l’innocent que du coupable <sup>22</sup><i class=""footnote"">Ci-après, 2, 3.</i>: c’est une bonne action en faveur de l’innocent de lui faire récupérer son bien, et même en faveur du coupable de lui avoir fait enlever l’objet volé. R. Abahou dit: les mots justice répétés dans la section de l’exercice de la justice <sup>23</sup><i class=""footnote"">Deux fois dans (Dt 1, 17).</i> équivalent aux répétitions analogues du verset (précité): “soyez dans la vérité, et jugez dans le sens de la paix” (en ce sens qu’il peut y avoir tantôt application sévère de la loi, tantôt une entente par conciliation).",,
Jerusalem Talmud Sanhedrin 1:1:26,"רבי זכריה בעי קומי רבי אמי עבדין עובדא כההן תנייא. תני ר' שמעון בן מנסיא אומר פעמים שאתה רשאי לבצע פעמים שאין אתה רשאי לבצוע כיצד שנים שבאו אל הדיין עד שלא שמע דבריהן או מששמע דבריהן ואינו יודע היכן הדין נוטה רשאי לומר להן צאו ובצעו משתשמע דבריהן ויודע אתה היכן הדין נוטה אין אתה רשאי לבצוע. שנאמר פוטר מים ראשית מדון ולפני התגלע הריב נטוש. עד שלא נתגלע הריב אתה רשאי לנוטשו משנתגלע הדין אין אתה רשאי לנוטשו. א""ר מתנייה אף הפשרה צריכה הכרע הדעת.","Devant R. Amé, R. Zaccarie demanda: est-ce qu’en fait on applique la théorie de ce Tana (de concilier les parties)? R. Simon b. Menassia répondit que parfois il est bon de recourir à la conciliation, et d’autres fois non. Ainsi, 2 plaideurs se présentent devant le juge; aussi longtemps qu’il n’a pas entendu exposer la cause, ou bien lorsqu’après l’avoir entendue, il ne sait pas encore de quel côté penche la justice, il peut les engager à s’entendre; mais après les avoir entendus tous deux et s’être rendu compte lequel des deux a raison, le juge devra plus les engager à se concilier, comme il est dit (Pr 17, 14): Le commencement d’une querelle est la rupture d’une digue ; abandonne-la avant qu’elle éclate; en d’autres termes, avant que la discussion éclate, mieux vaut l’abandonner, mais après cela, il n’est plus possible de l’abandonner. R. Mathnia dit: même pour suggérer la conciliation, il faut savoir qui des deux parties a le plus raison.",,
