Index_Title,Jerusalem_Talmud_Mechon_Mamre,Schwab_fr,id_paragraphe,missing_footnotes
Jerusalem Talmud Gittin 5:2:1,אין נפרעין מנכסים משועבדין במקום שיש בני חורין ואפי' הן זיבורית אין נפרעין מניכסי יתומין אלא מן הזיבורית:,"Le demandeur ne peut pas saisir les biens hypothéqués, si le défendeur possède encore des biens libres, quand même ces biens seraient de la classe inférieure (et que les biens vendus seraient d’une autre classe, que le demandeur aurait droit de prendre s’ils n’étaient pas venus). Ceux qui se font payer des biens des orphelins ne peuvent prendre que les champs de la classe inférieure.-<sup>165</sup><i class=""footnote"">La Guemara sur ce paragraphe est déjà traduite en (Ketubot 9, 8)</i>",1521,
Jerusalem Talmud Gittin 5:2:2,"רבי יוחנן בשם רבי ינאי אין נפרעין מניכסי יתומים קטנים אלא בשטר שהריבית אוכלת בו. ויש אומרים אף לכתובת אשה. אמר רבי אימי מפני מזונות. אמר רבי מתניה מאן חש למזונות ר""ש דרבי שמעון אמר במגבה הדבר תלוי. מאי כדון מפני חינה כדי שיהו הכל קופצין עליה לישאנה. ויש אומרים אף לגזילה ולניזקין. אמר רבי יוסי בי רבי בון אף אנן תנינן תרתיהן לגזילה מן הדא אם היה דבר שיש לו אחריות חייבין לשלם. לניזקין מן הדא ואין נפרעין מן הנכסים של יתומין אלא מן הזיבורית. כיני מתניתא אין נפרעין מניכסי יתומים לניזקין אלא מן הזיבורית. והתני עמד הבן תחת האב הניזקין שמין להן בעידית ובעלי החוב בבינונית. וכתובת אשה בזיבורית. אמר רבי יוסי בי רבי בון כאן ביתום גדול. כאן ביתום קטן:",,1521,
Jerusalem Talmud Gittin 5:3:1,אין מוציאין לאכילת פירות ולשבח קרקעות ולמזון האשה והבנות מנכסים משועבדים מפני תיקון העולם המוציא מציאה לא ישבע מפני תיקון העולם:,"On a établi comme loi d’utilité publique, qu’aux cas suivants le demandeur ne puisse pas se faire payer des biens vendus par le défendeur, savoir: pour les produit du champ <sup>166</sup><i class=""footnote"">""P ex , dit Rashi, A vend un champ à B qui l'a cultivé, puis il se trouve qu'A n'avait pas le droit de vendre ce champ ; ce champ appartenait à une autre qui le reprend avec ses produits B réclame donc d'A de lui payer le capital et les produits En ce cas, B peut se faire payer pour le capital des biens vendus par A postérieurement à son achat, mais pour les produits, il ne peut saisir que les biens libres qu'A possède encore Cf (Ketubot 12, 2)""</i>, ou pour son amélioration <sup>167</sup><i class=""footnote"">Si p ex B avait amélioré le champ que l'ancien propriétaire lui a enlevé avec les améliorations, B ne peut saisir pour ces améliorations que les biens libres non encore vendus par A</i>, ou pour la nourriture de la veuve et des filles orphelines (qui ont droit à être nourries des biens de l’héritage de leurs frères). On a encore établi pour l’utilité publique cette loi <sup>168</sup><i class=""footnote"">""Cette dernière règle est omise dans les éditions du Talmud jérus Qui ont suivi l'édition de Venise ; mais celle de Jitomir l'a rétablie, comme bien d'autres passages essentiels""</i>: celui qui rend les choses qu’il a trouvées, à l’ancien propriétaire qui les a perdues, n’est pas obligé de prêter serment (si le propriétaire prétend qu’il y en avait davantage).",1522,
Jerusalem Talmud Gittin 5:3:2,אמר רבי חנינא מפני שאין להן קצבה,"Ces lois ont été établies, dit R. Hanina, à défaut de détermination précise.",1522,
Jerusalem Talmud Gittin 5:3:3,גזל שדה משמעון ומכרה ללוי. ובא שמעון וטרפה מלוי. לוי גובה קרן ממשועבדין של ראובן ושמעון גובה אכילת פירות מבני חורין של לוי. עמד לוי והשביח. לוי גובה את הקרן ממשועבדין של ראובן וגובה את השבח מבני חורין של שמעון. רבי חייה בשם ר' יוחנן אמר והוא שקדם מקחו של זה לשבחו של זה אבל אם קדם שבחו של זה למקחו של זה לוי גובה את השבח אפילו ממשועבדין של שמעון. ר' בא רבי חייה בשם רבי יוחנן אמר אף באכילת פירות כך היא עבדא. אפיק ד' דינרין והוא שבח אשתא. לוי גבי ארבעתי דינרייא ממשועבדין של ראובן וגבי תרין אחרונייא מבני חורין של שמעון. ר' אבין בשם רבנין דתמן אין לך יורד ברשות וידו לתחתונה אצל שמעון. רבי יוסי בי ר' בון בשם רבנין דתמן אין לך יורד ברשות וידו לעליונה אצל ראובן.,"Ainsi, lorsque Ruben vole un champ à Simon qu’il vend à Levi, puis Simon vient reprendre son bien à Levi, ce dernier sera remboursé de son capital sur les biens-immeubles de Ruben, hypothéqués en sa faveur, et Simon réclamera la jouissance “des produits” sur les biens libres (mobiliers) de Ruben. De plus, si Levi a donné de “l’amélioration” à cette terre, il réclamera le capital (primordial) sur les immeubles de Ruben, et le montant de “l’amélioration” sera payable sur les biens restés libres de Simon. Toutefois, dit R. Hiya au nom de R. Yohanan, il faut que l’achat effectué par Levi ait précédé la plus-value du vol acquis (de Ruben); mais lorsque l’amélioration de l’un a précédé l’achat fait par l’autre, Levi peut réclamer la plus-value même sur les immeubles de Simon. R. Aba ou R. Hiya dit au nom de R. Yohanan: la règle de procédure (pour les reprises à effectuer par le volé) sera la même à l’égard de “la jouissance des produits”. Quant à la revendication par l’acquéreur Levi sur les biens du volé pour sa plus-value, si p. ex. Levi a déboursé 4 dinars, et que le sol en vaut maintenant 6, Levi réclamera les 4 dinars sur les immeubles de Ruben, et il se fera payer les 2 dinars d’excédant sur les biens libres de Simon. R. Abin dit au nom des rabbins de là-bas (de Babylone): ce n’est pas entrer à l’état d’autorisé dans la possession d’autrui <sup>169</sup><i class=""footnote"">""Lorsque Lévi a acquis le bien volé de Simon il l'a pris sans autorisation, comme l'explique le commentaire Qorban 'édan ; tandis que le comment Pné-Mosché suppose la phrase interrogative""</i>, et en présence du doute, sa faculté doit être négative à l’égard de Ruben (donc, selon eux, il n’y pas de raison pour restituer à Levi au-delà de sa dépense faite). Selon R. Yossé b. R. Aboun au nom des rabbins de là-bas, ce n’est pas sans autorisation qu’il est entré en possession, et en présence du doute la faculté prédomine auprès de Simon (pour réclamer même l’excédant de la dépense en plus-value).",,
Jerusalem Talmud Gittin 5:3:4,ראובן שגזל שדה משמעון ומכרה ללוי והלך לוי ונתנה מתנה ליהודה ובא שמעון וטרפה מיהודה. יהודה לא אזיל גבי לוי דהיא מתנה. לוי אזל גבי ראובן דהיא מכירה. ולא מתנה יהבתינה. יכל הוא מימר ליה בעי הוינא מיתן ליה וישלם לי טיבו. ראובן גזל שדה משמעון ונתנה מתנה ללוי. והלך לוי ומכרה ליהודה ובא שמעון וטרפה מיהודה. יהודה אזל גבי לוי דהוא מכרה. לוי לא אזיל גבי ראובן דהיא מתנה. דמר רבי יוסי בשם רבנין אין שיעבוד למתנה.,"Ruben volant un champ à Simon, le vend à Levi, lequel à son tour le donne en présent à Juda; puis Simon reprend son bien à Juda. Ce dernier ne peut rien revendiquer auprès de Levi, dont c’était un simple don; mais Levi peut revendiquer ses droits sur les biens de Ruben, lequel a opéré la vente. Ruben ne peut pas arguer contre Levi que celui-ci n’a fait que remettre un don; car Levi peut lui répliquer: J’ai voulu lui faire une donation, et, en équivalence, il me fera un autre bien <sup>170</sup><i class=""footnote"">Maintenant, je reste frustré</i>. Voici un autre cas: Ruben ayant volé un champ de Simon, en fait don à Levi, lequel à son tour le vend à Juda; puis Simon reprend son bien à Juda. Ce dernier réclame le remboursement de sa dépense auprès de Levi, qui a vendu le champ; mais Levi ne peut rien revendiquer auprès de Ruben, puisqu’il s’agit d’un don, et l’on sait, comme l’a dit R. Yossé au nom des rabbins, qu’il n’y a pas d’hypothèque en garantie d’un don.",,
Jerusalem Talmud Gittin 5:3:5,"ראובן גזל שדה משמעון ומכרה ללוי ולא הספיק לכתוב טרפו עד שמת. דמאן היא. רב הונא וחייה בריה דרב. חד אמר אם כתב שטר טרפו של ראובן. ואם לאו של לוי היא. וחרנה אמר היא כתב היא לא כתב של לוי היא. א""ר מנא מסתברא דלא דראובן דיכיל למימר ליה האי דלא קומיך אקום לזביניה טביאת.","D’autre part, Ruben avait volé un champ à Simon qu’il vend à Levi, et avant qu’il ait achevé d’écrire le contrat de reprise de sa rapine, Simon meurt, à qui sera attribué ce sol? R. Houna et R. Hiya, fils de Rav, diffèrent d’avis à ce sujet: l’un dit que si le contrat de reprise à Levi (avant la mort de Simon) est écrit, l’immeuble est à Ruben, et au cas contraire, ce bien est attribué à Levi; l’autre dit qu’en tous cas, que le contrat soit rédigé ou non, le terrain reste attribué à Levi. Il est logique, dit R. Mena, que ce bien reste à Ruben, qui pourrait avouer à Levi lui avoir vendu ce qui ne lui appartenait pas (fait de nullité). Selon R. Yossé b. R. Aboun, il paraît que ce bien doit rester à Levi, lequel peut arguer (à Ruben, pour se dégager): “tu as voulu me vendre un bien qui était alors en ton pouvoir, cession que je trouve bonne” (n’étant pas démuni) – <sup>171</sup><i class=""footnote"">Suit un passage traduit en (Ketubot 6, 6)</i>.",,
Jerusalem Talmud Gittin 5:3:6,מהו לגבות פרנסה מן המשועבדין. אמר רבי זעירא רבי יוחנן לא גבי. מאן גבי ר' חנינה ור' אילאי גבי. רבי יסא איתפקד מדל דיתמין והוו תמן בעיין פרנסה. אעיל עובדא קומי ר' אלעזר וקומי ר' שמעון בן יקים. אמר רבי שמעון בן יקים לא מוטב שיתפרנסו מן של אביהן ולא מן הצדקה. אמר ליה רבי לעזר רבי אילו יבואו לפני רבותינו נוגעין בו ואנו עושין בו מעשה. אמר ר' יסא אנא יהיב ואי קמון יתמין ועררין אנא יהיב לון. אפילו כן חמון ולא עררון.,,,
Jerusalem Talmud Gittin 5:3:7,גזר דין נפק ציפור בת אבשלום. רבי סימון ורבי יעקב בר אידי בשם ר' שמעון בר בא אנא ורבותינו גבינו לה מן המטלטלין כמנהג מקומה.,"Une décision juridique fut obtenue par Sippora, fille d’Absalom, ainsi conçue: “R. Simon et R. Jacob b. Idi, au nom de R. Simon b. Aba, déclarent que, d’accord avec d’autres docteurs, le montant de sa nourriture devra être prélevé pour elle sur les biens mobiliers de la succession de son mari, selon l’usage de sa ville”.",,
Jerusalem Talmud Gittin 5:3:8,רב הוה כתיב לרבי עברון על דעתיה דר' חייה רבה והוה ר' חייה כתיב ביני שיטייא עמדו היתומין ומכרו גובין מן הפרנסה ואין גובין מן המזונות. עמדו ושיעבדו. השיעבוד הזה איני יודע מהו. תנא לוי אחד שיעבוד האב ואחד שיעבוד הבן גובין מן הפרנסה ואין גובין מן המזונות. אמר רבי אבא לית כאן בשיעבוד האב אלא בשיעבוד הבן. אם בשיעבוד האב. אם בחיי האב אינו גובה לא כל שכן לאחר מיתת האב. רבי חמא בר עוקבה בשם ר' יוסי בר חנינה נישאו הבנות אלמנה ניזונת מהן. רבי בא בדידיה. ורבי יודה בדידיה. דאחתיה דר' יוסי בר חנינה בשם ר' יוסי בי רבי חנינה אפילו מתו אלמנה ניזונות מהן.,"Rav ayant écrit à Rabbi une lettre de consultation, la soumit à l’opinion de R. Hiya le grand, lequel répondit entre les colonnes de cette lettre (entre un sujet et l’autre) par ces mots: Si les orphelins ont vendu l’héritage paternel on prélèvera, même sur les immeubles, le montant servant à entretenir les filles, mais non pour les nourrir. Or, lorsqu’il vient d’être question d’une “hypothèque”, par qui cette hypothèque a-t-elle été faite? (Par le père, ou par les fils) ? Levi a enseigné (une réponse): peu importe que l’hypothèque ait été faite par le père ou par les fils, on peut réclamer sur les immeubles le montant pour entretenir les filles, non pour les nourrir. R. Aba dit au contraire: il ne saurait être question là du cas où le père a hypothéqué les biens, mais seulement de l’hypothèque par les fils: car, contre le cas de l’hypothèque par le père, on peut objecter que puisque déjà du vivant du père on ne peut rien réclamer aux acquéreurs pour l’entretien des filles, il en est à plus forte raison de même après le décès du père (il s’agit donc de l’hypothèque par les fils). R. Hama b. Ouqba dit au nom de R. Yossé b. Hanina: après le mariage des filles, la veuve sera nourrie même sur les immeubles (comme un héritier). R. Aba son neveu et R. Juda, neveu de la sœur de R. Hanina, disent au nom de R. Yossé b. R. Hanina: si même les filles sont mortes (de sorte que le mari a hérité de leur vivant), la veuve sera nourrie sur les biens immeubles. Comment considère-t-on les petits-fils (au point de vue de leur obligation de nourriture vis-à-vis de la veuve)?",,
Jerusalem Talmud Gittin 5:3:9,בני בנים מה הן. רבי מנא אמר בני בנים הרי הן כבנים. רבי יוסי אמר אין בני בנים כבנים. ר' שמואל בריה דר' יוסי בי רבי בון ורבי מתנייה הוון יתבין סברין מימר היא בני בנים שכאן. היא בני בנים של הלן. אמר לון רבי יוסי בי ר' בון בני בנים קפצה עליהן ירושת תורה.,"Les fils des fils, répondit R. Mena, sont considérés <sup>172</sup><i class=""footnote"">(Yebamot 6, 6) et (Ketubot 4, 8)</i> comme les propres fils (et si ceux-ci sont morts, les petits-fils seront débiteurs): selon R. Yossé, ils ne sont pas semblables aux fils (et comme créancière pour le douaire, la femme n’aura de droit que sur la plus mauvaise terre). R. Samuel, fils de R. Yossé b. R. Aboun et R. Mathnia, assis ensemble pour se livrer à l’étude, avaient supposé que les petits-fils dont il est question ici devraient subir la même règle que les petits-fils ordinaires (au points de vue de la transmission des dettes). -Non, lui dit R. Yossé b. R. Aboun, au moment même du décès de leur père, les petits-fils sont subitement devenus héritiers par la loi (et ladite veuve n’est pas leur créancière).",,
Jerusalem Talmud Gittin 5:3:10,תמן תנינן מנה לאבא בידך אין לו בידי אלא חמשים דינרין פטור. מפני שהוא כמשיב אבידה. אמר ר' לעזר תקנה תיקנו בו כדרך שתיקנו במציאה. דתנינן המוצא מציאה לא ישבע מפני תיקון העולם. אמר ר' בא מתניתא בשאמרו לו שני שוורין מצאת לי. אבל אם אמר לו שני שוורים מצאתי לך והחזרתי לך את שניהן. והוא אומר לו לא החזרתה לי אלא אחד לא בזה תיקנו. ר' פדת בשם רבי יוחנן בזה תקנו אבל בראשונה דבר תורה היא. כהדא דתני יכול אמר לו שני שוורים מצאת לי והוא אמר לא מצאתי אלא אחד יכול יהא חייב. תלמוד לומר (ויקרא ה) או מצא אבידה וכחש בה. פרט לזה שלא כיחש. אבל אם אמר לו עומד הייתי בראש גגי וראיתיך מושך שני שוורים קשורים. שני שוורים קשורים משכתי לי והוא אומר לא משכתי אלא אחד לא בזה תיקנו. ודכוותה עומד הייתי על אבא בשעת מיתתו וטענך מנה והודיתה לו. והוא אומר לא הודיתי אלא חמשים לא בזה תיקנו:,"On a enseigné ailleurs <sup>173</sup><i class=""footnote"">(Shevouot 6, 1)</i>: Si le demandeur dit: “tu devais à mon père un Maneh (= 100 zouz)”, et le défendeur répond ne devoir que 50 zouz, il est acquitté (sans avoir à prêter serment pour le reste), car il est considéré comme un homme qui ayant trouvé la perte d’autrui la lui rend. C’est là, dit R. Eléazar, l’adoption d’une mesure rabbinique, la même qui a été introduite pour la trouvaille, puisqu’il est dit ici: Celui qui restitue un objet trouvé n’est pas tenu de prêter serment, règle instituée par utilité publique. La Mishna, dit R. Aba, parle du cas où le demandeur prétend que la trouvaille devait être p. ex. de 2 bœufs; mais si le défenseur dit avoir trouvé 2 bœufs, qu’il déclare avoir rendus tous deux, tandis que le demandeur prétend n’en avoir reçu qu’un, en ce cas de discussion sur la restitution complète ou partielle, les rabbins n’ont pas établi leur règle. Selon R. Pedath au nom de R. Yohanan, les rabbins ont établi ici une règle qui en principe était déjà un ordre légal. Ainsi (quant à la dispense légale de jurer) il a dit: On aurait pu croire que si le demandeur réclame 2 bœufs perdus, et le défendeur dit n’en avoir trouvé qu’un, celui-ci est tenu de prêter serment; mais comme il est écrit (Lv 5, 21): ou s’il trouve un objet perdu qu’il nie, il devra jurer etc., on exclut celui qui ne nie pas (s’il y a aveu partiel). Si le demandeur dit: je me trouvais placé au sommet du toit et je t’ai vu conduire 2 bœufs liés ensemble, que tu m’amenais tous 2 enchaînés tandis que le défendeur prétend avoir conduit un seul bœuf, en ce cas les rabbins n’appliquent pas leur règle <sup>174</sup><i class=""footnote"">La similitude n'est pas complète entre le présent cas et celui de l'aveu partiel d'une dette paternelle, dans la Mishna précitée</i>. De même, leur règle n’est pas applicable au cas où le demandeur dirait: “j’ai assisté mon père à son lit de mort lorsqu’il t’a réclamé cent zouz, que tu as reconnu devoir”, tandis que le défendeur dit avoir seulement reconnu une dette de 50 zouz.",,
Jerusalem Talmud Gittin 5:4:1,יתומים שסמכו אצל בעל הבית או שמינה להן אביהן אפיטרופוס חייב לעשר פירותיהן אפיטרופוס שמינהו אבי יתומים ישבע ושמינהו בית דין לא ישבע אבא שאול אומר חילוף הדברים:,"Le maître de maison sur lequel les orphelins s’appuient (auquel est confiée la gestion de leurs biens), ou que leur père avait désigné d’avance pour être leur tuteur epitropo"", sera tenu de rédimer les fruits que ceux-ci mangeront. Si le père des orphelins a nommé pour eux un tuteur, celui-ci est obligé de prêter serment sur sa gestion (si les orphelins devenus majeurs l’exigent); mais si c’est le tribunal qui l’a nommé tuteur il n’est pas obligé de prêter serment <sup>175</sup><i class=""footnote"">Cf, (Shevouot 7, 9)</i>. Abba Saül dit le contraire.",1523,
Jerusalem Talmud Gittin 5:4:2,(במדבר יח) אתם פרט לשותפין. אתם פרט לאפיטרופוס. אתם פרט לתורם שאינו שלו. אתם פרט לשותפין. והתנינן השותפין שתרמו. אלא כאן בתרומה גדולה. כאן בתרומת מעשר. כלום למדו תרומה גדולה לא מתרומת מעשר. אלא כאן להלכה. כאן למעשה. אתם פרט לאפיטרופוס. והתניא יתומים שסמכו אצל בעל הבית או שמינה להן אביהן אפיטרופוס חייב לעשר פירותיהן. חברייא אמרין כאן לאפיטרופין לעולם. כאן לאפיטרופין לשעה. ר' יוסי בעי אם באפיטרופין לעולם ודא דתני מוכר הוא עבדים אבל לא קרקעות. אלא כאן ביתום גדול. כאן ביתום קטן.,,1523,
Jerusalem Talmud Gittin 5:4:3,"א""ר יוחנן בתחילה אין מעמידין אפיטרופוס ליתומין לחוב להן אלא לזכות להן ואם חבו חבו. ר' יוסי בר חנינה אמר בין בתחילה בין בסוף אין מעמידין להן בין לזכות בין לחובה. מתניתא פליגא על ר' יוסי בר חנינה מעמידין להן אפיטרופוס. שנייה היא בשור שלא ילך ויזיק. הזיק משל מי הן משלמין. ר' יוחנן אמר משל יתומין. רבי יוסי בר חנינה אמר משל אפיטרופוס. ואפילו דלא יסבור רבי יוחנן כן לית מילתיה אמרה כן לא דהוא אמר לבסוף אם חבו חבו.","<sup>176</sup><i class=""footnote"">""Nommé par le père, le tuteur ne jurera pas ; il jurera si le tribunal le nomme""</i> <sup>177</sup><i class=""footnote"">En tête du paragraphe, se trouve un passage déjà traduit, (Terumot 1, 1)</i>. R. Yohanan dit <sup>178</sup><i class=""footnote"">J, Baba (Qama 4, 2) ( 2b)</i>: en principe, on ne nomme pas de tuteur chargé d’assister les mineurs en justice s’ils sont débiteurs, mais seulement pour leur faire valoir un avantage, et si ensuite il résulte des débats qu’ils sont coupables, ils n’ont qu’à se soumettre à la condamnation. Selon R. Yossé b. Hanina, ni en principe, ni à la fin (après coup), on ne leur assigne de défenseur juridique, soit qu’il s’agisse d’acquittement, soit d’une condamnation. N’y a-t-il pas une Mishna opposée à l’avis de R. Yossé b. Hanina, qui dit: “Si des gens ont été frappés par le bœuf d’un sourd-muet, ou d’un mineur, on nommera pour ce dernier un tuteur, devant lequel ces attestations devront se produire et auquel la condamnation sera notifiée”? Là c’est différent, fut-il répondu, et cette juridiction a été établie pour empêcher qu’un tel bœuf ne fasse un dommage (et qu’il soit gardé par le représentant de l’intéressé). – Si le bœuf appartenant à des mineurs pourvus d’un tuteur cause un dommage, qui sera responsable de ce fait et devra le payer? Selon R. Yohanan, le montant sera pris sur les biens des orphelins; selon R. Yossé b. Hanina, on le prendra sur les biens du tuteur. Du reste, si même R. Yohanan n’exprimait pas son avis formellement, on le déduirait de ce qu’il a dit plus haut: “S’ils sont condamnés, ils n’ont qu’à se soumettre à la sentence “ (ce qui implique que le paiement du dommage est à leur propre charge).",,
