Index Title,Sotah
Version Title,"""Talmud Bavli. German. Lazarus Goldschmidt. 1929 -- footnotes"""
Language,he
Version Source,https://www.nli.org.il/he/books/NNL_ALEPH001042448/NLI
Version Notes,
Sotah 2a:1,"<sup>i</sup> <b>W</b>ENN <small>JEMAND SEINE</small> F<small>RAU VERWARNT</small>$fn1, <small>SO VERWARNE ER SIE, WIE</small> R. E<small>LIE͑ZER SAGT, VOR ZWEI</small> Z<small>EUGEN</small>$fn2 <small>UND LASSE SIE TRINKEN</small>$fn3 <small>AUF</small> G<small>RUND EINES</small> Z<small>EUGEN ODER EIGENER</small> W<small>AHRNEHMUNG</small>$fn4. R. J<small>EHOŠUA͑ SAGT, ER VERWARNE SIE VOR ZWEI ZEUGEN UND LASSE SIE TRINKEN AUF</small> G<small>RUND ZWEIER</small> Z<small>EUGEN</small>. <sup>ii</sup> W<small>IE VERWARNT ER</small>$fn5 <small>SIE?</small> W<small>ENN ER IHR VOR ZWEI</small> [Z<small>EUGEN</small>] <small>GESAGT HAT, DASS SIE MIT JENEM</small> M<small>ANNE NICHT SPRECHE, UND SIE MIT IHM GESPROCHEN HAT, SO IST SIE IHREM</small> M<small>ANNE NOCH</small>$fn6 <small>ERLAUBT, AUCH DARF SIE</small>$fn7 H<small>EBE ESSEN</small>. G<small>ING SIE MIT IHM IN EINEN VERBORGENEN</small> R<small>AUM UND VERWEILTE DA DIE</small> D<small>AUER EINER</small> V<small>ERUNREINIGUNG</small>$fn8<small>, SO IST SIE IHREM</small> M<small>ANNE VERBOTEN, AUCH DARF SIE KEINE</small> H<small>EBE ESSEN</small>. S<small>TIRBT ER</small>$fn9, <small>SO IST AN IHR DIE</small> Ḥ<small>ALIÇA</small>$fn10<small>UND NICHT DIE</small> S<small>CHWAGEREHE</small>$fn10<small>ZU VOLLZIEHEN</small>."
Sotah 2a:2,"GEMARA. Merke, der Autor schließt ja mit [dem Traktate vom] Nazirate, weshalb lehrt er [im Anschluß daran den Traktat von der] Ehebruchsverdächtigten? — Nach einer Lehre Rabbis. Es wird nämlich gelehrt: Rabbi sagte: Weshalb ist der Abschnitt vom Nazir dem Abschnitte von der Ehebruchsverdächtigten angeschlossen worden? Um dir zu sagen, daß, wenn jemand eine Ehebruchsverdächtigte in ihrem Unglimpf sieht, er den Wein abgelobe. — Sollte er doch zuerst [den Traktat] von der Ehebruchsverdächtigten und nachher den vom Nazir$fn11lehren!? — Da er [vorher den Traktat von der] Ehelichung$fn12lehrte, in dem vom Abgeloben$fn13gelehrt wird, und daran [den Traktat] von den Gelübden anschließt, so läßt er darauf [den Traktat] vom Nazirate folgen, das den Gelübden gleicht, und hierauf [den Traktat] von der Ehebruchsverdächtigten, wegen der Lehre Rabbis."
Sotah 2a:3,"W<small>ENN JEMAND VERWARNT</small>. Nur wenn es bereits erfolgt$fn14ist, von vornherein aber nicht, somit ist unser Autor der Ansicht, die Verwarnung sei verboten$fn15."
Sotah 2a:4,"R. Šemuél b. R. Jiçḥaq sagte: Wenn Reš Laqiš [den Traktat] von der Ehebruchsverdächtigten begann, sprach er wie folgt: Man gesellt einem Menschen eine Frau zu, nur nach Gebühr seiner Taten, denn es heißt: $fn16<i>denn das Szepter des Gottlosen wird über dem Lose der Frommen nicht ruhen</i>. Rabba b. Bar Ḥana sagte im Namen R. Joḥanans: Und ihre Paarung ist so schwierig, wie die Spaltung$fn17des Schilfmeeres, denn es heißt:$fn18<i>Gott bringt die Einsamen heim, er fährt die Gefesselten ins Freie</i>$fn19. — Dem ist ja aber nicht so, R. Jehuda sagte ja im Namen Rabhs, daß vierzig Tage vor der Bildung der Geburt eine Hallstimme ertöne und spreche: die Tochter$fn20von jenem für diesen, das Haus von jenem für diesen, das Feld von jenem für diesen!? — Das ist kein Einwand; das eine gilt von der ersten Verheiratung und das andere gilt von der zweiten Verheiratung."
Sotah 2a:5,"S<small>O VERWARNE ER SIE, WIE</small> R. E<small>LIE͑ZER SAGT, VOR ZWEI</small> Z<small>EUGEN &amp;C</small>. Sie streiten also nur über die Verwarnung und$fn21das Sichverbergen, hinsichtlich der Verunreinigung aber ist auch ein einzelner Zeuge$fn22glaubhaft. Ferner haben wir auch gelernt, daß, wenn ein einzelner Zeuge bekundet, er habe gesehen, daß sie sich verunreinigt hat, sie nicht$fn23trinke. Woher, daß nach der Tora ein einzelner Zeuge glaubhaft ist? — Die Rabbanan lehrten:$fn24<i>Und ein Zeuge gegen sie nicht da ist</i>; die Schrift spricht von zweien$fn25. Vielleicht ist dem nicht so, sondern auch von einem? Es"
Sotah 2b:1,"heißt:$fn26<i>ein einzelner Zeuge soll nicht gegen jemand auftreten</i>; schon aus den Worten: <i>ein Zeuge soll nicht gegen jemand auftreten</i>, weiß ich ja, daß von einem gesprochen wird, wenn es aber auch <i>einzelner</i> heißt, so ist dies eine Hauptnorm, daß überall, wo es ‘Zeuge’ heißt, zwei zu verstehen seien, es sei denn, daß die Schrift ausdrücklich einzelner sagt. Die Schrift sagt nun, daß, wenn zwei [Zeugen] nicht vorhanden sind, sondern nur einer, und sie nicht ertappt worden ist, sie [ihrem Manne] verboten sei. — Demnach erfolgt dies nur aus dem Grunde, weil der Allbarmherzige geschrieben hat: <i>ein einzelner Zeuge soll nicht gegen jemand auftreten</i>, sonst aber würde man gesagt haben, unter ‘Zeuge’ bei der Ehebruchsverdächtigten sei einer zu verstehen; wodurch sollte sie denn, wenn auch einer nicht vorhanden ist, verboten$fn27werden!? — Dies ist nötig; unter: <i>ein Zeuge gegen sie nicht da ist</i>, könnte man verstehen, er sei nicht glaubhaft. — Dies würde also heißen, ein Zeuge sei nicht glaubhaft, vielmehr seien zwei erforderlich; demnach sollte die Schrift davon geschwiegen haben, und ich würde durch [das Wort] <i>Sache</i>$fn28vom Zivelrechte gefolgert haben, daß dieses allen anderen Zeugnissen in der Tora gleiche!? — Dies ist nötig; man könnte glauben, bei einer Ehebruchsverdächtigten verhalte es sich anders, weil die Wahrscheinlichkeit dafür spricht, da er sie verwarnt und sie sich verborgen hat, somit sei auch ein einzelner Zeuge glaubhaft. — Wieso kannst du sagen, [man würde verstehen:] er sei nicht glaubhaft und sie sei erlaubt, es heißt ja:$fn29<i>und sie nicht ertappt worden ist</i>, demnach ist sie ja verboten!? — Dies ist nötig; man könnte glauben, nur zwei seien glaubhaft, und sie durch zwei nicht ertappt worden ist, so lehrt er uns."
Sotah 2b:2,"R. J<small>EHOŠA͑ SAGT, ER VERWARNE SIE VOR ZWEI &amp;C</small>. Was ist der Grund R. Jehošua͑s? — Die Schrift sagt: <i>gegen sie</i>, gegen sie$fn30, nicht aber bei der Verwarnung, gegen sie, nicht aber beim Sichverbergen$fn31. R. Eliézer aber erklärt: <i>gegen sie</i>, nicht aber bei der Verwarnung$fn32. — Vielleicht aber: <i>gegen sie</i>, nicht aber beim Sichverbergen!? — Das Sichverbergen wird mit der Verunreinigung verglichen, denn es heißt:$fn24<i>und sie sich verborgen und verunreinigt hat</i>. — Auch die Verwarnung wird ja mit der Verunreinigung verglichen, denn es heißt:$fn33<i>und er gegen seine Frau eifert</i>$fn34, <i>und sie sich verunreinigt hat</i>!? — Diese hat der Allbarmherzige durch [das Wort] <i>gegen sie</i> ausgeschlossen. — Was veranlaßt dich dazu$fn35!? — Es ist einleuchtend, daß das Sichverbergen strenger$fn36ist, denn dies macht sie gleich der Verunreinigung verboten. — Im Gegenteil, die Verwarnung ist ja strenger, denn diese ist die hauptsächliche Veranlassung$fn37!? — Wenn nicht das Sichverbergen, gäbe es keine Verwarnung$fn38. — Welche Wirkung hat denn das Sichverbergen ohne Verwarnung!? — Dennoch ist das Sichverbergen strenger, denn dies ist der Beginn der Verunreinigung."
Sotah 2b:3,"Unsere Mišna vertritt nicht die Ansicht des Autors der folgenden Lehre: R. Jose b. R. Jehuda sagte im Namen R. Elie͑zers: Wenn jemand seine Frau verwarnt, so verwarne er sie vor einem Zeugen oder ganz allein$fn39und lasse sie auf Grund zweier Zeugen$fn40trinken. Die Weisen erwiderten: Nach der Ansicht des R. Jose b. R. Jehuda hat die Sache keinen Zweck. — Was ist der Grund des R. Jose b. R. Jehuda? — Die Schrift sagt: <i>gegen sie</i>$fn40, nicht aber beim Sichverbergen. — Vielleicht aber: <i>gegen sie</i>, nicht aber bei der Verwarnung!? — Die Verwarnung wird mit der Verunreinigung verglichen, denn es heißt: <i>und er gegen seine Frau eifert</i>$fn34<i>und sie sich verunreinigt hat</i>. — Auch das Sichverbergen wird ja mit der Verunreinigung verglichen, denn es heißt: <i>und sie sich verborgen und verunreinigt hat</i>!? — Dies deutet darauf, daß das Sichverbergen die Dauer der Verunreinigung betragen müsse$fn41. — «Die Weisen erwiderten: Nach der Ansicht des R. Jose b. R. Jehuda hat die Sache keinen Zweck.» Wieso dies? — Es kann vorkommen, daß er sie tatsächlich nicht verwarnt hat, jedoch behauptet, er habe sie verwarnt$fn42. — Demnach hat dies nach unserer Mišna$fn43wohl einen Zweck; es kann ja vorkommen, daß sie sich nicht verborgen hat, er aber behauptet, sie habe sich wohl verborgen!? R. Jiçḥaq b. Joseph erwiderte im Namen R. Joḥanans: Auch nach der Ansicht des R. Jose b. R. Jehuda hat die Sache keinen Zweck. — ‘Auch nach der Ansicht des R. Jose b. R. Jehuda’, und um so weniger nach unserer Mišna; im Gegenteil, nach unserer Mišna ist ja die Grundlage vorhanden, während nach jener Lehre die Grundlage nicht vorhanden$fn44ist!? — Vielmehr, ist dies gelehrt worden, so wird es wie folgt lauten. R. Jiçḥaq b. Joseph erwiderte im Namen R. Joḥanans: Nach R. Jose b. R. Jehuda und auch nach unserer Mišna hat die Sache keinen Zweck."
Sotah 2b:4,"R. Ḥanina aus Sura sagte: In der Jetztzeit sage man nicht zu seiner Frau, daß sie sich mit jemandem nicht verberge, denn vielleicht ist nach R. Jose b. R. Jehuda zu entscheiden, welcher sagt, die Verwarnung könne durch ihn allein erfolgen, und wenn sie sich mit jenem verbirgt, ist sie ihm, da es in der Jetztzeit kein Untersuchungswasser zur Prüfung gibt, für ewig verboten."
Sotah 2b:5,"Reš Laqiš sagte: Was heißt Qinnuj$fn45? Ein Vorgang, der Haß [Qináh] stiftet zwischen ihr und anderen. Er ist der Ansicht, die Verwarnung könne durch ihn allein erfolgen, und da die Leute nicht wissen, daß er sie verwarnt hat, so sagen sie: Was hat diese, daß sie sich absondert!? Deshalb hegen sie Haß gegen sie. R. Jemar b. Šelemja erklärte im Namen Abajjes: Ein Vorgang, der zwischen ihm und ihr Haß stiftet. Er ist der Ansicht, die Verwarnung müsse vor zwei Zeugen erfolgen; jeder weiß somit, daß er sie verwarnt habe, und er selbst ist es, der den Haß gegen sie$fn46hervorruft. Demnach$fn47sind beide der Ansicht, die Verwarnung sei verboten."
Sotah 3a:1,"— Was bedeutet Qinnuj nach demjenigen, welcher sagt, die Verwarnung sei erlaubt? R. Naḥman b. Jiçḥaq erwiderte: Qinnuj ist nichts weiter als ein Ausdruck der Verwarnung, wie es heißt:$fn48<i>der Herr eifert für sein Land</i>$fn49."
Sotah 3a:2,"Es wird gelehrt: R. Meír sagte: Wenn ein Mensch heimlich eine Sünde begeht, so macht dies der Heilige, gepriesen sei er, öffentlich bekannt, denn es heißt:$fn50<i>und über ihn ein Geist der Eifersucht geht</i>, und unter ‘gehen’ ist eine Bekanntmachung zu verstehen, wie es heißt:$fn51<i>da gebot Moše und man ließ einen Ruf durch das Lager gshen</i>. Reš Laqiš sagte: Ein Mensch begeht nur dann eine Sünde, wenn ein Geist der Torheit in ihn fährt, denn es heißt:$fn52<i>wenn irgend eines Mannes Frau sich vergeht</i>, und geschrieben ist: eine Torheit$fn53begeht. In der Schule R. Jišma͑éls wurde gelehrt: Weshalb glaubte die Tora bei der Ehebruchsverdächtigten einem einzelnen Zeugen? Weil die Wahrscheinlichkeit dafür spricht, denn er hat sie verwarnt, sie sich verborgen, und ein Zeuge bekundet, daß sie sich verunreinigt habe. R. Papa sprach zu Abajje: Die Verwarnung wird ja in der Schrift nach dem Verbergen und der Verunreinigung$fn54genannt!? Dieser erwiderte:$fn50<i>Und geht</i>, wenn es bereits vorher gegangen$fn55war. — [Es heißt ja auch:]$fn56<i>und es gehe</i>$fn57<i>jeder Gerüstete von euch</i>, demnach wäre auch hierbei ebenso zu verstehen!? — Da heißt es: $fn58<i>und wenn das Land vor dem Herrn unterworfen ist, und ihr darauf umkehrt</i>, demnach bezieht es sich auf die Zukunft; wenn man aber hierbei nach der Reihenfolge der Schrift, kommen$fn59wird, auslegen wollte, so wäre ja, nach der Verunreinigung und dem Sich verbergen, die Verwarnung nicht nötig."
Sotah 3a:3,"In der Schule R. Jišma͑éls wurde gelehrt: Ein Mensch verwarnt seine Frau nur dann, wenn ein Geist in ihn gefahren ist, denn es heißt: <i>und über ihn ein Geist der Eifersucht geht und er gegen seine Frau eifert</i>. — Was ist dies für ein Geist? Die Rabbanan erklärten, ein Gaist der Unreinheit. R. Aši erklärte, ein Geist der Reinheit. Einleuchtend ist die Ansicht desjenigen, der ein Geist der Reinheit sagt, denn es wird gelehrt: <i>Und er gegen seine Frau eifert</i>, dies ist freigestellt — so R. Jišma͑él; R. A͑qiba sagt, es sei Pflicht. Erklärlich ist dies, wenn du ein Geist der Reinheit sagst, ist es denn aber, wenn du ein Geist der Unreinheit sagst, Pflicht oder freigestellt, daß ein Mensch einen Geist der Unreinheit in sich bringe!?"
Sotah 3a:4,"Der Text. <i>Und er gegen seine Frau eifert</i>, dies ist freigestellt — so R. Jišma͑él; R. A͑qiba sagt, es sei Pflicht.$fn60 <i>An ihr verunreinige er sich</i>, dies ist freigestellt — so R. Jišma͑él; R. A͑qiba sagt, es sei Pflicht.$fn61<i>Ewig haltet sie zur Arbeit</i>, dies ist freigestellt — so R. Jišma͑él; R. A͑qiba sagt, es sei Pflicht. R. Papa sprach zu Abajje, manche sagen, R. Mešršeja zu Raba: Demnach wäre anzunehmen, daß R. Jišma͑él und R. A͑qiba diesen Streit in der ganzen Tora führen; einer sagt, es sei freigestellt, und der andere sagt, es sei Pflicht$fn62!? Dieser erwiderte: Sie streiten nur über [diese] Schriftverse. «<i>Und er gegen seine Frau eifert</i>, dies ist freigestellt — so R. Jišma͑él: R. A͑qiba sagt, es sei Pflicht.» Was ist der Grund R. Jišma͑éls? — Er ist der Ansicht des Autors der folgenden Lehre: R. Elie͑zer b. Ja͑qob sagte: Die. Tora sagt:$fn63<i>du sollst deinen Bruder in deinem Herzen nicht hassen</i>, somit konnte man glauben, dies sei auch hierbei$fn64zu berücksichtigen, so heißt es: <i>und über ihn ein Geist der Eifersucht geht und er gegen seine Frau eifert</i>$fn65. — Und R. A͑qiba!? — [Der Ausdruck] ‘eifern’ wird zweimal gebraucht$fn66. — Und R. Jišma͑él!? — Da er schreiben will: <i>und sie sich verunreinigt hat, und sie sich nicht verunreinigt hat</i>, so heißt es auch [wiederum]: <i>und er gegen seine Frau eifert</i>$fn67. Dies nach einer Lehre der Schule R. Jišma͑éls, denn in der Schule R. Jišma͑éls wurde gelehrt: Jeder Abschnitt, der gelehrt und wiederholt worden ist, ist nur wegen einer darin vorkommenden Neuerung wiederholt worden. «<i>An ihr verunreinige er sich</i>, dies ist. freigestellt — so R. Jišma͑él; R. A͑qiba sagt, es sei Pflicht.» Was ist der Grund R. Jišma͑éls? — Es heißt: $fn68<i>rede zu den Priestern, den Kindern Ahrons, und sprich zu ihnen: er darf sich an keiner Seele in seinem Volke verunreinigen</i>, daher heißt es: <i>an ihr verunreinige er sich</i>$fn65. — Und R. A͑qiba!? Dies$fn69geht hervor aus [den Worten:]$fn70<i>nur an seinen Blutsverwandten</i>, und wenn es noch heißt: <i>an ihr verunreinige er sich</i>, so deutet dies auf die Pflicht. — Und R. Jišma͑él!? — <i>An ihr verunreinige er sich</i>, nicht aber an einzelnen Gliedern von ihr. — Und R. A͑qiba!? — Der Allbarmherzige sollte doch <i>an</i>"
Sotah 3b:1,"<i>ihr</i> geschrieben haben und nichts weiter, wenn es aber auch heißt: <i>verunreinige er sich</i>, so ist auch dies$fn71zu entnehmen. — Und R. Jišma͑él!? — Da er <i>an ihr</i> geschrieben hat, so schrieb er auch: <i>verunreinige er sich</i>. Dies nach einer Lehre R. Jišma͑éls, denn in der Schule R. Jišma͑éls wurde gelehrt: Jeder Abschnitt, der gelehrt und wiederholt worden ist, ist nur wegen einer darin vorkommenden Neuerung wiederholt worden. «<i>Ewig haltet sie zur Arbeit</i>, dies ist freigestellt — so R. Jišma͑él; R. A͑qiba sagt, es sei Pflicht.» Was ist der Grund R. Jišma͑éls? — Da es heißt:$fn72<i>du sollst keine Seele am Leben lassen</i>, so muß er auch schreiben: <i>ewig haltet sie zur Arbeit</i>, um zu lehren, daß, wenn jemand von den übrigen Völkern$fn73eine Kenániterin$fn74beschlafen und von ihr einen Sohn gezeugt hat, man ihn [als Sklaven] kaufen dürfe. Es wird nämlich gelehrt: Woher, daß, wenn jemand von den übrigen Völkern eine Kena͑niterin beschlafen und von ihr einen Sohn gezeugt hat, man diesen als Sklaven kaufen$fn75dürfe? Es heißt:$fn76<i>und auch aus den Kindern der Beisassen, die bei euch weilen, aus ihnen möget ihr erwerben</i>. Man könnte glauben, daß, auch wenn ein Kena͑niter eine von den übrigen Völkern beschlafen und von ihr einen Sohn gezeugt hat, man diesen als Sklaven kaufen dürfe, so heißt es:$fn76<i>die sie in eurem Lande gezeugt haben</i>; von denen, die in eurem Lande gezeugt worden sind, nicht aber von denen, die in eurem Lande wohnen$fn77. — Und R. A͑qiba!? — Dies geht hervor aus [den Worten]: <i>aus ihnen möget ihr erwerben</i>, und wenn es noch heißt: <i>ewig haltet sie zur Arbeit</i>, so deutet dies auf die Pflicht. — Und R. Jišma͑él!? — <i>Sie</i>, nicht aber eure Brüder. — Und R. A͑qiba!? — Hinsichtlich der Brüder geht dies aus dem Schlüsse des Schriftverses hervor:$fn78<i>aber bei euren Brüdern, den Kindern Jisraél, darf nicht einer den anderen mit schwerer Arbeit knechten</i>. — Und R. Jišma͑él!? — Da es <i>sie</i>$fn79heißt, so heißt es auch <i>euren Brüdern</i>. Dies nach einer Lehre der Schule R. Jišma͑éls, denn m der Schule R. Jišma͑éls wurde gelehrt: Jeder Abschnitt, der gelehrt und wiederholt worden ist, ist nur wegen einer darin vorkommenden Neuerung wiederholt worden."
Sotah 3b:2,"R. Ḥisda sagte: Hurerei im Hause ist wie Fäulnis$fn80für den Mohn. Ferner sagte R. Ḥisda: Zank im Hause ist wie Fäulnis für den Mohn. Beides gilt jedoch nur von der Frau, beim Manne aber ist nichts dabei."
Sotah 3b:3,"Ferner sagte R. Ḥisda: Zuerst, bevor die Jisraéliten gesündigt haben, ruhte die Göttlichkeit über jedem einzelnen besonders, denn es heißt: $fn81<i>denn der Herr, dein Gott, zieht in deinem Lager einher</i>; nachdem sie aber gesündigt haben, wich die Göttlichkeit von ihnen, denn es heißt: $fn81<i>daß er nicht etwas Schändliches an dir sehe und sich von dir zurückziehe</i>."
Sotah 3b:4,"R. Šemuél b. Naḥmani sagte im Namen R. Jonathans: Wer ein Gebot auf dieser Welt ausübt, den empfängt es in der zukünftigen Welt und geht vor ihm einher, wie es heißt:$fn82<i>deine Gerechtigkeit wird vor dir hergehen</i>. Wer ein Verbot auf dieser Welt übertritt, den umschlingt es am Tage des Gerichtes und geht vor ihm einher, wie es heißt:$fn83<i>es krümmen sich die Pfade ihres Laufes, sie steigen auf in die Öde und kommen um</i>. R. Elie͑zer sagt: Es hängt sich an ihn wie ein Hund, denn es heißt:$fn84<i>er war ihr nicht zuwillen, sich mit ihr zu legen und mit ihr zusammen zu sein; sich mit ihr zu legen</i>, auf dieser Welt, <i>und mit ihr zusammen zu sein</i>, in der zukünftigen Welt."
Sotah 3b:5,"Dort haben wir gelernt: Man könnte folgern: wenn das erste$fn85Zeugnis, das sie nicht für immer verboten$fn86macht, nicht durch weniger als zwei Zeugen gültig ist, um wieviel weniger ist das letzte$fn87Zeugnis, das sie für immer verboten macht, durch weniger als zwei Zeugen gültig, daher heißt es:$fn88<i>und ein Zeuge gegen sie nicht da ist</i>, irgend [ein Zeugnis]$fn89gegen sie. Demnach könnte man [durch einen Schluß] vom Schwereren auf das Leichtere folgern: wenn das letzte Zeugnis, das sie für immer verboten macht, durch einen Zeugen gültig ist, um wieviel mehr ist das erste Zeugnis, das sie nicht für immer verboten macht, durch einen Zeugen gültig, daher heißt es:$fn90<i>denn er hat an ihr etwas Schändliches gefunden</i>, und dort$fn91heißt es: <i>durch zwei Zeugen oder durch drei Zeugen soll etwas bestätigt werden</i>; wie dort das <i>etwas</i> durch zwei Zeugen [bestätigt werden muß], ebenso auch hierbei durch zwei. — Ist dies denn aus [den Worten:] <i>denn er hat an ihr etwas Schändliches gefunden</i>, zu entnehmen, dies wird ja gefolgert$fn92aus <i>gegen sie</i>, nicht aber bei der Verwarnung, <i>gegen sie</i>, nicht aber beim Sichverbergen!? — Dies sagt er auch: so heißt es <i>gegen sie</i>, gegen sie, nicht aber bei der Verwarnung, <i>gegen sie</i>, nicht aber beim Sichverbergen. Woher, daß bei einer sonstigen Verunreinigung, ohne Verwarnung und ohne Sichverbergen, ein einzelner Zeuge nicht glaubwürdig sei? Hierbei heißt es: <i>denn er hat an ihr etwas Schändliches gefunden</i>, und dort heißt es: <i>durch zwei Zeugen oder durch drei Zeugen soll etwas bestätigt werden</i>, wie dort das <i>etwas</i> durch zwei Zeugen [bestätigt werden muß], ebenso auch hierbei durch zwei Zeugen."
Sotah 3b:6,"Die Rabbanan lehrten: Das erste Zeugnis ist das Zeugnis über das Sichverbergen, das letzte Zeugnis ist das Zeugnis über die Verunreinigung. — Wieviel beträgt die Dauer des Sichverbergens? — Die Dauer der Verunreinigung,"
Sotah 4a:1,"das ist die Dauer des Beischlafes, das ist die Dauer der Anschmiegung$fn93, das ist die Dauer der Umkreisung einer Dattelpalme — so R. Jišma͑él. R. Elie͑zer sagt, die Dauer des Einschenkens eines Bechers. R. Jehošua͑ sagt, als man ihn trinken kann. Ben A͑zaj sagt, als man ein Ei backen kann. R. A͑qiba sagt, als man ein solches schlürfen kann. R. Jehuda b. Bethera sagt, als man drei Eier hinter einander schlürfen kann. R. Elea͑zar b. Jirmeja sagt, als ein Weber einen Faden zusammenknotet. Ḥanin b. Pinḥas sagt, als sie die Hand in den Mund stecken und ein Spänchen$fn94entfernen kann. Pelemo sagt, als sie mit der Hand in den Korb langen und ein Brot nehmen kann. Und obgleich es keinen Beweis dafür gibt, so gibt es dennoch eine Andeutung:$fn95<i>denn durch ein Hurenweib [kommt man herunter] bis auf einen Laib Brot</i>. Wozu ist dies alles$fn96nötig? — Dies ist nötig. Würde er nur gelehrt haben: die Dauer der Verunreinigung, so könnte man glauben, die Dauer der Verunreinigung und der Liebkosung; daher lehrt er: die Dauer des Beischlafes. Und würde er nur gelehrt haben: die Dauer des Beischlafes, so könnte man glauben, die Dauer bis zur Beendigung des Beischlafes; daher lehrt er: die Dauer der Anschmiegung. Und würde er nur gelehrt haben: die Dauer der Anschmiegung, so könnte man glauben, der Anschmiegung und der Liebkosung, daher lehrt er: die Dauer der Verunreinigung. — Beträgt denn die Verunreinigung die Dauer der Umkreisung einer Dattelpalme, ich will auf einen Widerspruch hinweisen: $fn97<i>Und sie sich verborgen hat</i>; wir würden die Dauer des Sichverbergens nicht gekannt haben, wenn es aber heißt: <i>und sie sich verunreinigt hat</i>, so sage man, es betrage die Dauer der Verunreinigung, das ist die Dauer des Beischlafes, das ist die Dauer der Anschmiegung, das ist die Dauer des Rückganges einer Dattelpalme — so R. Elie͑zer. R. Jehošua͑ sagt, die Dauer des Einschenkens eines Bechers. Ben A͑zaj sagt, als man ihn trinken kann. R. A͑qiba sagt, als man ein Ei backen kann. R. Jehuda b. Bethera Sagt, als man ein solches schlürfen kann. Er glaubte, ‘Umkreisung einer Dattelpalme’ und ‘Rückgang einer Dattelpalme’ sei dasselbe, [somit ist einzuwenden:] dort sagt R. Jišma͑él, die Dauer der Umkreisung einer Dattelpalme, und R. Elie͑zer streitet gegen ihn, und hier sagt R. Elie͑zer, die Dauer des Rückganges einer Dattelpalme!? Abajje erwiderte: Umkreisung: mit den Füßen, Rückgang: durch den Wind$fn98. R. Aši fragte: Ist dies zu verstehen, wie sie durch den Wind hin und her bewegt wird, oder aber, wie sie hin und her bewegt wird und zurück in ihre frühere Stellung gelangt? — Dies bleibt unentschieden. — Dort sagt R. Elie͑zer, die Dauer des Einschenkens eines Bechers, unci hier sagt er, die Dauer des Rückganges einer Dattelpalme!? — Beides ist von gleicher Dauer. — Dort sagt R. Jehošua͑, als man ihn trinken kann, und hier sagt er, die Dauer des Einschenkens eines Bechers!? — Lies: als man einen einschenken und trinken kann$fn99. — Sollte er doch erwidert haben. beides sei von gleicher Dauer!? — Demnach wäre dies identisch mit [der Ansicht] R. Elie͑zers. — Dort sagt Ben A͑zaj, als man ein Ei backen kann, und hier sagt er, als man [einen Becher] trinken kann!? — Beides ist von gleicher Dauer. — Dort sagt R. A͑qiba, als man [ein Ei] schlürfen kann, und hier sagt er, als man ein Ei backen kann!? — Lies: als man ein Ei backen und schlürfen kann. — Sollte er doch erwidert haben, beides sei von gleicher Dauer!? — Demnach wäre dies identisch mit [der Ansicht] Ben A͑zajs. — Dort sagt R. Jehuda b. Bethera, als man drei Eier hinter einander schlürfen kann, und hier sagt er, als man [ein Ei] schlürfen kann!? — Er sagt es nach der Ansicht R. A͑qibas; dieser sagt: die Dauer des Backens und Schlürfens, und hierzu sagt er: wenn nur schlürfen, als man drei Eier hinter einander schlürfen kann; es ist dies die Dauer von Backen und Schlürfen$fn100."
Sotah 4a:2,"«R. Elie͑zer b. Jirmeja sagt, als ein Weber einen Faden zusammenknotet.» R. Aši fragte: Entfernt$fn101oder nahe? — Dies bleibt unentschieden."
Sotah 4a:3,"«Ḥanin b. Pinḥas sagt, als sie die Hand in den Mund stecken und ein Spänchen entfernen kann.» R. Aši fragte: Ein eingepreßtes oder ein loses? — Dies bleibt unentschieden."
Sotah 4a:4,"«Pelemo sagt, als sie mit der Hand in den Korb langen und ein Brot nehmen kann.» R. Aši fragte: Ein eingepreßtes oder ein loses? Ein neuer$fn102oder ein alter? Ein warmes$fn103oder ein kaltes? Aus Weizen oder"
Sotah 4b:1,aus Gerste? Ein weiches$fn104oder ein hartes? — Dies bleibt unentschieden.
