Index Title,Sotah
Sotah 13a:4,"U<small>ND AUCH DARIN GAB ES KEINEN BEDEUTENDEREN ALS</small> J<small>OSEPH &amp;C</small>. Die Rabbanan lehrten: Komm und sieh, wie beliebt die Gebote unserem Meister Moše waren. Während ganz Jisraél sich mit Beutemachen$fn542befaßte, befaßte er sich mit [der Ausübung]$fn543der Gebote, wie es heißt:$fn544<i>wer weisen Herzens ist, nimmt Gebote an &amp;c</i>. Woher wußte Moše, wo Joseph begraben war? — Man erzählt, daß Serah, die Tochter Ašers, aus jener Generation zurückgeblieben war, und Moše wandte sich an sie und fragte sie, ob sie nicht wisse, wo Joseph begraben liege. Sie erwiderte ihm: Die Miçrijim fertigten für ihn einen Sarg aus Metall und versenkten ihn in den Nilfluß, damit sein Wasser gesegnet werde. Hierauf ging Moše hin, stellte sich an das Ufer des Nils und sprach: Joseph, Joseph, es ist die Zeit herangereicht, hinsichtlich welcher der Heilige, gepriesen sei er, geschworen hat: ich werde euch erlösen, und es ist die Zeit herangereicht, hinsichtlich welcher du Jisraél beschworen$fn545hast; wenn du jetzt erscheinest, so ist es recht, wenn aber nicht, so sind wir von deinem Schwure entbunden. Da schwamm der Sarg Josephs sofort herauf. Es darf dich aber nicht wundern, wieso Eisen obenauf schwimmen kann. Es heißt:$fn546<i>Und es geschah, als einer einen Balken fällte, da fiel das Eisen ins Wasser &amp;c. Da sprach der Mann Gottes: Wohin ist es gefallen? Und als er ihm die Stelle zeigte, hieb er ein Holz ab und warf es hinein; da schwamm das Eisen herauf</i>. Nun ist ein Schluß von einem Kleineren auf einen Größeren zu folgern: wenn für Eliša͑, der ein Schüler Elijahus und Elijahu wiederum ein Schüler Mošes war, das Eisen heraufgeschwommen ist, um wieviel mehr für unseren Meister Moše selbst. R. Nathan sagte: Er war in der Königsgruft begraben, und Moše$fn547ging hin, stellte sich an die Königsgruft und sprach: Joseph, es ist die Zeit herangereicht, hinsichtlich welcher der Heilige, gepriesen sei er, geschworen hat: ich werde euch erlösen, und es ist dic Zeit herangereicht, hinsichtlich welcher du Jisraél beschworen hast; wenn du jetzt erscheinest, so ist es recht, wenn aber nicht, so sind wir von deinem Schwure entbunden. In dieser Stunde erbebte der Sarg Josephs und Moše nahm ihn und führte ihn mit. Während aller Jahre, wo die Jisraéliten in der Wüste wanderten, zogen beide Laden, die des Toten und die der Göttlichkeit$fn548, neben einander, und die Wanderer fragten nach der Bedeutung dieser beiden Laden. Man erwiderte ihnen, die eine ist die eines Toten und die andere ist die der Göttlichkeit. — Ist es denn schicklich, daß ein Toter neben der Göttlichkeit ziehe? Man"
Sotah 13b:1,"erwiderte ihnen: Der eine hat alles gehalten, was in der anderen geschrieben steht. — Würden denn, wenn Moše sich mit ihm nicht befaßt hätte, die Jisraéliten sich mit ihm nicht befaßt$fn549haben, es heißt ja: $fn550<i>und die Gebeine Josephs, die die Kinder Jisraél aus Miçrajim brachten, begruben sie in Šekhem</i>!? — Sie sprachen: laßt ihn gewähren, es ist für ihn mehr Ehrung, wenn es durch Große erfolgt, als wenn es durch Geringe erfolgt. — Würden denn, wenn die Jisraéliten sich mit ihm nicht befaßt hätten, seine Söhne sich mit ihm nicht befaßt$fn549haben, es heißt ja:$fn550<i>und sie blieben den Söhnen Josephs zum Besitztume</i>!? — Sie sagten: laßt sie gewähren, es ist für ihn mehr Ehrung, wenn es durch viele erfolgt, als wenn es durch wenige erfolgt."
Sotah 13b:2,"$fn550<i>Begruben sie in Šekhem</i>. Weshalb gerade in Šekhem? R. Ḥama b. R. Ḥanina erwiderte: [Sie sagten:] aus Šekhem stahlen$fn551sie ihn und nach Šekhem wollen wir das Verlorene zurückbringen. — Die Schriftverse widersprechen ja einander, es heißt:$fn552<i>und Moše nahm die Gebeine Josephs mit</i>, und es heißt: <i>und die Gebeine Josephs, die die Kinder Jisraél mitnahmen</i>!? R. Ḥama b. R. Ḥanina erwiderte: Wenn jemand etwas tut und es nicht beendigt und ein anderer kommt und es beendigt, so rechnet die Schrift es dem an, der es beendigt hat, als bitte er es allein getan. R. Elea͑zar sagte: Man setzt ihn$fn553auch von seiner Würde ab, denn es heißt:$fn554<i>und es geschah in jener Zeit, da zog Jehuda</i>$fn555<i>hinab</i>$fn556. R. Šemuél b. Naḥmani sagte: Er begräbt auch Frau und Kinder, denn es heißt:$fn557<i>da starb die Tochter Šua͑s, die Frau Jehudas &amp;c</i>. Ferner heißt es: $fn558<i>da starben E͑r und Onan</i>."
Sotah 13b:3,"R. Jehuda sagte im Namen Rabhs: Weshalb wird Joseph schon bei Lebzeiten Gebeine$fn559genannt? Weil er nicht für die Ehrung seines Vaters eintrat. [Seine Brüder] sprachen zu ihm:$fn560<i>dein Knecht unser Vater</i>, und er sagte ihnen dazu nichts."
Sotah 13b:4,"Ferner sagte R. Jehuda im Namen Rabhs, nach anderen R. Ḥama b. R. Ḥanina: Weshalb starb Joseph früher als seine Brüder? Weil er sich herrisch benahm."
Sotah 13b:5,"$fn561<i>Und Joseph wurde nach Miçrajim hinabgebracht</i>. R. Elea͑zar sagte: Man lese nicht <i>hinabgebracht</i>, sondern <i>brachte hinab</i>, denn er brachte die Sterndeuter des Pareo͑ von ihrer Würde$fn562hinab.$fn561<i>Da kaufte ihn Poṭiphar, ein Hofbedienter des Pareo͑</i>. Rabh sagte: Er kaufte ihn für seine$fn563 Person, da kam Gabriél und kastrierte ihn, und hierauf kam Gabriél wieder und verstümmelte ihn. Zuerst wird er Poṭiphar, nachher aber Poṭiphera͑$fn564genannt."
Sotah 13b:6,"U<small>ND AUCH DARIN GAB ES KEINEN BEDEUTENDEREN ALS</small> M<small>OŠE &amp;C</small>.$fn565<i>Der Herr sprach zu mir: Laß genug sein</i>. R. Levi sagte: Mit ‘genug’ redete er an und mit ‘genug’ redete man ihn an; mit ‘genug’ redete er an, denn es heißt:$fn566<i>genug euch</i>, mit ‘genug’ redete man ihn an, wie es heißt: <i>laß genug sein</i>. Eine andere Erklärung: <i>Laß genug [rabh] sein</i>, du hast einen Meister$fn567[rabh], das ist Jehošua͑. Eine andere Erklärung: <i>Laß genug sein</i>, damit man nicht sage: wie hart ist der Meister und wie zudringlich ist der Schüler. — Weshalb dies alles? In der Schule R. Jišma͑éls wurde gelehrt: Entsprechend dem Kamele die Last$fn568."
Sotah 13b:7,"$fn569<i>Und er sprach zu ihnen: Hundertundzwanzig Jahre bin ich heute</i>. Wozu heißt es <i>heute</i>? — Heute sind meine Tage und Jahre voll geworden. Dies lehrt dich, daß der Heilige, gepriesen sei er, die Jahre der Frommen (vom Tag) bis auf den Tag und (vom Monat) bis auf den Monat voll werden läßt, wie es heißt:$fn570<i>die Zahl deiner Tage werde ich voll machen</i>."
Sotah 13b:8,"$fn569<i>Ich vermag nicht mehr auszuziehen und einzuziehen</i>. Was heißt auszuziehen und einzuziehen, wollte man sagen, wörtlich, ausziehen$fn571und einziehen, so heißt es ja:$fn572<i>hundertundzwanzig Jahre war Moše alt, als er starb</i>$fn573<i>&amp;c</i>. Ferner heißt es:$fn574<i>Moše stieg hinauf von A͑rboth Moab auf den Berg Nebo</i>, und hierzu wird gelehrt, daß da zwölf Stufen waren und Moše sie mit einem Schritte bestieg!? R. Šemuél h. Naḥmani erwiderte im Namen R. Jonathans: Auszuziehen und einzuziehen in den Angelegenheiten der Tora. Dies lehrt, daß die Pforten der Weisheit sich ihm geschlossen hatten."
Sotah 13b:9,"$fn575<i>Da gingen Moše und Jehošua͑ hin und stellten sich in das Offenbarungszelt</i>. Es wird gelehrt: Es war ein Zwei-Lehrer-Šabbath$fn576, und das Amt wurde dem einen genommen und dem anderen übertragen."
Sotah 13b:10,"Es wird gelehrt: R. Jehuda sagte: Wenn es nicht ein geschriebener Schriftvers wäre, dürfte man es nicht sagen. Gestorben ist Moše im Gebiete Reúbens, denn es heißt: <i>Moše stieg hinauf von A͑rboth Moab auf den Berg Nebo</i>, und Nebo lag im Gebiete Reúbens, wie es heißt:$fn577<i>und die Söhne Reúbens, sein Sohn &amp;c. und Nebo &amp;c</i>. (Es heißt Nebo, weil da drei Propheten [nebiím], Moše, Ahron und Mirjam, starben). Begraben worden ist Moše im Gebiete Gads, denn es heißt:$fn578<i>er hat das erste sich erschen$fn579&amp;c</i>. [Die Entfernung] vom Gebiete Reúbens bis zum Gebiete Gads beträgt vier Mil; wer hat ihn nun die vier Mil getragen? Dies lehrt, daß Moše auf den Fittigen der Göttlichkeit lag. Die Dienstengel sprachen:$fn578<i>Das Recht des Herrn führt er aus, seine Gerichte mit Jisraél</i>. Der Heilige, gepriesen sei er, sprach:$fn580<i>Wer tritt für mich gegen die Bösewichter, wer stellt sich für mich gegen die Übeltäter</i>. Šemuél sagte: [Er sprach:]$fn581<i>Wer ist wie der Weise, wer versteht die Deutung der Dinge?</i> R. Joḥanan sagte: [Er sprach:]$fn582<i>Die Weisheit, woher kommt sie</i>? R. Naḥman sagte:$fn583<i>Und Moše starb daselbst &amp;c</i>. Semaljon$fn584sprach: <i>Und Moše starb daselbst</i>, der große Gelehrte Jisraéls$fn585."
Sotah 13b:11,"Es wird gelehrt: R. Elie͑zer der Große sagte: Durch zwölf zu zwölf Mil, entsprechend dem jisraélitischen Lager, ertönte eine Hallstimme und sprach: <i>Und Moše starb daselbst</i>, der große Gelehrte Jisraéls. Manche sagen: Moše starb überhaupt nicht. Hier heißt es: <i>starb daselbst</i>, und dort$fn586heißt es: <i>er blieb daselbst mit dem Herrn</i>; wie dort [zu verstehen ist], er stand und tat Dienst, ebenso auch hier, er stand und tat Dienst."
Sotah 13b:12,"$fn587<i>Und er begrub ihn im Tale im Lande Moab, gegenüber Bet Peo͑r</i>. R. Berekhja sagte: ein Zeichen zu einem Zeichen, dennoch kennt niemand sein Grab."
Sotah 13b:13,
Sotah 14a:1,"Einst sandte die ruchlose Regierung an den Befehlshaber$fn588von Beth Peo͑r, daß er ihr zeige, wo Moše begraben ist. Standen sie oben, so erschien ihnen [das Grab] unten, und wenn unten, so erschien es ihnen oben. Hierauf teilten sie sich in zwei Abteilungen; denen aber, die oben standen, erschien es unten, und denen, die unten standen, erschien es oben. Es ging in Erfüllung, was geschrieben steht:$fn589<i>kein Mann kannte seine Grabstätte</i>. R. Ḥama b. R. Ḥanina sagte: Auch Moše selbst wußte nicht, wo er begraben wird; hier heißt es: <i>kein Mann kannte seine Grabstätte</i>, und dort heißt es:$fn590<i>dies ist der Segen, mit welchem gesegnet hat Moše, der Mann Gottes</i>."
Sotah 14a:2,"Ferner sagte R. Ḥama b. R. Ḥanina: Moše wurde deshalb gegenüber Beth Peo͑r begraben, um das Ereignis von Peo͑r$fn591zu sühnen."
Sotah 14a:3,"Ferner sagte R. Ḥama b. R. Ḥanina: Es heißt:$fn592<i>dem Herrn, eurem Gott, sollt ihr folgen</i>; ist es denn einem Menschen möglich, der Göttlichkeit zu folgen, es heißt ja:$fn593<i>denn der Herr, dein Gott, ist ein verzehrendes Feuer</i>!? Vielmehr [lehrt dies], daß man den Handlungen des Heiligen, gepriesen sei er, folge. Wie er die Nackten kleidet, wie es heißt:$fn594<i>und Gott der Herr machte Adam und seinem Weibe Hautröcke und bekleidete sie</i>, so kleide auch du die Nackten. Wie der Heilige, gepriesen sei er, Kranke besucht, wie es heißt:$fn595<i>und der Herr erschien ihm unter den Terebinthen Mamres</i>, so besuche auch du die Kranken. Wie der Heilige, gepriesen sei er, Trauernde tröstet, wie es heißt:$fn596<i>und es geschah nach dem Tode Abrahams, da segnete Gott seinen Sohn Jiçḥaq</i>, so tröste auch du die Trauernden. Wie der Heilige, gepriesen sei er, Tote begräbt, wie es heißt:$fn597<i>und er begrub ihn im Tale</i>, so begrabe auch du die Toten."
Sotah 14a:4,"<i>Hautröcke</i>. Rabh und Šemuél [streiten hierüber]; einer erklärt, etwas, das von der Haut kommt, und einer erklärt, etwas, wovon die Haut einen Genuß hat$fn598."
Sotah 14a:5,"R. Šimlaj trug vor: Die Tora beginnt mit Wohltätigkeit und schließt mit Wohltätigkeit. Sie beginnt mit Wohltätigkeit, denn es heißt: <i>und Gott der Herr machte Adam und seinem Weibe Hautröcke und bekleidete sie</i>; sie schließt mit Wohltätigkeit, denn es heißt: <i>er begrub ihn im Tale</i>."
Sotah 14a:6,"R. Šimlaj trug vor: Weshalb begehrte Moše, in das Jisraélland zu kommen; brauchte er etwa von seinen Früchten zu essen, oder etwa sich von seinem Gute zu sättigen? Vielmehr sprach Moše also: Viele Gebote sind den Jisraéliten auferlegt worden, die nur im Jisraéllande ausgeübt werden können, ich möchte daher in das Land kommen, damit sie alle durch mich ausgeübt werden können. Da sprach der Heilige, gepriesen sei er, zu ihm: Du möchtest ja nur die Belohnung erhalten, und ich rechne es dir an, als hättest du sie ausgeübt. Daher heißt es:$fn599<i>Ich will ihm einen Anteil geben unter Vielen, und mit Mächtigen soll er Beute teilen, weil er sich dem Tode hingab und unter die Frevler zählen ließ, während er doch die Sünden vieler getragen hat und für die Frevler herantrat. Ich will ihm einen Anteil geben unter vielen</i>; man könnte glauben, unter den letzteren und nicht unter den ersteren, so heißt es: <i>und mit den Mächligen soll er Beute teilen</i>, mit Abraham, Jiçḥaq und Ja͑qob, die in der Tora und guten Werken mächtig waren. <i>Weil er sich dem Tode hingab</i>, er gab sich dem Tode preis, wie es heißt:$fn600<i>wenn aber nicht, lösche mich doch aus &amp;c. Unter die Frevler zählen ließ</i>, er wird unter die in der Wüste Verstorbenen gezählt. <i>Während er doch die Sünde vieler getragen hat</i>, er sühnte das Ereignis$fn601mit dem Kalbe. <i>Und für die Frevler herantrat</i>, er flehte um Erbarmen für die Frevler Jisraéls, daß sie in Buße zurückkehren, denn unter ‘herantreten’ ist die Fürbitte zu verstehen, wie es heißt:$fn602<i>du sollst für dieses Volk nicht bitten, keine Klage und kein Gebet für sie erheben, und an mich nicht herantreten</i>."
Sotah 14a:7,"<b>E</b>R$fn1 <small>BRINGT DANN IHR</small> S<small>PEISOPFER IN EINEM</small> W<small>EIDENKORBE</small>$fn2 <small>UND LEGT ES IHR IN DIE</small> H<small>ÄNDE, UM SIE ZU ERMÜDEN</small>. A<small>LLE</small> S<small>PEISOPFER BEGINNEN UND ENDEN IN</small> D<small>IENSTGEFÄSSEN, DIESES ABER BEGINNT IN EINEM</small> W<small>EIDENKORBE UND ENDET IN EINEM</small> D<small>IENSTGEFÄSSE</small>. A<small>LLE</small> S<small>PEISOPFER BENÖTIGEN DES</small> Ö<small>LS UND DES</small> W<small>EIHRAUCHS, DIESES ABER BENÖTIGT WEDER DES</small> Ö<small>LS NOCH DES</small> W<small>EIHRAUCHS</small>. A<small>LLE</small> S<small>PEISOPFER WERDEN AUS</small> W<small>EIZEN DARGEBRACHT, DIESES ABER AUS</small> G<small>ERSTE</small>. D<small>AS</small> S<small>PEISOPFER DER</small> S<small>CHWINGEGARBE WURDE ZWAR</small> [<small>EBENFALLS</small>] <small>AUS</small> G<small>ERSTE DARGEBRACHT, JEDOCH AUS GESIEBTEM</small> F<small>EINMEHL, DIESES ABER AUS</small> G<small>ROBMEHL</small>. R. G<small>AMLIÉL SAGTE</small>: W<small>IE IHR</small> B<small>ETRAGEN DEM EINES</small> V<small>IEHS GLEICHT, EBENSO BESTEHT AUCH IHR</small> O<small>PFER AUS</small> V<small>IEHFUTTER</small>."
Sotah 14a:8,"GEMARA. Es wird gelehrt: Abba Ḥanin sagte im Namen R. Elie͑zers: Um sie zu ermüden, damit sie zurücktrete$fn3. Wenn die Tora diejenigen, die seinen Willen übertreten, so sehr schont$fn4, um wieviel mehr diejenigen, die seinen Willen tun. — Woher, daß dies aus Schonung erfolgt, vielleicht deshalb, damit die Rolle$fn5 nicht verwischt werde!? — Er ist der Ansicht, daß man sie vorher trinken lasse und nachher ihr Opfer darbringe;"
Sotah 14b:1,"wenn wegen der Rolle, so ist sie ja bereits verwischt worden."
Sotah 14b:2,"A<small>LLE</small> S<small>PEISOPFER &amp;C</small>. Ich will auf einen Widerspruch hinweisen; Bei den Speisopfern besteht folgende Ordnung. Man bringe sein Speisopfer aus der Wohnung in einem silbernen oder goldenen Korbe, lege es$fn6 in ein Dienstgefäß, heilige es im Dienstgefäße, tue dazu das Öl und den Weihrauch und reiche es dem Priester. Der Priester bringt es zum Altar und stellt es auf den südwestlichen Winkel, gegen die Kante des Horns, und dies genügt. Sodann schiebt er den Weihrauch nach der Seite, hebt eine Handvoll ab von einer Stelle, wo das meiste Öl sich befindet, legt sie in ein Dienstgefäß und heiligt sie im Dienstgefäße; den Weihrauch klaubt er zusammen, legt ihn darauf und räuchert ihn in einem Dienstgefäße auf. Hierauf salzt er [die Handvoll] und legt sie auf das Feuer. Ist die Handvoll dargebracht worden, so darf das Zurückbleibende gegessen werden. Die Priester dürfen darin Wein, Öl und Honig hineintun, nur säuern dürfen sie es nicht. Hier wird nun gelehrt: in einem silbernen oder goldenen Korbe$fn7!? R. Papa erwiderte: Lies: in Gefäßen, die als Dienstgefäße geeignet sind. — Demnach ist ein Weidenkorb ungeeignet, also nicht wie R. Jose b. R. Jehuda, denn es wird gelehrt: Hat man Dienstgefäße aus Holz gefertigt, so sind sie nach Rabbi untauglich und nach R. Jose b. R. Jehuda tauglich. — Du kannst auch sagen, nach R. Jose b. R. Jehuda, denn R. Jose b. R. Jehuda sagt es nur von wertvollen, sagt er es etwa auch von minderwertigen!? Hält er etwa nichts [vom Schriftverse:] $fn8<i>reiche es doch deinem Statthalter</i>$fn9!?"
Sotah 14b:3,"«Lege es in ein Dienstgefäß, heilige es im Dienstgefäße.» Hieraus ist demnach zu entnehmen, daß die Dienstgefäße nur beabsichtigt$fn10 heiligen? — Lies: lege es in ein Dienstgefäß, um es durch das Dienstgefäß zu heiligen$fn11."
Sotah 14b:4,«Tue dazu das Öl und den Weihrauch.» Denn es heißt:$fn12<i>er gieße darüber Öl und lege dazu Weihrauch</i>.
Sotah 14b:5,«Und reiche es dem Priester.» Denn es heißt:$fn13<i>und bringe es zu den Söhnen Ahrons &amp;c</i>.
Sotah 14b:6,«Der Priester bringt es zum Altar.» Denn es heißt:$fn14<i>und dieser bringe es zum Altar heran</i>.
Sotah 14b:7,"«Und stellt es auf den südwestlichen Winkel gegen die Spitze des Horns, und dies genügt.» Woher dies? — Es heißt:$fn15<i>dies ist das Gesetz des Speisopfers; die Söhne Ahrons sollen es vor den Herrn bringen, an die Vorderseite des Altars</i>. Hierzu wird gelehrt: <i>Vor den Herrn</i>, man könnte glauben, in der Westseite$fn16, so heißt es: <i>an die Vorderseite</i>$fn17<i>des Altars</i>; wenn an die Vorderseite des Altars, so könnte man glauben, in der Südseite, so heißt es: <i>vor den Herrn</i>. Wie ist dies nun zu erklären? Er bringe es zum südwestlichen Winkel, gegen die Kante des Horns, und dies genügt. R. Elea͑zar sagte: Man könnte glauben, daß man es zur westlichen oder zur südlichen Seite des Horns bringe, so ist zu erwidern: wenn du zwei Schriftverse findest, von denen der eine sich selbst und auch einen anderen aufrecht erhält, und der andere sich selbst aufrecht erhält und jenen aufhebt, so lasse man den, der sich selbst aufrecht erhält und den anderen aufhebt, und halte sich an den, der sich und den anderen aufrecht erhält. Wenn du sagst: <i>vor den Herrn</i>, in der Westseite, so hast du aufgehoben [die Worte:] <i>an die Vorderseite des Altars</i>, in der Südseite; wenn du aber sagst: <i>an die Vorderseite des Altars</i>, in der Südseite, so hältst du aufrecht [die Worte:] <i>vor den Herrn</i>, in der Westseite. [Wie mache er es? Er bringe es zur Südseite des Horns.] — Wieso hältst du sie aufrecht? R. Aši erwiderte: Dieser Autor ist der Ansicht, der ganze Altar habe auf der Nordseite$fn18gestanden. — Was heißt: dies genügt$fn19? R. Aši erwiderte: Dies ist nötig; man könnte glauben, es sei das Heranbringen des Speisopfers selbst$fn20nötig, so lehrt er uns. — Vielleicht ist dem auch so!? — Die Schrift sagt:$fn14<i>er reiche es dem Priester und dieser bringe es zum Altar heran</i>; wie das Reichen dem Priester in einem Gefäße, ebenso das Heranbringen zum Altar in einem Gefäße."
Sotah 14b:8,"«Sodann schiebt er den Weihrauch nach einer Seite.» Damit er nicht mit dem Haufen abgehoben werde, denn wir haben gelernt, daß, wenn ihm beim Abheben des Haufens ein Steinchen, ein Salzkorn oder ein Stück Weihrauch in die Hand gekommen ist, er untauglich sei."
Sotah 14b:9,"«Hebt eine Handvoll ab von einer Stelle, wo das meiste Öl sich befindet.» Woher dies? — Es heißt:$fn21<i>von seinem Mehl und seinem Öl, von seinem Schrote und seinem Öl</i>."
Sotah 14b:10,"«Legt sie in ein Dienstgefäß und heiligt sie im Dienstgefäße.» Wozu dies, er hat sie ja bereits einmal$fn22geheiligt!? — Wie beim Blute$fn23; das Blut wird im Halse des Viehs durch das Messer$fn24geheiligt, dennoch ist es wiederum durch das Dienstgefäß zu heiligen, ebenso auch dieses."
Sotah 14b:11,"«Den Weihrauch klaubt er zusammen, legt ihn darauf.» Denn es heißt:$fn25<i>und den aanzen Weihrauch, der sich auf dem Speisopfer befindet</i>."
Sotah 14b:12,«Und räuchert ihn in einem Dienstgefäße auf.» Räuchert er ihn denn
Sotah 15a:1,"im Dienstgefäße auf!? — Lies vielmehr: er bringt ihn in einem Dienstgefäße hinauf, um ihn aufzuräuchern."
Sotah 15a:2,«Salzt er [die Handvoll] und legt sie auf das Feuer.» Denn es heißt: $fn26<i>und all deine Speisopfer sollst du mit Salz salzen &amp;c</i>.
Sotah 15a:3,"«Ist die Handvoll dargebracht worden, so darf das Zurückbleibende gegessen werden.» Woher dies? — Es heißt:$fn27<i>der Priester lasse den Erinnerungsteil aufräuchern &amp;c</i>. und ferner: <i>und was vom Speisopfer zurückbleibt, gehört Ahron und seinen Söhnen</i>. «Ist die Handvoll dargebracht worden.» Nach dem einen, nach seiner Ansicht, und nach dem anderen nach seiner Ansicht Es wurde nämlich gelehrt: Von wann ab macht die Hand voll das Zurückbleibende zum Essen erlaubt? R. Ḥanina sagt, sobald das Feuer sie erfaßt hat, R. Joḥanan sagt, sobald das Feuer die größere Hälfte angebrannt hat."
Sotah 15a:4,"«Die Priester dürfen darin Wein, Öl und Honig hineintun.» Aus welchem Grunde? — Die Schrift sagt:$fn28<i>zum Salben</i>, zur Würde; wie die Könige$fn29essen."
Sotah 15a:5,"«Nur säuern dürfen sie es nicht.» Denn es heißt:$fn30<i>es darf nicht gesäuert gebacken werden, als ihren Anteil &amp;c</i>. und R. Šimo͑n b. Laqiš erklärte, auch ihr Anteil dürfe nicht gesäuert gebacken werden."
Sotah 15a:6,"A<small>LLE</small> S<small>PEISOPFER &amp;C</small>. Benötigen denn alle Speisopfer des Öls und des Weihrauchs, es gibt ja das Sünderspeisopfer, von dem der Allbarmherzige sagt:$fn31<i>night soll er Öl darauf tun noch Weihrauch dazu geben</i>!? — Er meint es wie folgt: alle Speisopfer benötigen des Öls und des Weihrauches, und sind aus Weizen und Feinmehl darzubringen; das Sünderspeisopfer benötigt zwar des Öls und des Weihrauchs nicht, jedoch wird es aus Weizen und Feinmehl dargebracht, das Speisopfer der Schwingegarbe wird zwar aus Gerste dargebracht, jedoch benötigt es des Öls und des Weihrauchs, auch wird es aus feinem Mehl dargebracht: dieses aber benötigt nicht des Öls und des Weihrauchs, auch wird es aus Gerste und aus Grobmehl dargebracht."
Sotah 15a:7,"Es wird gelehrt: R. Šimo͑n sagte: Eigentlich sollte das Sünderspeisopfer des Öls und des Weihrauchs benötigen, damit der Sünder nicht$fn32gewinne, nur benötigt es dieser deshalb nicht, damit sein Opfer nicht üppig sei. Ferner sollte eigentlich das Talgsündopfer$fn33des Trankopfers benötigen, damit der Sünder nicht gewinne, nur benötigt es dessen deshalb nicht, damit sein Opfer nicht üppig sei. Das Sündopfer des Aussätzigen aber und dessen Schuldopfer benötigen wohl des Trankopfers, weil sie nicht wegen einer Sünde dargebracht werden. — Dem ist ja aber nicht so, R. Šemuél b. Naḥmani sagte ja im Namen R. Jonathans, daß wegen sieben Dingen$fn34&amp;c. der Aussatz komme!? — Die Sühne erfolgt durch den Aussatz, und das Opfer bringt er nur deshalb dar, damit ihm Heiliges erlaubt sei. — Demnach sollte doch das Sündopfer eines Nazirs des Trankopfers benötigen, da es nicht wegen einer Sünde dargebracht wird!? — Er ist der Ansicht des R. Elea͑zar ha Qappar, welcher sagt, der Nazir sei ebenfalls ein Sünder$fn35."
Sotah 15a:8,"R. G<small>AMLIÉL SAGTE</small>: W<small>IE &amp;C</small>. Es wird gelehrt: R. Gamliél sprach zu den Weisen: Gelehrte, laßt mich, ich will es wie eine Perle$fn36auslegen."
Sotah 15b:1,"Er hörte R. Meír folgendes sagen: Sie gab ihm alle Leckereien der Welt zu essen, daher soll ihr Opfer aus Viehfutter bestehen. Da sprach er zu ihm: Allerdings eine Reiche, wie ist es aber hinsichtlich einer Armen zu erklären!? Vielmehr, wie ihr Betragen dem eines Viehs gleicht, ebenso besteht auch ihr Opfer aus Viehfutter."
Sotah 15b:2,"<sup>ii</sup> <b>E</b><small>R HOLT EINEN IRDENEN</small> B<small>ECHER UND SCHÜTTET DARIN EIN HALBES</small> L<small>OG</small> W<small>ASSER AUS DEM</small> W<small>ASCHBECKEN;</small> R. J<small>EHUDA SAGT, EIN</small> V<small>IERTEL</small>[<small>LOG</small>]. W<small>IE ER HINSICHTLICH DES</small> S<small>CHRIFTSTÜCKES VERMINDERND</small>$fn37<small>IST, SO IST ER VERMINDERND AUCH HINSICHTLICH DES</small> W<small>ASSERS</small>. H<small>IERAUF TRITT ER IN DEN</small> T<small>EMPEL UND WENDET SICH NACH RECHTS; DA IST EINE EINE</small> E<small>LLE ZU EINER</small> E<small>LLE GROSSE</small> S<small>TELLE, AUF DER EINE</small> M<small>ARMORPLATTE SICH BEFINDET, IN DIE EIN</small> R<small>ING EINGELASSEN IST</small>. D<small>IESE HEBT ER HOCH, NIMMT ETWAS</small> E<small>RDE HERAUS UND TUT SOVIEL HINEIN, DASS SIE AUF DEM</small> W<small>ASSER ZU SEHEN IST, WIE ES HEISST</small>:$fn38<i>der Priester nehme von der Erde, die sich am Fußboden des Zeltes befindet, und tue es in das Wasser</i>."
