Index Title,Sotah
Sotah 41a:2,"U<small>ND LIEST VOR</small> [<small>DIE</small> A<small>BSCHNITTE</small>] ‘N<small>ACH DEM</small> T<small>ODE’ UND</small> ‘A<small>BER AM ZEHNTEN’</small>. Ich will auf einen Widerspruch hinweisen: Man darf in einem Propheten$fn344 [Abschnitte] überspringen, nicht aber darf man in der Tora überspringen!? Abajje erwiderte: Dies ist kein Widerspruch; das eine, daß der Dolmetsch unterbrechen muß, das andere, daß der Dolmetsch nicht zu unterbrechen braucht$fn345. – Hierzu wird ja aber gelehrt, man dürfe in einem Propheten überspringen, nicht aber dürfe man in der Tora überspringen, jedoch dürfe man nur soviel überspringen, daß der Dolmetsch nicht zu unterbrechen braucht. Demnach in der Tora überhaupt nicht!? Abajje erwiderte: Das ist kein Widerspruch; das eine gilt von einem Thema, und das andere gilt von zwei Themen. Es wird auch gelehrt: Man darf in der Tora bei einem Thema überspringen, in einem Propheten auch bei zwei Themen; in diesem und jenem nur so lange, als der Domletsch nicht zu unterbrechen braucht. Man darf nicht von einem Propheten zu einem anderen überspringen; bei den zwölf [kleinen] Propheten$fn346ist dies erlaubt, jedoch darf man nicht vom Ende des Buches zum Anfang$fn347springen."
Sotah 41a:3,"D<small>ARAUF ROLLT ER DIE</small> T<small>ORAROLLE ZUSAMMEN, NIMMT SIE AN SEINEN</small> B<small>USEN</small> &amp;<small>C</small>. Weshalb$fn348dies? – Um nicht die Torarolle in Verdacht zu bringen$fn349."
Sotah 41a:4,"[D<small>EN</small> A<small>BSCHNITT</small>] ‘A<small>M ZEHNTEN’ IM</small> B<small>UCHE</small> N<small>UMERI LIEST ER AUSWENDIG</small>. Er kann ja die Torarolle wiederum aufrollen und vorlesen!? R. Ḥona b. Jehuda erwiderte im Namen R. Šešeths: Man rolle die Tora nicht in Gegenwart der Gemeinde. – Er kann ja eine andere holen und aus dieser vorlesen!? R. Hona b. Jehuda erwiderte: Wegen der Bemakelung$fn350der ersten. R. Šimo͑n b. Laqiš erwiderte: Weil man keinen Segen unnötig$fn351 sprechen darf. – Berücksichtigen wir denn die Bemakelung, R. Jiçḥaq der Schmied sagte ja, daß, wenn der Neumond des Ṭebeth auf einen Šabbath fällt, man drei Torarollen hole und aus einer den laufenden Wochenabschnitt, aus einer [den Abschnitt] vom Neumonde und aus einer [den Abschnitt] vom Ḥanukafeste$fn352vorlese!? – Wenn drei Personen aus drei Torarollen [lesen], so ist dies keine Bemakelung, wenn aber eine Person aus zwei Torarollen [liest], so ist dies eine Bemakelung."
Sotah 41a:5,"U<small>ND SPRICHT DARÜBER ACHT</small> S<small>EGENSSPRÜCHE</small> &amp;<small>C</small>. Die Rabbanan lehrten: Über die Tora, wie man im Bethause spricht; über den Tempeldienst, Danksegen über die Sündenvergebung, wie gewöhnlich, für den Tempel besonders, für die Priester besonders, für Jisraél besonders und für Jerušalem besonders."
Sotah 41a:6,"D<small>AS ÜBRIGE</small> G<small>EBET</small>. Die Rabbanan lehrten: Das übrige Gebet, Flehen, Preisgesang und Fürbitte für das Volk Jisraél, das der Hilfe benötigt. Er schließt [mit dem Segen] ‘Der das Gebet erhört’. Von da ab liest jeder aus dem von ihm selbst aus seiner Wohnung mitgebrachten Torabuche. – Weshalb dies? – Um das Schaugepränge öffentlich zu zeigen."
Sotah 41a:7,"<sup>viii</sup> <b>W</b><small>IE DER</small> K<small>ÖNIGSABSCHNITT?</small> A<small>M</small> A<small>USGANGE DES ERSTEN</small> T<small>AGES DES</small> [H<small>ÜTTEN</small>]<small>FESTES</small>, [<small>BEI</small> B<small>EGINN DES</small>]<small> ACHTEN, AM</small> E<small>NDE DES SIEBENTEN, ERRICHTET MAN FÜR IHN IM</small> T<small>EMPELHOFE EINE</small> T<small>RIBÜNE AUS</small> H<small>OLZ, AUF DER ER</small> P<small>LATZ NIMMT, WIE ES HEISST:</small>$fn353<i>nach Ablauf von sieben Jahren, zur Zeit &amp;c</i>. D<small>ER</small> S<small>YNAGOGENDIENER NIMMT DIE</small> T<small>ORAROLLE UND REICHT SIE DEM</small> S<small>YNAGOGENVORSTEHER, DER</small> S<small>YNAGOGENVORSTEHER REICHT SIE DEM</small> P<small>RIESTERPRÄSES, DER</small> P<small>RIESTERPRÄSES REICHT SIE DEM</small> H<small>OCHPRIESTER UND DER</small> H<small>OCHPRIESTER REICHT SIE DEM</small> K<small>ÖNIGE; DER</small> K<small>ÖNIG STEHT DANN AUF, NIMMT SIE IN</small> E<small>MPFANG UND LIEST SITZEND VOR</small>. D<small>ER</small> K<small>ÖNIG</small> A<small>GRIPPA STAND AUF, NAHM SIE IN</small> E<small>MPFANG UND LAS STEHEND VOR, UND DIE</small> W<small>EISEN LOBTEN IHN DIESERHALB</small>. A<small>LS ER HERANREICHTE</small> [<small>ZUM</small> S<small>CHRIFTVERSE</small>:]$fn354<i>du darfst über dick keinen Fremdling [zum Könige] einsetzen</i>, <small>FOLSSEN</small> T<small>RÄNEN</small>$fn355 <small>AUS SEINEN</small> A<small>UGEN</small>. D<small>A SPRACHEN SIE ZU IHM</small>: S<small>EI GETROST</small>, A<small>GRIPPA, DU BIST UNSER</small> B<small>RUDER, DU BIST UNSER</small> B<small>RUDER</small>. E<small>R LIEST VOM</small> B<small>EGINNE DES</small> D<small>EUTERONOMIUMS BIS</small> [<small>ZUM</small> A<small>BSCHNITTE</small>]$fn356‘<i>Höre</i>’, [<small>DIE</small> A<small>BSCHNITTE</small>] ‘H<small>ÖRE</small>’,$fn357 ‘W<small>ENN DU HÖREN WIRST’</small>,$fn358‘D<small>EN</small> Z<small>EHNTEN SOLLST DU ENTRICHTEN</small>’,$fn359‘W<small>ENN DU BEENDET HAST DEN</small> Z<small>EHNTEN ZU ENTRICHTEN’, DEN</small> K<small>ÖNIGSABSCHNITT UND DIE</small> S<small>EGEN UND DIE</small> F<small>LÜCHE, UND BEENDET DEN GANZEN</small> A<small>BSCHNITT</small>. D<small>IE</small> S<small>EGENSSPRÜCHE, DIE DER</small> H<small>OCHPRIESTER SPRICHT, SPRICHT AUCH DER</small> K<small>ÖNIG, NUR ERWÄHNT ER DES</small> F<small>ESTES ANSTATT DER</small> S<small>ÜNDENVERGEBUNG</small>$fn360."
Sotah 41a:8,"GEMARA. Wieso des achten$fn361!? Lies des achten [Jahres]$fn362. – Wozu dies$fn363alles? – Dies ist nötig. Würde der Allbarmherzige nur <i>nach Ablauf</i> geschrieben haben, so könnte man glauben, die Zählung sollte dann$fn364beginnen, selbst wenn es kein Erlaßjahr ist, daher heißt es <i>Erlaßjahr</i>. Würde der Allbarmherzige nur <i>Erlaßjahr</i> geschrieben haben, so könnte man glauben, am Ende des Erlaßjahres$fn365, daher heißt es <i>zur</i>$fn366<i>Zeit</i>. Würde er nur <i>zur Zeit</i> geschrieben haben, so könnte man glauben, am Beginnen$fn367des Jahres, daher heißt es <i>am Hüttenfeste</i>. Und würde der Allbarmherzige nur <i>am Hüttenfeste</i> geschrieben haben, so könnte man glauben, auch am letzten Tage des Festes, daher heißt es: $fn368<i>wenn ganz Jisraél kommt</i>, am Beginne des Festes."
Sotah 41b:1,
Sotah 41b:2,"D<small>ER</small> S<small>YNAGOGENDIENER NIMMT DIE</small> T<small>ORAROLLE UND REICHT SIE DEM</small> S<small>YNAGOGENVORSTEHER</small>. Hieraus$fn369wäre zu entnehmen, daß man einem Schüler in Gegenwart seines Lehrers Ehrung erweisen dürfe? Abajje erwiderte: Alles erfolgt zur Ehrung des Königs."
Sotah 41b:3,"D<small>ER</small> K<small>ÖNIG STEHT DANN AUF, NIMMT SIE IN</small> E<small>MPFANG UND LIEST SITZEND VOR</small>. D<small>ER</small> K<small>ÖNIG</small> A<small>GRIPPA STAND AUF, NAHM SIE IN</small> E<small>MPFANG UND LAS STEHEND VOR</small>. Wenn er auf steht, so sitzt er ja wahrscheinlich, und dem widersprechend sagte ja der Meister, daß nur den Königen aus dem Davidischen Hause das Sitzen im Tempelhofe erlaubt war!? So heißt es: $fn341<i>da kam der König David, setzte sich vor den Herrn und sprach &amp;c</i>. Wie R. Ḥisda erklärt hat: im Frauenvorhofe, ebenso auch hierbei im Frauenvorhofe."
Sotah 41b:4,"D<small>IE</small> W<small>EISEN LOBTEN IHN</small>. Wenn sie ihn lobten, so hat er ja wahrscheinlich recht getan, und dem widersprechend sagte ja R. Aši, daß selbst nach demjenigen, welcher sagt, daß, wenn ein Fürst auf seine Ehrung verzichtet, der Verzicht gültig sei, der Verzicht eines Königs auf seine Ehrung ungültig sei, denn es heißt :$fn370<i>du sollst über dich einen König setzen</i>, daß du Ehrfurcht vor ihm hast!? – Anders verhält es sich bei einem Gebote."
Sotah 41b:5,"A<small>LS ER HERANREICHTE</small> [<small>ZUM</small> S<small>CHRIFTVERSE</small>:] <i>du darfst nicht einsetzen &amp;c</i>. Im Namen R. Nathans wird gelehrt: In jener Stunde hatten sich die Feinde Jisraéls$fn371der Vernichtung schuldig gemacht, weil sie Agrippa schmeichelten."
Sotah 41b:6,"R. Šimo͑n b. Ḥalaphta sagte: Seit dem Tage, wo die Faust der Schmeichelei an Macht gewann, ist das Recht verdreht und sind die Werke verderbt worden; keiner kann zum anderen sagen: meine Werke sind besser als deine."
Sotah 41b:7,"R. Jehuda aus dem Westen, nach anderen R. Šimo ͑n b. Pazi, trug vor: Es ist erlaubt, den Frevlern auf dieser Welt zu schmeicheln, denn es heißt:$fn372<i>nicht soll mehr der Ruchlose edel genannt werden, noch der Geizige vornehm heißen</i>; demnach ist dies auf dieser Welt erlaubt. R. Šimo͑n b. Laqiš entnimmt dies hieraus :$fn373<i>[Ja͑qob sprach &amp;c.]: wie man das Antlitz Gottes schaut, und da warst zu mir gütig</i>. Er streitet somit gegen R. Levi, denn R. Levi sagte: Das Ereignis von Ja͑qob und E͑sav ist mit folgendem zu vergleichen. Einst lud jemand seinen Nächsten zu einer Mahlzeit, und als dieser merkte, daß jener ihn umbringen wolle, sprach er: Dieses Gericht schmeckt wie das Gericht, das ich im Hause des Königs gegessen habe. Hieraus folgerte jener, daß der König ihn kenne, und fürchtete sich, ihn zu töten$fn374."
Sotah 41b:8,"R. Elea͑zar sagte: Ein Mensch, dem Schmeichelei innewohnt, bringt Zorn über die Welt, denn es heißt:$fn375<i>die schmeichlerischen Herzens sind, bringen Zorn</i>. Und noch mehr, auch sein Gebet wird nicht erhört, denn es heißt :$fn375<i>sie flehen nicht, wenn er sie züchtigt</i>."
Sotah 41b:9,"Ferner sagte R. Elea͑zar: Einen Menschen, dem Schmeichelei innewohnt, verfluchen sogar Kinder im Leibe ihrer Mutter, denn es heißt:$fn376<i>wer zum Frevler spricht: du bist gerecht, den verfluchen [jiqbuhu] Völker, verwünschen Nationen [leúmim]. Qob bedeutet fluchen, wie es heißt:</i>$fn377<i>wenn Gott nicht flucht [qaba], und leóm bedeutet Geburt, wie es heißt :$fn378</i>und <i>ein Volksstamm [leóm]</i>$fn379<i>wird dem anderen überlegen sein</i>."
Sotah 41b:10,"<i>Ferner sagte R. Elea͑zar: Ein Mensch, dem Schmeichelei innewohnt, stürzt ins Fegefeuer, denn es heißt</i> :$fn380<i>wehe denen, die das Böse gut und das Gute bös nennen &amp;c., und hierauf folgt</i> :$fn381<i>daher wird, wie die Feuerzunge Stoppeln frißt und Heu vor der Flamme zusammensinkt</i> &amp;c."
Sotah 41b:11,"Ferner sagte R. Elea͑zar: Wer seinem Nächsten schmeichelt, fällt zuletzt in seine Hand, und wenn er nicht in seine Hand fällt, so fällt er in die Hand seiner Kinder, und wenn er nicht in die Hand seiner Kinder fällt, so fällt er in die Hand der Kinder seiner Kinder, denn es heißt: $fn382<i>da sprach Jirmejahu</i>$fn383<i>zu Ḥananja: Amen, also tue der Herr; bestätigen</i>"
Sotah 42a:1,"<i>möge der Herr deine Worte</i>. Hierauf folgt:$fn384<i>und als er an das Binjamintor kam, da ergriff der Aufseher der Wachen, namens Jiríja</i>, Sohn <i>Šelemjas, Sohn Ḥananjas, den Propheten Jirmejahu mit den Worten: du läufst zu den Kasdäern über. Jirmejahu aber sprach: Lüge, ich laufe nicht zu den Kasdäern über</i> &amp;c. <i>Und hierauf folgt: da ergriff Jiríja den J irmejahu und brachte ihn vor die Fürsten</i>."
Sotah 42a:2,"Ferner sagte R. Elea͑zar: Eine Gemeinde, in der Schmeichelei zu finden ist, ist wie eine Menstruierende widerwärtig, denn es heißt :$fn385<i>denn eine schmeichlerische Gemeinde ist gemieden [galmud]</i>, und in den überseeischen Ländern wird die Menstruierende Galmuda genannt. – Was heißt Galmuda? – Von ihrem Manne entwöhnt$fn386."
Sotah 42a:3,"Ferner sagte R. Elea͑zar: Eine Gemeinde, in der Schmeichelei zu finden ist, gerät zuletzt in die Verbannung, denn hier heißt es: <i>denn eine schmeichlerische Gemeinde ist gemieden</i>, und dort$fn387heißt es: <i>du wirst in deinem Herzen sprechen: wer hat mir diese geboren, ich bin kinderlos und gemieden, verbannt und verstoßen &amp;c</i>."
Sotah 42a:4,"R. Jirmeja b. Abba sagte: Vier Menschenklassen werden von der Göttlichkeit nicht empfangen: die der Spötter, die der Schmeichler, die der Lügner und die der Verleumder. Die der Spötter, denn es heißt :$fn388<i>er zieht seine Hand von den Spöttern</i>. Die der Schmeichler, denn es heißt: $fn389<i>vor sein Angesicht kommt kein Schmeichler</i>. Die der Lügner, denn es heißt:$fn390<i>wer Lügen redet, soll vor meinen Augen nicht bestehen</i>. Die der Verleumder, denn es heißt :$fn391<i>denn du bist nicht ein Gott, der an Frevel Wohlgefallen findet; Böses darf nicht bei dir weilen</i>. Du bist gerecht, o Herr, nicht darf in deiner Wohnung das Böse weilen."
Sotah 42a:5,"<b>W</b>ENN <small>DER</small> F<small>ELDPRIESTER ZUM</small> V<small>OLKE REDET, SO REDET ER IN DER</small> H<small>EILIGENSPRACHE, DENN ES HEISST</small> : $fn1<i>wenn ihr zum Kampfe hintretet, so trete der Priester vor</i>, <small>DAS IST DER</small> F<small>ELDPRIESTER;</small> <i>und rede zum Volke</i>, <small>IN DER</small> H<small>EILIGENSPRACHE</small>. $fn2<i>Er spreche zu ihnen: Höre, Jisraél &amp;c. gegen eure Feinde;</i> <small>NICHT ETWA GEGEN EURE</small> B<small>RÜDER</small>. N<small>ICHT</small> J<small>EHUDA GEGEN ŠIMO͑N ODER ŠIMO͑N GEGEN</small> B<small>INJAMIN, DIE, WENN EINER IN DIE</small> H<small>ÄNDE DES ANDEREN FÄLLT</small>$fn3, <small>MIT EINANDER</small> E<small>RBARMEN HABEN, WIE ES HEISST</small> :$fn4<i>da erhoben sich die namentlich genannten Männer und nahmen sich der Gefangenen an und kleideten all die Nackten unter ihnen aus der Beute; sie bekleideten sie, beschuhten sie, speisten sie, tränkten sie, salbten sie und brachten sie, die Matten auf Eseln, nach Jeriḥo, der Palmenstadt, zu ihren Brüdern, und kehrten nach Šomron zurück</i> &amp;c. I<small>HR ZIEHT GEGEN EURE</small> F<small>EINDE, UND WENN IHR IN IHRE</small> H<small>ÄNDE FALLET, HABEN SIE KEIN</small> E<small>RBARMEN MIT EUCH</small>. $fn2<i>Es werde euer Herz nicht zag, fürchtet euch nicht, seid nicht bestürzt &amp;c. Es werde euer Herz nicht zag</i>, <small>VOR DEM</small> G<small>EWIEHER DER</small> R<small>OSSE UND DEM</small> B<small>LINKEN DER</small> S<small>CHWERTER;</small> <i>fürchtet euch nicht</i>, <small>VOR DEM</small> G<small>ERASSEL DER</small> S<small>CHILDE UND DEM</small> H<small>ERANSTRÖMEN DER</small> K<small>RIEGER;</small> <i>seid nicht bestürzt</i>, <small>VOR DEM</small> S<small>CHALL DER</small> B<small>LASHÖRNER;</small> <i>zittert nicht</i>, <small>VOR DER</small> S<small>TIMME DES</small> G<small>ELÄRMS</small>. $fn5<i>Denn es ist der Herr, euer Gott, der mit euch zieht;</i> <small>SIE KOMMEN</small> [<small>GESTÜTZT</small>]<small> AUF DEN</small> S<small>IEG EINES</small> [M<small>ENSCEHN AUS</small>] F<small>LEISCH UND</small> B<small>LUT, IHR ABER KOMMT</small> [<small>GESTÜTZT</small>]<small> AUF DEN</small> S<small>IEG</small> G<small>OTTES</small>. D<small>IE</small> P<small>ELIŠTIM KAMEN</small> [<small>GESTÜTZT</small>]<small> AUF DEN SIEG GOLIATHS, UND DAS ENDE WAR, DASS ER DURCH DAS SCHWERT FIEL UND SIE MIT IHM FIELEN. DIE A͑MMONITER KAMEN</small> [<small>GESTÜTZT</small>]<small> AUF DEN</small> S<small>IEG</small> Š<small>OBAKHS, UND DAS</small> E<small>NDE WAR, DASS ER DURCH DAS</small> S<small>CHWERT FIEL UND SIE MIT IHM FIELEN; NICHT SO ABER IHR</small>. <i>Denn es ist der Herr, euer Gott, der mit euch zieht, um für euch zu streiten &amp;c</i>., <small>DAS IST DIE</small> A<small>BTEILUNG DER</small> B<small>UNDESLADE</small>."
Sotah 42a:6,"GEMARA. Wie ist dies zu verstehen$fn6? – Dies ist wie folgt zu verstehen; es heißt: <i>und rede</i>, und dort$fn7 heißt es: <i>Moše redete und Gott antwortete ihm mit der Stimme;</i> wie dort in der Heiligensprache, ebenso hierbei in der Heiligensprache."
Sotah 42a:7,"Die Rabbanan lehrten: <i>So trete der Priester vor und rede zum Volke;</i> man könnte glauben, jeder beliebige Priester, so heißt es :$fn8<i>die Beamten sollen reden;</i> wie die Beamten ernannt sind, ebenso auch ein Priester, der ernannt ist. – Vielleicht der Hochpriester!? – Gleich dem Beamten, wie der Beamte einen Vorgesetzten$fn9 über sich hat, ebenso auch ein Priester, der einen Vorgesetzten über sich hat. – Auch der Hochpriester hat ja den König über sich!? – Er spricht von seinem Dienste$fn10. – Vielleicht der Priesterpräses$fn11!? – Der Priesterpräses ist kein Beamter. Es wird nämlich gelehrt: R. Ḥanina der Priesterpräses sagte: Der Priesterpräses ist dazu da, damit, wenn der Hochpriester von einer Untauglichkeit betroffen wird, er an seinerstatt eintrete und den Dienst verrichte."
Sotah 42a:8,"<i>Er spreche zu ihnen: Höre, Jisraél. Weshalb gerade: höre, Jisraél?</i> R. Joḥanan erwiderte im Namen des R. Šimo͑n b. Joḥaj: Der Heilige, gepriesen sei er, sprach zu Jisraél: selbst wenn ihr nur das Lesen [des Abschnittes] ‘Höre, Jisraél’ morgens und abends beobachtet, werdet ihr nicht in ihre Hände ausgeliefert."
Sotah 42a:9,"<i>Es werde euer Herz nicht zag, fürchtet euch nicht &amp;c</i>. Die Rabbanan lehrten: Zweimal hält er an sie eine Ansprache, einmal an der Grenze und einmal auf dem Kriegsplatze. An der Grenze spricht er folgendes: Höret meine Worte von der Kriegsordnung und kehret$fn12um. Auf dem"
Sotah 42b:1,"Kriegsplatze spricht er also: <i>Es werde euer Herz nicht zag, fürchtet euch nicht, seid nicht bestürzt und zittert nicht</i>. Entsprechend den vier Verfahren, die die weltlichen Völker$fn13anwenden: sie rasseln, stoßen in die Trompeten, lärmen und traben$fn14."
Sotah 42b:2,"D<small>IE</small> P<small>ELIŠTIM KAMEN</small> [<small>GESTÜTZT</small>]<small> AUF DEN SIEG GOLIATHS</small> &amp;<small>C</small>. [Er hieß] Goljath, wie R. Joḥanan erklärte, weil er mit frechem Gesicht [giluj] vor Gott gestanden hat, denn es heißt :$fn15<i>wählet unter euch einen Mann, der zu mir herabkomme</i>, und unter Mann ist der Heilige, gepriesen sei er, zu verstehen, wie es heißt :$fn16<i>der Herr ist ein Mann des Krieges</i>. Der Heilige, gepriesen sei er, sprach: ich lasse ihn fallen durch die Hand des Sohnes eines Mannes, wie es heißt:$fn17<i>David war der Sohn eines Mannes aus Ephrath</i>."
Sotah 42b:3,"R. Joḥanan sagte im Namen R. Meírs: An drei Stellen verfing$fn18sich dieser Frevler durch seinen eigenen Mund; einmal: <i>wählet unter euch einen Mann, der zu mir herabkomme</i>, ferner:$fn19<i>wenn er mit mir zu kämpfen vermag und mich erschlägt</i> &amp;c.,<i> und wiederum, als er zu David sprach</i>:$fn20<i>bin ich denn ein Hund, daß du zu mir mit Stöcken lcommst!? – David sagte ja zu ihm ebenfalls</i>:$fn21<i>du kommst zu mir mit Schwert, Speer und Spieß</i>!?<i> – Hierauf aber sprach er zu ihm:<sup>21</sup></i>Ich <i>aber komm zu dir im Namen des Herrn der Heerscharen, des Gottes der Schlachtreihen Jisraéls, den du beschimpft hast</i>."
Sotah 42b:4,$fn22<i>Und der Pelešti trat morgens und abends vor</i>. R. Joḥanan sagte: Um sie beim Šema͑lesen morgens und abends zu stören.
Sotah 42b:5,"$fn22<i>Und er stellte sich vierzig Tage hin</i>. R. Johanan sagte: Entsprechend den vierzig Tagen, an denen die Tora verliehen worden$fn23ist."
Sotah 42b:6,$fn24<i>Da trat aus den Lagern der Pelištim ein Mittelsmann hervor</i>.<i> Was</i> heißt Mittelsmann? Rabh erklärte: Der frei war von jedem Leibesfehler$fn25. Šemué1 erklärte: Ein mittelmäßiger unter seinen Brüdern. In der Schule R. Šilas erklärten sie: Er war wie ein Bauwerk$fn25gebaut. R. Joḥanan erklärte: Ein Sohn von hundert Vätern und einer Mutter$fn26.
Sotah 42b:7,$fn24<i>Mit Namen Goljath aus Gath</i>. R. Joseph lehrte: Alle droschen seine Mutter wie eine Kelter [galh].
Sotah 42b:8,Es heißt :$fn27<i>maa͑roth</i> und wir lesen <i>maa͑rkhoth</i> [Kriegsreihen]? R. Joseph lehrte: Alle haben bei seiner Mutter die Geschlechtsorgane angeschlossen [hee͑ru].
Sotah 42b:9,"Es heißt <i>Harapha</i> und es heißt O͑rpa$fn28? Rabh und Šemuél [streiten hierüber]; einer sagt, sie hieß Harapha und wird deshalb O͑ rpa genannt, weil alle sie von hinten beschliefen$fn29, und einer sagt, sie hieß O͑rpa und wird deshalb Harapha genannt, weil alle sie wie Graupen [hariphoth] stampften. So heißt es auch :$fn30<i>da nahm das Weib eine Decke und breitete sie über den Brunnen und streute Graupen [hariphoth] darauf</i>. Wenn du willst, entnehme ich es aus folgendem :$fn31w<i>enn du einen Narren auch unter den Graupen [hariphoth] in einem Mörser mit einer Keule stampfst</i>."
Sotah 42b:10,"$fn32<i>Diese vier wurden Harapha in Gath geboren und sie fielen durch die Hand Davids und seiner Knappen. Wer waren diese? R. Ḥisda erwiderte: Saph, Madon, Goljath und Jišbi Benobh$fn33</i>."
Sotah 42b:11,"<i>Und sie fielen durch die Hand Davids und seiner Knappen, ferner</i> heißt es :$fn34<i>da küßte O͑rpa ihre Schwiegermutter, Ruth aber schloß sich ihr an</i>. R. Jiçḥaq sagte: Der Heilige, gepriesen sei er, sprach: Mögen die Kinder der Küssenden kommen und durch die Hände der Sichanschließenden fallen."
Sotah 42b:12,"Raba trug vor: Ais Belohnung für die vier Tränen, die O͑rpa über ihre Schwiegermutter fließen ließ, ward es ihr beschieden, daß vier Helden aus ihr hervorgingen, denn es heißt :$fn34<i>sie erhoben ihre Stimme und weinten sehr</i>."
Sotah 42b:13,"Es heißt:$fn35<i>Der ḥeç [Pfeil] seines Speeres</i>, und wir lesen: <i>e͑ç [der Schaft] seines Speeres</i>? R. Elea͑zar erklärte: Wir sind noch nicht zur Hälfte [ḥaçi] des Lobes jenes Frevlers herangereicht. Hieraus, daß man das Lob der Frevler nicht erzählen dürfe. – Sollte er damit überhaupt nicht begonnen haben!? – Um das Lob Davids hervorzuheben$fn36."
Sotah 42b:14,"D<small>IE</small> A͑<small>MMONITER KAMEN</small> [<small>GESTÜTZT</small>]<small> AUF DEN</small> S<small>IEG</small> Š<small>OBAKHS</small> &amp;<small>C</small>. Er heißt Šobakh und er heißt Šophakh$fn37? Rabh und Šemuél [streiten hierüber]; einer sagt, sein Name war Šophakh, und er wird nur deshalb Šobakh genannt, weil er wie ein Taubenschlag [šobakh] war, und einer sagt, sein Name war Šobakh, und er wird deshalb Šophakh genannt, weil jeder, der ihn sah, vor ihm wie ein Wasserkrug zerfloß [šaphakh]."
Sotah 42b:15,"$fn38<i>Sein Köcher gleich einem offenen Grabe, lauter Helden sind sie</i>. Rabh und Šemuél, manche sagen, R. Ami und R. Asi, [streiten hierüber]; einer sagt, wenn sie einen Pfeil abschossen, machten sie ganze Haufen$fn39 von Erschlagenen, und wenn man glauben wollte, daß sie im Kriege nur kunstfertig waren, so heißt es: <i>lauter Helden sind sie</i>, und einer erklärt, wenn sie ihre Notdurft verrichteten, warfen sie ganze Haufen Kot, und wenn man glauben wollte, weil sie darmkrank waren, so heißt es: <i>lauter Helden sind sie</i>. R. Mari sagte: Hieraus ist zu entnehmen, daß, wenn jemand viel Kot entleert, er darmkrank sei. – In welcher Hinsicht ist dies von Bedeutung? – Daß er etwas dagegen tue."
Sotah 42b:16,"$fn40<i>Ist Kummer im Herzen eines Menschen, so drücke er ihn nieder</i>. R. Ami und R. Asi [streiten hierüber]; einer erklärt, man schlage ihn aus dem Sinne, und einer erklärt, man erzähle ihn anderen$fn41."
Sotah 42b:17,N<small>ICHT SO ABER IHR</small> &amp;<small>C</small>. Weshalb dies alles? – Weil der Gottesname mit all seinen Attributen sich in der Lade$fn42befandern. So heißt es auch:
Sotah 43a:1,"$fn43<i>Moše sandte sie, je tausend vom Stamme zum Heere; sie und Pinḥas. Sie</i>, das sind [die Mitglieder des] Synedriums; <i>Pinḥas</i>, das ist der Feldpriester; <i>die heiligen Geräte</i>, das sind die Bundeslade und die darin befindlichen Tafeln; <i>und die Lärmtrompeten</i>, das sind die Blashömer. Es wird gelehrt: Nicht umsonst zog Pinḥas in den Krieg, sondern um das dem Vater seiner Mutter widerfahrene Unrecht zu rächen, denn es heißt: $fn44<i>und die Midjanim verkauften ihn an die Miçrijim &amp;c</i>. – Demnach stammt Pinḥas von Joseph ab, und [dem widersprechend] heißt es:$fn45<i>und Elea͑zar, der Sohn Ahrons, nahm eine von den Töchtern Puṭiéls zum Weibe</i>; wahrscheinlich stammt er von Jithro ab, der Kälber für den Götzendienst mästete [piṭem]!? – Nein, von Joseph, der seinen bösen Trieb bekämpfte [piṭpeṭ]. – Aber die übrigen Stämme beschimpften ihn ja: selit diesen Puṭi-Solm, dessen Großvater mütterlicherseits Kälber für die Götzen gemästet hat, er hat einen Fürsten$fn46in Jisraél getötet!? – Vielmehr, stammte der Vater seiner Mutter von Joseph, so stammte die Mutter seiner Mutter von Jithro, und stammte die Mutter seiner Mutter von Joseph, so stammte der Vater seiner Mutter von Jithro. Dies ist auch zu beweisen, denn es heißt: <i>von den Töchtern Puṭiéls</i>, wonach es zwei$fn47waren: Schließe hieraus."
