Index Title,Temurah
Temurah 24a:3,"R. Šimi b. Zee͑ri lehrte vor R. Papa: War es nach der Absonderung abhanden gekommen, so ist es nach Rabbi verenden zu lassen und nach den Rabbanan weiden zu lassen. War es nach der Sühne abhanden gekommen, so ist es nach den Rabbanan verenden zu lassen und nach Rabbi weiden zu lassen. – Dies ist ja paradox: wenn Rabbi vom bei der Absonderung abhandengekommenen, hinsichtlich dessen die Rabbanan sagen, es sei weiden zu lassen, sagt, es sei verenden zu lassen, um wieviel mehr sollte dies nach Rabbi vom bei der Sühne abhandengekommenen gelten, das auch nach den Rabbanan verenden zu lassen ist!? – Lies vielmehr wie folgt: war es bei der Absonderung abhanden gekommen, so ist es nach Rabbi verenden zu lassen und nach den Rabbanan weiden zu lassen, und wenn bei der Sühne, so ist es nach aller Ansicht verenden zu lassen."
Temurah 24a:4,"R. E<small>LEA͑ZAR B</small>. R. Š<small>IMO͑N SAGTE &amp;C</small>. Die Rabbanan lehrten: Man darf am Feiertage die Haut nicht von den Füßen aus$fn37abziehen; desgleichen darf man beim Erstgeborenen die Haut nicht von den Füßen aus abziehen und nicht beim untauglich gewordenen Opfertiere. Allerdings am Feiertage, weil dies eine Mühe ist, die dann nicht nötig ist, wer aber lehrte dies vom Erstgeborenen? R. Ḥisda erwiderte: Es ist die Schule Šammajs, welche sagt, das Erstgeborene verbleibe bei seiner Heiligkeit. Wir haben nämlich gelernt: Die Schule Šammajs sagt, ein Jisraélit dürfe sich nicht mit einem Priester am Erstgeborenen beteiligen. – Wer lehrte dies vom untauglich gewordenen Opfertiere? R. Ḥisda erwiderte: Es ist R. Elea͑zar b. R. Šimo͑n, denn es wird gelehrt: Wenn er vor sich zwei Sündopfer$fn38hat, eines fehlerfrei und eines fehlerbehaftet, so ist das fehlerfreie darzubringen und das fehlerbehaftete auszulösen; ist das fehlerbehaftete geschlachtet$fn39worden, bevor das Blut des fehlerfreien gesprengt worden ist, so ist es erlaubt, und wenn nachdem das Blut des fehlerfreien gesprengt worden ist, so ist es verboten. R. Elea͑zar b. R. Šimo͑n sagt, selbst wenn das Fleisch des fehlerbehafteten sich bereits im Topfe befindet, das Blut des fehlerfreien aber gesprengt worden ist, komme es in den Verbrennungsraum. – Sollte doch R. Ḥisda dieses und jenes der Schule Šammajs addizieren!? – Die Schule Šammajs sagt dies vielleicht nur vom Erstgeborenen, das vom Mutterleibe aus heilig ist, nicht aber von den untauglich gewordenen Opfertieren. – Sollte er doch dieses und jenes R. Elea͑zar b. R. Šimo͑n addizieren!? – R. Elea͑zar b. R. Šimo͑n sagt dies vielleicht nur von den untauglich gewordenen Opfertieren, [deren Heiligkeit] so stark ist, die Lösung zu erfassen, nicht aber vom Erstgeborenen. – Hält denn R. Elea͑zar b. R. Šimo͑n nichts von der Lehre, daß alle untauglich gewordenen Opfertiere im Scharren geschlachtet, im Scharren verkauft und nach Litra$fn40ausgewogen werden dürfen, weil er, wenn dies erlaubt ist, mehr zahlt$fn41und es kauft!? R. Mari, Sohn des R. Kahana, erwiderte: Was an der Haut gewonnen wird, geht am Fleische$fn42verloren. Im Westen sagten sie im Namen R. Abins: Weil es den Anschein hat, als verrichte man [Profan]arbeit mit Opfertieren. R. Jose b. R. Abin erklärte: Aus Rücksicht darauf, man könnte aus solchen ganze Herden züchten$fn43."
Temurah 24a:5,<sup>i</sup> <b>A</b>UF <small>WELCHE</small> W<small>EISE KANN MAN BEIM</small> E<small>RSTGEBORENEN EINE</small> L<small>IST</small>$fn1 <small>ANWENDEN</small>?
Temurah 24b:1,"W<small>ENN EIN</small> E<small>RSTGEBÄRENDES TRÄCHTIG IST, SAGE MAN: WAS IM</small> L<small>EIBE DIESER, SEI, WENN ES EIN</small> M<small>ÄNNCHEN IST, EIN</small> B<small>RANDOPFER; WIRFT ES EIN</small> M<small>ÄNNCHEN, SO IST ES ALS</small> B<small>RANDOPFER DARZUBRINGEN</small>; [<small>SAGTE ER</small>:] <small>WENN EIN</small> W<small>EIBCHEN, SEI ES EIN</small> H<small>EILSOPFER, SO IST, WENN ES EIN</small> W<small>EIBCHEN WIRFT, ES ALS</small> H<small>EILSOPFER DARZUBRINGEN</small>. [S<small>AGTE ER</small>:] <small>WENN EIN</small> M<small>ÄNNCHEN, SEI ES EIN</small> B<small>RANDOPFER, UND WENN EIN</small> W<small>EIBCHEN, SEI ES EIN</small> H<small>EILSOPFER, SO IST, WENN ES EIN</small> M<small>ÄNNCHEN UND EIN</small> W<small>EIBCHEN WIRFT, DAS</small> M<small>ÄNNCHEN ALS</small> B<small>RANDOPFER UND DAS</small> W<small>EIBCHEN ALS</small> H<small>EILSOPFER DARZUBRINGEN</small>. <sup>ii</sup> W<small>IRFT ES ZWEI</small> M<small>ÄNNCHEN, SO IST EINES ALS</small> B<small>RANDOPFER DARZUBRINGEIS UND DAS ANDERE AN</small> B<small>RANDOPFERPFLICHTIGE ZU VERKAUFEN, UND DER</small> E<small>RLÖS IST PROFAN</small>. W<small>IRFT ES ZWEI</small> W<small>EIBCHEN, SO IST DAS EINE VON IHNEN ALS</small> H<small>EILSOPFER DARZUBRINGEN UND DAS ANDERE AN</small> H<small>EILSOPFERPFLICHTIGE ZU VERKAUFEN, UND DER</small> E<small>RLÖS IST PROFAN</small>. W<small>IRFT ES EIN</small> G<small>ESCHLECHTSLOSES ODER EINEN</small> Z<small>WITTER, SO WERDEN SIE WIE</small> R. Š<small>IMO͑N B</small>. G<small>AMLIÉL SAGT, VON DER</small> H<small>EILIGKEIT NICHT ERFASST</small>."
Temurah 24b:2,"GEMARA. R. Jehuda sagte: Man darf einem Erstgeborenen, bevor es zur Welt kommt, einen Leibesfehler beibringen. – Wir haben gelernt: sage man: was im Leibe dieser, sei ein Brandopfer. Nur ein Brandopfer$fn2, nicht aber ein Heilsopfer, und du sagst, man könne es der Heiligkeit entziehen!? – R. Jehuda kann dir erwidern: dies nur zu einer Zeit, wenn der Tempel besteht, ich aber spreche von der Jetztzeit, wo es zur Darbringung nicht verwendbar ist. – Wozu braucht er, wenn von der Jetztzeit, dies zu lehren!? – Man könnte glauben, es sei zu berücksichtigen, man könnte ihm einen Leibesfehler beibringen, nachdem es schon den größeren Teil des Kopfes her vorgestreckt hat. – Vielleicht ist dem auch so!? –Immerhin ist es besser, ihm einen Leibesfehler beizubringen, als daß man dazu komme, es zur Schur und zur Arbeit zu verwenden."
Temurah 24b:3,"W<small>ENN EIN</small> W<small>EIBCHEN, SEI ES</small> H<small>EILSOPFER</small>. Ist denn ein Weibchen durch die Erstgeburt heilig!? – Der Schlußsatz bezieht sich auf ein Opfertier$fn3."
Temurah 24b:4,"W<small>IRFT ES ZWEI</small> M<small>ÄNNCHEN &amp;C</small>. Ich will dir sagen: wenn es ein Opfertier ist, sollte doch das als Brandopfer geheiligte Brandopfer sein und das andere bei der Heiligkeit der Mutter verbleiben!? – Der Schlußsalz bezieht sich auf ein profanes Vieh."
Temurah 24b:5,
Temurah 25a:1,"W<small>IRFT ES EIN</small> G<small>ESCHLECHTSLOSES ODER EINEN</small> Z<small>WITTER &amp;C</small>. Weshalb werden sie nicht von der Heiligkeit erfaßt? – R. Šimo͑n b. Gamliél ist der Ansicht, die Jungen der Opfertiere werden erst bei ihrem Sein$fn4 heilig, denn wieso werden sie, wenn man sagen wollte, sie seien schon im Leibe ihrer Mutter heilig, von der Heiligkeit nicht erfaßt, schon die Heiligkeit ihrer Mutter hat sie ja erfaßt. Vielmehr ist hieraus zu entnehmen, daß die Jungen der Opfcrliere erst bei ihrem Sein heilig werden. – Der folgende Autor aber ist der Ansicht, die Jungen der Opfertiere seien schon im Leibe ihrer Mutter heilig. Die Rabbanan lehrten nämlich: Würde es nur geheißen haben: $fn5<i>Erstgeborene nicht heiligen</i>, so würde ich gesagt haben, ein Erstgeborener [Mann] dürfe nichts dem Heiligtume weihen, so heißt es:$fn5<i>es ein Mann</i>, du darfst es nicht heiligen, wohl aber darf ein erstgeborener Mann heiligen. Aber immerhin könnte ich sagen, er$fn6 könne es nicht heiligen, wohl aber können andere es heiligen, so heißt es: $fn5<i>unter dem Vieh</i>, ich befasse mich mit dem Vieh$fn7. Man könnte glauben, man könne es auch nicht im Mutterleibe heiligen, so heißt es: $fn5<i>das durch die Erstgeburt des Herrn ist</i>, sobald es durch die Erstgeburt des Herrn ist, kannst du es nicht mehr heiligen, wohl aber kannst du es im Mutterleibe heiligen. Man könnte glauben, dasselbe gelte auch von den Geburten aller Opfertiere, so heißt es$fn5 <i>nur</i>, teilend. Er ist somit der Ansicht, die Jungen von Opfertieren seien schon im Mutterleibe heilig."
Temurah 25a:2,"R. A͑mram sprach zu R. Šešeth: Wie ist es, wenn man vom Erstgeborenen gesagt hat: es sei mit dem Hervorkommen der größeren Hälfte ein Brandopfer; ist es ein Brandopfer oder ist es Erstgeborenes? Ist es ein Brandopfer, denn jedes Bißchen, das hervorkommt, ist Ganzopfer$fn8, oder ist es Erstgeborenes, denn jedes Bißchen, das hervorkommt, bleibt bei seinem Wesen? Eine andere Lesart. [Ist es ein Brandopfer,] denn es wird von der Heiligkeit erfaßt, oder ist es Erstgeborenes, denn diese Heiligkeit beginnt schon im Mutterleibe? Dieser erwiderte: Was ist dir da fraglich, das ist ja das, was Ilpha gefragt hat: Wie ist es, wenn jemand von der Nachlese gesagt hat: es sei beim Herabfallen des größeren Teiles Freigut$fn9; ist es Nachlese oder Freigut? Ist es Nachlese, da es bereits durch den Himmel heilig$fn10ist, oder ist es Freigut, da Arme und Reiche$fn11es sich aneignen können? Und hierzu sagte Abajje: Was ist dir da fraglich: wem hat man von Meister und Schüler zu gehorchen$fn12? Ebenso hierbei: wem hat man zu gehorchen."
Temurah 25a:3,"<sup>iii</sup> <b>W</b><small>ENN JEMAND GESAGT HAT: DAS</small> J<small>UNGE VON DIESEM</small> [V<small>IEH</small>] <small>SEI EIN</small> B<small>RANDOPFER UND DIESES SELBST EIN</small> H<small>EILSOPFER, SO SIND SEINE</small> W<small>ORTE GÜLTIG; WENN ABER: DIESES SELBST SEI EIN</small> H<small>EILSOPFER UND SEIN</small> J<small>UNGES EIN</small> B<small>RANDOPFER, SO IST ES DAS</small> J<small>UNGE EINES</small> H<small>EILSOPFERS – SO</small> R. M<small>EÍR</small>. R. J<small>OSE SAGTE</small>: H<small>AT ER DIES VON VORNHEREIN BEABSICHTIGT, SO SIND, DA MAN NICHT ZWEI</small> N<small>AMEN GLEICHZEITIG AUSSPRECHEN KANN, SEINE</small> W<small>ORTE GÜLTIG; WENN ER ABER, NACHDEM ER ‘DIESES SELBST SEI EIN</small> H<small>EILSOPFER’ GESAGT HAT, SICH ÜBERLEGT UND SAGT: UND SEIN</small> J<small>UNGES EIN</small> B<small>RANDOPFER, SO IST ES DAS</small> J<small>UNGE EINES</small> H<small>EILSOPFERS</small>."
Temurah 25a:4,"GEMARA. R. Joḥanan sagte: Wenn jemand ein trächtiges Sündopfer abgesondert, und es geworfen hat, so kann er, wenn er will, mit diesem selbst und wenn er will, mit dem Jungen Sühne erlangen$fn13. – Aus welchem Grunde? – R. Joḥanan ist der Ansicht, was$fn14man zurückläßt, bleibe zurück$fn15, und die Geburt sei nicht Glied der Mutter, somit ist es ebenso, als würde jemand zur Sicherheit zwei Sündopfer absondern, der, wenn er will, mit diesem, und wenn er will, mit jenem Sühne erlangen kann. R. Elea͑zar wandte ein: Wenn aber: dieses selbst sei ein Heilsopfer und sein Junges ein Brandopfer, so ist es das Junge eines Heilsopfers. Wieso heißt es, wenn man nun sagen wollte, was man zurückläßt, bleibe zurück, es sei das Junge eines Heilsopfers, es sollte doch heißen, es sei ein Heilsopfer!? R. Ṭabla erwiderte: Dies scheidet$fn16aus, denn Rabh sagte zum Jünger: Lies: so ist es ein Heilsopfer. Man wandte ein: Wenn jemand zu seiner Sklavin gesagt hat: du sollst Sklavin bleiben, dein Kind aber soll frei sein, so hat sie, wenn sie schwanger ist, [die Freiheit] für dieses erlangt. Erklärlich ist es, daß sie sie für dieses erlangt hat, wenn du sagst, was man zurückläßt, bleibe nicht zurück, denn die Geburt sei Glied der Mutter, somit ist es ebenso, als würde jemand die Hälfte seines Sklaven freilassen,"
Temurah 25b:1,"und zwar nach Rabbi (Meír), denn es wird gelehrt, [Rabbi sagt,] wenn jemand die Hälfte seines Sklaven freiläßt, gehe er frei aus, denn seine Freilassungsurkunde und seine Hand$fn17kommen gleichzeitig, wieso aber erwirbt sie sie für dieses, wenn du sagst, was man zurückläßt, bleibe zurück, und die Geburt sei nicht Glied der Mutter, es wird ja gelehrt, es sei einleuchtend, daß ein Sklave die Freilassungsurkunde seines Nächsten aus der Hand eines fremden Herrn eignen kann, nicht aber aus der Hand seines eigenen Herrn!? Hieraus ist also zu entnehmen, daß das, was man zurückläßt, nicht zurückbleibe, und dies ist eine Widerlegung R. Joḥanans. Eine Widerlegung."
Temurah 25b:2,"Es wäre anzunehmen, daß darüber, ob das, was man zurückläßt, zurückbleibe, Tannaím streiten, denn es wird gelehrt: Wenn jemand zu seiner Sklavin gesagt hat: du werde frei und deine Geburt sei Sklave, so gleicht ihre Geburt ihr selber$fn18– so R. Jose der Galiläer. Die Weisen sagen, seine Worte seien gültig, denn es heißt:$fn19<i>das Weib und ihre Kinder verbleiben ihrem Herrn</i>, – Welche Stütze ist der Schriftvers für die Rabbanan$fn20? Raba erwiderte: Der Schriftvers bezieht sich auf R. Jose den Galiläer; dieser lehrt, die Geburt gleiche ihr, denn es heißt: <i>das Weib und ihre Kinder verbleiben ihrem Herrn</i>. [Nur] wenn das Weib ihrem Herrn gehört, gehören auch ihre Kinder dem Herrn. Ihr Streit besteht wahrscheinlich in folgendem: R. Jose ist der Ansicht, was man zurückläßt, bleibe nicht zurück, und die Rabbanan sind der Ansicht, es bleibe zurück. – R. Joḥanan kann dir erwidern: alle sind der Ansicht, was man zurückläßt, bleibe zurück, hierbei aber$fn21aus folgendem Grunde: die Schrift sagt: <i>das Weib und ihre Kinder verbleiben ihrem Herrn</i>. Vielmehr streiten hierüber folgende Tannaím: (Es wird gelehrt:) Wenn jemand ein Sündopfer schlachtet und darin eine lebende Vier[monats]geburt findet, so darf sie, wie Eines lehrt, nur von Männern der Priesterschaft, und nur einen Tag$fn22, und nur innerhalb der Vorhänge gegessen werden, und wie ein Anderes lehrt, von jedem Menschen, an jedem Orte und unbeschränkte Zeit gegessen werden. Wahrscheinlich streiten hierüber Tannaím: der erste Autor ist der Ansicht, was man zurückläßt, bleibe nicht zurück, und der andere ist der Ansicht, was man zurückläßt, bleibe zurück. – R. Joḥanan kann dir erwidern: alle sind der Ansicht, was man zurückläßt, bleibe zurück, und diese Tannaím streiten über folgendes: einer ist der Ansicht, die Geburten der Opfertiere seien heilig, erst wenn sie da sind, und einer ist der Ansicht, die Geburten der Opfertiere seien heilig schon im Leibe ihrer Mutter. Wenn du aber willst, sage ich: dies ist kein Widerspruch; eines gilt von dem Falle, wenn man es geheiligt hat und es nachher trächtig wurde, und eines von dem Falle, wenn es trächtig war und man es nachher geheiligt hat. Raba wandte ein: Woher, daß der Grund R. Joḥanans ist, weil das, was man zurückläßt, zurückbleibe, vielleicht ist der Grund R. Joḥanans, weil man durch den Zuwachs des Opfertieres Sühne erlangen$fn23könne!? R. Hamnuna erwiderte ihm: R. Elea͑zar war ein Schüler R. Joḥanans, und er saß vor R. Joḥanan, der ihm diese Antwort nicht gab, und du sagst, der Grund R. Joḥanans sei, weil man durch den Zuwachs des Opfertieres Sühne erlangen könne."
Temurah 25b:3,"W<small>ENN EU ABER, NACHDEM ER ‘DIESES SELBST SEI EIN</small> H<small>EILSOPFER’ GESAGT HAT, SICH ÜBERLEGT &amp;C</small>. Selbstverständlich ist es das Junge eines Heilsopfers, sollte er denn, so lange er will, sich überlegen dürfen!? R.Papa erwiderte: Dies gilt von dem Falle, wenn er es innerhalb der Zeit, in der man einen Satz$fn24ausspricht, gesagt hat; man könnte glauben, innerhalb dieser Zeit gelte es als ein Satz, nur habe er darüber nachgedacht, so lehrt er uns."
Temurah 25b:4,"<sup>iv</sup> <b>S</b><small>AGTE JEMAND</small>:] <small>DIESES SEI</small> E<small>INGETAUSCHTES AUF DAS</small> B<small>RANDOPFER</small>, E<small>INGETAUSCHTES AUF DAS</small> H<small>EILSOPFER, SO IST ES</small> E<small>INGETAUSCHTES AUF DAS</small> B<small>RANDOPFER – SO</small> R. M<small>EÍR</small>. R. J<small>OSE SPRACH</small>: H<small>AT ER ES</small>$fn25<small>VON VORNHEREIN BEABSICHTIGT, SO SIND, DA MAN NICHT ZWEI</small> N<small>AMEN GLEICHZEITIG AUSSPRECHEN KANN, SEINE</small> W<small>ORTE GÜLTIG</small>$fn26, <small>WENN ER ABER, NACHDEM ER</small> ‘E<small>INGETAUSCHTES AUF DAS</small> B<small>RANDOPFER’ GESAGT HAT, SICH ÜBERLEGT UND SAGT</small>: E<small>INGETAUSCHTES AUF DAS</small> H<small>EILSOPFER, SO IST ES</small> E<small>INGETAUSCHTES EINES</small> B<small>RANDOPFERS</small>."
Temurah 25b:5,
Temurah 26a:1,"GEMARA. R. Jiçḥaq b. R. Jose sagte im Namen R. Joḥanans: Alle stimmen überein, daß, wenn jemand zuerst ‘dieses möge Geltung haben’ und nachher ‘jenes möge Geltung haben’ gesagt hat, nach aller Ansicht die erste Fassung bestimmend sei, und wenn er ‘dieses möge Geltung haben, nur wenn jenes Geltung hat’ gesagt hat, beide heilig seien, sie streiten nur über einen Fall, wie in unserer Mišna, wenn er gesagt hat: ‘Eingetauschtes auf das Brandopfer, Eingetauschtes auf das Heilsopfer.’ R. Meír ist der Ansicht, da er ‘Eingetauschtes auf das Brandopfer und auf das Heilsopfer’ sagen sollte, aber ‘Eingetauschtes auf das Brandopfer, Eingetauschtes auf das Heilsopfer’ gesagt hat, so ist es ebenso, als ob er zuerst gesagt hätte ‘dieses möge Geltung haben’ und nachher ‘jenes möge Geltung haben’; R. Jose aber ist der Ansicht, hätte er ‘Eingetauschtes auf das Brandopfer und auf das Heilsopfer’ gesagt, so könnte man glauben, es sei heilig und nicht darzubringen, so lehrt er uns."
Temurah 26a:2,"Die Rabbanan lehrten: Wenn jemand gesagt hat: Dieses Vieh sei zur Hälfte Eingetauschtes auf das Brandopfer und zur Hälfte Eingetauschtes auf das Heilsopfer, so ist das ganze als Brandopfer darzubringen – so R. Meír; die Weisen sagen, es sei weiden zu lassen, bis es ein Gebrechen bekommt, sodann werde es verkauft, und für die Hälfte des Erlöses bringe er das Eingetauschte eines Brandopfers und für die Hälfte des Erlöses bringe er das Eingetauschte eines Heilsopfers. R. Jose sprach: Hat er dies von vornherein beabsichtigt, so sind, da man nicht zwei Namen gleichzeitig aussprechen kann, seine Worte gültig. R. Jose sagt ja dasselbe, was die Rabbanan!? – Das ganze lehrte R. Jose. Ein Anderes lehrt: Ein Vieh, das zur Hälfte Brandopfer und zur Hälfte Sündopfer ist, ist ganz als Brandopfer darzubringen – so R. Meír. R. Jose sagt, es sei verenden zu lassen$fn27. Sie stimmen überein, daß, wenn er ‘zur Hälfte Sündopfer$fn28und zur Hälfte Brandopfer’ gesagt hat, es verenden zu lassen sei. Der übereinstimmt, ist ja R. Meír$fn29, und dies ist ja selbstverständlich!? – Man könnte glauben, wenn er dies nicht gelehrt hätte, könnte man sagen, der Grund R. Meírs sei nicht, weil die erste Fassung maßgebend ist, sondern aus dem Grunde, weil das vermischte Sündopfer$fn30darzubringen ist, somit sei es darzubringen, auch wenn er zuerst ‘zur Hälfte Sündopfer’ und nachher ‘zur Hälfte Brandopfer’ gesagt hat, so lehrt er uns, daß dem nicht so sei. Ein Anderes lehrt: Wenn jemand gesagt hat: dieses Vieh sei zur Hälfte Brandopfer und zur Hälfte Heilsopfer, so ist es heilig und nicht darzubringen, es kann umgelauscht werden, und das Eingetauschte gleicht diesem selber. Also nach R. Jose, somit ist ja selbstverständlich, daß es heilig und nicht darzubringen ist!? – Nötig ist dies wegen des Eingetauschten, man könnte glauben, es selbst sei allerdings nicht darzubringen, das Eingetauschte aber sei darzubringen, so lehrt er uns. Es selbst ist deshalb nicht darzubringen, weil es eine verdrängte Heiligkeit ist, und auch das Eingetauschte kommt von einer verdrängten Heiligkeit."
Temurah 26a:3,"R. Joḥanan sagte: Wenn ein Vieh zwei Gesellschaftern gehört hatte und einer die Hälfte geveiht hat, und dieser darauf die andere Hälfte kauft und sie ebenfalls weiht, so ist es heilig und nicht darzubringen, es kann umgetauscht werden und das Eingetauschte gleicht diesem. Hieraus ist"
Temurah 26b:1,"dreierlei zu entnehmen; es ist zu entnehmen, daß die Heiligkeit des Geldwertes$fn31verdrängt werden$fn32kann, es ist zu entnehmen, daß Lebendes verdrängt werden kann, und es ist zu entnehmen, daß die frühere Verdrängung$fn33als Verdrängung gilt."
Temurah 26b:2,"Abajje sagte: Alle stimmen überein, daß, wenn jemand gesagt hat: die Hälfte sei Brandopfer und die Hälfte Zehnt, es nach aller Ansicht als Brandopfer darzubringen$fn34sei; wie ist es aber, wenn er gesagt hat: die Hälfte Eingetauschtes und die Hälfte Zehnt: ist es als Eingetauschtes darzubringen, da es bei allen Opfertieren Geltung hat, oder ist es als Zehnt darzubringen, da dieser das vorangehende und das folgende$fn35heiligt? – Dies bleibt unentschieden."
Temurah 26b:3,"<sup>v</sup> <b>S</b><small>AGTE JEMAND</small>: D<small>IESES SEI ANSTELLE VON DIESEM, UMGETAUSCHT AUF DIESES, AUSGEWECHSELT DURCH DIESES, SO IST DIES EIN</small> U<small>MTAUSCH; WENN ABER: DIESES SEI AUSGEWEIHT DURCH DIESES, SO IST DIES KEIN</small> U<small>MTAUSCH</small>. I<small>ST ABER DAS</small> O<small>PFERTIER FEHLERBEHAFTET, SO WIRD ES PROFAN, NUR MUSS ER FÜR DEN</small> G<small>ELDWERT AUFKOMMEN</small>."
Temurah 26b:4,"GEMARA. Demnach hat ‘anstelle’ den Begriff ‘erfassen’; ich will auf einen Widerspruch hinweisen: Wenn jemand von Geheiligtem des Tempelreparaturfonds’ gesagt hat: es sei eingewechselt gegen dieses, umgetauscht gegen dieses, so hat er nichts$fn36gesagt, wenn aber: anstelle von diesem, ausgeweiht durch dieses, so sind seine Worte gültig. Welcher Unterschied besteht zwischen dem Anfangsatze und dem Schlußsatze, wenn du sagst, es habe den Begriff ‘erfassen’!? Abajje erwiderte: ‘Anstelle’ hat zuweilen den Begriff ‘erfassen’ und [zuweilen den Begriff] ‘ausweihen’."
Temurah 27a:1,"Den Begriff ‘erfassen’, wie es heißt:$fn37<i>ist aber der Aussatzfleck an seiner Stelle</i>$fn38<i>geblieben</i>, [den Begriff] ‘ausweihen’, wie es heißt:$fn39<i>an der Stelle des Kupfers bringe ich</i>$fn40<i>Gold</i>. Beim Geheiligten für den Altar, wobei ein Umtausch erfolgen kann, hat es den Begriff ‘erfassen’, und beim Geheiligten für den Tempelreparaturfonds, wobei ein Umtausch nicht erfolgen kann, hat es den Begriff ‘ausweihen’. Raba sagte: Auch beim Geheiligten für den Altar kann es vorkommen, daß es den Begriff ‘ausweihen’ hat, wenn beispielsweise das Opfertier fehlerbehaftet$fn41ist. R. Aši saste: Auch bei einem fehlerbehafleten hat es zuweilen den Begriff ‘ausweihen’ und zuweilen den Begriff ‘erfassen’. Legt er seine Hand$fn42auf das geheiligte, so wird es profan, legt er seine Hand auf das profane, so ist es heilig$fn43."
Temurah 27a:2,"Abajje fragte: Wie ist es, wenn jemand zwei fehlerbehaftete heilige Tiere und zwei fehlerfreie profane Tiere vor sich hat und sagt: diese anstelle von jenen: wollte er sie erfassen$fn44lassen und er ist zu geißeln, oder aber läßt niemand, wo Erlaubtes vorhanden ist, das Erlaubte$fn45und wählt das Verbotene. Und wie ist es, falls du entscheidest, niemand lasse das Erlaubte, wenn er es vor sich hat, und wählt das Verbotene, wenn er zwei heilige Tiere, von denen eines fehlerbehaftet ist, und zwei profane Tiere, von denen eines fehlerbehaftet ist, vor sich hat und sagt: diese anstellevon jenen. Meinte er das fehlerfreie anstelle des fehlerfreien, zur Erfassung$fn44, und das fehlerbehaftete anstelle des fehlerbehafteten, zur Ausweihung$fn46, oder aber: das fehlerfreie profane anstelle des fehlerbehafteten heiligen und das fehlerbehaftete profane anstelle des fehlerfreien heiligen, und er ist wegen beider zu geißeln. Und wie ist es, falls du entscheidest, wer Erlaubtes vor sich hat, wähle nicht das Verbotene, er wollte es daher ausweihen und sei nicht zu geißeln, wenn er drei heilige Tiere, von denen eines fehlerbehaftet ist, und drei fehlerfreie profane Tiere vor sich hat und sagt: diese anstelle von jenen. Sagen wir, wie die fehlerfreien anstelle der fehlerfreien, zur Erfassung$fn44, ebenso das fehlerfreie anstelle des fehlerbehafteten, zur Erfassung, oder aber wählt auch hierbei, wer Erlaubtes vor sich hat, nicht das Verbotene, und er wollte das letzte ausweihen? Und wie ist es, fragte R. Aši, falls du entscheidest, auch hierbei sei es nicht festgestellt, daß er Verbotenes$fn47begehe, und niemand lasse das Erlaubte und wählt das Verbotene, wenn er vier heilige Tiere, von denen eines fehlerbehaftel ist, und vier profane Tiere vor sich hat und sagt: diese anstelle von jenen. Hierbei ist es ja festgestellt, daß er Verbotenes$fn48begeht, somit ist er viermal$fn49zu geißeln, oder aber läßt niemand, auch wenn es festgestellt ist, daß er Verbotenes begeht, das Erlaubte und wählt das Verbotene, und er wollte das letzte ausweihen. – Dies bleibt unentschieden."
Temurah 27a:3,"I<small>ST ABER DAS</small> O<small>PFERTIER FEHLERBEHAFTET, SO WIRD ES PROFAN &amp;C.</small> R. Joḥanan sagte: Es wird profan, nach der Tora, und er muß für den Geldwert aufkommen, rabbanitisch. Reš Laqiš aber sagte: Auch für den Geldwert aufkommen muß er nach der Tora. – Worauf bezieht sich dies: wollte man sagen, auf [den Betrag] der Übervorteilung$fn50, wieso sagt Reš Laqiš, er müsse für den Geldwert aufkommen [nach der Tora], wir haben ja gelernt, bei folgenden Dingen gebe es keine Übervorteilung: bei Sklaven, Schuldscheinen, Grundstücken und Heiligem!? Und wollte man sagen, auf [den Betrag] der Aufhebung$fn50des Kaufes, wieso sagt R. Joḥanan, er müsse nur rabbanitisch für den Geldwert aufkommen, R. Jirmeja"
