masechet,commentary,perek,halakha,page,comment,dh,base text ref,base text
Chagigah,עמודי ירושלים,1,0,3a,"@11חולה דכתיב ושמחת כו'. @33כ' השירי קרבן וז""ל וקשה א""כ יהא חולה פטור מן הביכורים דכתיב ושמחת בכל הטוב ולא תירץ כלום. ולדעתי לק""מ דהא בביכורים יוכל לעשות שליח וא""כ אף שהוא לא יוכל לשמוח מ""מ יוכל השליח שלו לשמוח וע""כ אין חולה פטור. ואולי דעת הש""ק כדעת הפלתי ביו""ד סי' ס""א דחולה אינו יכול לעשות שליח כיון דהוא מלתא דלא מצי עביד אבל הא ליתא וכמו שהשגתי עליו לעיל וא""כ קושיתו לק""מ. וע' במכילתא פ' משפטים פ""כ דדריש מושמחת לחולה וזקן ומוכח דס""ל דגם זקן לא הוי בכלל ושמחת והירושלמי לא ס""ל כן:",חולה דכתיב ושמחת כו',Jerusalem Talmud Chagigah 1:1:14,חולה:  דכתיב (דברים טז) ושמחת:  
Chagigah,עמודי ירושלים,1,0,9a,"@11ולא @33הסכימה דעתו של רבי ולקה בשחין צריך להבין מדוע נלקה דוקא בשחין. אולם מצאתי בביאור רבינו הראב""ד לת""כ (פ' מצורע פירקא דנגעים פ""ה) ע""מ דאי' התם להורות מלמד שאינו רואה את הנגעים עד שיורנו רבו כ' וז""ל וכן גרסינן בחגיגה ירושלמי פ' אין דורשין אמר רב אין אדם רשאי לומר בנגע הצרעת אא""כ ראה או שימש כיצד הוא עושה בתחלה רבו פותח לו ראשי פסוקים ומסכים. למדנו שאע""פ שהוא תלמיד ותיק ויודע ומבין את הכל דמדעתו אינו רשאי לעשות בהם מעשה אלא ע""י פתיחת רבו עכ""ל מבואר דהיה גירסתו כאן במימרא דרב בנגע הצרעת ולא כמו שפי' הקה""ע והפני משה דמיירי במעשה מרכבה וצ""ל דבגירסת הראב""ד לא היה תיבות לא כן ורק אמר רב הוא התחלת המאמר ולפ""ז גם בהסיום תלמיד ותיק כו' מיירי ג""כ בנגע צרעת ולא במעשה מרכבה וכגרסתינו וכיון שלא עשה כדיני' ע""כ נלקה הוא בעצמו בנגע צרעת. ונראה דהרמב""ם בה' טומאת צרעת (פ""ט ה""ב) שכ' אסור לו לראות נגע מכל נגעים עד שיורנו רבו הוציא דברים מהת""כ והירושלמי הזה והמפרשים לא כתבו שמה מקור מוצאו:",ולא הסכימה דעתו של רבי ולקה בשחין,Jerusalem Talmud Chagigah 2:1:6,"ולא במרכבה ביחיד.  עוד היא כר' עקיבה דברי הכל היא כדי שיהא אדם יודע לחוס על כבוד קונו לא כן אמר רב אין אדם רשאי לומר דבר כנגד רבו אלא א""כ ראה או שימש כיצד הוא עושה בתחילה רבו פותח לו ראשי פסוקים ומסכים ר' חייה בשם ר""י תלמיד וותיק היה לו לרבי ודרש פרק אחד במעשה המרכבה ולא הסכימה דעתו של רבי ולקה בשחין התורה הזו דומה לשני שבילים אחד של אור ואחד של שלג היטה בזה מת באור היטה בזו מת בשלג מה יעשה יהלך באמצע"
Chagigah,עמודי ירושלים,1,0,12a,"@11דוד @33מת בעצרת והיו כל ישראל אוננים כו' ע' בהפלאה כתובות (ק""ג ב') שהקשה דהא אין אנינות ברגל וכן הקשה בשו""ת רב משולם (סי' ג'). אולם לפמ""ש בס' תפארת למשה ביו""ד (סי' שמ""א ס""ב) דלא הי' אוננים ממש לפטור ממצוות רק מחמת צער לא הקריב לא קשה קושיתם. וע' במשנה למלך (ה' אבל פ""ג ה""י) ובשער המלך פ""ג מה' מעשה הקרבנות מה שהקשו ע""ד הירושלמי הללו ולפי פי' התפל""מ לק""מ. וראיתי להעיר ע""ד היד דוד פסחים (צ""א ב' ד""ה האונן) שהשיג ע""ד השער המלך יעו""ש ונראה שהוא הי' סובר דהראיה שהביא השער המלך הוא להוכיח דלא כהמשנה למלך דהטעם משום טירדא ולכן הקשה עליו. אולם באמת כוונת השעה""מ להביא ראיה דאנינות של תורה נוהג אף ביו""ט ולפ""ז לק""מ עלי' וז""ב:",דוד מת בעצרת והיו כל ישראל אוננים,Jerusalem Talmud Chagigah 2:3:4,"אמר ר' יוסי בי רבי בון רבי שמעון בן לקיש הוה עבר קומי סדרא ושמע קלהון קריי הדין פסוקא (דברי הימים א כט) ויזבחו לה' זבחים ויעלו עולות לה' למחרת היום ההוא אמר מאן דמפסיק ליה כבית שמאי מאן דקרא כוליה כבית הלל ניחא עולות למחרת היום ההוא שלמים למחרת היום ואין שלמים באין כב""ש א""ר יוסי בי רבי בון דוד מת בעצרת והיו כל ישראל אוננין והקריבו למחר"
Chagigah,עמודי ירושלים,1,0,12a,"הדא כסא בשירותא כו'. ע' מה שפי' הקה""ע ופירושו דחוק למאד ואין לו ביאור כלל. וגם בביצה (פ""ב ה""ד) הוצרך לשבש שם הגירסא וגם לא ראה שגם במעשר שני (פ""ה ה""ג) איתא בשרותא וליתא שם תיבא כסא. וגם פי' הפני משה הוא דחוק ורחוק. אולם מצאתי בחי' המאירי לביצה (ד""כ ע""א) שכתוב וז""ל ואמרי' עלה בירושלמי כל כשרותא בעי מלאי פירוש קורה צריכה היא לכריתה ואין אדם כורתה אלא במינה שהרי מן העצים אדם עושה קתא לסכינו כו' כך דברי ב""ש לא נפסלו אלא בשלהם וכן אמרו שם סמא דקסא מיני' ובי' פי' קסא עצים כו' וקאמר תולעת הנמצא בעצים מתוכו היא מתליע ואינו בא לו ממקום אחר כו' ע""ש והוא פי' נפלא:",הדא כסא בשירותא כו',Jerusalem Talmud Chagigah 2:3:5,"מעשה בהלל הזקן שהביא עולתו לעזרה וסמך עליה חברו עליו תלמידי ב""ש התחיל מכשכש בזנבה אמר להן ראו נקיבה היא ושלמים הפליגן בדברים והלכו להן לאחר ימים גברה ידן של ב""ש וביקשו לקבוע הלכה כדבריהם והיה שם בבא בן בוטא מתלמידי ב""ש ויודע שהלכה כב""ה ופעם אחת נכנס לעזרה ומצאה שוממת אמר ישמו בתיהן של אלו שהישמו את בית אלהינו מה עשה שלח והביא שלשת אלפים טלי מצאן קדר וביקרן ממומין והעמידן בהר הבית ואמר להן שמעוני אחיי בית ישראל כל מי שהוא רוצה יביא עולות יביא ויסמוך יביא שלמים ויסמוך באותה השעה נקבעה הלכה כבית הלל ולא אמר אדם דבר א""ר יצחק בי ר' לעזר הדא כסא בשירותה בעייא מילוי כסא דקיסא מיניה וביה כל גומרא דלא כוויא בשעתה לא כוייא מעשה באחד מתלמידי ב""ה שהביא עולתו לעזרה וסמך עליה וראהו אחד מתלמידי ב""ש אמר להן מה זו סמיכה אמר לו מה זו שתיקה ושיתקו בנזיפה והלך לו:"
Chagigah,עמודי ירושלים,1,0,12a,"כתוב אחד אומר כו'. ע' במראה הפנים שכתב בדעת הר""מ דסובר דביום טבוח מותר במלאכה דהר""מ אינו סובר דביום הקרבת הקרבן יהי' אסור בעשיית מלאכה ובע""פ מסיק הירושלמי דאינו אסור רק במלאכה במקום שנהגו ע""ש ותמהני ע""ז דהא כ' הר""מ ה' יו""ט (פ""ח הי""ז) דאיסור מלאכה בע""פ הוא מדינא משום הקרבת הקרבן וכטעם הירושלמי בתחלה ולא כדדחי אח""כ ועם כי יש לדחות דהתם הטעם משום שהוא קרבן של כל ישראל וכמ""ש המל""מ ה' כלי המקדש (פ""ו ה""ט) אכן הא הר""מ כתב שם כן במנדב עצים דאסור רק ממנהגא וכמבואר בירושלמי כאן וא""כ ביום טבוח עכ""פ ממנהגא אסור ואולי גם מדינא וצע""ג:",כתוב אחד אומר כו',Jerusalem Talmud Chagigah 2:4:3,"כתוב אחד אומר (שמות כג) וחג הקציר בכורי מעשיך וכתוב אחר אומר (ויקרא כג) כל מלאכת עבודה לא תעשו א""ר חנניה כיצד יתקיימו שני מקראות הללו בשעה שהוא חל בחול את חוגג ושובת ובשעה שהוא חל בשבת למחר את חוגג וקוצר א""ר יוסי בי רבי בון ובלבד שיבלים לעיסתו כהדא דתני להן אינש דיהוי עלוהי אעין ובכורין האומר הרי עלי עצים למזבח וגיזרין למערכה אסור בהספד ותענית ומלעשות מלאכה בו ביום."
Chagigah,עמודי ירושלים,1,0,21b,"@11יום טוב שחל להיות בערב שבת כו'. @33עי' ש""ק שהניח בצ""ע על הר""מ פי""א מה' מטמו""מ שהשמיט זה ע""ש ועדיפא הי' לו להקשות דלמה השמיט דין המשנה דעבר הרגל ביום הששי לא היו מעבירין מפני כבוד השבת וע' בתפארת ישראל פ""ג דחגיגה שהעיר בזה:",יום טוב שחל להיות בערב שבת כו',Jerusalem Talmud Chagigah 3:7:4,"ר' סימון בשם ר' יהושע בן לוי יום טוב שחל להיות בערב שבת אוכל אף תשבות הרגל כרגל א""ר זעירה מתניתא אמרה כן ערב הפסח כפסח ויום טבוח כעצרת א""ר חנניה אוף אנן תנינן דרבא ר' יודה אומר אף לא ביום החמישי שאין הכהנים פנויים:"
