masechet,commentary,perek,halakha,page,comment,dh,base text ref,base text
Shekalim,עמודי ירושלים,1,0,5a,"@11אדם לרבות את הגרים @33כתב הרא""פ וקשה לי מה צריך לרבות את הגרים הלא אף העכו""ם נודרים נדרים ונדבות ואתרבי להו מאיש איש. ובאמת כבר נשאל בזה ר' ישעיה הראשון בתשובתו ההובאה בא""ז סי' תשנ""ד יעו""ש מ""ש בזה ובקרבן אהרן פ' ויקרא:","אדם לרבות את הגרים כתב הרא""פ וקשה",Jerusalem Talmud Shekalim 1:4:4,"אמר ר' לעזר מתני' בנכרים הא בכותים לא ותני כן (ויקרא א) אדם לרבות את הגרים (שם) להוציא את המומרים מתני' פליגא על ר' אלעזר אין מקבלין מידם קיני זבין וזבות קיני יולדות וכי יש קיני זבין וזבות בעכו""ם אלא רישא בעכו""ם וסיפא בכותים &lt;והא כיני&gt; כן הוא רישא בעכו""ם וסיפא בכותים"
Shekalim,עמודי ירושלים,1,0,8b,"@11ותני דבי רבי אם נתקרבה הבהמה כו'. @33עי' ברא""פ ובקרבן העדה מה שדחקו בביאורו. אולם מצאתי בפי' רבינו הראב""ד לת""כ (פ' ויקרא פ' י""א ד""ה נפש) וז""ל הראב""ד ותו קשיא לי הא דתנן בשקלים פ""ב [מ""ב] הנותן שקלו לחבירו לשקול על ידו ושקלו על ידי עצמו אם נתרמה התרומה מעל ובפסקא אחריתי תנן השוקל שקלו ממעות הקדש אם נתרמה התרומה מעל ותנא (דברים) [דבי רבי] אם נתקרבה הבהמה וכז' ועלה אקשי [בירושלמי עי""ש] אפילו נתקרבה הבהמה אמאי מעל אלו גנב פרתו של חברו ושחטה סתם לא לבעלים הראשונים עלתה ושני לה במסויים של בית רבן גמליאל שהיה מתכוין ודוחפו לקופה של תרומה שלא יפול לשירים לפי שאין מועלין בשירים והרי הן כחולין אפי' לר' מאיר דאמר מועלין המסויים היה מבזין ותורמו לשמו אלמא יש מעילה בין התרומה והשירים שהרי אף בתרומה עצמה היה מעילה בין לשם בעלים והסתם משום נחת רוח בבעלים לא נגמר לבעלים עד שתתקרב הבהמה כי אז יאמר קרבו המעות לפני המקום. ובמסקנא דמילתא אקשינן ומה נהנה כלומר למאן דתני נתרמה התרומה. וא""ת מפני נחת רוח הרי אין לו נחת רוח א""ר אבין מתוך שנתנו ב""ד זמן למשכן ולא משכנו כאלו נהנה ?:",ותני דבי רבי אם נתקרבה הבהמה כו',Jerusalem Talmud Shekalim 2:2:2,"השוקל כו' אנן תנינן אם קרבה הבהמה ותני דבי ר' אם נתרמה התרומה &lt;נ""א אנן תנינן אם נתרמה התרומה ותני דבית רבי אם קרבה הבהמה אמר ר' לעזר מאן תנא אם קרבה הבהמה ר""ש דר""ש אומר מיד וכו'&gt; מאן תנא אם נתרמה התרומה רבי שמעון היא דאמר רבי שמעון מיד היה מקבל מעותיו והכהנים זריזים הן וקשיא אילו הגונב עולתו של חבירו ושחטה סתם סתמה לא לשם בעלים הראשונים מכפרת אמר ר' יודן תיפתר במסויים משל בית רבן גמליאל שהיה מתכוין ודוחפו לתוך הקופה וחש לומר שמא לשיריים הן נופלין וכי יש מעילה בשיריים אלא כרבי מאיר דרבי מאיר אומר מועלין בשיריים עוד היא במסויים של בית רבן גמליאל שהיה מתכווין ותורמו לשמו:"
Shekalim,עמודי ירושלים,1,0,8b,"והשתא קשיא לי לתנא דידן מאי שנא רישא ומאי שנא סיפא כיון דרישא חשיב ליה כנהנה בהקדש מפני שלא משכנוהו ומשום הכי כיון שנתרמה התרומה מיד מעל אם כן סיפא נמי אמאי בעי קרבו הבהמה. ומתחזי לי פירוקא דהאי קושי' היינו טעמא דבעינן קרבה הבהמה משום דבגזבר עסקינן שכל ההקדשות תחת ידו ואם נטל שקלו ממעות בדק הבית ושקלה לתרומת המזבח לא נהנה כלום עד שתתקרב הבהמה. וא""ת כבר נהנה שהרי הציל עצמו ממשכון הרי שנינו אין ממשכנין הכהנים מפני דרכי שלום וכל שכן הגזברים שבידם הגבוי והמשכן והכל [בידם]. אבל רישא בישראל עסקינן שנתנו למשכון וכיון שהציל עצמו בהקדש שלא משכנו אותו חשוב כמו שנהנה. ולפי ביאורו תראה דמ""ש הרא""פ דמוכח בירושלמי דגם רישא מיירי בנקרב ולפי' הראב""ד לא מוכח מידי:",והשתא קשיא לי לתנא דידן מאי שנא,,
Shekalim,עמודי ירושלים,1,0,15b,"@11לא נמצא כקומץ על השירים כו' @33עי' בקרבן העדה. אולם מצאתי לרבינו הראב""ד בביאורו לת""כ (פ' בהר פ""א) שהעתיק הירושלמי הזה וכתב וז""ל פי' על משנת שומרי ספיחים בשביעית נוטלין שכרן מתרומת הלשכה קא מקשה וש""מ דספיחין אסורין בשביעית לגמרי עכ""ל מבואר דפי' הירושלמי דקאי על ספיחין. ובהיות כן י""ל דהירושלמי קאי בשיטת חכמים דסוברים דספיחין אסורין רק מד""ס וכמו שכן פסק הר""מ (פ""ד מה' שמיטה ה""ב) א""כ י""ל דלא אסרינן משום משקה האסור לישראל רק היכא שיש איסורא דאורייתא ולא באיסורא דרבנן. אולם גם לפ""ד הקה""ע לק""מ עפ""י מ""ש התוס' במנחות דפ""ד דבעומר לא אמרינן משקה המותר כו' כיון דהותר כך בכל שנה דיקרב @11מביא מעות ומחללן על הבנין. @33ומביא קטרת ומחללין עליהן. בשירי קרבן כאן הקשה על הרע""ב ורש""י שכתבו בפי' המשנה שנותנין למפטמי קטרת דהא הכא מסיק דנותנן לאומני הבנין יע""ש. אולם ראיתי בחי' הר""ן לשבועות (ד""ו ע""ב) שהעתיק דברי הירושלמי בזה""ל מביא ב' מעות מן החולין ומביא קטרת ומחללן עליהן כו' ע""ש שלא היה בגירסתו דנותנן לאומני הבנין וכן היתה גירסת רש""י ורע""ב ולק""מ. ועי' מה שכתב שם הר""ן בביאור דברי הירוש':",לא נמצא כקומץ על השירים כו' עי',Jerusalem Talmud Shekalim 4:1:3,"העומר ושתי לחם ולחם הפנים וכל קרבנות הציבור: &lt;מתניתא דר' ישמעאל דר' ישמעאל אמר אין העומר בא מן הסוריא&gt; תמן תנינן כל קרבנות היחיד והציבור באין מן הארץ ומן חוצה לארץ מן החדש ומן הישן חוץ מן העומר ושתי לחם שאין באין אלא מן החדש ומן הארץ רב חונה בשם רבי ירמיה דרבי ישמעאל היא דרבי ישמעאל אומר אין העומר בא מן הסוריא תמן תנינן עשר קדושות הן ארץ ישראל מקודשת מכל הארצות ומה היא קדושתה שמביאין ממנה העומר והביכורים ושתי לחם מה שאין מביאין כן מכל הארצות ר' חייא &lt;חונה&gt; בשם רבי ירמיה דרבי ישמעאל היא דרבי ישמעאל אמר אין העומר בא מן הסוריא תמן תנינן ר' ישמעאל אומר מה חריש רשות אף קציר רשות יצא קציר העומר שהוא מצוה ר' ישמעאל כדעתיה דר' ישמעאל דאמר אין העומר בא מן הסוריא כדעתיה דאמר יצא קציר העומר שהוא מצוה מאן תנא שומרי ספיחין בשביעית נוטלין שכרן מתרומת הלשכה ר' ישמעאל היא א""ר יוסה דברי הכל היא לא מצאו בסוריא מביאין אותן ספיחין שבא""י ההן עומד מהו שיזרע בתחילה רב חייא בר אדא בעי קומי רבי מנא לא נמצא כקומץ על השיריים שאינן נאכלין אמר ליה נעשה כחמשה דברים שהן באין בטומאה ואין נאכלין בטומאה"
Shekalim,עמודי ירושלים,1,0,30a,"(שייך לעמוד הקודם) @11נקוניקה אישתכח כו' @33בקה""ע ובפי' הרא""פ פירשו מין קנקן וליתא רק פירושו בני מעים של שור ממולאים בבשר כן פי' (במעריך אות ו') ובפר""ח ביו""ד (סי' ס""ג סק""ג) וראיתי בספר שלמי נדבה ח""ב (ד""כ ע""א) שהקשה מהירושלמי הזה על תוס' חולין שכתבו דרק אי נקט ב' אבל אי נקט א' מותר וכאן מבואר דאף בא' אסור. ועוד הקשה דהא בב""מ דכ""ד ס""ל דר' יוחנן סובר בשר שנתעלם מן העין מותר וכאן סובר דאסור וקושיתו הא' כבר העיר בזה הפר""ח ובקושיתו השניה שגה מאד דאדרבה מבואר שם דר' יוחנן סובר דמותר דר' יוחנן מתיר בנמצא ביד עכו""ם ולרב אסור אף בנמצא ביד עכו""ם דלהירושלמי חמיר בנמצא ביד עכו""ם עי' ה""ה בהמ""א וב""י סי' ס""ג ולק""מ:",שייך לעמוד הקודם,,
