masechet,commentary,perek,halakha,page,comment,dh,base text ref,base text
Sotah,שיירי קרבן,1,0,30b,"@11והכתיב והיה בעברכם את הירדן וכו'. @33וקשה למה לא פריך מקרא דכתיב התם והיה ביום אשר תעברו את הירדן וכו' והקמות לך אבנים גדולות וגו' ואין לומר דאיכא לשנויי דהאי קרא לאו אהר עיבל קאי אבל בקרא בתרא כתיב והיה בעברכם את הירדן תקימו את האבנים האלה בהר עיבל א""כ קשיא מאי משני אבנים הקימו מיד וכו' הא כתיב בהר עיבל וע""כ לומר שבאו עד הר עיבל בו ביום וי""ל:",והכתיב והיה בעברכם את הירדן וכו',Jerusalem Talmud Sotah 7:3:4,אמר ר' אלעזר בר' שמעון נמייתי לסופרי כותים זייפתם תורתכם ולא הועלתם לעצמיכם כלום. שכתבתם בתורתכם אצל אלוני מורה שכם. והלא ידוע שהוא שכם אלא שאין אתם דורשין לגזירה שוה ואנו דורשין לגזירה שוה. נאמר כאן אלוני מורה ונאמר להלן אלוני מורה. מה אלוני מורה האמור להלן שכם אף אלוני מורה האמור כאן שכם. וכדר' ישמעאל דר' ישמעאל אמר כל ביאות שנאמרו בתורה לאחר ארבע עשרה שנה נאמרו. שבע שכיבשו ושבע שחילקו. ודכוותה לא נאמרו ברכות וקללות אלא לאחר ארבע עשרה שנה. התיב ר' חנניה קומי ר' מנא והכתיב (דברים כז) והיה בעברכם את הירדן תקימו את האבנים האלה. אמר ליה אבנים הקימו אותן מיד ברכות וקללות לאחר ארבע עשרה שנה נאמרו:
Sotah,שיירי קרבן,1,0,31a,"@11כל שהיה בכלל וכו'. @33מכאן קשה למה שפירש""י בשבת דף ע' ע""א בד""ה ועל כולן וכו' משום דהוה כלל בלא תעשה ופרט בעשה ואין דנין בדבר שהיה בכלל וכו' ע""כ. וכאן דהוה כלל בעשה דארור אשר לא יקים וגו' עשה הוא ופרט הוא בלא תעשה. וגם התוס' כתבו שם לגבי דבר שיוצא מן הכלל לא מצינו בשום מקום דבעינן שיהיו שניהם שוין בעשה או בלא תעשה ע""ש. ומכאן למדנו כלל חדש כל שכללן הכתוב לא הוו שני כתובים וצ""ע:",כל שהיה בכלל וכו',Jerusalem Talmud Sotah 7:4:5,עד כדון דברים שנכללו ונפרטו. דברים שנכללו ולא נפרטו. אמר ליה כן אמר רבי יוחנן משום רבי שמעון כל שהיה בכלל ויצא מן הכלל ללמד. לא ללמד על עצמו יצא אלא ללמד על הכלל כולו יצא. אמר ליה לא בדבר אחד. דילמא בשני דברים והכא בשני דברים אנן קיימין. אמר רבי תנחומא מכיון דכתיב בסוף אמן כמי שכולו דבר אחד.
Sotah,שיירי קרבן,1,0,31b,"@11כך הן חולקין בדגלים @33וקשה הא בדגלים כסדרן היו כל בני אם אחת בהדדי וי""ל שלא היו כסדר תולדתן:",כך הן חולקין בדגלים וקשה הא בדגלים,Jerusalem Talmud Sotah 7:4:9,כהנא אמר כשם שהן חולקין כאן כך הן חולקין בתחילת החומש השני. אית תניי תני כשם שהן חולקין כאן כך הן חולקין בדגלים. בני לאה מיכן. ובני רחל מיכן חד מיכן וחד מיכן. ובני השפחות באמצע. אמר רבי מתניה טעמיה דהדין תנייה (ישעיהו מח) שמע אלי יעקב עבדי וישראל מקוראי. מה התקרה הזו עובייה דהן גבי קוטנה דההן ועיבי' דהן גבי קוטנה דההן. אית תניי תני כשם שהן חלוקין כאן כך הן חלוקין באבני אפוד. במלואותם. כדי שיהיו עשרים וחמשה מיכן ועשרים וחמשה מיכן. והלא אינן אלא ארבעים ותשעה. אמר רבי יוחנן בנימין דותולדותם מלא. אמר רבי יודה בר זבידא יהוסף מלא (תהילים פא) עדות ביהוסף שמו. והלא אינן אלא עשרים ושלשה מיכן ועשרים ושבעה מיכן. אמר ר' יוחנן בנימין היה חציו. בן מיכן. ימן מיכן. אמר ר' זבידא ויאות מי כתיב (שמות כח) ששה שמותם לא. אלא משמותם. משמותם ולא כל שמותם. הראשונים נכתבין ממינו של כהן גדול משמאלו של קורא. והאחרונים נכתבין משמאלו של כהן גדול מימינו של קורא. הראשונים אינן נכתבין על סדר שיהודה מלך האחרונים נכתבין על סדר:
Sotah,שיירי קרבן,1,0,32a,"@11לא לשעה היה. @33כתב הי""מ לא היה אלא לשעה ואחר שהקריבו הקרבנות גנזו האבנים הואיל ונשתמש בהן קדושה ומשני עוד היא מעשה נסים שנתן הקב""ה בינה בלב כל אומה ולשעה קלה העתיקו משם ע""כ. וקשה הא מצינו מזבחות שעשה אברהם ויעקב ושאול הניחוהו ולא גנזו האבנים כדאמרינן וירפא את מזבח ה' ההרוס זה מזבחו של שאול וע""ק כיון שהיה צורך בכמידתו ודאי לא הרסו אותו ולא גנזוהו עד לאחר זמן כדי שיעתיקו ממנו התורה לכן מה שפירשתי בקונט' עיקר:",לא לשעה היה,Jerusalem Talmud Sotah 7:5:2,"תני על אבני המלון נכתבו דברי רבי יודה. רבי יוסי אומר על אבני המזבח נכתבו. מאן דמר על אבני המלון נכתבו בכל יום ויום אומות העולם משלחין נוטריהון ומשיאין את התורה שהיתה כתובה בשבעים לשון. מאן דמר על אבני המזבח נכתבו לא לשעה היו ונגנזו. עוד הוא מעשה נסים. נתן הקב""ה בינה בלב כל אומה ואומה והשיאו את התורה שהיתה כתובה בשבעים לשון. מאן דמר על אבני המלון נכתבו ניחא (דברים כו) ושדת אותם בשיד. מאן דמר על אבני המזבח נכתבו מה מקיים ושדת אותם בשיד. בין כל אבן ואבן. רבי שמואל בר נחמני בשם ר' יוחנן (ישעיהו לג) והיו עמים משרפות סיד. מסיד נטלו איפיפסין שלהן מיתה. רבי אבא בר כהנא בשם רבי יוחנן (ישעיהו ס) והגוים חרוב יחרבו מחורב נטלו איפיפסין שלהן מיתה."
Sotah,שיירי קרבן,1,0,32a,"@11ניחא ושדת אותם בסיד וכו'. @33כתב הי""מ בשלמא אי הוו על אבני המלון שנשארו שם בקבע ניחא שיסודו אותן בסיד לכסות הכתיבה מפני קדושתה עד שיבואו האומות ויקלפוה אלא אי על אבני המזבח הוו כיון דלא הוה אלא לשעה דמיד באו א""ה והעתיקו' כדלעיל מ""ט לכיסוי הסיד ומשני דאין הסיד אלא לבנין ע""כ. ודבריו תמוהים חדא שלא נזכר בירושלמי דקלפו הסיד ועוד וכי באו האומות בו ביום ועוד מ""ט לכסות הכתיבה ועוד מאי משני בין כל אבן וכי איצטרך קרא להכי ממילא אין בנין אבנים אלא בסיד לכן נ""ל פירושי שבקונט' עיקר:",ניחא ושדת אותם בסיד וכו',Jerusalem Talmud Sotah 7:5:2,"תני על אבני המלון נכתבו דברי רבי יודה. רבי יוסי אומר על אבני המזבח נכתבו. מאן דמר על אבני המלון נכתבו בכל יום ויום אומות העולם משלחין נוטריהון ומשיאין את התורה שהיתה כתובה בשבעים לשון. מאן דמר על אבני המזבח נכתבו לא לשעה היו ונגנזו. עוד הוא מעשה נסים. נתן הקב""ה בינה בלב כל אומה ואומה והשיאו את התורה שהיתה כתובה בשבעים לשון. מאן דמר על אבני המלון נכתבו ניחא (דברים כו) ושדת אותם בשיד. מאן דמר על אבני המזבח נכתבו מה מקיים ושדת אותם בשיד. בין כל אבן ואבן. רבי שמואל בר נחמני בשם ר' יוחנן (ישעיהו לג) והיו עמים משרפות סיד. מסיד נטלו איפיפסין שלהן מיתה. רבי אבא בר כהנא בשם רבי יוחנן (ישעיהו ס) והגוים חרוב יחרבו מחורב נטלו איפיפסין שלהן מיתה."
Sotah,שיירי קרבן,1,0,32a,"@11אין תימר אבני המלון לשעה היו ונגנזו. @33גם פה פי' הי""מ שנגנזו כדלעיל מפני קדושתן ע""ש שדחק מאוד בפירושו. ולפמ""ש בקונט' לק""מ אך קשה לי דהכא משמע שאבני מלון נגנזו כדרשינן מויניחו' שם כמ""ש בקונט' וכן דרשו במסכת יומא הא דכתיב בפ' אחרי מות בבגדי כה""ג דיוה""כ והניחם שם שטעונין גניזה ולעיל אמרינן למ""ד על אבני המלון ניחא שעמדו ימים רבים וי""ל דאתיא כמ""ד והניחם שם שלא ישתמש בהם ביוה""כ אחר י""ל דה""נ אתי ויניחו' שם שלא ישתמשו בם דבר חול:",אין תימר אבני המלון לשעה היו ונגנזו,Jerusalem Talmud Sotah 7:5:3,נמצאת אומר שלשה מיני אבנים הן. אבני המלון. ואבנים שהניח יהושע תחת כפות רגלי הכהנים. ואיסטליות שנתן להן משה. אמר רבי חנינן פשיט לן ארבעה מיני אבנים הן. אמר רבי סימון בר זביד ויאות אין תימר אבני המלון לשעה היו ונגנזו. אין תימר אבנים שהקים יהושע תחת כפות רגלי הכהנים משוקעות היו במים. אין תימר איסטליות שנתן להן משה כבר נכנסו עמהן לארץ. אלא כן אנן קיימין באבנים שהקים להן יהושע על גב הירדן.
Sotah,שיירי קרבן,1,0,32b,"@11עשרים וארבעה היו. @33לולא דמסתפינא אמינא שהני הנקובים בשמותם הן היו הי""ב הנוספים דכיון דכתיב כל נשיא בהם ידעינן שהנשיאים היו והן כבר הוזכרו בשמותם בפ' נשא ובהעלותך. והיינו דאמרינן בבבלי בפרקין א""ר יצחק דבר זה מסורת בידינו מאבותינו על שם מעשיהם נקראו וכו'. והטעם דכיון דכתיב כל נשיא בהם ידעינן שאין אלו שמותם:",עשרים וארבעה היו,Jerusalem Talmud Sotah 7:5:4,תני ר' יודה בר אלעאי אומר אבא חלפתא ורבי אלעזר בן מתיה וחנינה בן חכינאי עמדו על אותן האבנים ושיערום כל אחת ואחת משוי ארבעים סאה. מיכן את למד כמה היה באשכול כתיב (יהושוע ד) והרימו לכם איש אבן אחת על שכמו. לא דמי ההוא דטען מן ארעא לכתפי' לההוא דטען מארעא לארכובתיה ומן ארכובתיה לכתפיה לא דמי ההוא דטען מן ארעא לארכובתיה ומן ארכובתיה לכתפיה לההוא דאוחרן תלי ליה. לא דמי ההוא דאוחרן תלי ליה לההוא דטעין בתריין. כתיב (במדבר יג) איש אחד לשבט על דעתיה דרבי עקיבה דו אמר לשונו' רבויים הן עשרים וארבעה היו ששה עשר באשכול ושמנה בתאנים ורמוני' ובנושא כלים. ועל דעתיה דרבי ישמעאל דהוא אומר לשונות כפולין הן שנים עשר היו שמונה באשכול וארבעה בתאנים ורימוני' ובנושא כלים. על דעתיה דרבי ישמעאל טורטרין על דעתיה דר' עקיבה טורטורין וטורטורי טורטורין.
Sotah,שיירי קרבן,1,0,32b,"@11ושמונה בתאנים ורמונים וכו'. @33קצת קשה מנ""ל להוסיף בתאנים ורמונים לר""ע דלמא לא היו אלא ד' כמו לר""י וי""ל כיון שהאשכול היה גדול כל כך שצריך ט""ז לשאת אותה מסתמא גם תאנים ורמונים היה משאם כבד:",ושמונה בתאנים ורמונים וכו',Jerusalem Talmud Sotah 7:5:4,תני ר' יודה בר אלעאי אומר אבא חלפתא ורבי אלעזר בן מתיה וחנינה בן חכינאי עמדו על אותן האבנים ושיערום כל אחת ואחת משוי ארבעים סאה. מיכן את למד כמה היה באשכול כתיב (יהושוע ד) והרימו לכם איש אבן אחת על שכמו. לא דמי ההוא דטען מן ארעא לכתפי' לההוא דטען מארעא לארכובתיה ומן ארכובתיה לכתפיה לא דמי ההוא דטען מן ארעא לארכובתיה ומן ארכובתיה לכתפיה לההוא דאוחרן תלי ליה. לא דמי ההוא דאוחרן תלי ליה לההוא דטעין בתריין. כתיב (במדבר יג) איש אחד לשבט על דעתיה דרבי עקיבה דו אמר לשונו' רבויים הן עשרים וארבעה היו ששה עשר באשכול ושמנה בתאנים ורמוני' ובנושא כלים. ועל דעתיה דרבי ישמעאל דהוא אומר לשונות כפולין הן שנים עשר היו שמונה באשכול וארבעה בתאנים ורימוני' ובנושא כלים. על דעתיה דרבי ישמעאל טורטרין על דעתיה דר' עקיבה טורטורין וטורטורי טורטורין.
Sotah,שיירי קרבן,1,0,33b,"@11בכ""מ אינו קורא על פה וכו'. @33וקשה א""כ דמשום סידרו של יום התירו לדלג למה קורא ובעשור שבחומש הפקידים ע""פ ה""ל לקרות גם את פ' זו בס""ת ע""י דילוג וצ""ע וע""ק לפי מאי דקאמר שאין גוללין ס""ת ברבים ניחא טפי דלכך קרא ע""פ לפי שאין אדם א' קורא בצבור בשני ס""ת וכדפרישית במתני' וי""ל דלית ליה לירושלמי הך סברא:","בכ""מ אינו קורא על פה וכו'",Jerusalem Talmud Sotah 7:6:3,"תמן תנינן מדלגין בנביא ואין מדלגין מנביא לנביא. ובנביא של י""ב מותר. ואין מדלגין בתורה. ר' ירמיה בשם רשב""ל לפי שאין גוללין ס""ת ברבים. ר' יוסי בעי הגע עצמך שהיתה פרשה קטנה. אלא כדי שישמעו ישראל על סדר. והא תנינן וקורא אחרי מות ואך בעשו'. שנייא היא שחיא סדרו של יום. תדע לך דמר רבי שמעון בן לקיש בכל מקום אינו קורא על פה וכא קורא על פה. רבי יוסי מפקד לבר עולא חזנא דכנישתא דבבלאי כד דהיא חדא אורייא תונייל לה לחורי פרוכתא. כד אינון תרתיי תי מייבל חדא ומייתי חדא."
Sotah,שיירי קרבן,1,0,33b,"@11כד דהיא חדא אירייא וכו'. @33עיי' מ""ש ביומא דף י""ט ע""ב בתוס' בד""ה כד וכו' ליישב מנהגינו ולתרץ קושית המג""א בא""ח סי' קמ""ז:",כד דהיא חדא אירייא וכו',Jerusalem Talmud Sotah 7:6:3,"תמן תנינן מדלגין בנביא ואין מדלגין מנביא לנביא. ובנביא של י""ב מותר. ואין מדלגין בתורה. ר' ירמיה בשם רשב""ל לפי שאין גוללין ס""ת ברבים. ר' יוסי בעי הגע עצמך שהיתה פרשה קטנה. אלא כדי שישמעו ישראל על סדר. והא תנינן וקורא אחרי מות ואך בעשו'. שנייא היא שחיא סדרו של יום. תדע לך דמר רבי שמעון בן לקיש בכל מקום אינו קורא על פה וכא קורא על פה. רבי יוסי מפקד לבר עולא חזנא דכנישתא דבבלאי כד דהיא חדא אורייא תונייל לה לחורי פרוכתא. כד אינון תרתיי תי מייבל חדא ומייתי חדא."
Sotah,שיירי קרבן,1,0,33b,"@11תיפתר שסמך לו לכותל. @33כתב המג""א בא""ח סי' קמ""א ס""ק א' צריך לקרות מעומד. כב""ח סי' תר""ץ דאפילו בדיעבד לא יצא וכו' אבל ממ""ש הב""י בשם רש""י משמע דוקא לכתחילה אבל בדיעבד יצא וכ""מ מפ""ז דסוטה דאמרי' שהמלך קורא יושב ואי איתא דאפי' בדיעבד לא יצא משום כבודו של מלך לא שרי לכתחלה וכו' ע""כ. וקשה מאי ראיה מייתי ממלך שאני הכא דלא הוה אלא סמיכה וכדמשני הש""ס אצל ישיבה ממש אפי' לכתחלה אסור. ויש לומר דבבלי לא סבר הכי אלא דבעזרת נשים הוה קורא וכדמשני שם בפרקין אכה""ג ומלך ע""ש:",תיפתר שסמך לו לכותל,Jerusalem Talmud Sotah 7:7:2,לא כן תני רבי חייה לא היתה ישיבה בעזרה אלא למלכי בית דוד בלבד. ואמר ר' אמיב שם רבי שמעון בן לקיש אף למלכי בית דוד לא היתה ישיבה בעזרה. תיפתר שסמך לו בכותל וישב לו. והא כתיב (שמואל ב ז) ויבא המלך דוד וישב לפני ה' אמר רבי אייבו בר נגריי יישב עצמו בתפילה. תמן תנינן יצאה כת הראשונה וישבה לה בהר הבית. השניה בחיל. והשלישית במקומה. רבי נחמן בשם רבי מנא מה תנינן ישבה לה במקומה. עמדה לה במקומה.
Sotah,שיירי קרבן,1,0,34a,"@11ואינו צריך להבדיל וכו'. @33קושיא זו ופירוקה תימה לפום ריהטא. ולפי פירושי שבקונט' עדיין קשה על שלא הזכיר כלום הרמב""ם מברכת הבדלה זו. וע""ק מנין שיש הבדלה בשמיטה ופ' הקהל לא היתה בשנת היובל. מיהו הא איכא לתרוצי לפי סברת הירושלמי שהקריאה היתה ע""י שישראל יצאו משביעית לשמינית שלא לשכח המעשרות א""כ בשנת היובל היתה הקריאה בסופו. ונראה דס""ל שפ' הקהל קרא בליל מוצאי יו""ט כדתנן במתני' ואיכא נמי ברכו' הבדלה דיו""ט וה""ג א""ל כבר הבדיל מראש פי' כבר הבדיל קודם שקרא דהא היו צריכין לעשות הבימה שעמד עליה המלך וכ""ה בירושלמי במגילה דף ג' דלכך לא קרא פ' הקהל ביו""ט מפני התקיעה או מפני הבימה ועמ""ש שם בתוס' בד""ה מפני התקיעה. ואפשר דעל עושי בימה פריך שהיו צריכין להבדיל תחלה ומשני דאיירי לאחר שהבדיל והראשון נראה:",ואינו צריך להבדיל וכו',Jerusalem Talmud Sotah 7:8:2,אמר רבי אבהו ולמה קורין עשר תעשר. כי תכלה לעשר. על ידי שיצאו ישראל משביעית לשמינית שלא לשכח את המעשרות. רבי חגיי בעא קומי רבי יוסי ואינו צריך להבדיל. אמר ליה כבר הבדיל מראש השנה:
Sotah,שיירי קרבן,1,0,34a,@99הדרן עלך פרק אילו נאמרין,,Jerusalem Talmud Sotah 7:8:2,אמר רבי אבהו ולמה קורין עשר תעשר. כי תכלה לעשר. על ידי שיצאו ישראל משביעית לשמינית שלא לשכח את המעשרות. רבי חגיי בעא קומי רבי יוסי ואינו צריך להבדיל. אמר ליה כבר הבדיל מראש השנה:
Sotah,שיירי קרבן,1,0,34a,"@11נאמר כאן נגישה וכו'. @33וקשה הא תנן במתני' ודבר אל העם בלשון הקדש משמע דמודבר יליף שהוא בלה""ק. וי""ל דהתנ' לא בא אלא לפרש באיזה לשון דבר הכהן אבל עיקר הלימוד הוא מונגש. מיהו בבבלי יליף לה מודבר בגז""ש וכדפירשתי בקונט' בד""ה ומשני בנין דכתיב ודבר וכו'. אך קשה שפיר פריך הירו' מק""ש וי""ל דקסבר הבבלי דשאני הכא דמיותר ודבר כדאמרינן בסמוך לר""ע וצ""ל דאתי לגז""ש אבל ודברת בם איצטרך לכמה דברים וכדאמרי' בבבלי ביומא פ""ק כל השח דברים בטלים עובר בעשה דכתיב ודברת בם ולא דרשינן בגז""ש דאיכא למיפרך מה למשוח מלחמה שכן השוטר משמיע בכל לשון משא""כ בק""ש א""נ יליף דבור ואמיר' מדבור. ואמירה ולא ילפי' דבור מדבור ואמירה:",נאמר כאן נגישה וכו',Jerusalem Talmud Sotah 8:1:2,משוח מלחמה למה. בגין דכתיב ודיבר. הרי קרית שמע הרי כתיב בה (דברים ו) ודברת בם והיא נאמרת בכל לשון. אלא בגין דכתיב בה אמירה. הרי פרשת וידוי מעשר הרי כתיב בה אמירה והיא נאמרת בכל לשון. אמר רבי חגיי נאמר כאן נגישה. ונאמר להלן (דברים כא) ונגשו הכהנים בני לוי מה נגישה שנאמר להלן בלשון הקודש אף כאן בלשון הקודש. עד כדון כר' עקיבה דו אמר לשונות ריבויים הן כרבי ישמעאל דו אמר לשונות כפולין הן. אמר רבי חייה בר אבא נאמר כאן נגישה ונאמר להלן (שמות כ) ונגש משה אל הערפל. מה נגישה שנאמר להלן בלשון הקודש אף כאן בלשון הקודש.
Sotah,שיירי קרבן,1,0,34b,"@11לא מסתברא דלא ופקדו שרי צבאות בראש העם ואח""כ נגש הכהן וכו'. @33הנה הרמב""ם פ""ז מה' מלכים לא כתב כן אלא תחלה דבר הכהן והשוטרים משמיעים ואח""כ פקדו שרי צבאות וכו'. ונראה שהיא סובר אין מקרא אמור על הסדר תירוצא הוא וה""ק הן המקרא הסדר דופקדו שרי צבאות היינו לאחר שכבר אמרו כל הדברים על הספר ואח""כ ופקדו ואח""כ אמרו כל הדברים שניים בקרבם ממש אל המלחמה. אך אף שמסתייעא דבריו קצת מ""מ עדיין קשה שאף בזה לא בחר שהרי לאחר שאמר הכהן שני פעמים כתב שפוקדין שרי צבאות ועוד דבסמוך בדברי ר""ח מפורש שאין המקרא אמור על הסדר וע""ש בלח""מ. וצ""ע:",לא מסתברא דלא ופקדו שרי צבאות בראש,Jerusalem Talmud Sotah 8:1:3,לא מסתבר' דלא. ופקדו שרי צבאות בראש העם. ואחר כך ונגש הכהן ודבר אל העם. מאן די מתקון לון הוא משמע לון. אין מקרא אמור על סדר. בספר את אמר שוטר שומע מפי כהן פרשה ואומרה בכל לשון. אבל בערכי המלחמה מספקין מים ומשון ומתקנין את הדרכים. רבי חגיי בעי כמה דתימר בספר שוטר שומע פרשה מפי כהן ואומרה לעם בכל לשון. ואמור אף בערכי המלחמה כן. התיב רבי חייה בר אדא לא מסתברא דלא והיה ככלות השוטרים לדבר אל העם ואחר כך ונגש הכהן ודבר אל העם. אמר ליה מכיון דאת אמר אין מקרא אמור על הסדר לית שמע מינה כלום:
