masechet,commentary,perek,halakha,page,comment,dh,base text ref,base text
Sotah,שיירי קרבן,1,0,20a,"@11דלכן מה אנן אמרין. @33בגליון כתב פי' דאם לא כן דתשתרי אשת כהן אחר שתייתו לבעלה הכהן למה אמרינן שתת ולא בדקו אותה המים טהורה היא ולמה אי אנו אומרים שמא זכות תולה לה אלא ודאי לא אמרינן הכי לכך טהורה לבעלה גם אשת כהן דהכא ע""כ. ואין בדברים אלו טעם הא עד השתא לא ידעינן דיש שום חילוק בין אשת כהן לאשר ישראל דנילוף אשת כהן מאשת ישראל. לכו פירושי שבקונט' עיקר וכ""ה בבבלי בפרקין וכן מורה לשון הסוגיא:",דלכן מה אנן אמרין,Jerusalem Talmud Sotah 4:4:2,דלכן מה אנן אמרין שתת ולא בדקו אותה המים טהורה היא אני אומר הזכות תולה לה. ניחא כמאן דאמר הזכות תולה ואינה ניכרת. ברם כמאן דמר הזכות תולה וניכרת אמר רבי יצחק כן אנן קיימין כששתת ולא היו המים בודקין אותה שלא תאמר הואיל ואין המים בודקין באנוסה אלא במפותה וזו אנוסה היא. מה אנוסה שבכהונה כרצון שבישראל לפום כן צריך מימר מותרת לביתה. ומניין שאונסין פוסלין בכהונה באשת איש. מה אם שרצים הקלים עשה בהן את האונס כרצון. סוטה חמורה לא כל שכן. תני ר' יעקב בר אידי קומי רבי יונתן (במדבר ה) ואת כי שטית תחת אישך וכי נטמאת פרט לאונסין. מה את שמע מינה. אמר ליה מה תחת אישך לרצון אף כאן לרצון. (שם) והיא לא נתפשה. הא נתפשה מותרת. ויש לך תפוסה בישראל והיא אסורה ואי זו זו זו שתחילתה ברצון וסופה באונס ויש לך שאינה תפוסה בישראל והיא מותרת ואי זו זו זו שתחילת' באונס וסופה ברצון. כהדא איתתא אתת לגביה רבי יוחנן אמרה ליה נאנסתי. אמר לה ולא ערב לך בסוף אמרה ליה ואם יטבול אדם אצבעו בדבש ויתננה לתוך פיו ביום הכיפורים שמא אינו רע לו ובסוף אינו ערב לו. וקיבלה.
Sotah,שיירי קרבן,1,0,20a,"@11אני אזמר זכות תלה לה. @33וא""ת א""כ גם באשת ישראל ה""ל למתני דמותרת לבעלה ולא אמרינן דזכות תלה לה וי""ל דעדיפא מיניה קפריך דאפי' באשת כהן ליכא למיחש להכי למ""ד זכות תולה וניכרת:",אני אזמר זכות תלה לה,Jerusalem Talmud Sotah 4:4:2,דלכן מה אנן אמרין שתת ולא בדקו אותה המים טהורה היא אני אומר הזכות תולה לה. ניחא כמאן דאמר הזכות תולה ואינה ניכרת. ברם כמאן דמר הזכות תולה וניכרת אמר רבי יצחק כן אנן קיימין כששתת ולא היו המים בודקין אותה שלא תאמר הואיל ואין המים בודקין באנוסה אלא במפותה וזו אנוסה היא. מה אנוסה שבכהונה כרצון שבישראל לפום כן צריך מימר מותרת לביתה. ומניין שאונסין פוסלין בכהונה באשת איש. מה אם שרצים הקלים עשה בהן את האונס כרצון. סוטה חמורה לא כל שכן. תני ר' יעקב בר אידי קומי רבי יונתן (במדבר ה) ואת כי שטית תחת אישך וכי נטמאת פרט לאונסין. מה את שמע מינה. אמר ליה מה תחת אישך לרצון אף כאן לרצון. (שם) והיא לא נתפשה. הא נתפשה מותרת. ויש לך תפוסה בישראל והיא אסורה ואי זו זו זו שתחילתה ברצון וסופה באונס ויש לך שאינה תפוסה בישראל והיא מותרת ואי זו זו זו שתחילת' באונס וסופה ברצון. כהדא איתתא אתת לגביה רבי יוחנן אמרה ליה נאנסתי. אמר לה ולא ערב לך בסוף אמרה ליה ואם יטבול אדם אצבעו בדבש ויתננה לתוך פיו ביום הכיפורים שמא אינו רע לו ובסוף אינו ערב לו. וקיבלה.
Sotah,שיירי קרבן,1,0,20a,"@11שלא תאמר הואיל ואין המים בודקין באנוסה וכו'. @33כתב הרמב""ם ספ""ג מה""ם אשה שזנתה באונס או בשגגה. וכו' אין המים בודקין אותה שנא' והיא לא נתפשה פרט לאנוסה שהרי נתפשה בחזקה. וכ' הגאון במ""ל לא ידעתי לאיזה תכלית כתב רבינו כל זה ומה בא ללמדני וכו' וכן מאי דקאמר רב ששת בפ""ק דף ו' דסוטה שיש לה עדים במדינת הים דאין המים בודקין אותה וכו' ועוד נ""מ דאם המים בודקין אותה היכא דבאו עדים שהיא טמאה אחר שקדשה מנחתה בכלי נשרפת בדין תורה אבל אי אמרינן שאין המים בודקין אותה אין מנחתה נשרפת אלא מדרבנן גזרה שמא יאמרו מוציאין מכלי שרת לחול וכדאמר ר""א התם ע""כ. ותימא א""כ גם באנוסה אשת כהן נ""מ אם באו עדים ואמרו שנאנסה אם אין המים בודקין אותה מנחתה נשרפת מדאורייתא ואם אין המים בודקין אותה נשרפת מדרבנן דגם זו אינה שותת אחר שבאו לה עדים שנאנסה כמו בישראל שבאו עדים שנטמאה שהרי כבר נתברר הספק שהיא אסורה לו ולא גרעי מאלמנה לכה""ג וכו' דתנן אינן שותות. ועוד נ""מ טובא אם אומרת אח""כ שנאנסה קודם השקאה אע""ג שאינה נאמנת לאסור עצמה על בעלה מ""מ אם מת בעלה אסורה לכל כהן שבעולם וכמ""ש רבינו פי""ח מהא""ב הל""ט ע""ש שאם אין המים בודקין אותה נאמנת לגבי עצמו ואסורה לכהן אחר מיתת בעלה ואם המים בודקין אותה אינה נאמנת אפי' לגבי עצמה ומחזיקין לה בשקרנית או מהימנת באמתלא כל דהו. וגדולה מזו נ""ל דכוונת הרמב""ם לומר אם קינא כהן לאשתו בפירוש כגון שאמר לה אל תסתרי עם פ' שמא יאנוס אותך או שמא תבא לידי שוגג אע""ג דנאסרה עליו ע""י ביאה זו מ""מ כיון שאין המים בודקין אותה על האונס או על השוגג אינה שותה דעיקר הקינוי צריך להיות בדבר האוסרה ובדבר שהמים בודקין אותה. אע""ג דבאשת ישראל פשיטא להגאון במ""ל שם בסוף דבריו דלא הוי קינוי כיון שאינה אסורה לו מ""מ הרמב""ם קמ""ל אף באשת כהן דלא הוי קינוי. ועמש""ל פ' היה ניטל בד""ה אר""ה המתנונה וכו':",שלא תאמר הואיל ואין המים בודקין באנוסה,Jerusalem Talmud Sotah 4:4:2,דלכן מה אנן אמרין שתת ולא בדקו אותה המים טהורה היא אני אומר הזכות תולה לה. ניחא כמאן דאמר הזכות תולה ואינה ניכרת. ברם כמאן דמר הזכות תולה וניכרת אמר רבי יצחק כן אנן קיימין כששתת ולא היו המים בודקין אותה שלא תאמר הואיל ואין המים בודקין באנוסה אלא במפותה וזו אנוסה היא. מה אנוסה שבכהונה כרצון שבישראל לפום כן צריך מימר מותרת לביתה. ומניין שאונסין פוסלין בכהונה באשת איש. מה אם שרצים הקלים עשה בהן את האונס כרצון. סוטה חמורה לא כל שכן. תני ר' יעקב בר אידי קומי רבי יונתן (במדבר ה) ואת כי שטית תחת אישך וכי נטמאת פרט לאונסין. מה את שמע מינה. אמר ליה מה תחת אישך לרצון אף כאן לרצון. (שם) והיא לא נתפשה. הא נתפשה מותרת. ויש לך תפוסה בישראל והיא אסורה ואי זו זו זו שתחילתה ברצון וסופה באונס ויש לך שאינה תפוסה בישראל והיא מותרת ואי זו זו זו שתחילת' באונס וסופה ברצון. כהדא איתתא אתת לגביה רבי יוחנן אמרה ליה נאנסתי. אמר לה ולא ערב לך בסוף אמרה ליה ואם יטבול אדם אצבעו בדבש ויתננה לתוך פיו ביום הכיפורים שמא אינו רע לו ובסוף אינו ערב לו. וקיבלה.
Sotah,שיירי קרבן,1,0,20a,"@11מה אנוסה שבכהונה כרצון שבישראל. @33בבבלי בפרקי. גרסי' אשת כהן פשיטא אר""ה במתנונה דרך איברים מ""ד הא זנויי זנאי והא דלא בדקיה מיא כי אורחיה משום דבאונס זנאי ולגבי כהן אסירא קמ""ל ע""כ וקשה אמאי לא משני כי סוגיין דס""ד כיון שאין המים בודקין את האנוסה תאסור לכהן מספק קמ""ל דאינה נאסרת מספק וי""ל דס""ל לבבלי מדתנן שהיא שותת ממילא ידעינן שהיא מותרת לו דכלום המים באין אלא להתירה לביתה ואס""ד דאסורה מספק ודאי דאונס שותה וכן מפורש לעיל בפרקין אר""י בר' בון כלום המים באין אלא להתירה לביתה וכו' לפיכך צ""ל במתנונה בכה""ג והא דחיישינן לה מספק דאיכא רגלים לדבר אבל ר' יצחק לית ליה הא דר""י בר' בון. ועי""ל דסובר הבבלי כיון דכתיב ונקה האיש מעון ללמד אם תלתה לה זכות שהבעל מנוקה ש""מ דמותרת לו מיד לאחר השתי' ואינה נאסרת מספק כ""ש הכא בכהן דאינה נאסרת מספק דא""כ תהא אסורה לי לעולם. ועמש""ל פ' היה נוטל דף י""ב בד""ה אר""ה וכו':",מה אנוסה שבכהונה כרצון שבישראל,Jerusalem Talmud Sotah 4:4:2,דלכן מה אנן אמרין שתת ולא בדקו אותה המים טהורה היא אני אומר הזכות תולה לה. ניחא כמאן דאמר הזכות תולה ואינה ניכרת. ברם כמאן דמר הזכות תולה וניכרת אמר רבי יצחק כן אנן קיימין כששתת ולא היו המים בודקין אותה שלא תאמר הואיל ואין המים בודקין באנוסה אלא במפותה וזו אנוסה היא. מה אנוסה שבכהונה כרצון שבישראל לפום כן צריך מימר מותרת לביתה. ומניין שאונסין פוסלין בכהונה באשת איש. מה אם שרצים הקלים עשה בהן את האונס כרצון. סוטה חמורה לא כל שכן. תני ר' יעקב בר אידי קומי רבי יונתן (במדבר ה) ואת כי שטית תחת אישך וכי נטמאת פרט לאונסין. מה את שמע מינה. אמר ליה מה תחת אישך לרצון אף כאן לרצון. (שם) והיא לא נתפשה. הא נתפשה מותרת. ויש לך תפוסה בישראל והיא אסורה ואי זו זו זו שתחילתה ברצון וסופה באונס ויש לך שאינה תפוסה בישראל והיא מותרת ואי זו זו זו שתחילת' באונס וסופה ברצון. כהדא איתתא אתת לגביה רבי יוחנן אמרה ליה נאנסתי. אמר לה ולא ערב לך בסוף אמרה ליה ואם יטבול אדם אצבעו בדבש ויתננה לתוך פיו ביום הכיפורים שמא אינו רע לו ובסוף אינו ערב לו. וקיבלה.
Sotah,שיירי קרבן,1,0,20a,"@11מה אם שרצים הקלים וכו'. @33כתב בז""ר וצ""ע לענין טומאת שרצים כהן וישראל שוין וי""ל דישראל לא איכפת ליה בטומאה משא""כ כהן נפסל בטומאה מלאכול בתרומה:",מה אם שרצים הקלים וכו',Jerusalem Talmud Sotah 4:4:2,דלכן מה אנן אמרין שתת ולא בדקו אותה המים טהורה היא אני אומר הזכות תולה לה. ניחא כמאן דאמר הזכות תולה ואינה ניכרת. ברם כמאן דמר הזכות תולה וניכרת אמר רבי יצחק כן אנן קיימין כששתת ולא היו המים בודקין אותה שלא תאמר הואיל ואין המים בודקין באנוסה אלא במפותה וזו אנוסה היא. מה אנוסה שבכהונה כרצון שבישראל לפום כן צריך מימר מותרת לביתה. ומניין שאונסין פוסלין בכהונה באשת איש. מה אם שרצים הקלים עשה בהן את האונס כרצון. סוטה חמורה לא כל שכן. תני ר' יעקב בר אידי קומי רבי יונתן (במדבר ה) ואת כי שטית תחת אישך וכי נטמאת פרט לאונסין. מה את שמע מינה. אמר ליה מה תחת אישך לרצון אף כאן לרצון. (שם) והיא לא נתפשה. הא נתפשה מותרת. ויש לך תפוסה בישראל והיא אסורה ואי זו זו זו שתחילתה ברצון וסופה באונס ויש לך שאינה תפוסה בישראל והיא מותרת ואי זו זו זו שתחילת' באונס וסופה ברצון. כהדא איתתא אתת לגביה רבי יוחנן אמרה ליה נאנסתי. אמר לה ולא ערב לך בסוף אמרה ליה ואם יטבול אדם אצבעו בדבש ויתננה לתוך פיו ביום הכיפורים שמא אינו רע לו ובסוף אינו ערב לו. וקיבלה.
Sotah,שיירי קרבן,1,0,20b,"@11ולא יקנא לה. @33הא דלא פריך מיד ארישא מנ""ל דמקנא לה ב""ד י""ל דקסבר כיון דזכות הוא לו זכין לאדם שלא בפניו אבל השתא דקאמרת דקפיד קרא אהשקאה שתהא ע""י עצמו אף דזכות הוא לו קשיא ליה שפיר מנ""ל דמקנאין לה:",ולא יקנא לה,Jerusalem Talmud Sotah 4:5:3,וקינא וישקינה. גזירת הכתוב היא והביא האיש את אשתו אל הכהן. ולא יקנא לה. התורה אמרה וקינא את אשתו. וקינא את אשתו אפילו מקצת אשתו.
Sotah,שיירי קרבן,1,0,20b,"@11התורה אמרה וקינא את אשתו וכו'. @33וקשה אף דמרבינן מקצת אשתו מ""מ מנ""ל דב""ד מקנין דאפי' מקצת אשתו ליכא. לכן נ""ל דה""ג וקינא את אשתו אפי' מקצת אשתו וקינא את אשתו אפי' ב""ד. וה""פ תלתא זימני כתיב וקינא את אשתו בפרשה תרי זימני בריש פרשה ואחד בסופה וקאמר דחד לגופא וחד אפי' מקצת אשתו דאין מיעוט אתר מיעוט אלא לרבות וחד לרבות דאפי' ב""ד מקנין. מיהו לפימ""ש בקונט' דמדבר אל ב""י מרבי' שב""ד מקנין קשה למה לי קרא דוקינא את אשתו וי""ל דקסבר דאיצטרך דבר אל ב""י למעט עכו""ם וגרים:",התורה אמרה וקינא את אשתו וכו',Jerusalem Talmud Sotah 4:5:3,וקינא וישקינה. גזירת הכתוב היא והביא האיש את אשתו אל הכהן. ולא יקנא לה. התורה אמרה וקינא את אשתו. וקינא את אשתו אפילו מקצת אשתו.
Sotah,שיירי קרבן,1,0,20b,"@11רי""א אומר כל שזרעו פוסל וכו'. @33פירשתי בקונט' דלת""ק אף מצרי שני פוסל וקשה מנ""ל דפוסל דהא ליכא למילף במה הצד אלא כל שזרעו פסול וי""ל ת""ק סובר דילפי' מה הצד מאיסורי כהונה ועיי' בבבלי ביבמות בתוס' בד""ה מה לאלמנה וכו':","רי""א אומר כל שזרעו פוסל וכו'",Jerusalem Talmud Sotah 4:5:4,ביאת פסולין מניין שהיא פוסלה. מה אנן קיימין אם כאשת איש חמורה היא. אם כאלמנה לכהן גדול כבר כתיב (במדבר ד) והביא האיש את אשתו אל הכהן. הצד השווה שבהן את שזרעו פסול ביאתה פוסלת. ואת שאין זרעו פסול אין ביאתו פוסלת. ואילו הן בן תשע שנים ויום אחד גר עמוני ומואבי אדומי מצרי עבד ממזר חלל נתין כותי וגוי שבאו על בת כהן על בת לוי ועל בת ישראל פוסלת מן הכהונה. רבי יוסי אומר כל שזרעו פסול ביאתו פוסלת. וכל שאין זרעו פסול אין ביאתו פוסלת. רבן שמעון בן גמליאל אומר כל שאת מותר בבתו את מותר באלמנתו. וכל שאין את מותר בבתו אין את מותר באלמנתו:
Sotah,שיירי קרבן,1,0,20b,@99הדרן עלך פרק ארוסה,,Jerusalem Talmud Sotah 4:5:4,ביאת פסולין מניין שהיא פוסלה. מה אנן קיימין אם כאשת איש חמורה היא. אם כאלמנה לכהן גדול כבר כתיב (במדבר ד) והביא האיש את אשתו אל הכהן. הצד השווה שבהן את שזרעו פסול ביאתה פוסלת. ואת שאין זרעו פסול אין ביאתו פוסלת. ואילו הן בן תשע שנים ויום אחד גר עמוני ומואבי אדומי מצרי עבד ממזר חלל נתין כותי וגוי שבאו על בת כהן על בת לוי ועל בת ישראל פוסלת מן הכהונה. רבי יוסי אומר כל שזרעו פסול ביאתו פוסלת. וכל שאין זרעו פסול אין ביאתו פוסלת. רבן שמעון בן גמליאל אומר כל שאת מותר בבתו את מותר באלמנתו. וכל שאין את מותר בבתו אין את מותר באלמנתו:
Sotah,שיירי קרבן,1,0,20b,"@11מ""ד באו באו ר""ע. @33פירשתי בקונט' דמקראי יתירא דריש ולא מוי""ו לפ""ז הא דקאמר בסמוך מ""ד נטמתה נטמאה ר""ע נמי ה""פ דאתיא כר""ע דלא דריש וי""ו וקשה א""כ אימא סיפא ר' אומר שני פעמים נטמאה נטמאה וכו' ש""מ דר""ע לא דריש מיתורא אלא מוי""ו דאל""כ במאי פליגי והא ודאי שכן דרך ש""ס ירושלמי לפרוך היכא דאיכא לשונות כפולים הניחא לר""ע אלא לר""י וכ""מ ביבמות פ' הערל אבל כאן נראה דר""ע דריש וי""ו ויתור' מוקי לדרשא אחרינא כמפורש בבבלי בפרקין ואפשר לו' דסובר דר' בא לפרש דברי ר""ע ודוחק. לכן נ""ל להגיה אנן תנינן באו ובאו וכו' וכן בסמוך אנן תנינן נטמאה ונטמאה וה""פ ר""ע דריש כולא מחד קרא מיתירא ומוי""ו ור""י דריש מתרי ווי""ן ויתורא לא דריש וצ""ע:","מ""ד באו באו ר""ע",Jerusalem Talmud Sotah 5:1:2,אנן תנינן באו באו. אית תניי תני ובאו ובאו. מאן דמר באו באו ר' עקיבה. ומאן דמר ובאו ובאו ר' ישמעאל. אנן תנינן נטמאה נטמאה. אית תניי תני ונטמאה ונטמאה. מאן דמר נטמאה נטמאה ר' עקיבה. ומאן דמר ונטמאה ונטמאה ר' ישמעאל.
Sotah,שיירי קרבן,1,0,20b,"@11ואפי' באמצע התיבה ויצקת עליה שמן וכו'. @33במנתות דף ע""ה גרסי' קרבנך קרבנך לגז""ש וכו' ומה להלן במחבת יציקה ובלילה אף כאן במרחשת יציקה ובלילה. וכתבו תוס' תימה למה לי גז""ש תיפוק ליה דמרבינן בסמוך מדכתיב מנחה לרבות כל המנחות ליציקה ע""כ. והא דכתבו דמרבינן בסמוך הייני דגרסי' התם בדף הנ""ל ת""ר ויצקת שמן מנחה לרבות כל המנחות ליציקה יכול שאני מרבה אף מנחת מאפה ת""ל עליה שמן. ונ""ל דל""ק דמאן דאיצטרך גז""ש סובר דלא אמרינן גורעין ומוסיפין ודורשין דהא בבבלי פ' יש נוחלין פליגי תנאי אי אמרינן גורעין ומוסיפין ודורשין באותיות וכ""ש בתיבות ואפי' למ""ד גורעי' וכו' אמר רבא התם סכינא חריפא מפסק' קראי ופירשב""ם שאתה מסרס התיבות לעשות מוקדם מאוחר ומאוחר מוקדם. והאי תנא דיליף ממנחה סובר דגורעין ומוסיפין אפי' בתיבות. והבן כי הם דברים נכונים לפום סוגיין. ועיי' במ""ל פי""ג מהמע""ק הלכה ה' שהאריך בדברי תוס' אלו ולא הרגיש במ""ש. @11היא ע""י שדרכה וכו'. @33הנה הגאון בעל מ""ל פ""ב מה""ס הלכה י""ב האריך בסוגי' זו ובקצת דבריו יש לי מקום עיון ופירשתי הסוגי' בענין אחר. מ""ש שם בד""ה ודע דכל האי שקלא וטרי' דירושלמי הוא למ""ד זכות תולה וניכר אבל למ""ד זכות תולה ואינו ניכר אין אנו צריכין לכל זה ע""כ. לא ידעתי איך נפרש הא דקאמר הש""ס מעתה גירש יהא מותר בה למ""ד זכות תולה ואינו ניכר דלדידיה כשהיא נבדקת מתה מיד ובבדקו אותה קיימינן. א""כ מאי אין א""צ דקאמר הרב הא א""א דאתיא כמ""ד זכות תולה ואינו ניכר. ומש""ע בד""ה עוד יש לחקור במה שסיי' הירושלמי ומנין שהדבר תלוי בה וכו' וקשיא לי למה לא פשטוה מדכתיב והיא לא נתפשה הא נתפשה מותרת דמהכא גמרינן בש""ס דילן דכל באונס שריא לבעלה והכתוב לא תלה האונס אלא בה ע""כ. הנה מ""ש דמהכא גמרינן בש""ס דילן וכו' אינו מדוקדק דאף בירושלמי לעיל פ' הארוסה משמע דיליף היתר אנוסה מוהיא לא נתפשה ע""ש. ועיקר קושיתו כבר ישבתי בפירושי שבקנט'. ומש""ע בד""ה וראיתי להתוס' פ""ק דסוטה וכו' ע""ש. כבר הארכתי בזה לעיל פ' היה נוטל בפירושי ובתוס' וכיוונתי בע""ה לדעתו. ומש""ע בד""ה ודע דרבי' ז""ל וכו' אך עדיין אני תמיה בזה היכא דבדקו אותו ולא אותה והיה הבעל כהן היכי לידיינו להאי דינא וכו' מלבד שהדין הוא תמיה בעיני דאיך תאסר אשה לבעלה משום דצבתה בטנו של בועל וכו' ע""כ. ולא ידעתי למה תמה ע""ז הרי עלה בדעת התו' לומר לאוסרה מספק שמא תלה לה זכות וכמ""ש דבריהם שם וגם בפ' ארוסה בבבלי דף כ""ו היכא דמתנונה דרך אברים ס""ד לאסרה שמעינן היכא דאיכא למיחש חיישינן אתר שהיה לה קינוי וסתירה למה לא נאסור אותה בצביית בטנו של בועל שהרי אפי' שמע מעוף הפורח יוצי' כדתנן לקמן פ""ו ומש""ע בד""ה עוד יש לי חקירה אתת וגדולה היא אלי וכו'. והרב המפה ר""ס י""א על מ""ש מרן כשם שהוא אסורה לבעלה כך אסורה לבועל כתב וז""ל וה""ה אם נאסרה בשבילו לבעלה אסורה לו ע""כ ולא ידעתי כוונת הרב מה היא וכו' ודברי הב""ש שם ס""ק ג' דחוקים הרבה בעיני ע""כ. ואני אומר דצריכין להגיה דברי הרב וכצ""ל וה""ה אם לא נאסרת בשבילו לבעלה אסורה לו. וכוונתו אם בא על אשת ישראל והוא מזיד והיא שוגגת דאינה נאסרת על בעלה ואסורה לבועל כמפורש כאן בסוגיין וזה נ""ל ברור בכוונת הרב רמ""א ז""ל:",ואפי' באמצע התיבה ויצקת עליה שמן וכו',,
