masechet,commentary,perek,halakha,page,comment,dh,base text ref,base text
Sotah,שיירי קרבן,1,0,13a,"@11ולא מעיני יבמה. @33כתב המהרש""א בתו' הנ""ל וז""ל כ' מהרש""ל ומ""מ מקני לה שמקצת אשתו היא עכ""ל נרא' שהבין דלההוא תירוצא דבירושלמי דאפי' למקצת אשתו מקנא י""ל נמי דמותרת לביתה וא""א לומר כן כיון דמותרת לביתה לא הוה מתנ' עמה אלא דלהאי תירוצ' מוקמינן מתני' כרבנן דאסורה לביתה דאשתו ואפי' מקצת אשתו כתיב ולא איכפת לן בתפיסת קידושין ובממזרו' אבל לר' ינאי דהכא דס""ל דמותרת לביתה ע""כ דלי' לן לאוקמי מתני' אלא כר""ע ע""כ. ול""נ דאף המהרש""ל מודה דמתני' דהכא אתיא כר""ע אלא דקשיא הא דתנן לקמן פ""ד ארוסה ושומרת יבם לא שותות וכו' ודייקינן בבבלי מישתא הוא דלא שתיא אבל קינוי מקנא לה ובברייתא התם יליף מקרא דכתיב דבר אל בר ישראל לרבות שומרת יבם לקינוי אלא ודאי דלכ""ע שומרת יבם מקנא לה אלא דר' אילא סובר מדמקנא לה להשקותה אח""כ כשהיא נשוא' היינו אפי' אזנות שזינתה כשהיתה שומרת יבם דאסורא לביתה דאל""כ כל שתיבעל ולא היתה אסורה לו לא היה מתנה עמה כדתנן במתני'. וסתמא דש""ס ור' ינאי סוברים שלא היה מתנה עמה על זנותה כשהיתה שומרת יבם אלא להשקותה אח""כ על הקינוי שהיה מקודם ומתני' דתנן שלא שטיתי שומרת יבם כר""ע אתיא מיהו לפמ""ש תוס' ד""ה ארוסה דמתני' איירי בשבא עליה יבם בבית אחיו קשיא:",ולא מעיני יבמה,Jerusalem Talmud Sotah 2:5:6,מה תנא הדא מתניתא לא רבנן ולא רבי עקיבה אלא כיני מאן דמר מותרת לביתה דרבנן דלא כרבי עקיב'. ומאן דמר אסורה לביתה רבי עקיבה דלא כרבנן. אמר רבי ינאי שומרת יבם שזינת מותרת לביתה. ותני כן (במדבר ה) ונעלם מעיני אישה. ולא מעיני יבמה ר' יעקב בר זבדי בשם ר' אבהו מעשה היה וכהנת הייתה והתירוה לביתה. אמר ר' יוסי בר רבי בון אף לא מכות אין בה.
Sotah,שיירי קרבן,1,0,13a,"@11וכהנת היתה והתירוה לביתה. @33כתב בש""ע א""ע סי' ו' סעי' ח' וכן יבמה שבא עליה זר עשאה זונה. וכ""כ הרמב""ם פי""ח מהא""ב. וכ' הה""מ דכ""ש הוא משאר חייבי לאוין דהא מספקא לן אם קידושין תופסין ביבמה ע""כ וקשה הרי מפורש כאן דמותרת אפי' ליבם כהן ותו' בד""ה הנ""ל מביאי' דברי הירושלמי זה. והטעם פשוט להיתירא דלאו חייבי לאוין היא בזנות וכמש""ל וכדפירשתי בקונט' וכן פירש המהרש""א וי""ל כיון דס""ל להרמב""ם דיש זונה מחייבי לאוין ויש לזה ראי' מבבלי ביבמות פ' אלמנה וכמ""ש הה""מ א""כ ע""כ לומר דהירושלמי פליג דודאי לאו אית בה ביבמה לכ""ע כמ""ש תוס' ס""פ החולץ. מיהו הטור א""ע סי' ו' כתב דאין זונה מחייבי לאוין חוץ מהבא על היבמה שעשאה זונה. והיינו מטעם שאין הקידושין תופסין בה וכמ""ש הב""י לדידי' קשה מסוגיין דמפורש דמותרת לכהן. ודוחק לומר דסובר דמ""ד מותרת לכהן סובר דקידושין תופסין ביבמה דפשטא דלישנא משמע דאליבא דר' ינאי דאמר דמותרת לביתה קאמר דמותרת לכהן ור""י ס""ל דאין קידושין תופסין ביבמה כמפורש לעיל בסוגיין ואף שכתבו תוס' דמשמע דפליג ר' ינאי אר' ינאי כבר כתבתי לעיל בד""ה א""ר ינאי דלא פליגי וכן דעת הטור וצ""ע:",וכהנת היתה והתירוה לביתה,Jerusalem Talmud Sotah 2:5:6,מה תנא הדא מתניתא לא רבנן ולא רבי עקיבה אלא כיני מאן דמר מותרת לביתה דרבנן דלא כרבי עקיב'. ומאן דמר אסורה לביתה רבי עקיבה דלא כרבנן. אמר רבי ינאי שומרת יבם שזינת מותרת לביתה. ותני כן (במדבר ה) ונעלם מעיני אישה. ולא מעיני יבמה ר' יעקב בר זבדי בשם ר' אבהו מעשה היה וכהנת הייתה והתירוה לביתה. אמר ר' יוסי בר רבי בון אף לא מכות אין בה.
Sotah,שיירי קרבן,1,0,13a,"@11כבר כתיב והביא האיש את אשתו אל הכהן. @33כחב במ""ל פ""ב מה""ס הלכה ו' הנראה דס""ל לירושלמי והביא האיש את אשתו הוא ריבוי לרבות ישראל שנשא גיורת שמשקה אותה אך לא ידעתי למה לא נקיט קרא דוקנא האיש אח אשתו וכו' ואני תמי' על הירושלמי הזה באם עקביא מודה בישראל שנשא גיורת אמאי קאמר שאין משקין את הגיורת דהא טעמי' הוא משום דהבעל הוא גר דאי משום דידה היו משקין אותה מדכתיב והביא האיש את אשתו ואולי משום רבנן נקט הכי דטעמייהו משום דנשא גיורת משקין אותה ע""כ. והנה הקושיא ראשונה יש ליישב דוקנא את אשתו איצטריך לרבות אפי' מקצת אשתו וכדאמרינן לעיל בפרקין ולקמן ר""פ נוטל וקושיתו השני' לאו קושיא היא לפי מאי דפירשתי בקונט' דוהביא האיש אח אשתו למעוטי קאתי. וע""כ לומר כן דמבני ישראל ליכא למעוטי ישראל שנשא גיורת כי אם גר ולמה לי קרא לרבויי א""ו כדפרישית דלמעוטי קאתי. ומש""ע הרב הנ""ל דהרמב""ם לא חש לדברי הירושלמי דבבבלי תניא בהדיא אשת הגר שותה ע""כ. אינו מוכרח דאשת הגר אפשר לפרש גר שנשא גיורת וכמ""ש הוא עצמו שם בסמוך. אלא הכי י""ל דלשון הש""ס בבבלי משמע דלא דרשי' בני ישראל למעט גרי' וע""ש דף כ""ו ע""א. ומש""ע ומאי דאמרי' בגמר' דואמרת ריבוי' הוא הכוונה היא דכתיב אליהם וכמ""ש הראב""ד דמשמע שהם שוים ובזה יתיישב קושית תוס' תימא והא אפיקתי' לעיל לרבות ארוסה ושומרחת יבם לקינוי ולפי הירושלמי ניחא דמלת אליהם קא דריש ע""כ. לא ידעתי איך נדרוש ממלת אליהם ריבוי' לגר גם אין דברי הראב""ד משמעין כן אלא כיון דמואמרת דרשי' הרבוי וכתיב ואמרת אליהם ש""מ דבעינן שיהו שוין. וזה מבואר מלשון הירושלמי דמסיק ואמרת אליהם לרבות כל הכתוב בפרשה וכו'. ול""נ לתרץ קושית תוס' דכיון דמרבי' מואמרת כל ששכיבתה אוסרתה בעלה מקנא ומשקה מרבינן הכל שומרת יבם וארוסה ואשת הגר אלא דשומרת יבם אימעיטו משתיי' מקרא כדר' יונתן כמפורש בבבלי פ' ארוסה אבל לענין קינוי לא נתמעטו ובכן גיור' לישראל ובת ישראל לגר נמי נתמעטו מקרא כמפורש כאן וזה מבואר בדברי רש""י דף כ""ד בד""ה ה""ג דבר אל בני ישראל ואמרת אליהם לרבו' ארוס' וכו' ול""ג איש איש דלדרשא אחרינא דרש לי' לקמן אלא ריבוי' מואמר' אליהם וה""נ אמרי' לקמן בפרקין ואמרת ריבוי' הוא ע""כ וקשה למה ניחא לי' מואמר' הא נמי איצטריך לדרשא אחרינ' כמ""ש בעצמו אלא ודאי דמואמרת מרבינן כל מילי אבל לא מאיש איש. וא""ת תקשי למ""ד שומרת יבם שזינתה מותרת לביתה מנ""ל דמקנין לה וי""ל כבר תירצו תוס' בר""פ ארוסה דמתני' איירי כגון שבא עליה יבם בבית אחיו וכו' ע""ש והדברים ברורים באין גמגום. שוב ראיתי בשו""ת אמונת שמואל סי' ז' שכתב ברבה פ' נשא גרסי' דבר אל בני ישראל ע""י ישראל מקנאין ולא ע""י עכו""ם וכו' או אינו ב""י לרבות גרי' א""ר איש איש לרבות גרי' ומפרש הרמב""ם דאאשת הגר קאי וכו' ומשמע לי' דאפי' בנשא ישראלית ודחה האי ירושלמי מהאי דספרי ע""כ ואני תמה דודאי לית לי' להבבלי הך דרשא לרבות שהרי מפורש בר""פ הארוסה ובסופו דאיצטריך איש איש לרבות אשת חרש והרמב""ם כתב דין זה בפ""ק מה""ס וכן מפורש בדברי רש""י שהבאתי בסמוך. ואם נאמר שכוונתו דהרמב""ם סובר דבני ישראל איצטריך לדרשא המדרש דאין מקנאין ע""י עכו""ם לא ממעטים גרים הא ודאי ליתא שהרי בריש הלכות סוטה כ' דמקנין ע""י עכו""ם וכר""ה דאמר הכי בפ' ארוסה:",כבר כתיב והביא האיש את אשתו אל,Jerusalem Talmud Sotah 2:5:9,"תמן תנינן אין משקין את הגיורת וכו'. וחכמים אומרים משקין. מה אנן קיימין אם בישראל שנשא גיורת כבר כתיב בני ישראל לא גרים. אם בגר שנשא בת ישראל כבר כתיב והביא האיש את אשתו אל הכהן. אלא כן אנן קיימין בגר שנשא גיורת. ומה טעמא דר""ע בני ישראל לא גרים. מה טעמון דרבנן ואמרת אליהם לרבות כל הכתוב בפרשה. ומה כתוב בפרשה. (שם) ושכב איש אותה שכיבתה אוסרת' בעלה מקנא ומשקה."
Sotah,שיירי קרבן,1,0,13a,"@11מתניתא דר""י פוטרו מכל מצות וכו'. @33וקשה לר""י למה לי ונעלם מעיני אישה למעט סומא כיון דפטור מכל המצות א""כ אף זינתה תחתיו אינה נאסרת עליו וכל שתיבעל ואינה נאסרת עליו לא היה מתנה עמה כדתנן במתני' ברישא. לכן נ""ל דה""ג מתני' דלא כר""י וכו' וה""פ הא דתניא ונעלם מעיני אישה למעט סומא והא דתניא בין הוא סומא בין היא סומא נמי אתיא כרבנן דלר""י לא צריך קרא למעט ובבבלי ס""פ ארוסה יליף לה מדכתיב אשה תחת אישה שיהיו שניהם שוין בשלימות גופן:","מתניתא דר""י פוטרו מכל מצות וכו'",Jerusalem Talmud Sotah 2:5:10,ונעלם מעיני אישה פרט לסומ' שאין לו עינים. הוא סומה היא סומה. מתניתא דרבי יודן פוטרו מכל מצות האמורות בתורה:
Sotah,שיירי קרבן,1,0,13a,"@11נסתרה לאחר ונטמאה. @33פירש""י דאינה נאסרת עליו לחזור לו אא""כ נישא' ע""י קידושין דכי כתיב לא יוכל וכו' אחר קידושיו ונשואין כתיב כדכתיב והיתה לאיש אחר ע""כ. וקשה ששנה משנתו כר' יוסי בן כיפר דאמר הכי ביבמות דף י""ח ע""ב דמחזיר גרושתו מן האירוסין מותרת אבל חכמים אומרים אחת זו ואחת זו אסורה. וכן פסקו כל הפוסקים הלכה כחכמים. ועמ""ש ביבמות פ' החולץ בתו' בד""ה המחזיר גרושתו:",נסתרה לאחר ונטמאה,Jerusalem Talmud Sotah 2:6:1,הכל שוין שאינו מתנה עמה קודם לשנתארסה ולא משנתגרשה נסתרה לאחר וניטמאת ואחר כך החזירה לא היה מתנה עמה זה הכלל כל שתיבעל ולא תהא אסורה לו לא היה מתנה עמה:
Sotah,שיירי קרבן,1,0,13b,"@11או מאחר שאין המים בודקין את האשה שהיא אסורה לביתה טמאה היא. @33וקשה מאי מספקא ליה פשיטא שאינה ניחתרת בשתייה זו והרי היא באיסורה עומדת לביתה ולמה יגרע ביאה זו מבא עליה בעלה בדרך דתנן לקמן פ""ד שיוצא' ונוטלת כתובה (ועיי' במ""ל פ""ב מה""ס הלכה ה) וי""ל שסובר אף לאחר סתירה נמי יכול למחול ואיכא בבבלי הארוסה מאן דסבר הכי ומספקא לי' אם גירש כמו שמחל אף לאחר סתירה:",או מאחר שאין המים בודקין את האשה,Jerusalem Talmud Sotah 2:6:2,אמר ר' ינאי פשיטא שאדם מוחל על קינויו. גירש כמי שמחל. היך עבידא קינא לה ונתגרשה והחזירה ונסתרה. אין תימר גירש כמי שמחל צריך לקנות לה פעם שנייה. אין תימר גירש כמי שלא מחל אין צריך לקנות לה פעם שנייה. אבל אם קינא לה ונסתרה וידע בה וגירשה והחזירה ונסתרה שתת ולא בדקו אותה המים טהורה היא. או מאחר שאין המים בודקין את האשה שהיא אסורה לביתה טמאה היא:
Sotah,שיירי קרבן,1,0,13b,@99הדרן עלך פרק היה מביא,,Jerusalem Talmud Sotah 2:6:2,אמר ר' ינאי פשיטא שאדם מוחל על קינויו. גירש כמי שמחל. היך עבידא קינא לה ונתגרשה והחזירה ונסתרה. אין תימר גירש כמי שמחל צריך לקנות לה פעם שנייה. אין תימר גירש כמי שלא מחל אין צריך לקנות לה פעם שנייה. אבל אם קינא לה ונסתרה וידע בה וגירשה והחזירה ונסתרה שתת ולא בדקו אותה המים טהורה היא. או מאחר שאין המים בודקין את האשה שהיא אסורה לביתה טמאה היא:
Sotah,שיירי קרבן,1,0,13b,"@11היה נוטל. ולקח הכהן וכו'. @33כתבו תוס' בר""ת מכאן משמע הכהן היה נוטל ולא הבעל כדפירש""י ומצינו למימר שהקידוש כשר בזר מיהו מצוה בכהן ליטול המנחה מידה ומאחר שהוא נוטלה הוא נותנה כמו כן לתוך כלי שרת:",היה נוטל,Jerusalem Talmud Sotah 3:1:1,היה נוטל את מנחתה מתוך כפיפה מצרית ונותנה לתוך כלי שרת ונותנה על ידיה וכהן מניח את ידו תחתי' ומניפה הניף והגיש קמץ והקטיר והשאר נאכל לכהנים:
Sotah,שיירי קרבן,1,0,13b,"@11ואין הדבר כאור וכו'. @33כתבו תוס' במנחות דף ס""א ע""ב בד""ה כהן מניח ידו תחת יד בעלי' ' ומניף לאו דוקא תתת יד הבעלי' ממש דא""כ ה""ל חציצה בין הכלי ובין יד הכהן וכו' ובקונט' פי' דתנופת הכהן לא איכפת לן אם יש בה חציצה דעיקר תנופה בבעלים היא וקשה מנ""ל הא הא תרווייהו כתיבי ובירושלמי משמע קצת דהוי ממש דגרסי' ואין הדבר כעור וכו' איך יצה""ר מצוי לשעה מיהו מצינו למימר דאע""פ שזה למטה וזה למעלה פעמים נוגעין ידיו בידה ע""י שמתיחד בתנופה ע""כ. הנה מהירושלמי הזה ודאי קשיא אפירש""י דמדפריך ואינו חוצץ שמעינן דאף תנופת הכהן צריך שלא יהא בה חציצה. אך קשה הא מין במינו הוא ואינו חוצץ וי""ל בקדשים אפי' במינו חוצץ כדתנן בפ""ב דזבחים ע""ג רגליו של חבירו פסול דה""ל חציצה וא""ל דגזירת הכתוב הוא להכשיר הנחת יד בהן תחת יד בעלים ולא הוי חציצה וכ""כ תוס' בקידושין דף ל""ו ע""ב בד""ה הכהן וכו'. דאיכא לקיים תניפת כהן בענין דלא ליהוי חציצה שהבעלים אוחזין באוגני הכלי והכהן בשוליו מלמטה וכמ""ש תוס' שם במנחות ובקידושין וכ""מ במתני' בביכורים:",ואין הדבר כאור וכו',Jerusalem Talmud Sotah 3:1:2,כתיב (במדבר ה) ולקח הכהן מיד האשה את מנחת הקנאות וכי על ידו הוא מניף. ולא על ידה הוא מניף. אלא מיכן שהוא נוטלה מתוך כלי חול ונותנה בכלי שרת וכהן מניח את ידו תחתיה ומניפה. ואין הדבר כאור. מביא מפה. ואינו חוצץ. ומביא כהן זקן אפי' תימר ילד שאין יצר הרע מצוי לשעה. תני ר' חייה סוטה גידמ' שני כהנים מניפין על ידיה.
Sotah,שיירי קרבן,1,0,13b,"@11תני ר""ח סוטה גידמת שני כהנים מניפין על ידיה. @33וקשה הא כתיב ונתן על כפיה וליכא וי""ל דקסבר ר""ח דלא בעינן קרא כדכתיב וכ""כ תוס' אך קצת קשה על הרמב""ם שפסק בפ""ב מה""ס דגידמת אינה שותת משמע דסובר בעינן קרא' כדכתיב ובפ""ח מה' נזירות פסק דנזיר ממורט א""צ העברת תער משמע דסובר דלא בעינן קרא כדכתיב ועיין בתוי""ט פי""ד דמסכת נגעים ובלח""מ ה' נזירות וי""ל:","תני ר""ח סוטה גידמת שני כהנים מניפין",Jerusalem Talmud Sotah 3:1:2,כתיב (במדבר ה) ולקח הכהן מיד האשה את מנחת הקנאות וכי על ידו הוא מניף. ולא על ידה הוא מניף. אלא מיכן שהוא נוטלה מתוך כלי חול ונותנה בכלי שרת וכהן מניח את ידו תחתיה ומניפה. ואין הדבר כאור. מביא מפה. ואינו חוצץ. ומביא כהן זקן אפי' תימר ילד שאין יצר הרע מצוי לשעה. תני ר' חייה סוטה גידמ' שני כהנים מניפין על ידיה.
Sotah,שיירי קרבן,1,0,13b,"@11מהו מגיש גופה של מנחה גופה של כלי. @33בבבלי פ' היה מביא דף י""ד ע""ב פשט ליה דבגופה של כלי סגי דכתיב והקריבה אל הכהן וגו' והגישה אל המזבח מה הקרבה אצל כהן בכלי אף הגשה אצל מזבח בכלי:",מהו מגיש גופה של מנחה גופה של,Jerusalem Talmud Sotah 3:1:3,אמר רבי יוסי בכל אתר הדא היא מילתא צריכין לרבנן מהו מגיש גופה של מנח' גופה של כלי.
Sotah,שיירי קרבן,1,0,13b,"@11אר""י סוטה לחידושה יצאת וכו'. @33במנחות דף ס""א ע""א תנן תנופות קודמות' להגשות ופרש""י ומנין שהתנופה קודם דכתיב במנחת סוטה והניף אח המנחה לפני ה' והדר והקריב אותה אל המזבח ע""כ וכ""פ הר""ב. ותימא הא מפורש אר""י דמסוטה אין ללמוד דחידוש הוא ואין למידין ממנו אלא מוהבאת את המנחה וכו' יליף כדמסיק בסוגיין וצ""ע ועמ""ש לקמן בתו' בד""ה אלא אזכרה וכו':","אר""י סוטה לחידושה יצאת וכו'",Jerusalem Talmud Sotah 3:1:4,תנופות מניין שהן קודמות להגשות. רבי ירמיה בשם רבי פדת מסוטה למדו. אמר ר' יוסי סוטה לחידושה יצאת ודבר שהוא יוצא לחידושו אין למדין הימינו רבי בון בר חייה שמע לה מן הדא (ויקרא ו) וזאת תורת המנחה הקרב היכן היא תנופה כבר קדמה. אמר ר' יוסי תיפתר במנחות שאינן טעונות תנופה ולית שמע מינה כלום ויידא אמרה דא מדין (ויקרא ב) והבאת לרבות מנחת העומר להגשה והקריבה לרבו' מנחת סוטה להגשה. וכתיב בתרי והרים. והיכן היא תנופה כבר קדמה.
Sotah,שיירי קרבן,1,0,14a,"@11להביא מנחת העומר להגשה @33כתב המהרש""א וא""ל למה ליה לרבות הגשה לסוטה מוהקריבה דכתיב גבי שאר מנחות הא בגופה דמנחת סוטה כתיב והקריב אותה אל המזבח וכפירש""י די""ל לפי הירושל' דלא משמע ליה מוהקריב דסוטה הגשה אלא מריבוייא דוהקריבה דכתיב גבי שאר מנחות כדכתיב גבי' והגישה ע""כ. ואין ספק שנעלם ממנו דבמנחות דף ס' ע""ב גרסינן והקריבה לרבות מנחת סוטה להגשה וכן הוא אומר והקריב אותה אל המזבח. ואני תמה מדבריו שהרי מפורש בדברי תוס' שכן הוא בבבלי אלא הגשה קודמת לתנופה הוא דיליף בירושלמי אלא שהגהת המהרש""ל גרמי' לו שהגיה בתוס' ובירושלמי יליף בכל המנחות שהתנופות וכו'. ואינו כן אלא שהגירסא הישנה עיקר. וגם הגה' המהרש""ל תמוה. ולא ידעתי אנה מצא דבר זה בפירש""י. ואפשר שכיון לדברי רש""י ע""ב בד""ה ה""ג ת""ר וכו' והקריב דהיינו הגשה וכו' ע""כ. וא""נ דהשתא דכתיב והקריבה מפרשינן והקרי' היא הגשה אבל מוהקריב לחוד ליכא למשמע כלום וצ""ע:","להביא מנחת העומר להגשה כתב המהרש""א וא""ל",,
