Score,Ref,Version,Lang,Content,Field
143.01065,Mishnah Yoma 8:8,Sefaria Community Translation,en,"The sin-offering and guilt-offering atone [for sin]. Death and <b>Yom</b> <b>Kippur</b> atone with repentance. Repentance atones for minor transgressions of positive or negative commandments; for grave transgressions, it obtains a respite until <b>Yom</b> <b>Kippur</b> completes the atonement.",aggresive-ngram
141.96324,Mishnah Shabbat 15:3,Eighteen Treatises from the Mishna,en," fold clothes and make the beds on <b>Yom</b> <b>Kippur</b> for Shabbat [following it].  And the fats of Shabbat [sacrifices] may be offered on <b>Yom</b> <b>Kippur</b> (but not on Shabbat for <b>Yom</b> <b>Kippur</b>). Rabbi Akiva says: They may not offer those of Shabbat on <b>Yom</b> <b>Kippur</b>, or those of <b>Yom</b> <b>Kippur</b> on Shabbat. ",aggresive-ngram
105.20742,Rashi on Exodus 35:1:1,Sefaria Community Translation,en,"The day after <b>Yom</b> <b>Kippur</b>, when Moshe came down from the mountain...",aggresive-ngram
118.33633,Shabbat 113a:11,William Davidson Edition - English,en," the conclusion of Shabbat, since one may not perform an action on Shabbat that is preparation for a weekday. Rabbi Yishmael says: One may fold the garments and make the beds from <b>Yom</b> <b>Kippur</b> in",aggresive-ngram
106.274124,Megillah 7b:20,William Davidson Edition - English,en,"Rava said that the Sages of the school of Rav said: We learned: The difference between <b>Yom</b> <b>Kippur</b> and Shabbat is only that in this case, Shabbat, its intentional desecration is punishable at the hand",aggresive-ngram
128.60657,Sukkah 6a:7,Daf Shevui,en,"‘Honey’ alludes to the size of a large date, [which is the minimum size forbidden] on <b>Yom</b> <b>Kippur</b>.",aggresive-ngram
120.62476,Pesachim 109a:2,Sefaria Community Translation,en,"It was taught in a Beraita. They said about Rabbi Akiva In all his days he never said ""It is time to get up from the House of Study"" except for Erev Pesach and Erev <b>Yom</b> <b>Kippur</b>. On Erev Pesach, in",aggresive-ngram
33.576077,Mishnah Megillah 1:5,Sefaria Community Translation,en," <b>Yom</b> <b>Kippur</b> <b>except</b> <b>that</b> <b>the</b> <b>willful</b> <b>violation</b> <b>of</b> [<b>Shabbat</b>] <b>is</b> [<b>punishable</b>] <b>by</b> <b>man</b>, <b>and</b> <b>the</b> <b>willful</b> <b>violation</b> <b>of</b> [<b>Yom</b> <b>Kippur</b>] <b>is</b> [<b>punishable</b>] <b>by</b> <b>karet</b> [<b>Divinely</b> <b>imposed</b> <b>punishment</b> <b>consisting</b> <b>in</b> <b>severance</b> <b>from</b> <b>Heaven</b> <b>and</b>/<b>or</b> <b>the</b> <b>Jewish</b> <b>people</b>].",infreq
110.72101,Mishnah Moed Katan 3:6,Sefaria Community Translation,en,"Rabbi Eliezer says, ""Since the destruction of the Temple, the Shavuot is like Shabbat [in respect to mourning]."" Rabban Gamliel says, ""Rosh Hashanah and <b>Yom</b> <b>Kippur</b> are like festivals."" But the Sages",aggresive-ngram
107.35347,Beitzah 18b:4,William Davidson Edition - English,en,"Rava said: It is impossible to prohibit immersion on <b>Yom</b> <b>Kippur</b> alone, as is there anything that is permitted on Shabbat and the very same act is prohibited as labor on <b>Yom</b> <b>Kippur</b>? In fact, the",aggresive-ngram
106.417404,Rosh Hashanah 16a:3,Sefaria Community Translation,en," before <b>Yom</b> <b>Kippur</b>, it was judged during last years <b>Yom</b> <b>Kippur</b>. If it happened after <b>Yom</b> <b>Kippur</b>, it was judged this past <b>Yom</b> <b>Kippur</b>""",aggresive-ngram
113.55252,Taanit 17a:1,William Davidson Edition - English,en,"only on Rosh HaShana, and on <b>Yom</b> <b>Kippur</b> of Jubilee Years, and in a time of war.",aggresive-ngram
107.51834,Shabbat 114a:10,William Davidson Edition - English,en,"We learned in the mishna that Rabbi Yishmael says: One may fold clothes and make beds on <b>Yom</b> <b>Kippur</b> for Shabbat if <b>Yom</b> <b>Kippur</b> occurs on Friday, and the fats of the sacrifices that were brought on",aggresive-ngram
112.15021,Yoma 2a:1,William Davidson Edition - English,en,"MISHNA: Seven days prior to <b>Yom</b> <b>Kippur</b> the Sages would remove the High Priest, who performs the entire <b>Yom</b> <b>Kippur</b> service, from his house to the Chamber of Parhedrin, a room in the Temple designated",aggresive-ngram
108.08528,Leviticus 16:3,The Rashi chumash by Rabbi Shraga Silverstein,en,"	With this, [(and only on <b>Yom</b> <b>Kippur</b> (29)] shall Aaron come to the holy place: with a young bullock for a sin-offering and a ram for a burnt-offering.",aggresive-ngram
138.82838,Vayikra Rabbah 21:4,Sefaria Community Translation,en,Our Sages teach regarding Rosh Hashanah and <b>Yom</b> <b>Kippur</b>: my light on Rosh Hashanah and my salvation on <b>Yom</b> <b>Kippur</b>.,aggresive-ngram
112.16744,Eruvin 30b:1,William Davidson Edition - English,en,"that one may establish an eiruv for an adult even on <b>Yom</b> <b>Kippur</b>, despite the fact that he may not eat on <b>Yom</b> <b>Kippur</b>? It must be because eating is permitted to a minor. ",aggresive-ngram
104.270386,"Shulchan Arukh, Yoreh De'ah 11:2",Asher Meza (without commentary),en,"Seif 2 A slaughter perform on Shabbat or <b>Yom</b> <b>Kippur</b>, even if it was done intentionally, on Shabbat one forfeits his life (if he slaughters), and on <b>Yom</b> <b>Kippur</b> he receives lashes. However what he slaughter will be permissible.",aggresive-ngram
119.36584,"Shulchan Arukh, Orach Chayim 61:12",Sefaria Community Translation,en,The custom of saying adonai hu ha'elohim seven times on <b>Yom</b> <b>Kippur</b> during ne'ila is a good custom,aggresive-ngram
104.36919,Mishnah Keritot 6:5,Sefaria Community Translation,en,"[If] a woman is liable for a bird Chattat out of doubt and <b>Yom</b> <b>Kippur</b> passes [before she brings it], she is required to bring it after <b>Yom</b> <b>Kippur</b> because it renders her fit to eat sacrificial meat.  [In the case of] a bird Chattat brought out of doubt, [if the true facts] became known after the piercing of its neck, it is buried. ",aggresive-ngram
130.8603,Mishnah Keritot 6:4,Sefaria Community Translation,en,"[If] <b>Yom</b> <b>Kippur</b> passes [before] those who owe Chatta'ot or certain Ashamot [fulfill their obligations, they are still] required to bring them after <b>Yom</b> <b>Kippur</b>.  Those who owe Ashamot Teluiyim are",aggresive-ngram
