Id,Relevance,Ref,Version,Lang,Content,Field,Score
102,--,Menachot 99b:36,Wikisource Talmud Bavli,he,חל יום כיפורים להיות בשבת החלות מתחלקות לערב,aggresive-ngram,84.577576
103,--,Keritot 25a:47,Wikisource Talmud Bavli,he,חייבי חטאות ואשמות ודאין שעבר עליהן יום הכיפורים חייבין להביא לאחר יום הכיפורים וחייבי אשמות תלויין פטורין,aggresive-ngram,73.15623
104,--,Rashi on Sukkah 28a:4:3,Vilna Edition,he,וערב יום הכפורים - שצריך לאכול מבעוד יום:,aggresive-ngram,84.92464
105,--,Chullin 14a:1,Wikisource Talmud Bavli,he,מתני׳ השוחט בשבת וביום הכיפורים אף על פי שמתחייב בנפשו שחיטתו כשרה:,ngram,32.252357
106,--,Ran on Nedarim 80b:6:1,Vilna Edition,he,מילתא דידיעה עינויא השתא - דהיינו אכילה דבאותו יום מינכר עינויא ורחמנא לא קפיד ביום הכיפורים אלא בענוי דמינכר בההוא יומא:,hebmorph-exact,11.801402
107,--,"Shulchan Arukh, Orach Chayim 288:5",Torat Emet Freeware Shulchan Aruch,he, קדמונים שעל שלשה חלומות מתענים בשבת ואלו הן הרואה ספר תורה שנשרף או יום הכיפורים בשעת נעילה או קורות ביתו או שיניו שנפלו ויש אומרים הרואה יום הכיפורים אפילו שלא בשעת נעילה ויש אומרים הרואה שקורא בתורה,original,14.496417
108,--,Bartenura on Mishnah Shevuot 1:2:6,On Your Way,he,שעיר הנעשה בפנים. שעיר של יום הכפורים שמביא מדמו לפנים:,aggresive-ngram,75.520805
109,--,Rashi on Zevachim 38a:33:1,Wikisource Rashi,he,הזה ממנו - מדם פר יום הכפורים בסדר יומא:,aggresive-ngram,70.977684
110,--,Rashi on Keritot 7a:53:2,WikiSource Rashi,he,חלק - יום כפור לשבין ולא לשאינן שבין:,aggresive-ngram,85.34621
111,--,Shevuot 13a:42,Wikisource Talmud Bavli,he,"ת""ל (ויקרא כג, כח) יום כפורים הוא מ""מ",aggresive-ngram,79.07082
112,--,Ikar Tosafot Yom Tov on Mishnah Chullin 1:1:10,On Your Way,he,בנפשו. בשבת סקילה. וביום הכיפורים כרת. הר''נ:,hebmorph-standard,52.51544
113,--,Yoma 85b:11,William Davidson Edition - Aramaic,he,מיתה ויום הכפורים מכפרין עם התשובה עם התשובה אין בפני עצמן לא נימא דלא כרבי דתניא רבי אומר על כל עבירות שבתורה בין עשה תשובה בין לא עשה תשובה יום הכפורים מכפר חוץ (מפורק עול) ומגלה פנים בתורה ומיפר ברית בשר שאם עשה תשובה יום הכפורים מכפר ואם לא עשה תשובה אין יום הכפורים מכפר ,aggresive-ngram,76.54582
114,--,Shabbat 113a:11,Wikisource Talmud Bavli,he,"מתני׳ מקפלין את הכלים אפילו ארבעה וחמשה פעמים ומציעין את המטות מלילי שבת לשבת אבל לא משבת למוצאי שבת רבי ישמעאל אומר מקפלין את הכלים ומציעין את המטות מיום הכיפורים לשבת וחלבי שבת קריבין ביום הכיפורים אבל לא של יוה""כ בשבת ר""ע אומר לא של שבת קריבין ביום הכיפורים ולא של יום הכיפורים קריבין בשבת:",hebmorph-standard,52.471806
115,--,Pesachim 109a:2,William Davidson Edition - Aramaic,he,תניא אמרו עליו על רבי עקיבא מימיו לא אמר הגיע עת לעמוד בבית המדרש חוץ מערבי פסחים וערב יום הכפורים בערב פסח בשביל תינוקות כדי שלא ישנו וערב יום הכפורים כדי שיאכילו את בניהם,aggresive-ngram,79.72475
116,--,Ktav Yad Rashi on Menachot 91b:29:1,Wikisource Ktav Yad Rashi,he,אילו של אהרן - של יום כפורים:,aggresive-ngram,84.92464
117,--,Zevachim 39a:39,Wikisource Talmud Bavli,he,כן יעשה לפר זה פר יום הכפורים,aggresive-ngram,98.77704
118,--,"Shulchan Arukh, Orach Chayim 548:14",Torat Emet Freeware Shulchan Aruch,he,שעה אחת לפני ראש השנה בטלה ממנו גזירת שבעה מפני ראש השנה וגזירת שלשים מבטל ממנו יום הכיפורים ומגלח בערב יום הכיפורים והוא הדין לקובר מתו בשלשה לתשרי שמגלח בערב יום הכפורים:,hebmorph-standard,49.15148
119,--,"Shulchan Arukh, Orach Chayim 609:1",Torat Emet Freeware Shulchan Aruch,he,מותר להטמין חמין מערב יום הכיפורים למוצאי יום הכיפורים.  הגה: ויש אומרים שאין להטמין ביום הכיפורים (עיין בטור) וכן המנהג במדינות אלו (מהרי''ל):,aggresive-ngram,77.34576
120,--,Rashi on Yoma 50a:13:1,Vilna Edition,he,"ה""ג והתניא פר יום הכפורים ושעיר יום הכפורים:",aggresive-ngram,100.32362
121,--,"Shulchan Arukh, Orach Chayim 570:1",Wikisource Shulchan Aruch,he,יחיד שקיבל עליו תענית כך וכך ימים ואירעו בהם שבתות וימים טובים או ראש חדש חנוכה ופורים או ערב יום הכיפורים אם קבלו בלשון קבלת תענית בעלמא אינו צריך התרה ואם קבלו בלשון הרי עלי שהוא לשון נדר צריך התרת,original,16.05345
122,--,"Shulchan Arukh, Orach Chayim 416:4",Torat Emet Freeware Shulchan Aruch,he,יום הכיפורים הרי הוא כשבת בין לענין עירובי חצירות בין לענין עירובי תחומין:,hebmorph-standard,55.608555
123,--,"Chizkuni, Leviticus 16:25:1",Chizkuni,he,"ואת חלב החטאת תרגום לשון רבים וית תרבי דחטוותא, והם פר ושעיר הפנימיים של יום הכיפורים.",hebmorph-standard,49.42027
124,--,Megillah 20b:7,William Davidson Edition - Aramaic,he,ולוידוי הפרים ולוידוי מעשר ולוידוי יום הכפורים ,aggresive-ngram,84.62096
125,--,Rashi on Menachot 99b:37:2,Wikisource Rashi,he,הבבליים - כהנים אוכלין אותו חי כשחל יום הכפורים בערב שבת:,aggresive-ngram,70.977684
126,--,Megillah 9b:7,William Davidson Edition - Aramaic,he,אין בין כהן משמש לכהן שעבר אלא פר יום הכפורים ועשירית האיפה,aggresive-ngram,71.303986
127,--,"Shulchan Arukh, Orach Chayim 131:7",Wikisource Shulchan Aruch,he,ומנהג פשוט שלא ליפול על פניהם בכל בכל חדש ניסן ולא בט' באב ולא בין יום כיפור לסוכות. (ולא מתחלת ראש חודש סיון עד אחר שבועות),hebmorph-standard,48.777405
