Id,Relevance,Ref,Version,Lang,Content,Field,Score
142,--,Ritva on Eruvin 56a:1,"Chidushi HaRitva, Amsterdam, 1729.",he,ת״ר הבא לרבעה מרבעה ברבועו של עולם. פי׳ עיר עגול׳ שרוצין לרבע׳ מרבעין אותה לרבועו של עולם. דרומה כדרום עולם וצפונה כצפון עולם וה״ה למזרחו ולמערבו ונקט דרום וצפון משום דבעי למתני סימנא וסימניך עגלה,hebmorph-exact,7.6593413
143,--,Rosh on Berakhot 4:12:2,Vilna Edition,he," לפניך ה' אלהי ששמת חלקי מיושבי בית המדרש ולא שמת חלקי מיושבי קרנות שאני משכים והם משכימים אני משכים לדברי תורה והם משכימים לדברים בטלים אני עמל והם עמלים אני עמל ומקבל שכר והם עמלים ואינן מקבלים שכר אני רץ והם רצים  אני רץ לחיי עולם הבא והם רצים לבאר שחת: 
",original,7.113196
144,--,"Siftei Hakhamim, Genesis 44:32:1",Siftei Hakhamim,he," יוסף אינו מאמין בעונש עולם הבא, משום הכי הוצרך לו לומר גם עונש עולם הזה, מה שאין כן גבי יעקב שהאמין בעונש עולם הבא וק""ל:  
",hebmorph-exact,8.425749
145,--,Sefer HaBahir 8,Torat Emet Sefer HaBahir,he,"ועוד למה הוסיף הקב""ה ה""א באברהם יותר משאר אותיות אלא כדי שיזכו כל אבריו של אדם לחיי עולם הבא שהוא נמשל ליום, כביכול בו נשלם הבנין דכתיב (בראשית ט' ו) כי בצלם אלהים עשה את האדם, ואברהם בגמטריא רמ""ח כמנין אבריו של אדם: ",hebmorph-exact,7.980184
146,--,Ibn Ezra on Genesis 33:19:1,Ibn Ezra on Genesis -- Torat Emet,he,חלקת השדה. חלק בשדה והזכיר זה הכתוב להודיע כי מעלה גדולה יש לארץ ישראל. מי שיש לו בה חלק חשוב הוא כחלק עולם הבא:,hebmorph-exact,11.970276
147,--,"Shney Luchot HaBrit, Bamidbar, Torah Ohr 162",Shney Luchot Habrit by Rabbi Eliyahu Munk,en,"This is also the mystical dimension of the letter ה in the word “הששי,” in Genesis 1,31. It alludes to the seven times 7 days plus the כולל, general potential, which combined makes 50. The number 50 must be understood as five times 10, i.e. with the creation of the Sabbath, the material world, עולם הזה, had, so to speak been stamped with the seal of the spiritual world, the עולם הבא.",original,6.959228
148,--,Rashi on Arakhin 31a:33:1,Wikisource Rashi,he,מיום ליום - שאם מכרה באחד בניסן אין מונין שנה למנין עולם דלימא כיון שהגיע תשרי עלתה לו שנה שהרי יצתה אותה שנה אלא עד אחד בניסן הבא אינו נחלט:,hebmorph-exact,7.0402274
149,--,Torah Temimah on Psalms 16:11:1,On Your Way,he,"שבע שמחות: מתני' דלא כרבי יהודה דתניא רבי יהודה אומר כנור של מקדש של שבעת נימין היה שנאמר שובע שמחות [את] פניך אל תיקרי שובע אלא שבע ושל ימות המשיח שמונה שנאמר: למנצח על השמינית על נימא שמינית של עולם הבא עשר שנאמר עלי עשור ועלי נבל עלי הגיון בכנור ואומר הודו לה' בכנור בנבל עשור זמרו לו שירו לו שיר חדש אפילו תימא רבי יהודה לעולם הבא איידי דנפישי נימין דידיה נפיש קליה כי נבל קרי ליה נבל:(ערכין יג ע""ב)
",hebmorph-exact,7.927399
150,--,Rashi on Sanhedrin 90b:8:1,Wikisource Rashi,he,שעתיד לחיות - לעולם הבא:,hebmorph-standard,105.35084
151,--,Tosafot Yom Tov on Pirkei Avot 2:9:5,"Mishnah, ed. Romm, Vilna 1913",he,"וצדיק. פירש הר""ב הקב""ה שהוא צדיקו של עולם שנאמר [דברים ל""ב] צדיק וישר הוא. וכן [נחמיה ט'] ואתה צדיק על כל הבא עלינו. הרמב""ם. 
",hebmorph-exact,8.448273
152,--,Zevachim 118b:41,Wikisource Talmud Bavli,he,חופף עליו זה העולם הזה כל היום אלו ימות המשיח ובין כתיפיו שכן זה העולם הבא,ngram,20.279085
153,--,Chidushei Agadot on Chagigah 15a:7,Vilna Edition,he,"כתיב  לכן בארצם משנה יירשו כו'. וסיפא דקרא שמחת עולם תהי וגו' דהיינו בעולם הבא שהיא נקראת ארץ החיים וברשעים כתיב משנה שברון שברם היינו בעוה""ב בגיהנם: ",infreq,16.874752
154,--,Pesachim 50a:6,William Davidson Edition - Aramaic,he,ורבי יהושע בן לוי אמר אלו בני אדם שיקרין הן בעולם הזה וקפויין הן לעולם הבא כי הא דרב יוסף בריה דרבי יהושע בן לוי חלש ואיתנגיד כי הדר אמר ליה אבוה מאי חזית אמר ליה עולם הפוך ראיתי עליונים למטה ותחתונים למעלה אמר לו בני עולם ברור ראית ואנן היכי התם כי היכי דאיתו אנן הכא הכי איתינן התם ,infreq,18.812912
155,--,Pesachim 50a:4,Wikisource Talmud Bavli,he,"א""ר אלעזר זה אור שיקר בעולם הזה וקפוי לעולם הבא",hebmorph-standard,70.67889
156,--,"Meshech Hochma, Shelakh 13","Riga, 1927",he,"במדבר הזה יתמו ושם ימותו. ושם לחיי עולם הבא. אמרו ע""ז באפי נשבעתי וחוזרני בי. וליכא מידי דלא רמיזא באורייתא. ונראה, דבדברים חמר וישבע לאמר כו' הדור הרע הזה קראם דור הרע, ובפ' מטות אמר משה ויניעם",hebmorph-exact,6.950888
157,--,Derech Chaim 3:18:2,"Derech Chaim, Maharal",he," הבא שנאמר הליכות עולם לו אל תקרי הליכות אלא הלכות עולם לו עד כאן. והטעם הוא כי התורה היא המביאה את האדם לחיי עולם הבא, וכאשר ההלכה היא הלכה פסוקה אינה נוטה מנקודת האמת לא לימין ולא לשמאל ולכך נקרא",hebmorph-exact,9.639831
158,--,"Shney Luchot HaBrit, Terumah, Torah Ohr 106",Shney Luchot Habrit by Rabbi Eliyahu Munk,en," the corresponding Celestial Regions. It will then advance spiritually ever higher until the mystical level of the emanation  בינה, the root of עולם הבא, the World to Come, where the יין המשומר is",original,6.6759777
159,--,Avodah Zarah 5a:10,Wikisource Talmud Bavli,he,כל העושה מצוה אחת בעולם הזה מקדמתו והולכת לפניו לעולם הבא שנאמר,ngram,20.234348
160,--,Rashi on Genesis 39:10:2,On Your Way,he,"להיות עמה. לעולם הבא:
",hebmorph-standard,108.192604
161,--,Menachot 81b:44,Wikisource Talmud Bavli,he,שמור הבא תודה ושמעת הבא לחמה,hebmorph-exact,6.8532305
162,--,Malbim on Psalms 37:36:4,On Your Way,he,"ולא נמצא שם כי נפשו תאבד מעולם הבא :
",hebmorph-standard,65.84428
163,--,Malbim on I Samuel 20:41:4,On Your Way,he,"עד עולם : 
",hebmorph-exact,6.9122233
164,--,Netzach Yisrael 16:17,Netzach Yisrael,he,"ועוד יש לך לדעת, כי עולם הבא הוא עולם השני, כי עולם התחתון הוא ראשון לאדם, ונברא העולם בב' של ""בראשית ברא"" (בראשית א, א), כי יש עולם שני. ותמצא כי אותיות 'בכר' הכל שניים; הב' באחדים, הכ""ף בעשרות",infreq,17.118864
165,--,Rashi on Bava Metzia 83b:4:1,Vilna Edition,he,תזרח השמש - לעולם הבא:,hebmorph-standard,105.3345
166,--,Menachot 89b:18,Wikisource Talmud Bavli,he,כבש הבא עם העומר:,hebmorph-exact,6.835211
167,--,"Shulchan Arukh, Yoreh De'ah 204:4",Torat Emet Freeware Shulchan Aruch,he,אדם אוסר על עצמו דבר שלא בא לעולם לכשיבא לעולם:,hebmorph-standard,73.928825
168,--,Ibn Ezra on Psalms 71:18:2,Ibn Ezra on Psalms -- Daat,he,לדור - הבא. ,hebmorph-exact,7.1258006
169,--,Keritot 9a:90,Wikisource Talmud Bavli,he,הבא על חמש שפחות חרופות בהעלם אחת מהו,aggresive-ngram,13.025909
170,--,"Kedushat Levi, Exodus, Ki Tisa 10",Kedushat Levi - Munkatch 1939,he,"או יבואר, דהנה הקדוש ברוך הוא רצה לזכות את ישראל בעולם הבא לכך נתן להם תורה ומצות. והנה הקדוש ברוך הוא רצה להטעים לזרע ישראל שכר עולם הבא הרוחני ולכך נתן להם את יום השבת דהוא תענוג מעין עולם הבא. ובשבת כל אדם יכול להבחין התענוג הרוחני",original,7.953403
