Index Title,Esther
Esther 8:8,"Wy tedy możecie rozpisać na korzyść judejczyków w imieniu króla, jak się dobrem okaże w oczach waszych i opieczętować to pieczęcią królewską; pismo bowiem napisane w imieniu króla a opieczętowane pieczęcią królewską cofniętem być nie może. "
Esther 8:9,"I tak powołani zostali tegoż samego czasu pisarze królewscy dnia dwudziestego trzeciego, miesiąca trzeciego czyli miesiąca Siwan; i rozpisano ściśle tak, jak to Mardechai zarządził, do judejczyków i do satrapów i do namiestników i do starostów, stu dwudziestu i siedmiu dzielnic od Indyi aż do Etjopii, do każdej dzielnicy stosownie do pisma jej i do każdego ludu stosownie do języka jego, i do judejczyków też stosownie do pisma i języka ich. "
Esther 8:10,Napisano tedy w imieniu króla Ahaswera i opieczętowano pieczęcią królewską; poczem rozesłano te listy przez gońców konnych dosiadających wierzchowce państwowe źrebięta z tabunów. 
Esther 8:11,"Wedle których pozwolił król judejczykom w każdem pojedynczem mieście się znajdującym, aby się gromadzili, a życia swojego bronili, a tępili, mordowali i zgładzili każdy tłum, w jakimbądź by to nie było narodzie i w jakiejbądź dzielnicy, któryby gwałt czynił im, ich dzieciom i kobietom, a chciał mienie ich złupić. "
Esther 8:12,"A to jednego dnia we wszystkich dzielnicach króla Ahaswera mianowicie trzynastego dnia dwunastego miesiąca, czyli miesiąca Adar. "
Esther 8:13,"Dosłowny odpis pisma miał być wydany jako prawo w każdej pojedynczej dzielnicy, aby jawnem było dla wszystkich narodów, i aby judejczycy gotowi byli na dzień ten mścić się na wrogach swoich. "
Esther 8:14,"I tak odjechali gońce dosiadający wierzchowce państwowe czemrychlej nagleni rozkazem królewskim, gdy prawo na zamku w Suzie wydanem zostało. "
Esther 8:15,"Mardechai zaś wyszedł od króla w stroju królewskim, błękitnym i białym i w wielkim dyademie złotym, przyodziany w płaszcz z bisioru i purpury, a miasto Suza cieszyło się i radowało. "
Esther 8:16,Judejczykom wzeszła jasność i radość i wesele i cześć. 
Esther 8:17,"W każdej też dzielnicy i w każdem mieście, dokądkolwiek rozporządzenie królewskie i prawo jego doszło, była radość i wesele u judejczyków, biesiady i uroczystości dużo też z ludności krajowej przyznawało się do judztswa, ponieważ padła na nich trwoga przed judejczykami. "
Esther 9:1,"Dnia tedy tedy trzynastego, dwunastego miesiąca czyli miesiąca Adar, w którym rozporządzenie króla i prawo jego wykonanem być miało, tegoż samego dnia, w którym wrogowie judejczyków się spodziewali ich opanować, a w którym przeciwnie sami nieprzyjaciół swych opanować mieli: "
Esther 9:2,"Zgromadzili się judejczycy w miastach swych we wszystkich dzielnicach króla Ahaswera, aby podnieść rękę na tych, którzy niedoli ich pragnęli. A nie mógł się im nikt oprzeć bo padła trwoga przed nimi na wszystkie ludy. "
Esther 9:3,"Wszyscy też starostowie dzielnic i satrapi i namiestnicy i zawiadujący sprawami króla popierali judejczyków, bo padła na nich trwoga przed Mardechajem. "
Esther 9:4,"Gdyż wielkim był Mardechai na dworze króla, a sława jego rozniosła się po wszystkich dzielnicach, bo mąż ów Mardechai stał się coraz potężniejszym. "
Esther 9:5,"I tak porazili judejczycy wszystkich wrogów swoich mieczem, zabijając i wytracając, a postąpili z nieprzyjaciółmi swymi wedle upodobania swego. "
Esther 9:6,A w samej stolicy Suza zabili judejczycy i wytępili pięćset ludzi. 
Esther 9:7,"Również Parszandatę i Dalfona i Aspatę, "
Esther 9:8,"I Poratę i Adalję i Aridatę, "
Esther 9:9,I Parmasztę i Arisaja i Aridaja i Wajzatę. 
Esther 9:10,"Dziesięciu synów Hamana, syna Hamedaty, ciemięzcy judejczyków zabili; wszakże na łupy nie wyciągnęli ręki swojej. "
Esther 9:11,"Tegoż dnia, gdy powiadomiono króla o liczbie zabitych w stolicy, w Suzie, "
Esther 9:12,"Rzekł król do królowej Estery: W stolicy, w Suzie, zabili judejczycy i wytępili pięćset ludzi i dziesięciu synów Hamana; w innych zaś dzielnicach królewskich - cóż dopiero tam porobili! Jakaż tedy jeszcze prośba twoja, aby ci spełnioną została, i jakież dalsze życzenie twoje, aby ci użyczonem było? "
Esther 9:13,"I odpowiedziała Estera: Jeżeli to król za dobre uzna, niechajby i jutro dozwolonem było judejczykom w Suzie postąpić w sposób dzisiejszy; dziesięciu zaś synów Hamana niechaj obwieszą na szubienicy. "
Esther 9:14,"I rozkazał król, aby tak uczyniono. I wydany został podobny rozkaz w Suzie, dziesięciu zaś synów Hamana obwieszono. "
Esther 9:15,Zgromadzili się tedy judejczycy zamieszkali w Suzie również i czternastego miesiąca Adar i ubili w Suzie trzysta ludzi; wszakże na łupy nie wyciągnęli ręki swojej. 
Esther 9:16,"Inni też judejczycy osiadli w dzielnicach królewskich zgromadzili się i bronili życia swojego, folgując sobie na wrogach swoich i zabijając z pośród nieprzyjaciół swoich siedmdziesiąt i pięć tysięcy - wszakże na łupy nie wyciągnęli ręki swojej. "
Esther 9:17,"Trzynastego dnia miesiąca Adar poczęli a trzynastego tegoż miesiąca przestali, obracając go na dzień biesiad i radości. "
Esther 9:18,"Judejczycy zaś w Suzie zgromadzili się zarówno trzynastego jak czternastego tegoż miesiąca, tak że piętnastego przestali, obracając go na dzień biesiad i radości. "
Esther 9:19,"Dla tego czynią judejczycy osiadli po wsiach i w miastach otwartych, dzień czternasty miesiąca Adar dniem radości biesiady i uroczystości przyczem posyłają sobie upominki wzajemnie. "
Esther 9:20,I spisał Mardechai zdarzenia te i rozesłał listy do wszystkich judejczyków we wszystkich dzielnicach króla Ahaswera blizkich i dalekich. 
Esther 9:21,"Obowiązując ich stale, aby obchodzili corocznie dzień czternasty miesiąca Adar i dzień piętnasty tegoż miesiąca. "
Esther 9:22,"Jako te dni, w których wypoczęli judejczycy od wrogów swoich i ten miesiąc, który obrócił się im ze smutku w radość a z żałoby w dzień uroczysty - aby uczynili je dniami biesiady i radości, przyczem posyłać sobie mają upominki wzajemnie a ubogim dary. "
Esther 9:23,I zobowiązali się judejczycy czynić stale co rozpoczęli i co Mardechai do nich napisał: 
Esther 9:24,"Jako Haman, syn Hamedaty, agagita, ciemięzca wszystkich judejczyków uknuł przeciw judejczykom, aby ich zagubił, rzuciwszy pur - to jest los - aby ich wytępiono i zgładzono, "
Esther 9:25,"A jako król, gdy stanęła przed nim Estera, piśmiennie zarządził, aby niecny jego zamysł, który przeciw judejczykom uknuł spadł na głowę jego, a obwieszono go wraz z synami jego na szubienicy. "
Esther 9:26,"Dla tego nazwano dni te purym, podług wyrazu pur. Przeto, z powodu całej treści tego listu, tak dotycznie tego czego sami doświadczyli, jak tego co ich doszło wieścią, "
Esther 9:27,"Ustanowili i zobowiązali się judejczycy za siebie i za potomków swoich jak i za wszystkich, którzyby się do nich przyłączyli zwyczajem niezmiennym, aby obchodzili dwa te dni rok rocznie, stosownie do przepisu ich i w właściwej ich porze, "
Esther 9:28,"Dni zaś te upamiętnione i obchodzone były w każdem pokoleniu, w każdej rodzinie, w każdej dzielnicy i w każdem mieście, oby też dni te purymowe nigdy zniesione nie zostały wpośród judejczyków a pamięć ich nie zanikła z pośród potomków ich! "
Esther 9:29,"Napisała też królowa Estera, córka Abichaila, wraz z Mardechajem judejczykiem całą powagą swoją, aby stwierdzić one dni purymowe tym listem wtórym. "
Esther 9:30,"I rozesłano ten list do wszystkich judejczyków, do stu dwudziestu i siedmiu dzielnic państwa Ahaswera ze słowami przyjaźni i szczerości, "
Esther 9:31,"Aby ustanowili te dni purymowe w porze ich, jako ustanowił je dla nich Mardechai judejczyk i Estera królowa i jako ustanowili je dla siebie samych i potomków swoich na pamiątkę postów i biadania. "
Esther 9:32,"I tak utwierdził rozkaz Estery przepis ten co do purym, tak jak opisano go w tej księdze. "
Esther 10:1,Poczem nałożył król Ahasweros dań na kraj i na wyspy morza. 
Esther 10:2,"A co do dzieł jego mocy i potęgi i wyszczególnienia świetności Mardechaja, którego wywyższył król, spisano to wszak w księdze roczników królów Medyi i Persyi. "
Esther 10:3,"Albowiem judejczyk Mardechai był wtórym po królu Ahaswerze a był on wysoce poważanym u judejczyków i miłowanym u masy swych braci, bo dbał o dobro swego ludu a przemawiał za pomyślnością całego swego rodu. "
