Proverbs 6:1,בְּ֭נִי אִם־עָרַ֣בְתָּ לְרֵעֶ֑ךָ תָּקַ֖עְתָּ לַזָּ֣ר כַּפֶּֽיךָ׃,"<b>בְּנִי,</b> <b>אִם־עָרַבְתָּ</b>, נעשית עָרב <b>לְ</b>חובו של <b>רֵעֶךָ,</b> אם <b>תָּקַעְתָּ</b> <b>לַזָּר</b> <b>כַּפֶּיךָ,</b> התחייבת לאיש זר. ערבות היא התחייבות, ויש לעשותה בזהירות רבה. קורה שאנשים חסרי ניסיון ניאותים לבקשת אדם שעמו הם בקשר כלשהו, גם אם אינו מוכר להם היטב, לחתום לו על ערבויות, בלי שיביאו בחשבון את האפשרות שיהא עליהם לשלם אותן. לעתים משיבים לו בחיוב מתוך פזיזות ובלי תשומת לב מספקת."
Proverbs 7:27,"דַּרְכֵ֣י שְׁא֣וֹל בֵּיתָ֑הּ יֹ֝רְד֗וֹת אֶל־חַדְרֵי־מָֽוֶת׃ <span class=""mam-spi-pe"">{פ}</span><br>","<b>דַּרְכֵי</b> <b>שְׁאוֹל</b> הן הדרכים ההולכות אל <b>בֵּיתָהּ,</b> והן <b>יֹרְדוֹת</b> <b>אֶל־חַדְרֵי־מָוֶת. </b>אולי פיתויה של האשה המקושטת והמרשימה המבטיחה לך אהבה יהיה גדול, אולם בסופו של דבר אתה תרד לשאול – צרות וייסורים, כאבי לב ומצפון, הפסדים, עונשים ונקמות. כאמור, כשם שהעצות הללו נכונות בנוגע לאשה מופקרת, כך הן מועילות ביחס לחכמה רעה. גם חכמה של כפירה היא חכמה. היא יפה ומפתה כמו חכמת התורה, אך למעשה היא יוצרת תרבות-נגד, ובסופו של דבר ‘רגליה יורדות מוות'."
Proverbs 8:12,"“I, Wisdom, live with Prudence;<br>I attain knowledge and foresight.","It is clear that the wisdom referred to here is not merely good instruction and advice. Evidently, this wisdom rises beyond the realm of practical activity, as the text is alluding to the Torah itself, which is the perfect wisdom of God, and to which nothing in the world can compare. Therefore, wisdom adds: <b>I am wisdom; I dwell in cleverness, </b>I do not deal only in abstract statements; I also have the ability to act astutely in the world,<b> and will find, </b>become familiar with,<b> knowledge of plans, </b>thoughts, stratagems, and solutions."
Proverbs 8:12,אֲֽנִי־חׇ֭כְמָה שָׁכַ֣נְתִּי עׇרְמָ֑ה וְדַ֖עַת מְזִמּ֣וֹת אֶמְצָֽא׃,"ברור שהחכמה שעליה מדובר כאן, איננה עצה והדרכה נבונה בלבד. ניכר שהיא מתנשאת מעבר לתחום של המעשה בפועל, ומרמזת על התורה עצמה, שהיא חכמת ה' המושלמת, שאין דבר בעולם שערכו ישווה לה. <b>אֲנִי,</b> <b>חָכְמָה,</b> <b>שָׁכַנְתִּי,</b> שוכנת עם <b>עָרְמָה.</b> אינני עוסקת רק באמירות מופשטות. אתי גם היכולת להתנהל בעולם בצורה מושכלת. <b>וְדַעַת</b> <b>מְזִמּוֹת,</b> הכרת מחשבות, תחבולות ופתרונות <b>אֶמְצָא.</b>"
Proverbs 9:7,יֹ֤סֵ֨ר <b>׀</b> לֵ֗ץ לֹקֵ֣חַֽ ל֣וֹ קָל֑וֹן וּמוֹכִ֖יחַ לְרָשָׁ֣ע מוּמֽוֹ׃,"ההזמנה אינה מופנית אל החכמים החושקים בחכמה מעצמם, אך גם אין היא פונה אל הלצים הבזים לחכמה, שהרי <b>יֹסֵר,</b> מי שמייסר <b>לֵץ,</b> הלועג על דברים מתוך ביטחון עצמי מופרז, בין אם הוא מתלוצץ ומתבדח ובין אם לא, <b>לֹקֵחַ</b> <b>לו</b>ֹ, מביא על עצמו <b>קָלוֹן,</b> ביזיון. המוכיח אדם כזה לא יזכה לכבוד רב מפני שהלץ אינו מעוניין לשמוע. <b>ו</b>גורלו יהיה כ<b>מוֹכִיחַ</b> <b>לְרָשָׁע</b> על <b>מוּמוֹ,</b> חסרונותיו. אנשים כאלו אינם אוהבים מוסר, ואין הם מגיבים יפה לתוכחות."
Proverbs 9:13,The stupid woman bustles about;<br>She is simple and knows nothing.,"Up to this point, wisdom has been described as attempting to sell her wares, perhaps without great success. Although she can bestow all manner of good upon people, give them food and drink, teach them the plain and homiletic meaning of texts, and both exoteric and esoteric knowledge, this is a highly focused and defined form of wisdom. Wisdom’s counsel is not an abstract, sophisticated, intellectual exercise; rather, it is based on the fear of God, and it includes reproof and ethics. Therefore, it is not the most popular type of advice, and indeed, wisdom’s rival is no less available to all: <b>The woman of folly is clamorous; </b>she is<b> </b>talkative and loud, appearing on every stage and communicating through all types of media. However, she exists<b> in naïveté, and does not </b>actually <b>know anything. </b>Although her claims are vague, she nevertheless tries to tempt people into buying her merchandise."
Proverbs 9:13,אֵ֣שֶׁת כְּ֭סִילוּת הֹמִיָּ֑ה פְּ֝תַיּ֗וּת וּבַל־יָ֥דְעָה מָּֽה׃,"עד כה תוארה החכמה המנסה למכור את עצמה, אולי לא בהצלחה מרובה. אף שהיא מעניקה לאנשים מכל טוב, מאכילה ומשקה אותם, מלמדת אותם פשט ודרש, נגלה ונסתר, זוהי חכמה מכוונת ומוגדרת למדי. אין היא שעשוע אינטלקטואלי מופשט ומתוחכם, אלא היא מיוסדת על יראת ה' ונכללים בה תוכחות ומוסר. על כן היא אינה פופולרית ביותר. המתחרה שלה זמינה לא פחות – <b>אֵשֶׁת</b> <b>כְּסִילוּת</b>, הטיפשות ה<b>הֹמִיָּה</b>, מרבה לדבר, מרעישה ומופיעה מעל כל במה ובכל אמצעי תקשורת. דבריה דברי <b>פְּתַיּוּת,</b> <b>וּבַל־יָדְעָה</b> <b>מָּה.</b> היא אינה יודעת דבר. דבריה אינם ברורים, אך היא מנסה לפתות במרכולתה."
Proverbs 11:16,A graceful woman obtains honor;<br>Ruthless men obtain wealth.,"<b>A woman of grace supports </b>people deserving of<b> honor, </b>including her husband. <b>And </b>by contrast, <b>the strong, </b>powerful<b> </b>men<b> [</b><b><i>aritzim</i></b><b>], </b>apparently the polar opposite of a “woman of grace,”<b> support </b>those who have<b> wealth.</b> Unlike the honorable, who are supported by delicate, sensitive souls, the wealthy are supported by the powerful. It should be noted that in the Bible the word <i>aritz</i> does not necessarily have the negative connotation that later became associated with the term."
Proverbs 11:16,אֵֽשֶׁת־חֵ֭ן תִּתְמֹ֣ךְ כָּב֑וֹד וְ֝עָרִיצִ֗ים יִתְמְכוּ־עֹֽשֶׁר׃,"<b>אֵשֶׁת־חֵן</b> <b>תִּתְמֹךְ</b> <b>כָּבוֹד,</b> במה או במי שראוי לכבד אותו, בין אם זה בעלה ובין אם אדם אחר. <b>ו</b>לעומת זאת <b>עָרִיצִים,</b> בעלי הכוח – כנראה הקוטב הנגדי של ‘אשת חן' – <b>יִתְמְכוּ־עֹשֶׁר,</b> במי שיש לו כסף. לעומת הכבוד, המחוזק על ידי נפש עדינה ורגישה, העושר מתחזק על ידי בעלי כוח."
Proverbs 11:21,יָ֣ד לְ֭יָד לֹא־יִנָּ֣קֶה רָּ֑ע וְזֶ֖רַע צַדִּיקִ֣ים נִמְלָֽט׃,"<b>יָד</b> <b>לְיָד,</b> מי שרגיל בלחיצות ידיים להבטחות והסכמים <b>לֹא־יִנָּקֶה</b> מ<b>רָּע</b>. אין פירוש הדבר שאדם צריך לברוח מכל התחייבות שהיא, אלא שעליו להביא בחשבון את יכולתו לפרוע את ערבויותיו ואת החומרה הכרוכה בתקיעת כף. <b>וְזֶרַע</b> <b>צַדִּיקִים</b> <b>נִמְלָט</b> מן הצרה הזו. לחלופין: העושה דברים טובים על מנת לקבל גמול מיָּדי, זכויותיו אינן עומדות לו להינצל מרע, ואילו הצדיקים הפועלים מכוונה טהורה, טובתם נשמרת לזרעם."
Proverbs 12:27,לֹא־יַחֲרֹ֣ךְ רְמִיָּ֣ה צֵיד֑וֹ וְהוֹן־אָדָ֖ם יָקָ֣ר חָרֽוּץ׃,"<b>לֹא־יַחֲרֹךְ</b> בעל ה<b>רְמִיָּה</b>, הרמאי את <b>צֵידוֹ,</b> כדרכם של ציידים, שהיו שוברים או חורכים קצת את כנפי העופות הניצודים כדי שלא יברחו. מה שהושג במרמה לא יישמר, <b>ו</b>לעומת זאת <b>הוֹן־אָדָם</b> <b>יָקָר,</b> הונו של אדם נכבד הוא <b>חָרוּץ</b> – זהב משובח. לחלופין: הונו של אדם חרוץ – יקר לו. או: הון יקר של אדם נובע מהיותו חרוץ וישר. הרמאי מנסה לעגל פינות ולמצוא דרכים עקלקלות, אך סופו שלא יישאר בידו דבר, ואילו האנשים החרוצים, העושים את עבודתם נאמנה והולכים בדרך הישר, שומרים על ממונם ולהם תאיר ההצלחה פניה."
Proverbs 14:9,"Reparations mediate between fools,<br>Between the upright, good will.","<b>Guilt causes fools to talk. </b>Their conversation revolves around their sins, guilt, or the amends they must make. Some explain the verse to mean that fools distort the concept of sin. <b>And </b>in contrast, there is<b> good will among the upright. </b>The conversation of the upright is motivated by good deeds, kindness, and blessings. Consequently, one who keeps the company of fools will find guilt in various forms, whereas among sincere and upstanding people feelings of good will, closeness, and love will be cultivated."
Proverbs 14:9,אֱ֭וִלִים יָלִ֣יץ אָשָׁ֑ם וּבֵ֖ין יְשָׁרִ֣ים רָצֽוֹן׃,"את ה<b>אֱוִלִים</b> <b>יָלִיץ,</b> יניע לדבר ה<b>אָשָׁם.</b> החטא, האשמה או ראיית החובה הם הכוח הגורם להם לדבר, או: הם נושאי שיחתם העיקריים, <b>וּ</b>מנגד<b>,</b> <b>בֵין</b> <b>יְשָׁרִים</b> יליץ ה<b>רָצוֹן.</b> את שיח הישרים מניעים מעשים רצויים, חסד וברכה. אשר על כן, מי שנמצא בסביבה של אווילים ימצא אשמה מסוגים שונים, ואילו בין אנשים ישרים והגונים יצמחו רצון, קרבה ואהבה."
Proverbs 14:31,עֹ֣שֵֽׁק דָּ֭ל חֵרֵ֣ף עֹשֵׂ֑הוּ וּ֝מְכַבְּד֗וֹ חֹנֵ֥ן אֶבְיֽוֹן׃,"מי ש<b>עֹשֵׁק,</b> מנצל ומקפח את ה<b>דָּל</b> – <b>חֵרֵף</b> <b>עֹשֵׂהוּ,</b> אינו פוגע בעני בלבד, אלא הוא מבזה את בוראו – הקדוש ברוך הוא, <b>וּמְכַבְּדוֹ</b> של ה', יוצרו של הדל, הוא מי ש<b>חֹנֵן,</b> מרחם על ה<b>אֶבְיוֹן.</b> חנינת האביון היא עצמה נתינת כבוד לה'. הקדוש ברוך הוא איננו זקוק למתנות בשר ודם, אבל האביון זקוק להן, ולכן הדרך לכבד את ה' היא בנתינת מתנה לעני."
Proverbs 15:1,מַֽעֲנֶה־רַּ֭ךְ יָשִׁ֣יב חֵמָ֑ה וּדְבַר־עֶ֝֗צֶב יַעֲלֶה־אָֽף׃,"<b>מַעֲנֶה־רַּךְ,</b> עדין ואדיב ַעֲנֶה־רַּךְ,<b>יָשִׁיב,</b> ירגיע <b>חֵמָה,</b> כעס. במקרה של ריב או מצב רגיש העלול להתפתח למריבה אם עונים ברכּות, אפשר לשכך זעם מתלקח, <b>וּדְבַר־עֶצֶב,</b> דיבור מייגע או מצער <b>יַעֲלֶה,</b> יגדיל <b>אָף,</b> כעס. דיבור קשה או בוטה מגביר את הכעס. ראוי להרגיל את הלשון בדיבור רך."
Proverbs 16:1,לְאָדָ֥ם מַעַרְכֵי־לֵ֑ב וּ֝מֵיְהֹוָ֗ה מַעֲנֵ֥ה לָשֽׁוֹן׃,"<b>לְאָדָם</b> <b>מַעַרְכֵי־לֵב,</b> מחשבות והרהורים. אדם מתכנן תכניות, מביע משאלות וחולם איך היה רוצה שייראה העולם, <b>ו</b>אולם <b>מֵה'</b> <b>מַעֲנֵה</b> <b>לָשׁוֹן,</b> התשובה לכך. דברו של ה' הוא הקובע. פירוש קרוב: אדם מהרהר איך יסדר דבריו, ובסופו של דבר ה' הוא ששם את דבריו בלשון האדם."
Proverbs 16:10,קֶ֤סֶם <b>׀</b> עַֽל־שִׂפְתֵי־מֶ֑לֶךְ בְּ֝מִשְׁפָּ֗ט לֹ֣א יִמְעַל־פִּֽיו׃,"בקובץ הפתגמים הקשורים למלכים, המלך מתואר כאיש מיוחד וראוי לתפקידו. מכיוון שאלה משלי שלמה, ייתכן ששלמה רואה לנגד עיניו מלך כדוגמתו. <b>קֶסֶם,</b> כוח נפלא שרוי <b>עַל־שִׂפְתֵי־מֶלֶךְ.</b> ה' נותן כוח מיוחד למלך, בוודאי אם הוא מלך הגון, ועל כן <b>בְּמִשְׁפָּט</b> <b>לֹא</b> <b>יִמְעַל־פִּיו.</b> הוא לא יטעה בדבריו. גם אם אין הוא מבין ואינו מתכוון לדבריו, ה' מסייע לו לשפוט כראוי."
Proverbs 16:15,בְּאוֹר־פְּנֵי־מֶ֥לֶךְ חַיִּ֑ים וּ֝רְצוֹנ֗וֹ כְּעָ֣ב מַלְקֽוֹשׁ׃,"לעומת זאת <b>בְּאוֹר־פְּנֵי־מֶלֶךְ</b> באהדתו והסברת פניו יש <b>חַיִּים,</b> ברכה והצלחה, <b>וּרְצוֹנוֹ</b> הטוב של המלך <b>כְּעָב</b> <b>מַלְקוֹשׁ,</b> כענן של הגשם האחרון הנושא ברכה. ענן כזה הוא רצוי לכול, נוח למדי ואינו מאיים. מצד אחד, המלך יכול להיות מסוכן; ומצד שני, להביא עזרה מרובה."
Proverbs 17:19,אֹ֣הֵֽב פֶּ֭שַׁע אֹהֵ֣ב מַצָּ֑ה מַגְבִּ֥יהַּ פִּ֝תְח֗וֹ מְבַקֶּשׁ־שָֽׁבֶר׃,"<b>אֹהֵב</b> <b>פֶּשַׁע</b> הוא ה<b>אֹהֵב</b> <b>מַצָּה,</b> מריבה. מי שנהנה להתקוטט הוא בעצם אוהב את החטא, מפני שמריבה תמיד מביאה עמה דבר שאינו טוב. מי ש<b>מַגְבִּיהַּ</b> <b>פִּתְחוֹ,</b> האדם הבוחר להיות בלתי נגיש <b>מְבַקֶּשׁ־שָׁבֶר,</b> מזמין לעצמו מפלה. יש שבעלי מעמד מקשים על אחרים להתקרב אליהם, וכשהם נקלעים לקושי, מתברר להם שאיבדו את ידידיהם. בסופו של דבר הן אלה שמתחככים תמיד עם זולתם, הן אלה שמשתדלים להימנע מכל מעורבות אינם נושעים בדרכם."
Proverbs 18:8,דִּבְרֵ֣י נִ֭רְגָּן כְּמִֽתְלַהֲמִ֑ים וְ֝הֵ֗ם יָרְד֥וּ חַדְרֵי־בָֽטֶן׃,"מידות ותכונות אופי שונות – <b>דִּבְרֵי</b> <b>נִרְגָּן,</b> סכסכן <b>כְּמִתְלַהֲמִים,</b> מכים, מחרפים. אדם הרוצה להשמיץ מתלונן על הכול ומצליף לכל כיוון. לכאורה דבריו חסרי חשיבות, <b>וְ</b>אולם לאמתו של דבר <b>הֵם</b> <b>יָרְדוּ</b> <b>חַדְרֵי־בָטֶן.</b> דבריו יפגעו ויעליבו. לא תמיד שמים לב לכך, מפני שאיש כזה נחשב לפגע רע המשתלח בכול, אבל דבריו עלולים לחדור למעמקי בטנו של הזולת."
Proverbs 19:24,טָ֘מַ֤ן עָצֵ֣ל יָ֭דוֹ בַּצַּלָּ֑חַת גַּם־אֶל־פִּ֝֗יהוּ לֹ֣א יְשִׁיבֶֽנָּה׃,"<b>טָמַן</b> <b>עָצֵל</b> את <b>יָדוֹ</b> <b>בַּצַּלָּחַת,</b> כלי אוכל <b>גַּם</b> <b>אֶל־פִּיהוּ,</b> פיו <b>לֹא</b> <b>יְשִׁיבֶנָּה.</b> הוא כה עצל שאין לו כוח אפילו להחזיר את ידו לפה. העצל מתחיל לעשות דבר, אך אינו משלים מלאכתו, אף לא את צרכיו שלו, וכך הוא נשאר חסר ורעב. לפי המפרשים שצלחת היא מעין כיס, זהו חסר המעש הטומן ידו בחיקו, שעצלותו תביא לכך שלא יהיה לו מזון להכניס אל פיו."
Proverbs 21:11,בַּֽעֲנׇשׁ־לֵ֭ץ יֶחְכַּם־פֶּ֑תִי וּבְהַשְׂכִּ֥יל לְ֝חָכָ֗ם יִקַּח־דָּֽעַת׃,"<b>בַּעֲנָשׁ,</b> כשמענישים <b>לֵץ</b>, יהיר <b>יֶחְכַּם־פֶּתִי,</b> שאמנם אינו מבין הרבה, אבל הוא עשוי ללמוד מניסיון חייו של הלץ. <b>וּבְהַשְׂכִּיל</b>, כשמלמדים <b>לְחָכָם</b>, הוא <b>יִקַּח־דָּעַת</b> ותובנות מתוך העניין עצמו. אלה הן שלוש דרגות של בני אדם: לצים – שלא ילמדו בשום דרך; פתאים – שאינם לומדים מעצמם אבל מתוך התבוננותם בעונשו של זולתם הם מבינים מה ראוי ומה לא; וחכמים – היכולים להבין ללא דוגמא חיה."
Proverbs 22:25,Lest you learn his ways<br>And find yourself ensnared.,"The reason for the above advice, to keep away from someone who is prone to fits of rage, is not because he will inevitably turn his anger upon you, as you are his friend. Nevertheless, you should avoid his company <b>lest you become versed in his ways </b>and accustomed to acting accordingly, <b>and </b>as a result, you will <b>bring a snare upon your</b> <b>soul. </b>It is best to avoid being overly involved with those who serve as a negative role model."
Proverbs 22:26,אַל־תְּהִ֥י בְתֹֽקְעֵי־כָ֑ף בַּ֝עֹרְבִ֗ים מַשָּׁאֽוֹת׃,"<b>אַל־תְּהִי</b> <b>בְתֹקְעֵי־כָף,</b> בין מבטיחי הבטחות ו<b>בַעֹרְבִים,</b> בין אלו הנעשים ערבים על <b>מַשָּׁאוֹת,</b> הלוואות. גם אם אתה מוקף באנשים שחותמים ומתחייבים, כדי להתפאר או מסיבה אחרת, אל תיכנע ללחץ החברתי. שים לב לאפשרויותיך, וזכור שאינך חייב להתחייב."
Proverbs 23:3,אַל־תִּ֭תְאָו לְמַטְעַמּוֹתָ֑יו וְ֝ה֗וּא לֶ֣חֶם כְּזָבִֽים׃,"<b>אַל־תִּתְאָו</b> <b>לְמַטְעַמּוֹתָיו,</b> למטעמיו של המושל, <b>וְהוּא</b> <b>לֶחֶם</b> <b>כְּזָבִים.</b> הארוחה הזו אינה באה מאהבה גרידא. אינך יושב אצל המושל להנאתך או מפני שהוא אוהב אותך. בצד נדיבותו מונח חשבון שתצטרך לפרוע. הרעיון חוזר ומופיע דורות רבים מאוחר יותר בדברי חכמים המייעצים שלא להתקרב לרשויות יותר מדי, כי בעלי הכוח מעוניינים רק בתועלת עצמם ולא בתועלתם של אחרים."
Proverbs 23:23,"Buy truth and never sell it,<br>And wisdom, discipline, and understanding.","Invest the necessary effort and resources to <b>acquire truth, </b>even if that requires one to spend money purchasing books or traveling to a distant land to study. <b>And </b>after you have acquired truth, <b>do not sell it, </b>do not attempt to earn a profit by selling truth for more than you spent acquiring it. Rather, the acquisition of truth itself, alongside<b> wisdom, good conduct, and understanding, </b>should be your reward. In addition, the Sages explain that even if you have spent money to learn Torah, you should still teach others free of charge."
Proverbs 23:23,אֱמֶ֣ת קְ֭נֵה וְאַל־תִּמְכֹּ֑ר חׇכְמָ֖ה וּמוּסָ֣ר וּבִינָֽה׃,"<b>אֱמֶת</b> <b>קְנֵה,</b> השקע מאמץ להשיגה, גם מאמץ כספי כשנדרש. היו זמנים שאנשים שרצו לקנות אמת היו רוכשים ספרים, והיו שקנו אמת ביציאתם למקומות רחוקים כדי לשמוע וללמוד. <b>ו</b>לאחר שקנית אמת <b>אַל־תִּמְכֹּר</b> אותה, אינך צריך לעסוק בהפצתה לאחרים, כאילו הייתה איזה עסק מניב רווחים שעושים בו מקח-וממכר. דייך שיש בידך אמת, <b>חָכְמָה</b> <b>וּמוּסָר</b> <b>וּבִינָה.</b> משמעות מדרשית נוספת: גם אם לימודך בתורה היה כרוך בתשלום, אתה אל תלמד אותה לאחרים תמורת שכר אלא הענק אותה חינם."
Proverbs 23:30,לַֽמְאַחֲרִ֥ים עַל־הַיָּ֑יִן לַ֝בָּאִ֗ים לַחְקֹ֥ר מִמְסָֽךְ׃,"כל אלה נלווים <b>לַמְאַחֲרִים,</b> היושבים עד מאוחר בלילה <b>עַל־הַיָּיִן.</b> עיניהם אדומות מרוב שתייה וחוסר שינה, ולעתים מתוך תגרות הם נפצעים חינם. <b>לַבָּאִים</b> <b>לַחְקוֹר</b>, לבחון <b>מִמְסָךְ,</b> את טיב היין. במקום לשוחח בענייני תורה וביראה הם יושבים עד מאוחר וחוקרים ודורשים אחר משקה טוב יותר."
Proverbs 24:25,וְלַמּוֹכִיחִ֥ים יִנְעָ֑ם וַ֝עֲלֵיהֶ֗ם תָּב֥וֹא בִרְכַּת־טֽוֹב׃,"<b>ו</b>מצד שני – <b>לַמּוֹכִיחִים</b> <b>יִנְעָם,</b> <b>וַעֲלֵיהֶם</b> <b>תָּבוֹא</b> <b>בִרְכַּת־טוֹב.</b> אנשים יברכו אותם. האדם השומר על יושרו והנמנע מהטיית הכף לטובת מי שאינו צודק, אינו פסיבי בהכרח. אדרבא, האיסור להכיר פנים כולל את החובה להטיף מוסר למי שראוי להוכיחו, גם אם הוא צודק בדין."
Proverbs 25:9,רִ֭יבְךָ רִ֣יב אֶת־רֵעֶ֑ךָ וְס֖וֹד אַחֵ֣ר אַל־תְּגָֽל׃,"אם רצונך לריב – את <b>רִיבְךָ</b> <b>רִיב</b> <b>אֶת,</b> עם <b>רֵעֶךָ.</b> כאשר הריב מתמצה בתוך חוג מצומצם של אנשים קרובים, אדם יכול להרשות לעצמו להתקוטט בלי לפחד מביזיונות ומחציית גבולות. גם אם לא תגיעו להסכמה, ותמצאו את עצמכם אפילו בתגרה, מריבתכם לא תביא לבושה. <b>וְגם</b> אז, בזמן המריבה <b>סוֹד</b> של אדם <b>אַחֵר</b> <b>אַל־תְּגָל,</b> תגלה,"
Proverbs 27:13,קַח־בִּ֭גְדוֹ כִּי־עָ֣רַב זָ֑ר וּבְעַ֖ד נׇכְרִיָּ֣ה חַבְלֵֽהוּ׃,"לאדם שהלווה אומרים: <b>""קַח</b> את <b>בִּגְדוֹ</b> של פלוני <b>כִּי</b> <b>עָרַב</b> ל<b>זָר,</b> וגרם לעצמו נזק בלי שהיה מוכרח לכך<b>""</b>; <b>וּ""בְעַד,</b> בעבור אשה <b>נָכְרִיָּה</b> שביקשה ממנו לחלץ אותה מצרה <b>חַבְלֵהוּ,</b> קח אותו במשכון<b>""</b>. מוטב לאדם שלא לערוב לחובות של אחרים, כל שכן לזרים שמבקשים טובה קטנה, כי בסוף הוא עלול לאבד את מה שיש לו."
Proverbs 28:21,הַֽכֵּר־פָּנִ֥ים לֹא־ט֑וֹב וְעַל־פַּת־לֶ֝֗חֶם יִפְשַׁע־גָּֽבֶר׃,"<b>הַכֵּר־פָּנִים,</b> העדפת אדם לטובה שלא כדין, היא מעשה <b>לֹא־טוֹב.</b> קביעה זו מתייחסת במיוחד לשופט, אבל היא נכונה גם לגבי אנשים אחרים המעדיפים את מי שהם יודעים שאינו נוהג כשורה, <b>וְ</b>אולם בצד החובה לנהוג באנשים לפי מידת הדין והצדק, ולא מתוך אינטרס אישי, יש להביא בחשבון ש<b>עַל־פַּת־לֶחֶם</b> <b>יִפְשַׁע־גָּבֶר.</b> קורה שאנשים חוטאים בגלל רעב. יש להתחשב במצבו של החוטא כפי שהוא."
