Proverbs 30:1,דִּבְרֵ֤י <b>׀</b> אָג֥וּר בִּן־יָקֶ֗ה הַמַּ֫שָּׂ֥א נְאֻ֣ם הַ֭גֶּבֶר לְאִֽיתִיאֵ֑ל לְאִ֖יתִיאֵ֣ל וְאֻכָֽל׃,"<b>דִּבְרֵי</b> <b>אָגוּר</b> <b>בִּן־יָקֶה</b>, דמות שאינה מוכרת. חכמים סברו שזה אחד מכינויו של שלמה המלך עצמו, שהרי מן הכתוב ידוע שהיו לו שני שמות לפחות – שלמה וידידיה, ומקובל לייחס לו גם את הכינוי קֹהֶלֶת. לפיכך, חכמים דרשו את השם אגור בן יקה כמי שאוגר דברי חכמה ומקיאם, כלומר מוציא אותם החוצה, והם <b>הַמַּשָּׂא</b>, מעין חזון נבואי:<b>נְאֻם</b> <b>הַגֶּבֶר</b> <b>לְאִיתִיאֵל.</b> בין שאיתיאל הוא האיש הנושא את הנאום, ובין שהוא נמענו של אגור, גם זהותו אינה ידועה, אך אפשר להבין את השם ככינוי במשמעו המילולי. כך נראה שהמלה איתיאל משמשת בהמשך: <b>לְאִיתִיאֵל</b> <b>וְאֻכָל,</b> כלומר, אתי האל, ולכן אוכל ואצליח. זוהי פתיחה סתומה לנאום. והנאום פותח בהצהרה שהקשרה אינו ידוע:"
Proverbs 30:10,אַל־תַּלְשֵׁ֣ן עֶ֭בֶד אֶל־אֲדֹנָ֑ו פֶּֽן־יְקַלֶּלְךָ֥ וְאָשָֽׁמְתָּ׃,"דברי תוכחה שהקשרם אינו ידוע: <b>אַל־תַּלְשֵׁן</b>, תדבר רעות על <b>עֶבֶד</b> <b>אֶל</b>, באוזני <b>אֲדֹנָו,</b> שלא עבד כראוי או שמלאכתו הייתה פגומה, <b>פֶן־יְקַלֶּלְךָ</b> העבד כאשר הוא ילקה בעקבות דבריך, <b>וְאָשָׁמְתָּ,</b> כי אינך מחויב להתערב ביחסי העבד והאדון. פלישתך לענייניהם תביא עליך רעה. קודם דובר על העולם הגדול ועל האדם, ואילו עתה ידובר על הדור, כלומר על האדם הנתון בממד הזמן. תיאורים אלו הולמים כמה דורות."
Proverbs 30:31,זַרְזִ֣יר מׇתְנַ֣יִם אוֹ־תָ֑יִשׁ וּ֝מֶ֗לֶךְ אַלְק֥וּם עִמּֽוֹ׃,"<b>זַרְזִיר</b> <b>מָתְנַיִם,</b> כנראה סוג של כלב צייד, שגם הוא חצוף והולך בגאון; <b>אוֹ־תָיִשׁ,</b> שאף הוא הולך בביטחון, לפי דרכו ועניינו; <b>וּמֶלֶךְ</b> חזק <b>אַלְקוּם</b> <b>עִמּוֹ,</b> שאין מי שמתקומם נגדו. זוהי השוואה לעגנית: המלך עומד בשורה אחת עם שלוש חיות שאינן חשובות אלא הן מיטיבות לכת. המלך דומה לתיש או לאריה בגאונו, אך כידוע, לעתים בקושי הוא זז ממקומו. בהצגת רשימת הצועדים בצעד בוטח יש משום אזהרה שלא להתעסק אתם, מצד אחד; ומצד שני, יש בה לגלוג דק וחריף על הנהגתם של מלכים."
Proverbs 30:32,אִם־נָבַ֥לְתָּ בְהִתְנַשֵּׂ֑א וְאִם־זַ֝מּ֗וֹתָ יָ֣ד לְפֶֽה׃,"<b>אִם־נָבַלְתָּ,</b> נפלת, התבזית – <b>בְהִתְנַשֵּׂא</b>, הרי זה מפני שהתנשאת. במלותיך פיארת את עצמך, וכך גרמת לעצמך בושה. <b>וְאִם־זַמּוֹתָ,</b> זממת רע <b>יָד</b> <b>לְפֶה,</b> שתוק! או: אם אתה חוסם את פיך בידך על הפה, כמו בזמם על פיה של בהמה – לא יאונה לך רע."
Proverbs 31:2,מַה־בְּ֭רִי וּמַֽה־בַּר־בִּטְנִ֑י וּ֝מֶ֗ה בַּר־נְדָרָֽי׃,"<b>מַה־בְּרִי</b>, בני?!<b> וּמַה־בַּר־בִּטְנִי</b>?! דבר של מה-בכך עשית, בני; או: מהו הדבר הבטל שעשית, בני?! <b>וּמֶה בַּר־נְדָרָי.</b> לא נולדת בפשטות, אלא כתוצאה מנדרים שנדרתי, כשם שאמרה חנה על בנה שמואל: כִּי מֵה' שְׁאִלְתִּיו. דברַי אפוא אינם רק דברי מוסר של אם אל בנה, אלא הם נאמרים בהקשר מיוחד."
Proverbs 31:8,"Speak up for the dumb,<br>For the rights of all the unfortunate.","This verse provides further advice for a king, who also functions as a judge: <b>Open your mouth for the mute, </b>whether he is literally dumb, or simply unable to speak about the matter at hand, such as one at a trial who cannot express himself properly. A righteous judge is obligated to assist those who are incapable of pleading their cases, and act<b> for the judgment for all the fragile, </b>people who have no security and stability and whose claims are liable to be negated by the opposing party. Perhaps they came to the court inadequately prepared, while far more powerful, educated individuals of a higher status sit across from them, and therefore they are stifled. A king must pay careful attention to such a case, and try to redress the balance in favor of the weaker side."
Proverbs 31:8,פְּתַח־פִּ֥יךָ לְאִלֵּ֑ם אֶל־דִּ֝֗ין כׇּל־בְּנֵ֥י חֲלֽוֹף׃,"עצה נוספת למלך, שהוא גם השופט: <b>פְּתַח־פִּיךָ לְאִלֵּם, </b>בין שהוא אילם ממש או אילם בעניין מסוים, כמו מי שעומד למשפט ואיננו יכול לבטא את עצמו כראוי. מחובתו של שופט הצדק לסייע לאלה שאינם יודעים להתבטא, ולשים לב <b>אֶל־דִּין</b>, דינם של<b> כָּל־בְּנֵי חֲלוֹף, </b>לאנשים שאין להם חוסן ויציבות וטענתם עלולה להימחק ולהיעלם על ידי הצד שכנגדם. ייתכן שהם ניגשים למשפט ואינם מוכנים כראוי, ולמי שטוען כנגדם יש יותר עצמה, השכלה או מעמד, ומשום כך הם משתתקים. לדין מעין זה צריך המלך לשים את לבו במיוחד, ולנסות לאזן את מצבו של הצד החלש."
Proverbs 31:9,"Speak up, judge righteously,<br>Champion the poor and the needy.<br>","<b>Open your mouth, rule justly,</b><b> and judge the poor and indigent. </b>The righteous judge is obliged not only to decide between the competing parties but to examine the matter in detail, and clarify the claims as best he can. Consequently, a king is not permitted to enjoy physical pleasures like any other person, because he must be careful to retain his strength and clarity of mind at all times. Only in this way can he fulfill his task of leading his country and establishing righteous judgment."
Proverbs 31:9,"פְּתַח־פִּ֥יךָ שְׁפׇט־צֶ֑דֶק וְ֝דִ֗ין עָנִ֥י וְאֶבְיֽוֹן׃ <span class=""mam-spi-pe"">{פ}</span><br>","<b>פְּתַח־פִּיךָ, שְׁפָט־צֶדֶק ו</b>שפוט<b> דִין עָנִי וְאֶבְיוֹן.</b> על שופט הצדק מוטל לא רק להכריע בין הטענות הנשמעות, אלא לרדת לעומק הדברים ולבררם עד כמה שהוא יכול. אשר על כן, מלך אינו רשאי ליהנות מהעולם הזה כדרכו של סתם אדם, מפני שעליו להיזהר ולהישאר כל הזמן בכוחו ובבהירות דעתו. רק כך יוכל למלא את תפקידו לדאוג למדינה ולכונן משפט צדק."
Job 6:5,הֲיִֽנְהַק־פֶּ֥רֶא עֲלֵי־דֶ֑שֶׁא אִ֥ם יִגְעֶה־שּׁ֝֗וֹר עַל־בְּלִילֽוֹ׃,"אין קינותי ותלונותי מגיעות מתוך מצב של שובע וסיפוק. אילו היה הכול כשורה, לא הייתי משמיע את קולות הכאב שלי:<b>ה</b>אם<b> יִנְהַק</b>, ינער, ישמיע קולות של אי-שביעות רצון<b> פֶּרֶא</b>, חמור בר<b> עֲלֵי־דֶשֶׁא</b>?!<b> </b>כאשר מזונו לפניו הוא אוכל בשקט. <b>אִם יִגְעֶה־שּׁוֹר עַל־בְּלִילוֹ</b>, תערובת האוכל שלו?!"
Job 6:20,בֹּ֥שׁוּ כִּֽי־בָטָ֑ח בָּ֥אוּ עָ֝דֶ֗יהָ וַיֶּחְפָּֽרוּ׃,"אבל בפועל <b>בֹּשׁוּ</b>, התביישו, התאכזבו<b> כִי בָטָח,</b> ממה שבטחו בו קודם, <b>בָּאוּ עָדֶיהָ</b> – עד כל אחת מהשיירות שבה תלו את תקוותם,<b> וַיֶּחְפָּרוּ,</b> אכזבתם הביאה אותם לידי בושה ונמיכות רוח. אחיו של איוב, ואולי הכוונה למנחמיו, מאכזבים אותו. הוא מתאר את ציפייתו לדברי ניחומים של אמת בדימוי של הצמֵא למים, המשליך יהבו תחילה על נחלי אכזב שאינם משיבים את נפשו בצמָא, ואחר כך הוא מצפה למים מבני אדם הנודדים במדבר, אך גם אלה אינם מספקים לו את מבוקשו."
Job 8:3,הַ֭אֵל יְעַוֵּ֣ת מִשְׁפָּ֑ט וְאִם־שַׁ֝דַּ֗י יְעַוֵּת־צֶֽדֶק׃,"<b>הַ</b>אם<b> אֵל יְעַוֵּת מִשְׁפָּט, וְאִם־שַׁדַּי יְעַוֵּת־צֶדֶק</b>?!<b> </b>בלדד מטיח באיוב דברים שלא אמר. הרי איוב רק הביע את סבלו, ותהה מדוע אלוקים מכהו ללא הרף, כאילו יש להגן על העולם מפגיעתו הרעה. אולם בלדד, כאליפז, מניח שמאחורי דבריו של איוב יש תרעומת על משפטו של אלוקים, וכלפי זה הוא מגיב."
Job 13:12,זִֽ֭כְרֹנֵיכֶם מִשְׁלֵי־אֵ֑פֶר לְגַבֵּי־חֹ֝֗מֶר גַּבֵּיכֶֽם׃,"<b>זִכְרֹנֵיכֶם</b>, הדברים שאתם מזכירים ומשננים<b> מִשְׁלֵי</b>, משולים ל<b>אֵפֶר, </b>ואין להם קיום. <b>לְגַבֵּי</b>,<b> </b>ערמות, או: גופי<b> חֹמֶר </b>משולים<b> גַּבֵּיכֶם.</b> גביכם או גופיכם אינם מוצקים, אלא הם עשויים חומר המתעוות ומקבל כל צורה שמטביעים בו. דבריכם נאמרים בביטחון עצמי, אך לא אמרות פיכם ולא גופיכם יציבים וחסינים."
Job 22:30,"יְמַלֵּ֥ט אִֽי־נָקִ֑י וְ֝נִמְלַ֗ט בְּבֹ֣ר כַּפֶּֽיךָ׃ <span class=""mam-spi-pe"">{פ}</span><br>","אז בזכותך<b> יְמַלֵּט</b>, יציל אלוקים את <b>אִי־נָקִי, </b>האדם החוטא, <b>וְ</b>הוא<b> נִמְלַט</b>, יינצל<b> בְּבֹר</b>, הודות לניקיון<b> כַּפֶּיךָ. </b>דבריו של אליפז חריפים למדי, אם כי נראה שבסופם הוא מזכיר לאיוב שעדיין הבחירה בידו. כוונת דבריו היא, שאם אדם עושה מעשים רעים וחושב שהוא מסתתר מאלוקים, הוא ייענש בכל תוקף, אבל אם יחזור בתשובה ויפנה אל אלוקים, יבואו לו טובה וברכה. אם כן, הוא אומר לאיוב: הכול תלוי במעשיך, ואינך צריך להאשים את הקדוש ברוך הוא בגורלך."
Job 26:14,"These are but glimpses of His rule,<br>The mere whisper that we perceive of Him;<br>Who can absorb the thunder of His mighty deeds?","<b>Behold, these </b>matters I spoke of here <b>are but the edges of His ways, and how </b>but <b>a trace</b> of His full greatness<b> is heard about Him.</b><b> Who can understand the </b>whole<b> thunder of His might </b>in all its power?<b> </b>No one can grasp the full might of God. Job accepts Bildad’s claim about God’s greatness and power, and goes even further, depicting those strengths of God that do not provide harmony on earth. Yet, while Bildad inferred from the reality of God’s power that a human cannot emerge victorious in his contentions with the Divine, Job remains silent in that regard. It is clear from the context that his silence is a refusal to accept Bildad’s conclusion. Job insists that his recognition of God’s greatness does not mean that he must refrain from complaining. Perhaps Job is arguing that his friends, who have based their claims on wisdom, actually have limited access to true wisdom, which belongs to God alone. Nevertheless, it is also possible that in this speech, Job is less reactive to his friends. Rather, he is giving expression to his own confrontation with his current pitiful state. If so, then he is acknowledging the inability of human intelligence to find explanations for the unfathomable situation in which he finds himself."
Job 37:7,בְּיַד־כׇּל־אָדָ֥ם יַחְתּ֑וֹם לָ֝דַ֗עַת כׇּל־אַנְשֵׁ֥י מַעֲשֵֽׂהוּ׃,"הקדוש ברוך הוא לא רק עושה את כל הדברים הללו, אלא גם יודע מה מעשיו של כל אדם. יתר על כן, <b>בְּיַד</b>, בעד<b> כָּל־אָדָם </b>הגשם החזק<b> יַחְתּוֹם, </b>יסגור, ימנע מלצאת כדי<b> לָדַעַת כָּל־אַנְשֵׁי מַעֲשֵׂהוּ.</b> בעקבות המטר החזק לא יוכל האדם לפקח על ענייניו, מלאכתו ופועליו."
Job 38:8,וַיָּ֣סֶךְ בִּדְלָתַ֣יִם יָ֑ם בְּ֝גִיח֗וֹ מֵרֶ֥חֶם יֵצֵֽא׃,"מן השאלות שבהן ה' מראה לאיוב שאין הוא מכיר את ראשיתו של העולם ואת סוד היווצרותו וקיומו, הוא עובר להשתבח בעצמתו של הים ובכוח האלוקי שרק הוא יכול לבלמו: <b>וַיָּסֶךְ</b>, ומיהו שסָּכר<b> בִּדְלָתַיִם יָם </b>כדי שלא יציף את היבשה עוד <b>בְּגִיחוֹ, מֵרֶחֶם יֵצֵא, </b>בשעה שהים נולד, כביכול. כבר בראשיתו הופיע הים כבול, ונאסר עליו להתפרץ מחוץ לתחומו."
Job 40:1,וַיַּ֖עַן יְהֹוָ֥ה אֶת־אִיּ֗וֹב וַיֹּאמַֽר׃,"לאחר שה' הסב את תשומת לבו של איוב לכך שאין הוא אלא אחד מברואיו הרבים, ולמרות תודעתו המפותחת אין הוא יכול לנהל את העולם. טענותיו של איוב מסתתמות, והוא מעדיף לשתוק. <b>וַיַּעַן ה' אֶת־אִיּוֹב וַיֹּאמַר׃ </b>"
Job 40:14,וְגַם־אֲנִ֥י אוֹדֶ֑ךָּ כִּֽי־תוֹשִׁ֖עַ לְךָ֣ יְמִינֶֽךָ׃,"<b>וְגַם־אֲנִי אוֹדֶךָּ, </b>אודה בצדקתך, <b>כִּי</b>, אם<b> תוֹשִׁעַ לְךָ יְמִינֶךָ. </b>אם תוכל לעשות את אשר אני יכול לעשות בכוחך שלך. אלוקים לועג לאיוב המעמיד עצמו מולו, כאילו יש צד של דמיון בינו לבין יוצרו, ואומר לו: אדרבא, נהל אתה את העולם טוב יותר וגם אני אודה ואשבח אותך."
Job 40:24,בְּעֵינָ֥יו יִקָּחֶ֑נּוּ בְּ֝מוֹקְשִׁ֗ים יִנְקׇב־אָֽף׃,"<b>בְּעֵינָיו </b>של הבהמות<b> יִקָּחֶנּוּ</b> – יבלע את הירדן כולו. בתשוקתו לשתות אותו הוא ישפיל את פניו ויגמע אותו עד אשר <b>בְּמוֹקְשִׁים</b>, באבני הנגף ובמכשולים שעל קרקעית הנהר <b>יִנְקָב </b>הבהמות את ה<b>אָף </b>של עצמו."
Song of Songs 1:2,יִשָּׁקֵ֙נִי֙ מִנְּשִׁיק֣וֹת פִּ֔יהוּ כִּֽי־טוֹבִ֥ים דֹּדֶ֖יךָ מִיָּֽיִן׃,"השיר פותח ללא זיהוי הדמות המדברת, אבל ברור מתוכו שמדובר בשירה של עלמה. <b>יִשָּׁקֵנִי מִנְּשִׁיקוֹת פִּיהוּ, כִּי־טוֹבִים דֹּדֶיךָ</b>, אֲהָביך, או: רטיבות פיך<b> מִיָּיִן.</b> המעבר מגוף נסתר לפנייה ישירה עשוי להיות יותר מאשר סגנון של שירה; זהו ביטוי של חלום, בו הרצייה וההשתוקקות נעשות חיוניות יותר ויותר. מכל מקום, בין אם זה תיאור של חלום או פנייה ישירה לאהוב, הוא מבטא את כמיהתה של הבחורה לנשיקותיו של אהובה. היא מוסיפה לשבח את בן-זוגה:"
Song of Songs 1:4,"מׇשְׁכֵ֖נִי אַחֲרֶ֣יךָ נָּר֑וּצָה הֱבִיאַ֨נִי הַמֶּ֜לֶךְ חֲדָרָ֗יו נָגִ֤ילָה וְנִשְׂמְחָה֙ בָּ֔ךְ נַזְכִּ֤ירָה דֹדֶ֙יךָ֙ מִיַּ֔יִן מֵישָׁרִ֖ים אֲהֵבֽוּךָ׃ <span class=""mam-spi-pe"">{פ}</span><br>","<b>מָשְׁכֵנִי אַחֲרֶיךָ </b>ו<b>נָרוּצָה</b> יחד.<b> </b>זהו תיאור מתוך עולמם של האוהבים; הבחור מושך את הבחורה, והיא מחזיקה בידו ורצה אתו, אך אין זו ריצה סתמית – <b>הֱבִיאַנִי הַמֶּלֶךְ </b>אל<b> חֲדָרָיו </b>הפרטיים. כעת מתגלה רובד נוסף בשיר. היא מגלה לפתע שהאהוב איננו סתם אדם, אלא המלך בכבודו ובעצמו. אמנם בהמשך הוא יתואר לא פעם כרועה צאן, אך ייתכן שבחיזוריו אחריה המלך רוצה להופיע כאדם פשוט ולא כשליט. לעומת זאת, כאשר הם רצים יחד, הוא מושך אותה דווקא לחדרי ארמונו. אפשרות אחרת להבנת הסיפור היא שבעיניה נראה האהוב הרועה כמלך, היא חשה את עצמה כמלכה אהובה שחתנה המלך מביא אותה לביתו. שם<b> נָגִילָה וְנִשְׂמְחָה בָּךְ,</b> בְּךָ, <b>נַזְכִּירָה</b>, נדבר שם על<b> דֹדֶיךָ </b>המתוקים והמשכרים יותר<b> מִיַּיִן.</b> <b>מֵישָׁרִים</b>, כשורה, בצדק<b> אֲהֵבוּךָ,</b> או: הולכי מישרים אוהבים אותך. גם ביטוי זה איננו שייך בפשטות לשיר אהבה, והוא חושף ממד נוסף בשיר. הנשמה, ששוטטה עד כה בעולמה המוכר והחיצוני, מוצאת את עצמה עם ההימשכות, ההערצה והריצה, בתוך חדרי המלך האהוב פנימה. שאיפתה להתאחדות כרוכה בערנות ובחיוניות, מצד אחד, ובתחושה של אינטימיות וסודיות, מצד אחר, בין שהדברים מתרחשים בחוויית ההווה, בזיכרון העבר או בטעימת העתיד."
Song of Songs 1:6,אַל־תִּרְא֙וּנִי֙ שֶׁאֲנִ֣י שְׁחַרְחֹ֔רֶת שֶׁשְּׁזָפַ֖תְנִי הַשָּׁ֑מֶשׁ בְּנֵ֧י אִמִּ֣י נִֽחֲרוּ־בִ֗י שָׂמֻ֙נִי֙ נֹטֵרָ֣ה אֶת־הַכְּרָמִ֔ים כַּרְמִ֥י שֶׁלִּ֖י לֹ֥א נָטָֽרְתִּי׃,"<b>אַל־תִּרְאֻנִי</b>, אל תסתכלו עלי בזלזול מאחר <b>שֶׁאֲנִי שְׁחַרְחֹרֶת,</b> שחורה ביותר, <b>שֶׁ</b>הרי אין זה צבעי הטבעי, אלא<b> שְּׁזָפַתְנִי</b><b> הַשָּׁמֶשׁ.</b> כאן מתבקש הסבר מדוע בת ירושלים ההגונה והצנועה נחשפה כל כך לשמש – <b>בְּנֵי אִמִּי נִחֲרוּ־בִי,</b> כעסו עלי ו<b>שָׂמֻנִי נֹטֵרָה</b>, הפקידו אותי לשמור<b> אֶת־הַכְּרָמִים</b> של המשפחה, להפגין בהם נוכחות אנושית ולהבריח בעלי חיים המנסים לחדור לתוכם. כתוצאה מהתפקיד שהוטל עלי, את <b>כַּרְמִי שֶׁלִּי לֹא נָטָרְתִּי.</b> גם לי יש כרם משלי, אבל בני המשפחה שרבו אתי דאגו לשלהם בלבד, ואילו כרמי שלי נעזב. אפשר להבין תיאורים אלו כחוויה פרטית של מי שנדחקת להיחלץ ממצוקתה וכיעורה החיצוניים ולחשוף את יופיה החבוי, אך גם כמצבה של הנפש ושל האומה בכללה. אמנם אינני נקייה וצחה כשלג, אבל צבעי השחור אינו פגם טבעי, וגם אינו נובע ממצב שבחרתי בו. כעַם אולצנו להסתובב הרבה בחוץ; בעטיים של עמים אחרים נדחקנו לשאת בתפקידים שונים לטובת העולם ושמירת כרמיו, ולא נותרו לנו זמן ואפשרות לשמור על כרמנו שלנו."
Song of Songs 1:9,לְסֻֽסָתִי֙ בְּרִכְבֵ֣י פַרְעֹ֔ה דִּמִּיתִ֖יךְ רַעְיָתִֽי׃,"והוא ממשיך לבטא בקיצור את אהבתו אליה, המודגשת אף יותר מביטויי אהבתה אליו: <b>לְסֻסָתִי</b>, לסוסה ש<b>בְּרִכְבֵי פַרְעֹה דִּמִּיתִיךְ,</b> את<b> </b>דומה בעיני,<b> רַעְיָתִי. </b>הסוסים נתפסים בעיני מרבית בני האדם כיצורים יפים. הסוסה הרתומה לרכבי פרעה מסורקת, מקושטת ומושלמת. הוא מפאר של תכונות הנערה ויופיה, הרבה מעל לרועָה פשוטה."
Song of Songs 1:11,תּוֹרֵ֤י זָהָב֙ נַֽעֲשֶׂה־לָּ֔ךְ עִ֖ם נְקֻדּ֥וֹת הַכָּֽסֶף׃,"<b>תּוֹרֵי</b>, טורי, מחרוזות<b> זָהָב נַעֲשֶׂה־לָּךְ עִם נְקֻדּוֹת הַכָּסֶף.</b> צבע נקודות הכסף בולט ומשלים את הרקע הזהוב, והוא דומה לנקודות הלבנות המופיעות על בעלי חיים שונים שצבע גופם חום או צהבהב. כשמדובר בכנסת ישראל, רכבי פרעה מזכירים את יציאת מצרים; הקישוטים – את הרכוש הגדול שלקחו ישראל; וגם הזהב והכסף התפרשו באופנים רבים, בין על דרך הפשט ובין על דרך הסוד."
Song of Songs 1:17,"Cedars are the beams of our house,<br>Cypresses the rafters.","<b>The beams of our houses are </b>made of <b>cedars,</b><b> and our rafters are junipers.</b><b> </b>Two aspects of the lovers’ relationship are intertwined in this passage. Alongside passionate love, there is a motif of calm and the stability of home. When the woman calls to her lover, “Draw me; after you we will run” (verse 4), the intention is not to run and play aimlessly, as the same verse concludes: “The king brought me to his chambers.” The blossoming love between them, which is expressed by the fresh bed of the previous verse, is followed by the dream of sharing a home. Their relationship must eventually be brought into a stable framework. The young man and woman, though completely engulfed in a passionate love, still set as their goal a shared home, symbolizing the nation of Israel in Egypt or in the wilderness who, caught up in their romance with God, still yearned to reach their homeland."
Song of Songs 1:17,"קֹר֤וֹת בָּתֵּ֙ינוּ֙ אֲרָזִ֔ים <span class=""mam-kq""><span class=""mam-kq-k"">(רחיטנו)</span> <span class=""mam-kq-q"">[רַהִיטֵ֖נוּ]</span></span> בְּרוֹתִֽים׃","<b>קֹרוֹת בָּתֵּינוּ </b>עשויות <b>אֲרָזִים,</b> ו<b>רָהִיטֵנוּ בְּרוֹתִים. </b>שני צדדים שזורים בשירה הזו. בצד האהבה הלוהטת, שלפעמים יש בה אפילו פראות, מופיע מוטיב של בית ורגיעה. מָשְׁכֵנִי אַחֲרֶיךָ נָרוּצָה אינו מבטא ריצה סתמית והשתובבות לשמה, כי בסופה נכנסים לחדרי המלך; לאחר האהבה הפורחת, המבוטאת בערש הרענן, מגיע החלום על הבית. מערכת היחסים הזו צריכה בסופו של דבר להתמסד – על דרך המשל: בחור ובחורה הלוהטים באהבתם, אך מעמידים את ביתם המשותף כתכלית; ועל דרך הנמשל: ישראל הדבקים בה' במצרים או במסע מופלא במדבר, אך משתוקקים תמיד להגיע הביתה."
Song of Songs 2:4,הֱבִיאַ֙נִי֙ אֶל־בֵּ֣ית הַיָּ֔יִן וְדִגְל֥וֹ עָלַ֖י אַהֲבָֽה׃,"<b>הֱבִיאַנִי אֶל־בֵּית הַיָּיִן,</b> מין בית מרזח, שבו הגברים שותים. לא ברור אם בית היין שירת גם נשים. על כן נראה שזהו ביטוי לחלומה של האוהבת שאהוב לבה יופיע אִתה בכל מקום שהוא הולך אליו. ושמא בית היין היה המקביל לבית קפה בימינו. <b>וְדִגְלוֹ</b>, מבטו<b> עָלַי אַהֲבָה.</b> או: אהבתנו היא דגלו. הוא שמח להיראות באהבה הקורנת מחברתנו."
