Psalms 73:23,וַאֲנִ֣י תָמִ֣יד עִמָּ֑ךְ אָ֝חַ֗זְתָּ בְּיַד־יְמִינִֽי׃,"לכאורה, הליכה זו אחר ה', בלי טעם ודעת, אינה נושאת עמה הישגים נראים לעין, <b>ו</b>אולם בעצם ההליכה הזו יש לי הזכות הגדולה – <b>אֲנִי תָמִיד </b>יחד<b> עִמָּךְ</b>, אף שאינני מבין ואינני יודע. כיוון שאני הולך אחריך – <b>אָחַזְתָּ בְּיַד יְמִינִי</b> להוליך אותי."
Psalms 73:25,מִי־לִ֥י בַשָּׁמָ֑יִם וְ֝עִמְּךָ֗ לֹֽא־חָפַ֥צְתִּי בָאָֽרֶץ׃,"בשעה שאדם מעמיק דעתו באהבת ה' ובתשוקה אליו, ענייני העולם, הצרות והמחסור של הצדיקים, או העובדה שאין הם זוכים להישגים חיצוניים, מאבדים את משמעותם. הרי<b> מִי לִי </b>מלבדך<b> בַשָּׁמָיִם,</b> שאחפוץ לזכות בו, <b>וְ</b>כל אותם דברים אחרים שיכולים להיות <b>עִמְּךָ</b>: עושר, כבוד, הצלחה <b>לֹא חָפַצְתִּי בָאָרֶץ. </b>"
Psalms 76:11,כִּֽי־חֲמַ֣ת אָדָ֣ם תּוֹדֶ֑ךָּ שְׁאֵרִ֖ית חֵמֹ֣ת תַּחְגֹּֽר׃,"<b>כִּי חֲמַת אָדָם</b>, אנשים שהיו מלאי חמה, בשעה שהם מגלים שאינם יכולים לעשות כרצונם – <b>תּוֹדֶךָּ</b>, הם נכנעים ומודים לך על הצלתם. <b>שְׁאֵרִית חֵמֹת</b>,<b> </b>את מה שנשאר מחמת-אדם זו<b> תַּחְגֹּר,</b> תקשור, ותבטא אותה רק לפי רצונך; תחגור אותם עליהם כאות הכנעה; או: אנשים מלאי חֵמה ייכנעו ויודו לך כאשר תחגור חֵמה להינקם מאויביך."
Psalms 89:1,A <i>maskil</i> of Ethan the Ezrahite.<br>,"<b>A contemplation by Eitan the Ezrahite. </b>Like other psalms with the heading <i>maskil</i>, this psalm seeks to present a specific idea, woven throughout the text, in a poetic and contemplative manner. The exact identity of Eitan the Ezrahite is unclear, as he is rarely mentioned in the Bible. Some commentators believe that the term “Ezrahite” indicates that he was Eitan son of Zerah, from the tribe of Judah; others identify him with the Levite by that name who sang in the Temple in its early days. According to one interpretation, Eitan is another name for the patriarch Abraham; if so, the events mentioned in the psalm represent his prophecy regarding incidents that would occur in the distant future, namely, the middle or end of the First Temple era."
Psalms 89:1,מַ֝שְׂכִּ֗יל לְאֵיתָ֥ן הָאֶזְרָחִֽי׃,"<b>מַשְׂכִּיל</b>, שיר ובו התבוננות, ביטוי פיוטי לרעיון, <b>לְאֵיתָן הָאֶזְרָחִי, </b>שאולי הוא המשורר מבית לוי שהוזכר בדברי הימים, ייתכן שהיה מצאצאי זרח (‘אזרחי') שמיהודה, והיו שראו בשם זה כינוי לאברהם אבינו. לפי פירוש זה מכיל המזמור דברי נבואה רחוקים, שכן הוא עוסק במאורעות שהתרחשו באמצע תקופת הבית הראשון או בסופה."
Psalms 89:48,זְכׇר־אֲנִ֥י מֶה־חָ֑לֶד עַל־מַה־שָּׁ֝֗וְא בָּרָ֥אתָ כׇל־בְּנֵֽי־אָדָֽם׃,"<b>זְכָר אֲנִי,</b> אותי, זכור <b>מֶה </b>הוא<b> חָלֶד</b>, העולם – הוויה שאינה יציבה וברורה, מציאות הכרוכה בחידלון. <b>עַל מַה</b>, למה<b> שָּׁוְא בָּרָאתָ כָל בְּנֵי אָדָם</b>?! המפלות, הכישלונות, הבושה וחוסר התקווה אופפים לא רק את המלך אלא את כל הממלכה וכלל בני אדם, שהרי לחייו של כל אדם יש קץ –"
Psalms 90:11,מִֽי־י֭וֹדֵעַ עֹ֣ז אַפֶּ֑ךָ וּ֝כְיִרְאָתְךָ֗ עֶבְרָתֶֽךָ׃,"<b>מִי </b>מאתנו <b>יוֹדֵעַ </b>עד היכן יכול להגיע <b>עֹז אַפֶּךָ,</b> כוח כעסך, <b>וּכְיִרְאָתְךָ</b>, כמו שאנו מתייראים ממך, הלוא היא גם <b>עֶבְרָתֶךָ,</b> כעסך. מצד אחד, אנו יודעים שהחטא יגרור עונש, אם כי לא תמיד אנו משערים בנפשנו את גודלו וחומרתו; ומצד שני, התרוצצויותינו הרבות כמעט אינן מותירות לנו הזדמנויות להעריך את המציאות כמות שהיא."
Psalms 90:12,לִמְנ֣וֹת יָ֭מֵינוּ כֵּ֣ן הוֹדַ֑ע וְ֝נָבִ֗א לְבַ֣ב חׇכְמָֽה׃,"אנא,<b> לִמְנוֹת</b>, לספור את <b>יָמֵינוּ</b>, ימי חיינו כהווייתם, כדי שבאמת נתפוס את קיצורם ואת חלופיותם,<b> כֵּן הוֹדַע</b>, תן בנו את ההכרה וההבנה. <b>ו</b>אם נהיה מודעים לזמן העובר, <b>נָבִיא</b>, נצמיח <b>לְבַב חָכְמָה,</b> לב חכם. לכל הפחות לא נלך אחר דברים חסרי ערך או רעים, שתועלתם קצרת טווח, ואין להם קיום אל מול פניך – בין משום שאינם מחזיקים מעמד לאורך זמן, ובין משום שבעקבותיהם יגיע עונשם."
Psalms 92:1,A psalm. A song; for the sabbath day.<br>,"<b>A psalm, a song for the Sabbath day. </b>Although it was sung in the Temple every Sabbath, this psalm is not really about the Sabbath day as such, but rather what the Sages refer to as “the day that is entirely a Sabbath,” that is, the Messianic Era, when a final reckoning will enable everything to be understood clearly in hindsight. In essence, the psalm is a reflection and overview of history, in which all negative events will be understood as ephemeral phenomena, and precursors of evil’s ultimate downfall. The righteous, by contrast, will prove to have permanence, stability, and continuous prosperity."
Psalms 92:3,לְהַגִּ֣יד בַּבֹּ֣קֶר חַסְדֶּ֑ךָ וֶ֝אֱמ֥וּנָתְךָ֗ בַּלֵּילֽוֹת׃,"הזמר לשם ה' איננו אחיד – חלקוֹ האחד הוא <b>לְהַגִּיד בַּבֹּקֶר חַסְדֶּךָ, ו</b>חלקו האחר – לומר את<b> אֱמוּנָתְךָ בַּלֵּילוֹת.</b> חלוקת מהלכו של העולם לפי זמני היממה נושאת משמעות סמלית: הזמן המאיר, שבו חסד ה' ניכר, וטובתו גלויה לעין, לעומת זמן החשכה, הסתר הפנים או הדכדוך, שבו האמונה היא המלווה את האדם."
Psalms 92:8,בִּפְרֹ֤חַ רְשָׁעִ֨ים <b>׀</b> כְּמ֥וֹ־עֵ֗שֶׂב וַ֭יָּצִיצוּ כׇּל־פֹּ֣עֲלֵי אָ֑וֶן לְהִשָּׁמְדָ֥ם עֲדֵי־עַֽד׃,"למשל – <b>בִּפְרֹחַ</b> <b>רְשָׁעִים כְּמוֹ עֵשֶׂב,</b> כשהם צומחים בכל מקום ובלי גבולות מוגדרים, <b>וַיָּצִיצוּ</b>, מופיעים כצמחים הצצים מן האדמה או פורחים<b> כָּל פֹּעֲלֵי</b>, עושי<b> אָוֶן</b>, רֶשע. הכסיל אינו רואה פתרון לקושיה זו; ואולם גידולם והצלחתם-לכאורה של הרשעים אינם אלא אמצעים <b>לְהִשָּׁמְדָם עֲדֵי עַד.</b> אכן, לשם השמדתם של עשבים שוטים, אפשר להשקות את האדמה ולחכות שאותם עשבים יעלו ויצמחו מעט, כדי שאפשר יהיה לחרוש את השדה ולהשמידם על מנת שלא יצמחו עוד. כך שגשוגם של רשעי העולם – מטרתו להביא להשמדתם המלאה, שאין אחריה תקומה."
Psalms 94:11,יְֽהֹוָ֗ה יֹ֭דֵעַ מַחְשְׁב֣וֹת אָדָ֑ם כִּי־הֵ֥מָּה הָֽבֶל׃,"אדרבא, ה' איננו מתערב או פועל מיד להעניש את הרעים ולהיטיב עם הטובים משום שמחשבותיו מעמיקות הרבה יותר. <b>ה' יֹדֵעַ מַחְשְׁבוֹת אָדָם, כִּי הֵמָּה</b>, הן<b> הָבֶל,</b> בנות-חלוף וחסרות משמעות. על כן הוא יודע שלא יתממשו מחשבותיהם של זוממי הרעה, המבקשים להגיע לגדולה ובדרכם רומסים את האחרים, ושסופן של תכניותיהם – כליה. ומנגד, ראוי שהאנשים הסובלים לא יתמקדו רק בכאב שבסבלם, שכן לכאב יש היבט נוסף:"
Psalms 104:2,עֹֽטֶה־א֭וֹר כַּשַּׂלְמָ֑ה נוֹטֶ֥ה שָׁ֝מַ֗יִם כַּיְרִיעָֽה׃,"הברכה הראשונה שמברכת הנפש היא ברכה ישירה, לה' עצמו: <b>ה' אֱלֹהַי, גָּדַלְתָּ</b>, גדול אתה<b> מְּאֹד.</b> <b>הוֹד וְהָדָר לָבָשְׁתָּ,</b> אתה לובש. הבריאה כולה היא מעין לבוש של אלוקים. עתה מתחיל המהלל להתבונן בפרטי הלבוש ההדור הזה: ה'<b> עֹטֶה</b>, עוטף את עצמו או את העולם ב<b>אוֹר כַּשַֹּלְמָה,</b> כשמלה, כגלימה או כטלית. ה' <b>נוֹטֶה </b>את כיפת ה<b>שָׁמַיִם</b> <b>כ</b>מו שפורסים <b>יְרִיעָה, </b>כאוהל גדול."
Psalms 113:6,"sees what is below,<br>in heaven and on earth?","<b>who looks down to see what is in heaven and earth? </b>Here we come to the second facet of God’s praise: His awareness of all His creations on earth and His care for them. Because God is “above the heavens” (verse 4) and “sits on high” (verse 5), even when He observes what is in heaven He is looking down, as it were. From His perspective, the heavens and everything within them are no more exalted than the creatures of the earth; He cares about everyone and everything to the same degree."
Psalms 113:6,הַֽמַּשְׁפִּילִ֥י לִרְא֑וֹת בַּשָּׁמַ֥יִם וּבָאָֽרֶץ׃,"צדה השני של תהילת ה' הוא שה' משגיח גם על פרטי העולם הנמוכים ביותר: דווקא משום שהקדוש ברוך הוא נשגב כל כך, הוא גם <b>הַמַּשְׁפִּילִי</b>, משפיל <b>לִרְאוֹת </b>ממרומיו <b>בַּשָּׁמַיִם וּבָאָרֶץ,</b> ודואג ליצורי ארץ לא פחות משהו מטפח את שוכני השמים."
Psalms 114:3,"The sea saw them and fled,<br>Jordan ran backward,","After that, the Almighty revealed Himself further to them:<i> </i><b>The </b>Red<b> Sea saw and fled. </b>The verse describes the splitting of the Red Sea from the perspective of the water itself rather than the perspective of Israel’s salvation. After witnessing the revelation of God’s glory, the sea retreated in awe. And later, as the Israelites came to the Land of Israel, <b>the Jordan </b>River<b> </b>similarly <b>turned back</b> from its course to allow them to cross into the land."
Psalms 116:1,אָ֭הַבְתִּי כִּי־יִשְׁמַ֥ע <small>׀</small> יְהֹוָ֑ה אֶת־ק֝וֹלִ֗י תַּחֲנוּנָֽי׃,"לא רק בזמנים שמחים אני מרגיש את קרבת ה'; <b>אָהַבְתִּי כִּי יִשְׁמַע ה' אֶת קוֹלִי</b>, קול<b> תַּחֲנוּנָי.</b> אני שמח בה' לא רק בכך שהוא מושיע אותי; אני אוהב את עצם הקשבתו לתפילתי."
Psalms 116:11,"and said rashly,<br>“All men are false.”<br>","<b>In my haste, I said: All men are false. </b>Suffering is a subjective experience that is often exacerbated by the sense of being alone and abandoned, and many people in distress jump to the mistaken conclusion that no one around them cares. In truth, even in the darkest hours, people have at least a few loyal friends who will not abandon them. But this may not be immediately apparent, and the seeming lack of support can lead to despondency."
Psalms 116:11,אֲ֭נִי אָמַ֣רְתִּי בְחׇפְזִ֑י כׇּֽל־הָאָדָ֥ם כֹּזֵֽב׃,"באותן שעות קשות חשתי בדידות קשה. ומתוך חווייתי הסובייקטיבית <b>אֲנִי אָמַרְתִּי בְחָפְזִי</b>, בפזיזותי<b>: כָּל הָאָדָם כֹּזֵב</b>. ואולם לא פעם הסבל מתעצם בגלל ההנחה המוטעית של הסובל שאיש מסובביו אינו מתעניין בו בכנות ואינו נאמן לו. לחלופין: בשעת העינוי והדחק (חָפְזִי – דחקי) הגעתי להכרה כי רק בך אמונתי ומבטחי ולא בבני אדם."
Psalms 119:25,דָּבְקָ֣ה לֶעָפָ֣ר נַפְשִׁ֑י חַ֝יֵּ֗נִי כִּדְבָרֶֽךָ׃,"המשורר ממשיך וכורך, בנעימה חזקה יותר, את בקשת החיים והסרת המכשולים עם משאלתו העיקרית – הדבקות בתורה ומצוותיה: <b>דָּבְקָה לֶעָפָר נַפְשִׁי</b>, אני מדוכא ומדוכדך, כאילו הייתי רובץ באדמה, ואני יכול רק להתפלל: <b>חַיֵּנִי</b> במצב הקשה הזה <b>כִּדְבָרֶךָ,</b> כמו שיש חיים לדבריך. או: כפי שדיברת אלי והבטחת לי."
Psalms 119:49,זְכֹר־דָּבָ֥ר לְעַבְדֶּ֑ךָ עַ֝֗ל אֲשֶׁ֣ר יִֽחַלְתָּֽנִי׃,"לאחר שתיאר המשורר את העתיד המיוחל, המרחב והביטחון שיאפשרו לו לדבר במצוות לעיני כול ולהשיב למלעיגים עליהם, הוא מציג הווה אחר:<b>זְכֹר דָּבָר</b>, את הבטחתך <b>לְעַבְדֶּךָ</b> – לי,<b> עַל אֲשֶׁר</b>, אשר עליו <b>יִחַלְתָּנִי,</b> ציפית ממני לגדולות וקירבת אותי אליך. או: הדבר שעשית אותי מייחל אליו."
Psalms 119:105,נֵר־לְרַגְלִ֥י דְבָרֶ֑ךָ וְ֝א֗וֹר לִנְתִיבָתִֽי׃,"אני מוסר עצמי לתורה המאירה את דרכי, ונשבע לשומרה.<b>נֵר </b>המאיר<b> לְרַגְלִי </b>הוא <b>דְבָרֶךָ</b>. הודות לו אני יודע איפה להציב את רגלי, <b>וְ</b>הוא גם <b>אוֹר לִנְתִיבָתִי.</b> דברך משמש לי כאור ומופת ומאפשר לי למצוא את הדרך הנכונה."
Psalms 120:4,"A warrior’s sharp arrows,<br>with hot coals of broom-wood.<br>","Indeed, in some instances, the slanderer not only receives no benefit from his malicious speech, but is actually punished, whether directly or indirectly, and all he receives as a consequence of his malicious speech are the <b>sharp arrows of the warrior </b>that are aimed at him, and<b> burning coals of the broom bush,</b><b> </b>which burn for a considerable amount of time. Far from being rewarded, the slanderer will be punished with prolonged suffering."
Psalms 121:2,עֶ֭זְרִי מֵעִ֣ם יְהֹוָ֑ה עֹ֝שֵׂ֗ה שָׁמַ֥יִם וָאָֽרֶץ׃,"מתוך המצור שאני מצוי בו ומתוך אימתה של התקפה העלולה לבוא עלי, <b>אֶשָּׂא עֵינַי אֶל הֶהָרִים</b> – <b>מֵאַיִן יָבֹא עֶזְרִי</b>? האם יגיעו כוחות עזר מן ההרים, ואם כן – מאין הם יצוצו?ייתכן שמעברו השני של ההר אין שום כוחות צבא, אבל <b>עֶזְרִי מֵעִם ה', עֹשֵׂה שָׁמַיִם וָאָרֶץ,</b> והוא אשר בידו הכוח והממשלה בכל העולם כולו."
Psalms 122:3,"Jerusalem built up, a city knit together,","From our vantage point at the city’s gates, we can see how <b>the built-up Jerusalem is</b> <b>like a city </b>that has been <b>joined together, </b>in a literal sense. The city was built on a cluster of adjacent hills that, before the time of David, may have been separate civic, and perhaps also military, units. It was David who unified the city, though it was only during the reign of Solomon that the wall encompassing it was built."
Psalms 122:3,יְרוּשָׁלַ֥͏ִם הַבְּנוּיָ֑ה כְּ֝עִ֗יר שֶׁחֻבְּרָה־לָּ֥הּ יַחְדָּֽו׃,"מן השערים נשקפה <b>יְרוּשָׁלִָם הַבְּנוּיָה כְּעִיר שֶׁחֻבְּרָה לָּהּ יַחְדָּו.</b> ירושלים הייתה בנויה על כמה גבעות סמוכות, שייתכן שעד לזמנו של דוד הייתה כל אחת מהן יחידה עירונית ואולי גם יחידה צבאית נבדלת, ודוד הוא שאיחד אותה. מאוחר יותר בנה שלמה חומה שהקיפה את כל חלקי העיר."
Psalms 129:6,יִ֭הְיוּ כַּחֲצִ֣יר גַּגּ֑וֹת שֶׁקַּדְמַ֖ת שָׁלַ֣ף יָבֵֽשׁ׃,"בימי קדם היו הגגות השטוחים עשויים לעתים מטיט ואדמה, ומשום כך לפעמים צמחו עליהם שיבולים, אולם השיבולים הללו הגיעו עד שלב החציר, הגבעולים הירוקים, ולא הבשילו. באמצעות הדימוי הזה המשורר מקלל את האויבים: <b>יִהְיוּ כַּחֲצִיר גַּגּוֹת,</b> <b>שֶׁקַּדְמַת</b>, עוד לפני<b> </b>ש<b>שָׁלַף</b>, הוציא שיבולת או פרח, כבר הוא<b> יָבֵשׁ</b>, שהרי אין בגגות די אדמה כדי להזין אותו."
Psalms 139:19,אִם־תִּקְטֹ֖ל אֱל֥וֹהַּ <small>׀</small> רָשָׁ֑ע וְאַנְשֵׁ֥י דָ֝מִ֗ים ס֣וּרוּ מֶֽנִּי׃,"כמו במזמורים נוספים שיש בהם הסתכלות בהרמוניה שבין ה' לעולמו, גם כאן יש מודעות לנקודות של חשכה ושל פגם המצויות בעולם. אין אלה פגמים בעצם מעשה הבריאה אלא בדברים הנעשים בידי בני אדם; רק בני האדם, בעלי חופש בחירה, מסוגלים ליצור רע במודע. הכתמים והחללים שבמציאות קשורים אפוא לאדם. ולכן – <b>אִם</b>, הלוואי ש<b>תִּקְטֹל, אֱלוֹהַּ</b>, את<b> </b>ה<b>רָשָׁע,</b> <b>ו</b>אני פונה אליכם,<b> אַנְשֵׁי דָמִים </b>בקריאה:<b> סוּרוּ מֶנִּי,</b> ממני. ושוב מפנה דיבורו אל אלוקים:"
Psalms 139:20,אֲשֶׁ֣ר יֹ֭מְרוּךָ לִמְזִמָּ֑ה נָשׂ֖וּא לַשָּׁ֣וְא עָרֶֽיךָ׃,"אנשים אלו הם <b>אֲשֶׁר יֹמְרוּךָ</b>, אומרים את שמך, מזכירים אותך, נשבעים בך ואף מרוממים אותך<b> לִמְזִמָּה,</b> לשם<b> </b>מזימותיהם הרעות.<b> נָשׂוּא</b>, נשאו את שמך <b>לַשָּׁוְא</b>, לא רק מבחינת התוצאות אלא גם מבחינת שאיפותיהם <b>עָרֶיךָ,</b> אויביך. הרשעים נושאים שם שמים לשם דברים חסרי ערך ותוכן. אף על פי שאותם אנשים אינם אויביו הפרטיים של המשורר, אין הוא יכול שלא להיות מעורב במלחמת הטוב והרע –"
Psalms 145:9,טוֹב־יְהֹוָ֥ה לַכֹּ֑ל וְ֝רַחֲמָ֗יו עַל־כׇּל־מַעֲשָֽׂיו׃,"<b>טוֹב ה' לַכֹּל, וְרַחֲמָיו עַל כָּל מַעֲשָׂיו.</b> חסד ה' אינו ניתן רק לחלק מן הבריאה; הוא כללי ומאוזן. ה' טוב גם לאלה הנמצאים למעלה וגם לאלה שלמטה, והוא מרחם על היצורים הטורפים כמו על הנטרפים."
Psalms 145:13,Your kingship is an eternal kingship;<br>Your dominion is for all generations.,"A partial list of praise follows:<i> </i><b>Your kingship is an eternal kingship, and Your reign is in every generation. </b>God’s sovereignty is eternal. There is a difference in nuance between the two terms used in this verse for ruling. <i>Malkhut</i>, “kingship,” conveys a knowing and willing acceptance of God’s sovereignty, whereas <i>memshala</i>, “reign,” refers to God’s controlling rule, which exists independent of man’s awareness and acknowledgment. In accordance with the alphabetical structure of the psalm, the next verse should begin with the letter <i>nun</i>. However, this letter is skipped, and the psalm continues with a verse beginning with the following letter, <i>samekh</i>:"
Psalms 145:17,צַדִּ֣יק יְ֭הֹוָה בְּכׇל־דְּרָכָ֑יו וְ֝חָסִ֗יד בְּכׇל־מַעֲשָֽׂיו׃,"<b>צַדִּיק ה' בְּכָל דְּרָכָיו.</b> הואיל וידיעתנו מוגבלת, נראה לנו לפעמים שאין צדק בדרכי העולם. על כן מוטל עלינו להודיע שלאמתו של דבר הצדק האלוקי כולל ומקיף הכול.<b> ו</b>נוסף על כך ה' גם <b>חָסִיד</b>, עושה חסד מעבר למה שמתחייב על פי הצדק, <b>בְּכָל מַעֲשָׂיו. </b>"
Psalms 150:6,Let all that breathes praise the L<small>ORD</small>.<br>Hallelujah.,"<b>Let all who breathe praise the Lord. </b>The expression<b> </b>“let all who breathe” or, more literally, “all breaths,” relates both to every individual and to all forms of praise. It follows that praise of God can be expressed in all types of sound, as well as in every nuance and facet of a person’s soul. The additional meaning of “all who breathe” is that the totality of voices, in all their distinct varieties of tone, join in a single chorus of praise: <b>Halleluya. </b>"
Proverbs 1:17,כִּֽי־חִ֭נָּם מְזֹרָ֣ה הָרָ֑שֶׁת בְּ֝עֵינֵ֗י כׇּל־בַּ֥עַל כָּנָֽף׃,"<b>כִּי</b> ל<b>חִנָּם</b> <b>מְזֹרָה</b> <b>הָרָשֶׁת</b> <b>בְּעֵינֵי</b> <b>כָּל־בַּעַל</b> <b>כָּנָף.</b> בעיני העופות הרשת פרושה בלי סיבה, וכיוון שאין הם יודעים שזו מלכודת הם נתפסים בה. גם אותם אנשי חטא המתפתים להתפרנס מממונם של אחרים, לכודים במלכודת ומנסים גם ללכוד אותך בלא שתהיה ער לכך. זוהי חבורה של חכמים-מצליחים לכאורה, אך אין הם מבינים מה הם עושים."
Proverbs 3:5,בְּטַ֣ח אֶל־יְ֭הֹוָה בְּכׇל־לִבֶּ֑ךָ וְאֶל־בִּ֥֝ינָתְךָ֗ אַל־תִּשָּׁעֵֽן׃,"כמה הדרכות קצרות בטיב יחסו של האדם לאלוקיו: <b>בְּטַח</b> ופנה תמיד <b>אֶל־ה'</b> <b>בְּכָל־לִבֶּךָ,</b> כדי שידריך אותך בדרכך ויתמוך בך, <b>וְאֶל־בִּינָתְךָ</b> <b>אַל־תִּשָּׁעֵן.</b> גם כאשר דרך ה' או דברו אינם נראים לך, מוטב שתסמוך עליו ולא על חכמתך שלך. בתחומים רבים צריך אדם לבטוח בה':"
Proverbs 5:23,"He will die for lack of discipline,<br>Infatuated by his great folly.","<b>He will die for lack of admonishment, and in his abundant foolishness he will err.</b> The young person to whom these warnings are directed views himself as his own master. Wandering the streets of the city, he may encounter the strange woman either at her initiative or at his own. These verses explain to him that the other woman, to whom men are naturally attracted, is nothing but a beautiful illusion, who will ultimately lead him to physical and spiritual destruction. As explained above, on the symbolic level the temptress represents foreign ideologies. The message here is that you have the Torah that is yours; why do you turn to other systems of thought or religions? If you allow yourself to be seduced into following them, you will ultimately lose out, become trapped, and destroyed."
Proverbs 5:23,"ה֗וּא יָ֭מוּת בְּאֵ֣ין מוּסָ֑ר וּבְרֹ֖ב אִוַּלְתּ֣וֹ יִשְׁגֶּֽה׃ <span class=""mam-spi-pe"">{פ}</span><br>","<b>הוּא</b> <b>יָמוּת</b> <b>בְּאֵין,</b> בהיעדר <b>מוּסָר,</b> <b>וּבְרֹב</b> <b>אִוַּלְתּוֹ,</b> טיפשותו <b>יִשְׁגֶּה,</b> יטעה. הצעיר שאליו מופנות אזהרות אלה מרגיש אדון לעצמו. הוא מסתובב ברחובות העיר ועשוי לפגוש את האשה הזרה מרצונו או מרצונה. כאן נאמר שהאשה האחרת – שדרך העולם להימשך אחריה – אינה אלא חזון תעתועים של יופי, שבפועל מוליך לבאר שחת בגשמיות וברוחניות. כאמור, במובן הסמלי הכוונה לחכמות: יש לך תורה שהיא שלך והיא לפניך – ולמה אתה פונה לאסכולות, שיטות ודתות זרות? אם תתפתה אחריהן, בסופו של דבר תפסיד, תסתבך ותיהרס על ידיהן."
