masechet,commentary,perek,halakha,page,comment,dh,base text ref,base text,problem
Challah,ככר לאדן,1,0,1b,"@11רשב""ן @33שמע כולהון וכו'. הר""ן פ""ב דפסחים:","רשב""ן שמע כולהון וכו'",Jerusalem Talmud Challah 1:1:9,"רבי שמואל בר נחמן שמע כולהון מן אהן קרייא (ישעיהו כח) ושם חיטה שורה ושעורה נסמן וכוסמת גבולתו. ושם חיטה אלו החיטים שורה זו שבולת שועל ולמה נקרה שמה שורה שהיא עשויה כשורה. שעורה אלו השעורים. נסמן זה השיפון. וכוסמת זה הכוסמין. גבולתו לחם. עד כאן גבולו של לחם ולמידין מן הקבלה. א""ר סימון מן מה דכתיב (שם) ויסרו למשפט אלהיו יורנו כמי שהוא דבר תורה.",
Challah,ככר לאדן,1,0,2a,@11לא @33עבדין טבאות אלא ויסרו למשפט וכו'. פי' כשהאב יסרו לבן אלהיו יורנו:,לא עבדין טבאות אלא ויסרו למשפט וכו',Jerusalem Talmud Challah 1:1:10,"א""ר סימון אילין נשייא דאמרין לא ניעול בגינן לכנישתא אין חמי לי' מילף מילף הוא. לא עבדין טבאות אלא ויסרו למשפט אלהיו יורנו:",
Challah,ככר לאדן,1,0,2b,"@11וכאן @33בבלול. הר""ש פ""ק דכלאים ופ""ד דחלה:",וכאן בבלול,Jerusalem Talmud Challah 1:1:14,"תמן תנינן איזו מין במינו החיטים אין מצטרפין עם הכל אלא עם הכוסמין. השעורין מצטרפין עם הכל חוץ מן החיטים. ר' יוסי אמר ליה סתם. ר' יונה בשם ר' יוחנן תמן בנשוך וכאן בבלול. תני ר' חייא כן וכולן שבללן תבואה קמחים ובציקות מצטרפות. עירס ראשי עיסיות. א""ר יוסי וההן נשוך לאו כמעורס הוא. את אמר אינו מצטרף והכא אינו מצטרף.",
Challah,ככר לאדן,1,0,3a,"@11חטים @33שבו מהו שיבטלו חטים שבו ושעורים שבו מהו שיבטלו שעורים שבו כצ""ל:",חטים שבו מהו שיבטלו חטים שבו ושעורים,Jerusalem Talmud Challah 1:1:17,"רבי יהושע דרומיא בעי עשה עיסה מחמשת המינין וחזר ועשה חמש עיסיות ממין א' ועירבו. חיטים שבו מהו שיבטלו חיטים שבו ושעורין שבו מהו שיבטלו שעורין שבו. א""ר חייא בר אדא לא כן אמר רבי יוסי שני דברים רבים על אחד ומבטלין אותו. לא צורכה דלא עשה חמש עיסיות מחמשה מינים ועירבן וחזר ועשה חמש עיסיות מחמשה ולא עירבן. חיטין שכן מהו שיבטלו חיטים שכן ושעורי' שכן מהו שיבטלו שעורים שכן:",
Challah,ככר לאדן,1,0,11b,"@11יותר @33ממה שכיבש יהושע. יבמות דף צ""ח:",יותר ממה שכיבש יהושע,Jerusalem Talmud Challah 2:1:8,הוי בעיי מימר מה דאמר תמן חייב אוף הכא חייב. מה דאמר תמן פטור אוף הכא פטור. אפילו כמאן דאמר תמן פטור הכא חייב. כיון שנכנסו ישראל נתחייבו. כתיב (מלכים ב יד) הוא השיב את גבול ישראל מלבוא חמת עד ים הערבה כדבר ה' אלהי ישראל אשר דבר ביד עבדו יונה בן אמתי הנביא אשר מגת החפר. רבי חנניה ורבי מנא חד אמר כל מה שכיבש יהושע כיבש זה. וחרנה אמר יותר ממה שכיבש יהושע כיבש זה. תנא רבי סידור מסייע לרבי מנא ימים קלים עשו ישראל באותה הארץ.,
Challah,ככר לאדן,1,0,19a,"@11בגין @33דתנו דבתרה כצ""ל:","בגין דתנו דבתרה כצ""ל",,,
Challah,ככר לאדן,1,0,26b,"@11אית @33תנויי תני הירדן וכו'. בכורות ס' מעשר בהמה. [א""ה חיד""א עיין ברכי יוסף ח""ח סי' תקפ""ט]:",אית תנויי תני הירדן וכו',Jerusalem Talmud Challah 4:4:8,"אית תניי תני הירדן מארץ ישראל אית [תניי] תני הירדן מחוצה לארץ. אית [תניי] תני הירדן גבול בפני עצמו. מאן דאמר הירדן מארץ ישראל (דברים ג) והערבה והירדן וגבול. מאן דאמר הירדן מחוץ לארץ. (יהושוע יח) והירדן &lt;וגבול&gt; [יגבול] אותו לפאת קדמה. ומ""ד הירדן גבול בפני עצמו והוא שיהא במקום אחד עשה ירדן שנטל מזה ונתן לזה מה שנטל נטל ומה שנתן נתן. ומה נן קיימי' אם במקו' שהיה ארץ ישראל ונעשה בסוריא חזקתו למעשרות ולשביעית. רבי ירמיה רבי אימי בשם רבי יוחנן. ר' סימון בשם רבי יהושע בן לוי לחזקות ולביעורין ולמעשר בהמה. רבי הילא בשם רבי שמעון בן לקיש והוא שמשך עפר: ",
Challah,ככר לאדן,1,0,26b,"@11של @33יש לה שיעור. תוס' חולין דף ק""ד:",של יש לה שיעור,Jerusalem Talmud Challah 4:4:9,של אור יש לה שיעור שהוא דבר תורה. של כהן אין לה שיעור שהיא מדבריהן. ויפריש לאור ולא יפריש לכהן. שלא יהו אומרי' ראינו תרומה טהורה נשרפת. ויפריש לכהן ולא יפריש לאור. שלא יהו אומרים ראינו תרומה טמאה נאכלת. מתוך שהוא מפריש שתיהן לכשהוא בא לכאן הוא נשאל.,
Challah,ככר לאדן,1,0,27b,@11אילו @33הן שבמקדש. חולין פרק הזרוע:,אילו הן שבמקדש,Jerusalem Talmud Challah 4:4:17,עשרים וארבעה מתנות ניתנו לאהרן ולבניו. עשר במקדש. ארבע בירושלם. עשר בגבולין. אילו הן שבמקדש חטאת ואשם וזבחי שלמי ציבור וחטא' העוף ואשם תלוי ולוג שמן של מצורע. שתי הלחם ולחם הפנים ושירי מנחות והעומר. ואילו הן שבירושלם הבכורות והביכורים והמורם מן התודה ומאיל נזיר ועורת המוקדשין. אלו הן שבגבולין התרומה ותרומת מעשר וחלה והזרוע והלחיים והקיבה וראשית הגז וגזל הגר ופדיון הבן ופדיון פטר חמור וחרמים ושדה אחוזה:,
Challah,ככר לאדן,1,0,27b,@11אימר @33גזרו על הכרשינין. נראה שהוא מש' בסוף מעשרות:,אימר גזרו על הכרשינין,Jerusalem Talmud Challah 4:4:20,מפני מה לא גזרו על הבקייה במנעליהן יצאת עמהן מאלכסנדריאה. אימתי גזרו על הכרשינין רבי יוסי אומר בימי רעבון. רבי חנניה בשם רבי בימי דוד. אמרין היא הדא היא הדא:,
Challah,ככר לאדן,1,0,28a,"@11שותה @33יין של תרומה. דוגמתו בע""ז:",שותה יין של תרומה,Jerusalem Talmud Challah 4:5:3,אמר רבן שמעון בן גמליאל אני ראיתי את שמעון בן כהנא שותה יין של תרומה בעכו שאמר זה הובא מקיליקיה וגזרו עליו ושתייו בספינה. ואין בני אדם טועין לומר שמביאין תרומה מחוצה לארץ לארץ. נאמר לא ירד לעכו איכן שתייו מן החוט ולחוץ מן החוט ולפנים. נאמר מן החוט ולחוץ. אמר רבי יונה אפילו תימר מן החוט ולפנים לא חשו למראית העין בספינה.,
Niddah,ככר לאדן,1,0,1a,"@11בדקה @33עצמה בשני בשבת ולא ראתה וראתה בחמישי וכו' בשחרית ולא ראתה וראתה במנחה כצ""ל:",בדקה עצמה בשני בשבת ולא ראתה וראתה,Jerusalem Talmud Niddah 1:1:2,מהו דיין שעתן שאינן מטמאות טהרות למפרע: וחכמים אומרי' לא כדברי זה ולא כדברי זה. לא כשמאי שלא נתן סייג לדבריו ולא כהלל שהפליג על מדותיו אלא מעת לעת ממעטת על יד מפקידה לפקידה ומפקידה לפקידה ממעטת על יד מעת לעת. כיצד מעת לעת ממעטת על יד מפקידה לפקידה בדקה עצמה בשני בשבת וראת בחמישי בשבת אין טמא אלא עד מעת לעת דארבעתא. כיצד מפקידה לפקידה ממעטת על יד מעת לעת בדקה בשחרית וראת במנחה אין טמא אלא עד שחרית.,
Niddah,ככר לאדן,1,0,1a,@11עד @33כדון כשבדקה ומצאתה נגוב. אפשר שהוא על המשנה שניה:,עד כדון כשבדקה ומצאתה נגוב,Jerusalem Talmud Niddah 1:1:4,כד כדון בשבדקה ומצתה נגוב בדקה ומצתה טהור רבי אמי בשם רב רבי בא בשם רב יהודה בדקה ומצתה טהור אסורה לביתה עד שיתנגב מעיינה חד רבי טובי אמר בשם רבי אבהו אסורה לביתה עד מעת לעת אמר רבי יעקב בר אחא כד סליקית להכא שמיתה מן כל רבנן מותרת לביתה מיד. הוון בעיי מימר מאן דמר מותרת לביתה מפקידה הוא למעט מעת לעת ומאן דמר אסורה לביתה אינה כפקידה למעט מעת לעת ואפילו כמאן דמר אסורה לביתה כפקידה היא למעט מעת לעת ולמה היא אסורה לביתה שמתוך שהיא מתרגלת בדמים טהורין היא מתרגלת בדמים טמאין.,
Niddah,ככר לאדן,1,0,2b,"@11כל @33שלא נחרש בה מימיה וכו' כל שאין בה חרש. ה""ג באגדת שמואל פ' כ""ו:",כל שלא נחרש בה מימיה וכו' כל,Jerusalem Talmud Niddah 1:3:3,תני שלש בתולות הן בתולת אדם בתולת שקמה ובתולת הארץ בתולת אדם כל שלא נבעלה מימיה בתולת שקמה כל שלא נקצצה מימיה בתולת הארץ כל שלא נחרץ בה מימיה רבן שמעון בן גמליאל אומר כל שאין בה חרץ,
Niddah,ככר לאדן,1,0,3a,"@11ר' @33יודן בעי לא סוף דבר עד שתלד אלא אפי' הפילה כצ""ל:",ר' יודן בעי לא סוף דבר עד,Jerusalem Talmud Niddah 1:3:6,רבי יודן בעי סוף דבר עד שתלד לא אפילו הפילה,
Niddah,ככר לאדן,1,0,3b,"@11כל @33שהוא בהרבה ארבה ר' חייה וכו' כצ""ל ומפורש בב""ר [פ' כ'] כל שהוא במאתים ושנים עשר יום חי:",כל שהוא בהרבה ארבה ר' חייה וכו',Jerusalem Talmud Niddah 1:3:7,"אמר רבי מנא שמעית בשם שמואל היא הכרת העובר היא לידתו ולית אנא ידע מן מה שמעית אמר רבי בא בר כהן קומי רבי יוסי רבי ירמיה אמרה אמר ליה רבי חזקיה לא אמרה רבי ירמיה ואיקפד רבי יוסי לקיבליה אמר אילו יהושע שהיה קשור למשה לא הוה אמר כן והוא אמר כן חזר ואמר אין אמרה אלא כאינש דשמע מילה ומקשי עלה ואבא בר בא פליג על שמואל ברי. ר' ברכיה בשם שמואל לעולם אין האשה יולדת אלא לרע""א או לרע""ב או לרע""ג או לרע""ד א""ל רבי מנא מנן שמע רבי הדא מילתא א""ל מן רבי בא. מחלפה שיטתיה דרבי בא תמן הוא אמר שנייא הוא הכרת העובר שנייא היא לידתו והכא הוא אמר הכין רבי בא בר זוטרא משם שמואל כל שהוא בהרבה הרי הוא בארבה.",
Niddah,ככר לאדן,1,0,3b,"@11חמתיה @33מיבעת. תוס' בכורות פ""ג דף כ""ה:",חמתיה מיבעת,Jerusalem Talmud Niddah 1:3:8,"רבי חייה בר אשי הוה יתיב קומי רב חמתיה מיבעת א""ל מהו כן א""ל חמרתי מעברה והיא בעייא מילד ואנא בעי מרבעתה דלא תצטנן א""ל אימתי עלה עליה הזכר א""ל ביום פלן וחשב א""ל בעייא היא עד כדון. ותני כן הפוחתת אינה פוחתת מימות הלבנה והמוספת אינה מוספת על ימות החמה. מילתיה דרבי יהושע פליגא דמר ריב""ל בקורת של אנטונינוס היתה עוברה והריבעו של בית רבי ממנה שוורין ויש מהן שילדו עכשיו ויש מהן שילדו לאחר זמן כאן בבהמה טמאה וכאן בבהמה טהורה והכתיב הידעת עת לדת יעלי סלע חולל איילות תשמור תספר ירחים תמלאנה וידעת עת לדתנה א""ל חיה טהורה כבהמה טמאה:",
Niddah,ככר לאדן,1,0,6a,@11אין @33כן סומא וקמת. פי' לא תתני סומא וכך אוקמוה בני הישיבה ולא רבו עליה:,אין כן סומא וקמת,Jerusalem Talmud Niddah 2:1:4,אמרון בשם רבי ינאי אין כן סומא וקמת אמרון בשם ר' חנינה אין כן סומא וקמת ר' אילא ר' יוסי בר חנינה בשם דבית רבי ינאי אין כן סומא,
Niddah,ככר לאדן,1,0,7b,"@11לשהות @33בטומאתה. מרדכי פ' ידיעות. @11כל @33אילין מיליא לעובדא א""ל אין כצ""ל:",לשהות בטומאתה,Jerusalem Talmud Niddah 2:4:2,"אבא בר ירמיה כהנא בשם שמואל כל אשה שאין לה ווסת אסורה לביתה עד שעה שתבדוק והתנינן כל הנשים בחזקת טהרה לבעליהן פתר לה בבאין מן הדרך והתנינן הבאין מן הדרך נשיהם להם בחזקת טהרה אמר רבי בון בר חייה תיפתר שבא ומצאה עירה והתני בין שמצאה עירה בין שמצאה ישינה אמר רבי בא תיפתר שהניחה בחזקת טהרה. כמה עונה נותנין לה ר""ש בן לקיש אמר נותנין לה עונה בינונית שלשים יום אמר ר' יוחנן שונה אני אפילו לאחר שלש שנים מותר ובלבד באשה שיש לה ווסת אמר רבי אבהו והוא ששהת אחר ווסתה שבעת ימים וחש לומר שמא לא טבלה אמר רבי חנינה זאת אומרת שאסור לאשה לשהות בטומאתה. שמואל בר אבא בעי אפילו דבר בריא שילדה אמר רבי יוסי כך אנו אומרים אפילו נטמאת אלא כיון שילדה בטלה חזקתה אף הכא כיון שטימאת בטלה חזקתה:",
Niddah,ככר לאדן,1,0,8b,@11באילין @33קוזקזתהון פירוש בנושיהן:,באילין קוזקזתהון פירוש בנושיהן,,,
Niddah,ככר לאדן,1,0,8b,"@11כבר @33דהו מראיו כצ""ל:","כבר דהו מראיו כצ""ל",Jerusalem Talmud Niddah 2:7:4,"וכקרן כרכום כבור שבו. בלח ולא ביבש בעליון ולא בתחתון ברואה את הצל ולא ברואה את החמה רבי אבהו אייתי קומי רבי לעזר באילין קוזקזתהון א""ל כבר דהוא מראיו רבי יעקב בר זבדי אייתי קומי רבי אבהו דם שעיר באדום ודם דגים בשחור א""ל כבר דהוא מראיו:",
Niddah,ככר לאדן,1,0,9a,@11חמיתי @33עטיר מיניה. תרגום ירושלמי עשן כלו עטיר כוליה:,חמיתי עטיר מיניה,Jerusalem Talmud Niddah 2:7:7,"רבי יצחק בן נחמן יליף מן רבי לעזר דמים טהורין הא דמים טמאין לא ולא כן אמר רבי יצחק בר נחמן לרבי אבודמא דחיפא קרוב הוא זה לבוא לדם הנדה אלא מאן דיליף הדין מנה יליף הדין. יצחק בר יונתן ורב הוון יתיבין אתת חדא איתא ושאלתון אמר לה יצחק בר יונתן חמיתיה עטיר מניה א""ל רב הונא כן אמר רב מן דאתי קומיך הורי. אמר רבי יעקב בר אחא בשם ר""ש בר אבא כמה קופין דעובדין הוה אתי קומי רבי חנינה ומה דהוה אתו קומוי הוה אמר",
Niddah,ככר לאדן,1,0,10b,"@11אמר @33ר' זעורא לא דרבי יוחנן אמר אינו ולד כל דכן כצ""ל. פי' מכל וכל אלא לזה הענין:",אמר ר' זעורא לא דרבי יוחנן אמר,Jerusalem Talmud Niddah 3:2:9,"ואמר ר' יסא בשם רבי יוחנן לא סוף דבר כל הסימנין אלא אפילו אחד מן הסימנין ואילו הן הסימנין המצח והגבינין והעין והאוזן והלסת והחוטם והזקן וגומות הזקן ואמר רבי יסא בשם רבי יוחנן לא סוף דבר כל הסימנין אלא אפילו אחד מן הסימנין רבי בא רבי ירמיה בשם רב דברי רבי עד שיהו כל הפנים דומין לאדם ודברי חכמים אפילו אחד מן הסימנין ודברי ר""ש בן יוחי אפילו צפרניו. רבי פינחס בעי מחלפה שיטתיה דר""ש בן יוחי תמן הוא אומר עד שיהו ראשו ורובו דומין לאמו והכא הוא אמר הכין כאן באדם כאן בבהמה. אמר רבי בא רבי חייה רובה אזל לדרומא שאלון ליה רבי חמא אביו דרבי הושעיה ובר קפרא כולו אדם ופניו בהמה מהו אתא ושאל לרבי אמר ליה צא וכתוב להן אינו וולד אמר רבי ירמיה נפק זוגא לבר שאלון ליה רבי חמא אבוי דרבי הושעיה ובר קפרא שתי עיניו טוחות מהו אתא ושאיל לרבי א""ל צא וכתוב להן אינו וולד אמר רבי יוסי בי רבי בון רבי כדעתיה דרבי אמר עד שיהו כל הפנים דומין לאדם. פניו ממוסמסות מהו רבי יסא אמר איתפלגון רבי יוחנן ור""ש בן לקיש רבי יוחנן אמר אינו וולד ר""ש בן לקיש אמר וולד הוא אמר רבי זעירא לא דר' יוחנן אמר אינו וולד כל דכן אלא אינו וולד להושיב את אמו ימי טיהר אבל וולד הוא להושיב את אמו ימי לידה רבי יוחנן אמר בשם רבי ינאי וירכתו אטומה אינו וולד רבי יוחנן בשם רבי יוסי בי רבי יהושע טיבורו אטום אינו וולד רבי יוחנן בשם רבי זכאי נקובתו אטומה אינו וולד רבי זעירא בשם גידול גולגולתו אטומה אינו וולד:",
Niddah,ככר לאדן,1,0,11b,"@11אין @33שונין דבר שאי אפשר. פי' אין שונה האדם לחזור לשאול לרבו דבר שא""א במציאות דמתוך תשובתו לשאלתך ראשונה הי""ל להבין שאין שאלתך שניה שאלה כל עיקר שהוא דבר דלא אפשר ושונין מלשון ושונה בה:",אין שונין דבר שאי אפשר,Jerusalem Talmud Niddah 3:4:6,"רבי יוסי בן שאול בעא קומי רבי מהו לתלות שילייא בדבר שאינו וולד א""ל אין תולין שילייא בדבר שאינו וולד יצאת קשורה לו מהו אמר ליה אין שונין דבר שאי אפשר תנא רבי חנין דשמואל אין תולין שיליא בדבר שאינו וולד יצאת קשורה לו תולין אותה בו. שמואל שאל לתלמידוי דרב מהו לתלות שילייא בנפלים אמרין ליה תולין שיליא בוולד ותולין שיליא בנפלים וקלסון שמואל דאינון אמרין שיטתיה דרבי בון תנא רבי חנין דשמואל תולין שילייא בוולד ואין תולין שילייא בנפלים שאינה פורשת ממנו עד שיגמור רבי זעירא בשם דרבנן הן דאת אמרת תולין שילייא בוולד שאין האשה מתעברת וחוזרת ומתעברת ויתלו אותה בנפלים שאין האשה מפלת וחוזרת ומפלת אני אומר עיברה תאומים ונימוקה שילייתו של שפיר משפירה של שלייתה. רבי זעירא רב יהודה בשם רב תולין שילייא בוולד עד שלשה ימים ואין הוולד משתהא לאחר חבירו שלשה ימים אמר רבי זעירא מאן דמר הדא אמר הדא ואינון פליגין הדא על הדא אמר רבי בא אוקמה רב יהודה בשם רב הן דאת אמר תולין שילייא בוולד עד שלשה ימים כשיצא הוולד תחילה והן דאת אמר אין הוולד משתהא לאחר חבירו שלשה ימים כשיצא הסנדל תחילה. אמר רבי מנא ויאות אילין להטייה נפקין קדמאי אמר רבי יוסי בי רבי בון נפתח לגדול נפתח לקטן נפתח לקטן לא נפתח לגדול",
Niddah,ככר לאדן,1,0,13a,"@00קצת לשונות בירושלמי שצריכין פי' והעתקתי פירושם מפי' הרב הגדול מהר""ש שרילייו ז""ל בכ""י בפתיחתו לביאורו המשובח:",קצת לשונות בירושלמי שצריכין,,,
Niddah,ככר לאדן,1,0,13a,@22א) @11לא בדא. @33פי' לא יש מקום לחשוב מחשבה זו:,א,,,
Niddah,ככר לאדן,1,0,13a,"@22ב) @11דלכן. @33פי' דאי לא כן וכן פי' רב נסים גאון הביאוהו התוס' פ' בתרא דיומא וכ""כ הר""ש פ' כ""ו דכלים:",ב,,,
Niddah,ככר לאדן,1,0,13a,"@22ג) @11דלמא. @33פי' כמו דא לימא זאת להגיד לאנשים שישמעו מוסר ואל יפרעו ולעולם תמצא זה הלשון כשבא הירושלמי לספר מעשה שאירע לחכמים (א""ה חיד""א עיין במעריך להרמד""ל ז""ל):",ג,,,
Niddah,ככר לאדן,1,0,13a,@22ד) @11ייבא כהדא. @33פי' יהבא כהדא ולפעמים אומר נשמיעינא מן הדא והחילוק הוא כשאו' נשמיענה מן הדא משיב מן הענין עצמו אבל ייבא כהדא מביא ראיה בדומה @22ה) @11ודמיא היא כלרבא. @33פי' כל ארבא כלומר כך דומה זה כמו קברניט הספינה שמנהיגין אותה מאחריה כמו שפירש הערוך כלפי לייא כלפי אליה כלפי הזנב כלומר דבר מהופך זה שאינו דומה כלל וכן אדרבא שאמור בבבלי פי' אדארבא:,ד,,,
Niddah,ככר לאדן,1,0,13a,@22ו) @11ולכלרבא. @33פי' ולכלא ארבא כלומר כל מה שבספינה היה לך לשאול כלומר אין לך דעת דלא דמו:,ו,,,
Niddah,ככר לאדן,1,0,13a,"@22ז) @11בעי. @33יש שאינו שאלה דמספקא ליה אלא שאל לחכמים או תלמידים ולדידיה פשיטא ליה כההיא דפ' י""ג שופרות בעי האור עלי עץ. וכפירושו שם כתב בעי כלומר בקש לדון זה ומצא דאי אמר עץ מביא גזיר אחד. וכ""כ מהר""ר אליהו ז""ל שם בפי' בעי רצה לומר",ז,,,
Makkot,ככר לאדן,1,0,3a,"@11היו @33עומדין ומעידין עליו בעשרה בנייסן וכו'. רי""ף ונמו""י פרק מרובה:",היו עומדין ומעידין עליו בעשרה בנייסן וכו',Jerusalem Talmud Makkot 1:4:2,"א""ר זעירה הדא אמרה עד זומם אינו נפסל בבית דין אלא מעצמו הוא נפסל פתר לה בהתרייה ותני כן אמר רבי יוסי במה דברים אמורים בשתי כיתי עדיות ובשתי התריות אבל בעדות אחת ובהתרייה אחת כל עדות שבטלה מקצתה בטלה כולה. מהו כל עדות שבטלה מקצתה בטלה כולה היו עומדין ומעידין עליו בעשרה בניסן שגנב את השור באחד בניסן וטבח ומכר בחמשה בניסן והוזמו באחד עשר בניסן כל עדות שהעידו מב' בניסן עד חמשה עשר בניסן למפרע הרי אלו פסולין. א""ר בא בר ממל תיפתר במעידין עליו בכרך אחד ולית שמע מינה כלום ותני כן היו מן הראשונים והן האחרונים הוזמו בראשונה אין בכך כלום בשנייה הרי הוא לו עדות אחת בשלישית הרי היא לו כשתי עדיות. והיכי אמר במעידין עליו בכרך אחד לית שמע מינה כלום לא אתייא אלא על ידי עדיות סגין אמר ר' זעירא הדא אמרה עד זומם אינו נפסל בבית דין אלא מעצמו הוא נפסל:",
