masechet,commentary,perek,halakha,page,comment,dh,base text ref,base text,problem
Sanhedrin,ככר לאדן,1,0,1b,"@11ובימי @33ר""ש בן יוחאי בטלו דיני ממונות כן צ""ל (וכדלקמן פ""ז ה""ב):","ובימי ר""ש בן יוחאי בטלו דיני ממונות",Jerusalem Talmud Sanhedrin 1:1:9,"תני קודם לארבעים שנה עד שלא חרב הבית ניטלו דיני נפשות ובימי שמעון בן שטח ניטלו דיני ממונות. אמר ר""ש בן יוחי בריך רחמנא דלינא חכים מידון.",
Sanhedrin,ככר לאדן,1,0,1b,"@11תרויהון אמרין אפילו ב' שדנו. @33תוספות סנהדרין פ""ק דף ב' ע""א ותוס' גיטין פ""ד דף ל""ב:",תרויהון אמרין אפילו ב' שדנו,Jerusalem Talmud Sanhedrin 1:1:10,"שמואל אמר שנים שדנו דיניהם דין אלא שנקראו ב""ד חצוף ר' יוחנן וריש לקיש תריהון מרין אפילו שנים שדנו אין דיניהן דין. תמן תנינן היה דן את הדין זיכה את החייב חייב לזכאי טימא לטהור טיהר לטמא מה שעשה עשוי וישלם מביתו. ר' בא בשם ר' אבהו בשאמרו לו הרי את מקובל עלינו כשנים. מה אנן קיימין אם בשטעה ודנן משיקול הדעת בדא מה שעשה עשוי. אם בשטעה ודנן דין תורה בדא ישלם מביתו. רבי בא בשם רבי אבהו בשאמרו לו הרי את מקובל עלינו כשלשה על מנת שתדיננו דין תורה וטעה ודנן בשיקול הדעת ישלם מביתו שהגיס דעתו לדון יחידי דין תורה דתנינן אל תהי דן יחידי שאין דן יחיד אלא אחד.",
Sanhedrin,ככר לאדן,1,0,1b,"@11כשאמרו לו הרי את מקובל עלינו. @33נ""י פרק אחד דיני ממונות:",כשאמרו לו הרי את מקובל עלינו,Jerusalem Talmud Sanhedrin 1:1:10,"שמואל אמר שנים שדנו דיניהם דין אלא שנקראו ב""ד חצוף ר' יוחנן וריש לקיש תריהון מרין אפילו שנים שדנו אין דיניהן דין. תמן תנינן היה דן את הדין זיכה את החייב חייב לזכאי טימא לטהור טיהר לטמא מה שעשה עשוי וישלם מביתו. ר' בא בשם ר' אבהו בשאמרו לו הרי את מקובל עלינו כשנים. מה אנן קיימין אם בשטעה ודנן משיקול הדעת בדא מה שעשה עשוי. אם בשטעה ודנן דין תורה בדא ישלם מביתו. רבי בא בשם רבי אבהו בשאמרו לו הרי את מקובל עלינו כשלשה על מנת שתדיננו דין תורה וטעה ודנן בשיקול הדעת ישלם מביתו שהגיס דעתו לדון יחידי דין תורה דתנינן אל תהי דן יחידי שאין דן יחיד אלא אחד.",
Sanhedrin,ככר לאדן,1,0,2a,"@11אמר ר' יוחנן לעולם אין הקב""ה וכו'. @33זה המאמר אמרו ר""י בגמרא פרק אחד דיני ממונות (דף ל""ח) בלשון אחר:","אמר ר' יוחנן לעולם אין הקב""ה וכו'",Jerusalem Talmud Sanhedrin 1:1:11,"א""ר יהודה בן פזי אף הקב""ה אינו דן יחידי שנאמר וכל צבא השמי' עומדי' עליו מימינו ומשמאלו אילו מטין לכף זכות ואילו מטין לכף חובה. אע""פ שאין דן יחידי חותם יחידי שנאמר אבל אגיד לך את הרשום בכתב אמת. אמר רבי יוחנן לעולם אין הקב""ה עושה בעולמו דבר עד שנמלך בבית דין שלמעלן מה טעם ואמת הדבר וצבא גדול. אימתי חותמו של הקב""ה אמת בשעה שנמלך בבית דין שלמעלן. א""ר לעזר כל מקום שנאמר וה' הוא ובית דינו. ובניין אב שבכולם וה' דבר עליו רעה.",
Sanhedrin,ככר לאדן,1,0,2a,"א""ל ר' אלעזר כל מקום שנאמר וה' הוא ובית דינו כצ""ל וב""ב ברכות (דף י""ג) [פ""ט ה""ה] (א""ה חיד""א ואפשר דכי כתיב ואדני או ואלהים רמוז רחמים):","א""ל ר' אלעזר כל מקום שנאמר וה'",Jerusalem Talmud Sanhedrin 1:1:11,"א""ר יהודה בן פזי אף הקב""ה אינו דן יחידי שנאמר וכל צבא השמי' עומדי' עליו מימינו ומשמאלו אילו מטין לכף זכות ואילו מטין לכף חובה. אע""פ שאין דן יחידי חותם יחידי שנאמר אבל אגיד לך את הרשום בכתב אמת. אמר רבי יוחנן לעולם אין הקב""ה עושה בעולמו דבר עד שנמלך בבית דין שלמעלן מה טעם ואמת הדבר וצבא גדול. אימתי חותמו של הקב""ה אמת בשעה שנמלך בבית דין שלמעלן. א""ר לעזר כל מקום שנאמר וה' הוא ובית דינו. ובניין אב שבכולם וה' דבר עליו רעה.",
Sanhedrin,ככר לאדן,1,0,2a,"וה' דבר עליך רעה כצ""ל:","וה' דבר עליך רעה כצ""ל",Jerusalem Talmud Sanhedrin 1:1:11-12,"['א""ר יהודה בן פזי אף הקב""ה אינו דן יחידי שנאמר וכל צבא השמי\' עומדי\' עליו מימינו ומשמאלו אילו מטין לכף זכות ואילו מטין לכף חובה. אע""פ שאין דן יחידי חותם יחידי שנאמר אבל אגיד לך את הרשום בכתב אמת. אמר רבי יוחנן לעולם אין הקב""ה עושה בעולמו דבר עד שנמלך בבית דין שלמעלן מה טעם ואמת הדבר וצבא גדול. אימתי חותמו של הקב""ה אמת בשעה שנמלך בבית דין שלמעלן. א""ר לעזר כל מקום שנאמר וה\' הוא ובית דינו. ובניין אב שבכולם וה\' דבר עליו רעה.', 'מהו חותמו של הקדוש ברוך הוא רבי ביבי בשם ר\' ראובן אמת מהו אמת א""ר בון שהוא אלהים חיים ומלך עולם. אמר ריש לקיש אל""ף רישיה דאלפא ביתא מ""ם באמצעיתה תי""ו בסופה לומר אני ה\' ראשון שלא קיבלתי מאחר ומבלעדי אין אלהים שאין לי שותף ואת אחרונים אני הוא שאיני עתיד למוסרה לאחר.']",
Sanhedrin,ככר לאדן,1,0,2a,"מהו חותמו של הקב""ה. פ""ד מיתות בתלמודא דידן (דף ס""ד) וגם ביומא:","מהו חותמו של הקב""ה",Jerusalem Talmud Sanhedrin 1:1:12,"מהו חותמו של הקדוש ברוך הוא רבי ביבי בשם ר' ראובן אמת מהו אמת א""ר בון שהוא אלהים חיים ומלך עולם. אמר ריש לקיש אל""ף רישיה דאלפא ביתא מ""ם באמצעיתה תי""ו בסופה לומר אני ה' ראשון שלא קיבלתי מאחר ומבלעדי אין אלהים שאין לי שותף ואת אחרונים אני הוא שאיני עתיד למוסרה לאחר.",
Sanhedrin,ככר לאדן,1,0,2a,"מהו אמת. ברכות (דף ג') [פ""א ה""ה]:",מהו אמת,Jerusalem Talmud Sanhedrin 1:1:12,"מהו חותמו של הקדוש ברוך הוא רבי ביבי בשם ר' ראובן אמת מהו אמת א""ר בון שהוא אלהים חיים ומלך עולם. אמר ריש לקיש אל""ף רישיה דאלפא ביתא מ""ם באמצעיתה תי""ו בסופה לומר אני ה' ראשון שלא קיבלתי מאחר ומבלעדי אין אלהים שאין לי שותף ואת אחרונים אני הוא שאיני עתיד למוסרה לאחר.",
Sanhedrin,ככר לאדן,1,0,2a,"אני ה' ראשון שלא קבלתי מלכותי מאחר כצ""ל. ונ""ב בשיר רבה [פ""א פסוק לסוסתי] ושמ""ר פרשה יתרו ודברים רבה מביא פ' אני ראשון ואני אחרון ומבלעדי אין אלהים (ישעיה מ""ז):",אני ה' ראשון שלא קבלתי מלכותי מאחר,Jerusalem Talmud Sanhedrin 1:1:12,"מהו חותמו של הקדוש ברוך הוא רבי ביבי בשם ר' ראובן אמת מהו אמת א""ר בון שהוא אלהים חיים ומלך עולם. אמר ריש לקיש אל""ף רישיה דאלפא ביתא מ""ם באמצעיתה תי""ו בסופה לומר אני ה' ראשון שלא קיבלתי מאחר ומבלעדי אין אלהים שאין לי שותף ואת אחרונים אני הוא שאיני עתיד למוסרה לאחר.",
Sanhedrin,ככר לאדן,1,0,2a,"על ר' אמי ואלף. פי' לימד נ""י פ' זה:",על ר' אמי ואלף,Jerusalem Talmud Sanhedrin 1:1:13,רבי בא ורבי בנימין בר יפת הוו דיינין קומי ר' יצחק ונפק דינא עם רבי בנימן. אתא רבי בא בעי מיטרוף על רבי אמי ואלף מומחה שכפף ודן דינו דין.,
Sanhedrin,ככר לאדן,1,0,2b,"@11כל @33מקום שיש משפט אמת אין שלום כצ""ל:",כל מקום שיש משפט אמת אין שלום,Jerusalem Talmud Sanhedrin 1:1:24,רבי יהושע בן קרחה אומר מצוה לבצע שנאמר אמת ומשפט שלום כל מקום שיש אמת אין משפט שלום יש שלום אין משפט אמת ואי זה אמת שיש בו משפט שלום הוי אומר זה ביצוע.,
Sanhedrin,ככר לאדן,1,0,2b,"אף הפשרה צריכה הכרע הדעת. תוס' סנהדרין פ""ק (דף ו'):",אף הפשרה צריכה הכרע הדעת,Jerusalem Talmud Sanhedrin 1:1:26,"רבי זכריה בעי קומי רבי אמי עבדין עובדא כההן תנייא. תני ר' שמעון בן מנסיא אומר פעמים שאתה רשאי לבצע פעמים שאין אתה רשאי לבצוע כיצד שנים שבאו אל הדיין עד שלא שמע דבריהן או מששמע דבריהן ואינו יודע היכן הדין נוטה רשאי לומר להן צאו ובצעו משתשמע דבריהן ויודע אתה היכן הדין נוטה אין אתה רשאי לבצוע. שנאמר פוטר מים ראשית מדון ולפני התגלע הריב נטוש. עד שלא נתגלע הריב אתה רשאי לנוטשו משנתגלע הדין אין אתה רשאי לנוטשו. א""ר מתנייה אף הפשרה צריכה הכרע הדעת.",
Sanhedrin,ככר לאדן,1,0,4a,"כשם שחולקין. לעיל ר""ה פ""ג (דף נ""ח):",כשם שחולקין,Jerusalem Talmud Sanhedrin 1:2:9,תני סנהדרין שראו את ההורג אית תניי תני שנים נעשין עדים ומעידין בפני השאר אית תניי תני כולן עדים ומעידין בפני אחרים. ר' יהודה בר פזי בשם ר' זעירא כשם שחולקין כאן כך חולקין בעדות החדש.,
Sanhedrin,ככר לאדן,1,0,4a,"ויקום חד ויתיב חד. הר""ן פ""ב דכתובות ונימוקי יוסף פ' אחד דיני ממונות:",ויקום חד ויתיב חד,Jerusalem Talmud Sanhedrin 1:2:10,"ויקום חד ויתיב חד ויקום חד ויתיב חד. שנייא היא שאין העד נעשה דיין. רב הונא ידע שהדו לחד בר נש אזל בעי מידון קומיה וכפר ביה. א""ר שמואל בר רב יצחק בגין דאת ידע דר' הונא אינשא רבה את כפר ביה. מהו דייזיל ויסהוד עלך קומי בית דין חורין א""ל רב הונא ועבדין כן א""ל אין. ושרא רב הונא גרמיה מן ההוא דינא ואזל ואסהיד קומי בית דין חורון.",
Sanhedrin,ככר לאדן,1,0,4a,"רב הונא הוה ידע. הגהות אשר""י פ""ק דגיטין:",רב הונא הוה ידע,Jerusalem Talmud Sanhedrin 1:2:10,"ויקום חד ויתיב חד ויקום חד ויתיב חד. שנייא היא שאין העד נעשה דיין. רב הונא ידע שהדו לחד בר נש אזל בעי מידון קומיה וכפר ביה. א""ר שמואל בר רב יצחק בגין דאת ידע דר' הונא אינשא רבה את כפר ביה. מהו דייזיל ויסהוד עלך קומי בית דין חורין א""ל רב הונא ועבדין כן א""ל אין. ושרא רב הונא גרמיה מן ההוא דינא ואזל ואסהיד קומי בית דין חורון.",
Sanhedrin,ככר לאדן,1,0,4a,"אמר רב שמואל וכו' בגין דאת ידע וכו'. מרדכי פ""ק דגיטין:",אמר רב שמואל וכו' בגין דאת ידע,Jerusalem Talmud Sanhedrin 1:2:10,"ויקום חד ויתיב חד ויקום חד ויתיב חד. שנייא היא שאין העד נעשה דיין. רב הונא ידע שהדו לחד בר נש אזל בעי מידון קומיה וכפר ביה. א""ר שמואל בר רב יצחק בגין דאת ידע דר' הונא אינשא רבה את כפר ביה. מהו דייזיל ויסהוד עלך קומי בית דין חורין א""ל רב הונא ועבדין כן א""ל אין. ושרא רב הונא גרמיה מן ההוא דינא ואזל ואסהיד קומי בית דין חורון.",
Sanhedrin,ככר לאדן,1,0,4a,"@11אמר @33הרי השנה מקודשת בעיבור כצ""ל:","אמר הרי השנה מקודשת בעיבור כצ""ל",Jerusalem Talmud Sanhedrin 1:2:11,"תני ר' שמעון בן יוחי וקדשתם את שנת החמשים שנים שנים אתה מקדש ולא חדשים. והתנינן ראש בית דין אומר מקודש מהו מקודש מקויים. תני לקידוש החדש מתחילין מגדול א""ר חייה בר אדא מתניתא אמר' כן ראש בית דין אומר מקודש. תני לעיבור החדש מתחילין מן הצד א""ר זבידא וההן ביתא דלרע לא נהגין כן. ולא שמיע דמר ר' חייה בר מרייה ורבי יונה רבי בא בר חייה בשם ר' יוחנן לעיבור החדש מתחילין מגדול לעיבור שנה מתחילין מן הצד. וכבר נכנס רבי יוחנן והיה קטן שבכולם אמרו לו אמור הרי השנה מקודשת בעיבורה אמר הרי השנה מקודשת בעיבורה. א""ר יונתן ראה לשון שלימדנו בן הנפח אילו אמר בעיבורה הייתי אומר אילו אחד עשר יום שהחמה עודפת על לבנה אלא בעיבורה שהוסיפו לה חכמים שלשים יום. ר' יעקב בר אחא ר' יסא בשם ר' יוחנן לעיבור הולכין אחר המינוי לבית הוועד הולכין אחר הרגל והוא שיש כל אחד מדבר במקומו וחותם כגון ר' חנינה פתח ר""י וריש לקיש חותמין ר' בא בר זבדי פתח ר' יסא ור' אמי חותמין רבי חגי פתח רבי יונה ורבי יוסי חותמין. ר' כהנא אימני קומי רבי יעקב בר אחא ואעל רבי יעקב בר אחא קמיה מנייה לעיבורא. אמר אכן מרה דשמעתא לא מקיים לה.",
Sanhedrin,ככר לאדן,1,0,4a,"@11לבית @33הועד הולכין אחר הרגיל והוא שיהא כל אחד כצ""ל:",לבית הועד הולכין אחר הרגיל והוא שיהא,Jerusalem Talmud Sanhedrin 1:2:11,"תני ר' שמעון בן יוחי וקדשתם את שנת החמשים שנים שנים אתה מקדש ולא חדשים. והתנינן ראש בית דין אומר מקודש מהו מקודש מקויים. תני לקידוש החדש מתחילין מגדול א""ר חייה בר אדא מתניתא אמר' כן ראש בית דין אומר מקודש. תני לעיבור החדש מתחילין מן הצד א""ר זבידא וההן ביתא דלרע לא נהגין כן. ולא שמיע דמר ר' חייה בר מרייה ורבי יונה רבי בא בר חייה בשם ר' יוחנן לעיבור החדש מתחילין מגדול לעיבור שנה מתחילין מן הצד. וכבר נכנס רבי יוחנן והיה קטן שבכולם אמרו לו אמור הרי השנה מקודשת בעיבורה אמר הרי השנה מקודשת בעיבורה. א""ר יונתן ראה לשון שלימדנו בן הנפח אילו אמר בעיבורה הייתי אומר אילו אחד עשר יום שהחמה עודפת על לבנה אלא בעיבורה שהוסיפו לה חכמים שלשים יום. ר' יעקב בר אחא ר' יסא בשם ר' יוחנן לעיבור הולכין אחר המינוי לבית הוועד הולכין אחר הרגל והוא שיש כל אחד מדבר במקומו וחותם כגון ר' חנינה פתח ר""י וריש לקיש חותמין ר' בא בר זבדי פתח ר' יסא ור' אמי חותמין רבי חגי פתח רבי יונה ורבי יוסי חותמין. ר' כהנא אימני קומי רבי יעקב בר אחא ואעל רבי יעקב בר אחא קמיה מנייה לעיבורא. אמר אכן מרה דשמעתא לא מקיים לה.",
Sanhedrin,ככר לאדן,1,0,4b,"@11בעיון מיעקר אף אהן סימנא. @33כדלקמן על ג' סימנים. וכדאיתא בר""ה בבלי ושלח לו סימנא דוד מלך ישראל וכו' או אולי הוא ממנא:",בעיון מיעקר אף אהן סימנא,Jerusalem Talmud Sanhedrin 1:2:16,"ר' לעזר בשם ר' חנינה מעשה בעשרים וארבע קריות של בית רבי שנכנסו לעבר שנה בלוד ונכנסו בהן עין רע ומתו כולם בפרק אחד מאותה שעה עקרוה מיהודה וקבעוה בגליל. בעיון מיעקר אף אהן סימנא. אמר לון רבי סימון אין אנו מניחין ביהודה אפילו זכר והרי מצינו שקידשו את השנה בבעלת. הדא בעלת זימנין מיהודה וזימנין מדן. אלתקא וגבתון ובעלת הרי הן מיהודה בעלה ועיים ועצם הרי מדן. והרי מצינו שקידשו את השנה בבעלה מימר בתים מיהודה ושדות מדן. רבי ירמיה בעא קומי ר' זעירא ולוד לאו מיהודא היא א""ל אין ומפני מה אין מעברין בה א""ל שהן גסי רוח ומעוטי תורה הפיך אפוי וחמא רבי אחא ורבי יודה בן פזי אמר ליה איטה עבדתני מבזה רבנן.",
Sanhedrin,ככר לאדן,1,0,5a,"רבי אבהו הדא דתימר עד שלא התיר רבי. כל זה עד אקרא לאלהים לעיל נדרים (דף מ') [דף כ""ג] תחילתה בפסחים וקצתה בר""ה וגם בפאה (דף י""ח). ושבועות פ""ז ותרומות פ""ו וסוטה פ""ה:",רבי אבהו הדא דתימר עד שלא התיר,Jerusalem Talmud Sanhedrin 1:2:23,אין מעברין לא בשביעית ולא במוצאי שביעית ואם עיברוה הרי זו מעוברת. אימתי רגילין לעבר בערבי שביעיות ר' זעירא בשם ר' אבהו הדא דתימר עד שלא התיר ר' ליקח ירק מחוץ לארץ לארץ אבל משהתיר ר' ליקח ירק מחוצה לארץ לארץ היא שביעית שאר שני שבוע.,
Sanhedrin,ככר לאדן,1,0,5b,"אין מעברין קודם ר""ה. ר""ה בבלי (דף ו'):","אין מעברין קודם ר""ה",Jerusalem Talmud Sanhedrin 1:2:29,"אין מעברין קודם ר""ה ואם עיברוה אינה מעוברת אבל מפני הדוחק מעברין אחר ר""ה מיד אעפ""כ אינו מעובר אלא אדר. רבי אומר ניסן לא נתעבר מימיו והתנינן אם בא החדש בזמנו. אם בא לא בא. רב אמר תשרי לא נתעבר מימיו והתנינן אם היה החדש מעובר. אם היה לא היה.",
Sanhedrin,ככר לאדן,1,0,5b,"רבי אומר ניסן לא נתעבר מימיו. ר""ה פ""ג (דף נ""ח) שביעית (דף ל""ט) ובבבלי ר""ה (דף י""ט) הגירסא משם רב אלול והכא תשרי:",רבי אומר ניסן לא נתעבר מימיו,Jerusalem Talmud Sanhedrin 1:2:29,"אין מעברין קודם ר""ה ואם עיברוה אינה מעוברת אבל מפני הדוחק מעברין אחר ר""ה מיד אעפ""כ אינו מעובר אלא אדר. רבי אומר ניסן לא נתעבר מימיו והתנינן אם בא החדש בזמנו. אם בא לא בא. רב אמר תשרי לא נתעבר מימיו והתנינן אם היה החדש מעובר. אם היה לא היה.",
Sanhedrin,ככר לאדן,1,0,5b,"עבר ר' ישמעאל בן ר' יוחנן בן ברוקה. פרק בתרא דר""ה ובבלי (דף ל""ב). ת""ל אותם אותם אלה הם מועדי וכשאין אותם אין אלה מועדי כצ""ל. ומילת אותם קדריש דהיא מיותרת דמשמע שיהיה בזמן לא קודם ולא אחר כך וקא מפרשה תנא דברייתא:",עבר ר' ישמעאל בן ר' יוחנן בן,Jerusalem Talmud Sanhedrin 1:2:30,וכשקידשו את השנה באושא ביום הראשון עבר ר' ישמעאל בן רבי יוחנן בן ברוקה ואמר כדברי רבי יוחנן בן נורי אמר רבן שמעון בן גמליאל לא היינו נוהגין כן ביבנה. ביום השני עבר רבי חנניה בן רבי יוסי הגלילי ואמר כר' עקיבה אמר רבן שמעון בן גמליאל כך היינו נוהגין ביבנה. ותתני קידשוהו בראשון ובשני רבי זעירא בשם רב חסדאי אותה השנה נתקלקלה. מהו בראשון ומהו בשני רבא בשם רב שנה אחד ושנה שני'. והתני קידשוהו ביום הראשון וביום השני,
Sanhedrin,ככר לאדן,1,0,5b,"בגליל אין מעברין וכו'. שינויא הוא כלומר יש הפרש בשאינן יכולין לעבר בא""י מעברין וכו' כצ""ל:",בגליל אין מעברין וכו',Jerusalem Talmud Sanhedrin 1:2:32,"אין מעברין את השנה אלא ביהודה ואם עיברוה בגליל מעוברת. העיד חנינה איש אונו שאם אינה יכולה להתעבר ביהודה שמעברין אותה בגליל. אין מעברין אותה בח""ל ואם עיברוה אינה מעוברת. אית חמי בגליל אין מעברין בחוצה לארץ מעברין. בגליל אין מעברין ואם עיברוה מעוברת בחוצה לארץ אין מעברין ואם עיברוה אינה מעוברת. ביכולין לעבר בארץ ישראל אבל בשאינן יכולין לעבר בארץ ישראל שמעברין אותה בחוצה לארץ.",
Sanhedrin,ככר לאדן,1,0,5b,"ירמיה עיבר בח""ל תוס' יבמות (דף ק""ג):","ירמיה עיבר בח""ל תוס' יבמות דף ק""ג",,,
Sanhedrin,ככר לאדן,1,0,6a,"@11אלה @33הם מועדי חנניה בן אחי ר""י אמר ליה גבן אלה מועדי ה' כצ""ל:","אלה הם מועדי חנניה בן אחי ר""י",Jerusalem Talmud Sanhedrin 1:2:33,"ירמיה עיבר בחוצה לארץ. יחזקאל עיבר בחוצה לארץ. ברוך בן נריה עיבר בחוצה לארץ. חנניה בן אחי רבי יהושע עיבר בחוצה לארץ שלח ליה רבי שלשה איגרין גבי ר' יצחק ורבי נתן. בחדא כתב לקדושת חנניה ובחדא כתב גדיים שהינחת נעשו תיישם ובחדא כתב אם אין את מקבל עליך צא לך למדבר האטד ותהי שוחט ונחוניין זורק. קרא קדמייתא ואוקדון תנייתא ואוקרון תליתא בעי מבסרתהון. אמרין ליה לית את יכיל דכבר אוקרתנין. קם ר' יצחק וקרא באורייתא אלה מועדי חנניה בן אחי ר' יהושע אמר אלה הם מועדי ה' אמר לון גבן. קם רבי נתן ואשלים כי מבבל תצא תורה ודבר ה' מנהר פקוד. אמרין ליה כי מציון תצא תורה ודבר ה' מירושלם. אמר לון גבן אזל קבל עליהן קמי רבי יהודה בן בתירה לנציבין. א""ל אחריהם אחריהם. א""ל לי נא ידע מה תמן. מה מודע לי דאינון חכמין מחשבה דכוותי. מכיון דלא ידעי מחשבה דכוותיה ישמעון ליה ומכיון דאינון חכמין מחשבה דכוותיה ישמע לון. קם רכב סוסיא הן דמטא מטא והן דלא מטא נהגין בקילקול.",
Sanhedrin,ככר לאדן,1,0,6a,ביותר הם עלי זקני גולה. תיבת יתר דריש לשון יתרון וטפלה:,ביותר הם עלי זקני גולה,Jerusalem Talmud Sanhedrin 1:2:34,"כתיב ואל יתר זקני הגולה אמר הקב""ה ביותר הם עלי זקני הגולה. חביבה עלי כת קטנה שבארץ ישראל יותר מסנהדרין גדולה שבחוצה לארץ. כתיב החרש והמסגר אלף ואת מר הכן. רבי ברכיה בשם רבי חלבו ורבנן. רבי ברכיה בשם רבי חלבו אמר החדש אלף והמסגר אלף ורבנן אמרי כולהן אלף. רבי ברכיה בשם רבי אילו החבירים ורבנן אמרין אילו הבולבוטין.",
