Introduction	מס׳ עירובין בעזר הצור ובישועתו
	אמר מנחם בן שלמה לבית מאיר זאת המסכתא ר״ל מסכת עירובין היא מסדר מועד והורגלנו בלמודה אחר מסכת שבת לסבה אשר זכרנו בפתיחת זה החבור והיא כוללת עשרה פרקים וסדרם לפי שטתנו. א׳ מבוי. ב׳ עושין פסים. ג׳ בכל מערבין. ד׳ מי שהוציאוהו. ה׳ כיצד מעברין. ו׳ הדר עם הנכרי. ז׳ חלון. ח׳ כיצד משתתפין. ט׳ כל גגות. י׳ המוציא תפלין. וענין המסכתא כלו אמנם הוא בא להשלים עניני הלכות שבת והוא שבמסכת שבת התבארו עניני המלאכות האסורות הן מדברי תורה הן מדברי סופרים והאריכו בה בפרט בעניני ההוצאה מפני שרוב עניני שבת תלויים בה. הן היצאה מרשות לרשות. הן הושטה׳ הן העברה ארבע אמות ברשות הרבים. הן זריקה. הן טלטול שאף הוא מעין הוצאה. וכמו שאמרו באחרון של ביצה ובפרק כל הכלים אטו טלטול לאו משום הוצאה הוא כלומר שאין עיקר איסורו אלא שמתוך שהדבר שהוא מטלטל אינו ראוי לו לתוך ביתו שמא יוציאנו וכן בדברים שאדם מוציאם איזו נקרא הוצאה ואיזו נקרא דרך מלבוש או תכשיט. וכן התחיל לבאר שם ענין הרשויות ר״ל מהו רשות הרבים ורשות היחיד וכרמלית ומקום פטור אלא שלא נשלם שם ביאור זה אלא שביארנו שם ענינם דרך כלל על הדרך שכתבנו בראשון של שבת. וכן ביארנו שם דיניהן. איזה יש בהוצאתן וטלטולן חיוב. ואיזה פטור אבל אסור. ואיזה מותר להשתמש בו לכתחלה. ולא נתבאר שם דין קרפף שלא הוקף לדירה וחביריו שנשתנה דינם משאר הרשויות עד שמתוך כך שאלו חכמי התוספות למה לא מנאוהו ברשות חמשי כמו שביארנו שם. וכן לא התבאר שם דין גגות וחצרות ואכסדרא ומרפסת ומבוי ודיר וסהר וגינה וכל כיוצא באלו:
	וזאת המסכתא כלה אמנם באה להשלים ביאור המקומות שהוצאתן אסורה ותקונן עד שיוכשרו להוציא ולטלטל בהם וכן איסור יציאה חוץ לתחום ותקון הכשרו. ועל זה הצד יחלקו עניני המסכתא לארבעה חלקים:
	הראשון לבאר תקוני המבואות הן סתום הן מפולש בתקון עצמם וכן החצרות בתקון עצמם ר״ל הכשר לחיים וקורות ופסים וצורת פתח הן תקונם מתחלתן הן תקונן לאחר שנפרצו ודין פרוץ מרובה ועומד מרובה ומהו נקרא מבוי ומהו נקרא חצר וכן תקון רשות הרבים והרבה דינין שבענינים אלו:
	השני בתקון הצריך להם מצד אחר כענין (דיני) עירובי חצרות ושתופי מבואות להכשר הוצאה וטלטול. ועל איזה צד יערבו חצרות הרבה ביחד. ועל איזה צד אין יכולות לערב אלא אחת אחת. ובמה מערבין עירוב זה. והיכן מניחין אותו. ומי אוסר עליהם במבוי או בחצר אעפ״י שעירבו או נשתתפו. ועל איזה צד ובאיזה [צד] יכשירו את איסורו הן בשכירות מקומו הן בבטול רשותו להם ושאר דינין שבענינים אלו:
	השלישי בענין עירובי תחומין להכשר יציאה חוץ לתחום. ובמה מערבין עירוב זה. ובענין התחומי׳ עצמן. ודרך קניית שביתתם. והיאך אלפים נמדדות ומהיכן. ודין קידורי ההרים ורבועיהן ומדידתן ועבורי הערים והצדדים המפקיעים ממנו את תחומו מצד שביתתו ושאר דינים ארוכים שבענינים אלו:
	הרביעי הרשויות על איזה צד נאסרו ומהו רשות הרבים ומהו רשות היחיד או כרמלית ומקום פטור וגנה ודיר וסהר וקרפף ודין גגות וחצרות ואכסדרה ומרפסת ומבוי. ואיזה מהם מותר לטלטל בכלן ואיזה בבית סאתים ואיזה בארבע אמות לבד ועל איזה צד מטלטלין מזה לזה. ודיני חצרות ובתים הנפרצים למקום האסור להם על איזה צד נאסרו ושאר דינין שבענינים אלו. וכבר הותחל ביאור זה החלק במסכת שבת כמו שהקדמנו:
	זהו יסוד המסכתא דרך כלל. ועניניה באו בערבוב ושלא בסדר עד שאין לברר בחלקי׳ שהזכרנו איזה מתברר בפרק זה. ואיזה בפרק אחר אלא שהסדור יחייב להגביל מקומם מעט כפי היכולת. והוא שהחלק הראשון אמנם רובו יתבאר בפרק ראשון. וקצת ממנו בפרק פסים בענין עירוב רשות הרבים ובפרק (עבור) [מעברין] בענין עיר של יחיד ונעשית של רבים. ובפרק הדר בענין חצרות הפתוחות זו לזו אם נעשית כאחת להפקיע הכשר מבוי בלחי וקורה אם לאו. ובפרק גגות בענין חצר שנפרצה לרשות הרבים וכן חצר שנפרצה משתי רוחותיה ובית שנפחת ומבוי שנטלה קורתו. ובפרק שתוף בענין אמת המים עוברת בחצר׳ ודברים מפוזרים ממנו בקצת שאר הפרקים. והחלק השני יתבאר מקצתו בפ׳ פסים ובפרק הדר ובפרק חלון ובפרק שתוף ודברים מפוזרים ממנו בקצת שאר הפרקים. והחלק השלישי יתבאר בפ׳ פסים ובפ׳ שתוף ובפרק גגות ובפ׳ תפלין ודברים מפוזרים ממנו בקצת שאר הפרקים אלא שיתערבו בהרבה מקומות החלקים אחד בגבול חברו:
	זהו שרש המסכתא דרך כלל. אלא שיבאו בה דברים שלא מן הכונה על ידי גלגול כמו שיתבאר. והפרק הראשון אמנם יסוד ענינו להתחיל בביאור ענין החלק הראשון ובפרט בתקוני המבוי ורובו יסוב על שני ענינים. הראשון לבאר שיעור חלל המבוי ואם יש בחללו יתר מכשיעור כיצד מתקנין אותו ואיזה מבוי ניתר בלחי או קורה ואיזה צריך להכשר יתר ממנו וביאור עניני הקורה והלחי והצורת פתח ושאר דברים שבתקון המביאות. והשני הוא ממין זה החלק גם כן ובפרט בעניני חבלים שהוקפו למחיצות על איזה צד מטלטלין ביניהם:
	זהו שרש הפרק דרך כלל. אלא שיבאו בו דברים על ידי גלגול כענין סוגיית התלמוד על הדרך שקדם:
2a	והמשנה הראשונה ממנו אמנם תיוחד לבאר שיעור חלל המבוי. וקודם שתכנס בביאורה צריך שתדע דרך הקדמה שיש לנו בדין הוצאה דינין מן התורה ומכח הלכות סיני ומבית דינו של שלמה. ולפי מה שנפרש במשנה השניה יש לנו בה דין רביעי לאיסור חכמים בשתי מחיצות דעריבן כמו שיתבאר שם והענין הוא שמן התורה אין איסור הוצאה מרשות לרשות אלא מרשות היחיד גמורה לרשות הרבים גמורה וכן אין איסור טלטול והעברת ארבע אמות או יתר מארבע אמות בתוכו אלא ברשות הרבים גמורה ורשות הרבים הוא דרך שיש ברחבה שש עשרה אמה ומפולש משני ראשיו עד שיוכל אדם לעבור ביושר בלא עכוב ושאינו מקורה. וכן הצריכו בו גדולי הרבנים שיהא בו דריסת רגל לששים רבוא ולא שיהו ששים רבוא יכולין לעבור שם ביחד אלא שיהא דרך מצוי לששים רבוא ורגילים לעבור שם. ורשות היחיד הוא כל רשות גבוה עשרה או עמוק עשרה ורחב ארבעה. ויש דעות אחרות בענין רשות הרבים ולקצת רבותי׳ הצרפתים יתבארו במסכתא זו וכן רמזנו עליהם בראשון של שבת. ולא באנו עכשיו לבאר אלא שלא נאסר מן התורה אלא הוצאה מרשות היחיד לרשות הרבים או הכנסה מרשות הרבים לרשות היחיד או טלטול והעברת ארבע אמות ברשות [הרבים] ואין צריך לומר שמן התורה כל חצר שמתחלקת בדיורין אעפ״י שיד כולם שוה בחצר מותר לטלטל מחצר לבתים ומבתי׳ לחצרי. אין צריך לומר טלטול והעברה (לחצר) [בחצר] עצמה. וכן מדינה המוקפת חומה עשרה ויש לה דלתות נעולות בלילה. וכן הדין במבוי הסתום והוא שיש בו כותלים משלש רוחותיו ופתוח מצד רביעי לרשות הרבים וכל שכן לכרמלית אעפ״י שאין בו כלום מצד רביעי רשות היחיד גמורה הוא בין לזרוק בין לטלטל והלכות סיני החמירה להצריך מרוח רביעי לחי או קורה להיתר טלטול. וזו היא שיטת בית הלל שהלכה כמותו ואין צריך בה ללחי או קורה כדברי גדולי המחברים. שלדעת בית הלל מן התורה שלש מחיצות הוא דבעינן בין לזרוק בין לטלטל כמו שכתבנו ואתאי הלכתא לאוסופי אטלטול ברביעית לחי או קורה כל זה היה בדין תורה עם צירוף הלכה. והוא שאמרו [ד׳.] מחיצין הלכה למשה מסיני. ואעפ״י שלדעת בית שמאי מן התורה אין רשות היחיד אלא ארבע מחיצות והלכות סיני באה להקל לאוקומה לרביעית אלחי וקורה ותרוייהו בעינן. וכן שיש מי שסובר שתי מחיצות גמורות רשות היחיד מדאורייתא ואף במחיצות דלא עריבן כמו שיתבאר לדעת ר׳ יהודה בפרק גגות מכל מקום הלכה כבית הלל. ושלמה ובית דינו תקנו עוד שלא לטלטל מבתים לחצר אלא בעירוב לרמוז שכלם שוים באותו אוכל וכן יהו כלם שוים באותו הרשות כברשות אחת והוא הנקרא עירובי חצרות וכן לא מחצר למבוי אלא אם כן בעירוב גם כן והוא הנקרא שתופי מבואות. ועכשיו אנו עסוקים בתקון המבוי הסתום שמן התורה הוא רשות היחיד גמורה לטלטל בתוכו ולחייב בזריקה מתוכו לרשות הרבים ומכח הלכה לדעת בית הלל שהלכה כמותו נאסר שלא לטלטל בתוכו עד שיעשו בו דופן רביעית אלא שדיה בלחי או קורה מפני שאין הענין אלא משום היכר שאם לא יראו סתימה מצד רביעי יחשבו שאף [דרך המבוי מרשות הרבים ויבאו לטלטל מתוכו לרשות הרבים] ואעפ״י שהיא מכח הלכה קראוהו לפעמים מדברי סופרים כמו שאמרו בסוגיא זו מבוי דרבנן אחר שאינו מן התורה ולפעמים קורא הלכות סיני דבר תורה כמו שיתבאר למטה בענין רובו המקפיד. ועל ענין זה באה משנה זו ר״ל מבוי שהוא גבוה ומלת מבוי הוא מענין מבוא וכמו שאתה מוציאה בלשון קבוצה בלשון מבואות ועל שם שכל בני המבוי נכנסים דרך שם הוא קרוי כן כמה דאת אמר את מבוא העיר וכל השביל הוא קרוי מבוי ולפעמים הוא קורא חלקי המבוי ותקוניו בלשון מבוי כמו שקצת פרטים נקראים לפעמים בשם הכלל ועל דרך זה הוא קורא במשנה זו קורת המבוי בשם מבוי. והוא שאמר מבוי שהוא גבוה מעשרים אמה ימעט. כלומר שאם עשה בו קורה לתקנו לטלטל בתוכו אלא שהיא גבוהה מעשרים אמה. ר״ל שחלל שמפי הקורה המביט לארץ עד הקרקע הוא גבוה מעשרים אמה והרי נמצא שאין העין שולט בו ואין כאן היכר ולפיכך ימעט ר״ל שישפיל הקורה עד שלא יהא בחללה יתר מעשרים או יעשה איצטבא למטה הן בסתום הן במפולש שכבר הכשירו מן הצד השני בצורת פתח.
	ור׳ יהודה אומר אינו צריך. שהוא סובר שזה שהזקיקה הלכה למשה מסיני בקורה זו לאו משום היכר הוא אלא משום מחיצה. ומעתה הואיל ויש כאן מחיצה מכל מקום שהרי פי הקורה יורד וסותם אינו צריך כלום ואתה צריך לומר לענין פירוש שר׳ יהודה סובר שכל שיש שם שתי מחיצות חשובות אין רגל הנכנסים והיוצאים מבטלת מחיצה על הדרך שאמרה בשני בתים בשני צדי רשות הרבים ואף למעלה מחמשים או כמה כשרה לדעתו אבל לדעת חכמים אילו היתה קורה באה משום מחיצה לא היתה מועלת כלום שהרי הם סוברי׳ רגל הנכנסת והיוצאה מבטלת מחיצה בכל שאין שם שלש מחיצות של תורה ורביעית של הלכה. ומתוך כך נחלקו בפרק גגות שלר׳ יהודה מערבין במבוי מפולש ומטלטלין בתוכו ר״ל בהכשר לחי או קורה משני צדדיו שמאחר שיש קורה בשני ראשיו ופי תקרה יורד וסותם הרי יש כאן ד׳ מחיצות אבל לדעת חכמים שלש מחיצות בעינן והרביעית אינה אלא להיכר בעלמא ואין הלכה כר׳ יהודה לא בסתום ולא במפולש אלא כחכמים:
	והרחב מעשר אמות. וכו׳ ומכיון שהוא רחב יותר מעשר אמות אין זה קרוי פתח אלא פרצה ואינה ניתרת בקורה שאין כאן היכר ומתוך כך ימעט. והוא שיסתום בראש המבוי קצת הרחב בכותל או בפס ארבעה עד שיעמידנו על פחות מעשר או בעשר ויעשה שם קורה או לחי ור׳ יהודה חולק אף בזו כמו שאמרו בבריתא לומר שאינו צריך ואין הלכה כדבריו.
	ואם יש שם צורת פתח. ר״ל קנה מכאן וקנה מכאן וקנה על גביהן. אפי׳ רחב מעשר אמות אינו צריך למעט. שאין לך היכר גדול מזה. אלא שמכל מקום צריך שיהא ראוי להחזיק דלת של זמורות או של הוצין מגעת מן הקרקע עד הקורה כמו שיתבאר. וצורת פתח יתבאר בגמרא שכשם שמועיל לרחב יתר מעשר כך מועיל בגבוה יתר מעשרים שהרי יש כאן היכר. ורבותי נסתפקו אם צורת פתח מועיל לפחות מעשרה גובה שאף בו המבוי פסול כמו שיתבאר. וגדולי המחברים כתבוה כן אף בפחות מעשרה אלא שאנו מתמיהים בה מצד שאין צורת פתח מועיל במקום שאין מחיצות שכל מחיצה הפחותה מעשרה אינה מחיצה. וגדולי הדור ראיתי שמתמיהים בה מצד שאין צורת פתח מועיל יתר ממחיצה ומחיצה שאינה גבוהה עשרה אינה כלום. ואיני מבין שאף גדולי המחברים לא אמרוה אלא בשהפתח גבוה עשרה כמו שיתבאר למטה אלא שכותלי המבוי נמוכות מעשרה. אלא שאף בזה הדברים מתמיהי׳ כמו שכתבנו. ואם היה מבוי זה רחב עד עשרים אמה או יותר עושה פס ארבעה במשך ארבע אמות שהוא שיעור ארך מבוי ומעמידו לארכו של מבוי באמצע ונעשה כשני מבואות ואין כח באויר שמשני צדדיו לבטלו אבל בפחות מכאן אויר שמכאן ומכאן מבטלו. וכן יתבאר בגמרא. וסתם מבוי למדת ממה שכתבנו שהוא גבוה עשרה וארך ארבע אמות ומהם ולמעלה ורחבו גדולי המחברים נראה שכתבוהו משלשה ולמעלה שהרי הם כתבו מבוי שאין ברחבו שלשה טפחים אינו צריך לא לחי ולא קורה ומותר לטלטל בכלו שכל פחות משלשה כלבוד דמי למדת שבשלשה מיהא צריך הכשר ומכל מקום יש פוסקים דוקא בארבעה טפחים כמו (שהתבאר) [שיתבאר]. זהו ביאור המשנה ופסק שלה. ודברים שנכנסו תחתיה בגמרא אלו הן:
	סוכה שהיא גבוהה למעלה מעשרים אמה פסולה כמו שהתבאר במקומו. ושאלו בסוגיא זו מאי שנא דגבי סוכה תני פיסולא ומאי שנא דגבי מבוי תני תקנתא ר״ל ימעט דהא סכה נמי אית לה תקנתא. (ותירץ) [ותירצו] סוכה דפיסולא דידה דאוריתא תני פיסולא מבוי שכל עצמו אינו אלא מדברי סופרים תני תקנתא. אי נמי דאף בדאוריתא כל דאית ליה תקנתא אית ליה למתנייה אלא דסוכה נפישן מילה בההיא מתני׳ גבוהה למעלה מכ׳ ונמוכה למטה מעשרה ושאין לה שלש דפנות. ושחמתה מרובה ואלו היה שונה תקון לכלם היו הדברים יגיעים מצד שהיה צריך לשנות תקון מיוחד לכל אחד מהם [פסק ותני פסולה] אבל במשנתנו לא שנה אלא שני פיסולין ואף הם שניהם מתוקנים בתקון אחד:
	כבר ביארנו בראשון של יומא סדרי בנין בית המקדש בהר הבית היאך הוא עשוי וביארנו בכלל אותם הדברים שמפתח עזרת ישראל עד פתח האולם שבעים ושש אמה ומפתחו של אולם עד סוף העזרה מאה אמה ובשבעים ושש אמה הראשונות הם י״א אמה לדריסת רגלי ישראל וי״א לדריסת רגלי הכהנים עם הדוכן ושלשי׳ ושתים למזבח ועשרים ושתים משפת המזבח החיצון עד האולם ומפתחו של אולם ולפנים נקרא היכל ששם היה המזבח ושלחן ומנורה ושיעורו מאה אמה עם עובי הכותלים כיצד אולם רחבו עשר אמות וכתלו שש אמות וכותל ההיכל המבדיל בין האולם למקום שנקרא היכל בפרט שש אמות וארך ההיכל ארבעים אמות ומחיצה המבדלת בין ההיכל לדביר ר״ל קדש הקדשים אמה ונקראת אמה טרקסין ובית קדשי הקדשים עשרים אמה וכותל בית קדשי הקדשי׳ שש אמות וחלל התא שאחריו חמש אמות וכותל התא שש אמות הרי מאה אמה ומכותל זה של תא עד כותל מערבי של עזרה י״א אמות אויר והוא אחורי הכפרת ונמצאו מאה ושמונים ושבע אמה ממזרח למערב ט״ו מעזרת ישראל עד האולם ומאה מהאולם עד כותל התא שהוא סוף העזרה והם מאה ושבעים וששה ועם האחת עשרה אמה הם מאה ושמנים ושבעה וכל הקפ״ז בכלל נקראים עזרה אבל עזרת נשים שלפני עזרת ישראל לצד המזרח והחיל שלפני עזרת נשים אינו בכלל העזרה הכל כמו שביארנו שם:
	פתחו של אולם גבהו ארבעים אמה ורחבו עשרים ולא היו בו עשרים וחמש אמלתראות של מילה והוא עץ הנקרא גוונ״ץ היו על גב הפתח זו למעלה מזו והתחתונה שבהן עודפת על רוחב הפתח אמה מכאן ואמה מכאן וכל אחת מן העליונות עודפת על שלמטה הימנה אמה מכאן ואמה מכאן נמצאת התחתונה ארכה הנתון לרחב הפתח כ״ב אמות והסמוכה לה כ״ד אמות והשלישית לה כ״ו והרביעית לה כ״ח והעליונה ל׳ ונדבך של אבנים היה בין כל אחת ואחת ופתחו של היכל לפנים מן האולם גבהו עשרים אמה ורחבו עשר אמות. ולפי מה שיתבאר במקומו לא היו שם אמלתראות ואעפ״י שאמרו בכאן דילמא תבנית היכל כתבנית אולם אינה אלא למה שעשוי לנוי:
