Introduction	מס׳ עירובין בעזר הצור ובישועתו
	ובמעשר ראשון שנטלה תרומתו שהרי מותר הוא לזרים. ופירשוה בגמרא אפי׳ לא נטלה ממנו תרומה גדולה כגון שהקדימו ישראל ללוי ליתן לו מעשרו חמש סאין מחמשים קודם שנטל מהם אחת מחמשי׳ לתרומה ונמצא שלא נשארו ביד ישראל ליטול מהם תרומה גדולה אלא מ״ה ונמצא חלק קטן של תרומה גדולה מעורבת עם מעשר זה חלק מאה מן העשרה ואעפ״י שאין ראוי לעשות כן בדיעבד מיהא מה שעשה עשוי ואין הלוי צריך להפריש אותו חלק של תרומה גדולה. ומכל מקום דוקא בהקדימו בשיבלין שלא חל עליו חיוב תרומה עדיין אבל משנעשה דגן טבל גמור הוא ואין מערבין בו.
	ובמעשר שני והקדש שנפדו ונתחללה קדושתם. ופרשו בגמרא אעפ״י שלא נתן את החומש שאין חומש מעכב:
	אבל לא בטבל ר״ל שאינו מעושר כלל ואפי׳ בטבל טבול מדרבנן כגון מה שצמח מן העציץ שאינו נקוב:
	ולא במעשר ראשון שלא נטלה תרומתו ופרשו בגמרא אפי׳ נטלה אלא שנטלה שלא כהלכתה כגון שהקדימו בכרי:
	ולא במעשר שני והקדש שלא נפדו ופרשוה בגמרא אפי׳ נפדו אלא שנפדו שלא כהלכתן כגון שחלל מעשר שני על כסף שאין בו צורה וכן שחלל את ההקדש על הקרקע שכל אלו אינן ראויים לשום אדם:
	זהו ביאור המשנה וכלה על הצד שביארנוה הלכה היא ולא נתחדש עליה בגמרא דבר שלא ביארנוה:
31b	המשנה השלישית והכונה בא להתחיל בביאור ענין החלק השני והוא שאמר. השולח את עירובו ביד חרש שוטה וקטן אינו עירוב מפני שאינם בני דעת ולא בני שליחות ואין יודעים לכוין להיות שביתת המשלחם באותו מקום וכן אם שלחו ביד מי שאינו מודה בעירוב כגון כותי אף קודם שעשאום כעכו״ם גמורים שכל שאינו מודה בעירוב אינו מכוון לקנות לו שביתתו לשם אפי׳ נמצא שם שמא מעל בכונתו שלא להיותה על דעת שתהא שביתת המשלח לשם ואם אמר המשלח לבן דעת המודה בעירוב הריני שולח לך עירובי ביד כותי פלוני או ביד חרש או קטן קבלהו ממנו והביאהו למקום שביתתי והודה לו הלה שיעשה כן הרי זה עירוב. ופרשוה בגמרא כשראהו שהוליכו אליו ואעפ״י שלא ראה שקבלו מידו וכן שלא ראה שהניחו אין חוששין לכך שחזקה שליח עושה שליחותו וודאי קבלו והוליכו למקום שביתתו. ומכל מקום אם הלך שם ולא מצא עירובו יראה שיש לו לחוש. אלא שגדולי המפרשי׳ מקילין אף בזו מפני שיש לתלות שבשעת בין השמשות היה שם ואבד משחשיכה. ובגמרא אמרו שאם נתנו לקוף והוליכו או לפיל והוליכו אינו עירוב אעפ״י שהם מגודלים אצלו ומלמדים לעשות מצותו וכן שאמרו בתלמוד המערב שאדם יכול ללמדם שבעים לשון אבל אם אמר לאחר לקבלו וראה בהולכתם הרי זה עירוב ואין חוששין שמא לא קבל או לא הוליך שכל שבדברי סופרים חזקת שליח עושה שליחותו ומכל מקום בדברי תורה אין אומרין חזקת שליח עושה שליחותו אלא להחמיר כמו שהתבאר בגיטין פרק התקבל:
	זהו ביאור המשנה וכן הלכה. ודברים שנכנסו תחתיה בגמרא אלו הן:
	זה שביארנו שהקטן אין שולחין עירוב על ידו דוקא בעירובי תחומין אבל עירובי חצרות הלכה שהקטן גובה עירוב ולענין פירוש מיהא פרשו רוב מפרשי׳ שעירוב תחומין קנין בית הוא ואין כחו של קטן לקנות בית בשביל אחר אבל עירובי חצרות עירובי רשותא בעלמא ולא קנין שהרי אמרו בעל הבית שהיה שותף עם שכנו אין צריך לערב ונמצא שאינו צריך לומר כלום ומתוך כך הותר לגבותו אף על ידי קטן. וגדולי הדור מקשים בפי׳ זה ממה שאמרו בשביעי של גיטין חפץ ומניחו ולאחר שעה נוטלו זוכה בין לעצמו בין לאחרים ושמואל אמ׳ לעצמו ולא לאחרי׳ והקשו לו מדתנן כיצד משתתפין במבוי מניח את החבית וכו׳ וכשהוא מזכה אינו מזכה לא על ידי בנו ובתו הקטני׳ ולא על ידי עבדו ושפחתו העבריים. האי שפחה היכי דמיא אי גדולה מאי בעיא גביה אלא בקטנה אלמא זוכה אף לאחרים. ותירץ שאני שתופי מבואות דרבנן ולפי׳ שכתבנו היה לו לתרץ שאני שתופי מבואות דעירובי רשותא בעלמא היא וודאי למדנו משם שכל בדרבנן אף בקניה זוכה אף לאחרים והם מפרשי׳ כאן בעירובי חצרות שדעת אחרת מקנה אותם כאן בעירובי תחומין שאין כאן דעת אחרת מקנה אותם הא כל שדעת אחרת מקנה אותם בדרבנן זוכה אף לאחרים:
32a	איסור חדש נוהג בכל חמשת המינין עד שיקרב העומר בששה עשר בניסן ואיסור זה נוהג בין בארץ ישראל בין בחוצה לארץ ואף לאחר חורבן ומכל מקום בזמן שבית המקדש קיים משקירב העומר הותר החדש בירושלם והרחוקים שאינן יודעים אם קרב עדיין מותרין בו אחר חצות ואעפ״י שבדברי תורה אין סומכין על חזקת שליח והכהנים שלוחי צבור הם במקום בית דין אין לחוש לכך והדבר ידוע שאין בית דין מתעצלים בו עד לאחר חצות ואחר חורבן יום הנף כלו אסור ובגולה שנהגו בשני ימים אסור כל יום שבעה עשר כמו שיתבאר במקומו:
	כל הקרבנות אין מקריבין על ידם אלא מדעתם חוץ ממחוסרי כפרה ומחוסרי כפרה הם ארבעה זב וזבה ומצורע ויולדת. ולשון חסרון כפרה הוא שאעפ״י שטהרו מטומאתן וטבלו והעריבו שמשן לא גמרה טהרתן לאכול בקדשי׳ עד שיביאו קרבן למחר ויחזרו ויטבלו שהמחוסר כפורים צריך טבילה לקדש מדברי סופרי׳ כמו שביארנו באחרון של חגיגה. וזב וזבה קרבנן שתי תורים או שני בני יונה אחד לעולה ואחד לחטאת והיולדת קרבנה כבש לעולה ובן יונה או תור לחטאת ואם אין ידה משגת שתי תורים או שני בני יונה אחד לעולה ואחד לחטאת ושלש עשרה שופרות היו במקדש והם תיבות קטנות רחבות מלמעלה וקצרות מלמטה עשויות כמן שופר כל אחת מיוחדת לענינה ואחת מהן לכל מי שיש עליו קרבן שתי תורים או שני בני יונה אחד לעולה ואחד לחטאת משליך דמיהן לתיבה זו וכתוב עליה קנים:
	האשה שיש עליה קרבן לידה או זיבה מביאה מעות ר״ל דמי הקנים ונותנת בשופר וטובלת ואוכלת בקדש לערב אעפ״י שלא ידעה אם קרב קרבנה אם לאו מפני שחזקה אין בית דין של כהנים עומדים משם עד שיכלו מעות שבשופר ויקריבו כנגדן קנים כדי שלא יהיו גרמא להיות הנשים אוכלות בקדשים בחסרון כפרה ואין כאן חזקת שליח אלא חזקת בית דין:
	חבר שאמ׳ לו אחד צא ולקוט לך תאנים מתאנתי ולא נתן לו מדה בלקיטתו הרי זה לוקט ואוכל מהן עראי אבל כשהוא בא לאכול מהם בקבע מעשרין ודאי שהדבר ברור שלא עישר עליהם בעל התאנה ממקום אחר שהרי אינו יודע כמה לקט ואפי׳ היה המשלח חבר. ומה שאמרו למטה רישא בעם הארץ שאמר לו לחבר פי׳ אף בעם הארץ שאמ׳ לו לחבר שיש לומר עליו שמא מתוך שיודע בו שהוא חבר מעשר עליהן לכבודו ואינו חשש לשלא מן המוקף ולמה שאינו יודע כמה אלא שיעשר באומדן אעפ״י כן מעשרן ודאי ואינו חושש לכך וכל שכן בחבר שבודאי אינו מעשר אומדות או שמא פירושא ארישא והוא מה שאמר במה דברים אמורים שמעשרן דמאי בעם הארץ שאמר לחבר והענין הוא שאם אמ׳ לו אחד מלא לך כלכלה זו אם זה האומר הוא עם הארץ כשבא לאכול קבע מעשר דמאי שמא עישר עליו ממקום אחר שמא לא עישר הא אם זה האומר חבר הן שאמר לחבר הן שאמ׳ לעם הארץ וחבר אחר שומע אוכל מהן חבר זה קבע בלא מעשר חזקתו שהפריש ואעפ״י שאין תורמין ומעשרין המוקף נוח לו בכך כדי לסלק את המכשול ומכל מקום כל שאמר לקוט ואני מפריש ממקום אחר סומך עליו שחזקת שליח עושה שליחותו ואעפ״י שאין חזקת שליח נאמרת בשל תורה להקל ומעשר פירות מן התורה הוא לדעת גדולי המחברים ואף לשטתנו שאינה מן התורה כמו שכתבנו בברכות מכל מקום יש לו עיקר מן התורה. בזו אינו חזקת שליח לבד אלא חזקת חבר שהיא כחזקת בית דין וכמו שאמרו חזקה על חבר שאינו יוצא דבר שאינו מתוקן מתחת ידו:
	ולענין פי׳ אתה צריך לפרש כל השמועה בשהלוקט או האוכל מן הנלקט חבר שאם הלוקט עם הארץ אנו אין לנו והוא שאמרו עם הארץ מאי בעי [התם] וענין מעשר דמאי כבר ידעת שענינו הוא שאוכל הוא בעצמו מעשר הראוי ללוי אחר שהפריש ממנו תרומת מעשר שבו האסורה לזרים שהרי המעשר מותר לזרים ונסתלק האסור וחזר לדיני ממונות והרי הוא אומר ללוי אייתי ראיה ושקול כמו שהתבאר במקומו:
32b	המשנה הרביעית והכונה בה בענין החלק השני גם כן והוא שאמר נתנו באילן וכו׳ צריך שתדע שכל המניח את העירוב צריך שיהא העירוב במקום שיהא זה שהניחו או שהונח בשבילו ראוי לאכלו לשם בין השמשות ממקום שהוא מכוין לשבות בו ועל זה אמרו שצריך שיהא הוא וערובו במקום אחד ר״ל שאם נתכוון הוא לשבות ברשות היחיד לא יתן את העירוב ברשות הרבי׳ אף בסמוך לו ואם נתכוון לשבות ברשות הרבים לא יתן את עירובו ברשות היחיד ואם עשה כן אינו עירוב שהרי בין השמשות שהיא שעה שקנין העירוב חל בה אי אפשר לו להוציא העירוב ממקומו למקום שהוא שובת בו אלא בעברה והרי הוא צריך להיות העירוב אצלו ראוי לאכלו באותה שעה במקום שביתתו. ומכל מקום אם נתכוון לשבות ברשות הרבים או ברשות היחיד והניח עירובו בכרמלית הסמוך לו או שנתכוון לשבות בכרמלית והניח עירובו ברשות היחיד או ברשות הרבים הרי זה עירוב שהוצאת כרמלית לרשות היחיד או לרשות הרבים אף בשבת עצמה אינה אלא שבות וכל ששבת עצמה אינה אלא שבות בין השמשות מותר במקום מצוה או בשעת הדחק. ומתוך כך אמרו במשנה זו נתנו באילן למעלה מעשרה טפחים אינו עירוב למטה מעשרה הרי זה עירוב. ואילן זה פירושו שרחב ארבעה וכבר ידעת ממסכת שבת שכל שרוחב ארבעה בגובה עשרה הן תל הן חריץ הן היקף מחיצות הוא רשות היחיד אפי׳ היה ברשות הרבים. ושאלו בגמרא על אילן זה דקאי היכא אילימא דקאי ברשות היחיד שהיה שם בסוף אלפים אמה בית שהאילן בתוכו והוא מתכוין לשבות בבית זה אף למעלה מעשרה הוא ועירובו במקום אחד הוא שרשות היחיד עולה (אף) [עד] לרקיע ואין לה שיעור עשרה אלא דקאי ברשות הרבים דנתכון לשבות היכא אם נתכון לשבות באילן עצמו ולמעלה מעשרה גם כן. הרי אף זה הוא ועירובו במקום אחד ומכל מקום יכול היה להקשות לו אם כן היאך אמ׳ למטה מעשרה עירובו עירוב והרי הוא במקום אחד ועירובו במקום אחד. ואף יש ספרים גורסים כן וכן יש שואלין היאך לא הקשה גם כן והא קא משתמש במחובר. ופירשו בו שהיה סבור שאין כאן דין משתמש במחובר לקרקע שהרי מבעוד יום עלה לשם לשבות ואינו צריך לכוף ענפי האילן לנטילת עירובו שהרי במקומו הוא. ופרשוה בשהאילן ברשות הרבים ונתכון לשבות למטה בארץ וכשהניח עירובו למעלה מעשרה נמצא הוא ברשות הרבים ועירובו ברשות היחיד אבל למטה מעשרה נמצא הוא ברשות הרבים ועירובו בכרמלית שכל רחב ארבעה ואינו גבוה עשרה כרמלית הוא. ואעפ״י שמכל מקום צריך בנטילת עירובו להשתמש במחובר לכוף ענפי האילן או לעלות עליו או לסמוך בו הואיל ואין משתמש במחובר אלא משום שבות כל שהוא משום שבות לא גזרו עליו בין השמשות שלא להיותו עירוב אלא שמכל מקום אסור לכתחלה ליטלו אם רצה לאכלו והוא שאמ׳ בגמרא (וצריך) [ואסור] ליטלו. והוא הדין שהיה יכול להקשות מכרמלית שהרי משתמש מרשות הרבים לכרמלית אלא שהיה מתרצו כן ונמצא שאף שני שבותים לא גזרו עליהן בין השמשות. ויש מפרשי׳ בענין משתמש באילן שלא על נטילת העירוב היא שהרי אפשר לו ליטלו בלא עליית אילן והרי הוא כבהמה טעונה כלים שבכלים הנטלין נוטלן מעליה כמו שהתבאר בסוף שבת אלא מפני שנתן באילן זה מבעוד יום דבר שצריך לו שיעמוד שם עד השבת ובשבת יטלנו נקרא משתמש באילן מפני אותה עמידה שעומד שם בשבת לדעת שיטלנו בשבת ומדקדקים בה שאם לא היה צריך ליטלו עד אחר השבת לא נקרא משתמש באילן וכן פרשו שמפני שזוכה לו עמידת עירוב זה באילן ר״ל שהוה לו שביתה הוא עושהו משתמש באילן:
	וממה שכתבנו אתה למד שכל שכן באילן גבוה עשרה ואינו רחב ארבעה ונתכון לשבות למטה עירובו עירוב שהרי עירובו במקום פטור ועדיין אתה צריך לידע בדין אילן זה שפירשו בו בגמ׳ שיש צדדין שאפי׳ נתן בו עירובו למעלה מעשרה ונתכון הוא לשבות ברשות הרבים עירובו עירוב בשני דרכים והוא שנתכוון לשבות תוך ארבע אמות של מקום עירובו וכל המניח עירוב יש לו ארבע אמות שרואין אותו רשות היחיד עד לרקיע ונמצא זה ועירובו במקום אחד ולא שיהא מותר להורידו משם אף בין השמשות שהרי הוצאה גמורה היא אלא שמקולי עירוב שנו כאן לענין זה שרואין הוא ועירובו במקום אחד וכן מצינו דין זה בצד אחר והוא אם נתן עירובו בעיר אחרת שהיא בסוף אלפים אמה על אילן שהוא ברשות הרבים שבתוכה ולמעלה מעשרה ונתכון הוא לשבות ברשות הרבים למטה בעיקרו של אילן אף ברחוק ארבע אמות ומפני שלענין זה אנו רואין את העיר כאלו היה כולה מלאה ודנין אותה כאלו היא רשות היחיד לענין זה מפני שכל העיר כמלאה עפר והרי הוא כנתכון לשבות למעלה וכן הדין באילן העומד בתוך עבורה של אותה העיר ר״ל בתוך שבעים אמה ושירים שלה ואעפ״י שאם רצה ליטלו אינו יכול כמו שכתבנו רואין אותו התחום כמלא עפר עד מקום העירוב וכאילו הוא עומד למעלה מעשרה עם עירובו וכל זה אינו מעיקר הדין שהרי אף העיר נידונת כרשות הרבים כמו שאמרו [לעיל ו׳:] ירושלם אלמלא שדלתותיה נעולות בלילה חייבין עליה משום רשות הרבים אלא שלא נאמר אלא לענין זה שרואין כאילו היא כך להקל בענין עירוב הם אמרו והם אמרו. ויש חולקין מפני זה שלא לפסוק כרבא ואפי׳ לפנים מן העיבור (נתון) [נדון] כרשות הרבים ומביאים ראיה ממה שגדולי הפוסקי׳ לא הביאוה ומכל מקום רוב מפרשי׳ פסקוה והדברים נראין שלא לדחות דברי רבא בלא טענה ובלא שום חולק וגדולי הפוסקי׳ מנהגם לקצר בכמה מקומות שמא סמכו על מה שכבר אמרו בפרק חלון ביתא כמן דמלי דמיא ואעפ״י שבחצר אמרו לאו כמלי דמי דוקא להיתר טלטול ואף רבא מודה בה אבל להכשר עירוב ודאי בכלם נאמר כמאן דמלי דמיא. ואם כן אילן של משנתנו שהוא שנוי סתם ואף במתכוין לשבות בעיקרו של אילן בתוך ארבע אמות פירושו באילן שנוף אחד שלו נוטה חוץ לארבע אמות של מקום שביתתו והוא מתכוין לשבות ברשות הרבים בתוך ארבע של עקרו שהוא רשות הרבים והעירוב הוא באותו הנוף היוצא מן האילן חוץ לארבע אמות למעלה מעשרה והרי הוא כרשות היחיד והמביאו למקום שביתתו מביאו תחלה מרשות היחיד לרשות הרבים קודם שיכניסנו לארבע אמותיו אבל למטה מעשרה הרי הוא כרמלית ואעפ״י שרחוק יתר מארבע אמות ממקום שביתתו אינו אלא שבות שאפי׳ העבירו כמה אמות בכרמלית אין בו אלא שבות ואפי׳ היה רשות הרבים כגון למטה משלשה מביאו אצלו בפחות מארבע אמות שאין ארבע אמותיו רשות היחיד להחמיר בהוצאה מרשות הרבים לתוכו אלא להקל. ומכל מקום דוקא שהעירוב בתוך אלפים אמה שאילו מקום שביתתו בסוף אלפים ועירובו חוץ לאלפים ארבע אמות הוי עירובו חוץ למקומו וכמתגלגל חוץ לתחום שאינו עירוב:
	ולענין ביאור שאלו בגמרא על זה מאי למעלה ומאי למטה שהנוף הנוטה חוץ לארבע אמות מתפשט הוא בשוה ואו כלו למעלה מעשרה או כלו למטה מעשרה והיה לו לומר אם אותו נוף גבוה עשרה או נמוך פחות מעשרה שכשהוא אומר למעלה ולמטה נראה שהוא נוף ישר מלמעלה למטה והוא יכול ליתן בו עירובו פעמים למעלה מעשרה פעמים למטה מעשרה. ופרשוה דהדר זקיף ר״ל שבסוף נטייתו עולה סעיף למעלה בגובה ועיקר הנוף בתוך עשרה והנטייה המתישרת בסוף הנוף למעלה יש בה בתוך עשרה למעלה מעשרה. וחזר והקשה והא אי בעי מייתי לה דרך עליו כלומר שיגלגלנו על הנוף עצמו עד למטה מעשרה שהיא כרמלית ויביאנו דרך אותו הנוף תוך ארבע אמותיו והוה לי׳ מרשות היחיד לכרמלית ומכרמלית לרשות היחיד. ותירצוה שאי אפשר לגלגלה דרך אותו הנוף שבמקום גלגולה שלמטה מעשרה הוא מקום כתוף כגון שהוא גבוה תשעה ונמצא שאי אפשר לו לגלגלה אלא בהוצאה מרשות היחיד לרשות הרבים ובפחות מעשרה אפי׳ במקום זה יכול להפילה בפחות מארבע שאין ארבע אמותיו רשות היחיד להחמיר. כך נראה לי בפירושו והרבה ראיתי מתבלבלים בענינה ואף למובהקים שבמפרשים ראיתי שפירשו והא מייתי דרך עליו כלומר ואפי׳ היא חוץ לארבע אמות ולמעלה מעשרה הואיל וארבע אמות שלו עולות עד לרקיע הרי מביאו מרשות היחיד לרשות היחיד למעלה מעשרה ואין רשות הרבים בנתים. ותירצה שעיקר הנוף שבין העירוב והגזע נמוך כלפי מקום השביתה המחובר אל הגזע יותר מן הנוף הגבוה היוצא ממנו טפח ונמצא שם גבוה תשעה ורבים מכתפין עליו ועמוד תשעה ברשות הרבים שרבים מכתפין עליו רשות הרבים הוא והזורק מתחלת ארבע לסוף ארבע ונח עליו חייב כמו שהתבאר במסכת שבת. ונמצא אף כשאתה מצייר הבאתו למעלה מעשרה הרי עובר באויר רשות הרבי׳. ועמוד תשעה שהזכרנו פירושו תשעה דוקא שפחות משלשה ארעא סמיכתא היא ודרסי לה רבים משלשה ועד תשעה לאו מדרס דרסי לה מפני גבהה ולאו כתופי מכתפי עלה מפני נמכייתה והרי היא כרמלית. עשרה רשות היחיד היא. תשעה ראויה לכתוף. ונמצא לנדון שלפנינו שאין יכול להעבירו אלא דרך אויר רשות הרבים. וגדולי הרבנים פרשו בכאן שאסור תורה הוא שכל המושיט מרשות היחיד לרשות היחיד דרך אויר רשות הרבים אף למעלה מעשרה חייב וכדתנן בהזורק [צו.] היו שתיהן בדיוטא אחת הזורק פטור והמושיט חייב. שכך היתה עבודת הלוים. וגדולי הדור מתמיהים בה שאין הושטה אלא בשראש הדבר שמושיטין אותו מונח ברשות היחיד זו וראשו האחד ברשות שניה כקרשי העגלות ואף הוצאה מרשות היחיד לרשות היחיד דרך רשות הרבים אינו חייב מן התורה שאין הוצאה גמורה אלא עוקר מרשות היחיד ומניח ברשות הרבים ופרשו בזו שאם אנו רואין העברתה למעלה מעשרה מצד שדנין ארבע אמותיו עולות עד לרקיע אין כאן אלא שבות ושמא תאמר ואם כן אעפ״י שרבים מכתפין עליו מה בכך ואין כאן אלא שבות תדע שכל מרשות היחיד לרשות הרבים דנוהו כשל תורה ואף לדעת ר׳ שהרי לדברי הכל יכול לזרקו למעלה מעשרה לתוך ארבע אמות של שביתה ומכל מקום אם הניח עירובו בעמוד תשעה ונתכון לשבות בסמוך לו אלא שרחוק ארבע אמות או יותר עירובו עירוב הואיל ואין שם שמנה אמות שהרי ארבע אמות שלו ולא נשאר אלא פחות מארבע אמות והבאה ברשות הרבים פחות מארבע אמות מותרת:
