Bava Batra 60a:7-9,"מצינא אצטנועי מינך: אבל פותח הוא לרה""ר פתח כנגד פתח: דאמר ליה סוף סוף הא בעית אצטנועי מבני רה""ר: <big><strong>מתני׳</strong></big> אין עושין חלל תחת רה""ר בורות שיחין ומערות ר""א מתיר כדי שתהא עגלה מהלכת וטעונה",Meiri on Bava Batra 60a:4,רשאי ועל איזה צד אינו רשאי ואמר על זה אין עושין חלל תחת רשות הרבים בורות שיחין ומערות ר' אליעזר מתיר כדי שתהא עגלה מהלכת וטעונה אבנים אין מוציאין זיזין וגזוזטראות לרשות הרבים אלא אם רצה כונס לתוך
Bava Batra 60b:11,בשניה רבו פרושין בישראל שלא לאכול בשר ושלא לשתות יין נטפל להן ר' יהושע אמר להן בני מפני מה אי אתם אוכלין בשר ואין אתם שותין,Meiri on Bava Batra 60b:6,"מנין לכם אמרו נאכל בשר שממנו מקריבין על גבי המזבח ועכשו בטל נשתה יין שממנו מנסכין על גבי מזבח ועכשו בטל אמר להם א""כ להם לא"
Bava Batra 60b:11-12,"נשתה יין שמנסכין על גבי המזבח ועכשיו בטל אמר להם א""כ לחם לא נאכל שכבר בטלו מנחות אפשר בפירות פירות לא נאכל שכבר בטלו בכורים אפשר בפירות אחרים מים לא נשתה שכבר בטל ניסוך המים שתקו אמר",Meiri on Bava Batra 60b:6,המינין עד שאמר להם מים לא נשתה שכבר בטל נסוך המים ושתקו אמר להם בני באו ואומר לכם שלא להתאבל כל עיקר אי אפשר שכבר נגזרה גזרה להתאבל יותר מדאי אי אפשר שאין גוזרין גזרה על הצבור
Bava Batra 60b:15-16,"כסא דהרסנא עושה אשה כל תכשיטיה ומשיירת דבר מועט מאי היא אמר רב בת צדעא שנאמר (תהלים קלז, ה) אם אשכחך",Meiri on Bava Batra 60b:6,מניחין אפר מקלה בראשי חתנים ובמקום תפלין שנאמר לשום לאבלי ציון לתת להם פאר תחת אפר וכל המתאבל על ירושלם
Bava Batra 61a:1,"<big><strong>המוכר</strong></big> את הבית לא מכר יציע ואע""פ שהיא פתוחה לתוכו ולא את החדר שלפנים הימנו ולא את הגג בזמן שיש לו מעקה גבוה עשרה טפחים ר' יהודה אומר אם יש לו צורת פתח אע""פ שאינו גבוה י'",Meiri on Bava Batra 61a:2,"המוכר את הבית לא מכר את היציע אע""פ שהיא פתוחה לתוכו ולא את החדר שלפנים ממנו ולא את הגג בזמן שיש לו מעקה גבוה עשרה טפחים ר' יהודה אומר אם יש לו צורת פתח אע""פ שאינו גבוה עשרה"
Bava Batra 67b:1-2,"תשמישתא לחוד קא משמע לן: <big><strong>מתני׳</strong></big> המוכר בית הבד מכר את הים ואת הממל ואת הבתולות אבל לא מכר את העבירים ואת הגלגל ואת הקורה ובזמן שאמר לו הוא וכל מה שבתוכו הרי כולן מכורין ר""א אומר",Meiri on Bava Batra 67b:1,זה המוכר בית הבד מכר את הים ואת הממל ואת הבתולות אבל לא מכר את העמודים ואת הגלגל ולא את הקורה בזמן שאמר לו הוא וכל מה שבתוכו הרי כלן מכורין ר' אליעזר אומר המוכר את בית הבד מכר
Bava Batra 68a:3-4,וכל תשמישיו ואלין מצרנהא קני ואי לא לא קני: <big><strong>מתני׳</strong></big> המוכר את העיר מכר בתים בורות שיחין ומערות מרחצאות ושובכות בית הבדין ובית השלחין אבל לא את המטלטלין ובזמן שאמר לו היא וכל מה שבתוכה אפילו היו בה בהמה ועבדים,Meiri on Bava Batra 68a:2,"העיר ואמר על זה המוכר את העיר מכר בתים בורות שיחין ומערות מרחצאות ושובכות בית הבדים ובית השלחין אבל לא את המטלטלין בזמן שאמר לו היא וכל מה שבתוכה אפילו בהמה ועבדים הרי כלן מכורים רשב""ג אומר המוכר"
Bava Batra 68b:7-10,עמה לא קשיא הא דנגיח קאיהי לגו והא דנגיח קאיהי לבר והא קא תני ולא את חורשין המוקצין לה אימא המוקצין הימנה: <big><strong>מתני׳</strong></big> המוכר את השדה מכר את האבנים שהם לצרכה ואת הקנים שבכרם שהם לצרכו ואת התבואה שהיא מחוברת לקרקע ואת חיצת הקנים שהיא פחותה מבית רובע ואת השומירה שאינה עשויה בטיט ואת החרוב שאינו מורכב ואת בתולת השקמה אבל לא מכר לא את האבנים שאינן לצרכה ולא את הקנים שבכרם שאינן לצרכו ולא את התבואה שהיא תלושה מן הקרקע בזמן שאמר לו היא וכל מה שבתוכה הרי כולן מכורין בין כך ובין,Meiri on Bava Batra 68b:3,ואמר על זה המוכר את השדה מכר את האבנים שהם לצרכה ואת הקנים שבכרם שהם לצרכו ואת התבואה שהיא מחוברת לקרקע ואת מחיצת הקנים שהיא פתוחה מבית רובע ואת השומירה העשויה בטיט ואת החרוב שאינו מורכב ואת בתולת השקמה אבל לא מכר לא את האבנים שאינן לצרכה ולא את הקנים שבכרם שאינן לצרכו ולא את התבואה שהיא תלושה מן הקרקע ובזמן שאמר לו הוא וכל מה שבתוכה הרי כלן מכורין בין כך ובין כך לא מכר את מחיצת הקנים שהיא בית רובע ולא את השומירה שאינה עשויה בטיט ולא את החרוב המורכב
Bava Batra 71a:4-5,"במוכר אבל בנותן מתנה נותן את כולה האחין שחלקו זכו בשדה זכו בכולה המחזיק בנכסי הגר החזיק בשדה החזיק בכולה המקדיש את השדה הקדיש את כולה ר""ש אומר המקדיש את השדה לא הקדיש אלא את החרוב המורכב ואת",Meiri on Bava Batra 71a:1,"במוכר אבל בנותן נתן את כלן האחים שחלקו זכו בשדה זכו בכלן המחזיק בנכסי הגר זכה בשדה זכה בכולן המקדיש את השדה [הקדיש את כולה ר""ש אומר המקדיש את השדה] לא הקדיש אלא חרוב המורכב וסדן"
Bava Batra 77b:4-5,אנתיקי אמר רב פפא עיסקא דבגווה: <big><strong>מתני׳</strong></big> מכר את הקרון לא מכר את הפרדות מכר את הפרדות לא מכר את הקרון מכר את הצמד לא מכר את הבקר מכר את הבקר לא מכר את הצמד ר' יהודה אומר הדמים מודיעין כיצד אמר לו מכור לי צימדך במאתים זוז הדבר,Meiri on Bava Batra 77b:3,על זה מכר את הקרון לא מכר את הפרדות מכר את הפרדות לא מכר את הקרון מכר את הצמד לא מכר את הבקר מכר את הבקר לא מכר את הצמד ר' יהודה אומר הדמים מודיעין כיצד אמר לו מכור לי צמדך במאתים זוז הדבר ידוע שאין הצמד במאתים זוז
Bava Batra 78a:2-3,ליה: <big><strong>מתני׳</strong></big> המוכר את החמור לא מכר כליו נחום המדי אומר מכר כליו רבי יהודה אומר פעמים מכורין פעמים אינן מכורין כיצד היה חמור לפניו וכליו עליו ואמר לו מכור לי חמורך זה הרי כליו,Meiri on Bava Batra 78a:1,זה המוכר את החמור לא מכר את כליו נחום המדי אומר מכר את כליו ר' יהודה אומר פעמים מכורים ופעמים שאינן מכורים כיצד היה חמור לפניו וכליו עליו אמר לו מכור לי חמורך זה כליו מכורים
Bava Batra 78b:8-9,"דקא א""ל זו משום כליו קא""ל חמורך הוא דלא ידע דחמרא דידיה הוא והכי קא""ל חמורך הוא שתמכרנה לי: <big><strong>מתני׳</strong></big> המוכר את החמור מכר את הסיח מכר את",Meiri on Bava Batra 78b:1,המוכר את החמור מכר את הסייח מכר את הפרה לא מכר את בנה מכר אשפה מכר זבלה מכר בור מכר מימיו מכר שובך מכר
Bava Batra 80a:1,הלוקח פירות שובך מחבירו מפריח בריכה ראשונה פירות כוורת נוטל ג' נחילים ומסרס חלות דבש מניח שתי חלות זיתים לקוץ מניח שתי,Meiri on Bava Batra 80a:1,זה הלוקח פירות שובך מחבירו מפריח בריכה ראשונה פירות כוורת נוטל שלשה נחילין ומסרס חלות דבש מניח שתי חלות זיתים לקוץ מניח
Bava Batra 81a:1-3,<big><strong>מתני׳</strong></big> הקונה שני אילנות בתוך שדה חבירו הרי זה לא קנה קרקע רבי מאיר אומר קנה קרקע הגדילו לא ישפה והעולה מן הגזע שלו ומן השרשים של בעל הקרקע ואם מתו אין לו קרקע קנה שלשה קנה קרקע הגדילו ישפה והעולה מן הגזע ומן השרשין שלו ואם מתו,Meiri on Bava Batra 81a:1,"זה הקונה שני אילנות בתוך של חברו הרי זה לא קנה קרקע ר' מאיר אומר קנה, קרקע הגדילו לא ישפה העולה מן הגזע שלו ומן השרשים של בעל הבית ואם מתו אין לו קרקע קנה שלשה קנה קרקע הגדילו ישפה, העולה מן השרשים שלו ואם מתו"
Bava Batra 83b:4-5,"קרקע א""ל הנך לא חשיבי הנך חשיבי: <big><strong>מתני׳</strong></big> המוכר ראש בהמה גסה לא מכר את הרגלים מכר את הרגלים לא מכר את הראש מכר את הקנה לא מכר את הכבד מכר את הכבד לא מכר את הקנה אבל בדקה מכר את הראש מכר את הרגלים מכר את הרגלים לא מכר את הראש מכר את",Meiri on Bava Batra 83b:1,את הראש בבהמה גסה לא מכר את הרגלים מכר את הרגלים לא מכר את הראש מכר את הקנה לא מכר את הכבד מכר את הכבד לא מכר את הקנה אבל בבהמה דקה מכר את הראש מכר את הרגלים מכר את הרגלים מכר את הראש מכר את הקנה מכר את הכבד מכר את הכבד מכר
Bava Batra 83b:5-7,את הכבד מכר את הכבד לא מכר את הקנה: ארבע מדות במוכרין מכר לו חטין יפות ונמצאו רעות הלוקח יכול לחזור בו רעות ונמצאו יפות מוכר יכול לחזור בו רעות ונמצאו רעות יפות ונמצאו יפות אין אחד מהם יכול לחזור בו שחמתית ונמצאת לבנה לבנה ונמצאת שחמתית עצים של זית ונמצאו של שקמה של שקמה ונמצאו של,Meiri on Bava Batra 83b:4,לחזור ואמר על זה ארבע מדות במוכרין מכר לו חטים יפות ונמצאו רעות הלוקח יכול לחזור בו רעות ונמצאו יפות מוכר יכול לחזור בו רעות ונמצאו רעות יפות ונמצאו יפות אין אחד מהם יכול לחזור בו שחמתית ונמצאת לבנה לבנה ונמצאת שחמתית עצים של זית ונמצאו של שקמה של שקמה ונמצאת של זית יין ונמצא חומץ חומץ
Bava Batra 84b:4-6,ניחא ליה בחלא ואיכא דניחא ליה בחלא ולא ניחא ליה בחמרא: <big><strong>מתני'</strong></big> המוכר פירות לחבירו משך ולא מדד קנה מדד ולא משך לא קנה אם היה פיקח שוכר את מקומן הלוקח פשתן מחבירו הרי זה לא,Meiri on Bava Batra 84b:2,זה המוכר פירות לחברו משך ולא מדד קנה מדד ולא משך לא קנה ואם היה פקח שוכר את מקומו הלוקח פשתן מחברו הרי זה לא קנה עד שיטלטלנו ממקום למקום ואם היה מחובר לקרקע ותלש כל
Bava Batra 87a:5-7,וקני כל מה שעליה: <big><strong>מתני׳</strong></big> המוכר יין ושמן לחבירו והוקרו או שהוזלו אם עד שלא נתמלאת המדה למוכר משנתמלאת המדה ללוקח ואם היה סרסור ביניהן נשברה החבית נשברה לסרסור וחייב להטיף לו שלש טיפין הרכינה ומיצית הרי הוא של מוכר והחנווני אינו חייב להטיף שלש טיפין רבי,Meiri on Bava Batra 87a:1,זה המוכר יין ושמן לחברו והוקרו או שהוזלו עד שלא נתמלאת המדה למוכר משנתמלאת המדה ללוקח היה סרסור ביניהם ונשברה החבית נשברה לסרסור וחייב להטיף לו שלש טיפין הרכינה ומיצית הרי זו של מוכר החנוני חייב להטיף לו שלש טיפין ר' יהודה אומר אם היה ערב שבת
Bava Batra 87b:4-5,פטור מפני שחנווני טרוד: <big><strong>מתני׳</strong></big> השולח את בנו אצל חנווני (ופונדיון בידו) ומדד לו באיסר שמן ונתן לו את האיסר שבר את הצלוחית ואבד את האיסר חנווני חייב רבי יהודה פוטר שעל מנת כן שלחו ומודים חכמים,Meiri on Bava Batra 87b:1,זה השולח את בנו אצל חנוני ומדד לו באיסר שמן ונתן לו את האיסר שבר הצלוחית ואבד האיסר החנוני חייב ור' יהודה פוטר שעל מנת כן שלחו ומודים חכמים לר' יהודה בזמן שהצלוחית ביד התינוק
Bava Batra 88a:11-13,"בירא שמים עסקינן כגון רב ספרא דקיים בנפשיה (תהלים טו, ב) ודובר אמת בלבבו: <big><strong>מתני׳</strong></big> הסיטון מקנח מדותיו אחד לשלשים יום ובעל הבית אחד לשנים עשר חדש רבן שמעון בן גמליאל אומר חילוף הדברים חנווני מקנח מדותיו פעמים בשבת וממחה",Meiri on Bava Batra 88a:4,"על זה הסיטון מקנח את מדותיו אחת לשלשים יום ובעל הבית אחד לשנים עשר חדש רשב""ג אומר חלוף הדברים החנוני מקנח מדותיו פעמים בשבת וממחה את משקלותיו פעם אחת בשבת ומקנח מאזנים על כל משקל ומשקל אמר רשב""ג במה"
Bava Batra 89b:7-8,"ה' וצדיקים ילכו בם ופושעים יכשלו בם ת""ר (ויקרא יט, לה) לא תעשו עול במשפט במדה במשקל ובמשורה במדה",Meiri on Bava Batra 89b:4,שאמרו במדה זו מדת קרקעות שלא ימדוד לאחד בימות החמה ולאחד בימות הגשמים במשקל שלא יטמין משקלותיו במלח במשורה
Bava Batra 93a:3,שור שנגח את הפרה ונמצא עוברה בצדה ואינו ידוע אם עד שלא נגחה ילדה או אם משנגחה ילדה משלם חצי נזק,Meiri on Bava Batra 93a:1,<b>שור</b> שנגח את הפרה ונמצא עוברה בצדה ואין ידוע אם עד שלא נגחה ילדה אם משנגחה ילדה משלם חצי נזק
Bava Batra 93a:6,"ונמצא שור הרוג בצדו אע""פ שזה מנוגח וזה מועד ליגח זה מנושך וזה מועד לישוך אין אומרים בידוע שזה נגחו וזה",Meiri on Bava Batra 93a:2,"ונמצא שור הרוג בצדו אע""פ שזה מנוגח וזה מועד ליגח זה מנושך וזה מועד לישוך אין אומרין בידוע שזה נגחו וזה"
Bava Batra 93b:10-11,נאכלין חייב באחריותן אלא הא רבן שמעון בן גמליאל דתניא המוליך חטין לטחון ולא לתתן ועשאן סובין או מורסן קמח לנחתום,Meiri on Bava Batra 93b:1,"<b>המוליך</b> חטיו לטחון ולא לתתן ועשאן סובין או מורסן קמח לנחתום ואפאה פת ניפולין בהמה לטבח ונבלה חייבין לשלם בד""א בשכר וזה שאמרו מפני שהוא כנושא"
Bava Batra 93b:13-14,זמן שמפה פרוסה אורחין נכנסין נסתלקה המפה אין האורחין נכנסין: <big><strong>מתני׳</strong></big> המוכר פירות לחבירו הרי זה מקבל עליו רובע טנופת לסאה תאנים מקבל עליו עשר מתולעות למאה מרתף של יין,Meiri on Bava Batra 93b:4,המוכר פירות לחברו הרי זה מקבל עליו רובע טנופת לסאה תאנים מקבל עליו עשר מתליעות למאה מרתף של יין מקבל עליו עשר קוססות למאה קנקנים בשרון מקבל עליו עשר פטיסאות
Bava Batra 98b:2-4,מקום מחבירו לעשות לו בית חתנות לבנו ובית אלמנות לבתו בונה ארבע אמות על שש דברי ר' עקיבא רבי ישמעאל אומר רפת בקר היא זו הרוצה לעשות רפת בקר בונה ד' אמות על שש בית קטן שש על ח' גדול ח' על עשר טרקלין י' על י' רומו כחצי ארכו וכחצי,Meiri on Bava Batra 98b:1,המוכר מקום לחברו לבנות לו בית וכן המקבל מחברו לבנות לו בית חתנות לבנו או בית אלמנות לבתו בונה ארבע אמות על שש דברי ר' עקיבא ר' ישמעאל אומר רפת בקר היא זו הרוצה לעשות רפת בקר בונה ארבע אמות על שש בית קטן שש על שמנה בית גדול שמנה על עשר טרקלין עשר על עשר רומו כחצי ארכו
Bava Batra 98b:2-3,בית חתנות לבנו ובית אלמנות לבתו בונה ארבע אמות על שש דברי ר' עקיבא רבי ישמעאל אומר רפת בקר היא זו הרוצה לעשות רפת בקר בונה,Meiri on Bava Batra 98b:2,סתם או שקבל עליו בפרט בית חתנות לבנו או בית אלמנות לבתו בונה ארבע אמות על שש דברי ר' עקיבא ור' ישמעאל אומר רפת בקר היא זו ואינו כלום
Bava Batra 98b:5-6,בי חמוה כדכתיב בספר בן סירא הכל שקלתי בכף מאזנים ולא מצאתי קל מסובין וקל מסובין חתן הדר בבית חמיו וקל מחתן אורח מכניס אורח וקל,Meiri on Bava Batra 98b:5,אדם שלא יהא מכניס אורח בבית שהוא נכנס בו כאורח דרך הערה אמרו בספרים החיצונים הכל שקלתי בכף מאזנים ולא מצאתי קל מסובין וקל מסובין חתן
Bava Batra 99a:6-7,"שאין ישראל עושין רצונו של מקום ולמ""ד ופניהם לבית הא כתיב (שמות כה, כ) ופניהם איש אל אחיו דמצדדי אצדודי דתניא אונקלוס הגר אמר כרובים (דברי הימים ב ג, י) מעשה צעצועים הן ומצודדים פניהם כתלמיד הנפטר",Meiri on Bava Batra 99a:1,זה מי שיש לו בור לפנים מביתו של חברו נכנס בשעה שבני אדם נכנסין ויוצא בשעה שבני אדם יוצאין ואינו מכניס את בהמתו ומשקה מבורו אלא ממלא ומשקה מבחוץ וזה עושה לו פותחת וזה עושה לו
Bava Batra 99b:2-3,מי שיש לו גינה לפנים מגינתו של חברו נכנס בשעה שדרך בני אדם נכנסים ויוצא בשעה שדרך בני אדם יוצאין ואינו מכניס לתוכה תגרין ולא יכנס מתוכה לתוך שדה אחרת והחיצון זורע את הדרך נתנו לו דרך מן הצד מדעת שניהן נכנס בשעה שהוא רוצה ויוצא בשעה שרוצה ומכניס לתוכה תגרין ולא יכנס מתוכה לתוך שדה אחרת זה וזה אינן,Meiri on Bava Batra 99b:1,מי שיש לו גנה לפנים מגנתו של חברו נכנס בשעה שבני אדם נכנסין ויוצא בשעה שבני אדם יוצאים ואינו מכניס תגרין ולא יכנס מתוכה לתוך שדה אחרת והחיצון זורע את הדרך נתנו לו דרך מן הצד מדעת שניהם נכנס בשעה שהוא רוצה ומכניס לתוכה תגרין ולא יכנס מתוכה לתוך שדה אחרת וזה וזה אינן
Bava Batra 100b:9-10,ואי אמרת בבית הקברות וביום א' בית הקברות בשבת מאי בעי בעיר הסמוכה לבית הקברות דאמטיוהו בין השמשות: <big><strong>מתני׳</strong></big> המוכר מקום לחברו לעשות לו קבר וכן המקבל מחברו לעשות לו קבר עושה תוכה של מערה,Meiri on Bava Batra 100b:4,על זה המוכר מקום לחברו לעשות לו קבר וכן המקבל מקום מחברו לעשות לו קבר עושה תוכה של מערה ארבע אמות על שש ופותח לתוכה שמנה כוכין שלשה מכאן ושלשה מכאן ושנים מכנגדן והכוכין ארכן ארבע
Bava Batra 102b:7-9,שפיר ודלא שפיר ליהוי לציבי: <br><br><big><strong>הדרן עלך המוכר פירות</strong></big><br><br> מתני׳ <big><strong>האומר</strong></big> לחבירו בית כור עפר אני מוכר לך היו שם נקעים עמוקים עשרה טפחים או סלעים גבוהין י' טפחים אינן נמדדין עמ פחות מכאן נמדדין עמה ואם אמר לו כבית כור עפר אפילו היו שם נקעים עמוקים יותר,Meiri on Bava Batra 102b:4,האומר לחברו בית כור עפר אני מוכר לך היו שם נקעים עמוקים עשרה טפחים או סלעים גבוהים עשרה טפחים אין נמדדין עמה פחות מכן נמדדין עמה אם אמר לו כבית כור עפר אני מוכר לך אפילו היו שם נקעים עמוקים יותר מעשרה טפחים או סלעים גבוהים יותר מעשרה טפחים הרי אלו
Bava Batra 103b:3-5,תיקו: <big><strong>מתני׳</strong></big> בית כור עפר אני מוכר לך מדה בחבל פיחת כל שהוא ינכה הותיר כל שהוא יחזיר ואם אמר הן חסר הן יתר אפילו פיחת רובע לסאה או הותיר רובע לסאה הגיעו יותר מכאן יעשה חשבון מה הוא מחזיר לו מעות ואם רצה מחזיר לו קרקע ולמה אמרו מחזיר לו מעות לייפות כחו של מוכר שאם שייר בשדה בית תשעה קבין ובגינה בית חצי קב וכדברי ר' עקיבא בית רובע מחזיר לו את הקרקע לא את הרובע בלבד הוא,Meiri on Bava Batra 103b:3,על זה בית כור עפר אני מוכר לך מדה בחבל פחות כל שהו ינכה הותיר כל שהו יחזיר ואם אמר לו הן חסר והן יתר אפילו פחות רובע לסאה או הותיר רובע לסאה הגיעו יתר מכן יעשה עמו חשבון מהו מחזיר לו מעות ואם רצה יחזיר לו את הקרקע ולמה אמרו יחזיר לו מעות כדי ליפות כחו של מוכר שאם שייר בשדה בית תשעה קבין ובגנה בית חצי קב וכדברי ר' עקיבא בית רובע מחזיר לו את הקרקע ולא את הרובע בלבד הוא מחזיר
Bava Batra 104b:8-9,את המותר בלבד מחזיר לו אלא את כל הרבעין כולן: <big><strong>מתני׳</strong></big> מדה בחבל אני מוכר לך הן חסר הן יתר בטל,Meiri on Bava Batra 104b:4,זה מדה בחבל אני מוכר לך הן חסר הן יתר בטל הן חסר הן יתר מדה בחבל הן חסר הן יתר
Bava Batra 104b:8-9,אלא את כל הרבעין כולן: <big><strong>מתני׳</strong></big> מדה בחבל אני מוכר לך הן חסר הן יתר בטל,Meiri on Bava Batra 104b:5,<b>אמר</b> המאירי מדה בחבל הן חסר הן יתר ביטל הן חסר הן יתר מדה בחבל הן
