Bava Batra 107b:5-6,כדייני גולה אמר רב אשי טעמא דדייני גולה לא ידעינן הלכתא עבדינן כוותייהו: <big><strong>מתני׳</strong></big> האומר לחבירו חצי שדה אני מוכר לך משמנין ביניהן ונוטל חצי שדהו חציה בדרום אני מוכר לך משמנין ביניהן ונוטל חציה בדרום והוא,Meiri on Bava Batra 107b:1,זה האומר לחברו חצי שדה אני מוכר לך משמנין ביניהם ונוטל חצי שדהו חציה בדרום אני מוכר לך משמנין ביניהם ונוטל חצי בדרום ומקבל עליו מקום הגדר וחריץ ובן חריץ כמה הוא חריץ ששה טפחים ובן
Bava Batra 108a:2-4,כור</strong></big><br><br> מתני׳ <big><strong>יש</strong></big> נוחלין ומנחילין ויש נוחלין ולא מנחילין מנחילין ולא נוחלין לא נוחלין ולא מנחילין ואלו נוחלין ומנחילין האב את הבנים והבנים את האב והאחין מן האב נוחלין ומנחילין האיש את אמו והאיש את אשתו ובני אחיות נוחלין ולא מנחילין האשה את בניה והאשה את בעלה ואחי האם מנחילין ולא נוחלין והאחין מן האם לא,Meiri on Bava Batra 108a:2,יש נוחלין ומנחילין נוחלין ולא מנחילין מנחילין ולא נוחלין לא נוחלין ולא מנחילין ואלו נוחלין ומנחילין האב את הבנים והבנים את האב והאחים מן האב נוחלין ומנחילין האיש את אמו והאיש את אשתו ובני אחיות נוחלין ולא מנחילין האשה את בנה והאשה את בעלה ואחי האם מנחילין ולא נוחלין והאחים מן האם לא נוחלין ולא
Bava Batra 115a:5-7,"בנכסי האם מנא ליה לעולם דריש מטות ושאני הכא דאמר קרא (במדבר לו, ח) וכל בת יורשת נחלה יורשת ואינה מורשת: <big><strong>מתני׳</strong></big> סדר נחלות כך הוא (במדבר כז, ח) איש כי ימות ובן אין לו והעברתם את נחלתו לבתו בן קודם לבת כל יוצאי יריכו של בן קודמין לבת בת קודמת לאחין יוצאי יריכה",Meiri on Bava Batra 115a:1,סדר נחלות כך היא איש כי ימות ובן אין לו והעברתם את נחלתו לבתו בן קודם לבת כל יוצאי ירכו של בן קודמין לבת בת קודמת לאחים כל יוצאי ירכה של בת קודמין לאחים אחים קודמין לאחי האב כל יוצאי ירכו של אחים קודמין לאחי האב זה הכלל כל הקודם בנחלה כל יוצאי ירכו קודמין והאב קודם
Bava Batra 116b:3-4,שמע מינה: <big><strong>מתני׳</strong></big> בנות צלפחד נטלו ג' חלקים בנחלה חלק אביהן שהיה עם יוצאי מצרים וחלקו עם אחיו בנכסי חפר,Meiri on Bava Batra 116b:1,בנות צלפחד נטלו שלשה חלקים בנחלה חלק אביהן שהיה מיוצאי מצרים וחלקו עם אחיו בנכסי חפר ושהיה בכור ונוטל
Bava Batra 122b:2-3,"(יהושע כא, יב) ואת שדה העיר ואת חצריה נתנו לכלב בן יפונה באחוזתו: <big><strong>מתני׳</strong></big> אחד הבן ואחד הבת בנחלה אלא שהבן נוטל פי שנים בנכסי",Meiri on Bava Batra 122b:1,זה אחד הבן ואחד הבת לנחלה אלא שהבן נוטל פי שנים בנכסי האב ואין נוטל פי שנים בנכסי האם והבנות נזונות מנכסי האב ואינן נזונות
Bava Batra 129b:7,שלח רב אחא ברי' דרב עויא לדברי ר' יוחנן בן ברוקה נכסי לך ואחריך לפלוני וראשון ראוי ליורשו אין לשני במקום ראשון,Meiri on Bava Batra 129b:1,האחרים ראויים לירש והרי אמרו נכסי לך ואחריך לפלוני והראשון ראוי לירשו אין לשני במקום ראשון כלום שאין לשון מתנה אלא
Bava Batra 133b:3-4,"אכסיף קרי עליה (ישעיהו ס, כב) אני ה' בעתה אחישנה: <big><strong>מתני׳</strong></big> הכותב את נכסיו לאחרים והניח את בניו מה שעשה עשוי אלא אין רוח חכמים",Meiri on Bava Batra 133b:1,"זה הכותב נכסיו לאחרים והניח את בנו מה שעשה עשוי אבל אין רוח חכמים נוחה הימנו רשב""ג אומר אם לא היו בניו נוהגין כשורה"
Bava Batra 134a:3-4,מעשה בבית חורון באחד שהיה אביו מודר הימנו הנאה והיה משיא בנו ואמר לחבירו הרי חצר וסעודה נתונין לך במתנה ואינן לפניך [אלא כדי] שיבא אבא ויאכל עמנו בסעודה אמר לו אם שלי הן הרי הן מוקדשין לשמים אמר לו לא נתתי לך את שלי שתקדישם לשמים אמר לו לא נתת לי את שלך אלא שתהא אתה ואביך אוכלין ושותין ומרצין זה לזה ויהא עון תלוי בראשו,Meiri on Bava Batra 134a:1,באחד שהיה אביו מודר הנאה ממנו והיה משיא את בנו ואמר לחברו הרי חצר וסעודה נתונים לך במתנה ואינן לפניך אלא על מנת שיבא אבא ויאכל עמנו ואמר לו אם שלי הם הרי הם מוקדשים לשמים אמר לו לא נתתי לך את שלי על מנת שתקדיש לשמים אמר לו אתה נתת לי את שלך על מנת שתהיו אתה ואביך אוכלים ושותים ומתרצים זה לזה ויהא קולאר תלוי בצוארי ואמרו חכמים כל מתנה
Bava Batra 134a:9-10,וכמה אמרו עליו על יונתן בן עוזיאל בשעה שיושב ועוסק בתורה כל עוף שפורח עליו נשרף: <big><strong>מתני׳</strong></big> האומר זה בני נאמן זה,Meiri on Bava Batra 134a:3,לאו במי שפרע קאי: <b>המשנה</b> השביעית והכונה לבאר בה ענין החלק החמישי והוא שאמר האומר זה בני נאמן וזה אחי אינו נאמן
Bava Batra 134a:9-10,וכמה אמרו עליו על יונתן בן עוזיאל בשעה שיושב ועוסק בתורה כל עוף שפורח עליו נשרף: <big><strong>מתני׳</strong></big> האומר זה בני נאמן זה,Meiri on Bava Batra 134a:4,לאו במי שפרע קאי: <b>המשנה</b> השביעית והכונה לבאר בה ענין החלק החמישי והוא שאמר האומר זה בני נאמן וזה אחי אינו נאמן
Bava Batra 136a:3-5,מהיום ולאחר מיתה דברי רבי יהודה רבי יוסי אומר אינו צריך הכותב נכסיו לבנו לאחר מותו האב אינו יכול למכור מפני שהן כתובין לבן והבן אינו יכול למכור מפני שהן ברשות האב מכר האב,Meiri on Bava Batra 136a:5,ואף חכמי הדורות שלפנינו נסכמים בזו והוא תמה גדול: <b>המשנה</b> העשירית והכונה בה ככונת משנה שלפניה ואמר על זה הכותב נכסיו לבנו לאחר מיתתו האב אינו יכול למכור מפני שכתובין לבן הבן אינו
Bava Batra 136a:3-5,מהיום ולאחר מיתה דברי רבי יהודה רבי יוסי אומר אינו צריך הכותב נכסיו לבנו לאחר מותו האב אינו יכול למכור מפני שהן כתובין לבן והבן אינו יכול למכור מפני שהן ברשות האב מכר האב,Meiri on Bava Batra 136a:6,ואף חכמי הדורות שלפנינו נסכמים בזו והוא תמה גדול: <b>המשנה</b> העשירית והכונה בה ככונת משנה שלפניה ואמר על זה הכותב נכסיו לבנו לאחר מיתתו האב אינו יכול למכור מפני שכתובין לבן הבן אינו
Bava Batra 138a:7-8,דסבר כי לא מטו לידי מאי אצווח תנו רבנן שכיב מרע שאמר תנו מאתים זוז לפלוני ושלש מאות לפלוני וארבע מאות לפלוני אין אומרין כל,Meiri on Bava Batra 138a:5,צוח אין ספק שזהו כצווח מעיקרו וידו על העליונה שאם רצה הנותן לחזור קודם שידע זה אינו רשאי שזכין לאדם שלא בפניו ואם לא רצה זה לקבלה אינה מתנה שאין נותנין
Bava Batra 139a:4-6,נתן הניח בנות גדולות וקטנות אין הגדולות מתפרנסות על ידי הקטנות ולא הקטנות נזונות על הגדולות אלא חולקות בשוה נשאו גדולות ישאו קטנות ואם אמרו קטנות הרי אנו נושאות כדרך שנשאתם אתם,Meiri on Bava Batra 139a:1,זה הניח בנים גדולים וקטנים אין הגדולים מתפרנסין על הקטנים ולא הקטנים מתפרנסין על הגדולים אלא חולקין בשוה נשאו גדולים ישאו קטנים אם אמרו קטנים הרי אנו נושאין כדרך שנשאתם אתם
Bava Batra 139a:3-6,<big><strong>מתני׳</strong></big> הניח בנים גדולים וקטנים אין הגדולים מתפרנסין על ידי הקטנים ולא הקטנים נזונין על הגדולים אלא חולקין בשוה נשאו הגדולים ישאו הקטנים ואם אמרו קטנים הרי אנו נושאין כדרך שנשאתם אתם אין שומעין להם אלא מה שנתן להם אביהם נתן הניח בנות גדולות וקטנות אין הגדולות מתפרנסות על ידי הקטנות ולא הקטנות נזונות על הגדולות אלא חולקות בשוה נשאו גדולות,Meiri on Bava Batra 139a:1,זה הניח בנים גדולים וקטנים אין הגדולים מתפרנסין על הקטנים ולא הקטנים מתפרנסין על הגדולים אלא חולקין בשוה נשאו גדולים ישאו קטנים אם אמרו קטנים הרי אנו נושאין כדרך שנשאתם אתם אין שומעין להם אלא מה שנתן להם אביהם נתן הניח בנות גדולות וקטנות אין הגדולות מתפרנסות על הקטנות ולא הקטנות מתפרנסות על הגדולות אלא חולקות בשוה נשאו גדולות
Bava Batra 139a:12,אביהן ואמרו קטנים לאחר מיתת אביהן הרי אנו נושאין כדרך שנשאתם אתם אין שומעין להן אלא מה שנתן,Meiri on Bava Batra 139a:1,קטנים הרי אנו נושאין כדרך שנשאתם אתם אין שומעין להם אלא מה שנתן להם אביהם נתן הניח בנות
Bava Batra 139b:5-7,איבעי להו למיזבן מאיתתא דיתבא תותי גברא: <br><br><big><strong>הדרן עלך יש נוחלין</strong></big><br><br> מתני׳ <big><strong>מי</strong></big> שמת והניח בנים ובנות בזמן שהנכסים מרובין הבנים יירשו והבנות יזונו נכסים מועטין הבנות יזונו והבנים ישאלו על הפתחים,Meiri on Bava Batra 139b:7,"מי שמת והניח בנים ובנות בזמן שהנכסים מרובים הבנים יירשו והבנות נזונות נכסים מועטים הבנות נזונות והבנים ישאלו על הפתחים אדמון אומר בשביל שאני זכר הפסדתי אמר רשב""ג רואה אני את"
Bava Batra 140b:4-6,בזמן שהנכסים מרובין הזכרים דוחין אותו אצל נקבות נכסים מועטין הנקבות דוחות אותו אצל זכרים האומר אם תלד אשתי זכר יטול מנה ילדה זכר יטול מנה נקבה מאתים ילדה נקבה נוטלת מאתים אם זכר מנה אם נקבה מאתים וילדה זכר ונקבה זכר נוטל מנה נקבה נוטלת מאתים ילדה טומטום אינו נוטל אם,Meiri on Bava Batra 140b:4,האומר אם ילדה אשתי זכר יטול מנה ילדה זכר נוטל מנה ואם נקבה מאתים ילדה נקבה נוטלת מאתים אם זכר מנה ואם נקבה מאתים ילדה זכר ונקבה זכר נוטל מנה ונקבה נוטלת מאתים ילדה טומטום אינו נוטל ואם אמר כל מה שתלד אשתי יטול מנה הרי זה יטול ואם אין שם יורש אלא הוא יורש
Bava Batra 143b:7-8,ברא או לא רב חביבא אמר קרו אינשי לבר ברא ברא מר בר רב אשי אמר לא קרו אינשי לבר ברא ברא תניא כוותיה דמר בר רב אשי המודר הנאה מבנים מותר בבני בנים: <big><strong>מתני׳</strong></big> הניח בנים גדולים וקטנים השביחו גדולים,Meiri on Bava Batra 143b:7,עד שישא וכבר ביארנו הענין במסכת יום טוב: <b>המשנה</b> השלישית והכונה להתחיל בה בביאור החלק השלישי והוא שאמר הניח בנים גדולים וקטנים והשביחו הגדולים את הנכסים השביחו לאמצע ואם אמרו גדולים ראו מה שהניח לנו אבינו הרי אנו עושין ואוכלים השביחו לעצמם
Bava Batra 143b:7-8,ברא או לא רב חביבא אמר קרו אינשי לבר ברא ברא מר בר רב אשי אמר לא קרו אינשי לבר ברא ברא תניא כוותיה דמר בר רב אשי המודר הנאה מבנים מותר בבני בנים: <big><strong>מתני׳</strong></big> הניח בנים גדולים וקטנים השביחו גדולים,Meiri on Bava Batra 143b:8,עד שישא וכבר ביארנו הענין במסכת יום טוב: <b>המשנה</b> השלישית והכונה להתחיל בה בביאור החלק השלישי והוא שאמר הניח בנים גדולים וקטנים והשביחו הגדולים את הנכסים השביחו לאמצע ואם אמרו גדולים ראו מה שהניח לנו אבינו הרי אנו עושין ואוכלים השביחו לעצמם
Bava Batra 144b:6-7,"מצנים פחים שנאמר (משלי כב, ה) צנים פחים בדרך עקש שומר נפשו ירחק מהם: <big><strong>מתני׳</strong></big> האחין שעשו מקצתן שושבינות",Meiri on Bava Batra 144b:7,החמישית והכונה בה ככונת המשניות שלפניה והוא שאמר האחים שעשו מקצתם שושבינות בחיי האב חזרה שושבינות חזרה לאמצע מפני שהשושבינות
Bava Batra 146a:2-3,הרים כרמו מעפר כרמו לכרמים: <big><strong>מתני׳</strong></big> השולח סבלונות לבית חמיו שלח שם מאה מנה ואכל שם סעודת חתן אפילו בדינר אינן נגבין לא אכל שם סעודת חתן הרי אלו נגבין שלח סבלונות מרובין שיחזרו עמה לבית בעלה הרי אלו נגבין סבלונות,Meiri on Bava Batra 146a:1,השולח סבלונות לבית חמיו ושלח שם מאה מנה ואכל שם סעודת חתן אפילו בדינר אין אלו נגבין לא אכל שם סעודת חתן הרי אלו נגבין שלח סבלונות מרובין שיחזירו עמה לבית בעלה הרי אלו נגבין סבלונות מועטין שתשמש בהן בבית אביה אין
Bava Batra 150b:11-12,בר אחא אגב אסיפא דביתיה כי אתא נפק לאפיה עד תווך שטרא איקרי נכסי דאמר רבה בר יצחק שני שטרות הן,Meiri on Bava Batra 150b:4,של קדושין: <b>האומר</b> זכו בשדה זו לפלני וכתבו לו את השטר חוזר בשטר ואינו חוזר בשדה על מנת שתכתבו לו את
Bava Batra 150b:11-12,בר אחא אגב אסיפא דביתיה כי אתא נפק לאפיה עד תווך שטרא איקרי נכסי דאמר רבה בר יצחק שני שטרות הן,Meiri on Bava Batra 150b:5,של קדושין: <b>האומר</b> זכו בשדה זו לפלני וכתבו לו את השטר חוזר בשטר ואינו חוזר בשדה על מנת שתכתבו לו את
Bava Batra 156a:8-10,כלפני זמן והלכתא כגידל בר מנשה והלכתא כמר זוטרא והלכתא כאמימר והלכתא כרב נחמן אמר שמואל בכולהו: <big><strong>מתני׳</strong></big> המחלק נכסיו על פיו ר' אלעזר,Meiri on Bava Batra 156a:2,ואמר על זה המחלק נכסיו על פיו ר' אליעזר אומר אחד בריא ואחד מסוכן נכסים שיש להם אחריות נקנין בכסף בשטר ובחזקה ושאין להם
Bava Batra 156b:2-3,רבי אליעזר לחכמים מעשה במרוני אחד שהיה בירושלים והיו לו מטלטלין הרבה וביקש ליתנם במתנה אמרו לו אין להם תקנה עד שיקנה על גב קרקע הלך ולקח בית סלע אחד סמוך לירושלים ואמר צפונו לפלוני ועמו מאה צאן ומאה חביות ודרומו לפלוני ועמו מאה צאן ומאה חביות,Meiri on Bava Batra 156b:1,מעשה במריני אחד שהיה בירושלם והיו לו מטלטלין הרבה ובקש ליתנם במתנת בריא אמרו לו אין להם תקנה עד שיקנם על גבי קרקע הלך ולקח בית סלע אחד סמוך לירושלם ואמר צפונה לפלני ועמו מאה צאן ומאה חביות דרומה לפלני ועמו מאה צאן ומאה חביות וקיימו חכמים
Bava Batra 160a:1-3,<big><strong>גט</strong></big> פשוט עדיו מתוכו מקושר עדיו מאחוריו פשוט שכתבו עדיו מאחוריו מקושר שכתבו עדיו מתוכו שניהם פסולין רבי חנינא בן גמליאל אומר מקושר שכתבו עדיו מתוכו כשר מפני שיכול לעשותו פשוט רבן שמעון בן גמליאל אומר הכל כמנהג המדינה גט פשוט עדיו בשנים ומקושר בשלשה פשוט שכתב בו עד אחד ומקושר שכתב בו,Meiri on Bava Batra 160a:3,"גט פשוט עדיו מתוכו מקושר עדיו מאחוריו פשוט שכתבו עדיו מאחוריו מקושר שכתבו עדיו מתוכו שניהם פסולין ר' חנינא בן גמליאל אומר מקושר שכתבו עדיו מתוכו כשר שיכול לעשותו פשוט רשב""ג אומר הכל כמנהג המדינה גט פשוט עדיו שנים מקושר עדיו שלשה פשוט שכתוב בו עד אחד ומקושר שכתוב בו שני"
Bava Batra 165b:14-16,לי אלא כך דעת תלמידכם נוטה שצריכין למכתב במותב תלתא הוינא וחד ליתוהי ועל דא עיילוהו לרבי ירמיה בבי מדרשא: <big><strong>מתני׳</strong></big> כתוב בו זוזין מאה דאינון סלעין עשרין אין לו אלא עשרין זוזין מאה דאינון תלתין סלעין אין לו,Meiri on Bava Batra 165b:4,זה כתוב בו זוזין מאה דאינון סלעין עשרים אין לו אלא עשרים זוזין מאה דאינון סלעין תלתין אין לו אלא מנה כסף זוזי דאינון ונמחקו אין פחות משנים כסף סלעין דאינון ונמחקו אין פחות משנים דרכונות דאינון ונמחקו אין
Bava Batra 167a:7,"לי מעולם כפתיה ואודי א""ל בשלמא דידי זייפת אלא דרב אחא בר אדא דרתית ידיה היכי עבדת אמר",Meiri on Bava Batra 167a:3,"השלישי והוא שאמר כותבין גט לאיש אע""פ שאין אשתו עמו ושובר לאשה אע""פ שאין בעלה עמה ובלבד שיהא"
Bava Batra 168a:12-13,"כופין והכא היינו טעמא דר""ש בן גמליאל דאמר ליה לא ניחא לי דתהוי זכותך גבי זכותי דדמית עלאי כי אריא ארבא: <big><strong>מתני׳</strong></big> מי שפרע מקצת חובו והשליש את שטרו ואמר לו אם לא (נתתי) לך",Meiri on Bava Batra 168a:1,מי שפרע מקצת חובו והשליש את שטרו ואמר לו אם לא נתתי לך מכאן ועד יום פלני תן לו שטרו והגיע הזמן ולא נתן ר' יוסי אומר יתן ר' יהודה אומר לא יתן אמר
Bava Batra 168a:14-15,קניא אמר רב נחמן אמר רבה בר אבוה אמר רב הלכה כרבי יוסי כי אתו לקמיה דרבי אמי אמר להו,Meiri on Bava Batra 168a:3,ביארנוהו:</b> <b>המשנה</b> הששית והכונה לבאר בה ענין החלק החמישי והוא שאמר מי שנמחק שטר חובו מעמיד עליו עדים ובא לפני בית
Bava Batra 168a:14-15,קניא אמר רב נחמן אמר רבה בר אבוה אמר רב הלכה כרבי יוסי כי אתו לקמיה דרבי אמי אמר להו,Meiri on Bava Batra 168a:4,ביארנוהו:</b> <b>המשנה</b> הששית והכונה לבאר בה ענין החלק החמישי והוא שאמר מי שנמחק שטר חובו מעמיד עליו עדים ובא לפני בית
Bava Batra 172a:8-9,"מאה זוזי ואמר שוונהי ניהלי חד בר חמשין לא משוינא ליה מ""ט אמרינן האי מיפרע פרעיה ואמר ליה הב לי שטראי ואמר ליה אירכס לי וכתיב ליה תברא ומפיק ליה האי ואמר ליה האי",Meiri on Bava Batra 172a:6,וחדי ואמר על זה שני אחים אחד עני ואחד עשיר והניח להם אביהם מרחץ ובית הבד עשאן לשכר השכר לאמצע עשאן לעצמו הרי העשיר אומר לעני קח לך עבדים וירחצו במרחץ קח לך
Bava Batra 172a:9-11,אחרינא הוא: <big><strong>מתני׳</strong></big> שני אחין אחד עני ואחד עשיר והניח להן אביהן מרחץ ובית הבד עשאן לשכר השכר לאמצע עשאן לעצמו הרי העשיר אומר לעני קח לך עבדים וירחצו במרחץ קח לך זיתים ובא ועשה בבית הבד שנים שהיו בעיר אחת שם אחד יוסף בן שמעון ושם אחר יוסף בן שמעון,Meiri on Bava Batra 172a:8,ענין החלק הששי והוא שאמר שנים שהיו בעיר שם אחד יוסף בן שמעון ושם שני יוסף בן שמעון אינן יכולים להוציא שטר חוב זה על זה ולא אחר יכול להוציא עליהם שטר חוב נמצא לאחד בין שטרותיו שטרו של יוסף בן שמעון פרוע שטרות שניהם פרועים כיצד יעשו ישלשו ואם
Bava Batra 173a:17-18,ללוה בין שטרותיו שטרו של יוסף בן שמעון עלי פרוע שטרות שניהם פרועין: כיצד יעשו ישלשו כו': תנא אם היו שניהם,Meiri on Bava Batra 173a:3,והכונה בה ככונת משנה שלפניה והוא שאמר האומר לבנו שטר בין שטרותי פרוע ואיני יודע איזהו שטרות כלם פרועין נמצא
