Beitzah 10b:2-3,<big><strong>מתני׳</strong></big> זמן שחורים ומצא לבנים לבנים ומצא שחורים שנים ומצא שלשה אסורים שלשה ומצא שנים מותרים בתוך הקן ומצא לפני הקן אסורין ואם אין שם אלא,Meiri on Beitzah 10b:1,זימן שחורים ומצא לבנים לבנים ומצא שחורים שנים ומצא שלשה אסורין שלשה ומצא שנים מותרין בתוך הקן ומצא לפני הקן אסורין ואם אין שם אלא הן
Beitzah 12b:3-6,"נמי שלא לצורך: <big><strong>מתני׳</strong></big> בש""א אין מוליכין חלה ומתנות לכהן ביום טוב בין שהורמו מאמש בין שהורמו מהיום ובית הלל מתירין אמרו להם בית שמאי גזרה שוה חלה ומתנות מתנה לכהן ותרומה מתנה לכהן כשם שאין מוליכין את התרומה כך אין מוליכין את המתנות אמרו להם בית הלל לא אם אמרתם",Meiri on Beitzah 12b:1,"בש""א אין מוליכי' חלה ומתנות לכהן ביום טוב בין שהורמו מאמש בין שהורמו מהיום ובית הלל מתירים ואמרו בית שמאי גזירה שוה חלה ומתנות מתנה לכהן ותרומה מתנה לכהן כשם שאין מוליכין את התרומה כך לא יוליכו את המתנות אמרו להם בית הלל לא אמרתם בתרומה שאינו זכאי בהרמתה"
Beitzah 12b:9,בית שמאי ובית הלל על המתנות שמוליכין לא נחלקו אלא על התרומה שבית שמאי אומרים אין מוליכין ובית הלל אומרים מוליכין וכך היו בית הלל דנין חלה ומתנות מתנה לכהן,Meiri on Beitzah 12b:1,"מודים שמוליכין חלה ומתנות וחולקים בתרומה ובית הלל אומרי' חלה ומתנות מתנה לכהן ותרומה מתנה לכהן כשם שמוליכין את המתנות כך מוליכין התרומה וב""ש אומ' להם לא אם אמרתם"
Beitzah 14b:11-12,ליתן לפני בהמתו עדשים לעשות מהן רסיסין: <big><strong>מתני׳</strong></big> משלחין כלים בין תפורין בין שאינן תפורין ואף על פי שיש בהן כלאים והן לצורך המועד אבל לא סנדל המסומר,Meiri on Beitzah 14b:10,"המחברים מותר ומשום דתיקו דרבנן לקולא ויש חולקין בדבר ואף גדולי הפוסקים לא הביאוה: <b>המשנה</b> החמש עשרה משלחין כלים בין תפורין בין שאינן תפורין אע""פ שיש בהם כלאים והם"
Beitzah 14b:11-12,ליתן לפני בהמתו עדשים לעשות מהן רסיסין: <big><strong>מתני׳</strong></big> משלחין כלים בין תפורין בין שאינן תפורין ואף על פי שיש בהן כלאים והן לצורך המועד אבל לא סנדל המסומר,Meiri on Beitzah 14b:11,"המחברים מותר ומשום דתיקו דרבנן לקולא ויש חולקין בדבר ואף גדולי הפוסקים לא הביאוה: <b>המשנה</b> החמש עשרה משלחין כלים בין תפורין בין שאינן תפורין אע""פ שיש בהם כלאים והם"
Beitzah 15b:1,<big><strong>יום</strong></big> טוב שחל להיות ערב שבת לא יבשל בתחלה מיום טוב לשבת אבל מבשל הוא ליום טוב ואם הותיר הותיר לשבת ועושה תבשיל מערב יום טוב וסומך עליו,Meiri on Beitzah 15b:2,זה יום טוב שחל להיות ערב שבת לא יבשל כתחלה מיום טוב לשבת אבל מבשל הוא ביום טוב ואם הותיר הותיר לשבת ועושה תבשיל מערב יום טוב וסומך
Beitzah 15b:2-3,הלל אומרים תבשיל אחד ושוין בדג וביצה שעליו שהן שני תבשילין אכלו או שאבד לא יבשל עליו בתחלה ואם שייר ממנו כל שהוא,Meiri on Beitzah 15b:2,"תבשילין בה""א תבשיל אחד ומודים בדג ובביצה שעליו שהן שני תבשילין אכלו או שאבד לא יבשל עליו כתחלה שייר ממנו כל שהוא"
Beitzah 21b:13-15,"גופו להנאת אבר אחד או דלמא ב""ה קתני לה אבל ב""ש לא שני להו ת""ש ב""ש אומרים לא יעשה אדם מדורה ויתחמם כנגדה וב""ה מתירין: <big><strong>מתני׳</strong></big> שלשה דברים רבן גמליאל מחמיר כדברי ב""ש אין טומנין את החמין לכתחלה ביום טוב ואין זוקפין את המנורה ביום טוב ואין אופין פתין גריצין אלא רקיקין אמר רבן גמליאל מימיהן",Meiri on Beitzah 21b:16,מדורה פי' היסק גדול ביום טוב ומתחמם כנגדה שהרי צורך כל נפש הוא ודבר זה לבית הלל נאמר והלכה כדבריהם בשתיהן: <b>זהו ביאור המשנה ולא נתחדש עליה בגמרא דבר:</b> <b>המשנה</b> החמישית שלשה דברים רבן גמליאל מחמיר כדברי בית שמאי אין טומנין את החמין מיום טוב לשבת אין זוקפין את המנורה ביום טוב ואין אופין פתין גריצין אלא רקיקין אמר רבן
Beitzah 21b:13-15,"גופו להנאת אבר אחד או דלמא ב""ה קתני לה אבל ב""ש לא שני להו ת""ש ב""ש אומרים לא יעשה אדם מדורה ויתחמם כנגדה וב""ה מתירין: <big><strong>מתני׳</strong></big> שלשה דברים רבן גמליאל מחמיר כדברי ב""ש אין טומנין את החמין לכתחלה ביום טוב ואין זוקפין את המנורה ביום טוב ואין אופין פתין גריצין אלא רקיקין אמר רבן גמליאל מימיהן",Meiri on Beitzah 21b:17,מדורה פי' היסק גדול ביום טוב ומתחמם כנגדה שהרי צורך כל נפש הוא ודבר זה לבית הלל נאמר והלכה כדבריהם בשתיהן: <b>זהו ביאור המשנה ולא נתחדש עליה בגמרא דבר:</b> <b>המשנה</b> החמישית שלשה דברים רבן גמליאל מחמיר כדברי בית שמאי אין טומנין את החמין מיום טוב לשבת אין זוקפין את המנורה ביום טוב ואין אופין פתין גריצין אלא רקיקין אמר רבן
Beitzah 21b:13-15,"גופו להנאת אבר אחד או דלמא ב""ה קתני לה אבל ב""ש לא שני להו ת""ש ב""ש אומרים לא יעשה אדם מדורה ויתחמם כנגדה וב""ה מתירין: <big><strong>מתני׳</strong></big> שלשה דברים רבן גמליאל מחמיר כדברי ב""ש אין טומנין את החמין לכתחלה ביום טוב ואין זוקפין את המנורה ביום טוב ואין אופין פתין גריצין אלא רקיקין אמר רבן גמליאל מימיהן",Meiri on Beitzah 21b:18,מדורה פי' היסק גדול ביום טוב ומתחמם כנגדה שהרי צורך כל נפש הוא ודבר זה לבית הלל נאמר והלכה כדבריהם בשתיהן: <b>זהו ביאור המשנה ולא נתחדש עליה בגמרא דבר:</b> <b>המשנה</b> החמישית שלשה דברים רבן גמליאל מחמיר כדברי בית שמאי אין טומנין את החמין מיום טוב לשבת אין זוקפין את המנורה ביום טוב ואין אופין פתין גריצין אלא רקיקין אמר רבן
Beitzah 23a:6-8,את בני ישראל קדשים בחוץ קדשים סלקא דעתך אלא אימא כעין קדשים: <big><strong>מתני׳</strong></big> שלשה דברים רבי אלעזר בן עזריה מתיר וחכמים אוסרים פרתו יוצאה ברצועה,Meiri on Beitzah 23a:6,השביעית שלשה דברים ר' אלעזר בן עזריה מתיר וחכמים אוסרין פרתו יוצאת ברצועה שבין קרניה ומקדרין את הבהמה ביום טוב ושוחקין את הפלפלין בריחים שלהם ר'
Beitzah 23b:3-4,עגלה של קטן טמאה מדרס ונטלת בשבת ואינה נגררת אלא על גבי כלים ר' יהודה אומר כל הכלים אין נגררין חוץ מן העגלה מפני,Meiri on Beitzah 23b:3,דבר:</b> <b>המשנה</b> התשיעית עגלה של קטן טמאה מדרס ונטלת בשבת ואינה נגררת אלא על גבי הכלים ר' יהודה אומר כל הכלים אינן נגררין חוץ
Beitzah 23b:3-4,עגלה של קטן טמאה מדרס ונטלת בשבת ואינה נגררת אלא על גבי כלים ר' יהודה אומר כל הכלים אין נגררין חוץ מן העגלה מפני,Meiri on Beitzah 23b:4,דבר:</b> <b>המשנה</b> התשיעית עגלה של קטן טמאה מדרס ונטלת בשבת ואינה נגררת אלא על גבי הכלים ר' יהודה אומר כל הכלים אינן נגררין חוץ
Beitzah 23b:9-12,"ואליבא דרבי יהודה: <br><br><big><strong>הדרן עלך יום טוב:</strong></big><br><br> מתני׳ <big><strong>אין</strong></big> צדין דגים מן הביברים ביו""ט ואין נותנין לפניהם מזונות אבל צדין חיה ועוף מן הביברין ונותנין לפניהם",Meiri on Beitzah 23b:8,"לה ביומו: <b>והמשנה</b> הראשונה ממנו תכוין לבאר על דגים שבביברין שאסור לצודן ולזמנן ביו""ט ואמר על זה אין צדין דגים מן הביברים ביום טוב ואין נותנין לפניהם"
Beitzah 23b:9-12,"ואליבא דרבי יהודה: <br><br><big><strong>הדרן עלך יום טוב:</strong></big><br><br> מתני׳ <big><strong>אין</strong></big> צדין דגים מן הביברים ביו""ט ואין נותנין לפניהם מזונות אבל צדין חיה ועוף מן הביברין ונותנין לפניהם",Meiri on Beitzah 23b:9,"לה ביומו: <b>והמשנה</b> הראשונה ממנו תכוין לבאר על דגים שבביברין שאסור לצודן ולזמנן ביו""ט ואמר על זה אין צדין דגים מן הביברים ביום טוב ואין נותנין לפניהם"
Beitzah 26b:13,ושוין שאם נולד ומומו עמו שזה מן המוכן והא בכור מעיקרא הוה חזי אגב אמיה אתיליד ליה אדחי ליה אחזייה,Meiri on Beitzah 26b:8,"הזמינם מבערב מותרות ואם לאו אסורות אע""פ שכבר גלה דעתו ואכל מהם מבערב והוא שאמרו היה אוכל בענבים והותיר והעלן"
Beitzah 27b:3-4,"ת""ל (ויקרא כב, כא) כל מום אמר מום ואמר כל מום: <big><strong>מתני׳</strong></big> בהמה שמתה לא יזיזנה ממקומה ומעשה ושאלו את",Meiri on Beitzah 27b:1,בהמה שמתה לא יזיזנה ממקומה מעשה ששאלו את ר' טרפון עליה ועל החלה שנטמאת ונכנס לבית המדרש ושאל ואמרו לו
Beitzah 29b:6-7,"אצלו ואומר לו תן לי ביצים ואגוזים במנין שכן דרך בעל הבית להיות מונה בתוך ביתו: <big><strong>גמ׳</strong></big> ת""ר הולך אדם אצל רועה הרגיל אצלו ואומר לו תן לי גדי אחד או טלה אחד אצל טבח הרגיל אצלו ואומר לו תן לי כף אחת או ירך אחת אצל פטם הרגיל אצלו ואומר לו",Meiri on Beitzah 29b:4,אף בביתו אדם מוציאן לבני ביתו במנין וכן פי' בגמ' שהולך אדם אצל חנוני הרגיל אצלו ואומר לו תן לי גדי או טלה וכן אצל טבח ואומר לו תן לי כף אחת ירך אחת וכן אצל פטם הרגיל אצלו ואומר לו תן לי תור אחד או גוזל אחד
Beitzah 32b:3-4,"לבבל בעא מנייהו עסקא ולא יהבו ליה מזוני מיזן נמי לא זינוהו אמר הני מערב רב קא אתו דכתיב (דברים יג, יח)",Meiri on Beitzah 32b:2,חכמים כל המרחם על הבריות בידוע שהוא מזרעו של אברהם אבינו וכל שאינו מרחם על הבריות בידוע שאינו מזרעו של אברהם
Beitzah 32b:5-6,"חייו אינן חיים ת""ר ג' חייהן אינם חיים ואלו הן המצפה לשלחן חבירו ומי שאשתו מושלת עליו ומי שיסורין מושלין בגופו ויש אומרים אף מי שאין לו אלא חלוק אחד ות""ק אפשר דמעיין",Meiri on Beitzah 32b:3,אין שוברין את החרס אין חותכין את הנייר לצלות בו מליח אין גורפין תנור וכירים אבל מכבשין אין מקלפין שתי חביות לשפות עליהם את הקדרה ואין סומכין את הקדרה בבקעת וכן בדלת ואין מנהיגין
Beitzah 35b:5-7,"פטור: <br><br><big><strong>הדרן עלך המביא</strong></big><br><br> מתני׳ <big><strong>משילין</strong></big> פירות דרך ארובה ביו""ט אבל לא בשבת ומכסים פירות בכלים מפני הדלף וכן כדי יין וכדי שמן",Meiri on Beitzah 35b:2,זה משילין פירות דרך ארובה ביום טוב אבל לא בשבת ומכסין את הפירות בכלים מפני הדלף וכן כדי יין וכדי שמן נותני' כלי תחת הדלף
Beitzah 36b:7-11,"דרב אשי אמר להו רב אשי נקטה בצוציתה ואפקוה: <big><strong>מתני׳</strong></big> כל שחייבין עליו משום שבות משום רשות משום מצוה בשבת חייבין עליו ביו""ט ואלו הן משום שבות לא עולין באילן ולא רוכבין על גבי בהמה ולא שטין על פני המים ולא מטפחין ולא מספקין ולא מרקדין ואלו הן משום רשות לא דנין ולא מקדשין ולא חולצין ולא מיבמין ואלו",Meiri on Beitzah 36b:7,כתבוה בתוספות: <b>המשנה</b> השניה כל שחייבין עליו משום שבות משום רשות משום מצוה בשבת חייבין עליו ביום טוב אלו הן משום שבות לא עולין באילן ולא רוכבין על גבי בהמה ולא שטין על פני המים ולא מטפחין ולא מספקין ולא מרקדין אלו הם משום רשות לא דנין ולא מקדשין ולא מיבמין אלו הן משום מצוה לא מקדישין ולא
Beitzah 36b:7-11,"דרב אשי אמר להו רב אשי נקטה בצוציתה ואפקוה: <big><strong>מתני׳</strong></big> כל שחייבין עליו משום שבות משום רשות משום מצוה בשבת חייבין עליו ביו""ט ואלו הן משום שבות לא עולין באילן ולא רוכבין על גבי בהמה ולא שטין על פני המים ולא מטפחין ולא מספקין ולא מרקדין ואלו הן משום רשות לא דנין ולא מקדשין ולא חולצין ולא מיבמין ואלו",Meiri on Beitzah 36b:8,כתבוה בתוספות: <b>המשנה</b> השניה כל שחייבין עליו משום שבות משום רשות משום מצוה בשבת חייבין עליו ביום טוב אלו הן משום שבות לא עולין באילן ולא רוכבין על גבי בהמה ולא שטין על פני המים ולא מטפחין ולא מספקין ולא מרקדין אלו הם משום רשות לא דנין ולא מקדשין ולא מיבמין אלו הן משום מצוה לא מקדישין ולא
Beitzah 37b:3-5,"הבעלים ולאו אוקימנא כאן ברועה אחד כאן בשני רועים ת""ר שנים ששאלו חלוק אחד בשותפות זה לילך בו שחרית לבית המדרש וזה ליכנס בו",Meiri on Beitzah 37b:2,"שנים ששאלו חלוק אחד מערב יו""ט זה לילך בו שחרית לבית המדרש וזה לילך בו ערבית לבית המשתה זה עירב עליו לצד צפון וזה עירב עליו"
Beitzah 39a:10-11,בין פצים לחבירו דברי ר' יהודה אלא הא דתנן המוציא שלהבת פטור היכי משכחת לה כגון דאדייה,Meiri on Beitzah 39a:10,חולקים בקצת דברים אלו שבגחלת ובמקומם יתבאר: <b>המשנה</b> התשיעית בור של יחיד כרגלי היחיד ושל אנשי
Beitzah 39a:10-11,בין פצים לחבירו דברי ר' יהודה אלא הא דתנן המוציא שלהבת פטור היכי משכחת לה כגון דאדייה,Meiri on Beitzah 39a:11,חולקים בקצת דברים אלו שבגחלת ובמקומם יתבאר: <b>המשנה</b> התשיעית בור של יחיד כרגלי היחיד ושל אנשי
