Sotah 40a:7,וזקיף עליה יקרא בעלמא הוא דעביד ליה אזלא דביתהו ואמרה ליה לרבי אבהו אמר לה ומאי נפקא ליך מינה מיני ומיניה יתקלס עילאה ותו רבי אבהו אימנו רבנן עליה לממנייה ברישא כיון דחזיה לר' אבא דמן עכו דנפישי ליה,Meiri on Sotah 40a:12,ליתן לראש ישיבה מנות ולהעשירו להיות דבריו נשמעים וכמו שאמרו והכהן הגדול מאחיו גדלהו משל אחיו: <b>וכן</b> סופר עוד עליו דבר זה נסחו ר' אבהו ור' חייא בר אבא איקלעו לההוא אתרא ר' אבהו דרש באגדתא ר' חייא דרש בשמעתא שבקוה כולי עלמא לר' חייא
Sotah 40a:8-9,אתרא רבי אבהו דרש באגדתא רבי חייא בר אבא דרש בשמעתא שבקוה כולי עלמא לרבי חייא בר אבא ואזול לגביה דר' אבהו חלש דעתיה,Meiri on Sotah 40a:12,טובות ומרגליות ואחד מוכר מיני סדקית כלומר דברים דקים כגון פלכים ומחטים וצנורות על מי קופצין על זה שמוכר מיני סדקית כלומר שמניחין הדברים
Sotah 42a:5-6,"לשון הרע דכתיב (תהלים ה, ה) כי לא אל חפץ רשע אתה לא יגורך רע צדיק אתה ה' לא יגור במגורך רע <br><br><big><strong>הדרן עלך אלו",Meiri on Sotah 42a:2,אל העם בלשון הקדש היה מדבר שנאמ' והיה כקרבכם אל המלחמה ונגש הכהן וגו' זה כהן משוח מלחמה ודבר אל העם בלשון הקדש ואמר
Sotah 42a:6-8,"מתני׳ <big><strong>משוח</strong></big> מלחמה בשעה שמדבר אל העם בלשון הקודש היה מדבר שנאמר ' (דברים כ, ב) והיה כקרבכם אל המלחמה ונגש הכהן זה כהן משוח מלחמה",Meiri on Sotah 42a:2,על אויביכם על אויביכם לא על אחיכם לא יהודה על שמעון ולא שמעון על בנימין שאם תפלו בידן וירחמו עליכם כמה שנאמר להלן ויקומו האנשים אשר נקבו
Sotah 42a:9,"על שמעון ולא שמעון על בנימין שאם תפלו בידם ירחמו עליכם כמה שנאמר (דברי הימים ב כח, טו) ויקומו האנשים אשר נקבו בשמות ויחזיקו בשביה וכל מערומיהם הלבישו מן השלל וילבישום וינעילום ויאכילום וישקום ויסכום וינהלום בחמורים לכל כושל ויביאום יריחו עיר התמרים אצל אחיהם וישובו שומרון וגו' על אויביכם אתם הולכים שאם תפלו בידם אין מרחמין עליכם (דברים כ, ג) אל ירך ' לבבכם",Meiri on Sotah 42a:2,ויחזיקו בשביה על אויביכם אתם הולכים שאם תפלו בידם אין מרחמים עליכם אל ירך לבבכם אל תיראו וגו' אל ירך לבבכם מפני צהלת סוסים וצחצוח חרבות אל תראו מפני הגפת התריסין ושיפת הקולגסים ואל תחפזו מפני קול הקרנות ואל תערצו מפני קול הצוחה כי ה' אלהיכם ההולך עמכם הן באים בנצחונו של בשר ודם ואתם באים בנצחונו של מקום פלשתים באו בנצחנו של
Sotah 44b:8-11,"למעוטי עובדי כוכבים דלא ליתי עלייהו מר קרי לה מצוה ומר קרי רשות נפקא מינה לעוסק במצוה שפטור מן המצוה <br><br><big><strong>הדרן עלך משוח מלחמה</strong></big><br><br> מתני׳ <big><strong>עגלה</strong></big> ערופה בלשון הקודש שנאמר (דברים כא, א) כי ימצא חלל באדמה ויצאו זקניך ושופטיך שלשה מבית דין הגדול שבירושלים היו יוצאין רבי יהודה אומר חמשה שנאמר זקניך שנים ושופטיך שנים ואין בית דין שקול מוסיפין עליהן עוד אחד נמצא טמון בגל או תלוי באילן או צף על פני המים לא היו עורפין שנאמר באדמה ולא טמון בגל נופל ולא",Meiri on Sotah 44b:1,"עגלה ערופה בלשון הקדש נאמר שנ' כי ימצא חלל באדמה אשר ה' וגו' ויצאו זקניך וגו' שלשה מב""ד הגדול שבירושלים היו יוצאין ר' יהודה אומר חמשה שנאמר זקניך שנים ושופטיך שנים אין בית דין שקול מוסיפין עליהן עוד אחד נמצא טמון בגל טמון באילן צף על פני המים לא היו עורפים שנ' באדמה לא טמון בגל נופל לא תלוי באילן בשדה לא צף על פני המים נמצא סמוך לספר או לעיר שיש בה גוים או לעיר שאין בה בית דין לא היו מודדין ואין"
Sotah 47a:12-13,"טרוטות א""ל רשע בכך אתה עוסק אפיק ארבע מאה שפורי ושמתיה כל יומא אתא לקמיה ולא קבליה יומא חד הוה קרי קרית שמע אתא לקמיה הוה בדעתיה לקבוליה אחוי ליה בידיה סבר מדחא דחי ליה אזל זקף לבינתא פלחא אמר ליה חזור בך א""ל כך מקובלני ממך כל החוטא",Meiri on Sotah 47a:2,השני והוא שאמר נמצא ההורג עד שלא תערף העגלה תצא ותרעה בעדר משנערפה תקבר במקומה שעל ספק באת מתחלתה כפרה ספיקה והלכה לה נערפה העגלה ואחר כך נמצא ההורג הרי זה יהרג עד אומר ראיתי ההורג ועד אומר לא ראיה אשה אומרת ראיתי ואשה אומרת
Sotah 47a:13-14,אומר יצר תינוק ואשה תהא שמאל דוחה וימין מקרבת <big><strong>מתני׳</strong></big> נמצא ההורג עד שלא נערפה העגלה תצא ותרעה בעדר משנערפה העגלה תקבר במקומה שעל ספק באתה מתחילתה כיפרה ספיקה והלכה לה נערפה העגלה ואחר כך נמצא ההורג הרי זה יהרג עד אחד אומר ראיתי את ההורג ועד אחד אומר לא ראית אשה אומרת,Meiri on Sotah 47a:8,<b>המשנה</b> השלישית והכונה לבאר בה ענין החלק השלישי והוא שאמר משרבו הרצחנים בטלה עגלה ערופה משבא אלעזר בן דינאי ותחינה בן פרישה חזרו לקרותו בן הרצחן משרבו הנואפים פסקו המים המאררים ורבן יוחנן בן זכאי הפסיקן שנאמר לא אפקוד על בנותיכם כי תזנינה ועל כלותיכם כי תנאפנה משמת יוסף בן
Sotah 47b:18,"אלא לפנים איני והאמר מר האי מאן דמיהר אפילו אאינשי ביתיה לא מיקבל שנאמר (חבקוק ב, ה) גבר יהיר",Meiri on Sotah 47b:8,איש הישר בעיניו יעשה שפלים הוגבהו וגבוהים הושפלו ושררה מתנונה והולכת: <b>משרבו</b> צרי עין וטורפי טרף רבו מאמצים את
Sotah 47b:18,"אלא לפנים איני והאמר מר האי מאן דמיהר אפילו אאינשי ביתיה לא מיקבל שנאמר (חבקוק ב, ה) גבר יהיר",Meiri on Sotah 47b:9,איש הישר בעיניו יעשה שפלים הוגבהו וגבוהים הושפלו ושררה מתנונה והולכת: <b>משרבו</b> צרי עין וטורפי טרף רבו מאמצים את
Sotah 49b:13-14,"חכמה יוונית מפני שקרובין למלכות בפולמוס האחרון גזרו שלא תצא כלה באפריון וכו' מ""ט משום צניעותא משמת רבן יוחנן בטלה החכמה ת""ר",Meiri on Sotah 49b:2,תורה משמת ר' יהושע בטלה עצה ומחשבה משמת ר' עקיבא בטלו זרועי תורה ונסתתמו מעיינות חכמה משמת ר' אלעזר בן עזריה בטלה
