Sotah 2a:1-3,"ומשקה ע""פ שנים כיצד מקנא לה אומר לה בפני שנים אל תדברי עם איש פלוני ודברה עמו עדיין היא מותרת לביתה ומותרת לאכול בתרומה נכנסה עמו לבית הסתר ושהתה עמו כדי טומאה אסורה לביתה ואסורה לאכול בתרומה ואם מת",Meiri on Sotah 2a:2,אלא שיש חולקין בזו כמו שנבאר בפרק ששי במשנה ראשונה שבו: <b>משנה</b> כיצד הוא מקנא לה אומר לה בפני שנים אל תדברי עם איש פלוני ודברה עמו עדין היא מותרת לביתה ומותרת לאכול בתרומה נכנסה עמו לבית הסתר ושהת עמו
Sotah 2a:1-3,"ומשקה ע""פ שנים כיצד מקנא לה אומר לה בפני שנים אל תדברי עם איש פלוני ודברה עמו עדיין היא מותרת לביתה ומותרת לאכול בתרומה נכנסה עמו לבית הסתר ושהתה עמו כדי טומאה אסורה לביתה ואסורה לאכול בתרומה ואם מת",Meiri on Sotah 2a:3,אלא שיש חולקין בזו כמו שנבאר בפרק ששי במשנה ראשונה שבו: <b>משנה</b> כיצד הוא מקנא לה אומר לה בפני שנים אל תדברי עם איש פלוני ודברה עמו עדין היא מותרת לביתה ומותרת לאכול בתרומה נכנסה עמו לבית הסתר ושהת עמו
Sotah 3b:12,"בר נחמני א""ר יונתן כל העושה מצוה אחת בעוה""ז ממקדמתו והולכת לפניו לעוה""ב שנאמר (ישעיהו",Meiri on Sotah 3b:4,קשורה בו אף לעולם הבא שנאמר ולא שמע אליה לשכב אצלה להיות עמה לשכב אצלה
Sotah 6a:7,שכן אונס בישראל מישרא שרי וגבי דהאי (מיהא) ליכא איסורא <big><strong>מתני׳</strong></big> ואלו אסורות מלאכול בתרומה האומרת טמאה אני לך,Meiri on Sotah 6a:1,אלו אסורות מלאכול בתרומה האומרת טמאה אני לך ושבאו עדים שהיא טמאה והאומרת איני שותה ושבעלה אינו רוצה להשקותה
Sotah 7a:12-18,האיש מביא את אשתו אל הכהן שנא' והביא האיש את אשתו אמר להו קל וחומר ברישא ופרכוה והדר אמר להו קרא רבי יהודה היינו תנא קמא איכא בינייהו אבל אמרו <big><strong>מתני׳</strong></big> היו מעלין אותה לבית דין הגדול שבירושלים ומאיימין עליה כדרך שמאיימין על עדי נפשות ואומר לה בתי הרבה יין עושה הרבה שחוק עושה הרבה ילדות עושה הרבה שכנים הרעים עושין עשי לשמו הגדול שנכתב בקדושה שלא ימחה על המים ואומר לפניה דברים שאינם כדי לשומען היא וכל משפחת בית אביה אם אמרה טמאה אני שוברת כתובתה ויוצאת ואם אמרה טהורה אני מעלין אותה לשער המזרח שעל פתח שער נקנור ששם משקין את הסוטות ומטהרין את היולדות ומטהרין את המצורעין וכהן,Meiri on Sotah 7a:2,והרביעי והוא שאמר היו מוליכים אותה לבית דין הגדול שבירושלים ומאיימין עליה כדרך שמאיימין על עידי נפשות ואומרים לה בתי הרבה היין עושה הרבה השחוק עושה הרבה הילדות עושה הרבה שכנים הרעים עושין אל תעשי לשמו הגדול שנכתב בקדושה שימחה על המים ואומרין לפניה דברים שאינה כדי לשמען היא וכל משפחת בית אביה אם אמרה טמאה אני שוברת את כתובתה ויוצאה אם אמרה טהורה אני מעלים אותה לשערי המזרח ולשערי ניקנור ששם משקים את הסוטות ומטהרים את היולדות ומטהרים את המצורעים וכהן אוחז בבגדיה אם נקרעו נקרעו ואם נפרמו נפרמו עד שהוא מגלה את לבה וסותר את שערה ר' יהודה אומר אם היה לבה נאה לא היה מגלהו אם היה
Sotah 8b:14-16,"וחצי תרקב קב וחצי קב רובע וחצי רובע תומן ועוכלא מנין תלמוד לומר (ישעיהו ט, ד) כי כל סאון סואן ברעש ומנין שכל פרוטה ופרוטה מצטרפת לחשבון גדול תלמוד לומר (קהלת ז, כז) אחת לאחת למצוא חשבון וכן מצינו בסוטה",Meiri on Sotah 8b:2,שמדדה בה מדדו לה היא עמדה על פתח ביתה לראותו וכהן מעמידה בשער ניקנור ומראה קלונה לכל היא פירסה סודרים נאים על ראשה וכהן נוטל צעיף שבראשה ומניחו תחת רגליה היא קישטה לו פניה
Sotah 9a:8,ואחת שעתידה לשתות עם חברותיה וכי תימא הנך אזדו והני אחריני נינהו והתניא אמר רבי יהודה מנימין,Meiri on Sotah 9a:2,והוא שאמר מנימן המצרי אני מצרי ראשון ונשאתי מצרית ראשונה אשיא לבני מצרית שניה כדי שיהא
Sotah 9b:5-6,"ולנפיל ירך ההוא דמודע לה כהן דבטן ברישא והדר ירך שלא להוציא לעז על מים המרים <big><strong>מתני׳</strong></big> שמשון הלך אחר עיניו לפיכך נקרו פלשתים את עיניו שנאמר (שופטים טז, כא) ויאחזוהו פלשתים וינקרו את עיניו אבשלום נתגאה בשערו לפיכך נתלה בשערו ולפי שבא על עשר",Meiri on Sotah 9b:1,שמשון הלך אחר עיניו לפיכך נקרו פלשתים את עיניו אבשלום נתגאה בשערו לפיכך נתלה בשערו לפי שבא על עשר פלגשי אביו לפיכך נתנו בו עשר לונביות שנאמר ויסובו עשרה נערים ולפי שגנב שלש גניבות לב אביו
Sotah 9b:7-9,"שנאמר (שמואל ב יח, טו) ויסבו עשרה אנשים נושאי כלי יואב ולפי שגנב ג' גנבות לב אביו ולב ב""ד ולב ישראל (שנאמר (שמואל ב טו, ו) ויגנב אבשלום את לב אנשי ישראל) לפיכך נתקעו בו ג' שבטים שנאמר (שמואל ב יח, יד) ויקח שלשה שבטים בכפו ויתקעם בלב אבשלום וכן לענין הטובה מרים המתינה למשה שעה אחת שנאמר (שמות ב, ד) ותתצב אחותו מרחוק לפיכך נתעכבו לה ישראל ז' ימים במדבר שנאמר (במדבר יב, טו) והעם לא נסע עד האסף מרים יוסף זכה לקבור את אביו ואין באחיו גדול ממנו שנאמר (בראשית נ, ז) ויעל יוסף לקבור את אביו ויעלו עמו גם רכב גם פרשים מי לנו גדול מיוסף שלא נתעסק בו",Meiri on Sotah 9b:1,"ולב אנשי ישראל לפיכך נתקעו בו שלשה שבטים שנאמר ויקח שלשה שבטים בכפו וכן לענין הטובה מרים המתינה למשה שעה אחת שנאמר ותתצב אחותו מרחוק לפיכך נתעכבו לה ישראל שבעת ימים במדבר שנאמר והעם לא נסע עד האסף מרים יוסף זכה לקבור את אביו ואין באחיו גדול ממנו שנאמר ויעל יוסף לקבור את אביו ויעל עמו גם רכב גם פרשים וגו' מי לנו גדול מיוסף שלא נתעסק בו אלא משה משה זכה בעצמות יוסף ואין בישראל גדול ממנו שנאמר ויקח משה את עצמות יוסף עמו וגו' מי לנו גדול ממנו שלא נתעסק בו אלא הקב""ה שנאמר ויקבור אותו בגיא ולא על משה בלבד אמרו אלא על כל הצדיקים שנאמר והלך"
Sotah 14a:9-10,"לב, לב) ואם אין מחני נא וגו' ואת פושעים נמנה שנמנה עם מתי מדבר והוא חטא רבים נשא שכיפר על מעשה העגל ולפושעים יפגיע שביקש רחמים על פושעי ישראל שיחזרו בתשובה ואין פגיעה אלא תפלה שנאמר (ירמיהו ז, טז) ואתה אל תתפלל בעד העם הזה ואל תשא בעדם רנה ותפלה ואל תפגע בי <br><br><big><strong>הדרן עלך המקנא לאשתו</strong></big><br><br> מתני׳ <big><strong>היה</strong></big> מביא את מנחתה בתוך כפיפה מצרית ונותנה על ידיה",Meiri on Sotah 14a:2,"<b>היה</b> מביא את מנחתה בקפיפה מצרית ונתנה על ידיה כדי ליגעה כל המנחות תחלתן וסופן בכלי שרת כל המנחות טעונות שמן ולבונה וזו אינה טעונה לא שמן ולא לבונה כל המנחות באות מן החטים וזו אינה באה אלא מן השעורים מנחת העומר אע""פ שהיא באה מן השעורים היא היתה באה גרש וזו היתה באה קמח רבן גמליאל אומר כשם שמעשיה מעשה בהמה כך קרבנה מאכל"
Sotah 14b:12-13,"המזבח ותניא לפני ה' יכול במערב ת""ל אל פני המזבח אי אל פני המזבח יכול בדרום ת""ל לפני ה' הא כיצד מגישה בקרן דרומית מערבית כנגד חודה של קרן ודיו רבי אלעזר אומר יכול יגישנה במערבה של קרן או לדרומה של קרן אמרת כל מקום שאתה מוצא שני",Meiri on Sotah 14b:3,ופני המזבח יכול יגישנה באיזה מהם שירצה או במערבה שהוא פני ה' או בדרומה שהוא פני המזבח אמרת כל מקום שאתה מוצא שני מקראות אחד מקיים את עצמו ואת חברו ואחד מקיים את עצמו ואינו מקיים את חברו מניחין את שמקיים עצמו ומבטל חברו ותופסין את שמקיים עצמו ואת
Sotah 19a:5-7,מתני׳ <big><strong>היה</strong></big> נוטל את מנחתה מתוך כפיפה מצרית ונותנה לתוך כלי שרת ונותנה על ידה וכהן מניח ידו מתחתיה ומניפה הניף והגיש קמץ והקטיר והשאר,Meiri on Sotah 19a:1,היה נוטל את מנחתה מתוך קפיפה מצרית ונותנה בתוך כלי שרת ונותנה על ידיה וכהן מניח את ידו תחתיה ומניפה הניף והגיש וקמץ והקטיר והשאר נאכל
Sotah 19a:7-8,"והגיש קמץ והקטיר והשאר נאכל לכהנים היה משקה ואחר כך מקריב את מנחתה רבי שמעון אומר מקריב את מנחתה ואח""כ היה משקה שנאמר (במדבר ה, כו) ואחר ישקה את האשה את המים אם השקה",Meiri on Sotah 19a:2,מזבח וקומץ ומקטיר את הקומץ והשאר נאכל לכהנים: <b>משנה</b> היה משקה ואחר כך מקריב את מנחתה ר' שמעון אומר מקריב את מנחתה ואחר כך משקה שנ' ואחר ישקה את האשה את המים ואם השקה
Sotah 19a:7-8,"והגיש קמץ והקטיר והשאר נאכל לכהנים היה משקה ואחר כך מקריב את מנחתה רבי שמעון אומר מקריב את מנחתה ואח""כ היה משקה שנאמר (במדבר ה, כו) ואחר ישקה את האשה את המים אם השקה",Meiri on Sotah 19a:3,מזבח וקומץ ומקטיר את הקומץ והשאר נאכל לכהנים: <b>משנה</b> היה משקה ואחר כך מקריב את מנחתה ר' שמעון אומר מקריב את מנחתה ואחר כך משקה שנ' ואחר ישקה את האשה את המים ואם השקה
Sotah 20a:5-7,"אותה ומשקין אותה בעל כרחה אינה מספקת לשתות עד שפניה מוריקות ועיניה בולטות והיא מתמלאת גידין והם אומרים הוציאוה שלא תטמא העזרה אם יש לה זכות היתה תולה לה יש זכות תולה שנה אחת יש זכות תולה ב' שנים יש זכות תולה ג' שנים מכאן אומר בן עזאי חייב אדם ללמד את בתו תורה שאם תשתה תדע שהזכות תולה לה ר""א אומר כל המלמד בתו תורה (כאילו) לומדה תפלות ר' יהושע אומר רוצה אשה בקב ותפלות מט' קבין ופרישות הוא היה אומר חסיד שוטה ורשע",Meiri on Sotah 20a:5,בביאור החלק השלישי והוא שאמר אינה מספקת לשתות עד שפניה מוריקות ועיניה בולטות והיא מתמלאה גידים גידים והן אומרין הוציאוה הוציאוה שמא תטמא העזרה אם יש לה זכות היתה תולה לה יש לה זכות תולה לשנה אחת לשתי שנים יש זכות תולה לשלש שנים מכאן אמר בן עזאי חייב אדם ללמד את בתו תורה שאם תשתה תדע שהזכות תולה לה ר' אליעזר אומר המלמד את בתו תורה מלמדה תפלות ר' יהושע אומר רוצה היא אישה בקב תפלות מתשעה קבין פרישות הוא היה אומר חסיד שוטה
Sotah 22b:7,תולה במים המאררים ואינה יולדת ואינה משבחת אלא מתנוונה והולכת לסוף היא מתה באותה מיתה נטמאת מנחתה עד שלא קדשה בכלי,Meiri on Sotah 22b:1,נטמאת מנחתה עד שלא קדשה בכלי הרי היא ככל המנחות תפדה משנקדשה בכלי הרי היא ככל המנחות תשרף אלו שמנחותיהן
Sotah 23b:10-11,"כסותו ולא אותה בלא כסותה האיש נתלה ואין כו' מ""ט אמר קרא (דברים כא, כב) ותלית אותו על עץ אותו ולא אותה האיש נמכר בגניבתו",Meiri on Sotah 23b:2,ארוסה ושומרת יבם לא שותות ולא נוטלות כתובה שנאמר אשר תשטה אשה תחת אישה פרט לארוסה ולשומרת יבם אלמנה לכהן גדול גרושה וחלוצה לכהן הדיוט
Sotah 24a:4-5,"כתובתן מעוברת חבירו ומניקת חבירו לא שותות ולא נוטלות כתובה דברי ר""מ וחכ""א יכול הוא להפרישה ולהחזירה לאחר זמן איילונית וזקינה ושאינה ראויה",Meiri on Sotah 24a:1,מעוברת חבירו ומיניקת חברו לא שותה ולא נוטלת כתובה דברי ר' מאיר וחכמים אומרים יכול הוא להפרישה ולהחזירה לאחר זמן אילונית וזקנה ושאינה ראויה
Sotah 24a:7-9,"שב""ד מקנין להן מי שנתחרש בעלה או נשתטה או שהיה חבוש בבית האסורין לא להשקותה אמרו אלא לפוסלה מכתובתה ר' יוסי אומר אף להשקותה לכשיצא",Meiri on Sotah 24a:11,קטנה אונס הוא ואף בתלמוד המערב שבפרק ראשון ראיתי קטנה שזינתה אין לה דינין ליאסר על בעלה: <b>משנה</b> אלו שבית דין מקנים להם מי שנתחרש
Sotah 24a:7-9,"שב""ד מקנין להן מי שנתחרש בעלה או נשתטה או שהיה חבוש בבית האסורין לא להשקותה אמרו אלא לפוסלה מכתובתה ר' יוסי אומר אף להשקותה לכשיצא",Meiri on Sotah 24a:12,קטנה אונס הוא ואף בתלמוד המערב שבפרק ראשון ראיתי קטנה שזינתה אין לה דינין ליאסר על בעלה: <b>משנה</b> אלו שבית דין מקנים להם מי שנתחרש
Sotah 27b:1-4,"הוא אם היה אילם לא היה משקה <br><br><big><strong>הדרן עלך ארוסה</strong></big><br><br> מתני׳ <big><strong>כשם</strong></big> שהמים בודקין אותה כך המים בודקין אותו שנאמר (במדבר ה, כב) ובאו ובאו כשם שאסורה לבעל כך אסורה לבועל שנאמר (במדבר ה, יג) נטמאה ונטמאה דברי ר'",Meiri on Sotah 27b:2,והוא שאמר כשם שהמים בודקין אותה כך הן בודקין אותו שנ' ובאו כשם שהיא אסורה לבעל כך היא אסורה לבועל שנאמר נטמאה נטמאה דברי ר' עקיבא אמר ר' יהושע כך היה דורש זכריה בן הקצב ר' אומר שני פעמים
Sotah 31a:12-16,"צפנת ליראיך וחד אמר ליה אקריון בחלמאי (תהלים ה, יב) וישמחו כל חוסי בך לעולם ירננו ויעלצו בך אוהבי שמך אמר להו תרוייכו רבנן צדיקי גמורי אתון מר מאהבה ומר מיראה <br><br><big><strong>הדרן עלך כשם שהמים</strong></big><br><br> מתני׳ <big><strong>מי</strong></big> שקינא לאשתו ונסתרה אפילו שמע מעוף הפורח יוציא ויתן כתובה דברי רבי אליעזר רבי יהושע אומר עד שישאו ויתנו בה מוזרות בלבנה אמר עד אחד אני ראיתיה שנטמאת לא היתה שותה ולא עוד אלא אפילו עבד אפילו שפחה הרי אלו נאמנין אף לפוסלה מכתובתה חמותה ובת חמותה וצרתה ויבמתה ובת בעלה הרי אלו נאמנות ולא לפוסלה מכתובתה",Meiri on Sotah 31a:1,"אפילו שמע מן העוף הפורח יוציא ויתן כתבה דברי ר' אליעזר ר' יהושע אומר משישאו ויתנו בה מוזרות בלבנה עד אחד אומר אני ראיתיה שנטמאת לא היתה שותה ולא עוד אלא אפי' עבד אפי' שפחה הרי אלו נאמנים אף לפוסלה מכתובתה חמותה ובת חמותה וצרתה ויבמתה ובת בעלה הרי אלו נאמנות לא לפסלה מכתבתה אלא שלא תשתה שהיה בדין מה אם עדות הראשונה שאינה אוסרתה אסור עולם אינה מתקיימת בפחות משנים עדות האחרונה שהיא אוסרתה איסור עולם אינו דין שלא תתקיים בפחות משנים ת""ל ועד אין בה כל שיש בה קל וחמר לעדות הראשונה"
Sotah 32a:4-8,"לשון פרשת סוטה ווידוי מעשר קרית שמע ותפלה וברכת המזון ושבועת העדות ושבועת הפיקדון ואלו נאמרין בלשון הקודש מקרא ביכורים וחליצה ברכות וקללות ברכת כהנים וברכת כהן גדול ופרשת המלך ופרשת עגלה ערופה ומשוח מלחמה בשעה שמדבר אל העם מקרא ביכורים כיצד (דברים כו, ה) וענית ואמרת לפני ה' אלהיך ולהלן הוא אומר (דברים כז, יד) וענו הלוים ואמרו מה להלן בלשון הקודש אף כאן בלשון הקודש חליצה כיצד (דברים כה, ט) וענתה ואמרה ולהלן הוא אומר וענו הלוים ואמרו מה להלן בלשון הקודש",Meiri on Sotah 32a:2,פרשת סוטה ווידוי מעשר וקרית שמע ותפלה וברכת המזון ושבועת העדות ושבועת הפקדון אלו נאמרין בלשון הקדש מקרא בכורים וחליצה ברכות וקללות ברכות כהנים וברכות כהן גדול פרשת המלך ופרשת עגלה ערופה ומשוח מלחמה בשעה שהוא מדבר אל העם מקרא בכורים כיצד וענית ואמרת לפני ה' אלהיך ארמי אובד אבי ולהלן הוא אומר וענו הלויים מה ענייה אמורה להלן בלשון הקדש אף כאן בלשון הקדש חליצה כיצד וענתה ואמרה ככה יעשה לאיש ולהלן הוא אומר וענו הלוים ואמרו מה ענייה אמורה להלן בלשון הקדש אף כאן בלשון הקדש ר' יודה אומר וענתה ואמרה ככה
Sotah 32a:8-10,וקללות כיצד כיון שעברו ישראל את הירדן ובאו אל הר גריזים ואל הר עיבל שבשומרון שבצד שכם,Meiri on Sotah 32a:16,מלחמה קודם בתורה לענין עגלה ערופה: <b>משנה</b> ברכות וקללות כיצד כיון שעברו ישראל את הירדן באו להר
Sotah 32a:8-10,וקללות כיצד כיון שעברו ישראל את הירדן ובאו אל הר גריזים ואל הר עיבל שבשומרון שבצד שכם,Meiri on Sotah 32a:17,מלחמה קודם בתורה לענין עגלה ערופה: <b>משנה</b> ברכות וקללות כיצד כיון שעברו ישראל את הירדן באו להר
Sotah 32a:10,"הלא המה בעבר הירדן וגו' ולהלן הוא אומר (בראשית יב, ו) ויעבר אברם בארץ עד מקום שכם עד אלון מורה מה אלון מורה האמור להלן שכם אף אלון מורה האמור כאן שכם ששה שבטים עלו ראש הר גריזים וששה שבטים עלו לראש הר עיבל",Meiri on Sotah 32a:17,ולהר עיבל שבשומרון שבצד שכם שאצל אלוני מורה שנ' הלא המה בעבר הירדן ולהלן הוא אומר ויעבר אברם בארץ מה אלון מורה האמור שכם אף אלון מורה האמור כאן שכם ששה שבטים עלו על הר גריזים וששה שבטים עלו על ראש הר עיבל הכהנים
Sotah 32a:11-12,"ושופטיו עומדים מזה ומזה לארון וגו' הפכו פניהם כלפי הר גריזים ופתחו בברכה ברוך האיש אשר לא יעשה פסל ומסכה ואלו ואלו עונין אמן הפכו פניהם כלפי הר עיבל ופתחו בקללה (דברים כז, טו) ארור האיש אשר יעשה פסל ומסכה ואלו ואלו עונין אמן עד",Meiri on Sotah 32a:17,והארון עומדים למטה באמצע הכהנים מקיפים את הארון והלויים את הכהנים וכל ישראל מכאן ומכאן שנ' וכל ישראל וזקניו וגו' הפכו פניהם כלפי הר גריזים ופתחו בברכה ברוך האיש אשר לא יעשה פסל ומסכה וגו' ולא שם בסתר והיו אלו ואלו עונין ואומרין אמן עד שגומרין ברכות וקללות ואחר כך הביאו את
Sotah 32a:9-10,"הר עיבל שבשומרון שבצד שכם שבאצל אלוני מורה שנאמר (דברים יא, ל) הלא המה בעבר הירדן וגו' ולהלן הוא אומר (בראשית יב, ו) ויעבר אברם בארץ",Meiri on Sotah 32a:18,הר גריזים ואת הקללה על הר עיבל הלא המה בעבר הירדן אחרי דרך מבוא השמש בארץ הכנעני היושב בערבה מול הגלגל אצל אילוני מורה
Sotah 32a:11,בני ישראל וזקניו ושוטריו ושופטיו עומדים מזה ומזה לארון וגו' הפכו פניהם כלפי הר גריזים ופתחו בברכה ברוך האיש אשר,Meiri on Sotah 32a:18,יפה והלוים הפכו פניהם כלפי הר גריזים ופתחו בברכה ברוך האיש אשר לא יעשה פסל וכו' שכל ארור ארור
Sotah 39b:8-9,"אמר עד שיצא ולא פליגי הא דאיכא פיתחא אחרינא הא דליכא פיתחא אחרינא אמר רבא בר אהינא אסברה לי (דברים יג, ה) אחרי ה' אלהיכם תלכו בזמן שהכהנים מברכים את העם מה",Meiri on Sotah 39b:2,ברכו את ה' כל צבאיו משרתיו עושי רצונו ברכו ה' כל מעשיו בכל מקומות ממשלתו ברכי נפשי את ה' ובמוסף אומר שיר המעלות הנה ברכו את ה'
Sotah 40a:7,וזקיף עליה יקרא בעלמא הוא דעביד ליה אזלא דביתהו ואמרה ליה לרבי אבהו אמר לה ומאי נפקא ליך מינה מיני ומיניה יתקלס עילאה ותו רבי אבהו אימנו רבנן עליה לממנייה ברישא כיון דחזיה לר' אבא דמן עכו דנפישי ליה,Meiri on Sotah 40a:11,ליתן לראש ישיבה מנות ולהעשירו להיות דבריו נשמעים וכמו שאמרו והכהן הגדול מאחיו גדלהו משל אחיו: <b>וכן</b> סופר עוד עליו דבר זה נסחו ר' אבהו ור' חייא בר אבא איקלעו לההוא אתרא ר' אבהו דרש באגדתא ר' חייא דרש בשמעתא שבקוה כולי עלמא לר' חייא
