Ref,,Text,,edit footnote,Footnotes
Deuteronomy 16 16,,males,male-folk,,"[At] three points in the year<br> are all your male-folk to be seen<br> at the presence of <small>YHWH</small> your God<br> in the place that he chooses:<br> on the Festival of <i>Matzot,</i><br> on the Festival of Weeks,<br> and on the Festival of Huts,<br> and no one is to be seen at the presence of <small>YHWH</small> empty-handed;"
Deuteronomy 20 9,,count by head,by head,,"And it shall be,<br> when the officials finish speaking to the people,<br> the commanders of the armed-forces are to count the fighting-people by head."
Deuteronomy 23 7,,well-being,peace,,"You are not to seek their peace or their good, all your days, for the ages!"
Deuteronomy 25 18,,beaten-down-ones,beaten-down ones,,"how he encountered you on the way<br> and attacked-your-tail—all the beaten-down ones at your rear—<br> while you [were] weary and faint,<br> and [thus] he did not stand-in-awe of God."
Deuteronomy 26 18,,to be-careful,to be careful,,"And <small>YHWH</small> has declared you today, to be for him a specially-treasured people,<br> as he promised you,<br> to be careful [regarding] all his commandments,"
Deuteronomy 27 24,,strikes down,striking down,,Cursed be<br> one striking down his neighbor in secret!<br> And all the people are to say: Amen!
Deuteronomy 28 63,,in doing-good,by doing good,,"And it shall be:<br> as <small>YHWH</small> once delighted in you<br> by doing good for you and by making-you-many,<br> thus will <small>YHWH</small> delight in you<br> by causing you to perish and by wiping you out,<br> and you shall be pulled up<sup>•</sup><i class='footnote'><b>pulled up:</b> An idiom for “deport,” as in Akkadian (Weinfeld 1972a).</i> from the land that you are entering to possess."
Deuteronomy 29 16,,idol-clods,Illicit Things,,"you saw their Detestable Things and their Illicit Things,<br> of wood and stone, of silver and of gold, that were with them—"
Deuteronomy 32 26,,in pieces,in-pieces,,"I would have said: I will cleave-them-in-pieces,<br> I will make their memory cease from mortals,"
Deuteronomy 32 31,Deuteronomy 32 32,Amora,,,"For not like their rock is our Rock,<br> though our enemies<sup>•</sup><i class='footnote'><b>though our enemies</b> …: Heb. difficult.</i> [so] assess it;<br> indeed, from the vine of Sedom is their vine,"